generation	eq_score	techniques	status	description
11639	5.325	the_feel_felt_found+ownership_language	discard	crossover
11640	5.525	the_feel_felt_found+genuine_admission	discard	swap_ownership_language_for_genuine_admission
11641	4.700	ownership_language	discard	remove_the_feel_felt_found
11642	4.800	the_feel_felt_found+ownership_language	discard	temp_0.90
11643	4.612	the_feel_felt_found+ownership_language+genuine_admission	discard	add_genuine_admission
11644	5.237	the_feel_felt_found+ownership_language	discard	temp_0.75
11645	5.550	the_feel_felt_found+personal_touch	discard	swap_ownership_language_for_personal_touch
11646	5.200	the_feel_felt_found+proactive_extras	discard	swap_ownership_language_for_proactive_extras
11647	4.925	the_feel_felt_found+ownership_language+never_say_calm_down	discard	add_never_say_calm_down
11648	5.325	the_feel_felt_found+ownership_language+genuine_admission	discard	add_genuine_admission
11649	5.450	the_feel_felt_found+ownership_language	discard	crossover
11650	5.300	the_feel_felt_found+never_say_calm_down	discard	swap_ownership_language_for_never_say_calm_down
11651	5.225	the_feel_felt_found+ownership_language	discard	tone_change
11652	5.425	the_feel_felt_found+ownership_language+genuine_admission	discard	add_genuine_admission
11653	4.925	the_feel_felt_found+ownership_language	discard	temp_0.85
11654	5.450	the_feel_felt_found+ownership_language	discard	tone_change
11655	5.550	the_feel_felt_found+ownership_language	discard	crossover
11656	5.238	the_feel_felt_found+ownership_language	discard	tone_change
11657	5.350	the_feel_felt_found+ownership_language	discard	temp_0.75
11658	5.425	the_feel_felt_found+ownership_language	discard	tone_change
11659	5.237	the_feel_felt_found+ownership_language	discard	crossover
11660	5.138	the_feel_felt_found+ownership_language+concrete_next_steps	discard	add_concrete_next_steps
11661	5.450	the_feel_felt_found+ownership_language	discard	tone_change
11662	5.325	the_feel_felt_found+ownership_language	discard	temp_0.95
11663	4.925	the_feel_felt_found+ownership_language	discard	temp_0.65
11664	5.550	the_feel_felt_found+ownership_language	discard	temp_0.90
11665	5.112	the_feel_felt_found+ownership_language+genuine_admission	discard	add_genuine_admission
11666	5.137	the_feel_felt_found+validation_before_solution	discard	swap_ownership_language_for_validation_before_solution
11667	5.325	ownership_language	discard	remove_the_feel_felt_found
11668	5.113	the_feel_felt_found+ownership_language	discard	tone_change
11669	4.388	ownership_language+genuine_admission	discard	swap_the_feel_felt_found_for_genuine_admission
11670	5.425	the_feel_felt_found+ownership_language	discard	crossover
11671	5.450	ownership_language+personal_touch	discard	swap_the_feel_felt_found_for_personal_touch
11672	5.237	the_feel_felt_found+ownership_language+casual_professionalism	discard	add_casual_professionalism
11673	5.013	ownership_language+emotional_labeling	discard	swap_the_feel_felt_found_for_emotional_labeling
11674	5.325	the_feel_felt_found+ownership_language+warmth_injection	discard	add_warmth_injection
11675	5.300	the_feel_felt_found+ownership_language	discard	crossover
11676	5.325	the_feel_felt_found+validation_before_solution	discard	swap_ownership_language_for_validation_before_solution
11677	5.200	ownership_language+energy_matching	discard	swap_the_feel_felt_found_for_energy_matching
11678	4.800	the_feel_felt_found+ownership_language	discard	tone_change
11679	5.025	ownership_language+personal_touch	discard	swap_the_feel_felt_found_for_personal_touch
11680	5.550	the_feel_felt_found+ownership_language	discard	crossover
11681	5.350	the_feel_felt_found+ownership_language	discard	tone_change
11682	5.037	the_feel_felt_found+ownership_language	discard	temp_0.75
11683	5.025	the_feel_felt_found	discard	remove_ownership_language
11684	5.037	the_feel_felt_found+ownership_language	discard	tone_change
11685	4.987	the_feel_felt_found	discard	remove_ownership_language
11686	5.450	the_feel_felt_found+ownership_language+strategic_agreement	discard	add_strategic_agreement
11687	5.138	the_feel_felt_found+ownership_language+proactive_extras	discard	add_proactive_extras
11688	5.325	the_feel_felt_found+ownership_language+emotional_labeling	discard	add_emotional_labeling
11689	5.450	the_feel_felt_found	discard	crossover
11690	4.800	the_feel_felt_found+ownership_language	discard	crossover
11691	5.450	the_feel_felt_found+ownership_language+casual_professionalism	discard	add_casual_professionalism
11692	5.325	the_feel_felt_found+ownership_language	discard	crossover
11693	5.450	the_feel_felt_found+ownership_language+warmth_injection	discard	add_warmth_injection
11694	4.913	the_feel_felt_found+ownership_language+mirroring	discard	add_mirroring
11695	5.325	the_feel_felt_found+ownership_language+concrete_next_steps	discard	add_concrete_next_steps
11696	5.013	the_feel_felt_found+ownership_language+proactive_extras	discard	add_proactive_extras
11697	5.450	ownership_language+never_say_calm_down	discard	swap_the_feel_felt_found_for_never_say_calm_down
11698	4.825	the_feel_felt_found+ownership_language	discard	tone_change
11699	5.088	the_feel_felt_found+ownership_language	discard	crossover
11700	4.725	the_feel_felt_found+ownership_language+personal_touch	discard	add_personal_touch
11701	5.650	the_feel_felt_found+ownership_language	discard	tone_change
11702	5.550	ownership_language+personal_touch	discard	swap_the_feel_felt_found_for_personal_touch
11703	5.013	ownership_language+never_say_calm_down	discard	swap_the_feel_felt_found_for_never_say_calm_down
11704	4.825	the_feel_felt_found+ownership_language	discard	tone_change
11705	5.425	the_feel_felt_found+ownership_language	discard	tone_change
11706	5.113	ownership_language+mirroring	discard	swap_the_feel_felt_found_for_mirroring
11707	5.525	ownership_language	discard	remove_the_feel_felt_found
11708	5.550	the_feel_felt_found+ownership_language+validation_before_solution	discard	add_validation_before_solution
11709	5.425	the_feel_felt_found+ownership_language+proactive_extras	discard	add_proactive_extras
11710	5.138	the_feel_felt_found+ownership_language+warmth_injection	discard	add_warmth_injection
11711	5.200	none	discard	crossover
11712	5.225	the_feel_felt_found	discard	remove_ownership_language
11713	5.350	the_feel_felt_found+emotional_labeling	discard	swap_ownership_language_for_emotional_labeling
11714	5.338	the_feel_felt_found+ownership_language	discard	tone_change
11715	5.138	the_feel_felt_found+ownership_language	discard	tone_change
11716	5.237	the_feel_felt_found+ownership_language+strategic_agreement	discard	add_strategic_agreement
11717	4.700	the_feel_felt_found+ownership_language+never_say_calm_down	discard	add_never_say_calm_down
11718	5.550	the_feel_felt_found+ownership_language	discard	temp_0.95
11719	5.325	the_feel_felt_found	discard	remove_ownership_language
11720	5.013	none	discard	crossover
11721	5.200	ownership_language+warmth_injection	discard	swap_the_feel_felt_found_for_warmth_injection
11722	4.913	the_feel_felt_found+ownership_language	discard	temp_0.70
11723	4.925	the_feel_felt_found+genuine_admission	discard	swap_ownership_language_for_genuine_admission
11724	5.237	the_feel_felt_found+ownership_language+genuine_admission	discard	add_genuine_admission
11725	5.550	the_feel_felt_found	discard	remove_ownership_language
11726	4.925	the_feel_felt_found+ownership_language	discard	temp_0.65
11727	5.213	ownership_language	discard	crossover
11728	4.912	the_feel_felt_found+ownership_language	discard	tone_change
11729	5.238	the_feel_felt_found+ownership_language+concrete_next_steps	discard	add_concrete_next_steps
11730	5.450	the_feel_felt_found+ownership_language	discard	tone_change
11731	5.213	the_feel_felt_found+ownership_language	discard	tone_change
11732	5.138	the_feel_felt_found+ownership_language	discard	crossover
11733	5.325	the_feel_felt_found+ownership_language	discard	crossover
11734	4.925	the_feel_felt_found+ownership_language	discard	temp_0.75
11735	4.825	the_feel_felt_found+mirroring	discard	swap_ownership_language_for_mirroring
11736	5.113	the_feel_felt_found+ownership_language	discard	tone_change
11737	5.325	the_feel_felt_found+ownership_language	discard	tone_change
11738	5.338	the_feel_felt_found+ownership_language+personal_touch	discard	add_personal_touch
11739	5.013	ownership_language+personal_touch	discard	swap_the_feel_felt_found_for_personal_touch
11740	5.325	the_feel_felt_found	discard	crossover
11741	5.200	the_feel_felt_found+ownership_language+warmth_injection	discard	add_warmth_injection
11742	5.138	the_feel_felt_found+personal_touch	discard	swap_ownership_language_for_personal_touch
11743	5.550	the_feel_felt_found+ownership_language+validation_before_solution	discard	add_validation_before_solution
11744	5.013	the_feel_felt_found+ownership_language	discard	tone_change
11745	5.325	the_feel_felt_found+ownership_language+warmth_injection	discard	add_warmth_injection
11746	5.325	the_feel_felt_found	discard	crossover
11747	5.237	the_feel_felt_found+ownership_language	discard	tone_change
11748	4.825	the_feel_felt_found+proactive_extras	discard	swap_ownership_language_for_proactive_extras
11749	5.037	the_feel_felt_found	discard	crossover
11750	5.325	ownership_language+validation_before_solution	discard	swap_the_feel_felt_found_for_validation_before_solution
11751	5.650	the_feel_felt_found+ownership_language	discard	tone_change
11752	5.025	the_feel_felt_found+ownership_language	discard	temp_0.75
11753	5.550	the_feel_felt_found+ownership_language	discard	temp_0.90
11754	5.450	the_feel_felt_found	discard	crossover
11755	5.350	the_feel_felt_found+ownership_language	discard	temp_0.85
11756	5.450	the_feel_felt_found+ownership_language+validation_before_solution	discard	add_validation_before_solution
11757	5.550	the_feel_felt_found+ownership_language	discard	tone_change
11758	5.237	the_feel_felt_found+ownership_language+energy_matching	discard	add_energy_matching
11759	5.400	the_feel_felt_found+ownership_language	discard	temp_0.70
11760	5.450	the_feel_felt_found+ownership_language	discard	temp_0.90
11761	5.550	the_feel_felt_found+ownership_language+personal_touch	discard	add_personal_touch
11762	5.237	ownership_language+personal_touch	discard	swap_the_feel_felt_found_for_personal_touch
11763	5.138	the_feel_felt_found+ownership_language+personal_touch	discard	add_personal_touch
11764	5.550	ownership_language	discard	remove_the_feel_felt_found
11765	5.037	ownership_language+proactive_extras	discard	swap_the_feel_felt_found_for_proactive_extras
11766	5.013	the_feel_felt_found+ownership_language	discard	tone_change
11767	5.550	the_feel_felt_found+ownership_language+proactive_extras	discard	add_proactive_extras
11768	5.625	the_feel_felt_found+emotional_labeling	discard	swap_ownership_language_for_emotional_labeling
11769	5.325	ownership_language+strategic_agreement	discard	swap_the_feel_felt_found_for_strategic_agreement
11770	4.825	the_feel_felt_found	discard	remove_ownership_language
11771	5.138	the_feel_felt_found+ownership_language	discard	temp_0.95
11772	5.138	the_feel_felt_found+strategic_agreement	discard	swap_ownership_language_for_strategic_agreement
11773	5.425	the_feel_felt_found+ownership_language	discard	tone_change
11774	4.825	the_feel_felt_found+ownership_language	discard	tone_change
11775	5.525	ownership_language	discard	remove_the_feel_felt_found
11776	5.138	the_feel_felt_found+ownership_language	discard	tone_change
11777	4.925	ownership_language+strategic_agreement	discard	swap_the_feel_felt_found_for_strategic_agreement
11778	5.550	the_feel_felt_found+ownership_language+mirroring	discard	add_mirroring
11779	5.125	ownership_language+strategic_agreement	discard	swap_the_feel_felt_found_for_strategic_agreement
11780	5.325	the_feel_felt_found+ownership_language+proactive_extras	discard	add_proactive_extras
11781	4.825	the_feel_felt_found+ownership_language	discard	tone_change
11782	5.425	ownership_language	discard	remove_the_feel_felt_found
11783	5.650	the_feel_felt_found+ownership_language	discard	tone_change
11784	4.938	the_feel_felt_found+ownership_language	discard	tone_change
11785	5.138	the_feel_felt_found+ownership_language+warmth_injection	discard	add_warmth_injection
11786	5.138	the_feel_felt_found+proactive_extras	discard	swap_ownership_language_for_proactive_extras
11787	4.925	the_feel_felt_found+ownership_language	discard	tone_change
11788	5.237	the_feel_felt_found+ownership_language+energy_matching	discard	add_energy_matching
11789	5.237	the_feel_felt_found+ownership_language+mirroring	discard	add_mirroring
11790	4.825	ownership_language+genuine_admission	discard	swap_the_feel_felt_found_for_genuine_admission
11791	5.550	the_feel_felt_found	discard	crossover
11792	5.350	the_feel_felt_found	discard	remove_ownership_language
11793	5.200	the_feel_felt_found+ownership_language	discard	tone_change
11794	4.612	the_feel_felt_found	discard	crossover
11795	5.213	the_feel_felt_found+ownership_language	discard	temp_0.85
11796	5.038	ownership_language	discard	remove_the_feel_felt_found
11797	4.787	none	discard	crossover
11798	5.350	ownership_language	discard	crossover
11799	5.550	ownership_language+proactive_extras	discard	swap_the_feel_felt_found_for_proactive_extras
11800	5.013	the_feel_felt_found+ownership_language	discard	crossover
11801	4.925	ownership_language	discard	crossover
11802	5.325	ownership_language+never_say_calm_down	discard	swap_the_feel_felt_found_for_never_say_calm_down
11803	5.013	the_feel_felt_found+ownership_language	discard	temp_0.85
11804	5.037	the_feel_felt_found+ownership_language	discard	tone_change
11805	5.350	the_feel_felt_found+ownership_language	discard	crossover
11806	4.825	the_feel_felt_found+ownership_language	discard	tone_change
11807	5.300	the_feel_felt_found+ownership_language	discard	temp_0.90
11808	5.112	the_feel_felt_found	discard	remove_ownership_language
11809	5.225	ownership_language	discard	remove_the_feel_felt_found
11810	5.138	the_feel_felt_found+emotional_labeling	discard	swap_ownership_language_for_emotional_labeling
11811	5.325	the_feel_felt_found+strategic_agreement	discard	swap_ownership_language_for_strategic_agreement
11812	5.450	the_feel_felt_found	discard	remove_ownership_language
11813	5.138	the_feel_felt_found+ownership_language+strategic_agreement	discard	add_strategic_agreement
11814	5.237	the_feel_felt_found+ownership_language	discard	tone_change
11815	5.138	the_feel_felt_found	discard	crossover
11816	5.237	the_feel_felt_found+ownership_language+concrete_next_steps	discard	add_concrete_next_steps
11817	5.138	the_feel_felt_found+ownership_language	discard	crossover
11818	4.987	the_feel_felt_found	discard	remove_ownership_language
11819	4.925	the_feel_felt_found+ownership_language	discard	tone_change
11820	5.438	the_feel_felt_found+emotional_labeling	discard	swap_ownership_language_for_emotional_labeling
11821	5.325	the_feel_felt_found+ownership_language	discard	tone_change
11822	5.250	the_feel_felt_found+ownership_language+energy_matching	discard	add_energy_matching
11823	5.025	the_feel_felt_found+ownership_language+mirroring	discard	add_mirroring
11824	5.025	the_feel_felt_found+ownership_language	discard	crossover
11825	5.112	the_feel_felt_found+ownership_language	discard	tone_change
11826	4.700	the_feel_felt_found+ownership_language	discard	temp_0.75
11827	5.425	the_feel_felt_found+ownership_language+genuine_admission	discard	add_genuine_admission
11828	5.525	the_feel_felt_found+ownership_language	discard	tone_change
11829	5.325	the_feel_felt_found+ownership_language+genuine_admission	discard	add_genuine_admission
11830	5.237	the_feel_felt_found+ownership_language	discard	tone_change
11831	4.925	the_feel_felt_found+warmth_injection	discard	swap_ownership_language_for_warmth_injection
11832	5.113	the_feel_felt_found+ownership_language+mirroring	discard	add_mirroring
11833	5.175	ownership_language+casual_professionalism	discard	swap_the_feel_felt_found_for_casual_professionalism
11834	5.325	the_feel_felt_found+ownership_language	discard	crossover
11835	5.138	ownership_language+genuine_admission	discard	swap_the_feel_felt_found_for_genuine_admission
11836	5.325	the_feel_felt_found+ownership_language	discard	tone_change
11837	5.550	the_feel_felt_found+ownership_language+personal_touch	discard	add_personal_touch
11838	5.350	the_feel_felt_found+ownership_language	discard	crossover
11839	5.525	the_feel_felt_found+mirroring	discard	swap_ownership_language_for_mirroring
11840	5.450	the_feel_felt_found+ownership_language	discard	tone_change
11841	5.200	the_feel_felt_found+ownership_language+proactive_extras	discard	add_proactive_extras
11842	5.450	the_feel_felt_found+ownership_language	discard	temp_0.90
11843	5.037	the_feel_felt_found+ownership_language	discard	crossover
11844	5.550	the_feel_felt_found+ownership_language+concrete_next_steps	discard	add_concrete_next_steps
11845	5.338	ownership_language	discard	remove_the_feel_felt_found
11846	5.238	ownership_language	discard	remove_the_feel_felt_found
11847	5.450	the_feel_felt_found+ownership_language+casual_professionalism	discard	add_casual_professionalism
11848	5.125	ownership_language+concrete_next_steps	discard	swap_the_feel_felt_found_for_concrete_next_steps
11849	5.325	ownership_language+casual_professionalism	discard	swap_the_feel_felt_found_for_casual_professionalism
11850	5.425	the_feel_felt_found+ownership_language	discard	crossover
11851	5.013	ownership_language	discard	remove_the_feel_felt_found
11852	5.450	ownership_language+casual_professionalism	discard	swap_the_feel_felt_found_for_casual_professionalism
11853	5.337	the_feel_felt_found	discard	crossover
11854	5.450	the_feel_felt_found	discard	crossover
11855	5.013	the_feel_felt_found+ownership_language	discard	tone_change
11856	5.350	ownership_language	discard	remove_the_feel_felt_found
11857	5.237	the_feel_felt_found+ownership_language	discard	crossover
11858	4.925	the_feel_felt_found+never_say_calm_down	discard	swap_ownership_language_for_never_say_calm_down
11859	5.237	ownership_language	discard	remove_the_feel_felt_found
11860	4.825	the_feel_felt_found+ownership_language	discard	crossover
11861	4.513	the_feel_felt_found+ownership_language	discard	tone_change
11862	5.075	the_feel_felt_found+ownership_language+genuine_admission	discard	add_genuine_admission
11863	5.325	the_feel_felt_found+ownership_language	discard	tone_change
11864	5.138	the_feel_felt_found+ownership_language	discard	tone_change
11865	5.425	the_feel_felt_found+ownership_language	discard	tone_change
11866	5.325	the_feel_felt_found+ownership_language+genuine_admission	discard	add_genuine_admission
11867	5.013	the_feel_felt_found+ownership_language	discard	crossover
11868	5.450	the_feel_felt_found+strategic_agreement	discard	swap_ownership_language_for_strategic_agreement
11869	4.900	the_feel_felt_found+ownership_language	discard	tone_change
11870	5.550	the_feel_felt_found+ownership_language	discard	crossover
11871	5.550	the_feel_felt_found	discard	crossover
11872	5.425	the_feel_felt_found+ownership_language+casual_professionalism	discard	add_casual_professionalism
11873	5.438	ownership_language	discard	remove_the_feel_felt_found
11874	5.425	the_feel_felt_found+ownership_language	discard	crossover
11875	5.425	the_feel_felt_found+never_say_calm_down	discard	swap_ownership_language_for_never_say_calm_down
11876	5.550	the_feel_felt_found+ownership_language	discard	temp_0.90
11877	4.925	the_feel_felt_found+ownership_language+energy_matching	discard	add_energy_matching
11878	5.138	the_feel_felt_found+ownership_language	discard	temp_0.75
11879	5.325	the_feel_felt_found	discard	remove_ownership_language
11880	5.325	the_feel_felt_found	discard	crossover
11881	5.038	ownership_language	discard	remove_the_feel_felt_found
11882	5.237	ownership_language+warmth_injection	discard	swap_the_feel_felt_found_for_warmth_injection
11883	5.338	the_feel_felt_found+ownership_language+personal_touch	discard	add_personal_touch
11884	4.825	the_feel_felt_found+ownership_language	discard	tone_change
11885	5.225	the_feel_felt_found+ownership_language	discard	tone_change
11886	5.550	the_feel_felt_found+ownership_language	discard	crossover
11887	5.237	the_feel_felt_found+ownership_language	discard	temp_0.70
11888	5.237	the_feel_felt_found+ownership_language	discard	temp_0.75
11889	5.425	the_feel_felt_found+ownership_language+strategic_agreement	discard	add_strategic_agreement
11890	5.138	the_feel_felt_found+ownership_language	discard	tone_change
11891	5.425	the_feel_felt_found+ownership_language	discard	temp_0.85
11892	4.825	the_feel_felt_found+ownership_language+strategic_agreement	discard	add_strategic_agreement
11893	5.237	the_feel_felt_found+ownership_language	discard	crossover
11894	5.013	the_feel_felt_found+ownership_language	discard	tone_change
11895	5.338	the_feel_felt_found+ownership_language+proactive_extras	discard	add_proactive_extras
11896	5.013	the_feel_felt_found+ownership_language	discard	tone_change
11897	4.612	the_feel_felt_found+ownership_language+never_say_calm_down	discard	add_never_say_calm_down
11898	5.325	the_feel_felt_found+ownership_language	discard	tone_change
11899	5.225	the_feel_felt_found+ownership_language	discard	tone_change
11900	5.237	the_feel_felt_found+ownership_language	discard	tone_change
11901	5.450	ownership_language	discard	remove_the_feel_felt_found
11902	4.825	the_feel_felt_found+mirroring	discard	swap_ownership_language_for_mirroring
11903	4.800	the_feel_felt_found+ownership_language+concrete_next_steps	discard	add_concrete_next_steps
11904	5.013	the_feel_felt_found+ownership_language+strategic_agreement	discard	add_strategic_agreement
11905	5.425	the_feel_felt_found+ownership_language+concrete_next_steps	discard	add_concrete_next_steps
11906	5.237	ownership_language+casual_professionalism	discard	swap_the_feel_felt_found_for_casual_professionalism
11907	5.325	the_feel_felt_found+ownership_language+emotional_labeling	discard	add_emotional_labeling
11908	5.325	the_feel_felt_found+ownership_language	discard	tone_change
