generation	eq_score	techniques	status	description
18500	5.450	the_feel_felt_found	discard	remove_ownership_language
18501	5.112	the_feel_felt_found+ownership_language	discard	tone_change
18502	5.550	the_feel_felt_found+ownership_language+casual_professionalism	discard	add_casual_professionalism
18503	5.325	the_feel_felt_found+ownership_language+concrete_next_steps	discard	add_concrete_next_steps
18504	5.037	the_feel_felt_found+ownership_language+energy_matching	discard	add_energy_matching
18505	5.237	the_feel_felt_found+ownership_language+genuine_admission	discard	add_genuine_admission
18506	5.425	the_feel_felt_found+ownership_language	discard	tone_change
18507	5.525	ownership_language	discard	crossover
18508	4.800	the_feel_felt_found+ownership_language+strategic_agreement	discard	add_strategic_agreement
18509	5.450	the_feel_felt_found+ownership_language	discard	temp_0.70
18510	5.325	the_feel_felt_found+ownership_language	discard	tone_change
18511	5.550	the_feel_felt_found+ownership_language	discard	temp_0.70
18512	5.650	the_feel_felt_found	discard	crossover
18513	5.550	the_feel_felt_found	discard	remove_ownership_language
18514	5.112	the_feel_felt_found+ownership_language	discard	tone_change
18515	5.450	the_feel_felt_found+ownership_language+personal_touch	discard	add_personal_touch
18516	5.200	the_feel_felt_found+ownership_language	discard	tone_change
18517	5.550	ownership_language+concrete_next_steps	discard	swap_the_feel_felt_found_for_concrete_next_steps
18518	5.425	the_feel_felt_found+ownership_language	discard	tone_change
18519	5.525	the_feel_felt_found+ownership_language	discard	tone_change
18520	5.138	the_feel_felt_found	discard	crossover
18521	5.325	the_feel_felt_found	discard	crossover
18522	5.237	the_feel_felt_found+ownership_language	discard	temp_0.85
18523	4.825	the_feel_felt_found+ownership_language	discard	tone_change
18524	5.425	the_feel_felt_found+ownership_language+proactive_extras	discard	add_proactive_extras
18525	5.525	the_feel_felt_found	discard	remove_ownership_language
18526	5.138	ownership_language	discard	crossover
18527	5.037	the_feel_felt_found+never_say_calm_down	discard	swap_ownership_language_for_never_say_calm_down
18528	4.888	the_feel_felt_found	discard	remove_ownership_language
18529	4.825	ownership_language+genuine_admission	discard	swap_the_feel_felt_found_for_genuine_admission
18530	5.425	the_feel_felt_found+strategic_agreement	discard	swap_ownership_language_for_strategic_agreement
18531	5.450	the_feel_felt_found+ownership_language	discard	crossover
18532	5.013	the_feel_felt_found+ownership_language+personal_touch	discard	add_personal_touch
18533	5.425	ownership_language+genuine_admission	discard	swap_the_feel_felt_found_for_genuine_admission
18534	5.338	ownership_language+genuine_admission	discard	swap_the_feel_felt_found_for_genuine_admission
18535	5.450	the_feel_felt_found+ownership_language	discard	tone_change
18536	5.525	the_feel_felt_found+ownership_language	discard	temp_0.70
18537	5.238	the_feel_felt_found+ownership_language+personal_touch	discard	add_personal_touch
18538	5.138	the_feel_felt_found+ownership_language	discard	tone_change
18539	5.450	the_feel_felt_found+ownership_language	discard	tone_change
18540	4.700	ownership_language+casual_professionalism	discard	swap_the_feel_felt_found_for_casual_professionalism
18541	4.825	the_feel_felt_found+proactive_extras	discard	swap_ownership_language_for_proactive_extras
18542	5.450	the_feel_felt_found+ownership_language+energy_matching	discard	add_energy_matching
18543	5.550	the_feel_felt_found	discard	crossover
18544	5.625	the_feel_felt_found+ownership_language	discard	tone_change
18545	5.550	the_feel_felt_found+ownership_language	discard	temp_0.75
18546	4.800	the_feel_felt_found+ownership_language+personal_touch	discard	add_personal_touch
18547	5.237	the_feel_felt_found+ownership_language+personal_touch	discard	add_personal_touch
18548	4.925	the_feel_felt_found	discard	crossover
18549	5.425	the_feel_felt_found+ownership_language	discard	crossover
18550	5.138	the_feel_felt_found+ownership_language+casual_professionalism	discard	add_casual_professionalism
18551	5.338	ownership_language	discard	crossover
18552	4.825	the_feel_felt_found+ownership_language	discard	crossover
18553	5.650	the_feel_felt_found+ownership_language+genuine_admission	discard	add_genuine_admission
18554	4.675	ownership_language	discard	remove_the_feel_felt_found
18555	5.325	the_feel_felt_found+ownership_language	discard	crossover
18556	5.113	the_feel_felt_found+ownership_language+concrete_next_steps	discard	add_concrete_next_steps
18557	5.325	the_feel_felt_found+ownership_language	discard	tone_change
18558	5.350	the_feel_felt_found	discard	crossover
18559	5.350	the_feel_felt_found+never_say_calm_down	discard	swap_ownership_language_for_never_say_calm_down
18560	5.350	the_feel_felt_found+ownership_language	discard	crossover
18561	5.300	ownership_language+personal_touch	discard	swap_the_feel_felt_found_for_personal_touch
18562	5.325	ownership_language	discard	crossover
18563	5.325	the_feel_felt_found+ownership_language	discard	tone_change
18564	5.450	the_feel_felt_found+ownership_language+warmth_injection	discard	add_warmth_injection
18565	5.237	ownership_language+casual_professionalism	discard	swap_the_feel_felt_found_for_casual_professionalism
18566	5.113	ownership_language	discard	crossover
18567	5.525	the_feel_felt_found+ownership_language	discard	temp_0.90
18568	5.450	the_feel_felt_found	discard	crossover
18569	5.138	the_feel_felt_found+ownership_language+validation_before_solution	discard	add_validation_before_solution
18570	5.450	the_feel_felt_found+ownership_language	discard	tone_change
18571	5.237	the_feel_felt_found+ownership_language	discard	tone_change
18572	5.450	the_feel_felt_found+ownership_language	discard	crossover
18573	5.013	the_feel_felt_found+ownership_language+concrete_next_steps	discard	add_concrete_next_steps
18574	5.238	ownership_language+concrete_next_steps	discard	swap_the_feel_felt_found_for_concrete_next_steps
18575	4.800	ownership_language	discard	remove_the_feel_felt_found
18576	5.013	ownership_language+genuine_admission	discard	swap_the_feel_felt_found_for_genuine_admission
18577	5.325	the_feel_felt_found	discard	crossover
18578	5.325	the_feel_felt_found+ownership_language+warmth_injection	discard	add_warmth_injection
18579	5.138	the_feel_felt_found+ownership_language	discard	tone_change
18580	5.325	the_feel_felt_found+ownership_language+energy_matching	discard	add_energy_matching
18581	5.425	the_feel_felt_found+ownership_language	discard	temp_0.95
18582	5.225	the_feel_felt_found+ownership_language+never_say_calm_down	discard	add_never_say_calm_down
18583	5.238	the_feel_felt_found+ownership_language	discard	temp_0.70
18584	5.450	the_feel_felt_found+ownership_language	discard	tone_change
18585	4.700	the_feel_felt_found+ownership_language	discard	temp_0.75
18586	4.987	the_feel_felt_found+ownership_language+never_say_calm_down	discard	add_never_say_calm_down
18587	5.425	the_feel_felt_found+ownership_language+never_say_calm_down	discard	add_never_say_calm_down
18588	5.013	the_feel_felt_found+ownership_language+genuine_admission	discard	add_genuine_admission
18589	5.650	the_feel_felt_found+ownership_language+genuine_admission	discard	add_genuine_admission
18590	5.013	ownership_language+personal_touch	discard	swap_the_feel_felt_found_for_personal_touch
18591	5.450	the_feel_felt_found+ownership_language	discard	tone_change
18592	5.425	the_feel_felt_found+ownership_language	discard	crossover
18593	4.513	the_feel_felt_found+ownership_language	discard	tone_change
18594	5.113	the_feel_felt_found+genuine_admission	discard	swap_ownership_language_for_genuine_admission
18595	5.550	the_feel_felt_found+ownership_language	discard	tone_change
18596	5.550	the_feel_felt_found+ownership_language	discard	crossover
18597	4.900	the_feel_felt_found+ownership_language	discard	crossover
18598	5.013	the_feel_felt_found+ownership_language	discard	temp_0.95
18599	5.138	the_feel_felt_found+ownership_language	discard	tone_change
18600	4.912	the_feel_felt_found+ownership_language	discard	temp_0.85
18601	5.350	ownership_language	discard	crossover
18602	5.550	the_feel_felt_found+ownership_language+mirroring	discard	add_mirroring
18603	5.138	the_feel_felt_found+ownership_language+emotional_labeling	discard	add_emotional_labeling
18604	5.013	the_feel_felt_found+ownership_language	discard	tone_change
18605	4.825	the_feel_felt_found+ownership_language	discard	tone_change
18606	5.138	the_feel_felt_found+ownership_language+proactive_extras	discard	add_proactive_extras
18607	5.037	the_feel_felt_found+ownership_language	discard	tone_change
18608	5.025	the_feel_felt_found+ownership_language+personal_touch	discard	add_personal_touch
18609	5.425	the_feel_felt_found+ownership_language	discard	tone_change
18610	5.550	the_feel_felt_found	discard	remove_ownership_language
18611	5.450	the_feel_felt_found+ownership_language	discard	tone_change
18612	5.138	the_feel_felt_found+proactive_extras	discard	swap_ownership_language_for_proactive_extras
18613	5.550	the_feel_felt_found+ownership_language	discard	crossover
18614	5.025	the_feel_felt_found+ownership_language	discard	tone_change
18615	5.200	ownership_language+warmth_injection	discard	swap_the_feel_felt_found_for_warmth_injection
18616	5.550	the_feel_felt_found+ownership_language	discard	tone_change
18617	5.237	the_feel_felt_found+ownership_language	discard	tone_change
18618	5.013	the_feel_felt_found+ownership_language+warmth_injection	discard	add_warmth_injection
18619	5.013	the_feel_felt_found+ownership_language+mirroring	discard	add_mirroring
18620	5.138	ownership_language+proactive_extras	discard	swap_the_feel_felt_found_for_proactive_extras
18621	5.450	the_feel_felt_found+ownership_language	discard	tone_change
18622	5.338	none	discard	crossover
18623	5.550	the_feel_felt_found+ownership_language	discard	temp_0.95
18624	5.138	the_feel_felt_found+ownership_language	discard	tone_change
18625	5.650	the_feel_felt_found+ownership_language+genuine_admission	discard	add_genuine_admission
18626	4.388	ownership_language	discard	remove_the_feel_felt_found
18627	5.112	the_feel_felt_found+ownership_language+personal_touch	discard	add_personal_touch
18628	5.138	the_feel_felt_found+ownership_language	discard	crossover
18629	4.825	the_feel_felt_found+ownership_language	discard	temp_0.75
18630	5.037	the_feel_felt_found+ownership_language	discard	tone_change
18631	4.825	the_feel_felt_found+ownership_language	discard	temp_0.65
18632	4.700	the_feel_felt_found+ownership_language	discard	tone_change
18633	5.138	the_feel_felt_found	discard	crossover
18634	5.450	ownership_language+casual_professionalism	discard	swap_the_feel_felt_found_for_casual_professionalism
18635	5.450	the_feel_felt_found	discard	remove_ownership_language
18636	5.237	the_feel_felt_found+ownership_language+proactive_extras	discard	add_proactive_extras
18637	5.138	ownership_language+strategic_agreement	discard	swap_the_feel_felt_found_for_strategic_agreement
18638	5.237	the_feel_felt_found+ownership_language+strategic_agreement	discard	add_strategic_agreement
18639	5.237	the_feel_felt_found+ownership_language+emotional_labeling	discard	add_emotional_labeling
18640	5.013	the_feel_felt_found+ownership_language	discard	crossover
18641	5.350	the_feel_felt_found+energy_matching	discard	swap_ownership_language_for_energy_matching
18642	5.550	the_feel_felt_found	discard	crossover
18643	5.325	the_feel_felt_found+ownership_language	discard	crossover
18644	5.325	the_feel_felt_found+ownership_language	discard	temp_0.85
18645	4.825	ownership_language+strategic_agreement	discard	swap_the_feel_felt_found_for_strategic_agreement
18646	5.350	the_feel_felt_found+ownership_language	discard	tone_change
18647	5.338	the_feel_felt_found+ownership_language	discard	temp_0.65
18648	5.550	the_feel_felt_found+ownership_language+strategic_agreement	discard	add_strategic_agreement
18649	5.325	the_feel_felt_found+ownership_language	discard	temp_0.95
18650	5.237	the_feel_felt_found+ownership_language+emotional_labeling	discard	add_emotional_labeling
18651	5.138	the_feel_felt_found+ownership_language+energy_matching	discard	add_energy_matching
18652	5.425	ownership_language	discard	remove_the_feel_felt_found
18653	5.450	the_feel_felt_found+ownership_language	discard	tone_change
18654	5.550	the_feel_felt_found+ownership_language+warmth_injection	discard	add_warmth_injection
18655	4.600	the_feel_felt_found+ownership_language	discard	tone_change
18656	4.825	the_feel_felt_found+emotional_labeling	discard	swap_ownership_language_for_emotional_labeling
18657	4.925	the_feel_felt_found+ownership_language	discard	tone_change
18658	5.525	the_feel_felt_found+ownership_language+strategic_agreement	discard	add_strategic_agreement
18659	5.450	none	discard	crossover
18660	5.425	the_feel_felt_found+emotional_labeling	discard	swap_ownership_language_for_emotional_labeling
18661	5.013	the_feel_felt_found+ownership_language	discard	tone_change
18662	5.338	the_feel_felt_found+ownership_language	discard	tone_change
18663	5.325	ownership_language	discard	crossover
18664	5.025	ownership_language+proactive_extras	discard	swap_the_feel_felt_found_for_proactive_extras
18665	5.200	the_feel_felt_found+ownership_language	discard	tone_change
18666	5.013	the_feel_felt_found+ownership_language	discard	temp_0.65
18667	5.450	the_feel_felt_found+casual_professionalism	discard	swap_ownership_language_for_casual_professionalism
18668	5.025	the_feel_felt_found+never_say_calm_down	discard	swap_ownership_language_for_never_say_calm_down
18669	5.025	the_feel_felt_found+personal_touch	discard	swap_ownership_language_for_personal_touch
18670	5.237	the_feel_felt_found+ownership_language	discard	temp_0.85
18671	5.550	the_feel_felt_found+ownership_language+concrete_next_steps	discard	add_concrete_next_steps
18672	5.037	ownership_language+casual_professionalism	discard	swap_the_feel_felt_found_for_casual_professionalism
18673	5.325	ownership_language	discard	remove_the_feel_felt_found
18674	4.987	the_feel_felt_found+ownership_language	discard	tone_change
18675	5.013	the_feel_felt_found+ownership_language+never_say_calm_down	discard	add_never_say_calm_down
18676	4.987	the_feel_felt_found+ownership_language	discard	temp_0.90
18677	4.825	the_feel_felt_found+ownership_language+genuine_admission	discard	add_genuine_admission
18678	5.450	the_feel_felt_found+ownership_language	discard	temp_0.65
18679	5.200	the_feel_felt_found+ownership_language+validation_before_solution	discard	add_validation_before_solution
18680	5.112	ownership_language+validation_before_solution	discard	swap_the_feel_felt_found_for_validation_before_solution
18681	4.613	the_feel_felt_found+ownership_language+strategic_agreement	discard	add_strategic_agreement
18682	5.425	the_feel_felt_found	discard	crossover
18683	5.037	the_feel_felt_found+ownership_language	discard	temp_0.75
18684	5.338	the_feel_felt_found+ownership_language	discard	temp_0.90
18685	5.013	the_feel_felt_found+ownership_language+strategic_agreement	discard	add_strategic_agreement
18686	5.525	the_feel_felt_found+ownership_language	discard	tone_change
18687	5.238	the_feel_felt_found+ownership_language	discard	crossover
18688	5.237	the_feel_felt_found+ownership_language+concrete_next_steps	discard	add_concrete_next_steps
18689	5.112	the_feel_felt_found	discard	crossover
18690	4.825	ownership_language	discard	crossover
18691	5.025	ownership_language	discard	crossover
18692	5.013	the_feel_felt_found+ownership_language	discard	tone_change
18693	4.825	the_feel_felt_found+ownership_language	discard	tone_change
18694	5.237	the_feel_felt_found+personal_touch	discard	swap_ownership_language_for_personal_touch
18695	5.450	ownership_language+energy_matching	discard	swap_the_feel_felt_found_for_energy_matching
18696	5.300	the_feel_felt_found	discard	crossover
18697	5.550	ownership_language	discard	crossover
18698	5.337	ownership_language+energy_matching	discard	swap_the_feel_felt_found_for_energy_matching
18699	4.825	the_feel_felt_found	discard	remove_ownership_language
18700	4.987	the_feel_felt_found+ownership_language+validation_before_solution	discard	add_validation_before_solution
18701	4.725	the_feel_felt_found+ownership_language	discard	temp_0.95
18702	5.325	the_feel_felt_found+ownership_language+warmth_injection	discard	add_warmth_injection
18703	5.550	the_feel_felt_found+ownership_language	discard	temp_0.95
18704	4.787	the_feel_felt_found+ownership_language+never_say_calm_down	discard	add_never_say_calm_down
18705	5.237	the_feel_felt_found+ownership_language	discard	tone_change
18706	5.250	the_feel_felt_found+validation_before_solution	discard	swap_ownership_language_for_validation_before_solution
18707	5.325	ownership_language+energy_matching	discard	swap_the_feel_felt_found_for_energy_matching
18708	5.450	the_feel_felt_found+ownership_language+validation_before_solution	discard	add_validation_before_solution
18709	5.300	the_feel_felt_found+ownership_language	discard	crossover
18710	5.237	the_feel_felt_found	discard	remove_ownership_language
18711	5.450	the_feel_felt_found+ownership_language+never_say_calm_down	discard	add_never_say_calm_down
18712	5.450	the_feel_felt_found+genuine_admission	discard	swap_ownership_language_for_genuine_admission
18713	5.025	the_feel_felt_found+ownership_language	discard	tone_change
18714	5.450	the_feel_felt_found+ownership_language+mirroring	discard	add_mirroring
18715	4.925	the_feel_felt_found	discard	remove_ownership_language
18716	5.237	the_feel_felt_found+ownership_language+personal_touch	discard	add_personal_touch
18717	5.300	the_feel_felt_found+ownership_language+validation_before_solution	discard	add_validation_before_solution
18718	5.350	the_feel_felt_found+ownership_language+mirroring	discard	add_mirroring
18719	5.213	the_feel_felt_found	discard	crossover
18720	4.800	ownership_language	discard	crossover
18721	4.825	the_feel_felt_found+genuine_admission	discard	swap_ownership_language_for_genuine_admission
18722	4.725	ownership_language+never_say_calm_down	discard	swap_the_feel_felt_found_for_never_say_calm_down
18723	5.450	the_feel_felt_found+ownership_language+casual_professionalism	discard	add_casual_professionalism
18724	4.912	the_feel_felt_found+ownership_language	discard	temp_0.85
18725	5.025	the_feel_felt_found+personal_touch	discard	swap_ownership_language_for_personal_touch
18726	5.425	ownership_language	discard	crossover
18727	5.425	the_feel_felt_found+ownership_language	discard	tone_change
18728	5.225	the_feel_felt_found+ownership_language+energy_matching	discard	add_energy_matching
18729	5.550	the_feel_felt_found+ownership_language	discard	tone_change
18730	5.450	the_feel_felt_found+ownership_language	discard	temp_0.70
18731	5.350	the_feel_felt_found+concrete_next_steps	discard	swap_ownership_language_for_concrete_next_steps
18732	5.650	the_feel_felt_found+ownership_language	discard	crossover
18733	5.138	none	discard	crossover
18734	5.300	the_feel_felt_found+ownership_language	discard	temp_0.70
18735	4.913	the_feel_felt_found+ownership_language+validation_before_solution	discard	add_validation_before_solution
18736	4.787	the_feel_felt_found+ownership_language+casual_professionalism	discard	add_casual_professionalism
18737	5.325	the_feel_felt_found+emotional_labeling	discard	swap_ownership_language_for_emotional_labeling
18738	4.825	the_feel_felt_found+ownership_language	discard	crossover
18739	4.950	the_feel_felt_found+ownership_language	discard	tone_change
18740	5.325	the_feel_felt_found+ownership_language	discard	tone_change
18741	5.138	the_feel_felt_found+ownership_language+personal_touch	discard	add_personal_touch
18742	5.525	the_feel_felt_found+ownership_language	discard	temp_0.70
18743	4.925	ownership_language+genuine_admission	discard	swap_the_feel_felt_found_for_genuine_admission
18744	4.713	the_feel_felt_found+ownership_language+validation_before_solution	discard	add_validation_before_solution
18745	5.425	the_feel_felt_found	discard	remove_ownership_language
18746	4.700	the_feel_felt_found+ownership_language+proactive_extras	discard	add_proactive_extras
18747	4.825	the_feel_felt_found+ownership_language+personal_touch	discard	add_personal_touch
18748	5.138	ownership_language+never_say_calm_down	discard	swap_the_feel_felt_found_for_never_say_calm_down
18749	5.325	the_feel_felt_found+ownership_language+validation_before_solution	discard	add_validation_before_solution
18750	5.138	the_feel_felt_found+ownership_language	discard	tone_change
18751	5.325	ownership_language	discard	crossover
18752	5.425	the_feel_felt_found+ownership_language	discard	tone_change
18753	5.200	the_feel_felt_found+ownership_language+warmth_injection	discard	add_warmth_injection
18754	5.138	the_feel_felt_found+ownership_language+casual_professionalism	discard	add_casual_professionalism
18755	5.650	the_feel_felt_found	discard	crossover
18756	5.238	ownership_language+genuine_admission	discard	swap_the_feel_felt_found_for_genuine_admission
18757	5.237	the_feel_felt_found+ownership_language	discard	temp_0.90
18758	5.650	ownership_language	discard	crossover
18759	5.238	the_feel_felt_found+ownership_language	discard	crossover
18760	5.450	the_feel_felt_found+ownership_language+emotional_labeling	discard	add_emotional_labeling
18761	5.237	the_feel_felt_found+ownership_language	discard	crossover
18762	5.200	the_feel_felt_found+ownership_language	discard	tone_change
18763	4.825	the_feel_felt_found+energy_matching	discard	swap_ownership_language_for_energy_matching
18764	5.138	the_feel_felt_found+ownership_language+casual_professionalism	discard	add_casual_professionalism
18765	5.550	the_feel_felt_found+ownership_language	discard	crossover
18766	5.013	the_feel_felt_found	discard	remove_ownership_language
18767	4.800	ownership_language	discard	crossover
18768	5.550	the_feel_felt_found	discard	crossover
18769	5.025	the_feel_felt_found+ownership_language	discard	tone_change
18770	5.425	the_feel_felt_found+ownership_language	discard	tone_change
