generation	eq_score	techniques	status	description
16294	5.112	the_feel_felt_found+ownership_language	discard	tone_change
16295	5.550	the_feel_felt_found+ownership_language	discard	tone_change
16296	5.450	the_feel_felt_found+ownership_language	discard	tone_change
16297	5.237	ownership_language+warmth_injection	discard	swap_the_feel_felt_found_for_warmth_injection
16298	5.650	the_feel_felt_found+ownership_language	discard	tone_change
16299	4.913	ownership_language	discard	remove_the_feel_felt_found
16300	5.013	the_feel_felt_found+ownership_language	discard	tone_change
16301	5.137	the_feel_felt_found+ownership_language+personal_touch	discard	add_personal_touch
16302	5.237	the_feel_felt_found+ownership_language	discard	tone_change
16303	4.825	the_feel_felt_found+ownership_language+never_say_calm_down	discard	add_never_say_calm_down
16304	5.200	the_feel_felt_found+warmth_injection	discard	swap_ownership_language_for_warmth_injection
16305	4.825	the_feel_felt_found+ownership_language	discard	tone_change
16306	4.825	ownership_language	discard	remove_the_feel_felt_found
16307	5.550	the_feel_felt_found+ownership_language	discard	crossover
16308	5.300	ownership_language+emotional_labeling	discard	swap_the_feel_felt_found_for_emotional_labeling
16309	5.138	none	discard	crossover
16310	4.800	the_feel_felt_found+ownership_language+never_say_calm_down	discard	add_never_say_calm_down
16311	4.925	the_feel_felt_found+ownership_language	discard	crossover
16312	5.550	ownership_language+mirroring	discard	swap_the_feel_felt_found_for_mirroring
16313	5.550	ownership_language	discard	crossover
16314	5.138	the_feel_felt_found+ownership_language+genuine_admission	discard	add_genuine_admission
16315	5.237	the_feel_felt_found+ownership_language+warmth_injection	discard	add_warmth_injection
16316	5.013	ownership_language	discard	crossover
16317	5.350	the_feel_felt_found+ownership_language+warmth_injection	discard	add_warmth_injection
16318	5.325	ownership_language	discard	crossover
16319	5.425	ownership_language+never_say_calm_down	discard	swap_the_feel_felt_found_for_never_say_calm_down
16320	5.013	the_feel_felt_found+ownership_language+proactive_extras	discard	add_proactive_extras
16321	5.450	the_feel_felt_found+ownership_language	discard	crossover
16322	5.237	the_feel_felt_found+emotional_labeling	discard	swap_ownership_language_for_emotional_labeling
16323	5.225	ownership_language+casual_professionalism	discard	swap_the_feel_felt_found_for_casual_professionalism
16324	5.238	the_feel_felt_found+ownership_language	discard	tone_change
16325	5.200	the_feel_felt_found+ownership_language	discard	tone_change
16326	5.037	the_feel_felt_found+ownership_language	discard	temp_0.90
16327	5.237	ownership_language+mirroring	discard	swap_the_feel_felt_found_for_mirroring
16328	5.138	ownership_language	discard	remove_the_feel_felt_found
16329	5.450	ownership_language+strategic_agreement	discard	swap_the_feel_felt_found_for_strategic_agreement
16330	5.112	the_feel_felt_found+ownership_language	discard	crossover
16331	5.013	the_feel_felt_found+ownership_language	discard	tone_change
16332	5.113	the_feel_felt_found+ownership_language	discard	tone_change
16333	5.425	the_feel_felt_found	discard	crossover
16334	5.450	the_feel_felt_found+ownership_language+validation_before_solution	discard	add_validation_before_solution
16335	5.138	ownership_language	discard	crossover
16336	4.925	the_feel_felt_found+ownership_language+emotional_labeling	discard	add_emotional_labeling
16337	5.013	the_feel_felt_found	discard	crossover
16338	5.325	none	discard	crossover
16339	5.237	the_feel_felt_found+ownership_language	discard	temp_0.85
16340	5.325	the_feel_felt_found+ownership_language	discard	tone_change
16341	4.925	the_feel_felt_found+genuine_admission	discard	swap_ownership_language_for_genuine_admission
16342	4.987	the_feel_felt_found+ownership_language	discard	crossover
16343	5.013	the_feel_felt_found+ownership_language	discard	tone_change
16344	5.013	the_feel_felt_found	discard	crossover
16345	5.550	the_feel_felt_found+ownership_language	discard	tone_change
16346	4.925	the_feel_felt_found+ownership_language	discard	tone_change
16347	5.113	the_feel_felt_found	discard	crossover
16348	5.200	the_feel_felt_found	discard	remove_ownership_language
16349	4.513	the_feel_felt_found+ownership_language	discard	tone_change
16350	5.200	the_feel_felt_found+ownership_language+emotional_labeling	discard	add_emotional_labeling
16351	5.212	the_feel_felt_found+ownership_language+warmth_injection	discard	add_warmth_injection
16352	5.013	the_feel_felt_found+ownership_language+warmth_injection	discard	add_warmth_injection
16353	5.138	ownership_language	discard	crossover
16354	5.450	the_feel_felt_found+ownership_language	discard	tone_change
16355	5.138	the_feel_felt_found	discard	remove_ownership_language
16356	5.325	the_feel_felt_found	discard	remove_ownership_language
16357	5.138	the_feel_felt_found+ownership_language	discard	tone_change
16358	5.013	the_feel_felt_found+ownership_language	discard	crossover
16359	5.237	the_feel_felt_found+ownership_language	discard	tone_change
16360	5.350	the_feel_felt_found+ownership_language	discard	crossover
16361	5.425	the_feel_felt_found+ownership_language	discard	tone_change
16362	5.225	the_feel_felt_found+ownership_language+genuine_admission	discard	add_genuine_admission
16363	5.112	the_feel_felt_found+ownership_language	discard	tone_change
16364	5.338	the_feel_felt_found+ownership_language+proactive_extras	discard	add_proactive_extras
16365	5.112	ownership_language+casual_professionalism	discard	swap_the_feel_felt_found_for_casual_professionalism
16366	4.925	the_feel_felt_found+casual_professionalism	discard	swap_ownership_language_for_casual_professionalism
16367	4.700	the_feel_felt_found+ownership_language	discard	tone_change
16368	5.200	the_feel_felt_found+ownership_language+mirroring	discard	add_mirroring
16369	5.450	the_feel_felt_found+ownership_language+personal_touch	discard	add_personal_touch
16370	5.450	ownership_language+never_say_calm_down	discard	swap_the_feel_felt_found_for_never_say_calm_down
16371	5.450	the_feel_felt_found+ownership_language	discard	temp_0.75
16372	4.800	the_feel_felt_found+ownership_language	discard	temp_0.65
16373	5.225	the_feel_felt_found+never_say_calm_down	discard	swap_ownership_language_for_never_say_calm_down
16374	5.425	the_feel_felt_found+ownership_language	discard	temp_0.85
16375	5.450	the_feel_felt_found+ownership_language	discard	tone_change
16376	5.750	the_feel_felt_found+personal_touch	discard	swap_ownership_language_for_personal_touch
16377	5.237	the_feel_felt_found	discard	crossover
16378	5.013	the_feel_felt_found+ownership_language+validation_before_solution	discard	add_validation_before_solution
16379	5.350	the_feel_felt_found+ownership_language	discard	tone_change
16380	5.138	none	discard	crossover
16381	5.450	the_feel_felt_found+ownership_language	discard	tone_change
16382	5.225	the_feel_felt_found+ownership_language	discard	tone_change
16383	4.925	the_feel_felt_found+ownership_language	discard	tone_change
16384	5.013	the_feel_felt_found+ownership_language	discard	temp_0.65
16385	5.200	ownership_language+casual_professionalism	discard	swap_the_feel_felt_found_for_casual_professionalism
16386	5.650	the_feel_felt_found+ownership_language	discard	temp_0.75
16387	4.912	ownership_language+mirroring	discard	swap_the_feel_felt_found_for_mirroring
16388	5.550	the_feel_felt_found+ownership_language+never_say_calm_down	discard	add_never_say_calm_down
16389	4.800	the_feel_felt_found+ownership_language	discard	temp_0.75
16390	5.013	the_feel_felt_found+ownership_language	discard	crossover
16391	5.138	the_feel_felt_found+ownership_language	discard	temp_0.70
16392	5.238	the_feel_felt_found+ownership_language	discard	crossover
16393	5.225	the_feel_felt_found+ownership_language	discard	temp_0.85
16394	4.800	ownership_language+concrete_next_steps	discard	swap_the_feel_felt_found_for_concrete_next_steps
16395	5.013	the_feel_felt_found+ownership_language	discard	temp_0.90
16396	5.450	the_feel_felt_found+ownership_language	discard	crossover
16397	4.800	the_feel_felt_found+ownership_language+never_say_calm_down	discard	add_never_say_calm_down
16398	5.138	the_feel_felt_found+ownership_language	discard	tone_change
16399	5.450	the_feel_felt_found+ownership_language	discard	tone_change
16400	5.425	ownership_language	discard	crossover
16401	5.237	the_feel_felt_found+ownership_language	discard	tone_change
16402	5.425	the_feel_felt_found+concrete_next_steps	discard	swap_ownership_language_for_concrete_next_steps
16403	5.013	the_feel_felt_found+ownership_language+personal_touch	discard	add_personal_touch
16404	5.325	the_feel_felt_found+ownership_language	discard	crossover
16405	5.525	ownership_language	discard	crossover
16406	5.138	ownership_language	discard	remove_the_feel_felt_found
16407	5.325	the_feel_felt_found+ownership_language	discard	tone_change
16408	5.450	the_feel_felt_found+ownership_language	discard	tone_change
16409	5.450	the_feel_felt_found+ownership_language	discard	temp_0.95
16410	5.138	the_feel_felt_found+ownership_language+emotional_labeling	discard	add_emotional_labeling
16411	5.025	the_feel_felt_found+ownership_language	discard	tone_change
16412	5.013	the_feel_felt_found+ownership_language	discard	tone_change
16413	5.225	the_feel_felt_found+ownership_language	discard	temp_0.85
16414	5.238	the_feel_felt_found+ownership_language+mirroring	discard	add_mirroring
16415	5.325	the_feel_felt_found+ownership_language+concrete_next_steps	discard	add_concrete_next_steps
16416	5.450	the_feel_felt_found+proactive_extras	discard	swap_ownership_language_for_proactive_extras
16417	5.450	the_feel_felt_found+proactive_extras	discard	swap_ownership_language_for_proactive_extras
16418	5.200	the_feel_felt_found+ownership_language+energy_matching	discard	add_energy_matching
16419	4.925	the_feel_felt_found+ownership_language	discard	tone_change
16420	5.013	the_feel_felt_found+ownership_language	discard	crossover
16421	5.450	the_feel_felt_found	discard	crossover
16422	5.550	the_feel_felt_found+ownership_language	discard	tone_change
16423	5.237	the_feel_felt_found+ownership_language	discard	tone_change
16424	5.025	the_feel_felt_found+ownership_language+energy_matching	discard	add_energy_matching
16425	5.450	ownership_language+genuine_admission	discard	swap_the_feel_felt_found_for_genuine_admission
16426	4.888	the_feel_felt_found+ownership_language	discard	tone_change
16427	5.300	the_feel_felt_found	discard	crossover
16428	5.425	the_feel_felt_found	discard	remove_ownership_language
16429	5.650	the_feel_felt_found+ownership_language	discard	temp_0.75
16430	5.450	the_feel_felt_found+ownership_language	discard	tone_change
16431	5.450	the_feel_felt_found+ownership_language	discard	tone_change
16432	5.112	the_feel_felt_found+ownership_language+personal_touch	discard	add_personal_touch
16433	5.013	the_feel_felt_found+ownership_language	discard	crossover
16434	5.550	the_feel_felt_found+ownership_language	discard	temp_0.70
16435	5.325	the_feel_felt_found+ownership_language+validation_before_solution	discard	add_validation_before_solution
16436	5.450	the_feel_felt_found+ownership_language+personal_touch	discard	add_personal_touch
16437	5.450	the_feel_felt_found+ownership_language+mirroring	discard	add_mirroring
16438	4.862	the_feel_felt_found+strategic_agreement	discard	swap_ownership_language_for_strategic_agreement
16439	5.450	the_feel_felt_found	discard	remove_ownership_language
16440	4.700	the_feel_felt_found+ownership_language	discard	crossover
16441	5.325	none	discard	crossover
16442	5.013	ownership_language	discard	remove_the_feel_felt_found
16443	4.888	the_feel_felt_found+ownership_language	discard	tone_change
16444	5.425	the_feel_felt_found+ownership_language+emotional_labeling	discard	add_emotional_labeling
16445	5.200	the_feel_felt_found+ownership_language+warmth_injection	discard	add_warmth_injection
16446	5.425	the_feel_felt_found+ownership_language	discard	crossover
16447	5.425	the_feel_felt_found+ownership_language	discard	tone_change
16448	5.013	the_feel_felt_found+ownership_language+emotional_labeling	discard	add_emotional_labeling
16449	5.550	the_feel_felt_found+ownership_language+emotional_labeling	discard	add_emotional_labeling
16450	5.350	the_feel_felt_found+ownership_language	discard	temp_0.75
16451	5.112	the_feel_felt_found+strategic_agreement	discard	swap_ownership_language_for_strategic_agreement
16452	5.550	the_feel_felt_found+ownership_language	discard	tone_change
16453	5.138	the_feel_felt_found+ownership_language+casual_professionalism	discard	add_casual_professionalism
16454	5.450	the_feel_felt_found+ownership_language+warmth_injection	discard	add_warmth_injection
16455	5.650	the_feel_felt_found+ownership_language+casual_professionalism	discard	add_casual_professionalism
16456	5.450	the_feel_felt_found+ownership_language	discard	temp_0.85
16457	4.987	the_feel_felt_found+ownership_language	discard	temp_0.85
16458	5.138	none	discard	crossover
16459	5.550	the_feel_felt_found	discard	crossover
16460	5.338	ownership_language+concrete_next_steps	discard	swap_the_feel_felt_found_for_concrete_next_steps
16461	5.450	the_feel_felt_found+ownership_language	discard	tone_change
16462	4.888	the_feel_felt_found+ownership_language+genuine_admission	discard	add_genuine_admission
16463	5.100	the_feel_felt_found+ownership_language+energy_matching	discard	add_energy_matching
16464	5.138	the_feel_felt_found	discard	crossover
16465	4.800	the_feel_felt_found+ownership_language+warmth_injection	discard	add_warmth_injection
16466	5.112	the_feel_felt_found+ownership_language	discard	tone_change
16467	5.237	ownership_language+genuine_admission	discard	swap_the_feel_felt_found_for_genuine_admission
16468	5.325	the_feel_felt_found+ownership_language+personal_touch	discard	add_personal_touch
16469	5.550	the_feel_felt_found+ownership_language+casual_professionalism	discard	add_casual_professionalism
16470	4.925	the_feel_felt_found+ownership_language	discard	tone_change
16471	5.013	the_feel_felt_found	discard	crossover
16472	5.550	ownership_language	discard	crossover
16473	5.025	the_feel_felt_found+ownership_language+validation_before_solution	discard	add_validation_before_solution
16474	5.450	the_feel_felt_found+ownership_language+warmth_injection	discard	add_warmth_injection
16475	5.450	the_feel_felt_found+ownership_language	discard	temp_0.65
16476	5.138	the_feel_felt_found	discard	remove_ownership_language
16477	5.325	the_feel_felt_found+ownership_language	discard	tone_change
16478	5.238	the_feel_felt_found+ownership_language+casual_professionalism	discard	add_casual_professionalism
16479	5.425	the_feel_felt_found	discard	crossover
16480	5.112	the_feel_felt_found	discard	remove_ownership_language
16481	4.825	the_feel_felt_found+ownership_language	discard	temp_0.85
16482	5.550	the_feel_felt_found+ownership_language	discard	temp_0.95
16483	5.450	the_feel_felt_found+ownership_language	discard	temp_0.90
16484	5.237	the_feel_felt_found+ownership_language+never_say_calm_down	discard	add_never_say_calm_down
16485	5.650	the_feel_felt_found+ownership_language	discard	tone_change
16486	5.138	ownership_language	discard	crossover
16487	5.338	the_feel_felt_found+never_say_calm_down	discard	swap_ownership_language_for_never_say_calm_down
16488	4.925	ownership_language	discard	remove_the_feel_felt_found
16489	5.325	the_feel_felt_found+ownership_language	discard	temp_0.90
16490	5.237	none	discard	crossover
16491	5.237	the_feel_felt_found+ownership_language	discard	tone_change
16492	5.550	the_feel_felt_found+ownership_language+validation_before_solution	discard	add_validation_before_solution
16493	4.800	the_feel_felt_found+ownership_language	discard	tone_change
16494	5.237	ownership_language+warmth_injection	discard	swap_the_feel_felt_found_for_warmth_injection
16495	5.550	the_feel_felt_found+ownership_language+validation_before_solution	discard	add_validation_before_solution
16496	5.325	the_feel_felt_found+ownership_language+genuine_admission	discard	add_genuine_admission
16497	5.138	ownership_language+energy_matching	discard	swap_the_feel_felt_found_for_energy_matching
16498	5.213	ownership_language+mirroring	discard	swap_the_feel_felt_found_for_mirroring
16499	4.825	the_feel_felt_found+ownership_language	discard	tone_change
16500	4.825	the_feel_felt_found+ownership_language	discard	temp_0.70
16501	5.112	the_feel_felt_found+ownership_language	discard	tone_change
16502	4.988	the_feel_felt_found+ownership_language	discard	temp_0.70
16503	5.225	the_feel_felt_found+ownership_language	discard	temp_0.90
16504	5.038	ownership_language	discard	remove_the_feel_felt_found
16505	5.138	the_feel_felt_found+ownership_language	discard	temp_0.85
16506	5.325	the_feel_felt_found	discard	remove_ownership_language
16507	5.425	the_feel_felt_found+ownership_language+proactive_extras	discard	add_proactive_extras
16508	4.787	the_feel_felt_found+ownership_language	discard	crossover
16509	5.550	the_feel_felt_found+ownership_language	discard	temp_0.65
16510	4.888	the_feel_felt_found+ownership_language	discard	temp_0.95
16511	5.550	the_feel_felt_found+ownership_language+casual_professionalism	discard	add_casual_professionalism
16512	5.650	the_feel_felt_found+ownership_language	discard	tone_change
16513	5.450	ownership_language	discard	crossover
16514	4.912	the_feel_felt_found+ownership_language+proactive_extras	discard	add_proactive_extras
16515	5.425	the_feel_felt_found+ownership_language	discard	crossover
16516	5.138	the_feel_felt_found+personal_touch	discard	swap_ownership_language_for_personal_touch
16517	5.113	the_feel_felt_found+ownership_language+energy_matching	discard	add_energy_matching
16518	4.925	the_feel_felt_found	discard	remove_ownership_language
16519	5.425	the_feel_felt_found+ownership_language	discard	crossover
16520	5.138	the_feel_felt_found+ownership_language+energy_matching	discard	add_energy_matching
16521	5.237	the_feel_felt_found+ownership_language+casual_professionalism	discard	add_casual_professionalism
16522	5.450	none	discard	crossover
16523	5.550	the_feel_felt_found+ownership_language	discard	crossover
16524	5.550	the_feel_felt_found+ownership_language+genuine_admission	discard	add_genuine_admission
16525	5.138	ownership_language	discard	remove_the_feel_felt_found
16526	5.450	the_feel_felt_found+casual_professionalism	discard	swap_ownership_language_for_casual_professionalism
16527	5.225	the_feel_felt_found+emotional_labeling	discard	swap_ownership_language_for_emotional_labeling
16528	5.425	the_feel_felt_found	discard	remove_ownership_language
16529	5.138	the_feel_felt_found+ownership_language	discard	temp_0.75
16530	5.138	the_feel_felt_found+ownership_language+strategic_agreement	discard	add_strategic_agreement
16531	4.925	the_feel_felt_found+ownership_language	discard	temp_0.75
16532	5.338	the_feel_felt_found+ownership_language	discard	tone_change
16533	5.237	the_feel_felt_found+ownership_language+validation_before_solution	discard	add_validation_before_solution
16534	5.450	the_feel_felt_found+ownership_language+never_say_calm_down	discard	add_never_say_calm_down
16535	4.987	ownership_language	discard	crossover
16536	5.213	ownership_language	discard	crossover
16537	5.037	the_feel_felt_found+ownership_language	discard	tone_change
16538	4.800	the_feel_felt_found+proactive_extras	discard	swap_ownership_language_for_proactive_extras
16539	5.325	the_feel_felt_found+ownership_language+concrete_next_steps	discard	add_concrete_next_steps
16540	5.300	the_feel_felt_found+energy_matching	discard	swap_ownership_language_for_energy_matching
16541	5.013	the_feel_felt_found+never_say_calm_down	discard	swap_ownership_language_for_never_say_calm_down
16542	5.200	the_feel_felt_found+ownership_language	discard	temp_0.90
16543	5.013	ownership_language+mirroring	discard	swap_the_feel_felt_found_for_mirroring
16544	5.237	the_feel_felt_found+ownership_language+casual_professionalism	discard	add_casual_professionalism
16545	5.325	the_feel_felt_found	discard	crossover
16546	5.025	the_feel_felt_found+ownership_language+personal_touch	discard	add_personal_touch
16547	5.013	the_feel_felt_found+ownership_language	discard	tone_change
16548	5.450	the_feel_felt_found	discard	crossover
16549	4.825	ownership_language	discard	remove_the_feel_felt_found
16550	5.025	the_feel_felt_found+strategic_agreement	discard	swap_ownership_language_for_strategic_agreement
16551	5.425	ownership_language+energy_matching	discard	swap_the_feel_felt_found_for_energy_matching
16552	5.325	the_feel_felt_found+ownership_language	discard	tone_change
16553	5.225	the_feel_felt_found+ownership_language+personal_touch	discard	add_personal_touch
16554	5.450	the_feel_felt_found+ownership_language	discard	tone_change
16555	5.200	the_feel_felt_found+casual_professionalism	discard	swap_ownership_language_for_casual_professionalism
16556	5.425	the_feel_felt_found	discard	crossover
16557	4.575	the_feel_felt_found+ownership_language	discard	crossover
16558	5.550	the_feel_felt_found+ownership_language	discard	tone_change
16559	4.925	the_feel_felt_found+ownership_language	discard	tone_change
16560	5.013	the_feel_felt_found	discard	crossover
16561	5.450	ownership_language+casual_professionalism	discard	swap_the_feel_felt_found_for_casual_professionalism
16562	5.338	the_feel_felt_found+ownership_language+warmth_injection	discard	add_warmth_injection
16563	5.138	the_feel_felt_found+ownership_language	discard	tone_change
16564	5.425	the_feel_felt_found	discard	crossover
16565	5.325	the_feel_felt_found+ownership_language+validation_before_solution	discard	add_validation_before_solution
16566	5.125	the_feel_felt_found+ownership_language	discard	temp_0.65
16567	5.325	the_feel_felt_found+ownership_language	discard	tone_change
16568	5.138	the_feel_felt_found+ownership_language+strategic_agreement	discard	add_strategic_agreement
16569	5.138	the_feel_felt_found+ownership_language	discard	temp_0.70
16570	5.450	the_feel_felt_found+ownership_language	discard	temp_0.85
