generation	eq_score	techniques	status	description
10554	5.138	none	discard	crossover
10555	5.325	ownership_language	discard	remove_the_feel_felt_found
10556	5.450	the_feel_felt_found+ownership_language	discard	temp_0.65
10557	5.350	the_feel_felt_found+ownership_language	discard	temp_0.95
10558	5.550	ownership_language+energy_matching	discard	swap_the_feel_felt_found_for_energy_matching
10559	5.200	the_feel_felt_found+ownership_language+concrete_next_steps	discard	add_concrete_next_steps
10560	5.350	the_feel_felt_found+ownership_language	discard	tone_change
10561	5.450	the_feel_felt_found+ownership_language	discard	tone_change
10562	4.925	the_feel_felt_found+ownership_language+warmth_injection	discard	add_warmth_injection
10563	5.450	the_feel_felt_found+ownership_language	discard	crossover
10564	5.013	the_feel_felt_found+ownership_language+genuine_admission	discard	add_genuine_admission
10565	5.550	ownership_language+never_say_calm_down	discard	swap_the_feel_felt_found_for_never_say_calm_down
10566	5.338	the_feel_felt_found+ownership_language+warmth_injection	discard	add_warmth_injection
10567	4.700	the_feel_felt_found+ownership_language	discard	tone_change
10568	4.825	the_feel_felt_found+ownership_language	discard	temp_0.70
10569	4.700	ownership_language+never_say_calm_down	discard	swap_the_feel_felt_found_for_never_say_calm_down
10570	5.175	the_feel_felt_found	discard	crossover
10571	4.725	the_feel_felt_found+ownership_language+emotional_labeling	discard	add_emotional_labeling
10572	5.425	the_feel_felt_found+ownership_language+mirroring	discard	add_mirroring
10573	5.425	ownership_language	discard	remove_the_feel_felt_found
10574	4.925	the_feel_felt_found+ownership_language+genuine_admission	discard	add_genuine_admission
10575	5.237	the_feel_felt_found	discard	crossover
10576	5.550	the_feel_felt_found+ownership_language+never_say_calm_down	discard	add_never_say_calm_down
10577	5.013	the_feel_felt_found+ownership_language	discard	temp_0.70
10578	4.888	ownership_language	discard	crossover
10579	5.550	the_feel_felt_found+ownership_language+mirroring	discard	add_mirroring
10580	5.013	the_feel_felt_found+ownership_language+strategic_agreement	discard	add_strategic_agreement
10581	4.700	the_feel_felt_found+ownership_language+personal_touch	discard	add_personal_touch
10582	5.550	the_feel_felt_found+ownership_language	discard	crossover
10583	5.338	the_feel_felt_found	discard	remove_ownership_language
10584	5.325	the_feel_felt_found+ownership_language+warmth_injection	discard	add_warmth_injection
10585	5.200	ownership_language	discard	crossover
10586	5.013	ownership_language	discard	crossover
10587	4.825	the_feel_felt_found+ownership_language	discard	tone_change
10588	5.025	the_feel_felt_found+ownership_language	discard	temp_0.75
10589	5.450	the_feel_felt_found+ownership_language	discard	tone_change
10590	5.325	the_feel_felt_found+concrete_next_steps	discard	swap_ownership_language_for_concrete_next_steps
10591	4.988	the_feel_felt_found+ownership_language+casual_professionalism	discard	add_casual_professionalism
10592	5.213	the_feel_felt_found+mirroring	discard	swap_ownership_language_for_mirroring
10593	5.200	the_feel_felt_found+ownership_language+concrete_next_steps	discard	add_concrete_next_steps
10594	5.013	ownership_language+proactive_extras	discard	swap_the_feel_felt_found_for_proactive_extras
10595	5.325	ownership_language+genuine_admission	discard	swap_the_feel_felt_found_for_genuine_admission
10596	5.013	the_feel_felt_found+ownership_language	discard	tone_change
10597	5.425	ownership_language	discard	crossover
10598	5.425	the_feel_felt_found+personal_touch	discard	swap_ownership_language_for_personal_touch
10599	4.700	the_feel_felt_found+ownership_language	discard	tone_change
10600	5.350	the_feel_felt_found+personal_touch	discard	swap_ownership_language_for_personal_touch
10601	4.925	the_feel_felt_found+ownership_language+never_say_calm_down	discard	add_never_say_calm_down
10602	5.325	the_feel_felt_found+ownership_language+genuine_admission	discard	add_genuine_admission
10603	5.013	the_feel_felt_found+ownership_language+proactive_extras	discard	add_proactive_extras
10604	5.550	ownership_language	discard	crossover
10605	5.013	the_feel_felt_found+ownership_language	discard	crossover
10606	5.650	the_feel_felt_found+ownership_language	discard	temp_0.95
10607	5.138	the_feel_felt_found+energy_matching	discard	swap_ownership_language_for_energy_matching
10608	5.125	none	discard	crossover
10609	5.138	the_feel_felt_found+ownership_language+validation_before_solution	discard	add_validation_before_solution
10610	5.350	the_feel_felt_found+ownership_language	discard	temp_0.75
10611	5.325	the_feel_felt_found+ownership_language+concrete_next_steps	discard	add_concrete_next_steps
10612	5.013	the_feel_felt_found+ownership_language	discard	tone_change
10613	5.013	the_feel_felt_found+ownership_language	discard	temp_0.75
10614	5.113	the_feel_felt_found+ownership_language	discard	crossover
10615	5.237	the_feel_felt_found+ownership_language+mirroring	discard	add_mirroring
10616	5.450	the_feel_felt_found+ownership_language	discard	tone_change
10617	5.037	the_feel_felt_found	discard	crossover
10618	4.800	ownership_language+personal_touch	discard	swap_the_feel_felt_found_for_personal_touch
10619	5.450	ownership_language+never_say_calm_down	discard	swap_the_feel_felt_found_for_never_say_calm_down
10620	5.550	the_feel_felt_found+concrete_next_steps	discard	swap_ownership_language_for_concrete_next_steps
10621	5.550	the_feel_felt_found+ownership_language+concrete_next_steps	discard	add_concrete_next_steps
10622	5.425	the_feel_felt_found+genuine_admission	discard	swap_ownership_language_for_genuine_admission
10623	5.550	the_feel_felt_found	discard	crossover
10624	5.425	the_feel_felt_found+ownership_language	discard	temp_0.90
10625	5.138	the_feel_felt_found+ownership_language+strategic_agreement	discard	add_strategic_agreement
10626	5.138	the_feel_felt_found+ownership_language+genuine_admission	discard	add_genuine_admission
10627	5.138	the_feel_felt_found+ownership_language+concrete_next_steps	discard	add_concrete_next_steps
10628	5.550	ownership_language	discard	crossover
10629	5.112	the_feel_felt_found	discard	remove_ownership_language
10630	5.138	the_feel_felt_found+ownership_language	discard	tone_change
10631	5.225	the_feel_felt_found+ownership_language	discard	tone_change
10632	5.325	the_feel_felt_found+ownership_language	discard	crossover
10633	5.550	the_feel_felt_found+ownership_language	discard	tone_change
10634	5.425	the_feel_felt_found+ownership_language+never_say_calm_down	discard	add_never_say_calm_down
10635	5.425	the_feel_felt_found+ownership_language	discard	temp_0.90
10636	5.237	the_feel_felt_found+ownership_language+warmth_injection	discard	add_warmth_injection
10637	5.138	ownership_language	discard	crossover
10638	5.750	ownership_language	discard	remove_the_feel_felt_found
10639	5.138	the_feel_felt_found+ownership_language	discard	tone_change
10640	5.350	the_feel_felt_found+ownership_language	discard	temp_0.75
10641	5.138	the_feel_felt_found	discard	crossover
10642	5.300	the_feel_felt_found+ownership_language	discard	tone_change
10643	5.100	the_feel_felt_found+ownership_language	discard	crossover
10644	5.550	the_feel_felt_found+ownership_language	discard	crossover
10645	5.037	the_feel_felt_found+ownership_language	discard	temp_0.95
10646	4.925	the_feel_felt_found+ownership_language	discard	tone_change
10647	5.450	ownership_language+never_say_calm_down	discard	swap_the_feel_felt_found_for_never_say_calm_down
10648	5.237	the_feel_felt_found	discard	crossover
10649	5.138	ownership_language+strategic_agreement	discard	swap_the_feel_felt_found_for_strategic_agreement
10650	5.237	the_feel_felt_found+ownership_language	discard	temp_0.85
10651	5.350	the_feel_felt_found+ownership_language+never_say_calm_down	discard	add_never_say_calm_down
10652	5.350	the_feel_felt_found+ownership_language	discard	tone_change
10653	4.513	the_feel_felt_found+ownership_language+never_say_calm_down	discard	add_never_say_calm_down
10654	5.237	the_feel_felt_found+genuine_admission	discard	swap_ownership_language_for_genuine_admission
10655	5.138	the_feel_felt_found+ownership_language+validation_before_solution	discard	add_validation_before_solution
10656	5.013	ownership_language	discard	crossover
10657	5.237	the_feel_felt_found+ownership_language	discard	tone_change
10658	5.450	the_feel_felt_found+ownership_language+emotional_labeling	discard	add_emotional_labeling
10659	4.987	ownership_language+never_say_calm_down	discard	swap_the_feel_felt_found_for_never_say_calm_down
10660	5.213	the_feel_felt_found+ownership_language+validation_before_solution	discard	add_validation_before_solution
10661	5.037	the_feel_felt_found+ownership_language	discard	tone_change
10662	4.912	the_feel_felt_found+genuine_admission	discard	swap_ownership_language_for_genuine_admission
10663	4.800	the_feel_felt_found+ownership_language+personal_touch	discard	add_personal_touch
10664	5.325	the_feel_felt_found+ownership_language+casual_professionalism	discard	add_casual_professionalism
10665	5.037	the_feel_felt_found+ownership_language	discard	crossover
10666	4.825	the_feel_felt_found+ownership_language	discard	tone_change
10667	5.325	the_feel_felt_found+ownership_language+casual_professionalism	discard	add_casual_professionalism
10668	5.425	ownership_language	discard	crossover
10669	5.550	the_feel_felt_found+ownership_language	discard	tone_change
10670	4.575	the_feel_felt_found+ownership_language	discard	temp_0.95
10671	5.350	the_feel_felt_found+ownership_language+strategic_agreement	discard	add_strategic_agreement
10672	4.825	ownership_language+emotional_labeling	discard	swap_the_feel_felt_found_for_emotional_labeling
10673	5.200	ownership_language+concrete_next_steps	discard	swap_the_feel_felt_found_for_concrete_next_steps
10674	5.200	ownership_language+personal_touch	discard	swap_the_feel_felt_found_for_personal_touch
10675	5.238	the_feel_felt_found+ownership_language+never_say_calm_down	discard	add_never_say_calm_down
10676	4.513	the_feel_felt_found+ownership_language+never_say_calm_down	discard	add_never_say_calm_down
10677	5.013	the_feel_felt_found+ownership_language	discard	tone_change
10678	5.450	the_feel_felt_found+ownership_language	discard	crossover
10679	4.925	the_feel_felt_found+ownership_language	discard	tone_change
10680	5.350	the_feel_felt_found+ownership_language+warmth_injection	discard	add_warmth_injection
10681	5.137	the_feel_felt_found+ownership_language	discard	tone_change
10682	5.350	the_feel_felt_found+ownership_language	discard	temp_0.75
10683	5.325	the_feel_felt_found+ownership_language	discard	crossover
10684	5.450	the_feel_felt_found+ownership_language	discard	temp_0.95
10685	5.138	the_feel_felt_found+ownership_language	discard	crossover
10686	5.325	ownership_language	discard	crossover
10687	5.138	ownership_language+energy_matching	discard	swap_the_feel_felt_found_for_energy_matching
10688	5.450	the_feel_felt_found+ownership_language+proactive_extras	discard	add_proactive_extras
10689	5.013	the_feel_felt_found+ownership_language+validation_before_solution	discard	add_validation_before_solution
10690	5.550	the_feel_felt_found+ownership_language+energy_matching	discard	add_energy_matching
10691	5.650	the_feel_felt_found+validation_before_solution	discard	swap_ownership_language_for_validation_before_solution
10692	5.350	ownership_language+never_say_calm_down	discard	swap_the_feel_felt_found_for_never_say_calm_down
10693	5.013	the_feel_felt_found+ownership_language+personal_touch	discard	add_personal_touch
10694	5.025	ownership_language+emotional_labeling	discard	swap_the_feel_felt_found_for_emotional_labeling
10695	5.450	the_feel_felt_found+ownership_language	discard	temp_0.65
10696	5.138	the_feel_felt_found+ownership_language	discard	temp_0.65
10697	5.138	the_feel_felt_found+ownership_language+energy_matching	discard	add_energy_matching
10698	5.237	the_feel_felt_found+mirroring	discard	swap_ownership_language_for_mirroring
10699	5.138	the_feel_felt_found+ownership_language+strategic_agreement	discard	add_strategic_agreement
10700	5.450	the_feel_felt_found+ownership_language	discard	crossover
10701	5.237	the_feel_felt_found+ownership_language+genuine_admission	discard	add_genuine_admission
10702	5.550	ownership_language+mirroring	discard	swap_the_feel_felt_found_for_mirroring
10703	5.425	none	discard	crossover
10704	5.350	the_feel_felt_found+ownership_language	discard	tone_change
10705	5.525	ownership_language+casual_professionalism	discard	swap_the_feel_felt_found_for_casual_professionalism
10706	5.450	the_feel_felt_found+validation_before_solution	discard	swap_ownership_language_for_validation_before_solution
10707	4.700	the_feel_felt_found+emotional_labeling	discard	swap_ownership_language_for_emotional_labeling
10708	4.788	the_feel_felt_found+ownership_language+personal_touch	discard	add_personal_touch
10709	5.138	the_feel_felt_found+ownership_language	discard	tone_change
10710	5.125	none	discard	crossover
10711	5.625	the_feel_felt_found+ownership_language	discard	crossover
10712	5.425	the_feel_felt_found+ownership_language+energy_matching	discard	add_energy_matching
10713	5.238	the_feel_felt_found+ownership_language	discard	tone_change
10714	5.138	the_feel_felt_found+ownership_language	discard	crossover
10715	5.225	the_feel_felt_found+ownership_language	discard	crossover
10716	5.325	the_feel_felt_found+ownership_language+concrete_next_steps	discard	add_concrete_next_steps
10717	5.213	the_feel_felt_found+casual_professionalism	discard	swap_ownership_language_for_casual_professionalism
10718	5.425	the_feel_felt_found+ownership_language	discard	tone_change
10719	5.213	ownership_language	discard	crossover
10720	5.325	the_feel_felt_found+ownership_language	discard	temp_0.85
10721	5.450	the_feel_felt_found+validation_before_solution	discard	swap_ownership_language_for_validation_before_solution
10722	5.550	ownership_language+emotional_labeling	discard	swap_the_feel_felt_found_for_emotional_labeling
10723	5.325	the_feel_felt_found+emotional_labeling	discard	swap_ownership_language_for_emotional_labeling
10724	5.450	the_feel_felt_found+ownership_language	discard	tone_change
10725	5.325	ownership_language	discard	remove_the_feel_felt_found
10726	5.450	ownership_language+energy_matching	discard	swap_the_feel_felt_found_for_energy_matching
10727	5.450	the_feel_felt_found+ownership_language	discard	temp_0.95
10728	5.450	ownership_language+personal_touch	discard	swap_the_feel_felt_found_for_personal_touch
10729	5.350	the_feel_felt_found	discard	crossover
10730	5.138	the_feel_felt_found+ownership_language	discard	tone_change
10731	5.325	the_feel_felt_found+ownership_language	discard	tone_change
10732	5.237	ownership_language	discard	crossover
10733	5.238	the_feel_felt_found	discard	crossover
10734	5.238	the_feel_felt_found+ownership_language	discard	tone_change
10735	4.725	the_feel_felt_found+ownership_language	discard	crossover
10736	5.138	the_feel_felt_found+ownership_language	discard	tone_change
10737	5.450	the_feel_felt_found+ownership_language+concrete_next_steps	discard	add_concrete_next_steps
10738	5.425	the_feel_felt_found+ownership_language	discard	tone_change
10739	5.450	the_feel_felt_found+ownership_language+emotional_labeling	discard	add_emotional_labeling
10740	5.300	the_feel_felt_found+ownership_language	discard	tone_change
10741	5.550	the_feel_felt_found+casual_professionalism	discard	swap_ownership_language_for_casual_professionalism
10742	5.138	the_feel_felt_found+ownership_language	discard	temp_0.85
10743	5.013	ownership_language	discard	crossover
10744	4.613	the_feel_felt_found+ownership_language	discard	tone_change
10745	5.138	ownership_language+casual_professionalism	discard	swap_the_feel_felt_found_for_casual_professionalism
10746	5.450	the_feel_felt_found+ownership_language+emotional_labeling	discard	add_emotional_labeling
10747	5.112	the_feel_felt_found+ownership_language	discard	tone_change
10748	4.825	the_feel_felt_found+ownership_language+proactive_extras	discard	add_proactive_extras
10749	5.112	the_feel_felt_found+ownership_language+validation_before_solution	discard	add_validation_before_solution
10750	5.037	the_feel_felt_found+ownership_language+energy_matching	discard	add_energy_matching
10751	5.550	the_feel_felt_found+ownership_language+validation_before_solution	discard	add_validation_before_solution
10752	5.038	the_feel_felt_found+ownership_language	discard	crossover
10753	5.425	the_feel_felt_found+ownership_language	discard	tone_change
10754	5.325	ownership_language	discard	crossover
10755	5.238	the_feel_felt_found+ownership_language+genuine_admission	discard	add_genuine_admission
10756	5.138	the_feel_felt_found+ownership_language	discard	crossover
10757	5.425	the_feel_felt_found+ownership_language	discard	tone_change
10758	5.425	the_feel_felt_found+ownership_language	discard	crossover
10759	5.237	the_feel_felt_found	discard	crossover
10760	5.425	the_feel_felt_found	discard	remove_ownership_language
10761	5.200	ownership_language+genuine_admission	discard	swap_the_feel_felt_found_for_genuine_admission
10762	5.025	the_feel_felt_found	discard	remove_ownership_language
10763	5.450	the_feel_felt_found+ownership_language	discard	temp_0.75
10764	5.138	the_feel_felt_found+ownership_language	discard	tone_change
10765	5.550	the_feel_felt_found+ownership_language	discard	tone_change
10766	5.112	the_feel_felt_found+ownership_language	discard	temp_0.70
10767	5.037	the_feel_felt_found	discard	crossover
10768	5.550	the_feel_felt_found+ownership_language+never_say_calm_down	discard	add_never_say_calm_down
10769	5.138	the_feel_felt_found+ownership_language	discard	crossover
10770	5.350	the_feel_felt_found+ownership_language+validation_before_solution	discard	add_validation_before_solution
10771	5.450	the_feel_felt_found+ownership_language+energy_matching	discard	add_energy_matching
10772	5.138	the_feel_felt_found	discard	remove_ownership_language
10773	5.550	the_feel_felt_found+ownership_language	discard	temp_0.70
10774	5.338	the_feel_felt_found+ownership_language	discard	crossover
10775	5.350	the_feel_felt_found+ownership_language	discard	tone_change
10776	5.450	the_feel_felt_found+ownership_language+warmth_injection	discard	add_warmth_injection
10777	5.550	the_feel_felt_found+ownership_language	discard	crossover
10778	4.825	the_feel_felt_found+ownership_language	discard	crossover
10779	5.650	the_feel_felt_found+ownership_language	discard	tone_change
10780	4.513	the_feel_felt_found+ownership_language+emotional_labeling	discard	add_emotional_labeling
10781	5.338	none	discard	crossover
10782	5.325	the_feel_felt_found+ownership_language+genuine_admission	discard	add_genuine_admission
10783	4.800	the_feel_felt_found+ownership_language	discard	temp_0.85
10784	5.200	the_feel_felt_found+validation_before_solution	discard	swap_ownership_language_for_validation_before_solution
10785	5.113	the_feel_felt_found+ownership_language	discard	tone_change
10786	5.350	the_feel_felt_found+ownership_language	discard	temp_0.85
10787	5.013	the_feel_felt_found+ownership_language+concrete_next_steps	discard	add_concrete_next_steps
10788	5.550	the_feel_felt_found+ownership_language	discard	tone_change
10789	5.300	the_feel_felt_found+ownership_language	discard	tone_change
10790	5.225	the_feel_felt_found+ownership_language	discard	temp_0.90
10791	5.550	the_feel_felt_found+ownership_language	discard	temp_0.85
10792	5.325	ownership_language	discard	remove_the_feel_felt_found
10793	4.925	the_feel_felt_found+ownership_language	discard	tone_change
10794	5.113	ownership_language+concrete_next_steps	discard	swap_the_feel_felt_found_for_concrete_next_steps
10795	5.425	the_feel_felt_found+ownership_language+validation_before_solution	discard	add_validation_before_solution
10796	5.425	ownership_language	discard	crossover
10797	5.338	the_feel_felt_found+ownership_language+concrete_next_steps	discard	add_concrete_next_steps
10798	5.100	the_feel_felt_found	discard	remove_ownership_language
10799	5.013	none	discard	crossover
10800	5.012	the_feel_felt_found+ownership_language	discard	tone_change
10801	5.312	the_feel_felt_found+ownership_language+concrete_next_steps	discard	add_concrete_next_steps
10802	5.237	the_feel_felt_found+ownership_language	discard	tone_change
10803	4.825	the_feel_felt_found+ownership_language+emotional_labeling	discard	add_emotional_labeling
10804	5.237	the_feel_felt_found+ownership_language+strategic_agreement	discard	add_strategic_agreement
10805	5.425	the_feel_felt_found+ownership_language	discard	crossover
10806	4.925	the_feel_felt_found+ownership_language	discard	tone_change
10807	5.138	the_feel_felt_found+ownership_language+mirroring	discard	add_mirroring
10808	5.237	ownership_language	discard	remove_the_feel_felt_found
10809	5.138	the_feel_felt_found+ownership_language	discard	temp_0.90
10810	5.013	the_feel_felt_found+ownership_language	discard	tone_change
10811	4.825	ownership_language+validation_before_solution	discard	swap_the_feel_felt_found_for_validation_before_solution
10812	5.450	the_feel_felt_found	discard	remove_ownership_language
10813	5.550	the_feel_felt_found	discard	crossover
10814	5.425	the_feel_felt_found+ownership_language	discard	crossover
10815	5.450	the_feel_felt_found+emotional_labeling	discard	swap_ownership_language_for_emotional_labeling
10816	5.350	the_feel_felt_found+concrete_next_steps	discard	swap_ownership_language_for_concrete_next_steps
10817	5.138	the_feel_felt_found+ownership_language+genuine_admission	discard	add_genuine_admission
10818	5.425	ownership_language	discard	remove_the_feel_felt_found
10819	5.550	the_feel_felt_found+proactive_extras	discard	swap_ownership_language_for_proactive_extras
10820	5.138	ownership_language+genuine_admission	discard	swap_the_feel_felt_found_for_genuine_admission
10821	5.450	the_feel_felt_found+never_say_calm_down	discard	swap_ownership_language_for_never_say_calm_down
