generation	eq_score	techniques	status	description
13845	4.612	the_feel_felt_found+ownership_language+validation_before_solution	discard	add_validation_before_solution
13846	5.338	the_feel_felt_found+ownership_language	discard	crossover
13847	5.550	the_feel_felt_found	discard	crossover
13848	5.325	the_feel_felt_found+ownership_language	discard	crossover
13849	5.650	the_feel_felt_found+ownership_language+casual_professionalism	discard	add_casual_professionalism
13850	5.450	the_feel_felt_found+ownership_language+strategic_agreement	discard	add_strategic_agreement
13851	5.550	the_feel_felt_found+ownership_language+proactive_extras	discard	add_proactive_extras
13852	5.013	the_feel_felt_found+ownership_language+proactive_extras	discard	add_proactive_extras
13853	5.550	the_feel_felt_found+ownership_language+validation_before_solution	discard	add_validation_before_solution
13854	5.450	the_feel_felt_found+ownership_language+energy_matching	discard	add_energy_matching
13855	5.338	the_feel_felt_found+ownership_language+warmth_injection	discard	add_warmth_injection
13856	5.100	the_feel_felt_found+never_say_calm_down	discard	swap_ownership_language_for_never_say_calm_down
13857	5.450	the_feel_felt_found+ownership_language+genuine_admission	discard	add_genuine_admission
13858	4.925	ownership_language+mirroring	discard	swap_the_feel_felt_found_for_mirroring
13859	5.350	the_feel_felt_found+ownership_language	discard	temp_0.85
13860	5.013	the_feel_felt_found+ownership_language	discard	crossover
13861	5.450	ownership_language+emotional_labeling	discard	swap_the_feel_felt_found_for_emotional_labeling
13862	5.237	the_feel_felt_found+ownership_language+proactive_extras	discard	add_proactive_extras
13863	5.200	the_feel_felt_found+ownership_language+validation_before_solution	discard	add_validation_before_solution
13864	5.338	the_feel_felt_found+ownership_language	discard	tone_change
13865	5.337	the_feel_felt_found+ownership_language	discard	crossover
13866	4.987	the_feel_felt_found+energy_matching	discard	swap_ownership_language_for_energy_matching
13867	5.112	the_feel_felt_found	discard	remove_ownership_language
13868	5.337	the_feel_felt_found+ownership_language+energy_matching	discard	add_energy_matching
13869	5.237	the_feel_felt_found+ownership_language+concrete_next_steps	discard	add_concrete_next_steps
13870	5.525	the_feel_felt_found+never_say_calm_down	discard	swap_ownership_language_for_never_say_calm_down
13871	5.438	the_feel_felt_found+ownership_language	discard	tone_change
13872	5.138	the_feel_felt_found+ownership_language+casual_professionalism	discard	add_casual_professionalism
13873	5.037	the_feel_felt_found+strategic_agreement	discard	swap_ownership_language_for_strategic_agreement
13874	5.238	the_feel_felt_found+ownership_language	discard	crossover
13875	5.350	the_feel_felt_found+ownership_language	discard	tone_change
13876	5.138	the_feel_felt_found+ownership_language	discard	tone_change
13877	4.725	the_feel_felt_found+ownership_language+concrete_next_steps	discard	add_concrete_next_steps
13878	5.425	the_feel_felt_found+ownership_language	discard	crossover
13879	5.025	the_feel_felt_found+ownership_language+validation_before_solution	discard	add_validation_before_solution
13880	5.138	the_feel_felt_found+ownership_language+energy_matching	discard	add_energy_matching
13881	5.138	the_feel_felt_found+ownership_language	discard	tone_change
13882	5.237	ownership_language	discard	crossover
13883	5.325	the_feel_felt_found+ownership_language	discard	tone_change
13884	5.237	the_feel_felt_found+ownership_language	discard	temp_0.85
13885	5.425	the_feel_felt_found+ownership_language+casual_professionalism	discard	add_casual_professionalism
13886	5.200	the_feel_felt_found+ownership_language	discard	temp_0.75
13887	5.550	the_feel_felt_found	discard	remove_ownership_language
13888	5.200	the_feel_felt_found+energy_matching	discard	swap_ownership_language_for_energy_matching
13889	4.925	the_feel_felt_found+ownership_language	discard	tone_change
13890	4.825	ownership_language+genuine_admission	discard	swap_the_feel_felt_found_for_genuine_admission
13891	5.238	the_feel_felt_found+ownership_language+strategic_agreement	discard	add_strategic_agreement
13892	5.225	none	discard	crossover
13893	5.425	ownership_language+concrete_next_steps	discard	swap_the_feel_felt_found_for_concrete_next_steps
13894	5.325	the_feel_felt_found+ownership_language+energy_matching	discard	add_energy_matching
13895	4.925	the_feel_felt_found+ownership_language	discard	crossover
13896	4.725	ownership_language	discard	crossover
13897	5.138	the_feel_felt_found+ownership_language	discard	temp_0.75
13898	5.113	the_feel_felt_found+ownership_language	discard	temp_0.90
13899	4.825	the_feel_felt_found+ownership_language+warmth_injection	discard	add_warmth_injection
13900	5.425	none	discard	crossover
13901	5.550	the_feel_felt_found+ownership_language	discard	temp_0.95
13902	5.200	the_feel_felt_found+ownership_language	discard	crossover
13903	5.212	ownership_language	discard	remove_the_feel_felt_found
13904	5.550	the_feel_felt_found+ownership_language	discard	tone_change
13905	5.350	the_feel_felt_found+ownership_language	discard	tone_change
13906	5.013	the_feel_felt_found+ownership_language	discard	temp_0.95
13907	5.225	the_feel_felt_found+ownership_language	discard	tone_change
13908	5.425	the_feel_felt_found+ownership_language	discard	crossover
13909	5.650	ownership_language+genuine_admission	discard	swap_the_feel_felt_found_for_genuine_admission
13910	5.225	the_feel_felt_found+ownership_language	discard	temp_0.65
13911	4.513	the_feel_felt_found+ownership_language+proactive_extras	discard	add_proactive_extras
13912	5.525	the_feel_felt_found+ownership_language	discard	crossover
13913	5.650	ownership_language	discard	crossover
13914	5.450	the_feel_felt_found+ownership_language	discard	tone_change
13915	5.013	the_feel_felt_found+ownership_language+concrete_next_steps	discard	add_concrete_next_steps
13916	5.138	the_feel_felt_found+ownership_language+warmth_injection	discard	add_warmth_injection
13917	5.350	the_feel_felt_found+ownership_language	discard	tone_change
13918	5.450	the_feel_felt_found	discard	remove_ownership_language
13919	4.513	the_feel_felt_found+ownership_language+personal_touch	discard	add_personal_touch
13920	5.450	the_feel_felt_found+validation_before_solution	discard	swap_ownership_language_for_validation_before_solution
13921	5.450	the_feel_felt_found+ownership_language	discard	tone_change
13922	5.013	the_feel_felt_found+ownership_language	discard	tone_change
13923	5.237	ownership_language	discard	remove_the_feel_felt_found
13924	5.225	the_feel_felt_found+ownership_language	discard	tone_change
13925	4.575	the_feel_felt_found+ownership_language+proactive_extras	discard	add_proactive_extras
13926	5.450	ownership_language	discard	crossover
13927	4.800	the_feel_felt_found+ownership_language	discard	tone_change
13928	5.450	the_feel_felt_found+ownership_language	discard	tone_change
13929	5.200	the_feel_felt_found+ownership_language+energy_matching	discard	add_energy_matching
13930	5.550	the_feel_felt_found+ownership_language	discard	tone_change
13931	5.238	the_feel_felt_found+ownership_language	discard	tone_change
13932	5.237	the_feel_felt_found+ownership_language	discard	tone_change
13933	5.325	the_feel_felt_found+ownership_language+validation_before_solution	discard	add_validation_before_solution
13934	5.237	ownership_language	discard	crossover
13935	5.138	the_feel_felt_found+ownership_language	discard	crossover
13936	5.112	the_feel_felt_found+ownership_language+warmth_injection	discard	add_warmth_injection
13937	5.450	the_feel_felt_found+ownership_language+emotional_labeling	discard	add_emotional_labeling
13938	5.425	the_feel_felt_found	discard	remove_ownership_language
13939	5.325	ownership_language+proactive_extras	discard	swap_the_feel_felt_found_for_proactive_extras
13940	5.325	the_feel_felt_found	discard	crossover
13941	5.450	the_feel_felt_found+ownership_language	discard	crossover
13942	5.450	the_feel_felt_found+ownership_language+casual_professionalism	discard	add_casual_professionalism
13943	5.425	the_feel_felt_found	discard	remove_ownership_language
13944	5.112	the_feel_felt_found+strategic_agreement	discard	swap_ownership_language_for_strategic_agreement
13945	5.425	the_feel_felt_found+ownership_language	discard	temp_0.75
13946	4.825	the_feel_felt_found+ownership_language+proactive_extras	discard	add_proactive_extras
13947	5.138	ownership_language+energy_matching	discard	swap_the_feel_felt_found_for_energy_matching
13948	5.237	the_feel_felt_found+ownership_language+genuine_admission	discard	add_genuine_admission
13949	5.550	the_feel_felt_found+ownership_language	discard	tone_change
13950	5.138	the_feel_felt_found+ownership_language+energy_matching	discard	add_energy_matching
13951	5.425	ownership_language+proactive_extras	discard	swap_the_feel_felt_found_for_proactive_extras
13952	5.550	the_feel_felt_found+casual_professionalism	discard	swap_ownership_language_for_casual_professionalism
13953	5.337	the_feel_felt_found+strategic_agreement	discard	swap_ownership_language_for_strategic_agreement
13954	5.013	the_feel_felt_found+ownership_language+validation_before_solution	discard	add_validation_before_solution
13955	5.237	the_feel_felt_found+ownership_language	discard	temp_0.90
13956	4.625	the_feel_felt_found+ownership_language	discard	tone_change
13957	5.338	the_feel_felt_found+ownership_language	discard	temp_0.75
13958	5.325	ownership_language	discard	remove_the_feel_felt_found
13959	5.237	the_feel_felt_found+validation_before_solution	discard	swap_ownership_language_for_validation_before_solution
13960	5.013	the_feel_felt_found+ownership_language	discard	tone_change
13961	4.763	the_feel_felt_found+ownership_language	discard	tone_change
13962	5.013	the_feel_felt_found+ownership_language+proactive_extras	discard	add_proactive_extras
13963	4.900	the_feel_felt_found+never_say_calm_down	discard	swap_ownership_language_for_never_say_calm_down
13964	5.450	the_feel_felt_found+ownership_language+mirroring	discard	add_mirroring
13965	5.112	the_feel_felt_found+ownership_language	discard	tone_change
13966	5.013	the_feel_felt_found+ownership_language	discard	tone_change
13967	5.425	the_feel_felt_found+ownership_language	discard	tone_change
13968	5.350	the_feel_felt_found+ownership_language	discard	temp_0.85
13969	4.900	the_feel_felt_found+ownership_language	discard	tone_change
13970	5.350	the_feel_felt_found+ownership_language	discard	tone_change
13971	5.550	the_feel_felt_found+ownership_language	discard	temp_0.90
13972	4.825	ownership_language+proactive_extras	discard	swap_the_feel_felt_found_for_proactive_extras
13973	5.112	the_feel_felt_found+ownership_language	discard	tone_change
13974	5.450	the_feel_felt_found+ownership_language+personal_touch	discard	add_personal_touch
13975	5.013	the_feel_felt_found+ownership_language	discard	tone_change
13976	5.450	the_feel_felt_found	discard	crossover
13977	5.300	the_feel_felt_found+ownership_language	discard	tone_change
13978	5.450	ownership_language+concrete_next_steps	discard	swap_the_feel_felt_found_for_concrete_next_steps
13979	5.138	the_feel_felt_found+ownership_language+warmth_injection	discard	add_warmth_injection
13980	5.225	ownership_language	discard	remove_the_feel_felt_found
13981	5.750	none	discard	crossover
13982	5.237	ownership_language+emotional_labeling	discard	swap_the_feel_felt_found_for_emotional_labeling
13983	5.450	the_feel_felt_found+energy_matching	discard	swap_ownership_language_for_energy_matching
13984	5.138	the_feel_felt_found+ownership_language	discard	crossover
13985	5.325	the_feel_felt_found+ownership_language+energy_matching	discard	add_energy_matching
13986	5.450	the_feel_felt_found	discard	crossover
13987	5.450	the_feel_felt_found+ownership_language	discard	tone_change
13988	4.825	ownership_language	discard	remove_the_feel_felt_found
13989	5.237	the_feel_felt_found+ownership_language+validation_before_solution	discard	add_validation_before_solution
13990	5.225	the_feel_felt_found+ownership_language	discard	crossover
13991	5.325	ownership_language	discard	remove_the_feel_felt_found
13992	5.450	the_feel_felt_found	discard	remove_ownership_language
13993	5.237	the_feel_felt_found+ownership_language	discard	temp_0.95
13994	5.237	the_feel_felt_found	discard	remove_ownership_language
13995	5.237	the_feel_felt_found+ownership_language	discard	crossover
13996	5.350	the_feel_felt_found+ownership_language	discard	crossover
13997	5.213	the_feel_felt_found+ownership_language+personal_touch	discard	add_personal_touch
13998	5.113	the_feel_felt_found+ownership_language+casual_professionalism	discard	add_casual_professionalism
13999	5.450	the_feel_felt_found+ownership_language+never_say_calm_down	discard	add_never_say_calm_down
14000	5.037	the_feel_felt_found+ownership_language+never_say_calm_down	discard	add_never_say_calm_down
14001	5.237	the_feel_felt_found+ownership_language+casual_professionalism	discard	add_casual_professionalism
14002	5.200	the_feel_felt_found+ownership_language+emotional_labeling	discard	add_emotional_labeling
14003	4.725	the_feel_felt_found+ownership_language	discard	tone_change
14004	5.350	the_feel_felt_found+validation_before_solution	discard	swap_ownership_language_for_validation_before_solution
14005	5.450	the_feel_felt_found+ownership_language+personal_touch	discard	add_personal_touch
14006	5.450	the_feel_felt_found+ownership_language	discard	crossover
14007	5.013	the_feel_felt_found+ownership_language	discard	tone_change
14008	4.700	the_feel_felt_found+ownership_language	discard	tone_change
14009	5.450	the_feel_felt_found+ownership_language	discard	crossover
14010	5.237	ownership_language+personal_touch	discard	swap_the_feel_felt_found_for_personal_touch
14011	4.725	the_feel_felt_found+ownership_language+concrete_next_steps	discard	add_concrete_next_steps
14012	5.238	the_feel_felt_found+ownership_language+proactive_extras	discard	add_proactive_extras
14013	5.425	the_feel_felt_found+ownership_language	discard	tone_change
14014	4.700	the_feel_felt_found+ownership_language+genuine_admission	discard	add_genuine_admission
14015	5.325	the_feel_felt_found+ownership_language	discard	crossover
14016	5.237	the_feel_felt_found+ownership_language	discard	tone_change
14017	5.025	ownership_language	discard	crossover
14018	5.100	the_feel_felt_found+ownership_language+concrete_next_steps	discard	add_concrete_next_steps
14019	5.112	the_feel_felt_found+ownership_language	discard	temp_0.90
14020	5.650	the_feel_felt_found+ownership_language+mirroring	discard	add_mirroring
14021	5.450	ownership_language	discard	remove_the_feel_felt_found
14022	5.300	the_feel_felt_found	discard	crossover
14023	5.013	the_feel_felt_found+ownership_language	discard	tone_change
14024	5.237	the_feel_felt_found+casual_professionalism	discard	swap_ownership_language_for_casual_professionalism
14025	4.825	the_feel_felt_found+ownership_language	discard	tone_change
14026	5.138	the_feel_felt_found+ownership_language	discard	crossover
14027	5.138	the_feel_felt_found+ownership_language	discard	temp_0.85
14028	5.550	the_feel_felt_found+casual_professionalism	discard	swap_ownership_language_for_casual_professionalism
14029	5.138	the_feel_felt_found+never_say_calm_down	discard	swap_ownership_language_for_never_say_calm_down
14030	5.450	the_feel_felt_found+concrete_next_steps	discard	swap_ownership_language_for_concrete_next_steps
14031	5.237	ownership_language+energy_matching	discard	swap_the_feel_felt_found_for_energy_matching
14032	5.113	the_feel_felt_found+ownership_language+proactive_extras	discard	add_proactive_extras
14033	5.138	the_feel_felt_found	discard	crossover
14034	5.350	the_feel_felt_found+ownership_language+energy_matching	discard	add_energy_matching
14035	5.550	the_feel_felt_found+ownership_language	discard	crossover
14036	5.450	ownership_language	discard	remove_the_feel_felt_found
14037	5.425	ownership_language+concrete_next_steps	discard	swap_the_feel_felt_found_for_concrete_next_steps
14038	5.300	the_feel_felt_found+ownership_language	discard	tone_change
14039	5.200	the_feel_felt_found	discard	crossover
14040	5.450	the_feel_felt_found+ownership_language	discard	tone_change
14041	4.700	the_feel_felt_found	discard	remove_ownership_language
14042	5.650	the_feel_felt_found+ownership_language	discard	temp_0.70
14043	5.013	ownership_language+casual_professionalism	discard	swap_the_feel_felt_found_for_casual_professionalism
14044	5.113	ownership_language	discard	remove_the_feel_felt_found
14045	5.337	the_feel_felt_found+ownership_language+mirroring	discard	add_mirroring
14046	5.112	the_feel_felt_found+ownership_language+validation_before_solution	discard	add_validation_before_solution
14047	5.350	the_feel_felt_found+genuine_admission	discard	swap_ownership_language_for_genuine_admission
14048	5.338	the_feel_felt_found+ownership_language	discard	crossover
14049	5.138	ownership_language	discard	remove_the_feel_felt_found
14050	5.450	the_feel_felt_found+ownership_language	discard	temp_0.90
14051	5.237	the_feel_felt_found+ownership_language+validation_before_solution	discard	add_validation_before_solution
14052	5.325	the_feel_felt_found+ownership_language+casual_professionalism	discard	add_casual_professionalism
14053	5.138	ownership_language+mirroring	discard	swap_the_feel_felt_found_for_mirroring
14054	5.212	the_feel_felt_found+ownership_language	discard	temp_0.95
14055	5.138	the_feel_felt_found+ownership_language	discard	crossover
14056	5.550	none	discard	crossover
14057	5.325	the_feel_felt_found+ownership_language	discard	crossover
14058	5.237	the_feel_felt_found	discard	remove_ownership_language
14059	5.138	the_feel_felt_found+ownership_language+genuine_admission	discard	add_genuine_admission
14060	4.825	none	discard	crossover
14061	5.300	the_feel_felt_found	discard	remove_ownership_language
14062	5.525	the_feel_felt_found+ownership_language	discard	temp_0.90
14063	5.425	the_feel_felt_found+ownership_language	discard	temp_0.70
14064	5.138	the_feel_felt_found+ownership_language+validation_before_solution	discard	add_validation_before_solution
14065	5.013	ownership_language	discard	remove_the_feel_felt_found
14066	5.013	the_feel_felt_found+ownership_language+mirroring	discard	add_mirroring
14067	5.013	the_feel_felt_found+ownership_language	discard	temp_0.95
14068	5.450	the_feel_felt_found+proactive_extras	discard	swap_ownership_language_for_proactive_extras
14069	5.350	the_feel_felt_found+ownership_language+never_say_calm_down	discard	add_never_say_calm_down
14070	5.325	the_feel_felt_found+ownership_language	discard	tone_change
14071	5.550	the_feel_felt_found+ownership_language	discard	tone_change
14072	5.650	ownership_language+strategic_agreement	discard	swap_the_feel_felt_found_for_strategic_agreement
14073	5.338	the_feel_felt_found+ownership_language+energy_matching	discard	add_energy_matching
14074	4.987	the_feel_felt_found+ownership_language	discard	crossover
14075	5.237	ownership_language	discard	crossover
14076	5.325	the_feel_felt_found+ownership_language+strategic_agreement	discard	add_strategic_agreement
14077	5.013	the_feel_felt_found+ownership_language	discard	crossover
14078	5.100	the_feel_felt_found+ownership_language+proactive_extras	discard	add_proactive_extras
14079	5.138	the_feel_felt_found+ownership_language+energy_matching	discard	add_energy_matching
14080	5.138	the_feel_felt_found+ownership_language+casual_professionalism	discard	add_casual_professionalism
14081	5.325	ownership_language+warmth_injection	discard	swap_the_feel_felt_found_for_warmth_injection
14082	5.325	the_feel_felt_found+ownership_language	discard	tone_change
14083	4.925	ownership_language+casual_professionalism	discard	swap_the_feel_felt_found_for_casual_professionalism
14084	5.113	ownership_language+warmth_injection	discard	swap_the_feel_felt_found_for_warmth_injection
14085	5.550	the_feel_felt_found+ownership_language+energy_matching	discard	add_energy_matching
14086	4.925	the_feel_felt_found+ownership_language	discard	crossover
14087	5.138	the_feel_felt_found+ownership_language	discard	tone_change
14088	5.138	the_feel_felt_found+ownership_language+strategic_agreement	discard	add_strategic_agreement
14089	4.713	the_feel_felt_found+ownership_language	discard	tone_change
14090	4.487	the_feel_felt_found+ownership_language+mirroring	discard	add_mirroring
14091	5.550	the_feel_felt_found+ownership_language	discard	crossover
14092	4.888	ownership_language	discard	crossover
14093	5.013	the_feel_felt_found+ownership_language+validation_before_solution	discard	add_validation_before_solution
14094	5.325	the_feel_felt_found+ownership_language+validation_before_solution	discard	add_validation_before_solution
14095	5.013	the_feel_felt_found+ownership_language	discard	crossover
14096	4.825	the_feel_felt_found+ownership_language+emotional_labeling	discard	add_emotional_labeling
14097	5.525	the_feel_felt_found+ownership_language	discard	tone_change
14098	5.013	the_feel_felt_found+ownership_language+genuine_admission	discard	add_genuine_admission
14099	5.237	the_feel_felt_found	discard	remove_ownership_language
14100	4.825	the_feel_felt_found+ownership_language+validation_before_solution	discard	add_validation_before_solution
14101	5.550	the_feel_felt_found+strategic_agreement	discard	swap_ownership_language_for_strategic_agreement
14102	5.525	the_feel_felt_found+ownership_language	discard	tone_change
14103	5.425	ownership_language+mirroring	discard	swap_the_feel_felt_found_for_mirroring
14104	5.425	ownership_language+personal_touch	discard	swap_the_feel_felt_found_for_personal_touch
14105	5.013	the_feel_felt_found+ownership_language	discard	tone_change
14106	5.138	the_feel_felt_found	discard	crossover
14107	5.138	the_feel_felt_found+ownership_language	discard	tone_change
14108	5.550	the_feel_felt_found	discard	crossover
14109	5.112	ownership_language+strategic_agreement	discard	swap_the_feel_felt_found_for_strategic_agreement
14110	5.550	the_feel_felt_found	discard	crossover
