generation	eq_score	techniques	status	description
1147	5.650	the_feel_felt_found	discard	crossover
1148	5.450	the_feel_felt_found+ownership_language	discard	temp_0.65
1149	5.137	the_feel_felt_found+ownership_language+proactive_extras	discard	add_proactive_extras
1150	4.725	the_feel_felt_found+ownership_language+genuine_admission	discard	add_genuine_admission
1151	5.425	the_feel_felt_found+emotional_labeling	discard	swap_ownership_language_for_emotional_labeling
1152	5.650	the_feel_felt_found+ownership_language+proactive_extras	discard	add_proactive_extras
1153	5.300	the_feel_felt_found+ownership_language	discard	temp_0.85
1154	5.112	ownership_language	discard	crossover
1155	5.450	ownership_language	discard	crossover
1156	5.550	the_feel_felt_found+ownership_language+mirroring	discard	add_mirroring
1157	4.825	the_feel_felt_found+proactive_extras	discard	swap_ownership_language_for_proactive_extras
1158	5.037	the_feel_felt_found+ownership_language+personal_touch	discard	add_personal_touch
1159	5.450	ownership_language	discard	crossover
1160	5.550	the_feel_felt_found+ownership_language+never_say_calm_down	discard	add_never_say_calm_down
1161	5.013	the_feel_felt_found+ownership_language	discard	temp_0.95
1162	5.550	the_feel_felt_found+ownership_language	discard	temp_0.90
1163	4.925	the_feel_felt_found+ownership_language+proactive_extras	discard	add_proactive_extras
1164	4.925	the_feel_felt_found	discard	crossover
1165	5.325	ownership_language	discard	remove_the_feel_felt_found
1166	5.013	the_feel_felt_found+ownership_language+concrete_next_steps	discard	add_concrete_next_steps
1167	5.138	the_feel_felt_found+ownership_language	discard	temp_0.65
1168	5.325	the_feel_felt_found+ownership_language	discard	temp_0.95
1169	5.200	ownership_language	discard	crossover
1170	5.138	the_feel_felt_found+ownership_language	discard	tone_change
1171	5.138	the_feel_felt_found+energy_matching	discard	swap_ownership_language_for_energy_matching
1172	4.888	the_feel_felt_found+ownership_language	discard	tone_change
1173	5.325	the_feel_felt_found+ownership_language	discard	tone_change
1174	5.200	the_feel_felt_found+ownership_language	discard	temp_0.70
1175	5.113	the_feel_felt_found	discard	remove_ownership_language
1176	5.112	the_feel_felt_found+ownership_language+proactive_extras	discard	add_proactive_extras
1177	5.400	the_feel_felt_found+ownership_language+proactive_extras	discard	add_proactive_extras
1178	5.013	the_feel_felt_found+ownership_language	discard	tone_change
1179	5.338	the_feel_felt_found+never_say_calm_down	discard	swap_ownership_language_for_never_say_calm_down
1180	5.325	the_feel_felt_found+ownership_language	discard	tone_change
1181	5.238	the_feel_felt_found+ownership_language+genuine_admission	discard	add_genuine_admission
1182	5.325	the_feel_felt_found+ownership_language	discard	temp_0.95
1183	5.237	the_feel_felt_found+ownership_language+mirroring	discard	add_mirroring
1184	5.037	ownership_language+personal_touch	discard	swap_the_feel_felt_found_for_personal_touch
1185	5.550	the_feel_felt_found+warmth_injection	discard	swap_ownership_language_for_warmth_injection
1186	5.013	ownership_language+genuine_admission	discard	swap_the_feel_felt_found_for_genuine_admission
1187	5.112	the_feel_felt_found+ownership_language+validation_before_solution	discard	add_validation_before_solution
1188	5.425	the_feel_felt_found+ownership_language	discard	temp_0.75
1189	5.325	the_feel_felt_found+ownership_language+validation_before_solution	discard	add_validation_before_solution
1190	5.138	the_feel_felt_found	discard	remove_ownership_language
1191	5.112	the_feel_felt_found+ownership_language+energy_matching	discard	add_energy_matching
1192	5.250	the_feel_felt_found+genuine_admission	discard	swap_ownership_language_for_genuine_admission
1193	5.425	the_feel_felt_found	discard	remove_ownership_language
1194	5.450	the_feel_felt_found+strategic_agreement	discard	swap_ownership_language_for_strategic_agreement
1195	5.112	the_feel_felt_found+ownership_language	discard	tone_change
1196	4.912	the_feel_felt_found	discard	remove_ownership_language
1197	5.450	ownership_language+casual_professionalism	discard	swap_the_feel_felt_found_for_casual_professionalism
1198	5.450	ownership_language+concrete_next_steps	discard	swap_the_feel_felt_found_for_concrete_next_steps
1199	5.325	ownership_language	discard	crossover
1200	5.337	the_feel_felt_found+ownership_language+never_say_calm_down	discard	add_never_say_calm_down
1201	5.550	the_feel_felt_found+ownership_language	discard	temp_0.95
1202	5.337	the_feel_felt_found+ownership_language+energy_matching	discard	add_energy_matching
1203	5.225	the_feel_felt_found+ownership_language	discard	temp_0.75
1204	5.450	the_feel_felt_found+ownership_language	discard	temp_0.95
1205	5.425	the_feel_felt_found	discard	remove_ownership_language
1206	5.338	the_feel_felt_found+emotional_labeling	discard	swap_ownership_language_for_emotional_labeling
1207	5.325	the_feel_felt_found+ownership_language	discard	tone_change
1208	5.325	ownership_language+never_say_calm_down	discard	swap_the_feel_felt_found_for_never_say_calm_down
1209	5.450	the_feel_felt_found+ownership_language+never_say_calm_down	discard	add_never_say_calm_down
1210	5.650	the_feel_felt_found+ownership_language+personal_touch	discard	add_personal_touch
1211	5.450	the_feel_felt_found+ownership_language	discard	tone_change
1212	5.013	the_feel_felt_found+ownership_language	discard	tone_change
1213	5.137	none	discard	crossover
1214	5.237	ownership_language	discard	crossover
1215	5.650	the_feel_felt_found+ownership_language	discard	tone_change
1216	5.138	the_feel_felt_found+emotional_labeling	discard	swap_ownership_language_for_emotional_labeling
1217	5.013	ownership_language+strategic_agreement	discard	swap_the_feel_felt_found_for_strategic_agreement
1218	5.238	the_feel_felt_found+ownership_language	discard	temp_0.65
1219	5.037	the_feel_felt_found+ownership_language	discard	temp_0.65
1220	5.325	ownership_language+casual_professionalism	discard	swap_the_feel_felt_found_for_casual_professionalism
1221	5.138	the_feel_felt_found+ownership_language	discard	temp_0.75
1222	5.325	the_feel_felt_found+ownership_language	discard	temp_0.70
1223	5.325	the_feel_felt_found	discard	remove_ownership_language
1224	5.450	the_feel_felt_found+ownership_language	discard	crossover
1225	5.425	the_feel_felt_found+ownership_language+mirroring	discard	add_mirroring
1226	5.650	the_feel_felt_found+ownership_language+energy_matching	discard	add_energy_matching
1227	5.013	the_feel_felt_found	discard	remove_ownership_language
1228	4.825	the_feel_felt_found	discard	remove_ownership_language
1229	5.325	the_feel_felt_found+ownership_language	discard	tone_change
1230	5.138	ownership_language	discard	crossover
1231	5.113	none	discard	crossover
1232	5.138	the_feel_felt_found	discard	remove_ownership_language
1233	5.350	the_feel_felt_found+ownership_language	discard	temp_0.95
1234	5.425	ownership_language	discard	remove_the_feel_felt_found
1235	5.037	the_feel_felt_found+ownership_language+concrete_next_steps	discard	add_concrete_next_steps
1236	5.350	the_feel_felt_found+ownership_language	discard	tone_change
1237	5.200	the_feel_felt_found+energy_matching	discard	swap_ownership_language_for_energy_matching
1238	5.325	ownership_language	discard	crossover
1239	5.450	the_feel_felt_found+ownership_language	discard	crossover
1240	5.650	the_feel_felt_found+ownership_language	discard	temp_0.70
1241	4.925	the_feel_felt_found+ownership_language+genuine_admission	discard	add_genuine_admission
1242	5.650	the_feel_felt_found+ownership_language	discard	temp_0.95
1243	5.550	the_feel_felt_found+ownership_language+strategic_agreement	discard	add_strategic_agreement
1244	5.138	ownership_language	discard	remove_the_feel_felt_found
1245	5.450	ownership_language	discard	crossover
1246	5.100	the_feel_felt_found+ownership_language	discard	temp_0.85
1247	5.450	the_feel_felt_found+ownership_language	discard	tone_change
1248	5.112	the_feel_felt_found	discard	crossover
1249	4.925	the_feel_felt_found	discard	remove_ownership_language
1250	5.238	ownership_language	discard	crossover
1251	5.450	the_feel_felt_found+ownership_language+strategic_agreement	discard	add_strategic_agreement
1252	5.450	the_feel_felt_found+ownership_language	discard	tone_change
1253	5.237	the_feel_felt_found+ownership_language	discard	crossover
1254	5.550	the_feel_felt_found+ownership_language+casual_professionalism	discard	add_casual_professionalism
1255	4.825	the_feel_felt_found+proactive_extras	discard	swap_ownership_language_for_proactive_extras
1256	5.450	the_feel_felt_found+ownership_language	discard	tone_change
1257	5.325	the_feel_felt_found+ownership_language+strategic_agreement	discard	add_strategic_agreement
1258	5.112	the_feel_felt_found+ownership_language	discard	temp_0.95
1259	5.213	ownership_language	discard	remove_the_feel_felt_found
1260	5.650	ownership_language+strategic_agreement	discard	swap_the_feel_felt_found_for_strategic_agreement
1261	5.425	the_feel_felt_found+ownership_language	discard	temp_0.95
1262	5.137	the_feel_felt_found+ownership_language+concrete_next_steps	discard	add_concrete_next_steps
1263	5.013	the_feel_felt_found+ownership_language	discard	crossover
1264	5.338	ownership_language	discard	remove_the_feel_felt_found
1265	5.138	the_feel_felt_found+ownership_language	discard	temp_0.65
1266	5.450	ownership_language+validation_before_solution	discard	swap_the_feel_felt_found_for_validation_before_solution
1267	5.625	ownership_language	discard	crossover
1268	5.450	the_feel_felt_found+ownership_language	discard	tone_change
1269	5.025	the_feel_felt_found+emotional_labeling	discard	swap_ownership_language_for_emotional_labeling
1270	5.325	the_feel_felt_found+ownership_language+personal_touch	discard	add_personal_touch
1271	5.325	the_feel_felt_found	discard	crossover
1272	5.138	the_feel_felt_found+ownership_language+personal_touch	discard	add_personal_touch
1273	5.550	the_feel_felt_found+ownership_language	discard	temp_0.90
1274	5.113	the_feel_felt_found+ownership_language	discard	crossover
1275	5.325	the_feel_felt_found+ownership_language	discard	crossover
1276	5.350	the_feel_felt_found+ownership_language+energy_matching	discard	add_energy_matching
1277	5.025	the_feel_felt_found+ownership_language	discard	crossover
1278	5.237	the_feel_felt_found+concrete_next_steps	discard	swap_ownership_language_for_concrete_next_steps
1279	4.888	ownership_language+never_say_calm_down	discard	swap_the_feel_felt_found_for_never_say_calm_down
1280	5.112	ownership_language	discard	remove_the_feel_felt_found
1281	5.237	the_feel_felt_found+ownership_language	discard	tone_change
1282	5.138	the_feel_felt_found+personal_touch	discard	swap_ownership_language_for_personal_touch
1283	5.237	ownership_language+emotional_labeling	discard	swap_the_feel_felt_found_for_emotional_labeling
1284	5.350	the_feel_felt_found+ownership_language+concrete_next_steps	discard	add_concrete_next_steps
1285	5.225	the_feel_felt_found+ownership_language	discard	temp_0.85
1286	5.425	ownership_language+validation_before_solution	discard	swap_the_feel_felt_found_for_validation_before_solution
1287	5.550	the_feel_felt_found+ownership_language+casual_professionalism	discard	add_casual_professionalism
1288	5.325	the_feel_felt_found+ownership_language	discard	temp_0.90
1289	5.238	the_feel_felt_found+ownership_language	discard	tone_change
1290	5.450	the_feel_felt_found+never_say_calm_down	discard	swap_ownership_language_for_never_say_calm_down
1291	5.350	the_feel_felt_found+ownership_language	discard	temp_0.90
1292	5.225	the_feel_felt_found+emotional_labeling	discard	swap_ownership_language_for_emotional_labeling
1293	5.438	ownership_language	discard	crossover
1294	5.550	ownership_language	discard	remove_the_feel_felt_found
1295	5.013	the_feel_felt_found+ownership_language	discard	temp_0.95
1296	5.038	the_feel_felt_found+strategic_agreement	discard	swap_ownership_language_for_strategic_agreement
1297	5.338	the_feel_felt_found+ownership_language+strategic_agreement	discard	add_strategic_agreement
1298	5.550	the_feel_felt_found+ownership_language	discard	temp_0.65
1299	4.725	the_feel_felt_found	discard	remove_ownership_language
1300	5.450	the_feel_felt_found+ownership_language+warmth_injection	discard	add_warmth_injection
1301	5.138	the_feel_felt_found+ownership_language+strategic_agreement	discard	add_strategic_agreement
1302	5.450	the_feel_felt_found+ownership_language	discard	crossover
1303	4.800	the_feel_felt_found+ownership_language	discard	tone_change
1304	5.450	the_feel_felt_found+ownership_language	discard	temp_0.85
1305	5.238	the_feel_felt_found	discard	remove_ownership_language
1306	5.425	the_feel_felt_found+validation_before_solution	discard	swap_ownership_language_for_validation_before_solution
1307	5.650	ownership_language+energy_matching	discard	swap_the_feel_felt_found_for_energy_matching
1308	5.550	the_feel_felt_found+ownership_language	discard	tone_change
1309	5.325	the_feel_felt_found+ownership_language	discard	tone_change
1310	4.800	the_feel_felt_found+ownership_language	discard	crossover
1311	5.138	the_feel_felt_found+ownership_language+energy_matching	discard	add_energy_matching
1312	5.238	ownership_language+energy_matching	discard	swap_the_feel_felt_found_for_energy_matching
1313	5.037	the_feel_felt_found+ownership_language+proactive_extras	discard	add_proactive_extras
1314	5.025	the_feel_felt_found+ownership_language	discard	tone_change
1315	5.338	the_feel_felt_found+ownership_language+personal_touch	discard	add_personal_touch
1316	5.450	the_feel_felt_found+ownership_language+personal_touch	discard	add_personal_touch
1317	5.650	the_feel_felt_found+ownership_language	discard	tone_change
1318	5.450	the_feel_felt_found+ownership_language	discard	tone_change
1319	5.013	the_feel_felt_found+ownership_language+concrete_next_steps	discard	add_concrete_next_steps
1320	5.225	the_feel_felt_found+ownership_language+concrete_next_steps	discard	add_concrete_next_steps
1321	5.525	the_feel_felt_found+ownership_language	discard	tone_change
1322	5.450	the_feel_felt_found+ownership_language+strategic_agreement	discard	add_strategic_agreement
1323	5.550	the_feel_felt_found+ownership_language	discard	crossover
1324	5.650	the_feel_felt_found+ownership_language	discard	temp_0.90
1325	5.425	the_feel_felt_found	discard	crossover
1326	4.925	the_feel_felt_found+ownership_language+mirroring	discard	add_mirroring
1327	4.725	ownership_language	discard	crossover
1328	5.237	the_feel_felt_found+ownership_language+emotional_labeling	discard	add_emotional_labeling
1329	5.400	the_feel_felt_found+ownership_language	discard	temp_0.70
1330	5.237	ownership_language	discard	crossover
1331	5.200	the_feel_felt_found+ownership_language	discard	crossover
1332	5.000	ownership_language+strategic_agreement	discard	swap_the_feel_felt_found_for_strategic_agreement
1333	5.325	ownership_language+emotional_labeling	discard	swap_the_feel_felt_found_for_emotional_labeling
1334	5.138	the_feel_felt_found+never_say_calm_down	discard	swap_ownership_language_for_never_say_calm_down
1335	5.138	the_feel_felt_found+ownership_language+emotional_labeling	discard	add_emotional_labeling
1336	4.938	the_feel_felt_found+personal_touch	discard	swap_ownership_language_for_personal_touch
1337	5.013	the_feel_felt_found+ownership_language	discard	crossover
1338	5.237	the_feel_felt_found+ownership_language+never_say_calm_down	discard	add_never_say_calm_down
1339	4.725	the_feel_felt_found+ownership_language	discard	temp_0.65
1340	5.350	the_feel_felt_found+ownership_language+mirroring	discard	add_mirroring
1341	5.550	ownership_language+genuine_admission	discard	swap_the_feel_felt_found_for_genuine_admission
1342	5.138	the_feel_felt_found+ownership_language	discard	crossover
1343	5.450	the_feel_felt_found+ownership_language	discard	temp_0.95
1344	5.325	the_feel_felt_found+ownership_language+concrete_next_steps	discard	add_concrete_next_steps
1345	5.325	the_feel_felt_found+ownership_language+proactive_extras	discard	add_proactive_extras
1346	4.412	the_feel_felt_found+ownership_language	discard	temp_0.75
1347	5.113	the_feel_felt_found+ownership_language+proactive_extras	discard	add_proactive_extras
1348	5.237	the_feel_felt_found+ownership_language	discard	crossover
1349	5.225	the_feel_felt_found+strategic_agreement	discard	swap_ownership_language_for_strategic_agreement
1350	4.825	the_feel_felt_found+validation_before_solution	discard	swap_ownership_language_for_validation_before_solution
1351	5.650	the_feel_felt_found+ownership_language	discard	temp_0.70
1352	5.237	the_feel_felt_found+ownership_language+genuine_admission	discard	add_genuine_admission
1353	4.612	ownership_language	discard	crossover
1354	5.325	the_feel_felt_found+ownership_language	discard	crossover
1355	5.450	the_feel_felt_found+ownership_language+energy_matching	discard	add_energy_matching
1356	5.450	the_feel_felt_found+ownership_language	discard	tone_change
1357	5.013	the_feel_felt_found+ownership_language	discard	crossover
1358	4.888	the_feel_felt_found+ownership_language	discard	tone_change
1359	5.237	the_feel_felt_found+ownership_language+emotional_labeling	discard	add_emotional_labeling
1360	5.450	the_feel_felt_found+ownership_language	discard	tone_change
1361	5.000	the_feel_felt_found+ownership_language+mirroring	discard	add_mirroring
1362	5.337	the_feel_felt_found+ownership_language	discard	tone_change
1363	5.013	ownership_language	discard	crossover
1364	5.325	the_feel_felt_found+ownership_language	discard	tone_change
1365	5.013	the_feel_felt_found+concrete_next_steps	discard	swap_ownership_language_for_concrete_next_steps
1366	5.075	the_feel_felt_found+ownership_language+validation_before_solution	discard	add_validation_before_solution
1367	5.112	the_feel_felt_found	discard	crossover
1368	5.338	the_feel_felt_found+ownership_language+energy_matching	discard	add_energy_matching
1369	5.550	the_feel_felt_found+ownership_language+emotional_labeling	discard	add_emotional_labeling
1370	5.550	the_feel_felt_found+ownership_language	discard	temp_0.95
1371	5.550	the_feel_felt_found+ownership_language	discard	tone_change
1372	4.925	the_feel_felt_found+ownership_language	discard	crossover
1373	5.025	the_feel_felt_found+ownership_language	discard	tone_change
1374	5.325	the_feel_felt_found+ownership_language	discard	crossover
1375	5.025	the_feel_felt_found+ownership_language	discard	tone_change
1376	5.550	the_feel_felt_found+ownership_language+proactive_extras	discard	add_proactive_extras
1377	4.825	the_feel_felt_found	discard	crossover
1378	5.225	the_feel_felt_found+ownership_language	discard	temp_0.65
1379	5.550	none	discard	crossover
1380	5.037	the_feel_felt_found+emotional_labeling	discard	swap_ownership_language_for_emotional_labeling
1381	5.138	the_feel_felt_found	discard	crossover
1382	4.713	ownership_language	discard	crossover
1383	5.338	the_feel_felt_found+ownership_language	discard	tone_change
1384	5.237	the_feel_felt_found+ownership_language	discard	tone_change
1385	5.450	the_feel_felt_found+personal_touch	discard	swap_ownership_language_for_personal_touch
1386	5.425	the_feel_felt_found+ownership_language+never_say_calm_down	discard	add_never_say_calm_down
1387	5.450	the_feel_felt_found+validation_before_solution	discard	swap_ownership_language_for_validation_before_solution
1388	5.550	the_feel_felt_found+ownership_language+emotional_labeling	discard	add_emotional_labeling
1389	5.025	the_feel_felt_found+ownership_language	discard	tone_change
1390	5.112	the_feel_felt_found+ownership_language+casual_professionalism	discard	add_casual_professionalism
1391	5.013	the_feel_felt_found+ownership_language+strategic_agreement	discard	add_strategic_agreement
1392	5.550	the_feel_felt_found+ownership_language	discard	tone_change
1393	5.138	the_feel_felt_found+ownership_language+emotional_labeling	discard	add_emotional_labeling
1394	5.550	the_feel_felt_found	discard	crossover
1395	5.237	ownership_language	discard	remove_the_feel_felt_found
1396	5.237	the_feel_felt_found+ownership_language	discard	tone_change
1397	5.550	the_feel_felt_found+ownership_language	discard	tone_change
1398	4.825	the_feel_felt_found+ownership_language+genuine_admission	discard	add_genuine_admission
1399	5.450	the_feel_felt_found+concrete_next_steps	discard	swap_ownership_language_for_concrete_next_steps
1400	5.425	the_feel_felt_found+ownership_language	discard	tone_change
1401	5.025	the_feel_felt_found+proactive_extras	discard	swap_ownership_language_for_proactive_extras
1402	4.825	the_feel_felt_found+ownership_language	discard	tone_change
1403	5.325	the_feel_felt_found+ownership_language	discard	tone_change
1404	5.325	the_feel_felt_found+ownership_language	discard	temp_0.75
1405	5.138	the_feel_felt_found+ownership_language	discard	crossover
1406	5.013	the_feel_felt_found+ownership_language+casual_professionalism	discard	add_casual_professionalism
1407	4.300	the_feel_felt_found+ownership_language+warmth_injection	discard	add_warmth_injection
1408	4.713	the_feel_felt_found	discard	crossover
1409	5.450	the_feel_felt_found+never_say_calm_down	discard	swap_ownership_language_for_never_say_calm_down
1410	5.238	the_feel_felt_found+ownership_language	discard	crossover
1411	5.325	ownership_language	discard	remove_the_feel_felt_found
1412	5.550	the_feel_felt_found+ownership_language+personal_touch	discard	add_personal_touch
1413	5.200	the_feel_felt_found+ownership_language	discard	tone_change
1414	5.525	the_feel_felt_found+ownership_language	discard	tone_change
1415	5.112	the_feel_felt_found+ownership_language+casual_professionalism	discard	add_casual_professionalism
1416	5.300	the_feel_felt_found+ownership_language	discard	temp_0.75
1417	5.450	the_feel_felt_found+ownership_language	discard	tone_change
1418	5.425	the_feel_felt_found+ownership_language	discard	tone_change
1419	5.237	ownership_language+personal_touch	discard	swap_the_feel_felt_found_for_personal_touch
1420	5.225	the_feel_felt_found+ownership_language	discard	tone_change
1421	5.450	ownership_language	discard	crossover
