generation	eq_score	techniques	status	description
1422	5.138	ownership_language	discard	crossover
1423	5.550	the_feel_felt_found+ownership_language	discard	crossover
1424	4.825	the_feel_felt_found	discard	remove_ownership_language
1425	5.013	the_feel_felt_found+ownership_language	discard	temp_0.75
1426	4.925	the_feel_felt_found+ownership_language	discard	tone_change
1427	5.550	the_feel_felt_found+ownership_language	discard	tone_change
1428	5.550	the_feel_felt_found+ownership_language	discard	tone_change
1429	4.825	ownership_language	discard	crossover
1430	5.075	the_feel_felt_found+ownership_language+proactive_extras	discard	add_proactive_extras
1431	5.138	the_feel_felt_found+ownership_language	discard	tone_change
1432	5.450	the_feel_felt_found+ownership_language	discard	crossover
1433	5.238	the_feel_felt_found+ownership_language+validation_before_solution	discard	add_validation_before_solution
1434	5.238	the_feel_felt_found+ownership_language	discard	tone_change
1435	5.013	the_feel_felt_found+energy_matching	discard	swap_ownership_language_for_energy_matching
1436	5.300	the_feel_felt_found+ownership_language	discard	tone_change
1437	5.112	the_feel_felt_found+never_say_calm_down	discard	swap_ownership_language_for_never_say_calm_down
1438	5.550	the_feel_felt_found+ownership_language	discard	tone_change
1439	4.925	the_feel_felt_found+casual_professionalism	discard	swap_ownership_language_for_casual_professionalism
1440	5.200	the_feel_felt_found+personal_touch	discard	swap_ownership_language_for_personal_touch
1441	5.237	the_feel_felt_found+ownership_language	discard	tone_change
1442	4.925	the_feel_felt_found+ownership_language+casual_professionalism	discard	add_casual_professionalism
1443	5.450	the_feel_felt_found+proactive_extras	discard	swap_ownership_language_for_proactive_extras
1444	5.550	the_feel_felt_found+ownership_language+emotional_labeling	discard	add_emotional_labeling
1445	5.138	the_feel_felt_found+ownership_language	discard	crossover
1446	5.550	none	discard	crossover
1447	5.450	the_feel_felt_found+ownership_language	discard	tone_change
1448	5.325	the_feel_felt_found+ownership_language+personal_touch	discard	add_personal_touch
1449	5.175	the_feel_felt_found+ownership_language+genuine_admission	discard	add_genuine_admission
1450	5.038	ownership_language	discard	crossover
1451	4.725	the_feel_felt_found+ownership_language	discard	temp_0.70
1452	5.138	the_feel_felt_found+ownership_language	discard	temp_0.85
1453	5.550	the_feel_felt_found+emotional_labeling	discard	swap_ownership_language_for_emotional_labeling
1454	5.550	the_feel_felt_found+ownership_language	discard	tone_change
1455	5.325	the_feel_felt_found+ownership_language	discard	temp_0.75
1456	5.550	ownership_language+genuine_admission	discard	swap_the_feel_felt_found_for_genuine_admission
1457	4.725	ownership_language	discard	crossover
1458	5.325	the_feel_felt_found+ownership_language+warmth_injection	discard	add_warmth_injection
1459	5.325	the_feel_felt_found+ownership_language	discard	tone_change
1460	5.237	the_feel_felt_found	discard	remove_ownership_language
1461	5.238	the_feel_felt_found+ownership_language	discard	tone_change
1462	5.013	the_feel_felt_found+ownership_language	discard	tone_change
1463	4.825	the_feel_felt_found+ownership_language	discard	temp_0.85
1464	5.025	ownership_language	discard	crossover
1465	5.113	the_feel_felt_found+ownership_language+emotional_labeling	discard	add_emotional_labeling
1466	5.450	the_feel_felt_found+ownership_language	discard	tone_change
1467	5.425	the_feel_felt_found+ownership_language	discard	crossover
1468	5.450	the_feel_felt_found+ownership_language+never_say_calm_down	discard	add_never_say_calm_down
1469	5.013	the_feel_felt_found+ownership_language	discard	crossover
1470	5.325	ownership_language	discard	crossover
1471	5.550	the_feel_felt_found+ownership_language+never_say_calm_down	discard	add_never_say_calm_down
1472	5.437	the_feel_felt_found+ownership_language	discard	temp_0.65
1473	5.112	the_feel_felt_found+strategic_agreement	discard	swap_ownership_language_for_strategic_agreement
1474	5.238	ownership_language+energy_matching	discard	swap_the_feel_felt_found_for_energy_matching
1475	5.138	the_feel_felt_found+ownership_language	discard	tone_change
1476	5.112	the_feel_felt_found+ownership_language+personal_touch	discard	add_personal_touch
1477	4.925	the_feel_felt_found+validation_before_solution	discard	swap_ownership_language_for_validation_before_solution
1478	5.450	the_feel_felt_found+ownership_language+concrete_next_steps	discard	add_concrete_next_steps
1479	4.888	the_feel_felt_found+ownership_language	discard	tone_change
1480	5.237	the_feel_felt_found+ownership_language	discard	tone_change
1481	5.138	the_feel_felt_found+ownership_language	discard	crossover
1482	4.925	ownership_language+personal_touch	discard	swap_the_feel_felt_found_for_personal_touch
1483	5.550	the_feel_felt_found+ownership_language	discard	crossover
1484	4.413	the_feel_felt_found+ownership_language	discard	crossover
1485	5.037	the_feel_felt_found+ownership_language	discard	crossover
1486	5.112	the_feel_felt_found+ownership_language	discard	temp_0.75
1487	4.913	the_feel_felt_found	discard	crossover
1488	5.075	the_feel_felt_found+ownership_language+warmth_injection	discard	add_warmth_injection
1489	5.550	the_feel_felt_found	discard	remove_ownership_language
1490	5.550	ownership_language+mirroring	discard	swap_the_feel_felt_found_for_mirroring
1491	5.238	ownership_language	discard	remove_the_feel_felt_found
1492	5.650	the_feel_felt_found+ownership_language+genuine_admission	discard	add_genuine_admission
1493	4.888	the_feel_felt_found+ownership_language	discard	tone_change
1494	5.037	the_feel_felt_found+ownership_language+concrete_next_steps	discard	add_concrete_next_steps
1495	5.138	the_feel_felt_found+ownership_language	discard	temp_0.95
1496	5.450	the_feel_felt_found+ownership_language	discard	crossover
1497	5.550	ownership_language	discard	remove_the_feel_felt_found
1498	5.425	the_feel_felt_found+ownership_language+strategic_agreement	discard	add_strategic_agreement
1499	5.237	the_feel_felt_found+ownership_language+proactive_extras	discard	add_proactive_extras
1500	5.112	the_feel_felt_found+ownership_language	discard	tone_change
1501	5.237	the_feel_felt_found+ownership_language	discard	tone_change
1502	5.325	the_feel_felt_found+ownership_language	discard	tone_change
1503	5.450	the_feel_felt_found+ownership_language	discard	crossover
1504	5.112	the_feel_felt_found+ownership_language	discard	temp_0.95
1505	5.325	the_feel_felt_found+ownership_language+personal_touch	discard	add_personal_touch
1506	5.237	the_feel_felt_found+ownership_language	discard	tone_change
1507	5.550	the_feel_felt_found+ownership_language	discard	temp_0.75
1508	5.350	the_feel_felt_found+ownership_language+casual_professionalism	discard	add_casual_professionalism
1509	5.088	the_feel_felt_found+concrete_next_steps	discard	swap_ownership_language_for_concrete_next_steps
1510	4.825	the_feel_felt_found+ownership_language	discard	tone_change
1511	5.337	the_feel_felt_found+ownership_language	discard	temp_0.65
1512	5.550	the_feel_felt_found+proactive_extras	discard	swap_ownership_language_for_proactive_extras
1513	4.725	the_feel_felt_found+ownership_language+energy_matching	discard	add_energy_matching
1514	5.112	the_feel_felt_found+ownership_language	discard	tone_change
1515	5.013	the_feel_felt_found	discard	crossover
1516	5.125	the_feel_felt_found+ownership_language	discard	temp_0.70
1517	5.238	the_feel_felt_found+proactive_extras	discard	swap_ownership_language_for_proactive_extras
1518	5.037	the_feel_felt_found+strategic_agreement	discard	swap_ownership_language_for_strategic_agreement
1519	5.550	the_feel_felt_found+ownership_language	discard	tone_change
1520	4.925	the_feel_felt_found+ownership_language+strategic_agreement	discard	add_strategic_agreement
1521	5.125	the_feel_felt_found+ownership_language+warmth_injection	discard	add_warmth_injection
1522	5.325	the_feel_felt_found+ownership_language	discard	tone_change
1523	4.825	the_feel_felt_found+ownership_language	discard	temp_0.90
1524	4.925	the_feel_felt_found	discard	remove_ownership_language
1525	5.425	the_feel_felt_found+ownership_language	discard	tone_change
1526	4.888	the_feel_felt_found+ownership_language	discard	tone_change
1527	5.138	the_feel_felt_found+ownership_language	discard	temp_0.85
1528	5.325	the_feel_felt_found+ownership_language	discard	crossover
1529	5.138	the_feel_felt_found+ownership_language	discard	tone_change
1530	5.138	the_feel_felt_found+ownership_language	discard	temp_0.85
1531	4.675	the_feel_felt_found+ownership_language	discard	temp_0.85
1532	5.450	the_feel_felt_found+ownership_language+never_say_calm_down	discard	add_never_say_calm_down
1533	5.237	the_feel_felt_found	discard	crossover
1534	5.112	the_feel_felt_found+ownership_language	discard	tone_change
1535	5.112	the_feel_felt_found+ownership_language	discard	crossover
1536	5.425	the_feel_felt_found+genuine_admission	discard	swap_ownership_language_for_genuine_admission
1537	5.325	the_feel_felt_found+ownership_language+energy_matching	discard	add_energy_matching
1538	5.300	the_feel_felt_found+ownership_language+personal_touch	discard	add_personal_touch
1539	5.550	the_feel_felt_found+ownership_language	discard	tone_change
1540	5.550	the_feel_felt_found+ownership_language+validation_before_solution	discard	add_validation_before_solution
1541	4.812	the_feel_felt_found+ownership_language	discard	temp_0.85
1542	5.138	the_feel_felt_found+ownership_language+strategic_agreement	discard	add_strategic_agreement
1543	5.113	the_feel_felt_found+ownership_language+personal_touch	discard	add_personal_touch
1544	5.138	the_feel_felt_found+ownership_language	discard	temp_0.65
1545	5.338	the_feel_felt_found+ownership_language	discard	crossover
1546	5.238	the_feel_felt_found+ownership_language+proactive_extras	discard	add_proactive_extras
1547	4.825	the_feel_felt_found+ownership_language	discard	crossover
1548	4.925	none	discard	crossover
1549	5.112	the_feel_felt_found+ownership_language	discard	crossover
1550	5.525	the_feel_felt_found+ownership_language	discard	tone_change
1551	5.200	ownership_language	discard	remove_the_feel_felt_found
1552	5.325	the_feel_felt_found+ownership_language	discard	temp_0.95
1553	5.325	ownership_language+proactive_extras	discard	swap_the_feel_felt_found_for_proactive_extras
1554	5.013	ownership_language	discard	remove_the_feel_felt_found
1555	5.237	ownership_language	discard	crossover
1556	5.113	the_feel_felt_found+ownership_language+personal_touch	discard	add_personal_touch
1557	5.550	the_feel_felt_found+ownership_language	discard	temp_0.75
1558	5.125	none	discard	crossover
1559	5.237	the_feel_felt_found+ownership_language	discard	tone_change
1560	5.138	the_feel_felt_found+ownership_language+mirroring	discard	add_mirroring
1561	5.075	the_feel_felt_found+ownership_language	discard	temp_0.85
1562	5.550	the_feel_felt_found+ownership_language+concrete_next_steps	discard	add_concrete_next_steps
1563	5.550	the_feel_felt_found	discard	remove_ownership_language
1564	5.450	the_feel_felt_found+ownership_language	discard	tone_change
1565	5.138	the_feel_felt_found+ownership_language	discard	temp_0.95
1566	5.013	the_feel_felt_found+ownership_language+concrete_next_steps	discard	add_concrete_next_steps
1567	4.925	the_feel_felt_found	discard	remove_ownership_language
1568	5.237	ownership_language+personal_touch	discard	swap_the_feel_felt_found_for_personal_touch
1569	4.612	the_feel_felt_found+ownership_language	discard	crossover
1570	4.800	the_feel_felt_found+personal_touch	discard	swap_ownership_language_for_personal_touch
1571	4.825	the_feel_felt_found+ownership_language	discard	tone_change
1572	5.425	the_feel_felt_found+ownership_language	discard	tone_change
1573	4.825	the_feel_felt_found+personal_touch	discard	swap_ownership_language_for_personal_touch
1574	5.550	the_feel_felt_found+ownership_language	discard	crossover
1575	5.237	ownership_language+warmth_injection	discard	swap_the_feel_felt_found_for_warmth_injection
1576	5.237	the_feel_felt_found+ownership_language	discard	temp_0.95
1577	5.300	the_feel_felt_found+ownership_language	discard	crossover
1578	5.237	the_feel_felt_found	discard	remove_ownership_language
1579	5.450	ownership_language+never_say_calm_down	discard	swap_the_feel_felt_found_for_never_say_calm_down
1580	5.138	the_feel_felt_found+ownership_language	discard	temp_0.65
1581	5.650	the_feel_felt_found+ownership_language+concrete_next_steps	discard	add_concrete_next_steps
1582	4.725	the_feel_felt_found+ownership_language	discard	crossover
1583	5.138	the_feel_felt_found	discard	remove_ownership_language
1584	4.825	ownership_language+concrete_next_steps	discard	swap_the_feel_felt_found_for_concrete_next_steps
1585	5.450	the_feel_felt_found+ownership_language	discard	tone_change
1586	5.325	the_feel_felt_found+ownership_language+personal_touch	discard	add_personal_touch
1587	5.450	the_feel_felt_found+ownership_language	discard	tone_change
1588	5.237	the_feel_felt_found+ownership_language+casual_professionalism	discard	add_casual_professionalism
1589	5.325	the_feel_felt_found+ownership_language	discard	crossover
1590	5.138	the_feel_felt_found+ownership_language	discard	temp_0.95
1591	5.112	ownership_language	discard	remove_the_feel_felt_found
1592	5.325	the_feel_felt_found+ownership_language+casual_professionalism	discard	add_casual_professionalism
1593	4.825	the_feel_felt_found+ownership_language	discard	crossover
1594	5.450	the_feel_felt_found+ownership_language+proactive_extras	discard	add_proactive_extras
1595	5.350	the_feel_felt_found+ownership_language	discard	tone_change
1596	5.025	the_feel_felt_found+ownership_language	discard	temp_0.75
1597	5.013	the_feel_felt_found+ownership_language	discard	tone_change
1598	5.650	ownership_language+concrete_next_steps	discard	swap_the_feel_felt_found_for_concrete_next_steps
1599	4.925	the_feel_felt_found+ownership_language+concrete_next_steps	discard	add_concrete_next_steps
1600	4.912	ownership_language+warmth_injection	discard	swap_the_feel_felt_found_for_warmth_injection
1601	5.200	the_feel_felt_found+ownership_language+never_say_calm_down	discard	add_never_say_calm_down
1602	5.013	the_feel_felt_found+ownership_language	discard	temp_0.95
1603	5.450	the_feel_felt_found	discard	remove_ownership_language
1604	5.450	the_feel_felt_found+ownership_language+genuine_admission	discard	add_genuine_admission
1605	5.550	the_feel_felt_found+ownership_language	discard	temp_0.75
1606	5.550	the_feel_felt_found+ownership_language	discard	tone_change
1607	5.013	ownership_language	discard	crossover
1608	4.888	the_feel_felt_found+ownership_language+genuine_admission	discard	add_genuine_admission
1609	5.550	the_feel_felt_found+validation_before_solution	discard	swap_ownership_language_for_validation_before_solution
1610	5.138	the_feel_felt_found+ownership_language	discard	tone_change
1611	5.237	ownership_language	discard	remove_the_feel_felt_found
1612	5.550	the_feel_felt_found+ownership_language+energy_matching	discard	add_energy_matching
1613	5.325	the_feel_felt_found	discard	remove_ownership_language
1614	5.013	the_feel_felt_found+ownership_language+strategic_agreement	discard	add_strategic_agreement
1615	5.450	the_feel_felt_found+emotional_labeling	discard	swap_ownership_language_for_emotional_labeling
1616	4.987	the_feel_felt_found+ownership_language	discard	temp_0.65
1617	5.650	the_feel_felt_found	discard	crossover
1618	5.088	the_feel_felt_found+ownership_language+mirroring	discard	add_mirroring
1619	5.238	the_feel_felt_found+ownership_language+mirroring	discard	add_mirroring
1620	4.800	the_feel_felt_found+ownership_language+mirroring	discard	add_mirroring
1621	5.450	ownership_language+strategic_agreement	discard	swap_the_feel_felt_found_for_strategic_agreement
1622	5.013	the_feel_felt_found	discard	remove_ownership_language
1623	5.450	the_feel_felt_found+ownership_language	discard	tone_change
1624	5.450	ownership_language+proactive_extras	discard	swap_the_feel_felt_found_for_proactive_extras
1625	5.338	the_feel_felt_found+ownership_language+casual_professionalism	discard	add_casual_professionalism
1626	5.112	the_feel_felt_found	discard	remove_ownership_language
1627	5.325	the_feel_felt_found+ownership_language	discard	crossover
1628	5.075	the_feel_felt_found+ownership_language	discard	tone_change
1629	5.550	the_feel_felt_found	discard	crossover
1630	5.013	the_feel_felt_found+ownership_language+casual_professionalism	discard	add_casual_professionalism
1631	5.325	the_feel_felt_found+ownership_language+mirroring	discard	add_mirroring
1632	4.825	the_feel_felt_found+ownership_language+genuine_admission	discard	add_genuine_admission
1633	5.550	the_feel_felt_found+ownership_language	discard	temp_0.70
1634	5.350	the_feel_felt_found+ownership_language	discard	crossover
1635	5.237	the_feel_felt_found+ownership_language+proactive_extras	discard	add_proactive_extras
1636	4.725	the_feel_felt_found+ownership_language	discard	crossover
1637	5.138	the_feel_felt_found+ownership_language	discard	temp_0.85
1638	5.325	the_feel_felt_found+ownership_language+warmth_injection	discard	add_warmth_injection
1639	5.550	the_feel_felt_found+validation_before_solution	discard	swap_ownership_language_for_validation_before_solution
1640	5.113	the_feel_felt_found+ownership_language	discard	tone_change
1641	5.037	the_feel_felt_found+ownership_language	discard	temp_0.85
1642	4.800	the_feel_felt_found+ownership_language+genuine_admission	discard	add_genuine_admission
1643	5.138	the_feel_felt_found+ownership_language	discard	crossover
1644	5.237	the_feel_felt_found+ownership_language+proactive_extras	discard	add_proactive_extras
1645	4.825	the_feel_felt_found+ownership_language	discard	tone_change
1646	5.025	ownership_language	discard	remove_the_feel_felt_found
1647	4.825	the_feel_felt_found+ownership_language+mirroring	discard	add_mirroring
1648	5.425	the_feel_felt_found+ownership_language	discard	temp_0.65
1649	5.013	the_feel_felt_found+strategic_agreement	discard	swap_ownership_language_for_strategic_agreement
1650	5.550	the_feel_felt_found+mirroring	discard	swap_ownership_language_for_mirroring
1651	4.888	the_feel_felt_found+ownership_language	discard	tone_change
1652	5.013	the_feel_felt_found+ownership_language	discard	tone_change
1653	5.525	ownership_language	discard	remove_the_feel_felt_found
1654	4.925	the_feel_felt_found+ownership_language+genuine_admission	discard	add_genuine_admission
1655	4.713	the_feel_felt_found+ownership_language+warmth_injection	discard	add_warmth_injection
1656	5.025	the_feel_felt_found+ownership_language	discard	temp_0.75
1657	5.550	the_feel_felt_found+ownership_language	discard	temp_0.90
1658	5.025	the_feel_felt_found+ownership_language	discard	temp_0.65
1659	5.550	the_feel_felt_found+ownership_language+validation_before_solution	discard	add_validation_before_solution
1660	5.138	the_feel_felt_found+ownership_language	discard	tone_change
1661	5.450	ownership_language	discard	remove_the_feel_felt_found
1662	5.013	the_feel_felt_found+casual_professionalism	discard	swap_ownership_language_for_casual_professionalism
1663	5.138	the_feel_felt_found	discard	remove_ownership_language
1664	5.450	the_feel_felt_found+casual_professionalism	discard	swap_ownership_language_for_casual_professionalism
1665	5.338	the_feel_felt_found+validation_before_solution	discard	swap_ownership_language_for_validation_before_solution
1666	5.425	the_feel_felt_found+ownership_language+proactive_extras	discard	add_proactive_extras
1667	5.237	the_feel_felt_found+ownership_language	discard	crossover
1668	4.925	the_feel_felt_found+ownership_language+warmth_injection	discard	add_warmth_injection
1669	5.138	ownership_language	discard	crossover
1670	5.013	the_feel_felt_found+ownership_language	discard	crossover
1671	5.425	ownership_language+validation_before_solution	discard	swap_the_feel_felt_found_for_validation_before_solution
1672	4.800	the_feel_felt_found	discard	crossover
1673	4.925	the_feel_felt_found+never_say_calm_down	discard	swap_ownership_language_for_never_say_calm_down
1674	5.425	the_feel_felt_found+ownership_language	discard	tone_change
1675	5.550	ownership_language+genuine_admission	discard	swap_the_feel_felt_found_for_genuine_admission
1676	5.013	the_feel_felt_found+personal_touch	discard	swap_ownership_language_for_personal_touch
1677	5.337	ownership_language	discard	crossover
1678	5.237	the_feel_felt_found+ownership_language	discard	tone_change
1679	5.550	the_feel_felt_found+ownership_language+never_say_calm_down	discard	add_never_say_calm_down
1680	5.325	the_feel_felt_found+validation_before_solution	discard	swap_ownership_language_for_validation_before_solution
1681	5.138	ownership_language+never_say_calm_down	discard	swap_the_feel_felt_found_for_never_say_calm_down
1682	4.825	the_feel_felt_found+proactive_extras	discard	swap_ownership_language_for_proactive_extras
1683	4.900	the_feel_felt_found+ownership_language+emotional_labeling	discard	add_emotional_labeling
1684	4.913	the_feel_felt_found+ownership_language	discard	tone_change
1685	5.112	the_feel_felt_found+ownership_language	discard	crossover
1686	5.750	the_feel_felt_found+ownership_language	discard	crossover
1687	5.138	the_feel_felt_found	discard	remove_ownership_language
1688	5.013	ownership_language	discard	crossover
1689	4.487	the_feel_felt_found+ownership_language	discard	temp_0.95
1690	5.325	the_feel_felt_found+ownership_language	discard	tone_change
1691	5.750	ownership_language	discard	remove_the_feel_felt_found
1692	5.225	the_feel_felt_found+ownership_language+energy_matching	discard	add_energy_matching
1693	5.025	the_feel_felt_found+ownership_language+casual_professionalism	discard	add_casual_professionalism
1694	5.450	the_feel_felt_found+warmth_injection	discard	swap_ownership_language_for_warmth_injection
1695	4.925	ownership_language+emotional_labeling	discard	swap_the_feel_felt_found_for_emotional_labeling
1696	5.450	the_feel_felt_found+ownership_language	discard	temp_0.65
