generation	eq_score	techniques	status	description
5600	5.238	the_feel_felt_found+ownership_language	discard	tone_change
5601	5.350	the_feel_felt_found+energy_matching	discard	swap_ownership_language_for_energy_matching
5602	5.350	the_feel_felt_found+ownership_language	discard	tone_change
5603	5.225	the_feel_felt_found+ownership_language	discard	tone_change
5604	5.650	the_feel_felt_found+ownership_language	discard	crossover
5605	4.913	the_feel_felt_found+personal_touch	discard	swap_ownership_language_for_personal_touch
5606	5.425	the_feel_felt_found+ownership_language	discard	temp_0.65
5607	5.237	the_feel_felt_found+ownership_language+warmth_injection	discard	add_warmth_injection
5608	5.337	the_feel_felt_found+ownership_language	discard	crossover
5609	4.987	the_feel_felt_found+ownership_language	discard	tone_change
5610	4.612	the_feel_felt_found+ownership_language	discard	temp_0.85
5611	5.450	the_feel_felt_found+ownership_language	discard	temp_0.90
5612	4.825	the_feel_felt_found+ownership_language	discard	tone_change
5613	5.013	the_feel_felt_found+ownership_language	discard	crossover
5614	5.425	the_feel_felt_found+ownership_language	discard	temp_0.95
5615	5.450	the_feel_felt_found+ownership_language	discard	crossover
5616	5.325	the_feel_felt_found+ownership_language	discard	crossover
5617	5.425	the_feel_felt_found+never_say_calm_down	discard	swap_ownership_language_for_never_say_calm_down
5618	5.550	the_feel_felt_found+ownership_language	discard	tone_change
5619	5.025	the_feel_felt_found+ownership_language+validation_before_solution	discard	add_validation_before_solution
5620	5.350	the_feel_felt_found+ownership_language	discard	tone_change
5621	4.513	the_feel_felt_found+ownership_language+proactive_extras	discard	add_proactive_extras
5622	5.138	the_feel_felt_found+ownership_language	discard	temp_0.95
5623	5.325	the_feel_felt_found+ownership_language	discard	temp_0.95
5624	5.112	ownership_language+never_say_calm_down	discard	swap_the_feel_felt_found_for_never_say_calm_down
5625	5.550	the_feel_felt_found+ownership_language	discard	crossover
5626	5.550	the_feel_felt_found+ownership_language	discard	temp_0.65
5627	5.200	the_feel_felt_found+ownership_language	discard	tone_change
5628	4.513	the_feel_felt_found+ownership_language	discard	temp_0.90
5629	5.013	the_feel_felt_found	discard	remove_ownership_language
5630	5.425	ownership_language+concrete_next_steps	discard	swap_the_feel_felt_found_for_concrete_next_steps
5631	5.325	ownership_language+energy_matching	discard	swap_the_feel_felt_found_for_energy_matching
5632	4.725	ownership_language+energy_matching	discard	swap_the_feel_felt_found_for_energy_matching
5633	4.513	the_feel_felt_found+ownership_language	discard	temp_0.95
5634	5.337	the_feel_felt_found+ownership_language+strategic_agreement	discard	add_strategic_agreement
5635	5.450	the_feel_felt_found+ownership_language+warmth_injection	discard	add_warmth_injection
5636	4.700	the_feel_felt_found+ownership_language	discard	temp_0.70
5637	5.650	the_feel_felt_found+personal_touch	discard	swap_ownership_language_for_personal_touch
5638	5.450	the_feel_felt_found+ownership_language	discard	temp_0.70
5639	4.925	the_feel_felt_found+ownership_language+emotional_labeling	discard	add_emotional_labeling
5640	5.425	the_feel_felt_found+ownership_language+warmth_injection	discard	add_warmth_injection
5641	5.425	the_feel_felt_found+ownership_language+mirroring	discard	add_mirroring
5642	5.138	the_feel_felt_found+ownership_language	discard	tone_change
5643	4.912	the_feel_felt_found+ownership_language	discard	temp_0.70
5644	5.112	ownership_language+casual_professionalism	discard	swap_the_feel_felt_found_for_casual_professionalism
5645	4.725	none	discard	crossover
5646	5.025	the_feel_felt_found+ownership_language+concrete_next_steps	discard	add_concrete_next_steps
5647	4.888	none	discard	crossover
5648	5.425	the_feel_felt_found+ownership_language	discard	tone_change
5649	5.013	the_feel_felt_found+energy_matching	discard	swap_ownership_language_for_energy_matching
5650	5.100	the_feel_felt_found+ownership_language	discard	tone_change
5651	4.925	the_feel_felt_found+ownership_language	discard	tone_change
5652	5.450	the_feel_felt_found+ownership_language	discard	tone_change
5653	4.612	the_feel_felt_found	discard	crossover
5654	5.325	the_feel_felt_found+proactive_extras	discard	swap_ownership_language_for_proactive_extras
5655	5.237	the_feel_felt_found+concrete_next_steps	discard	swap_ownership_language_for_concrete_next_steps
5656	5.350	the_feel_felt_found+ownership_language	discard	temp_0.75
5657	5.650	the_feel_felt_found+ownership_language	discard	crossover
5658	5.238	the_feel_felt_found+ownership_language	discard	tone_change
5659	5.650	ownership_language+never_say_calm_down	discard	swap_the_feel_felt_found_for_never_say_calm_down
5660	5.237	the_feel_felt_found+ownership_language	discard	tone_change
5661	5.013	the_feel_felt_found+ownership_language	discard	temp_0.70
5662	5.138	the_feel_felt_found+ownership_language+warmth_injection	discard	add_warmth_injection
5663	5.325	the_feel_felt_found+ownership_language+casual_professionalism	discard	add_casual_professionalism
5664	5.325	the_feel_felt_found+genuine_admission	discard	swap_ownership_language_for_genuine_admission
5665	4.987	the_feel_felt_found+ownership_language+energy_matching	discard	add_energy_matching
5666	4.912	the_feel_felt_found+ownership_language	discard	crossover
5667	5.450	the_feel_felt_found+ownership_language	discard	tone_change
5668	5.450	ownership_language	discard	remove_the_feel_felt_found
5669	5.013	the_feel_felt_found+ownership_language+warmth_injection	discard	add_warmth_injection
5670	5.238	the_feel_felt_found+ownership_language	discard	crossover
5671	5.138	the_feel_felt_found+ownership_language+validation_before_solution	discard	add_validation_before_solution
5672	5.425	ownership_language	discard	remove_the_feel_felt_found
5673	5.112	ownership_language+proactive_extras	discard	swap_the_feel_felt_found_for_proactive_extras
5674	5.625	ownership_language	discard	crossover
5675	5.138	the_feel_felt_found+ownership_language+energy_matching	discard	add_energy_matching
5676	5.650	the_feel_felt_found+ownership_language	discard	temp_0.95
5677	5.338	the_feel_felt_found+ownership_language	discard	temp_0.70
5678	5.438	the_feel_felt_found+ownership_language	discard	crossover
5679	5.550	the_feel_felt_found+energy_matching	discard	swap_ownership_language_for_energy_matching
5680	4.925	the_feel_felt_found+ownership_language	discard	tone_change
5681	4.825	the_feel_felt_found+ownership_language	discard	tone_change
5682	5.325	the_feel_felt_found+concrete_next_steps	discard	swap_ownership_language_for_concrete_next_steps
5683	5.138	the_feel_felt_found+ownership_language	discard	tone_change
5684	5.237	the_feel_felt_found+ownership_language	discard	crossover
5685	5.550	the_feel_felt_found	discard	remove_ownership_language
5686	5.013	the_feel_felt_found+ownership_language+casual_professionalism	discard	add_casual_professionalism
5687	5.325	ownership_language+energy_matching	discard	swap_the_feel_felt_found_for_energy_matching
5688	5.550	the_feel_felt_found+ownership_language	discard	tone_change
5689	5.550	ownership_language+warmth_injection	discard	swap_the_feel_felt_found_for_warmth_injection
5690	5.450	the_feel_felt_found+ownership_language+mirroring	discard	add_mirroring
5691	5.112	the_feel_felt_found	discard	remove_ownership_language
5692	5.550	the_feel_felt_found+ownership_language	discard	crossover
5693	4.987	the_feel_felt_found+ownership_language	discard	tone_change
5694	5.338	the_feel_felt_found+ownership_language+proactive_extras	discard	add_proactive_extras
5695	4.938	the_feel_felt_found+ownership_language	discard	temp_0.95
5696	5.325	the_feel_felt_found+ownership_language	discard	tone_change
5697	5.550	ownership_language+casual_professionalism	discard	swap_the_feel_felt_found_for_casual_professionalism
5698	5.325	the_feel_felt_found+ownership_language+validation_before_solution	discard	add_validation_before_solution
5699	4.825	ownership_language	discard	remove_the_feel_felt_found
5700	4.925	the_feel_felt_found+ownership_language	discard	temp_0.90
5701	5.350	the_feel_felt_found+ownership_language	discard	tone_change
5702	5.013	ownership_language+mirroring	discard	swap_the_feel_felt_found_for_mirroring
5703	5.112	ownership_language	discard	remove_the_feel_felt_found
5704	5.112	ownership_language	discard	crossover
5705	5.138	the_feel_felt_found+ownership_language+casual_professionalism	discard	add_casual_professionalism
5706	5.237	the_feel_felt_found+strategic_agreement	discard	swap_ownership_language_for_strategic_agreement
5707	5.138	the_feel_felt_found+ownership_language	discard	tone_change
5708	4.487	the_feel_felt_found+ownership_language+genuine_admission	discard	add_genuine_admission
5709	5.350	the_feel_felt_found+ownership_language	discard	tone_change
5710	5.237	the_feel_felt_found+ownership_language	discard	temp_0.70
5711	5.013	ownership_language+validation_before_solution	discard	swap_the_feel_felt_found_for_validation_before_solution
5712	5.325	the_feel_felt_found+ownership_language	discard	tone_change
5713	5.237	the_feel_felt_found+emotional_labeling	discard	swap_ownership_language_for_emotional_labeling
5714	5.325	the_feel_felt_found+ownership_language+strategic_agreement	discard	add_strategic_agreement
5715	5.450	the_feel_felt_found+personal_touch	discard	swap_ownership_language_for_personal_touch
5716	5.325	the_feel_felt_found+ownership_language+validation_before_solution	discard	add_validation_before_solution
5717	5.138	the_feel_felt_found	discard	remove_ownership_language
5718	5.325	ownership_language	discard	crossover
5719	5.425	the_feel_felt_found+ownership_language+warmth_injection	discard	add_warmth_injection
5720	5.138	the_feel_felt_found+ownership_language+concrete_next_steps	discard	add_concrete_next_steps
5721	5.138	the_feel_felt_found+ownership_language	discard	temp_0.65
5722	5.550	the_feel_felt_found+ownership_language+warmth_injection	discard	add_warmth_injection
5723	5.237	ownership_language+emotional_labeling	discard	swap_the_feel_felt_found_for_emotional_labeling
5724	5.325	the_feel_felt_found+ownership_language	discard	temp_0.90
5725	5.450	ownership_language+strategic_agreement	discard	swap_the_feel_felt_found_for_strategic_agreement
5726	4.888	the_feel_felt_found+ownership_language	discard	temp_0.85
5727	5.325	the_feel_felt_found+ownership_language	discard	crossover
5728	4.987	the_feel_felt_found+ownership_language	discard	tone_change
5729	5.237	the_feel_felt_found+ownership_language	discard	crossover
5730	5.550	the_feel_felt_found+ownership_language+personal_touch	discard	add_personal_touch
5731	5.237	the_feel_felt_found+ownership_language+personal_touch	discard	add_personal_touch
5732	5.125	the_feel_felt_found+ownership_language	discard	temp_0.90
5733	5.550	the_feel_felt_found+ownership_language	discard	tone_change
5734	4.800	the_feel_felt_found+ownership_language	discard	crossover
5735	5.325	the_feel_felt_found+ownership_language+genuine_admission	discard	add_genuine_admission
5736	5.238	the_feel_felt_found	discard	crossover
5737	5.237	the_feel_felt_found+ownership_language+strategic_agreement	discard	add_strategic_agreement
5738	5.138	none	discard	crossover
5739	5.013	the_feel_felt_found+ownership_language	discard	temp_0.75
5740	4.600	the_feel_felt_found+ownership_language	discard	tone_change
5741	5.025	the_feel_felt_found+ownership_language+concrete_next_steps	discard	add_concrete_next_steps
5742	5.425	the_feel_felt_found+ownership_language	discard	temp_0.85
5743	5.550	ownership_language+concrete_next_steps	discard	swap_the_feel_felt_found_for_concrete_next_steps
5744	4.925	the_feel_felt_found+ownership_language	discard	temp_0.65
5745	5.237	the_feel_felt_found+ownership_language	discard	crossover
5746	5.038	the_feel_felt_found+ownership_language+energy_matching	discard	add_energy_matching
5747	5.088	the_feel_felt_found	discard	remove_ownership_language
5748	5.550	the_feel_felt_found+ownership_language	discard	temp_0.95
5749	4.825	the_feel_felt_found+ownership_language	discard	tone_change
5750	5.438	the_feel_felt_found+ownership_language+mirroring	discard	add_mirroring
5751	5.250	the_feel_felt_found+ownership_language+emotional_labeling	discard	add_emotional_labeling
5752	4.825	the_feel_felt_found+ownership_language	discard	tone_change
5753	4.987	the_feel_felt_found	discard	crossover
5754	5.138	ownership_language	discard	remove_the_feel_felt_found
5755	5.350	the_feel_felt_found+ownership_language	discard	tone_change
5756	5.550	ownership_language	discard	crossover
5757	5.013	the_feel_felt_found+ownership_language	discard	crossover
5758	5.425	ownership_language+personal_touch	discard	swap_the_feel_felt_found_for_personal_touch
5759	5.237	the_feel_felt_found+ownership_language	discard	tone_change
5760	5.550	the_feel_felt_found+ownership_language	discard	temp_0.85
5761	5.450	ownership_language	discard	remove_the_feel_felt_found
5762	5.200	the_feel_felt_found+ownership_language	discard	crossover
5763	4.800	the_feel_felt_found	discard	crossover
5764	5.237	the_feel_felt_found+ownership_language	discard	crossover
5765	4.912	the_feel_felt_found+ownership_language	discard	temp_0.85
5766	5.237	the_feel_felt_found+ownership_language	discard	temp_0.95
5767	5.450	none	discard	crossover
5768	5.237	the_feel_felt_found+ownership_language+mirroring	discard	add_mirroring
5769	5.138	the_feel_felt_found+ownership_language+proactive_extras	discard	add_proactive_extras
5770	5.350	ownership_language+proactive_extras	discard	swap_the_feel_felt_found_for_proactive_extras
5771	4.725	the_feel_felt_found+ownership_language	discard	temp_0.65
5772	4.925	the_feel_felt_found+ownership_language	discard	temp_0.65
5773	5.138	the_feel_felt_found+ownership_language+never_say_calm_down	discard	add_never_say_calm_down
5774	5.325	the_feel_felt_found+ownership_language	discard	temp_0.70
5775	4.825	ownership_language+personal_touch	discard	swap_the_feel_felt_found_for_personal_touch
5776	5.550	ownership_language+emotional_labeling	discard	swap_the_feel_felt_found_for_emotional_labeling
5777	5.550	the_feel_felt_found+ownership_language+proactive_extras	discard	add_proactive_extras
5778	5.237	the_feel_felt_found+ownership_language+casual_professionalism	discard	add_casual_professionalism
5779	5.350	the_feel_felt_found+ownership_language	discard	temp_0.75
5780	5.450	the_feel_felt_found+ownership_language+strategic_agreement	discard	add_strategic_agreement
5781	5.037	the_feel_felt_found	discard	remove_ownership_language
5782	5.450	the_feel_felt_found+genuine_admission	discard	swap_ownership_language_for_genuine_admission
5783	5.425	the_feel_felt_found+ownership_language	discard	crossover
5784	5.138	ownership_language+never_say_calm_down	discard	swap_the_feel_felt_found_for_never_say_calm_down
5785	5.425	ownership_language	discard	crossover
5786	5.138	ownership_language+personal_touch	discard	swap_the_feel_felt_found_for_personal_touch
5787	4.713	the_feel_felt_found+ownership_language	discard	tone_change
5788	4.300	the_feel_felt_found+ownership_language	discard	crossover
5789	5.425	the_feel_felt_found+ownership_language	discard	temp_0.65
5790	5.325	the_feel_felt_found+ownership_language	discard	temp_0.75
5791	4.600	the_feel_felt_found+emotional_labeling	discard	swap_ownership_language_for_emotional_labeling
5792	5.112	the_feel_felt_found+ownership_language+proactive_extras	discard	add_proactive_extras
5793	5.012	the_feel_felt_found+never_say_calm_down	discard	swap_ownership_language_for_never_say_calm_down
5794	4.713	the_feel_felt_found+ownership_language	discard	tone_change
5795	5.550	the_feel_felt_found+ownership_language	discard	tone_change
5796	5.138	the_feel_felt_found+ownership_language	discard	temp_0.95
5797	5.450	the_feel_felt_found+ownership_language+concrete_next_steps	discard	add_concrete_next_steps
5798	5.038	none	discard	crossover
5799	4.987	the_feel_felt_found+ownership_language	discard	crossover
5800	5.138	the_feel_felt_found	discard	remove_ownership_language
5801	4.825	the_feel_felt_found+ownership_language	discard	temp_0.85
5802	5.013	ownership_language+validation_before_solution	discard	swap_the_feel_felt_found_for_validation_before_solution
5803	5.750	the_feel_felt_found+ownership_language+emotional_labeling	discard	add_emotional_labeling
5804	5.237	the_feel_felt_found+validation_before_solution	discard	swap_ownership_language_for_validation_before_solution
5805	4.800	the_feel_felt_found+ownership_language	discard	tone_change
5806	5.013	the_feel_felt_found+ownership_language+never_say_calm_down	discard	add_never_say_calm_down
5807	5.213	the_feel_felt_found+validation_before_solution	discard	swap_ownership_language_for_validation_before_solution
5808	5.450	the_feel_felt_found+ownership_language	discard	tone_change
5809	5.112	the_feel_felt_found+ownership_language+casual_professionalism	discard	add_casual_professionalism
5810	5.450	the_feel_felt_found+ownership_language	discard	crossover
5811	5.450	the_feel_felt_found+ownership_language	discard	temp_0.70
5812	4.925	the_feel_felt_found+ownership_language+concrete_next_steps	discard	add_concrete_next_steps
5813	5.450	the_feel_felt_found+ownership_language	discard	temp_0.95
5814	5.350	the_feel_felt_found+ownership_language	discard	tone_change
5815	5.550	the_feel_felt_found+ownership_language	discard	crossover
5816	4.900	the_feel_felt_found+ownership_language	discard	tone_change
5817	4.938	the_feel_felt_found+ownership_language	discard	crossover
5818	5.325	the_feel_felt_found+ownership_language+genuine_admission	discard	add_genuine_admission
5819	4.925	the_feel_felt_found+ownership_language	discard	temp_0.65
5820	5.325	the_feel_felt_found+ownership_language+proactive_extras	discard	add_proactive_extras
5821	5.550	the_feel_felt_found+ownership_language+personal_touch	discard	add_personal_touch
5822	5.650	the_feel_felt_found+ownership_language	discard	temp_0.85
5823	5.550	the_feel_felt_found+ownership_language	discard	tone_change
5824	5.037	the_feel_felt_found+ownership_language	discard	temp_0.75
5825	5.550	ownership_language	discard	remove_the_feel_felt_found
5826	5.212	the_feel_felt_found+ownership_language	discard	tone_change
5827	5.138	the_feel_felt_found+ownership_language+strategic_agreement	discard	add_strategic_agreement
5828	5.550	the_feel_felt_found+ownership_language+emotional_labeling	discard	add_emotional_labeling
5829	5.013	the_feel_felt_found+ownership_language	discard	temp_0.95
5830	5.425	the_feel_felt_found+ownership_language	discard	crossover
5831	5.550	the_feel_felt_found+ownership_language	discard	temp_0.85
5832	5.013	the_feel_felt_found+ownership_language	discard	tone_change
5833	4.513	ownership_language+strategic_agreement	discard	swap_the_feel_felt_found_for_strategic_agreement
5834	5.113	the_feel_felt_found+ownership_language	discard	temp_0.75
5835	5.425	the_feel_felt_found+ownership_language	discard	tone_change
5836	5.138	the_feel_felt_found+ownership_language	discard	tone_change
5837	5.450	the_feel_felt_found+ownership_language	discard	crossover
5838	5.237	the_feel_felt_found+ownership_language+proactive_extras	discard	add_proactive_extras
5839	5.325	the_feel_felt_found+ownership_language	discard	tone_change
5840	5.550	the_feel_felt_found+ownership_language	discard	crossover
5841	4.825	none	discard	crossover
5842	5.450	the_feel_felt_found+ownership_language	discard	tone_change
5843	5.450	the_feel_felt_found+ownership_language	discard	crossover
5844	5.650	the_feel_felt_found+ownership_language	discard	tone_change
5845	5.425	the_feel_felt_found+ownership_language+mirroring	discard	add_mirroring
5846	5.450	the_feel_felt_found+ownership_language+energy_matching	discard	add_energy_matching
5847	5.325	ownership_language+casual_professionalism	discard	swap_the_feel_felt_found_for_casual_professionalism
5848	5.013	the_feel_felt_found+ownership_language+personal_touch	discard	add_personal_touch
5849	5.550	ownership_language	discard	crossover
5850	5.450	ownership_language+warmth_injection	discard	swap_the_feel_felt_found_for_warmth_injection
5851	5.425	ownership_language+emotional_labeling	discard	swap_the_feel_felt_found_for_emotional_labeling
5852	5.450	the_feel_felt_found+ownership_language	discard	tone_change
5853	5.138	the_feel_felt_found	discard	remove_ownership_language
5854	5.112	the_feel_felt_found+casual_professionalism	discard	swap_ownership_language_for_casual_professionalism
5855	5.550	the_feel_felt_found+ownership_language+warmth_injection	discard	add_warmth_injection
5856	5.325	the_feel_felt_found+ownership_language+never_say_calm_down	discard	add_never_say_calm_down
5857	5.138	the_feel_felt_found+ownership_language+concrete_next_steps	discard	add_concrete_next_steps
5858	5.225	the_feel_felt_found+casual_professionalism	discard	swap_ownership_language_for_casual_professionalism
5859	5.450	ownership_language+concrete_next_steps	discard	swap_the_feel_felt_found_for_concrete_next_steps
5860	5.650	ownership_language	discard	crossover
5861	5.450	the_feel_felt_found+ownership_language	discard	crossover
5862	5.237	the_feel_felt_found+ownership_language+concrete_next_steps	discard	add_concrete_next_steps
5863	5.350	the_feel_felt_found	discard	remove_ownership_language
5864	5.425	the_feel_felt_found+ownership_language	discard	tone_change
5865	5.550	the_feel_felt_found+energy_matching	discard	swap_ownership_language_for_energy_matching
5866	5.550	the_feel_felt_found+ownership_language	discard	crossover
5867	5.138	the_feel_felt_found+ownership_language	discard	tone_change
5868	5.525	the_feel_felt_found+ownership_language	discard	tone_change
5869	5.300	the_feel_felt_found+ownership_language	discard	temp_0.85
5870	5.237	the_feel_felt_found+ownership_language	discard	temp_0.85
5871	5.113	the_feel_felt_found	discard	crossover
5872	4.800	ownership_language	discard	crossover
5873	4.987	the_feel_felt_found+ownership_language	discard	tone_change
5874	5.425	the_feel_felt_found+ownership_language	discard	temp_0.70
