generation	eq_score	techniques	status	description
16571	5.025	ownership_language+casual_professionalism	discard	swap_the_feel_felt_found_for_casual_professionalism
16572	5.225	ownership_language	discard	remove_the_feel_felt_found
16573	4.487	ownership_language+genuine_admission	discard	swap_the_feel_felt_found_for_genuine_admission
16574	5.013	the_feel_felt_found+ownership_language	discard	temp_0.70
16575	4.912	the_feel_felt_found	discard	remove_ownership_language
16576	5.350	the_feel_felt_found+ownership_language+energy_matching	discard	add_energy_matching
16577	4.825	the_feel_felt_found+ownership_language	discard	crossover
16578	5.138	the_feel_felt_found	discard	remove_ownership_language
16579	5.225	the_feel_felt_found+ownership_language+validation_before_solution	discard	add_validation_before_solution
16580	5.238	the_feel_felt_found+ownership_language	discard	crossover
16581	5.112	the_feel_felt_found+ownership_language	discard	crossover
16582	5.425	ownership_language+warmth_injection	discard	swap_the_feel_felt_found_for_warmth_injection
16583	5.325	the_feel_felt_found+ownership_language	discard	tone_change
16584	4.975	the_feel_felt_found+personal_touch	discard	swap_ownership_language_for_personal_touch
16585	5.125	the_feel_felt_found+ownership_language+personal_touch	discard	add_personal_touch
16586	4.925	the_feel_felt_found+ownership_language	discard	tone_change
16587	5.325	the_feel_felt_found+ownership_language	discard	tone_change
16588	4.912	the_feel_felt_found	discard	remove_ownership_language
16589	5.350	the_feel_felt_found+ownership_language	discard	tone_change
16590	5.450	the_feel_felt_found	discard	remove_ownership_language
16591	5.550	the_feel_felt_found+ownership_language	discard	tone_change
16592	5.112	the_feel_felt_found+ownership_language	discard	tone_change
16593	5.325	the_feel_felt_found+ownership_language	discard	temp_0.90
16594	5.013	the_feel_felt_found+genuine_admission	discard	swap_ownership_language_for_genuine_admission
16595	5.138	ownership_language+proactive_extras	discard	swap_the_feel_felt_found_for_proactive_extras
16596	5.113	ownership_language+validation_before_solution	discard	swap_the_feel_felt_found_for_validation_before_solution
16597	5.138	the_feel_felt_found+ownership_language+emotional_labeling	discard	add_emotional_labeling
16598	5.138	the_feel_felt_found+ownership_language+validation_before_solution	discard	add_validation_before_solution
16599	5.550	the_feel_felt_found+ownership_language	discard	crossover
16600	5.138	the_feel_felt_found+ownership_language	discard	crossover
16601	5.350	the_feel_felt_found+ownership_language	discard	temp_0.85
16602	5.138	ownership_language	discard	remove_the_feel_felt_found
16603	5.325	the_feel_felt_found+ownership_language	discard	temp_0.95
16604	5.013	the_feel_felt_found+ownership_language+validation_before_solution	discard	add_validation_before_solution
16605	5.550	the_feel_felt_found+ownership_language	discard	tone_change
16606	5.238	ownership_language+never_say_calm_down	discard	swap_the_feel_felt_found_for_never_say_calm_down
16607	5.138	the_feel_felt_found+ownership_language+emotional_labeling	discard	add_emotional_labeling
16608	5.550	the_feel_felt_found+emotional_labeling	discard	swap_ownership_language_for_emotional_labeling
16609	5.200	the_feel_felt_found	discard	remove_ownership_language
16610	5.325	the_feel_felt_found+ownership_language	discard	tone_change
16611	5.425	the_feel_felt_found+ownership_language+strategic_agreement	discard	add_strategic_agreement
16612	5.025	ownership_language+never_say_calm_down	discard	swap_the_feel_felt_found_for_never_say_calm_down
16613	5.450	ownership_language	discard	crossover
16614	5.337	the_feel_felt_found+ownership_language	discard	tone_change
16615	4.825	ownership_language+emotional_labeling	discard	swap_the_feel_felt_found_for_emotional_labeling
16616	5.138	ownership_language	discard	remove_the_feel_felt_found
16617	5.138	the_feel_felt_found	discard	crossover
16618	5.138	the_feel_felt_found+ownership_language	discard	temp_0.90
16619	5.138	the_feel_felt_found+ownership_language+emotional_labeling	discard	add_emotional_labeling
16620	4.800	the_feel_felt_found+ownership_language+emotional_labeling	discard	add_emotional_labeling
16621	5.238	the_feel_felt_found+ownership_language	discard	crossover
16622	5.325	the_feel_felt_found+ownership_language+personal_touch	discard	add_personal_touch
16623	5.438	the_feel_felt_found+ownership_language	discard	temp_0.70
16624	5.200	ownership_language	discard	crossover
16625	5.237	the_feel_felt_found+personal_touch	discard	swap_ownership_language_for_personal_touch
16626	5.450	the_feel_felt_found+ownership_language	discard	crossover
16627	5.450	the_feel_felt_found+ownership_language	discard	tone_change
16628	5.337	ownership_language+validation_before_solution	discard	swap_the_feel_felt_found_for_validation_before_solution
16629	5.650	the_feel_felt_found+ownership_language	discard	crossover
16630	5.237	the_feel_felt_found	discard	crossover
16631	5.250	the_feel_felt_found+concrete_next_steps	discard	swap_ownership_language_for_concrete_next_steps
16632	5.325	the_feel_felt_found+ownership_language+validation_before_solution	discard	add_validation_before_solution
16633	5.325	the_feel_felt_found	discard	remove_ownership_language
16634	5.213	the_feel_felt_found+ownership_language	discard	tone_change
16635	5.125	the_feel_felt_found+ownership_language	discard	tone_change
16636	5.550	the_feel_felt_found+ownership_language+energy_matching	discard	add_energy_matching
16637	5.100	the_feel_felt_found	discard	remove_ownership_language
16638	5.450	the_feel_felt_found	discard	crossover
16639	4.800	the_feel_felt_found	discard	crossover
16640	5.550	the_feel_felt_found+ownership_language	discard	tone_change
16641	5.450	the_feel_felt_found+ownership_language+energy_matching	discard	add_energy_matching
16642	5.550	ownership_language	discard	crossover
16643	5.237	the_feel_felt_found+never_say_calm_down	discard	swap_ownership_language_for_never_say_calm_down
16644	5.425	the_feel_felt_found+ownership_language	discard	temp_0.95
16645	5.138	the_feel_felt_found+ownership_language+mirroring	discard	add_mirroring
16646	5.550	the_feel_felt_found+ownership_language	discard	crossover
16647	5.113	the_feel_felt_found+ownership_language	discard	tone_change
16648	5.550	the_feel_felt_found+ownership_language+validation_before_solution	discard	add_validation_before_solution
16649	5.425	the_feel_felt_found+ownership_language	discard	temp_0.85
16650	5.550	none	discard	crossover
16651	5.450	the_feel_felt_found+ownership_language	discard	temp_0.85
16652	5.550	the_feel_felt_found	discard	remove_ownership_language
16653	5.550	the_feel_felt_found+concrete_next_steps	discard	swap_ownership_language_for_concrete_next_steps
16654	5.450	the_feel_felt_found+ownership_language	discard	temp_0.65
16655	5.238	the_feel_felt_found+ownership_language+warmth_injection	discard	add_warmth_injection
16656	5.138	the_feel_felt_found+ownership_language	discard	tone_change
16657	5.325	the_feel_felt_found+ownership_language	discard	tone_change
16658	5.325	the_feel_felt_found+ownership_language	discard	temp_0.65
16659	5.238	the_feel_felt_found+ownership_language	discard	temp_0.65
16660	5.550	the_feel_felt_found+ownership_language	discard	crossover
16661	5.037	the_feel_felt_found+ownership_language	discard	temp_0.75
16662	5.325	the_feel_felt_found+ownership_language	discard	temp_0.85
16663	5.550	the_feel_felt_found+never_say_calm_down	discard	swap_ownership_language_for_never_say_calm_down
16664	5.237	the_feel_felt_found+ownership_language	discard	temp_0.90
16665	5.525	the_feel_felt_found+ownership_language	discard	tone_change
16666	5.200	the_feel_felt_found+ownership_language+personal_touch	discard	add_personal_touch
16667	5.750	the_feel_felt_found+ownership_language	discard	temp_0.85
16668	5.112	the_feel_felt_found	discard	crossover
16669	5.013	the_feel_felt_found+ownership_language	discard	tone_change
16670	5.125	the_feel_felt_found+ownership_language	discard	tone_change
16671	5.200	the_feel_felt_found+ownership_language	discard	temp_0.70
16672	4.987	the_feel_felt_found+ownership_language+energy_matching	discard	add_energy_matching
16673	4.700	the_feel_felt_found+warmth_injection	discard	swap_ownership_language_for_warmth_injection
16674	5.450	the_feel_felt_found+ownership_language	discard	crossover
16675	5.138	the_feel_felt_found+ownership_language	discard	tone_change
16676	5.350	the_feel_felt_found	discard	remove_ownership_language
16677	5.425	the_feel_felt_found+ownership_language	discard	tone_change
16678	5.025	the_feel_felt_found	discard	crossover
16679	4.675	the_feel_felt_found	discard	remove_ownership_language
16680	5.338	the_feel_felt_found+ownership_language	discard	temp_0.95
16681	5.013	the_feel_felt_found+ownership_language	discard	crossover
16682	5.450	ownership_language	discard	crossover
16683	5.338	the_feel_felt_found+ownership_language	discard	crossover
16684	5.425	the_feel_felt_found+ownership_language	discard	temp_0.90
16685	5.650	none	discard	crossover
16686	5.350	the_feel_felt_found+ownership_language	discard	temp_0.95
16687	5.450	the_feel_felt_found+ownership_language	discard	tone_change
16688	5.325	the_feel_felt_found+ownership_language	discard	tone_change
16689	5.138	the_feel_felt_found+ownership_language+personal_touch	discard	add_personal_touch
16690	5.013	the_feel_felt_found+ownership_language	discard	tone_change
16691	5.650	ownership_language+warmth_injection	discard	swap_the_feel_felt_found_for_warmth_injection
16692	5.550	ownership_language	discard	crossover
16693	5.550	the_feel_felt_found+ownership_language	discard	tone_change
16694	5.237	the_feel_felt_found+ownership_language+energy_matching	discard	add_energy_matching
16695	5.550	the_feel_felt_found+ownership_language	discard	tone_change
16696	5.450	the_feel_felt_found+ownership_language	discard	crossover
16697	5.138	the_feel_felt_found+ownership_language	discard	tone_change
16698	4.888	the_feel_felt_found+ownership_language+concrete_next_steps	discard	add_concrete_next_steps
16699	5.425	the_feel_felt_found	discard	remove_ownership_language
16700	4.825	the_feel_felt_found+ownership_language	discard	tone_change
16701	5.225	the_feel_felt_found+ownership_language+casual_professionalism	discard	add_casual_professionalism
16702	5.138	the_feel_felt_found+ownership_language	discard	crossover
16703	5.450	the_feel_felt_found+ownership_language	discard	tone_change
16704	5.025	the_feel_felt_found+ownership_language+genuine_admission	discard	add_genuine_admission
16705	4.713	the_feel_felt_found+never_say_calm_down	discard	swap_ownership_language_for_never_say_calm_down
16706	5.325	the_feel_felt_found+ownership_language	discard	temp_0.90
16707	5.237	the_feel_felt_found+ownership_language+strategic_agreement	discard	add_strategic_agreement
16708	5.138	the_feel_felt_found+ownership_language	discard	temp_0.70
16709	5.137	ownership_language+emotional_labeling	discard	swap_the_feel_felt_found_for_emotional_labeling
16710	5.450	the_feel_felt_found+warmth_injection	discard	swap_ownership_language_for_warmth_injection
16711	5.550	ownership_language	discard	remove_the_feel_felt_found
16712	4.700	the_feel_felt_found+ownership_language	discard	temp_0.75
16713	5.350	the_feel_felt_found+ownership_language	discard	temp_0.90
16714	5.650	the_feel_felt_found+ownership_language	discard	temp_0.75
16715	4.800	the_feel_felt_found+personal_touch	discard	swap_ownership_language_for_personal_touch
16716	5.550	ownership_language+mirroring	discard	swap_the_feel_felt_found_for_mirroring
16717	5.237	the_feel_felt_found+ownership_language	discard	temp_0.70
16718	5.237	the_feel_felt_found+ownership_language	discard	tone_change
16719	5.550	the_feel_felt_found+ownership_language+proactive_extras	discard	add_proactive_extras
16720	5.237	the_feel_felt_found+ownership_language	discard	temp_0.75
16721	5.025	ownership_language+mirroring	discard	swap_the_feel_felt_found_for_mirroring
16722	5.237	ownership_language	discard	crossover
16723	5.237	the_feel_felt_found+ownership_language+emotional_labeling	discard	add_emotional_labeling
16724	5.350	the_feel_felt_found+ownership_language+never_say_calm_down	discard	add_never_say_calm_down
16725	5.237	the_feel_felt_found+ownership_language	discard	tone_change
16726	5.450	the_feel_felt_found+ownership_language+warmth_injection	discard	add_warmth_injection
16727	5.350	the_feel_felt_found+ownership_language	discard	crossover
16728	5.325	the_feel_felt_found+ownership_language	discard	temp_0.65
16729	4.513	the_feel_felt_found	discard	crossover
16730	5.138	the_feel_felt_found+mirroring	discard	swap_ownership_language_for_mirroring
16731	5.550	the_feel_felt_found+emotional_labeling	discard	swap_ownership_language_for_emotional_labeling
16732	5.650	the_feel_felt_found+ownership_language+mirroring	discard	add_mirroring
16733	5.025	the_feel_felt_found+ownership_language	discard	tone_change
16734	5.138	ownership_language	discard	remove_the_feel_felt_found
16735	5.013	the_feel_felt_found+ownership_language	discard	temp_0.70
16736	5.013	the_feel_felt_found+ownership_language	discard	tone_change
16737	5.550	ownership_language	discard	crossover
16738	5.138	the_feel_felt_found+validation_before_solution	discard	swap_ownership_language_for_validation_before_solution
16739	5.125	the_feel_felt_found+ownership_language+validation_before_solution	discard	add_validation_before_solution
16740	5.138	ownership_language	discard	remove_the_feel_felt_found
16741	5.450	the_feel_felt_found+ownership_language	discard	tone_change
16742	5.238	the_feel_felt_found+ownership_language+strategic_agreement	discard	add_strategic_agreement
16743	5.425	the_feel_felt_found+ownership_language	discard	crossover
16744	5.200	the_feel_felt_found+ownership_language	discard	tone_change
16745	5.138	the_feel_felt_found+ownership_language	discard	temp_0.85
16746	5.450	the_feel_felt_found+ownership_language+genuine_admission	discard	add_genuine_admission
16747	5.013	the_feel_felt_found+ownership_language+never_say_calm_down	discard	add_never_say_calm_down
16748	5.650	the_feel_felt_found+ownership_language	discard	temp_0.95
16749	5.338	ownership_language+never_say_calm_down	discard	swap_the_feel_felt_found_for_never_say_calm_down
16750	5.450	the_feel_felt_found+ownership_language	discard	tone_change
16751	5.225	the_feel_felt_found+ownership_language	discard	temp_0.95
16752	5.238	the_feel_felt_found+ownership_language	discard	tone_change
16753	5.238	the_feel_felt_found+ownership_language	discard	crossover
16754	5.650	the_feel_felt_found+ownership_language+casual_professionalism	discard	add_casual_professionalism
16755	5.525	the_feel_felt_found+ownership_language	discard	crossover
16756	5.138	the_feel_felt_found+ownership_language	discard	tone_change
16757	5.525	the_feel_felt_found+ownership_language	discard	tone_change
16758	5.450	the_feel_felt_found+ownership_language	discard	crossover
16759	4.613	the_feel_felt_found	discard	crossover
16760	5.550	the_feel_felt_found+ownership_language	discard	tone_change
16761	4.800	ownership_language+concrete_next_steps	discard	swap_the_feel_felt_found_for_concrete_next_steps
16762	5.112	none	discard	crossover
16763	5.450	ownership_language	discard	crossover
16764	5.650	the_feel_felt_found+ownership_language	discard	crossover
16765	5.450	the_feel_felt_found+ownership_language	discard	temp_0.95
16766	5.450	the_feel_felt_found+ownership_language	discard	temp_0.95
16767	5.437	the_feel_felt_found+ownership_language	discard	crossover
16768	5.225	ownership_language	discard	crossover
16769	5.425	the_feel_felt_found+ownership_language	discard	tone_change
16770	5.025	the_feel_felt_found+ownership_language	discard	tone_change
16771	5.138	the_feel_felt_found+mirroring	discard	swap_ownership_language_for_mirroring
16772	5.250	ownership_language	discard	remove_the_feel_felt_found
16773	5.425	the_feel_felt_found+ownership_language	discard	temp_0.85
16774	5.200	ownership_language+proactive_extras	discard	swap_the_feel_felt_found_for_proactive_extras
16775	5.138	the_feel_felt_found+ownership_language+warmth_injection	discard	add_warmth_injection
16776	4.925	ownership_language+proactive_extras	discard	swap_the_feel_felt_found_for_proactive_extras
16777	4.800	ownership_language	discard	remove_the_feel_felt_found
16778	5.213	the_feel_felt_found+ownership_language	discard	crossover
16779	5.200	ownership_language	discard	crossover
16780	4.700	the_feel_felt_found+ownership_language	discard	temp_0.75
16781	5.138	the_feel_felt_found+personal_touch	discard	swap_ownership_language_for_personal_touch
16782	5.450	the_feel_felt_found+ownership_language	discard	crossover
16783	5.300	the_feel_felt_found+ownership_language+genuine_admission	discard	add_genuine_admission
16784	5.650	the_feel_felt_found+ownership_language	discard	tone_change
16785	5.237	the_feel_felt_found+ownership_language+genuine_admission	discard	add_genuine_admission
16786	5.325	the_feel_felt_found+mirroring	discard	swap_ownership_language_for_mirroring
16787	4.925	ownership_language+never_say_calm_down	discard	swap_the_feel_felt_found_for_never_say_calm_down
16788	5.300	the_feel_felt_found	discard	remove_ownership_language
16789	5.013	the_feel_felt_found+casual_professionalism	discard	swap_ownership_language_for_casual_professionalism
16790	5.350	the_feel_felt_found	discard	remove_ownership_language
16791	5.550	ownership_language+energy_matching	discard	swap_the_feel_felt_found_for_energy_matching
16792	5.113	the_feel_felt_found+ownership_language+emotional_labeling	discard	add_emotional_labeling
16793	4.925	the_feel_felt_found+ownership_language+emotional_labeling	discard	add_emotional_labeling
16794	5.550	the_feel_felt_found+ownership_language	discard	temp_0.90
16795	5.037	the_feel_felt_found+ownership_language	discard	crossover
16796	5.237	the_feel_felt_found	discard	remove_ownership_language
16797	5.013	the_feel_felt_found+ownership_language	discard	tone_change
16798	5.200	the_feel_felt_found+ownership_language	discard	temp_0.95
16799	5.037	the_feel_felt_found+ownership_language	discard	tone_change
16800	5.350	the_feel_felt_found+ownership_language	discard	tone_change
16801	5.425	the_feel_felt_found+ownership_language+mirroring	discard	add_mirroring
16802	4.925	the_feel_felt_found+ownership_language	discard	temp_0.95
16803	5.325	the_feel_felt_found+ownership_language	discard	tone_change
16804	4.700	ownership_language+energy_matching	discard	swap_the_feel_felt_found_for_energy_matching
16805	5.450	the_feel_felt_found+ownership_language	discard	temp_0.85
16806	5.450	the_feel_felt_found+ownership_language	discard	temp_0.70
16807	5.750	the_feel_felt_found	discard	remove_ownership_language
16808	5.650	ownership_language	discard	crossover
16809	5.038	ownership_language	discard	crossover
16810	5.325	the_feel_felt_found+ownership_language+warmth_injection	discard	add_warmth_injection
16811	5.112	the_feel_felt_found+ownership_language	discard	tone_change
16812	5.112	the_feel_felt_found	discard	crossover
16813	5.450	the_feel_felt_found+ownership_language	discard	temp_0.85
16814	5.138	the_feel_felt_found+ownership_language+personal_touch	discard	add_personal_touch
16815	4.800	the_feel_felt_found+ownership_language	discard	temp_0.70
16816	5.138	the_feel_felt_found+ownership_language	discard	crossover
16817	5.112	the_feel_felt_found+ownership_language	discard	tone_change
16818	5.013	the_feel_felt_found+ownership_language	discard	tone_change
16819	5.112	ownership_language	discard	crossover
16820	4.700	the_feel_felt_found+ownership_language	discard	tone_change
16821	5.425	the_feel_felt_found+ownership_language+warmth_injection	discard	add_warmth_injection
16822	5.025	the_feel_felt_found+ownership_language	discard	tone_change
16823	5.338	the_feel_felt_found+ownership_language+concrete_next_steps	discard	add_concrete_next_steps
16824	5.138	the_feel_felt_found+ownership_language	discard	tone_change
16825	5.450	the_feel_felt_found+ownership_language	discard	temp_0.85
16826	5.238	the_feel_felt_found+ownership_language	discard	crossover
16827	4.888	ownership_language	discard	crossover
16828	5.450	the_feel_felt_found	discard	remove_ownership_language
16829	5.325	the_feel_felt_found+ownership_language+validation_before_solution	discard	add_validation_before_solution
16830	5.238	the_feel_felt_found+ownership_language	discard	temp_0.85
16831	5.650	the_feel_felt_found+warmth_injection	discard	swap_ownership_language_for_warmth_injection
16832	5.013	none	discard	crossover
16833	5.037	the_feel_felt_found+ownership_language+never_say_calm_down	discard	add_never_say_calm_down
16834	5.013	the_feel_felt_found+ownership_language+strategic_agreement	discard	add_strategic_agreement
16835	5.237	ownership_language+mirroring	discard	swap_the_feel_felt_found_for_mirroring
16836	5.225	the_feel_felt_found+ownership_language	discard	temp_0.90
16837	5.550	the_feel_felt_found+ownership_language+mirroring	discard	add_mirroring
16838	5.525	the_feel_felt_found+ownership_language+mirroring	discard	add_mirroring
16839	5.325	the_feel_felt_found+ownership_language	discard	tone_change
16840	5.450	the_feel_felt_found+ownership_language+mirroring	discard	add_mirroring
16841	5.338	ownership_language+energy_matching	discard	swap_the_feel_felt_found_for_energy_matching
16842	5.450	the_feel_felt_found	discard	remove_ownership_language
16843	5.650	the_feel_felt_found+ownership_language	discard	tone_change
16844	4.825	ownership_language+personal_touch	discard	swap_the_feel_felt_found_for_personal_touch
16845	5.238	ownership_language+genuine_admission	discard	swap_the_feel_felt_found_for_genuine_admission
16846	5.350	the_feel_felt_found+warmth_injection	discard	swap_ownership_language_for_warmth_injection
16847	5.450	the_feel_felt_found+ownership_language+warmth_injection	discard	add_warmth_injection
16848	5.237	the_feel_felt_found	discard	crossover
16849	5.138	the_feel_felt_found+personal_touch	discard	swap_ownership_language_for_personal_touch
16850	5.225	the_feel_felt_found+ownership_language	discard	tone_change
