generation	eq_score	techniques	status	description
15194	5.138	the_feel_felt_found	discard	crossover
15195	5.237	the_feel_felt_found+ownership_language+personal_touch	discard	add_personal_touch
15196	5.437	the_feel_felt_found+ownership_language	discard	tone_change
15197	5.237	ownership_language	discard	remove_the_feel_felt_found
15198	5.113	ownership_language+mirroring	discard	swap_the_feel_felt_found_for_mirroring
15199	5.138	the_feel_felt_found+ownership_language	discard	temp_0.95
15200	5.237	the_feel_felt_found	discard	crossover
15201	5.225	the_feel_felt_found+ownership_language	discard	tone_change
15202	5.325	the_feel_felt_found+genuine_admission	discard	swap_ownership_language_for_genuine_admission
15203	5.013	the_feel_felt_found+ownership_language	discard	temp_0.95
15204	5.550	the_feel_felt_found+ownership_language	discard	crossover
15205	5.238	the_feel_felt_found+ownership_language+never_say_calm_down	discard	add_never_say_calm_down
15206	5.750	ownership_language+emotional_labeling	discard	swap_the_feel_felt_found_for_emotional_labeling
15207	5.112	the_feel_felt_found+ownership_language	discard	tone_change
15208	5.350	the_feel_felt_found+ownership_language+validation_before_solution	discard	add_validation_before_solution
15209	4.825	the_feel_felt_found+ownership_language	discard	tone_change
15210	5.225	the_feel_felt_found+ownership_language	discard	tone_change
15211	5.550	the_feel_felt_found+ownership_language	discard	tone_change
15212	5.450	the_feel_felt_found+ownership_language	discard	tone_change
15213	5.200	ownership_language+genuine_admission	discard	swap_the_feel_felt_found_for_genuine_admission
15214	5.425	the_feel_felt_found+ownership_language	discard	tone_change
15215	5.325	the_feel_felt_found+warmth_injection	discard	swap_ownership_language_for_warmth_injection
15216	5.225	the_feel_felt_found+ownership_language	discard	temp_0.70
15217	5.325	ownership_language+strategic_agreement	discard	swap_the_feel_felt_found_for_strategic_agreement
15218	5.237	the_feel_felt_found+ownership_language+never_say_calm_down	discard	add_never_say_calm_down
15219	5.225	the_feel_felt_found+ownership_language	discard	tone_change
15220	5.138	the_feel_felt_found+ownership_language+genuine_admission	discard	add_genuine_admission
15221	5.450	the_feel_felt_found+ownership_language	discard	tone_change
15222	5.237	the_feel_felt_found+ownership_language	discard	temp_0.75
15223	5.450	the_feel_felt_found+ownership_language	discard	temp_0.90
15224	5.138	none	discard	crossover
15225	5.037	the_feel_felt_found+ownership_language+proactive_extras	discard	add_proactive_extras
15226	4.825	the_feel_felt_found+never_say_calm_down	discard	swap_ownership_language_for_never_say_calm_down
15227	5.138	the_feel_felt_found+ownership_language	discard	temp_0.90
15228	5.200	the_feel_felt_found+ownership_language	discard	crossover
15229	5.450	the_feel_felt_found+ownership_language+validation_before_solution	discard	add_validation_before_solution
15230	5.213	the_feel_felt_found+ownership_language	discard	tone_change
15231	5.237	the_feel_felt_found+ownership_language+never_say_calm_down	discard	add_never_say_calm_down
15232	4.912	none	discard	crossover
15233	5.237	the_feel_felt_found+ownership_language+warmth_injection	discard	add_warmth_injection
15234	5.550	ownership_language	discard	remove_the_feel_felt_found
15235	5.213	the_feel_felt_found+ownership_language	discard	tone_change
15236	5.450	the_feel_felt_found+ownership_language	discard	tone_change
15237	5.138	the_feel_felt_found+ownership_language+validation_before_solution	discard	add_validation_before_solution
15238	5.450	the_feel_felt_found+ownership_language	discard	temp_0.85
15239	5.325	the_feel_felt_found+ownership_language	discard	tone_change
15240	5.325	the_feel_felt_found+ownership_language	discard	tone_change
15241	5.237	the_feel_felt_found+ownership_language	discard	tone_change
15242	5.550	the_feel_felt_found+ownership_language	discard	crossover
15243	5.650	the_feel_felt_found+ownership_language	discard	crossover
15244	4.987	ownership_language	discard	remove_the_feel_felt_found
15245	5.325	the_feel_felt_found+ownership_language	discard	temp_0.90
15246	4.825	the_feel_felt_found+warmth_injection	discard	swap_ownership_language_for_warmth_injection
15247	5.525	ownership_language	discard	crossover
15248	5.112	the_feel_felt_found+ownership_language	discard	tone_change
15249	5.325	the_feel_felt_found+ownership_language	discard	temp_0.70
15250	5.138	the_feel_felt_found+genuine_admission	discard	swap_ownership_language_for_genuine_admission
15251	4.987	the_feel_felt_found+ownership_language+mirroring	discard	add_mirroring
15252	5.025	the_feel_felt_found+mirroring	discard	swap_ownership_language_for_mirroring
15253	4.925	ownership_language	discard	remove_the_feel_felt_found
15254	5.138	the_feel_felt_found+ownership_language	discard	crossover
15255	5.013	the_feel_felt_found+casual_professionalism	discard	swap_ownership_language_for_casual_professionalism
15256	5.650	the_feel_felt_found+ownership_language	discard	tone_change
15257	4.812	the_feel_felt_found+ownership_language	discard	temp_0.95
15258	5.450	the_feel_felt_found+ownership_language	discard	tone_change
15259	5.237	the_feel_felt_found+ownership_language	discard	tone_change
15260	5.013	the_feel_felt_found+ownership_language	discard	tone_change
15261	5.425	the_feel_felt_found+ownership_language+strategic_agreement	discard	add_strategic_agreement
15262	5.425	the_feel_felt_found+ownership_language	discard	temp_0.75
15263	5.300	the_feel_felt_found+ownership_language+never_say_calm_down	discard	add_never_say_calm_down
15264	5.013	ownership_language	discard	crossover
15265	5.550	the_feel_felt_found+ownership_language	discard	temp_0.75
15266	4.513	ownership_language+emotional_labeling	discard	swap_the_feel_felt_found_for_emotional_labeling
15267	5.237	the_feel_felt_found+ownership_language	discard	tone_change
15268	5.025	the_feel_felt_found+ownership_language+concrete_next_steps	discard	add_concrete_next_steps
15269	5.325	the_feel_felt_found+ownership_language	discard	temp_0.65
15270	5.650	the_feel_felt_found+ownership_language	discard	tone_change
15271	5.013	the_feel_felt_found+casual_professionalism	discard	swap_ownership_language_for_casual_professionalism
15272	5.200	the_feel_felt_found+ownership_language	discard	temp_0.90
15273	5.237	ownership_language	discard	remove_the_feel_felt_found
15274	5.013	the_feel_felt_found+ownership_language+validation_before_solution	discard	add_validation_before_solution
15275	5.425	the_feel_felt_found+ownership_language	discard	crossover
15276	5.300	the_feel_felt_found+ownership_language	discard	tone_change
15277	5.238	the_feel_felt_found+ownership_language	discard	crossover
15278	5.338	the_feel_felt_found+ownership_language	discard	temp_0.90
15279	5.300	the_feel_felt_found+ownership_language	discard	crossover
15280	5.238	the_feel_felt_found+ownership_language	discard	tone_change
15281	5.450	the_feel_felt_found+proactive_extras	discard	swap_ownership_language_for_proactive_extras
15282	5.325	the_feel_felt_found+ownership_language+genuine_admission	discard	add_genuine_admission
15283	5.450	the_feel_felt_found+ownership_language	discard	crossover
15284	5.038	the_feel_felt_found+ownership_language+warmth_injection	discard	add_warmth_injection
15285	5.138	the_feel_felt_found+ownership_language	discard	tone_change
15286	5.450	the_feel_felt_found+ownership_language+emotional_labeling	discard	add_emotional_labeling
15287	5.450	the_feel_felt_found+ownership_language	discard	tone_change
15288	5.325	ownership_language+personal_touch	discard	swap_the_feel_felt_found_for_personal_touch
15289	5.113	ownership_language+concrete_next_steps	discard	swap_the_feel_felt_found_for_concrete_next_steps
15290	5.650	the_feel_felt_found+ownership_language+genuine_admission	discard	add_genuine_admission
15291	5.425	the_feel_felt_found	discard	crossover
15292	5.238	none	discard	crossover
15293	5.138	the_feel_felt_found+ownership_language+genuine_admission	discard	add_genuine_admission
15294	5.237	the_feel_felt_found	discard	remove_ownership_language
15295	4.912	the_feel_felt_found+ownership_language+validation_before_solution	discard	add_validation_before_solution
15296	5.300	the_feel_felt_found+ownership_language	discard	temp_0.70
15297	5.237	ownership_language	discard	remove_the_feel_felt_found
15298	5.025	the_feel_felt_found+warmth_injection	discard	swap_ownership_language_for_warmth_injection
15299	5.425	ownership_language	discard	crossover
15300	5.138	the_feel_felt_found+validation_before_solution	discard	swap_ownership_language_for_validation_before_solution
15301	5.013	ownership_language	discard	crossover
15302	5.450	the_feel_felt_found+emotional_labeling	discard	swap_ownership_language_for_emotional_labeling
15303	5.325	the_feel_felt_found+personal_touch	discard	swap_ownership_language_for_personal_touch
15304	5.450	the_feel_felt_found+ownership_language+validation_before_solution	discard	add_validation_before_solution
15305	5.138	the_feel_felt_found+ownership_language+mirroring	discard	add_mirroring
15306	4.925	the_feel_felt_found	discard	crossover
15307	5.138	the_feel_felt_found+ownership_language	discard	tone_change
15308	4.912	the_feel_felt_found+ownership_language+energy_matching	discard	add_energy_matching
15309	5.325	the_feel_felt_found+ownership_language	discard	crossover
15310	5.138	the_feel_felt_found+ownership_language	discard	temp_0.65
15311	5.450	the_feel_felt_found+ownership_language	discard	tone_change
15312	5.338	the_feel_felt_found+ownership_language	discard	temp_0.95
15313	5.112	ownership_language+mirroring	discard	swap_the_feel_felt_found_for_mirroring
15314	5.337	the_feel_felt_found	discard	crossover
15315	5.338	the_feel_felt_found+ownership_language	discard	tone_change
15316	5.138	the_feel_felt_found+validation_before_solution	discard	swap_ownership_language_for_validation_before_solution
15317	5.550	the_feel_felt_found+ownership_language	discard	tone_change
15318	5.237	the_feel_felt_found+ownership_language	discard	crossover
15319	5.550	the_feel_felt_found+ownership_language+warmth_injection	discard	add_warmth_injection
15320	5.237	the_feel_felt_found+ownership_language	discard	temp_0.95
15321	5.300	the_feel_felt_found+ownership_language+emotional_labeling	discard	add_emotional_labeling
15322	5.450	the_feel_felt_found+ownership_language+energy_matching	discard	add_energy_matching
15323	5.113	the_feel_felt_found+ownership_language	discard	tone_change
15324	5.550	the_feel_felt_found+ownership_language	discard	crossover
15325	5.237	the_feel_felt_found+ownership_language	discard	crossover
15326	5.225	the_feel_felt_found	discard	crossover
15327	5.025	the_feel_felt_found+ownership_language	discard	crossover
15328	5.013	the_feel_felt_found+ownership_language	discard	temp_0.75
15329	5.112	the_feel_felt_found+ownership_language	discard	tone_change
15330	5.138	ownership_language+proactive_extras	discard	swap_the_feel_felt_found_for_proactive_extras
15331	5.237	the_feel_felt_found+ownership_language	discard	crossover
15332	5.237	the_feel_felt_found+ownership_language+emotional_labeling	discard	add_emotional_labeling
15333	5.325	the_feel_felt_found+ownership_language	discard	tone_change
15334	5.550	the_feel_felt_found	discard	remove_ownership_language
15335	5.550	the_feel_felt_found+ownership_language+emotional_labeling	discard	add_emotional_labeling
15336	4.888	the_feel_felt_found+ownership_language	discard	tone_change
15337	5.138	the_feel_felt_found	discard	remove_ownership_language
15338	5.325	the_feel_felt_found+ownership_language	discard	crossover
15339	4.912	the_feel_felt_found	discard	crossover
15340	5.138	the_feel_felt_found+ownership_language+genuine_admission	discard	add_genuine_admission
15341	5.338	the_feel_felt_found+ownership_language	discard	temp_0.95
15342	5.013	the_feel_felt_found+ownership_language+proactive_extras	discard	add_proactive_extras
15343	5.237	the_feel_felt_found+ownership_language+emotional_labeling	discard	add_emotional_labeling
15344	5.425	the_feel_felt_found+ownership_language	discard	crossover
15345	5.550	the_feel_felt_found+ownership_language+mirroring	discard	add_mirroring
15346	5.325	the_feel_felt_found+ownership_language	discard	tone_change
15347	5.237	the_feel_felt_found+ownership_language	discard	tone_change
15348	5.237	ownership_language+proactive_extras	discard	swap_the_feel_felt_found_for_proactive_extras
15349	5.450	ownership_language	discard	crossover
15350	5.237	the_feel_felt_found	discard	crossover
15351	5.013	the_feel_felt_found+ownership_language	discard	tone_change
15352	5.550	the_feel_felt_found+ownership_language	discard	tone_change
15353	4.825	ownership_language+genuine_admission	discard	swap_the_feel_felt_found_for_genuine_admission
15354	5.350	ownership_language+warmth_injection	discard	swap_the_feel_felt_found_for_warmth_injection
15355	4.987	the_feel_felt_found+ownership_language	discard	tone_change
15356	5.138	the_feel_felt_found+ownership_language	discard	crossover
15357	5.138	the_feel_felt_found+concrete_next_steps	discard	swap_ownership_language_for_concrete_next_steps
15358	5.425	the_feel_felt_found+genuine_admission	discard	swap_ownership_language_for_genuine_admission
15359	5.437	ownership_language+validation_before_solution	discard	swap_the_feel_felt_found_for_validation_before_solution
15360	5.075	the_feel_felt_found+emotional_labeling	discard	swap_ownership_language_for_emotional_labeling
15361	5.138	the_feel_felt_found+ownership_language	discard	temp_0.85
15362	5.325	the_feel_felt_found+ownership_language	discard	temp_0.65
15363	5.325	the_feel_felt_found	discard	remove_ownership_language
15364	5.450	the_feel_felt_found+ownership_language	discard	crossover
15365	5.238	ownership_language	discard	remove_the_feel_felt_found
15366	5.350	the_feel_felt_found+ownership_language	discard	temp_0.65
15367	5.550	the_feel_felt_found+emotional_labeling	discard	swap_ownership_language_for_emotional_labeling
15368	5.450	the_feel_felt_found+casual_professionalism	discard	swap_ownership_language_for_casual_professionalism
15369	5.550	ownership_language+strategic_agreement	discard	swap_the_feel_felt_found_for_strategic_agreement
15370	5.138	none	discard	crossover
15371	5.138	the_feel_felt_found+ownership_language+mirroring	discard	add_mirroring
15372	5.013	ownership_language+genuine_admission	discard	swap_the_feel_felt_found_for_genuine_admission
15373	5.425	the_feel_felt_found+strategic_agreement	discard	swap_ownership_language_for_strategic_agreement
15374	5.325	the_feel_felt_found+ownership_language	discard	crossover
15375	5.237	the_feel_felt_found+ownership_language	discard	tone_change
15376	5.338	the_feel_felt_found	discard	crossover
15377	5.237	none	discard	crossover
15378	4.700	the_feel_felt_found+ownership_language+strategic_agreement	discard	add_strategic_agreement
15379	4.675	the_feel_felt_found+ownership_language	discard	tone_change
15380	5.550	the_feel_felt_found+ownership_language+validation_before_solution	discard	add_validation_before_solution
15381	5.325	the_feel_felt_found+ownership_language	discard	tone_change
15382	5.450	the_feel_felt_found+ownership_language	discard	temp_0.65
15383	5.450	the_feel_felt_found+ownership_language+mirroring	discard	add_mirroring
15384	5.112	the_feel_felt_found	discard	crossover
15385	5.325	the_feel_felt_found	discard	crossover
15386	4.700	the_feel_felt_found+ownership_language+validation_before_solution	discard	add_validation_before_solution
15387	5.138	the_feel_felt_found+ownership_language	discard	temp_0.65
15388	5.550	ownership_language+strategic_agreement	discard	swap_the_feel_felt_found_for_strategic_agreement
15389	5.550	the_feel_felt_found+ownership_language	discard	tone_change
15390	5.425	the_feel_felt_found+ownership_language	discard	tone_change
15391	5.037	the_feel_felt_found+ownership_language+mirroring	discard	add_mirroring
15392	5.138	the_feel_felt_found+ownership_language+personal_touch	discard	add_personal_touch
15393	5.550	the_feel_felt_found+strategic_agreement	discard	swap_ownership_language_for_strategic_agreement
15394	5.238	the_feel_felt_found+ownership_language	discard	temp_0.70
15395	5.450	the_feel_felt_found+warmth_injection	discard	swap_ownership_language_for_warmth_injection
15396	5.238	the_feel_felt_found+ownership_language	discard	temp_0.65
15397	5.300	the_feel_felt_found	discard	remove_ownership_language
15398	5.237	the_feel_felt_found+never_say_calm_down	discard	swap_ownership_language_for_never_say_calm_down
15399	4.825	the_feel_felt_found+ownership_language	discard	crossover
15400	5.025	the_feel_felt_found+ownership_language	discard	temp_0.90
15401	5.013	the_feel_felt_found+ownership_language	discard	temp_0.90
15402	5.450	the_feel_felt_found+ownership_language	discard	crossover
15403	5.425	the_feel_felt_found+ownership_language	discard	temp_0.90
15404	5.200	the_feel_felt_found+ownership_language	discard	tone_change
15405	5.238	the_feel_felt_found	discard	remove_ownership_language
15406	5.425	the_feel_felt_found+ownership_language	discard	tone_change
15407	5.325	the_feel_felt_found+strategic_agreement	discard	swap_ownership_language_for_strategic_agreement
15408	5.013	the_feel_felt_found	discard	crossover
15409	4.800	the_feel_felt_found+ownership_language+genuine_admission	discard	add_genuine_admission
15410	5.650	the_feel_felt_found+ownership_language	discard	tone_change
15411	5.450	the_feel_felt_found+ownership_language+casual_professionalism	discard	add_casual_professionalism
15412	5.237	the_feel_felt_found+ownership_language	discard	crossover
15413	5.037	the_feel_felt_found+ownership_language+casual_professionalism	discard	add_casual_professionalism
15414	5.200	the_feel_felt_found+ownership_language+proactive_extras	discard	add_proactive_extras
15415	5.025	the_feel_felt_found	discard	remove_ownership_language
15416	5.338	none	discard	crossover
15417	4.825	the_feel_felt_found	discard	remove_ownership_language
15418	4.800	the_feel_felt_found+ownership_language	discard	crossover
15419	5.013	the_feel_felt_found+ownership_language	discard	tone_change
15420	5.550	the_feel_felt_found+energy_matching	discard	swap_ownership_language_for_energy_matching
15421	5.525	the_feel_felt_found+ownership_language	discard	temp_0.75
15422	5.325	the_feel_felt_found+ownership_language	discard	crossover
15423	5.450	the_feel_felt_found+ownership_language	discard	temp_0.75
15424	5.325	the_feel_felt_found+ownership_language	discard	tone_change
15425	5.550	the_feel_felt_found+ownership_language	discard	crossover
15426	4.825	ownership_language	discard	crossover
15427	5.138	the_feel_felt_found+ownership_language	discard	tone_change
15428	5.238	the_feel_felt_found+ownership_language	discard	temp_0.95
15429	5.113	ownership_language	discard	crossover
15430	5.650	the_feel_felt_found+warmth_injection	discard	swap_ownership_language_for_warmth_injection
15431	4.925	the_feel_felt_found+ownership_language+proactive_extras	discard	add_proactive_extras
15432	4.925	ownership_language+validation_before_solution	discard	swap_the_feel_felt_found_for_validation_before_solution
15433	5.225	the_feel_felt_found	discard	crossover
15434	5.550	the_feel_felt_found+ownership_language	discard	crossover
15435	5.550	ownership_language+warmth_injection	discard	swap_the_feel_felt_found_for_warmth_injection
15436	4.825	the_feel_felt_found	discard	remove_ownership_language
15437	4.925	the_feel_felt_found+ownership_language+validation_before_solution	discard	add_validation_before_solution
15438	5.350	the_feel_felt_found+ownership_language	discard	temp_0.70
15439	5.650	the_feel_felt_found+ownership_language+mirroring	discard	add_mirroring
15440	4.825	the_feel_felt_found+ownership_language	discard	tone_change
15441	5.300	the_feel_felt_found+ownership_language	discard	tone_change
15442	4.612	the_feel_felt_found	discard	crossover
15443	5.325	the_feel_felt_found+ownership_language	discard	tone_change
15444	5.425	ownership_language+warmth_injection	discard	swap_the_feel_felt_found_for_warmth_injection
15445	5.213	the_feel_felt_found+ownership_language	discard	crossover
15446	5.238	the_feel_felt_found+ownership_language+mirroring	discard	add_mirroring
15447	5.550	the_feel_felt_found+ownership_language	discard	temp_0.65
15448	5.137	the_feel_felt_found	discard	remove_ownership_language
15449	5.138	ownership_language	discard	remove_the_feel_felt_found
15450	5.450	the_feel_felt_found+ownership_language	discard	tone_change
15451	5.450	the_feel_felt_found+ownership_language	discard	tone_change
15452	5.425	the_feel_felt_found+ownership_language+warmth_injection	discard	add_warmth_injection
15453	5.425	the_feel_felt_found+ownership_language+strategic_agreement	discard	add_strategic_agreement
15454	5.138	the_feel_felt_found+ownership_language+casual_professionalism	discard	add_casual_professionalism
15455	4.987	the_feel_felt_found+ownership_language	discard	temp_0.85
15456	5.013	the_feel_felt_found	discard	crossover
15457	5.138	the_feel_felt_found+ownership_language	discard	temp_0.65
15458	5.625	the_feel_felt_found+ownership_language+personal_touch	discard	add_personal_touch
15459	5.237	the_feel_felt_found+ownership_language+emotional_labeling	discard	add_emotional_labeling
15460	5.138	the_feel_felt_found+ownership_language+mirroring	discard	add_mirroring
15461	5.138	the_feel_felt_found+ownership_language	discard	crossover
15462	4.925	the_feel_felt_found+ownership_language	discard	tone_change
15463	4.925	ownership_language+warmth_injection	discard	swap_the_feel_felt_found_for_warmth_injection
15464	5.237	the_feel_felt_found	discard	remove_ownership_language
15465	5.450	the_feel_felt_found+ownership_language	discard	tone_change
15466	5.113	the_feel_felt_found+ownership_language+never_say_calm_down	discard	add_never_say_calm_down
15467	5.650	the_feel_felt_found+ownership_language	discard	tone_change
15468	5.138	the_feel_felt_found+ownership_language+never_say_calm_down	discard	add_never_say_calm_down
15469	4.825	the_feel_felt_found+ownership_language	discard	tone_change
