generation	eq_score	techniques	status	description
4210	5.550	the_feel_felt_found+ownership_language	discard	temp_0.95
4211	5.025	ownership_language+warmth_injection	discard	swap_the_feel_felt_found_for_warmth_injection
4212	5.550	ownership_language+proactive_extras	discard	swap_the_feel_felt_found_for_proactive_extras
4213	4.725	ownership_language+genuine_admission	discard	swap_the_feel_felt_found_for_genuine_admission
4214	5.138	the_feel_felt_found+ownership_language+energy_matching	discard	add_energy_matching
4215	5.650	the_feel_felt_found+ownership_language	discard	crossover
4216	4.725	the_feel_felt_found+ownership_language	discard	tone_change
4217	5.425	the_feel_felt_found+ownership_language	discard	tone_change
4218	5.550	ownership_language	discard	remove_the_feel_felt_found
4219	5.325	the_feel_felt_found+ownership_language	discard	tone_change
4220	4.950	ownership_language	discard	remove_the_feel_felt_found
4221	5.650	ownership_language+casual_professionalism	discard	swap_the_feel_felt_found_for_casual_professionalism
4222	5.325	the_feel_felt_found+ownership_language+proactive_extras	discard	add_proactive_extras
4223	5.450	ownership_language	discard	remove_the_feel_felt_found
4224	5.550	the_feel_felt_found+ownership_language+concrete_next_steps	discard	add_concrete_next_steps
4225	5.238	the_feel_felt_found+ownership_language	discard	tone_change
4226	5.425	the_feel_felt_found+ownership_language	discard	temp_0.65
4227	4.900	the_feel_felt_found+ownership_language	discard	tone_change
4228	5.425	the_feel_felt_found+ownership_language	discard	tone_change
4229	5.325	the_feel_felt_found+ownership_language	discard	tone_change
4230	5.450	the_feel_felt_found+ownership_language	discard	tone_change
4231	5.425	the_feel_felt_found+genuine_admission	discard	swap_ownership_language_for_genuine_admission
4232	5.112	ownership_language+concrete_next_steps	discard	swap_the_feel_felt_found_for_concrete_next_steps
4233	5.325	none	discard	crossover
4234	5.112	the_feel_felt_found+ownership_language+personal_touch	discard	add_personal_touch
4235	5.138	the_feel_felt_found+ownership_language	discard	temp_0.90
4236	5.200	the_feel_felt_found+ownership_language+genuine_admission	discard	add_genuine_admission
4237	5.450	the_feel_felt_found	discard	crossover
4238	5.238	ownership_language	discard	remove_the_feel_felt_found
4239	5.138	ownership_language+casual_professionalism	discard	swap_the_feel_felt_found_for_casual_professionalism
4240	4.200	the_feel_felt_found+ownership_language	discard	temp_0.90
4241	5.338	ownership_language+proactive_extras	discard	swap_the_feel_felt_found_for_proactive_extras
4242	5.213	the_feel_felt_found+ownership_language	discard	tone_change
4243	5.213	the_feel_felt_found	discard	remove_ownership_language
4244	5.225	ownership_language	discard	remove_the_feel_felt_found
4245	5.425	ownership_language	discard	remove_the_feel_felt_found
4246	5.450	the_feel_felt_found+ownership_language	discard	tone_change
4247	5.113	the_feel_felt_found+ownership_language	discard	temp_0.70
4248	4.888	the_feel_felt_found+never_say_calm_down	discard	swap_ownership_language_for_never_say_calm_down
4249	4.713	ownership_language+warmth_injection	discard	swap_the_feel_felt_found_for_warmth_injection
4250	5.350	the_feel_felt_found+ownership_language+concrete_next_steps	discard	add_concrete_next_steps
4251	5.425	the_feel_felt_found+ownership_language	discard	tone_change
4252	5.550	the_feel_felt_found+ownership_language+emotional_labeling	discard	add_emotional_labeling
4253	5.450	the_feel_felt_found	discard	remove_ownership_language
4254	4.825	the_feel_felt_found	discard	crossover
4255	5.338	the_feel_felt_found+ownership_language	discard	crossover
4256	5.200	the_feel_felt_found+ownership_language	discard	crossover
4257	5.350	the_feel_felt_found+ownership_language	discard	tone_change
4258	5.237	the_feel_felt_found	discard	crossover
4259	5.013	the_feel_felt_found+ownership_language	discard	crossover
4260	5.650	the_feel_felt_found+ownership_language	discard	tone_change
4261	5.450	the_feel_felt_found+ownership_language	discard	tone_change
4262	5.138	the_feel_felt_found+ownership_language+warmth_injection	discard	add_warmth_injection
4263	5.325	the_feel_felt_found+ownership_language	discard	tone_change
4264	5.550	the_feel_felt_found+ownership_language	discard	temp_0.85
4265	5.225	the_feel_felt_found+strategic_agreement	discard	swap_ownership_language_for_strategic_agreement
4266	5.138	the_feel_felt_found+ownership_language	discard	tone_change
4267	5.138	the_feel_felt_found+ownership_language+never_say_calm_down	discard	add_never_say_calm_down
4268	5.013	the_feel_felt_found+ownership_language	discard	temp_0.75
4269	5.237	the_feel_felt_found+ownership_language	discard	tone_change
4270	4.987	the_feel_felt_found+ownership_language	discard	temp_0.85
4271	4.912	the_feel_felt_found+ownership_language+energy_matching	discard	add_energy_matching
4272	5.450	the_feel_felt_found+ownership_language+never_say_calm_down	discard	add_never_say_calm_down
4273	4.825	the_feel_felt_found+ownership_language	discard	tone_change
4274	5.037	ownership_language+personal_touch	discard	swap_the_feel_felt_found_for_personal_touch
4275	5.237	the_feel_felt_found+ownership_language+casual_professionalism	discard	add_casual_professionalism
4276	5.450	the_feel_felt_found+ownership_language	discard	tone_change
4277	5.550	ownership_language+warmth_injection	discard	swap_the_feel_felt_found_for_warmth_injection
4278	5.550	the_feel_felt_found+ownership_language	discard	tone_change
4279	5.450	the_feel_felt_found+ownership_language+personal_touch	discard	add_personal_touch
4280	5.200	the_feel_felt_found+ownership_language	discard	temp_0.75
4281	5.350	the_feel_felt_found	discard	remove_ownership_language
4282	5.350	the_feel_felt_found+ownership_language	discard	temp_0.65
4283	5.450	the_feel_felt_found+ownership_language	discard	crossover
4284	5.325	the_feel_felt_found+ownership_language	discard	crossover
4285	4.925	ownership_language+genuine_admission	discard	swap_the_feel_felt_found_for_genuine_admission
4286	5.325	the_feel_felt_found	discard	crossover
4287	4.700	the_feel_felt_found+ownership_language	discard	tone_change
4288	5.450	the_feel_felt_found+genuine_admission	discard	swap_ownership_language_for_genuine_admission
4289	5.550	the_feel_felt_found+proactive_extras	discard	swap_ownership_language_for_proactive_extras
4290	5.238	the_feel_felt_found+never_say_calm_down	discard	swap_ownership_language_for_never_say_calm_down
4291	5.450	the_feel_felt_found+ownership_language	discard	crossover
4292	4.925	the_feel_felt_found+ownership_language	discard	tone_change
4293	5.337	the_feel_felt_found+ownership_language	discard	crossover
4294	5.438	the_feel_felt_found+ownership_language	discard	tone_change
4295	4.612	the_feel_felt_found+ownership_language	discard	tone_change
4296	5.550	ownership_language+mirroring	discard	swap_the_feel_felt_found_for_mirroring
4297	5.138	none	discard	crossover
4298	5.450	the_feel_felt_found+ownership_language+genuine_admission	discard	add_genuine_admission
4299	5.200	the_feel_felt_found+ownership_language+personal_touch	discard	add_personal_touch
4300	5.225	the_feel_felt_found+ownership_language	discard	temp_0.90
4301	5.450	the_feel_felt_found+ownership_language	discard	tone_change
4302	5.550	the_feel_felt_found+ownership_language+warmth_injection	discard	add_warmth_injection
4303	5.450	the_feel_felt_found+ownership_language	discard	tone_change
4304	5.338	the_feel_felt_found+strategic_agreement	discard	swap_ownership_language_for_strategic_agreement
4305	5.450	the_feel_felt_found+ownership_language+casual_professionalism	discard	add_casual_professionalism
4306	5.138	the_feel_felt_found+ownership_language+strategic_agreement	discard	add_strategic_agreement
4307	4.925	the_feel_felt_found+ownership_language+personal_touch	discard	add_personal_touch
4308	5.200	the_feel_felt_found	discard	remove_ownership_language
4309	5.450	ownership_language	discard	remove_the_feel_felt_found
4310	5.012	the_feel_felt_found+ownership_language+genuine_admission	discard	add_genuine_admission
4311	5.325	the_feel_felt_found+ownership_language+proactive_extras	discard	add_proactive_extras
4312	5.213	ownership_language	discard	crossover
4313	5.338	ownership_language	discard	remove_the_feel_felt_found
4314	5.013	ownership_language	discard	crossover
4315	5.650	the_feel_felt_found+ownership_language	discard	tone_change
4316	5.238	the_feel_felt_found	discard	crossover
4317	5.237	the_feel_felt_found+ownership_language	discard	tone_change
4318	5.450	ownership_language+validation_before_solution	discard	swap_the_feel_felt_found_for_validation_before_solution
4319	5.013	the_feel_felt_found+ownership_language+warmth_injection	discard	add_warmth_injection
4320	5.338	the_feel_felt_found+ownership_language	discard	temp_0.95
4321	5.550	the_feel_felt_found+ownership_language	discard	crossover
4322	4.825	the_feel_felt_found+ownership_language	discard	crossover
4323	5.525	the_feel_felt_found+ownership_language+concrete_next_steps	discard	add_concrete_next_steps
4324	5.113	the_feel_felt_found+ownership_language+concrete_next_steps	discard	add_concrete_next_steps
4325	4.925	the_feel_felt_found+ownership_language+emotional_labeling	discard	add_emotional_labeling
4326	5.550	the_feel_felt_found+ownership_language	discard	tone_change
4327	5.425	the_feel_felt_found+ownership_language	discard	crossover
4328	5.225	the_feel_felt_found	discard	remove_ownership_language
4329	5.237	the_feel_felt_found+ownership_language	discard	temp_0.95
4330	4.612	the_feel_felt_found+ownership_language	discard	tone_change
4331	5.075	the_feel_felt_found+ownership_language	discard	tone_change
4332	5.325	the_feel_felt_found+ownership_language+casual_professionalism	discard	add_casual_professionalism
4333	5.325	the_feel_felt_found+ownership_language+validation_before_solution	discard	add_validation_before_solution
4334	5.550	the_feel_felt_found+personal_touch	discard	swap_ownership_language_for_personal_touch
4335	4.888	ownership_language	discard	remove_the_feel_felt_found
4336	5.013	the_feel_felt_found+ownership_language	discard	tone_change
4337	5.325	ownership_language	discard	remove_the_feel_felt_found
4338	5.138	the_feel_felt_found+ownership_language	discard	temp_0.85
4339	5.238	the_feel_felt_found+ownership_language+energy_matching	discard	add_energy_matching
4340	5.037	the_feel_felt_found+ownership_language	discard	crossover
4341	5.450	ownership_language	discard	crossover
4342	5.100	none	discard	crossover
4343	5.138	the_feel_felt_found+ownership_language	discard	crossover
4344	5.350	the_feel_felt_found+ownership_language	discard	tone_change
4345	4.700	the_feel_felt_found+ownership_language+energy_matching	discard	add_energy_matching
4346	5.325	the_feel_felt_found+ownership_language	discard	tone_change
4347	4.825	the_feel_felt_found+ownership_language	discard	tone_change
4348	5.138	the_feel_felt_found+ownership_language+never_say_calm_down	discard	add_never_say_calm_down
4349	5.350	the_feel_felt_found+ownership_language	discard	tone_change
4350	5.550	the_feel_felt_found+ownership_language	discard	tone_change
4351	5.013	ownership_language+never_say_calm_down	discard	swap_the_feel_felt_found_for_never_say_calm_down
4352	5.550	the_feel_felt_found+ownership_language	discard	tone_change
4353	5.337	the_feel_felt_found+ownership_language+energy_matching	discard	add_energy_matching
4354	5.237	the_feel_felt_found+ownership_language	discard	crossover
4355	5.325	the_feel_felt_found+ownership_language	discard	temp_0.65
4356	4.700	ownership_language	discard	remove_the_feel_felt_found
4357	5.350	the_feel_felt_found+ownership_language	discard	crossover
4358	5.350	the_feel_felt_found+ownership_language	discard	temp_0.90
4359	5.650	ownership_language+energy_matching	discard	swap_the_feel_felt_found_for_energy_matching
4360	5.650	ownership_language	discard	crossover
4361	5.325	the_feel_felt_found+warmth_injection	discard	swap_ownership_language_for_warmth_injection
4362	5.175	the_feel_felt_found+ownership_language	discard	tone_change
4363	5.350	none	discard	crossover
4364	5.025	ownership_language+proactive_extras	discard	swap_the_feel_felt_found_for_proactive_extras
4365	5.450	ownership_language	discard	remove_the_feel_felt_found
4366	5.237	the_feel_felt_found+ownership_language+mirroring	discard	add_mirroring
4367	5.425	the_feel_felt_found+ownership_language+genuine_admission	discard	add_genuine_admission
4368	5.550	the_feel_felt_found+ownership_language	discard	crossover
4369	5.550	the_feel_felt_found	discard	remove_ownership_language
4370	5.200	ownership_language	discard	remove_the_feel_felt_found
4371	5.212	the_feel_felt_found+strategic_agreement	discard	swap_ownership_language_for_strategic_agreement
4372	5.450	ownership_language	discard	crossover
4373	5.550	the_feel_felt_found+ownership_language+validation_before_solution	discard	add_validation_before_solution
4374	5.112	ownership_language+validation_before_solution	discard	swap_the_feel_felt_found_for_validation_before_solution
4375	4.987	the_feel_felt_found+ownership_language	discard	tone_change
4376	5.325	the_feel_felt_found+never_say_calm_down	discard	swap_ownership_language_for_never_say_calm_down
4377	5.450	the_feel_felt_found+ownership_language	discard	temp_0.75
4378	5.425	the_feel_felt_found+ownership_language	discard	crossover
4379	5.075	the_feel_felt_found+ownership_language+proactive_extras	discard	add_proactive_extras
4380	5.075	the_feel_felt_found+ownership_language	discard	crossover
4381	5.425	the_feel_felt_found+ownership_language	discard	tone_change
4382	4.700	the_feel_felt_found+ownership_language	discard	temp_0.65
4383	5.550	the_feel_felt_found+ownership_language	discard	tone_change
4384	5.337	the_feel_felt_found+ownership_language	discard	tone_change
4385	5.200	the_feel_felt_found+ownership_language	discard	tone_change
4386	4.925	the_feel_felt_found+ownership_language	discard	crossover
4387	5.450	the_feel_felt_found+ownership_language+concrete_next_steps	discard	add_concrete_next_steps
4388	4.912	the_feel_felt_found+ownership_language	discard	tone_change
4389	4.925	the_feel_felt_found+ownership_language	discard	tone_change
4390	5.013	the_feel_felt_found+ownership_language+energy_matching	discard	add_energy_matching
4391	5.013	the_feel_felt_found+ownership_language	discard	temp_0.85
4392	5.350	the_feel_felt_found+warmth_injection	discard	swap_ownership_language_for_warmth_injection
4393	5.450	the_feel_felt_found+ownership_language+proactive_extras	discard	add_proactive_extras
4394	5.425	ownership_language+genuine_admission	discard	swap_the_feel_felt_found_for_genuine_admission
4395	5.112	the_feel_felt_found+ownership_language+validation_before_solution	discard	add_validation_before_solution
4396	5.013	the_feel_felt_found+ownership_language	discard	temp_0.85
4397	4.812	ownership_language+emotional_labeling	discard	swap_the_feel_felt_found_for_emotional_labeling
4398	5.550	none	discard	crossover
4399	5.338	the_feel_felt_found+ownership_language+mirroring	discard	add_mirroring
4400	5.112	the_feel_felt_found+ownership_language	discard	temp_0.95
4401	5.325	the_feel_felt_found+validation_before_solution	discard	swap_ownership_language_for_validation_before_solution
4402	4.912	the_feel_felt_found+ownership_language	discard	temp_0.90
4403	5.300	the_feel_felt_found+ownership_language	discard	crossover
4404	4.700	the_feel_felt_found	discard	crossover
4405	5.200	the_feel_felt_found+ownership_language	discard	crossover
4406	4.513	the_feel_felt_found+ownership_language	discard	tone_change
4407	5.650	the_feel_felt_found+ownership_language+warmth_injection	discard	add_warmth_injection
4408	5.312	the_feel_felt_found+strategic_agreement	discard	swap_ownership_language_for_strategic_agreement
4409	5.425	the_feel_felt_found+ownership_language	discard	temp_0.90
4410	5.425	the_feel_felt_found+ownership_language+personal_touch	discard	add_personal_touch
4411	5.138	ownership_language+validation_before_solution	discard	swap_the_feel_felt_found_for_validation_before_solution
4412	5.125	the_feel_felt_found+ownership_language+proactive_extras	discard	add_proactive_extras
4413	5.138	the_feel_felt_found+ownership_language	discard	tone_change
4414	5.650	the_feel_felt_found+ownership_language	discard	temp_0.90
4415	5.038	none	discard	crossover
4416	4.825	ownership_language+concrete_next_steps	discard	swap_the_feel_felt_found_for_concrete_next_steps
4417	5.425	ownership_language	discard	crossover
4418	5.625	the_feel_felt_found	discard	crossover
4419	5.213	the_feel_felt_found+ownership_language	discard	temp_0.75
4420	5.325	the_feel_felt_found+never_say_calm_down	discard	swap_ownership_language_for_never_say_calm_down
4421	5.450	the_feel_felt_found+ownership_language	discard	temp_0.85
4422	5.013	the_feel_felt_found+ownership_language+energy_matching	discard	add_energy_matching
4423	4.900	the_feel_felt_found+ownership_language+genuine_admission	discard	add_genuine_admission
4424	5.425	the_feel_felt_found+ownership_language	discard	tone_change
4425	5.338	none	discard	crossover
4426	5.338	ownership_language	discard	remove_the_feel_felt_found
4427	4.888	ownership_language+strategic_agreement	discard	swap_the_feel_felt_found_for_strategic_agreement
4428	5.113	the_feel_felt_found	discard	remove_ownership_language
4429	4.900	the_feel_felt_found+ownership_language	discard	temp_0.75
4430	5.112	the_feel_felt_found	discard	remove_ownership_language
4431	5.138	the_feel_felt_found+ownership_language	discard	crossover
4432	5.075	ownership_language+proactive_extras	discard	swap_the_feel_felt_found_for_proactive_extras
4433	5.525	the_feel_felt_found+ownership_language	discard	temp_0.75
4434	4.700	the_feel_felt_found+personal_touch	discard	swap_ownership_language_for_personal_touch
4435	5.325	the_feel_felt_found+ownership_language+validation_before_solution	discard	add_validation_before_solution
4436	5.450	the_feel_felt_found+ownership_language	discard	tone_change
4437	5.037	the_feel_felt_found+ownership_language	discard	temp_0.65
4438	4.787	the_feel_felt_found+ownership_language+personal_touch	discard	add_personal_touch
4439	5.550	the_feel_felt_found+ownership_language	discard	crossover
4440	5.325	the_feel_felt_found+ownership_language	discard	tone_change
4441	4.888	the_feel_felt_found+ownership_language+genuine_admission	discard	add_genuine_admission
4442	5.325	the_feel_felt_found+personal_touch	discard	swap_ownership_language_for_personal_touch
4443	5.338	the_feel_felt_found+ownership_language	discard	crossover
4444	4.888	ownership_language+mirroring	discard	swap_the_feel_felt_found_for_mirroring
4445	5.450	the_feel_felt_found+ownership_language	discard	temp_0.90
4446	5.550	the_feel_felt_found+ownership_language	discard	temp_0.70
4447	5.325	the_feel_felt_found+ownership_language+validation_before_solution	discard	add_validation_before_solution
4448	5.025	the_feel_felt_found+ownership_language	discard	crossover
4449	5.213	the_feel_felt_found+ownership_language+validation_before_solution	discard	add_validation_before_solution
4450	5.013	the_feel_felt_found+ownership_language+emotional_labeling	discard	add_emotional_labeling
4451	5.025	the_feel_felt_found	discard	crossover
4452	5.325	the_feel_felt_found+ownership_language+never_say_calm_down	discard	add_never_say_calm_down
4453	4.925	the_feel_felt_found+ownership_language	discard	temp_0.95
4454	5.325	the_feel_felt_found+ownership_language	discard	tone_change
4455	5.450	the_feel_felt_found+ownership_language	discard	tone_change
4456	5.450	the_feel_felt_found+ownership_language	discard	crossover
4457	5.525	ownership_language+concrete_next_steps	discard	swap_the_feel_felt_found_for_concrete_next_steps
4458	5.537	the_feel_felt_found+mirroring	discard	swap_ownership_language_for_mirroring
4459	4.800	the_feel_felt_found+ownership_language	discard	temp_0.75
4460	5.338	the_feel_felt_found	discard	crossover
4461	5.650	the_feel_felt_found+ownership_language+proactive_extras	discard	add_proactive_extras
4462	5.325	the_feel_felt_found+ownership_language	discard	temp_0.95
4463	5.138	the_feel_felt_found	discard	remove_ownership_language
4464	5.225	the_feel_felt_found+warmth_injection	discard	swap_ownership_language_for_warmth_injection
4465	5.138	the_feel_felt_found+ownership_language	discard	temp_0.85
4466	5.425	the_feel_felt_found+ownership_language	discard	crossover
4467	5.750	the_feel_felt_found+ownership_language	discard	tone_change
4468	5.012	the_feel_felt_found	discard	remove_ownership_language
4469	5.650	ownership_language	discard	remove_the_feel_felt_found
4470	5.550	the_feel_felt_found	discard	crossover
4471	5.138	ownership_language	discard	crossover
4472	5.037	the_feel_felt_found+ownership_language+warmth_injection	discard	add_warmth_injection
4473	5.550	ownership_language+proactive_extras	discard	swap_the_feel_felt_found_for_proactive_extras
4474	4.600	the_feel_felt_found+ownership_language+strategic_agreement	discard	add_strategic_agreement
4475	5.137	the_feel_felt_found+ownership_language	discard	tone_change
4476	5.550	the_feel_felt_found+ownership_language	discard	temp_0.95
4477	5.325	the_feel_felt_found+ownership_language	discard	tone_change
4478	4.925	the_feel_felt_found+ownership_language+energy_matching	discard	add_energy_matching
4479	5.200	the_feel_felt_found+ownership_language+concrete_next_steps	discard	add_concrete_next_steps
4480	5.038	ownership_language+energy_matching	discard	swap_the_feel_felt_found_for_energy_matching
4481	5.038	the_feel_felt_found+ownership_language	discard	tone_change
4482	5.450	ownership_language	discard	crossover
4483	5.238	the_feel_felt_found+ownership_language	discard	temp_0.90
4484	5.138	the_feel_felt_found+ownership_language	discard	tone_change
4485	5.100	the_feel_felt_found+ownership_language	discard	crossover
4486	5.138	ownership_language+warmth_injection	discard	swap_the_feel_felt_found_for_warmth_injection
4487	5.238	none	discard	crossover
4488	5.138	the_feel_felt_found+personal_touch	discard	swap_ownership_language_for_personal_touch
