generation	eq_score	techniques	status	description
17411	5.325	the_feel_felt_found+ownership_language	discard	tone_change
17412	5.238	the_feel_felt_found+never_say_calm_down	discard	swap_ownership_language_for_never_say_calm_down
17413	4.888	the_feel_felt_found+ownership_language+mirroring	discard	add_mirroring
17414	5.138	the_feel_felt_found+ownership_language	discard	temp_0.75
17415	5.425	the_feel_felt_found+ownership_language	discard	crossover
17416	5.450	the_feel_felt_found+ownership_language+proactive_extras	discard	add_proactive_extras
17417	5.325	the_feel_felt_found+ownership_language	discard	tone_change
17418	5.225	ownership_language	discard	remove_the_feel_felt_found
17419	5.325	the_feel_felt_found+ownership_language	discard	tone_change
17420	5.550	the_feel_felt_found+ownership_language	discard	tone_change
17421	5.013	the_feel_felt_found	discard	crossover
17422	5.650	the_feel_felt_found+ownership_language+genuine_admission	discard	add_genuine_admission
17423	4.925	the_feel_felt_found+ownership_language	discard	temp_0.70
17424	4.825	the_feel_felt_found+ownership_language	discard	tone_change
17425	4.888	the_feel_felt_found+mirroring	discard	swap_ownership_language_for_mirroring
17426	5.438	the_feel_felt_found+ownership_language+proactive_extras	discard	add_proactive_extras
17427	5.425	ownership_language+casual_professionalism	discard	swap_the_feel_felt_found_for_casual_professionalism
17428	5.325	the_feel_felt_found+ownership_language+casual_professionalism	discard	add_casual_professionalism
17429	5.325	ownership_language	discard	crossover
17430	5.138	the_feel_felt_found+ownership_language+personal_touch	discard	add_personal_touch
17431	4.888	the_feel_felt_found+ownership_language	discard	crossover
17432	5.325	ownership_language+energy_matching	discard	swap_the_feel_felt_found_for_energy_matching
17433	4.988	the_feel_felt_found+ownership_language+genuine_admission	discard	add_genuine_admission
17434	5.550	the_feel_felt_found	discard	remove_ownership_language
17435	5.138	the_feel_felt_found	discard	crossover
17436	5.550	ownership_language	discard	remove_the_feel_felt_found
17437	5.550	the_feel_felt_found+ownership_language	discard	tone_change
17438	5.037	the_feel_felt_found+ownership_language	discard	tone_change
17439	5.225	ownership_language	discard	remove_the_feel_felt_found
17440	5.425	ownership_language+never_say_calm_down	discard	swap_the_feel_felt_found_for_never_say_calm_down
17441	5.350	ownership_language+validation_before_solution	discard	swap_the_feel_felt_found_for_validation_before_solution
17442	5.450	the_feel_felt_found+ownership_language+emotional_labeling	discard	add_emotional_labeling
17443	5.550	the_feel_felt_found+ownership_language	discard	crossover
17444	5.013	the_feel_felt_found+ownership_language	discard	tone_change
17445	5.450	the_feel_felt_found+ownership_language	discard	temp_0.90
17446	4.800	ownership_language+emotional_labeling	discard	swap_the_feel_felt_found_for_emotional_labeling
17447	5.013	ownership_language+emotional_labeling	discard	swap_the_feel_felt_found_for_emotional_labeling
17448	5.037	the_feel_felt_found+ownership_language+personal_touch	discard	add_personal_touch
17449	5.013	the_feel_felt_found+ownership_language	discard	tone_change
17450	5.550	the_feel_felt_found+validation_before_solution	discard	swap_ownership_language_for_validation_before_solution
17451	5.325	the_feel_felt_found+ownership_language	discard	tone_change
17452	5.550	the_feel_felt_found+ownership_language+concrete_next_steps	discard	add_concrete_next_steps
17453	5.013	the_feel_felt_found+ownership_language	discard	tone_change
17454	5.525	the_feel_felt_found+ownership_language	discard	crossover
17455	4.825	the_feel_felt_found+ownership_language+proactive_extras	discard	add_proactive_extras
17456	5.325	the_feel_felt_found+ownership_language	discard	tone_change
17457	4.987	the_feel_felt_found+ownership_language	discard	tone_change
17458	5.550	the_feel_felt_found+ownership_language+warmth_injection	discard	add_warmth_injection
17459	5.237	the_feel_felt_found+ownership_language	discard	tone_change
17460	5.325	the_feel_felt_found	discard	remove_ownership_language
17461	5.550	the_feel_felt_found+ownership_language	discard	tone_change
17462	5.450	the_feel_felt_found+ownership_language+concrete_next_steps	discard	add_concrete_next_steps
17463	5.238	the_feel_felt_found+ownership_language	discard	crossover
17464	5.138	the_feel_felt_found+ownership_language	discard	tone_change
17465	5.337	the_feel_felt_found+ownership_language+personal_touch	discard	add_personal_touch
17466	4.725	ownership_language	discard	crossover
17467	5.138	ownership_language	discard	remove_the_feel_felt_found
17468	5.025	the_feel_felt_found+ownership_language	discard	crossover
17469	5.013	the_feel_felt_found+ownership_language	discard	temp_0.90
17470	5.238	ownership_language+concrete_next_steps	discard	swap_the_feel_felt_found_for_concrete_next_steps
17471	5.138	the_feel_felt_found	discard	crossover
17472	4.925	the_feel_felt_found+ownership_language	discard	temp_0.90
17473	5.450	the_feel_felt_found+ownership_language+validation_before_solution	discard	add_validation_before_solution
17474	5.138	ownership_language	discard	crossover
17475	5.325	the_feel_felt_found+proactive_extras	discard	swap_ownership_language_for_proactive_extras
17476	5.525	the_feel_felt_found	discard	remove_ownership_language
17477	5.138	the_feel_felt_found+ownership_language	discard	temp_0.75
17478	5.325	the_feel_felt_found+ownership_language	discard	tone_change
17479	4.763	the_feel_felt_found+ownership_language	discard	tone_change
17480	5.650	ownership_language	discard	crossover
17481	5.425	ownership_language+never_say_calm_down	discard	swap_the_feel_felt_found_for_never_say_calm_down
17482	5.325	the_feel_felt_found+ownership_language+emotional_labeling	discard	add_emotional_labeling
17483	5.237	the_feel_felt_found+ownership_language+never_say_calm_down	discard	add_never_say_calm_down
17484	5.238	the_feel_felt_found+ownership_language	discard	tone_change
17485	4.513	the_feel_felt_found	discard	remove_ownership_language
17486	5.237	the_feel_felt_found+ownership_language	discard	tone_change
17487	4.925	ownership_language+warmth_injection	discard	swap_the_feel_felt_found_for_warmth_injection
17488	5.138	the_feel_felt_found+genuine_admission	discard	swap_ownership_language_for_genuine_admission
17489	5.350	the_feel_felt_found+ownership_language+mirroring	discard	add_mirroring
17490	5.200	ownership_language	discard	crossover
17491	5.338	the_feel_felt_found+ownership_language	discard	tone_change
17492	5.425	the_feel_felt_found+ownership_language+concrete_next_steps	discard	add_concrete_next_steps
17493	5.325	the_feel_felt_found+ownership_language+energy_matching	discard	add_energy_matching
17494	5.138	the_feel_felt_found+ownership_language	discard	temp_0.75
17495	5.038	the_feel_felt_found+ownership_language	discard	tone_change
17496	5.450	the_feel_felt_found+ownership_language+energy_matching	discard	add_energy_matching
17497	4.713	the_feel_felt_found+ownership_language	discard	tone_change
17498	4.925	the_feel_felt_found+ownership_language+energy_matching	discard	add_energy_matching
17499	5.200	the_feel_felt_found+ownership_language	discard	temp_0.85
17500	4.888	ownership_language+validation_before_solution	discard	swap_the_feel_felt_found_for_validation_before_solution
17501	5.425	ownership_language	discard	remove_the_feel_felt_found
17502	5.325	the_feel_felt_found+validation_before_solution	discard	swap_ownership_language_for_validation_before_solution
17503	5.138	ownership_language+never_say_calm_down	discard	swap_the_feel_felt_found_for_never_say_calm_down
17504	5.550	ownership_language+concrete_next_steps	discard	swap_the_feel_felt_found_for_concrete_next_steps
17505	5.550	the_feel_felt_found+ownership_language	discard	temp_0.85
17506	5.450	the_feel_felt_found+ownership_language	discard	tone_change
17507	5.038	the_feel_felt_found+ownership_language+emotional_labeling	discard	add_emotional_labeling
17508	5.113	the_feel_felt_found+ownership_language+proactive_extras	discard	add_proactive_extras
17509	4.987	ownership_language+strategic_agreement	discard	swap_the_feel_felt_found_for_strategic_agreement
17510	5.350	ownership_language+energy_matching	discard	swap_the_feel_felt_found_for_energy_matching
17511	5.113	the_feel_felt_found+ownership_language	discard	tone_change
17512	5.650	the_feel_felt_found+ownership_language	discard	crossover
17513	5.138	ownership_language+concrete_next_steps	discard	swap_the_feel_felt_found_for_concrete_next_steps
17514	5.237	the_feel_felt_found+ownership_language	discard	tone_change
17515	5.237	the_feel_felt_found+ownership_language	discard	temp_0.75
17516	5.138	the_feel_felt_found+ownership_language	discard	crossover
17517	5.650	ownership_language	discard	crossover
17518	5.112	the_feel_felt_found+ownership_language+emotional_labeling	discard	add_emotional_labeling
17519	5.112	the_feel_felt_found+ownership_language+energy_matching	discard	add_energy_matching
17520	5.013	the_feel_felt_found+ownership_language	discard	crossover
17521	5.125	the_feel_felt_found+ownership_language	discard	crossover
17522	5.238	the_feel_felt_found+ownership_language	discard	crossover
17523	5.237	the_feel_felt_found+ownership_language+personal_touch	discard	add_personal_touch
17524	5.450	ownership_language	discard	crossover
17525	5.113	the_feel_felt_found+ownership_language+emotional_labeling	discard	add_emotional_labeling
17526	5.350	the_feel_felt_found+ownership_language+genuine_admission	discard	add_genuine_admission
17527	5.213	the_feel_felt_found+ownership_language+genuine_admission	discard	add_genuine_admission
17528	5.138	the_feel_felt_found+ownership_language	discard	crossover
17529	4.825	the_feel_felt_found+ownership_language	discard	temp_0.70
17530	5.138	the_feel_felt_found	discard	crossover
17531	5.113	the_feel_felt_found+ownership_language+energy_matching	discard	add_energy_matching
17532	5.450	the_feel_felt_found+genuine_admission	discard	swap_ownership_language_for_genuine_admission
17533	5.013	the_feel_felt_found+ownership_language	discard	tone_change
17534	5.037	the_feel_felt_found+ownership_language+genuine_admission	discard	add_genuine_admission
17535	5.138	the_feel_felt_found+ownership_language	discard	tone_change
17536	5.325	ownership_language	discard	crossover
17537	5.325	ownership_language+emotional_labeling	discard	swap_the_feel_felt_found_for_emotional_labeling
17538	5.525	the_feel_felt_found+ownership_language+concrete_next_steps	discard	add_concrete_next_steps
17539	5.138	the_feel_felt_found+strategic_agreement	discard	swap_ownership_language_for_strategic_agreement
17540	5.425	ownership_language	discard	crossover
17541	5.425	the_feel_felt_found+ownership_language+strategic_agreement	discard	add_strategic_agreement
17542	5.200	the_feel_felt_found+ownership_language+validation_before_solution	discard	add_validation_before_solution
17543	5.450	the_feel_felt_found+concrete_next_steps	discard	swap_ownership_language_for_concrete_next_steps
17544	5.325	the_feel_felt_found+ownership_language+validation_before_solution	discard	add_validation_before_solution
17545	5.037	ownership_language+validation_before_solution	discard	swap_the_feel_felt_found_for_validation_before_solution
17546	5.125	the_feel_felt_found+ownership_language	discard	crossover
17547	5.300	the_feel_felt_found+ownership_language	discard	tone_change
17548	5.350	the_feel_felt_found+ownership_language	discard	tone_change
17549	5.138	ownership_language	discard	remove_the_feel_felt_found
17550	5.550	the_feel_felt_found	discard	crossover
17551	5.237	the_feel_felt_found	discard	crossover
17552	5.237	the_feel_felt_found+ownership_language	discard	tone_change
17553	5.425	the_feel_felt_found+ownership_language+genuine_admission	discard	add_genuine_admission
17554	5.325	the_feel_felt_found+ownership_language+never_say_calm_down	discard	add_never_say_calm_down
17555	5.238	ownership_language+genuine_admission	discard	swap_the_feel_felt_found_for_genuine_admission
17556	5.350	the_feel_felt_found+ownership_language	discard	temp_0.95
17557	5.138	the_feel_felt_found+emotional_labeling	discard	swap_ownership_language_for_emotional_labeling
17558	4.925	ownership_language+strategic_agreement	discard	swap_the_feel_felt_found_for_strategic_agreement
17559	5.425	ownership_language	discard	crossover
17560	5.100	none	discard	crossover
17561	5.450	the_feel_felt_found+ownership_language	discard	temp_0.65
17562	5.550	the_feel_felt_found+ownership_language	discard	crossover
17563	5.138	the_feel_felt_found+ownership_language	discard	temp_0.85
17564	5.337	the_feel_felt_found+ownership_language	discard	tone_change
17565	5.213	ownership_language+warmth_injection	discard	swap_the_feel_felt_found_for_warmth_injection
17566	4.800	the_feel_felt_found+ownership_language+concrete_next_steps	discard	add_concrete_next_steps
17567	5.325	the_feel_felt_found+ownership_language+strategic_agreement	discard	add_strategic_agreement
17568	4.888	the_feel_felt_found+ownership_language	discard	temp_0.75
17569	5.325	the_feel_felt_found+ownership_language	discard	crossover
17570	5.238	the_feel_felt_found+ownership_language+energy_matching	discard	add_energy_matching
17571	4.612	the_feel_felt_found+ownership_language+never_say_calm_down	discard	add_never_say_calm_down
17572	5.338	the_feel_felt_found+ownership_language	discard	tone_change
17573	5.425	ownership_language	discard	crossover
17574	5.550	ownership_language	discard	remove_the_feel_felt_found
17575	4.888	the_feel_felt_found+casual_professionalism	discard	swap_ownership_language_for_casual_professionalism
17576	4.925	the_feel_felt_found+ownership_language	discard	crossover
17577	5.200	the_feel_felt_found+ownership_language+concrete_next_steps	discard	add_concrete_next_steps
17578	5.650	the_feel_felt_found+ownership_language	discard	temp_0.85
17579	4.912	the_feel_felt_found+ownership_language+personal_touch	discard	add_personal_touch
17580	5.237	the_feel_felt_found+ownership_language	discard	tone_change
17581	5.138	the_feel_felt_found+ownership_language+strategic_agreement	discard	add_strategic_agreement
17582	5.200	the_feel_felt_found+ownership_language	discard	crossover
17583	5.650	the_feel_felt_found+ownership_language+concrete_next_steps	discard	add_concrete_next_steps
17584	5.437	the_feel_felt_found+casual_professionalism	discard	swap_ownership_language_for_casual_professionalism
17585	5.325	ownership_language	discard	remove_the_feel_felt_found
17586	5.238	the_feel_felt_found+ownership_language+mirroring	discard	add_mirroring
17587	4.888	the_feel_felt_found+ownership_language+strategic_agreement	discard	add_strategic_agreement
17588	5.550	the_feel_felt_found+ownership_language+mirroring	discard	add_mirroring
17589	4.925	the_feel_felt_found+ownership_language+personal_touch	discard	add_personal_touch
17590	5.237	the_feel_felt_found	discard	crossover
17591	4.800	the_feel_felt_found+ownership_language+mirroring	discard	add_mirroring
17592	5.237	the_feel_felt_found+ownership_language+proactive_extras	discard	add_proactive_extras
17593	5.425	the_feel_felt_found+ownership_language	discard	crossover
17594	5.437	the_feel_felt_found+ownership_language	discard	tone_change
17595	5.212	the_feel_felt_found+ownership_language+emotional_labeling	discard	add_emotional_labeling
17596	5.138	the_feel_felt_found+ownership_language	discard	tone_change
17597	5.137	the_feel_felt_found	discard	remove_ownership_language
17598	5.450	the_feel_felt_found+ownership_language+mirroring	discard	add_mirroring
17599	5.113	the_feel_felt_found	discard	crossover
17600	5.325	the_feel_felt_found+ownership_language	discard	crossover
17601	5.425	the_feel_felt_found+ownership_language	discard	tone_change
17602	5.200	ownership_language+energy_matching	discard	swap_the_feel_felt_found_for_energy_matching
17603	5.138	the_feel_felt_found	discard	crossover
17604	5.137	the_feel_felt_found+concrete_next_steps	discard	swap_ownership_language_for_concrete_next_steps
17605	5.013	the_feel_felt_found+ownership_language	discard	tone_change
17606	5.013	the_feel_felt_found+ownership_language	discard	temp_0.70
17607	5.400	ownership_language+mirroring	discard	swap_the_feel_felt_found_for_mirroring
17608	5.325	ownership_language	discard	crossover
17609	5.325	the_feel_felt_found+ownership_language	discard	tone_change
17610	5.450	the_feel_felt_found+ownership_language	discard	tone_change
17611	5.350	the_feel_felt_found+ownership_language+validation_before_solution	discard	add_validation_before_solution
17612	5.525	the_feel_felt_found+ownership_language	discard	tone_change
17613	5.138	ownership_language+mirroring	discard	swap_the_feel_felt_found_for_mirroring
17614	5.338	the_feel_felt_found+ownership_language	discard	temp_0.70
17615	4.700	the_feel_felt_found+ownership_language	discard	temp_0.65
17616	4.888	the_feel_felt_found+ownership_language+validation_before_solution	discard	add_validation_before_solution
17617	5.425	the_feel_felt_found+ownership_language	discard	tone_change
17618	5.450	the_feel_felt_found+ownership_language	discard	tone_change
17619	4.800	the_feel_felt_found+ownership_language+casual_professionalism	discard	add_casual_professionalism
17620	5.550	the_feel_felt_found+ownership_language	discard	crossover
17621	5.425	the_feel_felt_found+ownership_language	discard	tone_change
17622	5.213	the_feel_felt_found+ownership_language	discard	crossover
17623	4.925	the_feel_felt_found+ownership_language	discard	tone_change
17624	5.450	ownership_language	discard	crossover
17625	5.325	ownership_language+concrete_next_steps	discard	swap_the_feel_felt_found_for_concrete_next_steps
17626	5.325	the_feel_felt_found+ownership_language	discard	crossover
17627	5.450	the_feel_felt_found+genuine_admission	discard	swap_ownership_language_for_genuine_admission
17628	5.112	ownership_language	discard	crossover
17629	5.425	the_feel_felt_found+ownership_language+emotional_labeling	discard	add_emotional_labeling
17630	5.013	the_feel_felt_found	discard	remove_ownership_language
17631	5.213	ownership_language+emotional_labeling	discard	swap_the_feel_felt_found_for_emotional_labeling
17632	5.450	the_feel_felt_found+ownership_language	discard	tone_change
17633	5.425	the_feel_felt_found	discard	remove_ownership_language
17634	4.912	ownership_language+genuine_admission	discard	swap_the_feel_felt_found_for_genuine_admission
17635	5.138	the_feel_felt_found+ownership_language+warmth_injection	discard	add_warmth_injection
17636	5.138	the_feel_felt_found+ownership_language	discard	tone_change
17637	5.200	ownership_language+proactive_extras	discard	swap_the_feel_felt_found_for_proactive_extras
17638	4.825	the_feel_felt_found+validation_before_solution	discard	swap_ownership_language_for_validation_before_solution
17639	5.350	ownership_language+proactive_extras	discard	swap_the_feel_felt_found_for_proactive_extras
17640	5.138	the_feel_felt_found+personal_touch	discard	swap_ownership_language_for_personal_touch
17641	4.725	the_feel_felt_found+ownership_language+proactive_extras	discard	add_proactive_extras
17642	5.437	the_feel_felt_found+ownership_language	discard	tone_change
17643	5.013	the_feel_felt_found+ownership_language	discard	crossover
17644	5.338	the_feel_felt_found+ownership_language	discard	tone_change
17645	5.450	the_feel_felt_found+ownership_language	discard	crossover
17646	5.137	the_feel_felt_found+ownership_language	discard	tone_change
17647	5.425	the_feel_felt_found+ownership_language+validation_before_solution	discard	add_validation_before_solution
17648	5.237	the_feel_felt_found+ownership_language	discard	temp_0.70
17649	5.350	the_feel_felt_found+ownership_language	discard	tone_change
17650	5.138	the_feel_felt_found+ownership_language	discard	temp_0.95
17651	5.238	the_feel_felt_found	discard	crossover
17652	5.013	the_feel_felt_found+ownership_language	discard	crossover
17653	5.013	the_feel_felt_found+ownership_language	discard	tone_change
17654	5.550	the_feel_felt_found+ownership_language+proactive_extras	discard	add_proactive_extras
17655	5.450	the_feel_felt_found+ownership_language	discard	temp_0.85
17656	4.713	the_feel_felt_found+ownership_language	discard	temp_0.90
17657	4.925	ownership_language+proactive_extras	discard	swap_the_feel_felt_found_for_proactive_extras
17658	5.138	ownership_language	discard	crossover
17659	5.450	the_feel_felt_found+ownership_language+genuine_admission	discard	add_genuine_admission
17660	5.237	the_feel_felt_found+concrete_next_steps	discard	swap_ownership_language_for_concrete_next_steps
17661	5.237	the_feel_felt_found+ownership_language+personal_touch	discard	add_personal_touch
17662	5.350	the_feel_felt_found	discard	remove_ownership_language
17663	5.237	the_feel_felt_found+ownership_language	discard	tone_change
17664	5.237	the_feel_felt_found+ownership_language	discard	tone_change
17665	5.037	ownership_language	discard	remove_the_feel_felt_found
17666	5.350	the_feel_felt_found+ownership_language+mirroring	discard	add_mirroring
17667	4.925	the_feel_felt_found+proactive_extras	discard	swap_ownership_language_for_proactive_extras
17668	5.237	the_feel_felt_found+ownership_language+warmth_injection	discard	add_warmth_injection
17669	5.138	the_feel_felt_found+casual_professionalism	discard	swap_ownership_language_for_casual_professionalism
17670	5.213	the_feel_felt_found+ownership_language	discard	tone_change
17671	5.325	the_feel_felt_found	discard	crossover
17672	4.987	the_feel_felt_found+ownership_language	discard	crossover
17673	5.013	the_feel_felt_found+ownership_language	discard	temp_0.95
17674	5.450	the_feel_felt_found+ownership_language	discard	temp_0.75
17675	5.138	the_feel_felt_found+ownership_language+mirroring	discard	add_mirroring
17676	5.550	the_feel_felt_found+ownership_language	discard	crossover
17677	5.337	the_feel_felt_found	discard	crossover
17678	4.725	the_feel_felt_found	discard	crossover
17679	4.600	the_feel_felt_found+ownership_language+never_say_calm_down	discard	add_never_say_calm_down
