generation	eq_score	techniques	status	description
13293	5.450	the_feel_felt_found+ownership_language	discard	tone_change
13294	5.325	the_feel_felt_found+ownership_language+emotional_labeling	discard	add_emotional_labeling
13295	5.550	the_feel_felt_found+ownership_language	discard	tone_change
13296	5.037	the_feel_felt_found+ownership_language	discard	tone_change
13297	5.425	the_feel_felt_found+ownership_language+warmth_injection	discard	add_warmth_injection
13298	5.450	none	discard	crossover
13299	4.888	the_feel_felt_found+proactive_extras	discard	swap_ownership_language_for_proactive_extras
13300	5.325	the_feel_felt_found+ownership_language+casual_professionalism	discard	add_casual_professionalism
13301	4.888	none	discard	crossover
13302	5.237	the_feel_felt_found+ownership_language+never_say_calm_down	discard	add_never_say_calm_down
13303	5.200	the_feel_felt_found+ownership_language	discard	crossover
13304	5.138	the_feel_felt_found+ownership_language	discard	tone_change
13305	5.037	the_feel_felt_found+ownership_language	discard	tone_change
13306	5.300	the_feel_felt_found	discard	crossover
13307	5.450	ownership_language+casual_professionalism	discard	swap_the_feel_felt_found_for_casual_professionalism
13308	5.200	the_feel_felt_found+ownership_language	discard	tone_change
13309	4.912	ownership_language	discard	crossover
13310	5.225	the_feel_felt_found+ownership_language	discard	crossover
13311	5.138	the_feel_felt_found+ownership_language	discard	crossover
13312	5.138	ownership_language	discard	remove_the_feel_felt_found
13313	4.825	the_feel_felt_found+ownership_language	discard	tone_change
13314	4.825	the_feel_felt_found+ownership_language+warmth_injection	discard	add_warmth_injection
13315	5.325	the_feel_felt_found+ownership_language	discard	tone_change
13316	5.325	the_feel_felt_found+ownership_language	discard	temp_0.65
13317	5.013	the_feel_felt_found+ownership_language	discard	temp_0.95
13318	5.237	ownership_language+concrete_next_steps	discard	swap_the_feel_felt_found_for_concrete_next_steps
13319	5.337	the_feel_felt_found+ownership_language+emotional_labeling	discard	add_emotional_labeling
13320	5.325	the_feel_felt_found+ownership_language	discard	crossover
13321	5.237	ownership_language	discard	crossover
13322	5.350	the_feel_felt_found+ownership_language+proactive_extras	discard	add_proactive_extras
13323	5.213	the_feel_felt_found+ownership_language+personal_touch	discard	add_personal_touch
13324	4.825	none	discard	crossover
13325	4.825	the_feel_felt_found+ownership_language+genuine_admission	discard	add_genuine_admission
13326	5.237	the_feel_felt_found+ownership_language+casual_professionalism	discard	add_casual_professionalism
13327	5.013	the_feel_felt_found	discard	remove_ownership_language
13328	5.013	ownership_language	discard	remove_the_feel_felt_found
13329	5.300	the_feel_felt_found+ownership_language	discard	tone_change
13330	5.138	the_feel_felt_found+ownership_language	discard	tone_change
13331	4.825	ownership_language	discard	remove_the_feel_felt_found
13332	5.138	the_feel_felt_found+ownership_language+genuine_admission	discard	add_genuine_admission
13333	4.700	the_feel_felt_found	discard	remove_ownership_language
13334	5.138	the_feel_felt_found+ownership_language+mirroring	discard	add_mirroring
13335	5.325	the_feel_felt_found+warmth_injection	discard	swap_ownership_language_for_warmth_injection
13336	5.237	the_feel_felt_found+ownership_language	discard	temp_0.70
13337	5.025	the_feel_felt_found	discard	crossover
13338	5.550	ownership_language	discard	remove_the_feel_felt_found
13339	5.200	the_feel_felt_found+energy_matching	discard	swap_ownership_language_for_energy_matching
13340	5.013	the_feel_felt_found+concrete_next_steps	discard	swap_ownership_language_for_concrete_next_steps
13341	5.650	the_feel_felt_found+ownership_language	discard	tone_change
13342	5.200	the_feel_felt_found+ownership_language	discard	crossover
13343	5.138	the_feel_felt_found+ownership_language	discard	tone_change
13344	5.250	the_feel_felt_found+ownership_language	discard	tone_change
13345	4.912	ownership_language+proactive_extras	discard	swap_the_feel_felt_found_for_proactive_extras
13346	4.925	the_feel_felt_found+ownership_language	discard	temp_0.95
13347	5.300	ownership_language+emotional_labeling	discard	swap_the_feel_felt_found_for_emotional_labeling
13348	5.325	ownership_language	discard	remove_the_feel_felt_found
13349	5.525	the_feel_felt_found	discard	crossover
13350	4.888	the_feel_felt_found+ownership_language	discard	temp_0.65
13351	5.025	the_feel_felt_found+ownership_language	discard	tone_change
13352	5.225	ownership_language+concrete_next_steps	discard	swap_the_feel_felt_found_for_concrete_next_steps
13353	5.325	the_feel_felt_found+ownership_language+strategic_agreement	discard	add_strategic_agreement
13354	5.338	the_feel_felt_found	discard	crossover
13355	5.237	the_feel_felt_found+ownership_language	discard	tone_change
13356	5.325	the_feel_felt_found+ownership_language	discard	tone_change
13357	5.238	ownership_language	discard	crossover
13358	5.350	the_feel_felt_found+ownership_language	discard	tone_change
13359	5.325	the_feel_felt_found+ownership_language+energy_matching	discard	add_energy_matching
13360	5.237	the_feel_felt_found+ownership_language+proactive_extras	discard	add_proactive_extras
13361	5.350	the_feel_felt_found+ownership_language+energy_matching	discard	add_energy_matching
13362	5.450	the_feel_felt_found+energy_matching	discard	swap_ownership_language_for_energy_matching
13363	5.112	the_feel_felt_found+ownership_language	discard	temp_0.65
13364	4.925	the_feel_felt_found+ownership_language	discard	temp_0.65
13365	4.787	ownership_language	discard	crossover
13366	5.113	the_feel_felt_found+ownership_language+concrete_next_steps	discard	add_concrete_next_steps
13367	5.350	ownership_language	discard	crossover
13368	5.550	the_feel_felt_found+ownership_language+concrete_next_steps	discard	add_concrete_next_steps
13369	5.112	the_feel_felt_found+ownership_language	discard	temp_0.90
13370	5.137	the_feel_felt_found+ownership_language	discard	tone_change
13371	4.912	ownership_language	discard	crossover
13372	5.013	the_feel_felt_found+ownership_language	discard	tone_change
13373	5.650	the_feel_felt_found+ownership_language	discard	tone_change
13374	5.238	the_feel_felt_found+ownership_language+energy_matching	discard	add_energy_matching
13375	5.425	ownership_language+casual_professionalism	discard	swap_the_feel_felt_found_for_casual_professionalism
13376	5.325	ownership_language	discard	remove_the_feel_felt_found
13377	5.138	ownership_language+never_say_calm_down	discard	swap_the_feel_felt_found_for_never_say_calm_down
13378	5.525	ownership_language+genuine_admission	discard	swap_the_feel_felt_found_for_genuine_admission
13379	5.138	the_feel_felt_found+ownership_language+casual_professionalism	discard	add_casual_professionalism
13380	5.013	the_feel_felt_found+ownership_language	discard	tone_change
13381	5.325	the_feel_felt_found+ownership_language	discard	temp_0.75
13382	5.237	the_feel_felt_found+ownership_language+never_say_calm_down	discard	add_never_say_calm_down
13383	5.350	ownership_language	discard	remove_the_feel_felt_found
13384	5.325	the_feel_felt_found+ownership_language	discard	tone_change
13385	5.200	the_feel_felt_found+ownership_language	discard	crossover
13386	4.612	the_feel_felt_found+ownership_language	discard	crossover
13387	5.025	the_feel_felt_found+ownership_language+strategic_agreement	discard	add_strategic_agreement
13388	5.037	the_feel_felt_found+ownership_language	discard	temp_0.85
13389	5.037	the_feel_felt_found+ownership_language+genuine_admission	discard	add_genuine_admission
13390	5.237	the_feel_felt_found+ownership_language	discard	tone_change
13391	5.325	the_feel_felt_found+ownership_language+genuine_admission	discard	add_genuine_admission
13392	5.450	ownership_language	discard	remove_the_feel_felt_found
13393	5.013	the_feel_felt_found+ownership_language	discard	crossover
13394	5.338	the_feel_felt_found+ownership_language	discard	temp_0.75
13395	5.450	the_feel_felt_found+ownership_language+warmth_injection	discard	add_warmth_injection
13396	5.325	the_feel_felt_found+ownership_language	discard	tone_change
13397	5.013	the_feel_felt_found+ownership_language	discard	temp_0.95
13398	5.038	the_feel_felt_found+never_say_calm_down	discard	swap_ownership_language_for_never_say_calm_down
13399	5.112	the_feel_felt_found+ownership_language+energy_matching	discard	add_energy_matching
13400	5.250	ownership_language	discard	crossover
13401	5.325	the_feel_felt_found+ownership_language	discard	crossover
13402	5.138	the_feel_felt_found+ownership_language	discard	tone_change
13403	5.138	ownership_language+strategic_agreement	discard	swap_the_feel_felt_found_for_strategic_agreement
13404	5.350	the_feel_felt_found+strategic_agreement	discard	swap_ownership_language_for_strategic_agreement
13405	5.225	the_feel_felt_found+ownership_language+validation_before_solution	discard	add_validation_before_solution
13406	5.100	the_feel_felt_found+ownership_language+personal_touch	discard	add_personal_touch
13407	5.112	the_feel_felt_found+ownership_language	discard	tone_change
13408	4.825	the_feel_felt_found+ownership_language	discard	tone_change
13409	5.112	the_feel_felt_found+ownership_language+concrete_next_steps	discard	add_concrete_next_steps
13410	4.675	the_feel_felt_found+validation_before_solution	discard	swap_ownership_language_for_validation_before_solution
13411	5.425	the_feel_felt_found+concrete_next_steps	discard	swap_ownership_language_for_concrete_next_steps
13412	5.138	the_feel_felt_found+ownership_language	discard	crossover
13413	5.450	ownership_language	discard	crossover
13414	4.613	the_feel_felt_found+ownership_language+validation_before_solution	discard	add_validation_before_solution
13415	5.550	the_feel_felt_found+ownership_language	discard	temp_0.65
13416	5.138	ownership_language	discard	crossover
13417	5.325	the_feel_felt_found+ownership_language+concrete_next_steps	discard	add_concrete_next_steps
13418	5.238	the_feel_felt_found+ownership_language+genuine_admission	discard	add_genuine_admission
13419	5.013	the_feel_felt_found+ownership_language	discard	crossover
13420	5.200	the_feel_felt_found+personal_touch	discard	swap_ownership_language_for_personal_touch
13421	4.612	ownership_language+emotional_labeling	discard	swap_the_feel_felt_found_for_emotional_labeling
13422	5.450	the_feel_felt_found+ownership_language	discard	tone_change
13423	5.650	the_feel_felt_found+ownership_language	discard	crossover
13424	5.550	the_feel_felt_found+ownership_language+never_say_calm_down	discard	add_never_say_calm_down
13425	5.350	the_feel_felt_found+ownership_language+never_say_calm_down	discard	add_never_say_calm_down
13426	5.550	ownership_language+warmth_injection	discard	swap_the_feel_felt_found_for_warmth_injection
13427	4.925	the_feel_felt_found+validation_before_solution	discard	swap_ownership_language_for_validation_before_solution
13428	4.987	the_feel_felt_found+ownership_language	discard	crossover
13429	5.138	the_feel_felt_found+ownership_language	discard	tone_change
13430	5.025	the_feel_felt_found+ownership_language+personal_touch	discard	add_personal_touch
13431	4.888	the_feel_felt_found+ownership_language	discard	temp_0.85
13432	4.388	ownership_language	discard	remove_the_feel_felt_found
13433	5.400	the_feel_felt_found+concrete_next_steps	discard	swap_ownership_language_for_concrete_next_steps
13434	5.112	the_feel_felt_found+ownership_language	discard	crossover
13435	5.138	the_feel_felt_found+ownership_language	discard	tone_change
13436	5.037	the_feel_felt_found+ownership_language	discard	tone_change
13437	5.550	the_feel_felt_found+ownership_language	discard	tone_change
13438	5.112	the_feel_felt_found	discard	remove_ownership_language
13439	4.825	the_feel_felt_found+ownership_language	discard	tone_change
13440	4.888	the_feel_felt_found+ownership_language+personal_touch	discard	add_personal_touch
13441	5.025	the_feel_felt_found+ownership_language+mirroring	discard	add_mirroring
13442	5.237	the_feel_felt_found+ownership_language	discard	tone_change
13443	5.425	the_feel_felt_found+ownership_language+emotional_labeling	discard	add_emotional_labeling
13444	5.450	the_feel_felt_found+ownership_language	discard	temp_0.70
13445	5.200	the_feel_felt_found+proactive_extras	discard	swap_ownership_language_for_proactive_extras
13446	5.112	the_feel_felt_found+ownership_language+genuine_admission	discard	add_genuine_admission
13447	4.612	the_feel_felt_found+ownership_language+concrete_next_steps	discard	add_concrete_next_steps
13448	5.237	ownership_language+casual_professionalism	discard	swap_the_feel_felt_found_for_casual_professionalism
13449	4.700	the_feel_felt_found+ownership_language	discard	tone_change
13450	4.612	the_feel_felt_found+ownership_language	discard	crossover
13451	5.237	the_feel_felt_found+emotional_labeling	discard	swap_ownership_language_for_emotional_labeling
13452	5.325	the_feel_felt_found+ownership_language	discard	tone_change
13453	5.550	ownership_language	discard	remove_the_feel_felt_found
13454	5.525	the_feel_felt_found+ownership_language+energy_matching	discard	add_energy_matching
13455	4.487	the_feel_felt_found+ownership_language+emotional_labeling	discard	add_emotional_labeling
13456	5.138	the_feel_felt_found+ownership_language	discard	temp_0.95
13457	4.388	ownership_language	discard	crossover
13458	5.525	the_feel_felt_found+ownership_language+emotional_labeling	discard	add_emotional_labeling
13459	4.800	the_feel_felt_found+concrete_next_steps	discard	swap_ownership_language_for_concrete_next_steps
13460	5.450	none	discard	crossover
13461	5.013	the_feel_felt_found+ownership_language	discard	temp_0.95
13462	5.450	ownership_language+proactive_extras	discard	swap_the_feel_felt_found_for_proactive_extras
13463	5.350	the_feel_felt_found	discard	remove_ownership_language
13464	5.450	the_feel_felt_found+ownership_language	discard	tone_change
13465	5.325	the_feel_felt_found+ownership_language+strategic_agreement	discard	add_strategic_agreement
13466	5.025	the_feel_felt_found+ownership_language	discard	tone_change
13467	5.013	ownership_language+strategic_agreement	discard	swap_the_feel_felt_found_for_strategic_agreement
13468	5.550	the_feel_felt_found+ownership_language	discard	tone_change
13469	5.138	the_feel_felt_found	discard	remove_ownership_language
13470	5.325	ownership_language	discard	crossover
13471	5.425	the_feel_felt_found+ownership_language	discard	tone_change
13472	4.825	ownership_language+personal_touch	discard	swap_the_feel_felt_found_for_personal_touch
13473	4.925	the_feel_felt_found+ownership_language	discard	crossover
13474	5.325	the_feel_felt_found+ownership_language	discard	tone_change
13475	4.925	the_feel_felt_found	discard	crossover
13476	5.138	the_feel_felt_found+ownership_language	discard	tone_change
13477	5.237	ownership_language	discard	remove_the_feel_felt_found
13478	5.013	the_feel_felt_found+ownership_language	discard	tone_change
13479	5.013	the_feel_felt_found+ownership_language+genuine_admission	discard	add_genuine_admission
13480	4.888	the_feel_felt_found+personal_touch	discard	swap_ownership_language_for_personal_touch
13481	4.913	the_feel_felt_found+ownership_language	discard	tone_change
13482	5.550	the_feel_felt_found+casual_professionalism	discard	swap_ownership_language_for_casual_professionalism
13483	5.200	ownership_language	discard	crossover
13484	5.125	the_feel_felt_found+ownership_language	discard	temp_0.65
13485	5.237	the_feel_felt_found+ownership_language	discard	tone_change
13486	5.013	the_feel_felt_found+ownership_language	discard	tone_change
13487	5.237	the_feel_felt_found+ownership_language+concrete_next_steps	discard	add_concrete_next_steps
13488	5.125	the_feel_felt_found+ownership_language	discard	tone_change
13489	4.825	the_feel_felt_found+ownership_language+strategic_agreement	discard	add_strategic_agreement
13490	5.238	the_feel_felt_found+ownership_language+strategic_agreement	discard	add_strategic_agreement
13491	5.550	the_feel_felt_found+ownership_language	discard	crossover
13492	5.450	the_feel_felt_found+ownership_language	discard	tone_change
13493	5.550	ownership_language+genuine_admission	discard	swap_the_feel_felt_found_for_genuine_admission
13494	4.925	the_feel_felt_found+ownership_language+personal_touch	discard	add_personal_touch
13495	5.325	the_feel_felt_found+ownership_language+concrete_next_steps	discard	add_concrete_next_steps
13496	4.800	the_feel_felt_found+ownership_language+concrete_next_steps	discard	add_concrete_next_steps
13497	5.037	ownership_language	discard	remove_the_feel_felt_found
13498	5.025	the_feel_felt_found+ownership_language	discard	crossover
13499	5.425	ownership_language	discard	remove_the_feel_felt_found
13500	5.450	the_feel_felt_found+ownership_language+emotional_labeling	discard	add_emotional_labeling
13501	4.700	the_feel_felt_found+ownership_language	discard	tone_change
13502	5.100	the_feel_felt_found+ownership_language+never_say_calm_down	discard	add_never_say_calm_down
13503	5.550	the_feel_felt_found+ownership_language	discard	tone_change
13504	5.425	the_feel_felt_found+ownership_language	discard	temp_0.85
13505	5.112	the_feel_felt_found+ownership_language	discard	tone_change
13506	5.200	the_feel_felt_found+ownership_language+proactive_extras	discard	add_proactive_extras
13507	4.888	none	discard	crossover
13508	5.550	the_feel_felt_found+ownership_language+energy_matching	discard	add_energy_matching
13509	5.450	the_feel_felt_found+ownership_language	discard	crossover
13510	5.425	the_feel_felt_found+ownership_language+personal_touch	discard	add_personal_touch
13511	4.800	ownership_language+casual_professionalism	discard	swap_the_feel_felt_found_for_casual_professionalism
13512	4.900	the_feel_felt_found+ownership_language+warmth_injection	discard	add_warmth_injection
13513	5.550	ownership_language+genuine_admission	discard	swap_the_feel_felt_found_for_genuine_admission
13514	5.550	ownership_language+strategic_agreement	discard	swap_the_feel_felt_found_for_strategic_agreement
13515	5.325	ownership_language	discard	remove_the_feel_felt_found
13516	5.237	the_feel_felt_found+ownership_language	discard	crossover
13517	5.200	the_feel_felt_found+ownership_language	discard	crossover
13518	5.013	the_feel_felt_found	discard	crossover
13519	5.425	ownership_language+never_say_calm_down	discard	swap_the_feel_felt_found_for_never_say_calm_down
13520	5.300	the_feel_felt_found+ownership_language	discard	tone_change
13521	5.238	the_feel_felt_found+ownership_language	discard	temp_0.70
13522	5.550	the_feel_felt_found+ownership_language	discard	tone_change
13523	4.800	ownership_language	discard	crossover
13524	5.338	ownership_language	discard	remove_the_feel_felt_found
13525	5.450	the_feel_felt_found	discard	crossover
13526	5.425	the_feel_felt_found	discard	remove_ownership_language
13527	4.913	the_feel_felt_found+ownership_language	discard	crossover
13528	5.138	ownership_language+strategic_agreement	discard	swap_the_feel_felt_found_for_strategic_agreement
13529	5.450	the_feel_felt_found+ownership_language+validation_before_solution	discard	add_validation_before_solution
13530	5.350	ownership_language	discard	crossover
13531	5.013	the_feel_felt_found+ownership_language	discard	crossover
13532	5.425	the_feel_felt_found+ownership_language	discard	tone_change
13533	4.900	the_feel_felt_found+ownership_language	discard	tone_change
13534	5.113	the_feel_felt_found	discard	crossover
13535	5.238	the_feel_felt_found+ownership_language+personal_touch	discard	add_personal_touch
13536	5.450	the_feel_felt_found+ownership_language	discard	temp_0.95
13537	5.450	ownership_language+never_say_calm_down	discard	swap_the_feel_felt_found_for_never_say_calm_down
13538	5.225	the_feel_felt_found+ownership_language	discard	tone_change
13539	4.700	the_feel_felt_found+ownership_language+never_say_calm_down	discard	add_never_say_calm_down
13540	5.350	ownership_language+casual_professionalism	discard	swap_the_feel_felt_found_for_casual_professionalism
13541	5.138	the_feel_felt_found+ownership_language	discard	temp_0.65
13542	4.888	ownership_language	discard	remove_the_feel_felt_found
13543	5.750	none	discard	crossover
13544	5.238	the_feel_felt_found+ownership_language+never_say_calm_down	discard	add_never_say_calm_down
13545	5.037	the_feel_felt_found+ownership_language+never_say_calm_down	discard	add_never_say_calm_down
13546	5.237	the_feel_felt_found+ownership_language	discard	tone_change
13547	5.450	the_feel_felt_found+ownership_language	discard	temp_0.70
13548	5.300	ownership_language+validation_before_solution	discard	swap_the_feel_felt_found_for_validation_before_solution
13549	4.800	the_feel_felt_found+ownership_language	discard	temp_0.65
13550	5.425	the_feel_felt_found+ownership_language	discard	tone_change
13551	5.325	the_feel_felt_found+ownership_language	discard	tone_change
13552	5.237	ownership_language+casual_professionalism	discard	swap_the_feel_felt_found_for_casual_professionalism
13553	4.925	the_feel_felt_found+ownership_language	discard	crossover
13554	5.338	the_feel_felt_found+ownership_language	discard	tone_change
13555	5.525	the_feel_felt_found+ownership_language	discard	temp_0.65
13556	5.450	the_feel_felt_found+ownership_language	discard	tone_change
13557	4.825	the_feel_felt_found+ownership_language	discard	crossover
13558	5.138	the_feel_felt_found+ownership_language+casual_professionalism	discard	add_casual_professionalism
13559	5.650	the_feel_felt_found+ownership_language	discard	crossover
13560	5.425	ownership_language+emotional_labeling	discard	swap_the_feel_felt_found_for_emotional_labeling
13561	4.612	ownership_language	discard	crossover
13562	5.350	the_feel_felt_found+ownership_language	discard	temp_0.65
13563	4.575	the_feel_felt_found+ownership_language	discard	crossover
13564	5.550	the_feel_felt_found+ownership_language	discard	crossover
13565	5.450	the_feel_felt_found+ownership_language+emotional_labeling	discard	add_emotional_labeling
