generation	eq_score	techniques	status	description
15470	5.450	the_feel_felt_found+ownership_language	discard	tone_change
15471	5.237	the_feel_felt_found+ownership_language+proactive_extras	discard	add_proactive_extras
15472	4.900	the_feel_felt_found+ownership_language	discard	crossover
15473	5.350	the_feel_felt_found+ownership_language	discard	crossover
15474	5.013	the_feel_felt_found+ownership_language+emotional_labeling	discard	add_emotional_labeling
15475	5.037	ownership_language	discard	remove_the_feel_felt_found
15476	5.125	the_feel_felt_found+ownership_language	discard	crossover
15477	5.225	the_feel_felt_found+ownership_language	discard	tone_change
15478	5.138	the_feel_felt_found+ownership_language	discard	crossover
15479	5.225	the_feel_felt_found+ownership_language+energy_matching	discard	add_energy_matching
15480	5.137	the_feel_felt_found+ownership_language	discard	tone_change
15481	5.225	ownership_language	discard	remove_the_feel_felt_found
15482	5.550	ownership_language	discard	crossover
15483	5.338	ownership_language	discard	remove_the_feel_felt_found
15484	5.450	the_feel_felt_found+casual_professionalism	discard	swap_ownership_language_for_casual_professionalism
15485	5.013	the_feel_felt_found+ownership_language	discard	tone_change
15486	5.013	the_feel_felt_found+ownership_language	discard	temp_0.75
15487	5.338	the_feel_felt_found+ownership_language+casual_professionalism	discard	add_casual_professionalism
15488	5.200	the_feel_felt_found	discard	remove_ownership_language
15489	5.225	ownership_language+genuine_admission	discard	swap_the_feel_felt_found_for_genuine_admission
15490	5.750	ownership_language+warmth_injection	discard	swap_the_feel_felt_found_for_warmth_injection
15491	5.013	ownership_language	discard	crossover
15492	5.238	the_feel_felt_found	discard	remove_ownership_language
15493	5.450	the_feel_felt_found+personal_touch	discard	swap_ownership_language_for_personal_touch
15494	5.237	ownership_language	discard	remove_the_feel_felt_found
15495	5.300	the_feel_felt_found+ownership_language	discard	tone_change
15496	5.450	ownership_language+concrete_next_steps	discard	swap_the_feel_felt_found_for_concrete_next_steps
15497	5.550	the_feel_felt_found	discard	crossover
15498	4.888	the_feel_felt_found+ownership_language	discard	tone_change
15499	5.450	the_feel_felt_found+ownership_language	discard	tone_change
15500	5.425	ownership_language+personal_touch	discard	swap_the_feel_felt_found_for_personal_touch
15501	5.450	the_feel_felt_found+ownership_language+emotional_labeling	discard	add_emotional_labeling
15502	5.037	the_feel_felt_found+ownership_language+validation_before_solution	discard	add_validation_before_solution
15503	5.238	the_feel_felt_found+ownership_language	discard	tone_change
15504	5.325	the_feel_felt_found+validation_before_solution	discard	swap_ownership_language_for_validation_before_solution
15505	4.888	the_feel_felt_found	discard	remove_ownership_language
15506	5.450	ownership_language+emotional_labeling	discard	swap_the_feel_felt_found_for_emotional_labeling
15507	5.337	the_feel_felt_found	discard	crossover
15508	5.237	the_feel_felt_found+ownership_language+genuine_admission	discard	add_genuine_admission
15509	5.137	the_feel_felt_found+ownership_language	discard	temp_0.70
15510	5.450	the_feel_felt_found+ownership_language	discard	crossover
15511	5.025	the_feel_felt_found+ownership_language	discard	temp_0.90
15512	5.013	ownership_language+mirroring	discard	swap_the_feel_felt_found_for_mirroring
15513	5.075	ownership_language+mirroring	discard	swap_the_feel_felt_found_for_mirroring
15514	4.912	the_feel_felt_found+ownership_language	discard	temp_0.85
15515	5.200	the_feel_felt_found+mirroring	discard	swap_ownership_language_for_mirroring
15516	5.037	the_feel_felt_found+ownership_language+strategic_agreement	discard	add_strategic_agreement
15517	4.700	the_feel_felt_found+ownership_language+validation_before_solution	discard	add_validation_before_solution
15518	5.425	the_feel_felt_found+ownership_language+validation_before_solution	discard	add_validation_before_solution
15519	5.350	the_feel_felt_found+ownership_language	discard	crossover
15520	5.013	the_feel_felt_found+ownership_language	discard	tone_change
15521	5.212	the_feel_felt_found+ownership_language+casual_professionalism	discard	add_casual_professionalism
15522	5.112	the_feel_felt_found+ownership_language+concrete_next_steps	discard	add_concrete_next_steps
15523	5.325	the_feel_felt_found+mirroring	discard	swap_ownership_language_for_mirroring
15524	5.238	the_feel_felt_found+ownership_language	discard	tone_change
15525	5.338	the_feel_felt_found+ownership_language	discard	temp_0.70
15526	4.925	the_feel_felt_found	discard	crossover
15527	5.450	the_feel_felt_found+ownership_language+proactive_extras	discard	add_proactive_extras
15528	5.113	the_feel_felt_found+ownership_language	discard	tone_change
15529	5.325	the_feel_felt_found+ownership_language+emotional_labeling	discard	add_emotional_labeling
15530	5.237	the_feel_felt_found+ownership_language	discard	tone_change
15531	5.550	the_feel_felt_found+ownership_language	discard	crossover
15532	5.237	the_feel_felt_found+ownership_language	discard	tone_change
15533	5.325	the_feel_felt_found+ownership_language	discard	temp_0.70
15534	5.450	the_feel_felt_found+ownership_language+concrete_next_steps	discard	add_concrete_next_steps
15535	5.112	the_feel_felt_found	discard	crossover
15536	5.550	none	discard	crossover
15537	5.425	the_feel_felt_found+ownership_language	discard	tone_change
15538	5.013	the_feel_felt_found+ownership_language	discard	tone_change
15539	4.988	the_feel_felt_found+ownership_language	discard	temp_0.90
15540	4.800	the_feel_felt_found	discard	crossover
15541	5.237	the_feel_felt_found+ownership_language	discard	tone_change
15542	5.450	the_feel_felt_found+ownership_language	discard	tone_change
15543	5.200	the_feel_felt_found	discard	remove_ownership_language
15544	5.138	the_feel_felt_found+ownership_language	discard	crossover
15545	5.325	ownership_language+never_say_calm_down	discard	swap_the_feel_felt_found_for_never_say_calm_down
15546	5.338	the_feel_felt_found+ownership_language	discard	tone_change
15547	5.450	the_feel_felt_found+concrete_next_steps	discard	swap_ownership_language_for_concrete_next_steps
15548	5.113	ownership_language	discard	crossover
15549	5.450	ownership_language	discard	remove_the_feel_felt_found
15550	4.912	the_feel_felt_found+ownership_language+energy_matching	discard	add_energy_matching
15551	5.138	the_feel_felt_found+ownership_language	discard	crossover
15552	4.912	the_feel_felt_found+ownership_language+personal_touch	discard	add_personal_touch
15553	5.450	the_feel_felt_found+ownership_language+proactive_extras	discard	add_proactive_extras
15554	5.112	the_feel_felt_found+ownership_language+warmth_injection	discard	add_warmth_injection
15555	5.300	the_feel_felt_found+ownership_language	discard	temp_0.65
15556	5.138	the_feel_felt_found+ownership_language	discard	crossover
15557	5.550	the_feel_felt_found+ownership_language+genuine_admission	discard	add_genuine_admission
15558	5.350	the_feel_felt_found+strategic_agreement	discard	swap_ownership_language_for_strategic_agreement
15559	5.200	the_feel_felt_found+ownership_language	discard	temp_0.85
15560	5.325	the_feel_felt_found+ownership_language+genuine_admission	discard	add_genuine_admission
15561	5.237	the_feel_felt_found+ownership_language	discard	tone_change
15562	5.325	the_feel_felt_found+ownership_language	discard	tone_change
15563	5.013	the_feel_felt_found	discard	remove_ownership_language
15564	5.425	the_feel_felt_found+ownership_language	discard	tone_change
15565	5.137	the_feel_felt_found+ownership_language+mirroring	discard	add_mirroring
15566	5.237	the_feel_felt_found	discard	crossover
15567	4.725	the_feel_felt_found+ownership_language+casual_professionalism	discard	add_casual_professionalism
15568	4.825	the_feel_felt_found+ownership_language	discard	temp_0.75
15569	5.425	the_feel_felt_found+ownership_language	discard	crossover
15570	4.612	the_feel_felt_found+ownership_language	discard	temp_0.90
15571	5.138	ownership_language	discard	remove_the_feel_felt_found
15572	5.337	the_feel_felt_found+ownership_language	discard	tone_change
15573	4.612	ownership_language	discard	remove_the_feel_felt_found
15574	5.450	the_feel_felt_found+ownership_language	discard	temp_0.75
15575	4.925	the_feel_felt_found+ownership_language+casual_professionalism	discard	add_casual_professionalism
15576	5.138	the_feel_felt_found	discard	crossover
15577	5.325	the_feel_felt_found+ownership_language	discard	tone_change
15578	4.700	the_feel_felt_found+ownership_language	discard	tone_change
15579	5.650	the_feel_felt_found+ownership_language	discard	crossover
15580	5.550	none	discard	crossover
15581	5.225	the_feel_felt_found+ownership_language	discard	temp_0.75
15582	5.225	the_feel_felt_found+ownership_language	discard	temp_0.90
15583	5.138	ownership_language+mirroring	discard	swap_the_feel_felt_found_for_mirroring
15584	5.300	the_feel_felt_found+ownership_language	discard	crossover
15585	5.450	the_feel_felt_found	discard	crossover
15586	4.912	ownership_language+warmth_injection	discard	swap_the_feel_felt_found_for_warmth_injection
15587	5.213	the_feel_felt_found+ownership_language+genuine_admission	discard	add_genuine_admission
15588	4.513	the_feel_felt_found	discard	crossover
15589	5.112	the_feel_felt_found+ownership_language+proactive_extras	discard	add_proactive_extras
15590	5.138	the_feel_felt_found+ownership_language	discard	tone_change
15591	5.237	the_feel_felt_found+ownership_language+personal_touch	discard	add_personal_touch
15592	5.075	the_feel_felt_found+ownership_language+personal_touch	discard	add_personal_touch
15593	5.425	the_feel_felt_found+ownership_language+strategic_agreement	discard	add_strategic_agreement
15594	5.013	the_feel_felt_found+energy_matching	discard	swap_ownership_language_for_energy_matching
15595	5.300	ownership_language	discard	remove_the_feel_felt_found
15596	5.425	the_feel_felt_found+ownership_language	discard	tone_change
15597	4.912	ownership_language+casual_professionalism	discard	swap_the_feel_felt_found_for_casual_professionalism
15598	4.713	the_feel_felt_found+ownership_language	discard	temp_0.90
15599	5.237	the_feel_felt_found+ownership_language+never_say_calm_down	discard	add_never_say_calm_down
15600	5.550	the_feel_felt_found+ownership_language+energy_matching	discard	add_energy_matching
15601	5.338	the_feel_felt_found+ownership_language+warmth_injection	discard	add_warmth_injection
15602	5.650	the_feel_felt_found+ownership_language	discard	tone_change
15603	5.550	the_feel_felt_found+ownership_language	discard	tone_change
15604	5.013	the_feel_felt_found+ownership_language	discard	crossover
15605	4.488	the_feel_felt_found+ownership_language	discard	crossover
15606	5.175	the_feel_felt_found+ownership_language	discard	temp_0.85
15607	4.950	the_feel_felt_found+ownership_language+energy_matching	discard	add_energy_matching
15608	5.237	ownership_language+personal_touch	discard	swap_the_feel_felt_found_for_personal_touch
15609	5.337	the_feel_felt_found+ownership_language+validation_before_solution	discard	add_validation_before_solution
15610	5.550	the_feel_felt_found+ownership_language	discard	crossover
15611	4.925	the_feel_felt_found+ownership_language	discard	temp_0.75
15612	5.138	the_feel_felt_found+ownership_language	discard	tone_change
15613	5.325	the_feel_felt_found+ownership_language	discard	tone_change
15614	5.550	the_feel_felt_found+ownership_language+casual_professionalism	discard	add_casual_professionalism
15615	5.037	the_feel_felt_found+ownership_language+casual_professionalism	discard	add_casual_professionalism
15616	5.237	the_feel_felt_found+ownership_language	discard	temp_0.85
15617	5.138	ownership_language	discard	remove_the_feel_felt_found
15618	5.238	the_feel_felt_found+ownership_language	discard	crossover
15619	5.450	the_feel_felt_found+ownership_language+mirroring	discard	add_mirroring
15620	5.237	the_feel_felt_found+ownership_language	discard	tone_change
15621	5.550	the_feel_felt_found	discard	remove_ownership_language
15622	5.525	the_feel_felt_found+ownership_language	discard	tone_change
15623	5.450	ownership_language+casual_professionalism	discard	swap_the_feel_felt_found_for_casual_professionalism
15624	5.238	the_feel_felt_found+ownership_language	discard	tone_change
15625	5.750	ownership_language	discard	remove_the_feel_felt_found
15626	4.700	the_feel_felt_found+ownership_language	discard	crossover
15627	5.237	the_feel_felt_found+ownership_language+proactive_extras	discard	add_proactive_extras
15628	5.325	the_feel_felt_found+mirroring	discard	swap_ownership_language_for_mirroring
15629	5.650	ownership_language	discard	crossover
15630	5.550	the_feel_felt_found+ownership_language	discard	tone_change
15631	5.138	the_feel_felt_found+ownership_language+validation_before_solution	discard	add_validation_before_solution
15632	5.750	the_feel_felt_found+ownership_language	discard	tone_change
15633	5.650	the_feel_felt_found+ownership_language+emotional_labeling	discard	add_emotional_labeling
15634	5.450	the_feel_felt_found	discard	remove_ownership_language
15635	5.425	ownership_language	discard	remove_the_feel_felt_found
15636	5.450	the_feel_felt_found+ownership_language+concrete_next_steps	discard	add_concrete_next_steps
15637	5.550	the_feel_felt_found	discard	crossover
15638	5.650	ownership_language+never_say_calm_down	discard	swap_the_feel_felt_found_for_never_say_calm_down
15639	5.350	ownership_language	discard	crossover
15640	5.650	the_feel_felt_found+ownership_language+genuine_admission	discard	add_genuine_admission
15641	4.825	the_feel_felt_found+mirroring	discard	swap_ownership_language_for_mirroring
15642	5.113	the_feel_felt_found+ownership_language	discard	tone_change
15643	5.438	the_feel_felt_found+ownership_language	discard	crossover
15644	5.325	the_feel_felt_found+ownership_language+validation_before_solution	discard	add_validation_before_solution
15645	5.425	ownership_language+validation_before_solution	discard	swap_the_feel_felt_found_for_validation_before_solution
15646	5.450	the_feel_felt_found+ownership_language	discard	tone_change
15647	5.213	the_feel_felt_found+ownership_language	discard	tone_change
15648	5.650	the_feel_felt_found+ownership_language	discard	tone_change
15649	5.238	the_feel_felt_found	discard	crossover
15650	5.550	the_feel_felt_found+ownership_language+validation_before_solution	discard	add_validation_before_solution
15651	4.988	the_feel_felt_found+ownership_language+validation_before_solution	discard	add_validation_before_solution
15652	5.450	the_feel_felt_found+ownership_language	discard	tone_change
15653	5.450	the_feel_felt_found+ownership_language	discard	tone_change
15654	5.450	ownership_language	discard	remove_the_feel_felt_found
15655	4.700	the_feel_felt_found+ownership_language	discard	tone_change
15656	5.237	the_feel_felt_found+ownership_language	discard	tone_change
15657	5.338	ownership_language	discard	remove_the_feel_felt_found
15658	5.425	the_feel_felt_found+ownership_language+concrete_next_steps	discard	add_concrete_next_steps
15659	5.038	the_feel_felt_found+ownership_language+strategic_agreement	discard	add_strategic_agreement
15660	5.550	the_feel_felt_found+ownership_language+casual_professionalism	discard	add_casual_professionalism
15661	5.325	the_feel_felt_found	discard	remove_ownership_language
15662	5.113	ownership_language	discard	crossover
15663	4.925	the_feel_felt_found+ownership_language	discard	crossover
15664	4.725	the_feel_felt_found+ownership_language+validation_before_solution	discard	add_validation_before_solution
15665	5.338	the_feel_felt_found+concrete_next_steps	discard	swap_ownership_language_for_concrete_next_steps
15666	5.238	the_feel_felt_found+ownership_language	discard	tone_change
15667	5.325	the_feel_felt_found+ownership_language	discard	crossover
15668	5.650	the_feel_felt_found+never_say_calm_down	discard	swap_ownership_language_for_never_say_calm_down
15669	4.912	ownership_language	discard	remove_the_feel_felt_found
15670	5.425	the_feel_felt_found+ownership_language+concrete_next_steps	discard	add_concrete_next_steps
15671	5.325	ownership_language+mirroring	discard	swap_the_feel_felt_found_for_mirroring
15672	5.013	ownership_language	discard	remove_the_feel_felt_found
15673	5.450	the_feel_felt_found+ownership_language+energy_matching	discard	add_energy_matching
15674	5.325	the_feel_felt_found+ownership_language	discard	temp_0.85
15675	5.325	ownership_language	discard	remove_the_feel_felt_found
15676	5.325	the_feel_felt_found+ownership_language	discard	tone_change
15677	5.013	the_feel_felt_found+ownership_language+validation_before_solution	discard	add_validation_before_solution
15678	5.137	the_feel_felt_found	discard	crossover
15679	5.013	ownership_language	discard	remove_the_feel_felt_found
15680	5.138	the_feel_felt_found+ownership_language	discard	tone_change
15681	5.550	the_feel_felt_found+ownership_language	discard	crossover
15682	5.325	the_feel_felt_found+ownership_language	discard	temp_0.85
15683	5.013	the_feel_felt_found+ownership_language+validation_before_solution	discard	add_validation_before_solution
15684	5.550	the_feel_felt_found+ownership_language	discard	crossover
15685	5.425	ownership_language	discard	remove_the_feel_felt_found
15686	5.238	the_feel_felt_found+ownership_language	discard	crossover
15687	5.237	the_feel_felt_found+ownership_language	discard	crossover
15688	5.550	ownership_language+proactive_extras	discard	swap_the_feel_felt_found_for_proactive_extras
15689	5.113	the_feel_felt_found+ownership_language	discard	tone_change
15690	5.237	the_feel_felt_found+ownership_language	discard	temp_0.95
15691	5.238	the_feel_felt_found+ownership_language	discard	temp_0.65
15692	5.550	the_feel_felt_found+warmth_injection	discard	swap_ownership_language_for_warmth_injection
15693	5.013	the_feel_felt_found+ownership_language+warmth_injection	discard	add_warmth_injection
15694	5.650	the_feel_felt_found+ownership_language	discard	tone_change
15695	5.237	the_feel_felt_found+ownership_language	discard	tone_change
15696	5.550	the_feel_felt_found+ownership_language	discard	temp_0.75
15697	5.325	the_feel_felt_found+ownership_language	discard	tone_change
15698	5.450	the_feel_felt_found+ownership_language+mirroring	discard	add_mirroring
15699	5.425	ownership_language+genuine_admission	discard	swap_the_feel_felt_found_for_genuine_admission
15700	5.325	the_feel_felt_found+ownership_language	discard	tone_change
15701	5.138	the_feel_felt_found+validation_before_solution	discard	swap_ownership_language_for_validation_before_solution
15702	5.325	the_feel_felt_found+ownership_language	discard	crossover
15703	5.425	the_feel_felt_found	discard	remove_ownership_language
15704	5.138	the_feel_felt_found+ownership_language	discard	tone_change
15705	5.425	the_feel_felt_found+ownership_language	discard	crossover
15706	5.250	ownership_language	discard	crossover
15707	5.138	the_feel_felt_found+ownership_language+proactive_extras	discard	add_proactive_extras
15708	5.425	the_feel_felt_found+ownership_language+proactive_extras	discard	add_proactive_extras
15709	5.025	ownership_language+genuine_admission	discard	swap_the_feel_felt_found_for_genuine_admission
15710	5.425	the_feel_felt_found+validation_before_solution	discard	swap_ownership_language_for_validation_before_solution
15711	5.238	the_feel_felt_found	discard	remove_ownership_language
15712	5.650	ownership_language	discard	remove_the_feel_felt_found
15713	5.138	the_feel_felt_found+ownership_language+warmth_injection	discard	add_warmth_injection
15714	5.025	the_feel_felt_found+ownership_language	discard	tone_change
15715	4.513	the_feel_felt_found+ownership_language	discard	temp_0.90
15716	5.325	the_feel_felt_found+never_say_calm_down	discard	swap_ownership_language_for_never_say_calm_down
15717	5.450	the_feel_felt_found+ownership_language	discard	crossover
15718	5.425	the_feel_felt_found+ownership_language	discard	tone_change
15719	4.825	the_feel_felt_found+ownership_language+warmth_injection	discard	add_warmth_injection
15720	5.013	the_feel_felt_found	discard	crossover
15721	5.550	ownership_language	discard	crossover
15722	5.212	ownership_language+casual_professionalism	discard	swap_the_feel_felt_found_for_casual_professionalism
15723	5.025	the_feel_felt_found+ownership_language	discard	crossover
15724	5.325	the_feel_felt_found+ownership_language	discard	tone_change
15725	5.138	ownership_language	discard	crossover
15726	5.025	ownership_language+genuine_admission	discard	swap_the_feel_felt_found_for_genuine_admission
15727	5.112	the_feel_felt_found+ownership_language	discard	temp_0.65
15728	5.450	the_feel_felt_found+ownership_language	discard	temp_0.75
15729	5.650	the_feel_felt_found+ownership_language	discard	crossover
15730	5.325	the_feel_felt_found+ownership_language	discard	tone_change
15731	5.550	the_feel_felt_found+emotional_labeling	discard	swap_ownership_language_for_emotional_labeling
15732	5.138	the_feel_felt_found+ownership_language	discard	temp_0.70
15733	4.900	the_feel_felt_found+ownership_language+mirroring	discard	add_mirroring
15734	5.350	the_feel_felt_found+ownership_language+warmth_injection	discard	add_warmth_injection
15735	5.300	the_feel_felt_found+ownership_language	discard	temp_0.65
15736	5.237	ownership_language+mirroring	discard	swap_the_feel_felt_found_for_mirroring
15737	4.925	ownership_language+warmth_injection	discard	swap_the_feel_felt_found_for_warmth_injection
15738	5.200	ownership_language+emotional_labeling	discard	swap_the_feel_felt_found_for_emotional_labeling
15739	5.325	the_feel_felt_found+ownership_language+genuine_admission	discard	add_genuine_admission
15740	5.300	the_feel_felt_found+emotional_labeling	discard	swap_ownership_language_for_emotional_labeling
15741	5.450	none	discard	crossover
15742	4.488	the_feel_felt_found+ownership_language+never_say_calm_down	discard	add_never_say_calm_down
15743	5.300	the_feel_felt_found+ownership_language	discard	tone_change
