generation	eq_score	techniques	status	description
18229	5.650	the_feel_felt_found+ownership_language+casual_professionalism	discard	add_casual_professionalism
18230	5.200	the_feel_felt_found+ownership_language+strategic_agreement	discard	add_strategic_agreement
18231	5.425	the_feel_felt_found+personal_touch	discard	swap_ownership_language_for_personal_touch
18232	5.112	ownership_language+genuine_admission	discard	swap_the_feel_felt_found_for_genuine_admission
18233	5.450	the_feel_felt_found+ownership_language	discard	tone_change
18234	5.450	the_feel_felt_found+ownership_language	discard	tone_change
18235	5.450	none	discard	crossover
18236	5.138	the_feel_felt_found+ownership_language	discard	tone_change
18237	4.825	the_feel_felt_found+ownership_language+casual_professionalism	discard	add_casual_professionalism
18238	5.425	the_feel_felt_found+casual_professionalism	discard	swap_ownership_language_for_casual_professionalism
18239	5.325	ownership_language	discard	crossover
18240	5.325	the_feel_felt_found+ownership_language	discard	tone_change
18241	5.037	the_feel_felt_found+ownership_language+mirroring	discard	add_mirroring
18242	5.237	ownership_language	discard	crossover
18243	5.400	the_feel_felt_found+ownership_language	discard	tone_change
18244	5.200	the_feel_felt_found+ownership_language+mirroring	discard	add_mirroring
18245	5.138	ownership_language	discard	crossover
18246	4.925	ownership_language	discard	crossover
18247	5.137	the_feel_felt_found+ownership_language	discard	crossover
18248	5.325	the_feel_felt_found+ownership_language	discard	tone_change
18249	5.450	the_feel_felt_found+warmth_injection	discard	swap_ownership_language_for_warmth_injection
18250	5.138	ownership_language	discard	remove_the_feel_felt_found
18251	5.425	the_feel_felt_found+ownership_language+energy_matching	discard	add_energy_matching
18252	5.112	ownership_language	discard	crossover
18253	5.450	the_feel_felt_found+ownership_language+mirroring	discard	add_mirroring
18254	5.237	the_feel_felt_found+ownership_language+proactive_extras	discard	add_proactive_extras
18255	5.037	ownership_language	discard	crossover
18256	5.325	the_feel_felt_found+ownership_language	discard	crossover
18257	5.138	the_feel_felt_found+ownership_language+strategic_agreement	discard	add_strategic_agreement
18258	5.138	the_feel_felt_found	discard	crossover
18259	4.825	the_feel_felt_found+ownership_language	discard	crossover
18260	5.100	the_feel_felt_found+ownership_language	discard	temp_0.85
18261	5.550	the_feel_felt_found+warmth_injection	discard	swap_ownership_language_for_warmth_injection
18262	5.350	the_feel_felt_found+ownership_language	discard	tone_change
18263	5.425	the_feel_felt_found+ownership_language+validation_before_solution	discard	add_validation_before_solution
18264	5.400	the_feel_felt_found+ownership_language	discard	tone_change
18265	5.200	the_feel_felt_found+ownership_language+strategic_agreement	discard	add_strategic_agreement
18266	5.337	the_feel_felt_found+ownership_language+mirroring	discard	add_mirroring
18267	5.112	the_feel_felt_found+ownership_language	discard	temp_0.90
18268	4.825	the_feel_felt_found+concrete_next_steps	discard	swap_ownership_language_for_concrete_next_steps
18269	5.550	the_feel_felt_found+ownership_language+validation_before_solution	discard	add_validation_before_solution
18270	5.013	ownership_language	discard	remove_the_feel_felt_found
18271	5.213	the_feel_felt_found+ownership_language+genuine_admission	discard	add_genuine_admission
18272	5.225	the_feel_felt_found+ownership_language	discard	crossover
18273	5.138	the_feel_felt_found+ownership_language+energy_matching	discard	add_energy_matching
18274	5.338	the_feel_felt_found+ownership_language+energy_matching	discard	add_energy_matching
18275	5.450	the_feel_felt_found+ownership_language+proactive_extras	discard	add_proactive_extras
18276	5.550	ownership_language	discard	crossover
18277	5.325	the_feel_felt_found+ownership_language	discard	tone_change
18278	5.200	the_feel_felt_found+ownership_language	discard	crossover
18279	5.013	the_feel_felt_found+ownership_language	discard	tone_change
18280	4.925	the_feel_felt_found+ownership_language+emotional_labeling	discard	add_emotional_labeling
18281	5.237	the_feel_felt_found+ownership_language	discard	temp_0.90
18282	5.138	the_feel_felt_found+ownership_language	discard	tone_change
18283	5.037	the_feel_felt_found+ownership_language	discard	crossover
18284	5.450	the_feel_felt_found+ownership_language	discard	tone_change
18285	4.825	the_feel_felt_found+ownership_language+genuine_admission	discard	add_genuine_admission
18286	5.650	the_feel_felt_found+ownership_language+mirroring	discard	add_mirroring
18287	5.213	the_feel_felt_found+ownership_language+never_say_calm_down	discard	add_never_say_calm_down
18288	5.450	the_feel_felt_found+ownership_language+energy_matching	discard	add_energy_matching
18289	5.137	the_feel_felt_found+ownership_language	discard	crossover
18290	5.425	the_feel_felt_found+ownership_language+strategic_agreement	discard	add_strategic_agreement
18291	5.450	the_feel_felt_found+mirroring	discard	swap_ownership_language_for_mirroring
18292	4.800	the_feel_felt_found+ownership_language	discard	temp_0.85
18293	5.350	the_feel_felt_found+ownership_language	discard	tone_change
18294	5.112	the_feel_felt_found+ownership_language	discard	temp_0.65
18295	5.213	the_feel_felt_found+ownership_language+mirroring	discard	add_mirroring
18296	5.237	the_feel_felt_found+personal_touch	discard	swap_ownership_language_for_personal_touch
18297	5.113	ownership_language+personal_touch	discard	swap_the_feel_felt_found_for_personal_touch
18298	5.450	the_feel_felt_found+casual_professionalism	discard	swap_ownership_language_for_casual_professionalism
18299	4.925	the_feel_felt_found+ownership_language+energy_matching	discard	add_energy_matching
18300	5.237	the_feel_felt_found+proactive_extras	discard	swap_ownership_language_for_proactive_extras
18301	5.213	the_feel_felt_found+ownership_language	discard	crossover
18302	5.138	the_feel_felt_found+ownership_language+warmth_injection	discard	add_warmth_injection
18303	5.450	the_feel_felt_found+ownership_language+personal_touch	discard	add_personal_touch
18304	4.825	none	discard	crossover
18305	5.212	the_feel_felt_found+ownership_language	discard	temp_0.90
18306	5.450	the_feel_felt_found+ownership_language+warmth_injection	discard	add_warmth_injection
18307	5.225	the_feel_felt_found+ownership_language+validation_before_solution	discard	add_validation_before_solution
18308	5.237	the_feel_felt_found+ownership_language+energy_matching	discard	add_energy_matching
18309	5.450	the_feel_felt_found+ownership_language	discard	crossover
18310	5.450	the_feel_felt_found	discard	crossover
18311	5.075	none	discard	crossover
18312	5.112	none	discard	crossover
18313	5.237	the_feel_felt_found+ownership_language	discard	temp_0.85
18314	4.700	none	discard	crossover
18315	4.513	the_feel_felt_found+ownership_language	discard	crossover
18316	5.137	the_feel_felt_found+ownership_language+warmth_injection	discard	add_warmth_injection
18317	5.450	the_feel_felt_found+ownership_language+genuine_admission	discard	add_genuine_admission
18318	5.138	the_feel_felt_found+personal_touch	discard	swap_ownership_language_for_personal_touch
18319	5.200	the_feel_felt_found+ownership_language+concrete_next_steps	discard	add_concrete_next_steps
18320	5.238	the_feel_felt_found+ownership_language	discard	crossover
18321	5.450	the_feel_felt_found+ownership_language+genuine_admission	discard	add_genuine_admission
18322	4.800	the_feel_felt_found+ownership_language	discard	tone_change
18323	5.237	the_feel_felt_found+ownership_language	discard	crossover
18324	5.550	the_feel_felt_found+ownership_language+personal_touch	discard	add_personal_touch
18325	5.437	the_feel_felt_found+ownership_language	discard	crossover
18326	5.550	ownership_language	discard	crossover
18327	5.237	ownership_language+proactive_extras	discard	swap_the_feel_felt_found_for_proactive_extras
18328	5.325	the_feel_felt_found	discard	remove_ownership_language
18329	5.138	ownership_language	discard	crossover
18330	5.338	the_feel_felt_found+ownership_language+casual_professionalism	discard	add_casual_professionalism
18331	5.013	the_feel_felt_found+personal_touch	discard	swap_ownership_language_for_personal_touch
18332	5.338	the_feel_felt_found+strategic_agreement	discard	swap_ownership_language_for_strategic_agreement
18333	5.550	the_feel_felt_found	discard	remove_ownership_language
18334	5.450	the_feel_felt_found+ownership_language	discard	crossover
18335	5.550	the_feel_felt_found+ownership_language+genuine_admission	discard	add_genuine_admission
18336	5.450	the_feel_felt_found+ownership_language+validation_before_solution	discard	add_validation_before_solution
18337	4.925	the_feel_felt_found+ownership_language	discard	temp_0.85
18338	5.112	the_feel_felt_found+ownership_language+genuine_admission	discard	add_genuine_admission
18339	5.325	the_feel_felt_found+ownership_language	discard	temp_0.95
18340	5.025	the_feel_felt_found+ownership_language	discard	crossover
18341	4.925	the_feel_felt_found+ownership_language	discard	tone_change
18342	5.325	the_feel_felt_found+ownership_language+validation_before_solution	discard	add_validation_before_solution
18343	5.237	the_feel_felt_found+ownership_language	discard	tone_change
18344	5.138	the_feel_felt_found+ownership_language	discard	crossover
18345	5.138	the_feel_felt_found+ownership_language	discard	temp_0.75
18346	5.200	the_feel_felt_found+ownership_language	discard	tone_change
18347	5.237	ownership_language	discard	crossover
18348	5.450	the_feel_felt_found	discard	crossover
18349	5.650	the_feel_felt_found+ownership_language+mirroring	discard	add_mirroring
18350	4.825	the_feel_felt_found+ownership_language	discard	tone_change
18351	5.325	the_feel_felt_found+ownership_language+energy_matching	discard	add_energy_matching
18352	5.450	the_feel_felt_found+ownership_language	discard	temp_0.75
18353	4.925	ownership_language+energy_matching	discard	swap_the_feel_felt_found_for_energy_matching
18354	5.525	the_feel_felt_found+ownership_language	discard	crossover
18355	5.237	the_feel_felt_found+ownership_language+casual_professionalism	discard	add_casual_professionalism
18356	5.550	the_feel_felt_found+ownership_language	discard	temp_0.65
18357	5.450	the_feel_felt_found	discard	remove_ownership_language
18358	5.325	the_feel_felt_found+ownership_language	discard	tone_change
18359	5.013	the_feel_felt_found+ownership_language	discard	tone_change
18360	4.700	ownership_language+personal_touch	discard	swap_the_feel_felt_found_for_personal_touch
18361	5.425	ownership_language+energy_matching	discard	swap_the_feel_felt_found_for_energy_matching
18362	5.337	ownership_language+concrete_next_steps	discard	swap_the_feel_felt_found_for_concrete_next_steps
18363	5.112	the_feel_felt_found+ownership_language	discard	temp_0.90
18364	5.450	the_feel_felt_found+ownership_language	discard	crossover
18365	5.325	the_feel_felt_found+proactive_extras	discard	swap_ownership_language_for_proactive_extras
18366	5.450	the_feel_felt_found+ownership_language	discard	crossover
18367	5.325	the_feel_felt_found+ownership_language+mirroring	discard	add_mirroring
18368	5.550	the_feel_felt_found	discard	remove_ownership_language
18369	5.138	the_feel_felt_found+ownership_language	discard	temp_0.70
18370	5.112	the_feel_felt_found+ownership_language+never_say_calm_down	discard	add_never_say_calm_down
18371	5.325	ownership_language	discard	remove_the_feel_felt_found
18372	5.425	ownership_language	discard	crossover
18373	5.425	the_feel_felt_found+ownership_language	discard	crossover
18374	5.225	the_feel_felt_found+ownership_language+never_say_calm_down	discard	add_never_say_calm_down
18375	5.650	the_feel_felt_found+ownership_language+mirroring	discard	add_mirroring
18376	5.550	the_feel_felt_found+ownership_language	discard	tone_change
18377	5.200	the_feel_felt_found+ownership_language	discard	tone_change
18378	5.237	the_feel_felt_found+ownership_language	discard	crossover
18379	5.550	the_feel_felt_found+ownership_language	discard	temp_0.75
18380	5.550	the_feel_felt_found+ownership_language+concrete_next_steps	discard	add_concrete_next_steps
18381	5.112	the_feel_felt_found+ownership_language	discard	tone_change
18382	5.138	ownership_language+concrete_next_steps	discard	swap_the_feel_felt_found_for_concrete_next_steps
18383	5.113	the_feel_felt_found	discard	crossover
18384	5.425	the_feel_felt_found+ownership_language+mirroring	discard	add_mirroring
18385	5.037	the_feel_felt_found+ownership_language+strategic_agreement	discard	add_strategic_agreement
18386	5.325	the_feel_felt_found+ownership_language+energy_matching	discard	add_energy_matching
18387	5.037	the_feel_felt_found+ownership_language	discard	tone_change
18388	5.113	the_feel_felt_found+ownership_language	discard	temp_0.90
18389	4.888	ownership_language	discard	crossover
18390	5.200	the_feel_felt_found+ownership_language+validation_before_solution	discard	add_validation_before_solution
18391	5.300	the_feel_felt_found+ownership_language+concrete_next_steps	discard	add_concrete_next_steps
18392	5.550	the_feel_felt_found+ownership_language	discard	tone_change
18393	5.037	the_feel_felt_found+ownership_language	discard	crossover
18394	5.237	the_feel_felt_found+ownership_language	discard	tone_change
18395	5.450	ownership_language	discard	remove_the_feel_felt_found
18396	5.425	the_feel_felt_found+ownership_language	discard	tone_change
18397	5.425	ownership_language+genuine_admission	discard	swap_the_feel_felt_found_for_genuine_admission
18398	4.825	the_feel_felt_found+ownership_language	discard	temp_0.70
18399	5.237	the_feel_felt_found+ownership_language	discard	temp_0.85
18400	5.237	ownership_language+casual_professionalism	discard	swap_the_feel_felt_found_for_casual_professionalism
18401	5.325	none	discard	crossover
18402	5.450	the_feel_felt_found+ownership_language	discard	tone_change
18403	5.237	ownership_language+mirroring	discard	swap_the_feel_felt_found_for_mirroring
18404	5.325	the_feel_felt_found+ownership_language+emotional_labeling	discard	add_emotional_labeling
18405	4.713	the_feel_felt_found+ownership_language+strategic_agreement	discard	add_strategic_agreement
18406	5.550	ownership_language+validation_before_solution	discard	swap_the_feel_felt_found_for_validation_before_solution
18407	5.200	the_feel_felt_found+ownership_language	discard	tone_change
18408	5.438	the_feel_felt_found+ownership_language	discard	crossover
18409	5.138	ownership_language+strategic_agreement	discard	swap_the_feel_felt_found_for_strategic_agreement
18410	4.987	the_feel_felt_found+ownership_language+proactive_extras	discard	add_proactive_extras
18411	5.237	the_feel_felt_found+ownership_language+emotional_labeling	discard	add_emotional_labeling
18412	5.338	the_feel_felt_found	discard	remove_ownership_language
18413	5.237	the_feel_felt_found+ownership_language	discard	tone_change
18414	5.237	the_feel_felt_found+ownership_language	discard	tone_change
18415	5.138	ownership_language	discard	remove_the_feel_felt_found
18416	5.650	the_feel_felt_found+ownership_language+mirroring	discard	add_mirroring
18417	5.013	the_feel_felt_found+ownership_language+energy_matching	discard	add_energy_matching
18418	5.138	ownership_language	discard	remove_the_feel_felt_found
18419	5.450	the_feel_felt_found+ownership_language	discard	temp_0.95
18420	5.350	the_feel_felt_found+ownership_language	discard	temp_0.65
18421	5.325	the_feel_felt_found+strategic_agreement	discard	swap_ownership_language_for_strategic_agreement
18422	5.312	the_feel_felt_found+ownership_language+energy_matching	discard	add_energy_matching
18423	5.138	the_feel_felt_found+ownership_language	discard	tone_change
18424	5.138	ownership_language	discard	remove_the_feel_felt_found
18425	5.425	the_feel_felt_found+ownership_language+casual_professionalism	discard	add_casual_professionalism
18426	5.525	the_feel_felt_found+concrete_next_steps	discard	swap_ownership_language_for_concrete_next_steps
18427	4.925	the_feel_felt_found+validation_before_solution	discard	swap_ownership_language_for_validation_before_solution
18428	5.237	the_feel_felt_found+ownership_language	discard	tone_change
18429	5.450	the_feel_felt_found+ownership_language+never_say_calm_down	discard	add_never_say_calm_down
18430	5.238	ownership_language	discard	crossover
18431	5.550	the_feel_felt_found+ownership_language+genuine_admission	discard	add_genuine_admission
18432	5.350	the_feel_felt_found	discard	crossover
18433	5.350	the_feel_felt_found+ownership_language	discard	tone_change
18434	5.450	the_feel_felt_found+ownership_language	discard	crossover
18435	5.425	ownership_language+mirroring	discard	swap_the_feel_felt_found_for_mirroring
18436	5.337	the_feel_felt_found+ownership_language	discard	temp_0.90
18437	5.425	the_feel_felt_found+ownership_language	discard	tone_change
18438	5.013	the_feel_felt_found	discard	remove_ownership_language
18439	5.338	ownership_language	discard	remove_the_feel_felt_found
18440	5.037	the_feel_felt_found+ownership_language	discard	tone_change
18441	5.325	the_feel_felt_found+ownership_language	discard	temp_0.85
18442	5.237	the_feel_felt_found+ownership_language	discard	temp_0.95
18443	5.750	the_feel_felt_found+ownership_language+validation_before_solution	discard	add_validation_before_solution
18444	5.350	the_feel_felt_found+ownership_language	discard	tone_change
18445	5.237	the_feel_felt_found+ownership_language	discard	tone_change
18446	5.450	the_feel_felt_found+never_say_calm_down	discard	swap_ownership_language_for_never_say_calm_down
18447	5.237	the_feel_felt_found+concrete_next_steps	discard	swap_ownership_language_for_concrete_next_steps
18448	4.787	ownership_language	discard	remove_the_feel_felt_found
18449	5.112	ownership_language+casual_professionalism	discard	swap_the_feel_felt_found_for_casual_professionalism
18450	5.450	the_feel_felt_found+ownership_language	discard	temp_0.85
18451	5.450	the_feel_felt_found+ownership_language+concrete_next_steps	discard	add_concrete_next_steps
18452	5.425	the_feel_felt_found+never_say_calm_down	discard	swap_ownership_language_for_never_say_calm_down
18453	5.525	the_feel_felt_found+ownership_language	discard	temp_0.65
18454	5.350	ownership_language+proactive_extras	discard	swap_the_feel_felt_found_for_proactive_extras
18455	4.925	the_feel_felt_found+ownership_language	discard	temp_0.70
18456	5.350	the_feel_felt_found+ownership_language	discard	tone_change
18457	4.487	the_feel_felt_found+ownership_language	discard	tone_change
18458	5.200	the_feel_felt_found+ownership_language+energy_matching	discard	add_energy_matching
18459	5.525	the_feel_felt_found+strategic_agreement	discard	swap_ownership_language_for_strategic_agreement
18460	5.550	the_feel_felt_found+ownership_language	discard	crossover
18461	5.213	ownership_language	discard	remove_the_feel_felt_found
18462	5.075	the_feel_felt_found+ownership_language	discard	temp_0.95
18463	5.013	the_feel_felt_found	discard	crossover
18464	5.112	the_feel_felt_found+ownership_language	discard	temp_0.70
18465	5.425	the_feel_felt_found+ownership_language	discard	tone_change
18466	5.213	the_feel_felt_found+ownership_language+never_say_calm_down	discard	add_never_say_calm_down
18467	5.425	the_feel_felt_found+ownership_language+proactive_extras	discard	add_proactive_extras
18468	5.325	ownership_language	discard	remove_the_feel_felt_found
18469	5.550	the_feel_felt_found	discard	crossover
18470	5.550	the_feel_felt_found+validation_before_solution	discard	swap_ownership_language_for_validation_before_solution
18471	4.513	the_feel_felt_found+ownership_language	discard	tone_change
18472	5.013	the_feel_felt_found+strategic_agreement	discard	swap_ownership_language_for_strategic_agreement
18473	5.325	the_feel_felt_found+ownership_language+casual_professionalism	discard	add_casual_professionalism
18474	5.138	ownership_language+validation_before_solution	discard	swap_the_feel_felt_found_for_validation_before_solution
18475	5.450	the_feel_felt_found+ownership_language+personal_touch	discard	add_personal_touch
18476	5.650	the_feel_felt_found+ownership_language+proactive_extras	discard	add_proactive_extras
18477	4.888	the_feel_felt_found	discard	crossover
18478	5.013	the_feel_felt_found+ownership_language	discard	crossover
18479	5.238	the_feel_felt_found+concrete_next_steps	discard	swap_ownership_language_for_concrete_next_steps
18480	5.450	the_feel_felt_found+ownership_language	discard	crossover
18481	5.350	ownership_language+concrete_next_steps	discard	swap_the_feel_felt_found_for_concrete_next_steps
18482	5.238	the_feel_felt_found+ownership_language+proactive_extras	discard	add_proactive_extras
18483	5.112	the_feel_felt_found+ownership_language+proactive_extras	discard	add_proactive_extras
18484	5.013	the_feel_felt_found+ownership_language	discard	crossover
18485	5.425	the_feel_felt_found+ownership_language	discard	temp_0.75
18486	5.525	the_feel_felt_found+ownership_language	discard	tone_change
18487	5.650	the_feel_felt_found+ownership_language+proactive_extras	discard	add_proactive_extras
18488	5.312	the_feel_felt_found+ownership_language	discard	tone_change
18489	5.237	the_feel_felt_found	discard	remove_ownership_language
18490	5.325	the_feel_felt_found+ownership_language+strategic_agreement	discard	add_strategic_agreement
18491	5.350	the_feel_felt_found+ownership_language	discard	crossover
18492	4.925	ownership_language	discard	remove_the_feel_felt_found
18493	5.550	the_feel_felt_found	discard	remove_ownership_language
18494	5.550	the_feel_felt_found+validation_before_solution	discard	swap_ownership_language_for_validation_before_solution
18495	5.112	ownership_language	discard	remove_the_feel_felt_found
18496	4.800	ownership_language	discard	remove_the_feel_felt_found
18497	5.350	the_feel_felt_found+ownership_language	discard	tone_change
18498	5.325	the_feel_felt_found+emotional_labeling	discard	swap_ownership_language_for_emotional_labeling
18499	5.200	the_feel_felt_found+ownership_language	discard	tone_change
