generation	eq_score	techniques	status	description
9463	4.800	the_feel_felt_found+emotional_labeling	discard	swap_ownership_language_for_emotional_labeling
9464	5.013	the_feel_felt_found+ownership_language	discard	crossover
9465	5.013	the_feel_felt_found+ownership_language	discard	temp_0.90
9466	5.300	ownership_language+strategic_agreement	discard	swap_the_feel_felt_found_for_strategic_agreement
9467	5.450	the_feel_felt_found+ownership_language	discard	tone_change
9468	5.237	the_feel_felt_found+ownership_language	discard	temp_0.65
9469	5.525	the_feel_felt_found+ownership_language+validation_before_solution	discard	add_validation_before_solution
9470	5.012	the_feel_felt_found+ownership_language	discard	crossover
9471	5.450	ownership_language+personal_touch	discard	swap_the_feel_felt_found_for_personal_touch
9472	5.100	the_feel_felt_found+ownership_language	discard	temp_0.85
9473	5.450	the_feel_felt_found+ownership_language	discard	tone_change
9474	5.450	the_feel_felt_found+ownership_language	discard	tone_change
9475	5.325	the_feel_felt_found+ownership_language	discard	crossover
9476	5.038	the_feel_felt_found+ownership_language+energy_matching	discard	add_energy_matching
9477	5.112	the_feel_felt_found+ownership_language	discard	tone_change
9478	5.425	the_feel_felt_found+ownership_language	discard	tone_change
9479	5.237	the_feel_felt_found	discard	remove_ownership_language
9480	5.113	the_feel_felt_found+ownership_language+mirroring	discard	add_mirroring
9481	5.138	the_feel_felt_found+ownership_language+genuine_admission	discard	add_genuine_admission
9482	5.550	the_feel_felt_found	discard	remove_ownership_language
9483	5.425	the_feel_felt_found+ownership_language	discard	crossover
9484	5.338	ownership_language+emotional_labeling	discard	swap_the_feel_felt_found_for_emotional_labeling
9485	4.825	the_feel_felt_found+ownership_language	discard	temp_0.90
9486	5.112	ownership_language	discard	crossover
9487	4.912	the_feel_felt_found+ownership_language	discard	tone_change
9488	5.237	the_feel_felt_found+ownership_language	discard	crossover
9489	5.137	ownership_language	discard	remove_the_feel_felt_found
9490	5.237	the_feel_felt_found+proactive_extras	discard	swap_ownership_language_for_proactive_extras
9491	5.450	ownership_language+mirroring	discard	swap_the_feel_felt_found_for_mirroring
9492	4.938	the_feel_felt_found+ownership_language	discard	tone_change
9493	5.550	the_feel_felt_found+ownership_language+concrete_next_steps	discard	add_concrete_next_steps
9494	5.112	the_feel_felt_found+ownership_language+strategic_agreement	discard	add_strategic_agreement
9495	5.450	the_feel_felt_found+ownership_language+warmth_injection	discard	add_warmth_injection
9496	5.138	the_feel_felt_found	discard	remove_ownership_language
9497	5.425	the_feel_felt_found+proactive_extras	discard	swap_ownership_language_for_proactive_extras
9498	4.825	the_feel_felt_found+ownership_language+casual_professionalism	discard	add_casual_professionalism
9499	5.450	ownership_language	discard	remove_the_feel_felt_found
9500	5.213	the_feel_felt_found+ownership_language	discard	tone_change
9501	4.725	the_feel_felt_found+ownership_language	discard	tone_change
9502	5.138	the_feel_felt_found+ownership_language	discard	tone_change
9503	5.450	the_feel_felt_found+energy_matching	discard	swap_ownership_language_for_energy_matching
9504	4.888	the_feel_felt_found+ownership_language	discard	crossover
9505	5.425	the_feel_felt_found+ownership_language+casual_professionalism	discard	add_casual_professionalism
9506	4.912	the_feel_felt_found+ownership_language	discard	crossover
9507	4.888	ownership_language+proactive_extras	discard	swap_the_feel_felt_found_for_proactive_extras
9508	5.112	ownership_language	discard	crossover
9509	5.550	the_feel_felt_found	discard	crossover
9510	5.237	ownership_language	discard	remove_the_feel_felt_found
9511	5.550	the_feel_felt_found+ownership_language	discard	temp_0.65
9512	5.200	the_feel_felt_found+concrete_next_steps	discard	swap_ownership_language_for_concrete_next_steps
9513	5.325	the_feel_felt_found+ownership_language	discard	tone_change
9514	5.138	the_feel_felt_found+ownership_language	discard	tone_change
9515	5.013	the_feel_felt_found+ownership_language+never_say_calm_down	discard	add_never_say_calm_down
9516	5.450	the_feel_felt_found+ownership_language+casual_professionalism	discard	add_casual_professionalism
9517	4.825	ownership_language+never_say_calm_down	discard	swap_the_feel_felt_found_for_never_say_calm_down
9518	5.300	the_feel_felt_found+ownership_language	discard	tone_change
9519	5.138	the_feel_felt_found+mirroring	discard	swap_ownership_language_for_mirroring
9520	5.237	the_feel_felt_found+ownership_language+genuine_admission	discard	add_genuine_admission
9521	4.913	none	discard	crossover
9522	5.237	the_feel_felt_found+ownership_language	discard	tone_change
9523	4.888	the_feel_felt_found+validation_before_solution	discard	swap_ownership_language_for_validation_before_solution
9524	5.337	the_feel_felt_found+ownership_language+energy_matching	discard	add_energy_matching
9525	5.237	the_feel_felt_found+ownership_language	discard	tone_change
9526	5.338	the_feel_felt_found+ownership_language	discard	tone_change
9527	5.525	the_feel_felt_found+ownership_language	discard	temp_0.90
9528	5.225	the_feel_felt_found+ownership_language+mirroring	discard	add_mirroring
9529	4.888	the_feel_felt_found+never_say_calm_down	discard	swap_ownership_language_for_never_say_calm_down
9530	5.013	the_feel_felt_found+ownership_language+concrete_next_steps	discard	add_concrete_next_steps
9531	5.075	the_feel_felt_found+ownership_language	discard	tone_change
9532	5.025	the_feel_felt_found+ownership_language	discard	temp_0.75
9533	5.550	the_feel_felt_found+energy_matching	discard	swap_ownership_language_for_energy_matching
9534	4.700	the_feel_felt_found+ownership_language	discard	tone_change
9535	5.112	the_feel_felt_found+ownership_language+strategic_agreement	discard	add_strategic_agreement
9536	5.125	the_feel_felt_found+ownership_language+validation_before_solution	discard	add_validation_before_solution
9537	5.200	the_feel_felt_found+ownership_language+energy_matching	discard	add_energy_matching
9538	5.238	the_feel_felt_found	discard	crossover
9539	5.650	ownership_language+validation_before_solution	discard	swap_the_feel_felt_found_for_validation_before_solution
9540	5.650	the_feel_felt_found	discard	crossover
9541	4.825	the_feel_felt_found+ownership_language	discard	temp_0.85
9542	5.325	the_feel_felt_found+ownership_language	discard	crossover
9543	5.237	the_feel_felt_found+ownership_language	discard	temp_0.90
9544	5.650	the_feel_felt_found+ownership_language	discard	tone_change
9545	5.325	the_feel_felt_found+ownership_language	discard	tone_change
9546	5.425	the_feel_felt_found+ownership_language	discard	tone_change
9547	5.238	the_feel_felt_found	discard	crossover
9548	5.237	the_feel_felt_found+ownership_language+personal_touch	discard	add_personal_touch
9549	5.138	none	discard	crossover
9550	4.825	the_feel_felt_found+ownership_language+energy_matching	discard	add_energy_matching
9551	5.550	the_feel_felt_found+ownership_language	discard	temp_0.70
9552	5.550	the_feel_felt_found+ownership_language	discard	crossover
9553	5.138	the_feel_felt_found	discard	crossover
9554	5.325	the_feel_felt_found+ownership_language+validation_before_solution	discard	add_validation_before_solution
9555	4.788	the_feel_felt_found+ownership_language	discard	tone_change
9556	5.013	the_feel_felt_found+ownership_language+genuine_admission	discard	add_genuine_admission
9557	5.225	ownership_language	discard	crossover
9558	5.112	the_feel_felt_found+concrete_next_steps	discard	swap_ownership_language_for_concrete_next_steps
9559	4.888	the_feel_felt_found+ownership_language	discard	temp_0.90
9560	5.325	the_feel_felt_found	discard	crossover
9561	5.213	the_feel_felt_found+ownership_language	discard	tone_change
9562	5.550	the_feel_felt_found+ownership_language	discard	temp_0.75
9563	5.450	the_feel_felt_found+ownership_language	discard	tone_change
9564	5.237	the_feel_felt_found+ownership_language	discard	crossover
9565	5.325	ownership_language+validation_before_solution	discard	swap_the_feel_felt_found_for_validation_before_solution
9566	4.925	the_feel_felt_found+ownership_language	discard	tone_change
9567	5.137	the_feel_felt_found+ownership_language	discard	tone_change
9568	4.888	the_feel_felt_found+ownership_language	discard	tone_change
9569	5.650	ownership_language	discard	crossover
9570	5.112	the_feel_felt_found+ownership_language	discard	temp_0.85
9571	5.650	ownership_language+energy_matching	discard	swap_the_feel_felt_found_for_energy_matching
9572	4.700	the_feel_felt_found+casual_professionalism	discard	swap_ownership_language_for_casual_professionalism
9573	5.338	ownership_language+validation_before_solution	discard	swap_the_feel_felt_found_for_validation_before_solution
9574	5.200	the_feel_felt_found+concrete_next_steps	discard	swap_ownership_language_for_concrete_next_steps
9575	5.300	the_feel_felt_found+ownership_language	discard	crossover
9576	5.237	ownership_language	discard	remove_the_feel_felt_found
9577	4.888	the_feel_felt_found+ownership_language	discard	temp_0.95
9578	5.450	the_feel_felt_found+validation_before_solution	discard	swap_ownership_language_for_validation_before_solution
9579	5.325	ownership_language	discard	crossover
9580	5.425	the_feel_felt_found+ownership_language	discard	tone_change
9581	5.025	ownership_language	discard	crossover
9582	4.487	the_feel_felt_found+ownership_language+validation_before_solution	discard	add_validation_before_solution
9583	5.138	the_feel_felt_found+emotional_labeling	discard	swap_ownership_language_for_emotional_labeling
9584	5.138	the_feel_felt_found+warmth_injection	discard	swap_ownership_language_for_warmth_injection
9585	5.425	the_feel_felt_found+ownership_language+genuine_admission	discard	add_genuine_admission
9586	5.450	the_feel_felt_found+ownership_language+personal_touch	discard	add_personal_touch
9587	5.325	the_feel_felt_found+ownership_language+personal_touch	discard	add_personal_touch
9588	5.450	the_feel_felt_found+ownership_language	discard	tone_change
9589	5.075	ownership_language+energy_matching	discard	swap_the_feel_felt_found_for_energy_matching
9590	5.337	ownership_language	discard	crossover
9591	5.013	the_feel_felt_found+warmth_injection	discard	swap_ownership_language_for_warmth_injection
9592	5.450	the_feel_felt_found+ownership_language+energy_matching	discard	add_energy_matching
9593	5.425	the_feel_felt_found+energy_matching	discard	swap_ownership_language_for_energy_matching
9594	5.325	the_feel_felt_found+ownership_language+proactive_extras	discard	add_proactive_extras
9595	5.037	the_feel_felt_found+ownership_language+validation_before_solution	discard	add_validation_before_solution
9596	5.138	the_feel_felt_found+ownership_language+warmth_injection	discard	add_warmth_injection
9597	5.138	the_feel_felt_found+ownership_language+genuine_admission	discard	add_genuine_admission
9598	4.825	the_feel_felt_found+ownership_language	discard	tone_change
9599	5.138	the_feel_felt_found+ownership_language	discard	crossover
9600	5.138	the_feel_felt_found+ownership_language	discard	crossover
9601	5.425	ownership_language+proactive_extras	discard	swap_the_feel_felt_found_for_proactive_extras
9602	5.325	the_feel_felt_found+ownership_language+personal_touch	discard	add_personal_touch
9603	5.325	ownership_language	discard	crossover
9604	5.450	the_feel_felt_found+ownership_language	discard	temp_0.85
9605	5.550	the_feel_felt_found+ownership_language	discard	tone_change
9606	5.138	ownership_language+validation_before_solution	discard	swap_the_feel_felt_found_for_validation_before_solution
9607	5.237	ownership_language	discard	crossover
9608	5.550	the_feel_felt_found+ownership_language	discard	crossover
9609	5.238	none	discard	crossover
9610	5.138	the_feel_felt_found	discard	crossover
9611	4.987	the_feel_felt_found+warmth_injection	discard	swap_ownership_language_for_warmth_injection
9612	4.800	the_feel_felt_found+ownership_language+emotional_labeling	discard	add_emotional_labeling
9613	4.925	the_feel_felt_found+ownership_language	discard	tone_change
9614	5.425	the_feel_felt_found+ownership_language+proactive_extras	discard	add_proactive_extras
9615	5.237	the_feel_felt_found+ownership_language	discard	crossover
9616	5.550	the_feel_felt_found+ownership_language	discard	crossover
9617	5.113	the_feel_felt_found+ownership_language	discard	temp_0.95
9618	5.338	the_feel_felt_found+ownership_language	discard	tone_change
9619	5.037	the_feel_felt_found+ownership_language+energy_matching	discard	add_energy_matching
9620	4.600	the_feel_felt_found+emotional_labeling	discard	swap_ownership_language_for_emotional_labeling
9621	5.088	ownership_language+mirroring	discard	swap_the_feel_felt_found_for_mirroring
9622	5.550	the_feel_felt_found+ownership_language+genuine_admission	discard	add_genuine_admission
9623	5.013	the_feel_felt_found+ownership_language	discard	temp_0.70
9624	5.237	the_feel_felt_found+ownership_language	discard	crossover
9625	5.013	the_feel_felt_found+ownership_language	discard	temp_0.90
9626	5.200	the_feel_felt_found	discard	crossover
9627	5.550	the_feel_felt_found+ownership_language	discard	temp_0.90
9628	5.125	the_feel_felt_found+ownership_language+genuine_admission	discard	add_genuine_admission
9629	5.138	the_feel_felt_found+ownership_language+strategic_agreement	discard	add_strategic_agreement
9630	5.138	the_feel_felt_found+ownership_language	discard	temp_0.85
9631	5.325	none	discard	crossover
9632	5.138	the_feel_felt_found+casual_professionalism	discard	swap_ownership_language_for_casual_professionalism
9633	5.013	the_feel_felt_found+ownership_language	discard	tone_change
9634	5.650	ownership_language+strategic_agreement	discard	swap_the_feel_felt_found_for_strategic_agreement
9635	5.013	the_feel_felt_found+ownership_language	discard	tone_change
9636	5.425	the_feel_felt_found+warmth_injection	discard	swap_ownership_language_for_warmth_injection
9637	5.238	the_feel_felt_found+ownership_language	discard	tone_change
9638	5.300	the_feel_felt_found	discard	crossover
9639	5.100	ownership_language+energy_matching	discard	swap_the_feel_felt_found_for_energy_matching
9640	5.450	the_feel_felt_found+ownership_language+validation_before_solution	discard	add_validation_before_solution
9641	4.925	the_feel_felt_found+ownership_language+never_say_calm_down	discard	add_never_say_calm_down
9642	5.138	the_feel_felt_found+ownership_language	discard	crossover
9643	4.800	the_feel_felt_found+validation_before_solution	discard	swap_ownership_language_for_validation_before_solution
9644	5.450	the_feel_felt_found+ownership_language+warmth_injection	discard	add_warmth_injection
9645	5.112	none	discard	crossover
9646	5.200	the_feel_felt_found+ownership_language	discard	tone_change
9647	5.325	the_feel_felt_found	discard	remove_ownership_language
9648	5.138	ownership_language+never_say_calm_down	discard	swap_the_feel_felt_found_for_never_say_calm_down
9649	5.550	the_feel_felt_found+ownership_language	discard	tone_change
9650	4.612	ownership_language	discard	remove_the_feel_felt_found
9651	5.237	the_feel_felt_found+ownership_language+genuine_admission	discard	add_genuine_admission
9652	5.425	the_feel_felt_found+ownership_language	discard	tone_change
9653	4.888	the_feel_felt_found+ownership_language	discard	temp_0.90
9654	5.025	the_feel_felt_found+ownership_language+concrete_next_steps	discard	add_concrete_next_steps
9655	5.425	the_feel_felt_found+emotional_labeling	discard	swap_ownership_language_for_emotional_labeling
9656	5.425	the_feel_felt_found+ownership_language	discard	tone_change
9657	5.325	the_feel_felt_found+ownership_language+validation_before_solution	discard	add_validation_before_solution
9658	5.325	the_feel_felt_found+proactive_extras	discard	swap_ownership_language_for_proactive_extras
9659	5.325	ownership_language	discard	crossover
9660	5.237	the_feel_felt_found+ownership_language	discard	tone_change
9661	5.450	ownership_language	discard	crossover
9662	5.450	the_feel_felt_found+proactive_extras	discard	swap_ownership_language_for_proactive_extras
9663	5.138	the_feel_felt_found+ownership_language+emotional_labeling	discard	add_emotional_labeling
9664	5.237	the_feel_felt_found+ownership_language+warmth_injection	discard	add_warmth_injection
9665	5.338	the_feel_felt_found+ownership_language	discard	temp_0.95
9666	4.675	the_feel_felt_found	discard	crossover
9667	5.650	the_feel_felt_found+ownership_language	discard	tone_change
9668	5.138	the_feel_felt_found+ownership_language	discard	temp_0.85
9669	5.013	the_feel_felt_found	discard	crossover
9670	5.425	the_feel_felt_found+ownership_language	discard	tone_change
9671	5.013	ownership_language+genuine_admission	discard	swap_the_feel_felt_found_for_genuine_admission
9672	5.037	the_feel_felt_found+ownership_language+energy_matching	discard	add_energy_matching
9673	5.037	the_feel_felt_found+ownership_language+proactive_extras	discard	add_proactive_extras
9674	4.912	the_feel_felt_found+ownership_language	discard	temp_0.65
9675	4.925	the_feel_felt_found+ownership_language+warmth_injection	discard	add_warmth_injection
9676	5.425	ownership_language	discard	remove_the_feel_felt_found
9677	5.112	the_feel_felt_found+ownership_language+casual_professionalism	discard	add_casual_professionalism
9678	5.138	the_feel_felt_found+ownership_language	discard	temp_0.95
9679	5.550	the_feel_felt_found+ownership_language	discard	tone_change
9680	5.425	ownership_language	discard	crossover
9681	5.325	ownership_language	discard	crossover
9682	5.013	the_feel_felt_found+ownership_language	discard	tone_change
9683	5.237	the_feel_felt_found+ownership_language+never_say_calm_down	discard	add_never_say_calm_down
9684	5.325	the_feel_felt_found+ownership_language	discard	tone_change
9685	5.138	the_feel_felt_found+ownership_language	discard	temp_0.85
9686	5.450	the_feel_felt_found+ownership_language	discard	crossover
9687	5.138	the_feel_felt_found+proactive_extras	discard	swap_ownership_language_for_proactive_extras
9688	5.450	the_feel_felt_found+ownership_language	discard	temp_0.75
9689	4.912	the_feel_felt_found+ownership_language	discard	tone_change
9690	5.450	the_feel_felt_found	discard	remove_ownership_language
9691	5.450	ownership_language+casual_professionalism	discard	swap_the_feel_felt_found_for_casual_professionalism
9692	5.650	the_feel_felt_found+ownership_language	discard	temp_0.85
9693	4.888	the_feel_felt_found+ownership_language	discard	tone_change
9694	5.112	the_feel_felt_found+ownership_language	discard	crossover
9695	4.888	the_feel_felt_found+ownership_language	discard	tone_change
9696	4.913	the_feel_felt_found+ownership_language	discard	tone_change
9697	5.338	ownership_language+proactive_extras	discard	swap_the_feel_felt_found_for_proactive_extras
9698	5.237	the_feel_felt_found+ownership_language	discard	tone_change
9699	5.013	ownership_language+energy_matching	discard	swap_the_feel_felt_found_for_energy_matching
9700	5.013	the_feel_felt_found+ownership_language	discard	temp_0.90
9701	5.238	the_feel_felt_found+ownership_language	discard	crossover
9702	5.112	the_feel_felt_found+ownership_language+mirroring	discard	add_mirroring
9703	5.750	the_feel_felt_found+ownership_language	discard	tone_change
9704	5.450	the_feel_felt_found+personal_touch	discard	swap_ownership_language_for_personal_touch
9705	5.237	the_feel_felt_found+ownership_language+proactive_extras	discard	add_proactive_extras
9706	5.550	the_feel_felt_found+ownership_language+mirroring	discard	add_mirroring
9707	5.237	the_feel_felt_found+ownership_language	discard	crossover
9708	5.237	the_feel_felt_found+ownership_language+validation_before_solution	discard	add_validation_before_solution
9709	4.888	the_feel_felt_found+ownership_language	discard	tone_change
9710	5.338	the_feel_felt_found+ownership_language	discard	tone_change
9711	5.237	the_feel_felt_found+ownership_language+proactive_extras	discard	add_proactive_extras
9712	5.425	the_feel_felt_found+ownership_language	discard	tone_change
9713	5.112	the_feel_felt_found+ownership_language+proactive_extras	discard	add_proactive_extras
9714	5.425	ownership_language+concrete_next_steps	discard	swap_the_feel_felt_found_for_concrete_next_steps
9715	5.550	ownership_language+concrete_next_steps	discard	swap_the_feel_felt_found_for_concrete_next_steps
9716	5.550	none	discard	crossover
9717	5.113	the_feel_felt_found+casual_professionalism	discard	swap_ownership_language_for_casual_professionalism
9718	5.013	the_feel_felt_found+ownership_language	discard	tone_change
9719	4.925	the_feel_felt_found+ownership_language	discard	tone_change
9720	5.112	the_feel_felt_found+ownership_language	discard	crossover
9721	5.225	the_feel_felt_found+ownership_language+genuine_admission	discard	add_genuine_admission
9722	5.325	the_feel_felt_found	discard	remove_ownership_language
9723	5.325	the_feel_felt_found+ownership_language	discard	tone_change
9724	4.825	the_feel_felt_found	discard	crossover
9725	5.300	the_feel_felt_found+warmth_injection	discard	swap_ownership_language_for_warmth_injection
9726	5.450	the_feel_felt_found+ownership_language	discard	tone_change
9727	4.825	ownership_language	discard	remove_the_feel_felt_found
9728	5.450	ownership_language+never_say_calm_down	discard	swap_the_feel_felt_found_for_never_say_calm_down
9729	5.550	the_feel_felt_found+ownership_language	discard	tone_change
9730	5.450	the_feel_felt_found+validation_before_solution	discard	swap_ownership_language_for_validation_before_solution
9731	5.550	the_feel_felt_found+ownership_language	discard	temp_0.95
9732	5.550	the_feel_felt_found+ownership_language+concrete_next_steps	discard	add_concrete_next_steps
9733	5.550	the_feel_felt_found+genuine_admission	discard	swap_ownership_language_for_genuine_admission
9734	5.075	the_feel_felt_found+ownership_language	discard	tone_change
9735	5.350	the_feel_felt_found+strategic_agreement	discard	swap_ownership_language_for_strategic_agreement
