generation	eq_score	techniques	status	description
1977	5.650	the_feel_felt_found+ownership_language	discard	tone_change
1978	5.237	the_feel_felt_found+ownership_language	discard	temp_0.90
1979	5.450	the_feel_felt_found+ownership_language+casual_professionalism	discard	add_casual_professionalism
1980	5.450	the_feel_felt_found+ownership_language	discard	tone_change
1981	5.650	the_feel_felt_found+ownership_language+concrete_next_steps	discard	add_concrete_next_steps
1982	5.425	the_feel_felt_found+ownership_language+genuine_admission	discard	add_genuine_admission
1983	5.350	ownership_language+genuine_admission	discard	swap_the_feel_felt_found_for_genuine_admission
1984	5.450	the_feel_felt_found+ownership_language+energy_matching	discard	add_energy_matching
1985	5.450	ownership_language+never_say_calm_down	discard	swap_the_feel_felt_found_for_never_say_calm_down
1986	4.612	the_feel_felt_found+ownership_language+strategic_agreement	discard	add_strategic_agreement
1987	5.550	the_feel_felt_found+ownership_language	discard	temp_0.70
1988	5.338	the_feel_felt_found+ownership_language+strategic_agreement	discard	add_strategic_agreement
1989	5.425	the_feel_felt_found+ownership_language	discard	tone_change
1990	5.025	the_feel_felt_found+ownership_language	discard	tone_change
1991	5.237	the_feel_felt_found+ownership_language	discard	tone_change
1992	5.013	ownership_language	discard	crossover
1993	5.013	none	discard	crossover
1994	5.238	the_feel_felt_found+ownership_language+genuine_admission	discard	add_genuine_admission
1995	4.787	the_feel_felt_found+ownership_language	discard	tone_change
1996	5.325	the_feel_felt_found+ownership_language	discard	tone_change
1997	5.138	ownership_language+genuine_admission	discard	swap_the_feel_felt_found_for_genuine_admission
1998	4.925	the_feel_felt_found+ownership_language+casual_professionalism	discard	add_casual_professionalism
1999	5.037	the_feel_felt_found+ownership_language	discard	tone_change
2000	5.237	the_feel_felt_found+ownership_language	discard	temp_0.70
2001	5.112	the_feel_felt_found+ownership_language	discard	tone_change
2002	5.037	the_feel_felt_found+ownership_language+validation_before_solution	discard	add_validation_before_solution
2003	5.325	the_feel_felt_found+ownership_language	discard	crossover
2004	5.425	the_feel_felt_found	discard	remove_ownership_language
2005	5.425	the_feel_felt_found+ownership_language+concrete_next_steps	discard	add_concrete_next_steps
2006	4.988	ownership_language	discard	remove_the_feel_felt_found
2007	5.325	ownership_language	discard	crossover
2008	5.200	ownership_language+energy_matching	discard	swap_the_feel_felt_found_for_energy_matching
2009	5.338	the_feel_felt_found+ownership_language+casual_professionalism	discard	add_casual_professionalism
2010	4.825	the_feel_felt_found+ownership_language	discard	tone_change
2011	5.450	none	discard	crossover
2012	5.450	ownership_language	discard	remove_the_feel_felt_found
2013	5.225	ownership_language	discard	remove_the_feel_felt_found
2014	5.237	the_feel_felt_found+ownership_language	discard	crossover
2015	4.800	the_feel_felt_found+ownership_language	discard	tone_change
2016	5.325	ownership_language	discard	remove_the_feel_felt_found
2017	5.025	the_feel_felt_found+ownership_language	discard	temp_0.95
2018	5.238	the_feel_felt_found+ownership_language+strategic_agreement	discard	add_strategic_agreement
2019	5.113	the_feel_felt_found+ownership_language	discard	tone_change
2020	5.550	the_feel_felt_found+ownership_language+validation_before_solution	discard	add_validation_before_solution
2021	5.012	the_feel_felt_found+ownership_language	discard	tone_change
2022	5.137	the_feel_felt_found+ownership_language	discard	crossover
2023	5.425	the_feel_felt_found	discard	remove_ownership_language
2024	5.138	the_feel_felt_found+ownership_language+energy_matching	discard	add_energy_matching
2025	5.138	the_feel_felt_found+ownership_language	discard	crossover
2026	5.200	the_feel_felt_found+ownership_language	discard	tone_change
2027	5.650	the_feel_felt_found+ownership_language+casual_professionalism	discard	add_casual_professionalism
2028	5.025	the_feel_felt_found+ownership_language+mirroring	discard	add_mirroring
2029	5.550	the_feel_felt_found+ownership_language	discard	tone_change
2030	5.650	the_feel_felt_found+ownership_language	discard	temp_0.85
2031	5.138	the_feel_felt_found+ownership_language	discard	tone_change
2032	5.200	the_feel_felt_found	discard	crossover
2033	5.112	the_feel_felt_found+ownership_language	discard	crossover
2034	5.450	the_feel_felt_found	discard	remove_ownership_language
2035	5.350	the_feel_felt_found+proactive_extras	discard	swap_ownership_language_for_proactive_extras
2036	5.350	the_feel_felt_found+ownership_language+mirroring	discard	add_mirroring
2037	4.588	the_feel_felt_found+ownership_language+personal_touch	discard	add_personal_touch
2038	4.613	the_feel_felt_found+ownership_language	discard	crossover
2039	5.238	the_feel_felt_found+ownership_language	discard	crossover
2040	5.450	ownership_language+genuine_admission	discard	swap_the_feel_felt_found_for_genuine_admission
2041	5.325	the_feel_felt_found+ownership_language	discard	tone_change
2042	5.138	the_feel_felt_found+ownership_language	discard	tone_change
2043	5.013	the_feel_felt_found	discard	crossover
2044	5.450	the_feel_felt_found+ownership_language+proactive_extras	discard	add_proactive_extras
2045	5.450	the_feel_felt_found+ownership_language	discard	temp_0.65
2046	5.112	the_feel_felt_found+ownership_language+concrete_next_steps	discard	add_concrete_next_steps
2047	5.013	the_feel_felt_found+validation_before_solution	discard	swap_ownership_language_for_validation_before_solution
2048	5.325	the_feel_felt_found+ownership_language+strategic_agreement	discard	add_strategic_agreement
2049	5.325	the_feel_felt_found+genuine_admission	discard	swap_ownership_language_for_genuine_admission
2050	5.325	the_feel_felt_found+ownership_language	discard	temp_0.85
2051	4.825	the_feel_felt_found+never_say_calm_down	discard	swap_ownership_language_for_never_say_calm_down
2052	5.338	the_feel_felt_found+ownership_language	discard	tone_change
2053	5.213	the_feel_felt_found	discard	crossover
2054	5.450	none	discard	crossover
2055	5.325	the_feel_felt_found+ownership_language+emotional_labeling	discard	add_emotional_labeling
2056	5.112	the_feel_felt_found	discard	crossover
2057	4.825	the_feel_felt_found+ownership_language	discard	temp_0.75
2058	5.450	ownership_language	discard	remove_the_feel_felt_found
2059	5.200	the_feel_felt_found+ownership_language+warmth_injection	discard	add_warmth_injection
2060	5.113	the_feel_felt_found+ownership_language	discard	tone_change
2061	4.888	the_feel_felt_found+strategic_agreement	discard	swap_ownership_language_for_strategic_agreement
2062	5.350	ownership_language	discard	remove_the_feel_felt_found
2063	5.650	the_feel_felt_found+ownership_language	discard	temp_0.90
2064	5.450	ownership_language+genuine_admission	discard	swap_the_feel_felt_found_for_genuine_admission
2065	4.925	the_feel_felt_found+ownership_language	discard	temp_0.75
2066	5.550	the_feel_felt_found+ownership_language	discard	tone_change
2067	5.550	the_feel_felt_found+ownership_language	discard	crossover
2068	5.238	the_feel_felt_found+ownership_language	discard	temp_0.95
2069	5.425	ownership_language+personal_touch	discard	swap_the_feel_felt_found_for_personal_touch
2070	5.450	the_feel_felt_found+energy_matching	discard	swap_ownership_language_for_energy_matching
2071	5.138	the_feel_felt_found+ownership_language+personal_touch	discard	add_personal_touch
2072	5.450	ownership_language+casual_professionalism	discard	swap_the_feel_felt_found_for_casual_professionalism
2073	5.138	the_feel_felt_found+ownership_language	discard	crossover
2074	4.800	the_feel_felt_found+ownership_language	discard	tone_change
2075	4.925	the_feel_felt_found+strategic_agreement	discard	swap_ownership_language_for_strategic_agreement
2076	5.013	the_feel_felt_found+ownership_language+never_say_calm_down	discard	add_never_say_calm_down
2077	5.113	ownership_language+concrete_next_steps	discard	swap_the_feel_felt_found_for_concrete_next_steps
2078	5.450	the_feel_felt_found	discard	crossover
2079	5.237	the_feel_felt_found+ownership_language	discard	crossover
2080	5.450	the_feel_felt_found	discard	remove_ownership_language
2081	5.137	the_feel_felt_found	discard	crossover
2082	5.037	the_feel_felt_found+ownership_language	discard	tone_change
2083	5.450	ownership_language+validation_before_solution	discard	swap_the_feel_felt_found_for_validation_before_solution
2084	5.138	the_feel_felt_found+ownership_language	discard	temp_0.70
2085	5.425	the_feel_felt_found+ownership_language	discard	tone_change
2086	4.825	the_feel_felt_found+ownership_language+personal_touch	discard	add_personal_touch
2087	4.700	the_feel_felt_found+ownership_language+warmth_injection	discard	add_warmth_injection
2088	5.650	the_feel_felt_found+ownership_language	discard	temp_0.65
2089	5.550	the_feel_felt_found+ownership_language	discard	temp_0.90
2090	4.800	the_feel_felt_found+ownership_language	discard	crossover
2091	5.138	the_feel_felt_found+ownership_language	discard	tone_change
2092	5.450	the_feel_felt_found+genuine_admission	discard	swap_ownership_language_for_genuine_admission
2093	5.112	the_feel_felt_found+ownership_language	discard	temp_0.70
2094	5.113	the_feel_felt_found+ownership_language	discard	crossover
2095	5.338	the_feel_felt_found+ownership_language	discard	crossover
2096	5.013	the_feel_felt_found+ownership_language	discard	crossover
2097	5.550	the_feel_felt_found	discard	remove_ownership_language
2098	5.237	the_feel_felt_found+ownership_language	discard	temp_0.90
2099	4.925	the_feel_felt_found+ownership_language	discard	temp_0.65
2100	4.825	the_feel_felt_found+ownership_language	discard	tone_change
2101	5.137	the_feel_felt_found+energy_matching	discard	swap_ownership_language_for_energy_matching
2102	5.325	the_feel_felt_found	discard	remove_ownership_language
2103	5.012	the_feel_felt_found+ownership_language	discard	tone_change
2104	5.450	ownership_language+casual_professionalism	discard	swap_the_feel_felt_found_for_casual_professionalism
2105	4.800	the_feel_felt_found+ownership_language	discard	crossover
2106	5.450	the_feel_felt_found+ownership_language	discard	crossover
2107	5.550	the_feel_felt_found+ownership_language+warmth_injection	discard	add_warmth_injection
2108	5.138	ownership_language+personal_touch	discard	swap_the_feel_felt_found_for_personal_touch
2109	4.800	the_feel_felt_found+ownership_language	discard	tone_change
2110	5.550	ownership_language	discard	remove_the_feel_felt_found
2111	5.350	the_feel_felt_found	discard	remove_ownership_language
2112	5.138	the_feel_felt_found+ownership_language	discard	tone_change
2113	5.237	the_feel_felt_found+ownership_language	discard	tone_change
2114	5.550	the_feel_felt_found+ownership_language+emotional_labeling	discard	add_emotional_labeling
2115	5.325	the_feel_felt_found+ownership_language	discard	tone_change
2116	5.350	none	discard	crossover
2117	4.825	the_feel_felt_found+ownership_language+strategic_agreement	discard	add_strategic_agreement
2118	5.237	the_feel_felt_found+ownership_language	discard	tone_change
2119	5.337	the_feel_felt_found+ownership_language	discard	tone_change
2120	5.138	ownership_language	discard	crossover
2121	5.200	the_feel_felt_found	discard	remove_ownership_language
2122	5.425	ownership_language	discard	remove_the_feel_felt_found
2123	5.450	the_feel_felt_found+ownership_language	discard	tone_change
2124	4.513	the_feel_felt_found+ownership_language	discard	crossover
2125	5.300	the_feel_felt_found+ownership_language	discard	crossover
2126	5.013	the_feel_felt_found+ownership_language+warmth_injection	discard	add_warmth_injection
2127	4.888	the_feel_felt_found+ownership_language	discard	temp_0.70
2128	5.425	the_feel_felt_found+strategic_agreement	discard	swap_ownership_language_for_strategic_agreement
2129	5.225	none	discard	crossover
2130	5.425	the_feel_felt_found+ownership_language	discard	crossover
2131	5.237	the_feel_felt_found	discard	crossover
2132	5.650	ownership_language	discard	remove_the_feel_felt_found
2133	5.450	the_feel_felt_found+ownership_language	discard	tone_change
2134	5.325	the_feel_felt_found+never_say_calm_down	discard	swap_ownership_language_for_never_say_calm_down
2135	5.013	ownership_language+warmth_injection	discard	swap_the_feel_felt_found_for_warmth_injection
2136	4.487	the_feel_felt_found+ownership_language+warmth_injection	discard	add_warmth_injection
2137	5.013	the_feel_felt_found+casual_professionalism	discard	swap_ownership_language_for_casual_professionalism
2138	5.350	the_feel_felt_found+ownership_language+personal_touch	discard	add_personal_touch
2139	5.350	the_feel_felt_found	discard	remove_ownership_language
2140	5.550	ownership_language	discard	crossover
2141	4.925	the_feel_felt_found+ownership_language	discard	tone_change
2142	5.350	the_feel_felt_found+ownership_language	discard	tone_change
2143	5.138	the_feel_felt_found	discard	remove_ownership_language
2144	5.100	the_feel_felt_found+ownership_language	discard	tone_change
2145	5.013	the_feel_felt_found+ownership_language+never_say_calm_down	discard	add_never_say_calm_down
2146	5.550	the_feel_felt_found+ownership_language	discard	tone_change
2147	5.213	the_feel_felt_found+ownership_language+genuine_admission	discard	add_genuine_admission
2148	5.237	the_feel_felt_found+ownership_language	discard	tone_change
2149	5.450	the_feel_felt_found+energy_matching	discard	swap_ownership_language_for_energy_matching
2150	5.550	the_feel_felt_found+ownership_language+validation_before_solution	discard	add_validation_before_solution
2151	5.550	the_feel_felt_found+ownership_language+mirroring	discard	add_mirroring
2152	5.237	the_feel_felt_found+ownership_language	discard	temp_0.70
2153	5.138	the_feel_felt_found+ownership_language	discard	temp_0.85
2154	5.550	the_feel_felt_found+ownership_language	discard	tone_change
2155	5.450	the_feel_felt_found+ownership_language	discard	tone_change
2156	5.550	the_feel_felt_found+ownership_language	discard	tone_change
2157	4.800	the_feel_felt_found+ownership_language	discard	temp_0.75
2158	5.450	the_feel_felt_found+ownership_language	discard	tone_change
2159	4.825	ownership_language+casual_professionalism	discard	swap_the_feel_felt_found_for_casual_professionalism
2160	5.237	ownership_language	discard	crossover
2161	5.450	the_feel_felt_found+ownership_language+proactive_extras	discard	add_proactive_extras
2162	5.237	ownership_language	discard	crossover
2163	4.900	ownership_language	discard	crossover
2164	5.238	the_feel_felt_found	discard	crossover
2165	5.325	the_feel_felt_found	discard	remove_ownership_language
2166	5.112	the_feel_felt_found+ownership_language	discard	tone_change
2167	5.325	the_feel_felt_found+ownership_language	discard	temp_0.75
2168	4.825	the_feel_felt_found+ownership_language+concrete_next_steps	discard	add_concrete_next_steps
2169	5.200	the_feel_felt_found+ownership_language	discard	crossover
2170	4.925	the_feel_felt_found+ownership_language	discard	tone_change
2171	5.550	the_feel_felt_found+proactive_extras	discard	swap_ownership_language_for_proactive_extras
2172	5.550	the_feel_felt_found	discard	remove_ownership_language
2173	5.200	the_feel_felt_found+proactive_extras	discard	swap_ownership_language_for_proactive_extras
2174	5.013	the_feel_felt_found+ownership_language	discard	crossover
2175	5.325	the_feel_felt_found+personal_touch	discard	swap_ownership_language_for_personal_touch
2176	5.325	the_feel_felt_found	discard	crossover
2177	5.525	the_feel_felt_found+ownership_language	discard	crossover
2178	5.450	the_feel_felt_found+ownership_language	discard	crossover
2179	5.013	the_feel_felt_found+ownership_language+personal_touch	discard	add_personal_touch
2180	4.913	the_feel_felt_found+warmth_injection	discard	swap_ownership_language_for_warmth_injection
2181	5.013	the_feel_felt_found+ownership_language	discard	crossover
2182	4.925	the_feel_felt_found+ownership_language	discard	tone_change
2183	4.725	the_feel_felt_found+ownership_language+never_say_calm_down	discard	add_never_say_calm_down
2184	5.237	the_feel_felt_found+ownership_language+proactive_extras	discard	add_proactive_extras
2185	5.450	the_feel_felt_found+ownership_language+emotional_labeling	discard	add_emotional_labeling
2186	5.325	the_feel_felt_found+ownership_language	discard	crossover
2187	4.825	the_feel_felt_found+ownership_language+casual_professionalism	discard	add_casual_professionalism
2188	5.650	the_feel_felt_found+ownership_language	discard	tone_change
2189	4.900	the_feel_felt_found+ownership_language	discard	tone_change
2190	4.925	the_feel_felt_found+ownership_language	discard	temp_0.65
2191	5.550	the_feel_felt_found+ownership_language	discard	temp_0.65
2192	5.237	the_feel_felt_found+ownership_language	discard	tone_change
2193	4.700	the_feel_felt_found	discard	remove_ownership_language
2194	5.138	the_feel_felt_found	discard	crossover
2195	5.013	the_feel_felt_found	discard	remove_ownership_language
2196	5.325	the_feel_felt_found+ownership_language+never_say_calm_down	discard	add_never_say_calm_down
2197	5.550	the_feel_felt_found+mirroring	discard	swap_ownership_language_for_mirroring
2198	5.075	the_feel_felt_found+ownership_language	discard	crossover
2199	5.200	the_feel_felt_found+ownership_language+personal_touch	discard	add_personal_touch
2200	4.925	the_feel_felt_found	discard	crossover
2201	5.450	the_feel_felt_found+ownership_language+energy_matching	discard	add_energy_matching
2202	5.550	the_feel_felt_found+ownership_language	discard	temp_0.90
2203	5.450	the_feel_felt_found+ownership_language	discard	temp_0.85
2204	5.425	the_feel_felt_found+ownership_language	discard	temp_0.95
2205	5.450	the_feel_felt_found+ownership_language+proactive_extras	discard	add_proactive_extras
2206	5.337	the_feel_felt_found+ownership_language	discard	crossover
2207	5.450	the_feel_felt_found+ownership_language	discard	tone_change
2208	5.325	the_feel_felt_found+ownership_language	discard	crossover
2209	5.525	the_feel_felt_found+ownership_language+genuine_admission	discard	add_genuine_admission
2210	5.237	the_feel_felt_found+ownership_language+casual_professionalism	discard	add_casual_professionalism
2211	5.650	ownership_language	discard	remove_the_feel_felt_found
2212	5.450	ownership_language	discard	crossover
2213	5.237	the_feel_felt_found+ownership_language	discard	tone_change
2214	4.925	the_feel_felt_found+ownership_language+concrete_next_steps	discard	add_concrete_next_steps
2215	5.113	the_feel_felt_found+validation_before_solution	discard	swap_ownership_language_for_validation_before_solution
2216	5.550	the_feel_felt_found+ownership_language+emotional_labeling	discard	add_emotional_labeling
2217	5.525	the_feel_felt_found+ownership_language	discard	tone_change
2218	5.237	the_feel_felt_found	discard	remove_ownership_language
2219	5.237	the_feel_felt_found	discard	crossover
2220	5.450	the_feel_felt_found+ownership_language	discard	crossover
2221	5.225	the_feel_felt_found+ownership_language+genuine_admission	discard	add_genuine_admission
2222	5.450	the_feel_felt_found+ownership_language	discard	tone_change
2223	4.700	the_feel_felt_found+ownership_language+casual_professionalism	discard	add_casual_professionalism
2224	5.138	the_feel_felt_found+ownership_language	discard	tone_change
2225	5.350	the_feel_felt_found+ownership_language	discard	tone_change
2226	5.650	ownership_language	discard	crossover
2227	4.675	the_feel_felt_found+ownership_language+casual_professionalism	discard	add_casual_professionalism
2228	5.013	the_feel_felt_found	discard	crossover
2229	5.450	ownership_language	discard	crossover
2230	4.825	the_feel_felt_found+ownership_language+mirroring	discard	add_mirroring
2231	5.550	the_feel_felt_found+ownership_language+concrete_next_steps	discard	add_concrete_next_steps
2232	5.237	ownership_language	discard	remove_the_feel_felt_found
2233	5.350	ownership_language	discard	remove_the_feel_felt_found
2234	5.013	the_feel_felt_found	discard	remove_ownership_language
2235	5.237	the_feel_felt_found+ownership_language	discard	tone_change
2236	5.138	ownership_language	discard	remove_the_feel_felt_found
2237	5.550	none	discard	crossover
2238	5.200	ownership_language	discard	crossover
2239	4.825	the_feel_felt_found+ownership_language	discard	tone_change
2240	5.013	the_feel_felt_found+ownership_language	discard	tone_change
2241	5.325	the_feel_felt_found+ownership_language+strategic_agreement	discard	add_strategic_agreement
2242	5.425	the_feel_felt_found+ownership_language	discard	crossover
2243	5.325	ownership_language+energy_matching	discard	swap_the_feel_felt_found_for_energy_matching
2244	5.338	the_feel_felt_found+ownership_language+casual_professionalism	discard	add_casual_professionalism
2245	5.138	the_feel_felt_found+ownership_language+never_say_calm_down	discard	add_never_say_calm_down
2246	5.237	the_feel_felt_found+ownership_language	discard	tone_change
2247	5.138	ownership_language+mirroring	discard	swap_the_feel_felt_found_for_mirroring
2248	5.450	the_feel_felt_found+ownership_language	discard	temp_0.90
2249	5.237	the_feel_felt_found+ownership_language	discard	tone_change
2250	5.450	ownership_language	discard	remove_the_feel_felt_found
2251	5.650	the_feel_felt_found+ownership_language+validation_before_solution	discard	add_validation_before_solution
2252	5.237	the_feel_felt_found+ownership_language+genuine_admission	discard	add_genuine_admission
2253	5.450	the_feel_felt_found+ownership_language	discard	temp_0.90
2254	5.550	the_feel_felt_found+ownership_language+validation_before_solution	discard	add_validation_before_solution
2255	5.350	the_feel_felt_found+ownership_language	discard	crossover
2256	5.138	ownership_language+warmth_injection	discard	swap_the_feel_felt_found_for_warmth_injection
2257	5.112	the_feel_felt_found+ownership_language	discard	tone_change
2258	5.237	ownership_language+warmth_injection	discard	swap_the_feel_felt_found_for_warmth_injection
2259	5.325	ownership_language	discard	crossover
