generation	eq_score	techniques	status	description
4768	5.325	ownership_language	discard	crossover
4769	5.237	the_feel_felt_found+ownership_language	discard	temp_0.85
4770	5.138	the_feel_felt_found	discard	crossover
4771	5.450	the_feel_felt_found+ownership_language+proactive_extras	discard	add_proactive_extras
4772	5.138	the_feel_felt_found+ownership_language+casual_professionalism	discard	add_casual_professionalism
4773	5.450	the_feel_felt_found+ownership_language	discard	tone_change
4774	5.525	the_feel_felt_found+validation_before_solution	discard	swap_ownership_language_for_validation_before_solution
4775	5.013	the_feel_felt_found+strategic_agreement	discard	swap_ownership_language_for_strategic_agreement
4776	5.550	the_feel_felt_found+ownership_language	discard	tone_change
4777	5.325	the_feel_felt_found	discard	crossover
4778	5.450	the_feel_felt_found+ownership_language	discard	tone_change
4779	5.138	the_feel_felt_found	discard	remove_ownership_language
4780	5.550	the_feel_felt_found+ownership_language	discard	tone_change
4781	5.425	the_feel_felt_found+ownership_language	discard	temp_0.70
4782	5.437	the_feel_felt_found+ownership_language	discard	tone_change
4783	4.588	the_feel_felt_found	discard	crossover
4784	5.138	the_feel_felt_found	discard	crossover
4785	5.238	the_feel_felt_found+ownership_language	discard	crossover
4786	5.450	ownership_language+personal_touch	discard	swap_the_feel_felt_found_for_personal_touch
4787	5.650	the_feel_felt_found+ownership_language	discard	temp_0.75
4788	5.450	the_feel_felt_found+ownership_language	discard	tone_change
4789	5.138	the_feel_felt_found+ownership_language	discard	crossover
4790	5.237	the_feel_felt_found+ownership_language	discard	crossover
4791	5.012	the_feel_felt_found+concrete_next_steps	discard	swap_ownership_language_for_concrete_next_steps
4792	5.338	ownership_language	discard	crossover
4793	5.450	the_feel_felt_found+ownership_language+casual_professionalism	discard	add_casual_professionalism
4794	5.325	the_feel_felt_found+ownership_language	discard	tone_change
4795	5.325	the_feel_felt_found	discard	crossover
4796	5.025	the_feel_felt_found+ownership_language	discard	crossover
4797	4.925	the_feel_felt_found+strategic_agreement	discard	swap_ownership_language_for_strategic_agreement
4798	5.237	the_feel_felt_found+ownership_language	discard	temp_0.75
4799	5.450	ownership_language+never_say_calm_down	discard	swap_the_feel_felt_found_for_never_say_calm_down
4800	5.425	the_feel_felt_found+ownership_language	discard	temp_0.65
4801	4.800	the_feel_felt_found+ownership_language+energy_matching	discard	add_energy_matching
4802	5.425	the_feel_felt_found+ownership_language+personal_touch	discard	add_personal_touch
4803	5.138	the_feel_felt_found+ownership_language+warmth_injection	discard	add_warmth_injection
4804	5.237	the_feel_felt_found+proactive_extras	discard	swap_ownership_language_for_proactive_extras
4805	4.725	the_feel_felt_found	discard	remove_ownership_language
4806	5.200	the_feel_felt_found+ownership_language	discard	tone_change
4807	5.200	the_feel_felt_found+ownership_language	discard	temp_0.75
4808	5.013	the_feel_felt_found+ownership_language+casual_professionalism	discard	add_casual_professionalism
4809	5.200	the_feel_felt_found	discard	remove_ownership_language
4810	5.325	the_feel_felt_found+ownership_language+energy_matching	discard	add_energy_matching
4811	5.450	ownership_language+mirroring	discard	swap_the_feel_felt_found_for_mirroring
4812	5.425	the_feel_felt_found+ownership_language	discard	tone_change
4813	5.425	the_feel_felt_found+ownership_language+casual_professionalism	discard	add_casual_professionalism
4814	5.225	the_feel_felt_found	discard	remove_ownership_language
4815	5.237	ownership_language+energy_matching	discard	swap_the_feel_felt_found_for_energy_matching
4816	5.525	the_feel_felt_found+strategic_agreement	discard	swap_ownership_language_for_strategic_agreement
4817	5.450	ownership_language+validation_before_solution	discard	swap_the_feel_felt_found_for_validation_before_solution
4818	5.450	the_feel_felt_found+ownership_language	discard	tone_change
4819	5.013	ownership_language+concrete_next_steps	discard	swap_the_feel_felt_found_for_concrete_next_steps
4820	5.037	the_feel_felt_found+ownership_language	discard	crossover
4821	5.237	the_feel_felt_found+ownership_language	discard	crossover
4822	5.450	ownership_language	discard	remove_the_feel_felt_found
4823	5.138	none	discard	crossover
4824	5.138	the_feel_felt_found+ownership_language+energy_matching	discard	add_energy_matching
4825	5.137	the_feel_felt_found+ownership_language	discard	temp_0.85
4826	4.938	ownership_language+genuine_admission	discard	swap_the_feel_felt_found_for_genuine_admission
4827	5.425	the_feel_felt_found+never_say_calm_down	discard	swap_ownership_language_for_never_say_calm_down
4828	5.425	the_feel_felt_found+validation_before_solution	discard	swap_ownership_language_for_validation_before_solution
4829	5.650	the_feel_felt_found+ownership_language	discard	tone_change
4830	5.213	the_feel_felt_found+ownership_language+never_say_calm_down	discard	add_never_say_calm_down
4831	5.450	ownership_language+concrete_next_steps	discard	swap_the_feel_felt_found_for_concrete_next_steps
4832	5.425	the_feel_felt_found+ownership_language	discard	tone_change
4833	5.325	the_feel_felt_found+ownership_language	discard	crossover
4834	5.325	the_feel_felt_found+ownership_language	discard	crossover
4835	5.300	the_feel_felt_found+ownership_language	discard	temp_0.65
4836	4.825	the_feel_felt_found+ownership_language	discard	temp_0.95
4837	5.550	ownership_language+validation_before_solution	discard	swap_the_feel_felt_found_for_validation_before_solution
4838	5.112	the_feel_felt_found+ownership_language	discard	temp_0.90
4839	5.200	the_feel_felt_found+ownership_language	discard	tone_change
4840	5.450	the_feel_felt_found+ownership_language	discard	tone_change
4841	5.138	the_feel_felt_found+ownership_language+casual_professionalism	discard	add_casual_professionalism
4842	5.550	the_feel_felt_found+ownership_language	discard	tone_change
4843	5.138	the_feel_felt_found+ownership_language+mirroring	discard	add_mirroring
4844	4.487	ownership_language	discard	remove_the_feel_felt_found
4845	5.237	ownership_language	discard	crossover
4846	5.225	the_feel_felt_found+ownership_language	discard	tone_change
4847	4.988	the_feel_felt_found+ownership_language	discard	tone_change
4848	5.450	ownership_language+casual_professionalism	discard	swap_the_feel_felt_found_for_casual_professionalism
4849	5.075	the_feel_felt_found	discard	crossover
4850	5.450	the_feel_felt_found+ownership_language+genuine_admission	discard	add_genuine_admission
4851	5.425	the_feel_felt_found	discard	remove_ownership_language
4852	5.550	the_feel_felt_found+ownership_language+mirroring	discard	add_mirroring
4853	5.138	none	discard	crossover
4854	5.350	the_feel_felt_found	discard	crossover
4855	5.325	the_feel_felt_found+ownership_language	discard	temp_0.70
4856	4.825	the_feel_felt_found+ownership_language	discard	tone_change
4857	5.550	the_feel_felt_found+ownership_language+personal_touch	discard	add_personal_touch
4858	5.425	the_feel_felt_found+ownership_language+genuine_admission	discard	add_genuine_admission
4859	5.138	the_feel_felt_found+ownership_language+personal_touch	discard	add_personal_touch
4860	5.237	ownership_language+concrete_next_steps	discard	swap_the_feel_felt_found_for_concrete_next_steps
4861	4.700	the_feel_felt_found+ownership_language	discard	crossover
4862	5.550	none	discard	crossover
4863	5.138	ownership_language+casual_professionalism	discard	swap_the_feel_felt_found_for_casual_professionalism
4864	5.425	the_feel_felt_found+ownership_language	discard	tone_change
4865	4.925	the_feel_felt_found+ownership_language	discard	temp_0.65
4866	5.425	the_feel_felt_found+ownership_language	discard	tone_change
4867	5.550	the_feel_felt_found+proactive_extras	discard	swap_ownership_language_for_proactive_extras
4868	5.300	the_feel_felt_found+ownership_language	discard	temp_0.95
4869	5.525	ownership_language	discard	crossover
4870	5.237	the_feel_felt_found+ownership_language	discard	tone_change
4871	5.138	the_feel_felt_found+ownership_language	discard	tone_change
4872	4.825	the_feel_felt_found+ownership_language+concrete_next_steps	discard	add_concrete_next_steps
4873	4.713	the_feel_felt_found+ownership_language+validation_before_solution	discard	add_validation_before_solution
4874	5.138	the_feel_felt_found+ownership_language+proactive_extras	discard	add_proactive_extras
4875	5.238	ownership_language	discard	remove_the_feel_felt_found
4876	5.550	the_feel_felt_found+ownership_language	discard	temp_0.95
4877	5.213	the_feel_felt_found	discard	remove_ownership_language
4878	5.338	the_feel_felt_found+ownership_language+concrete_next_steps	discard	add_concrete_next_steps
4879	5.450	the_feel_felt_found+ownership_language	discard	tone_change
4880	5.013	the_feel_felt_found+ownership_language+never_say_calm_down	discard	add_never_say_calm_down
4881	5.425	the_feel_felt_found+never_say_calm_down	discard	swap_ownership_language_for_never_say_calm_down
4882	5.550	ownership_language	discard	crossover
4883	5.425	the_feel_felt_found+ownership_language+energy_matching	discard	add_energy_matching
4884	4.925	the_feel_felt_found+ownership_language	discard	crossover
4885	5.550	ownership_language+proactive_extras	discard	swap_the_feel_felt_found_for_proactive_extras
4886	5.338	the_feel_felt_found+ownership_language	discard	crossover
4887	5.450	ownership_language	discard	remove_the_feel_felt_found
4888	5.450	the_feel_felt_found+ownership_language+mirroring	discard	add_mirroring
4889	4.888	the_feel_felt_found+ownership_language+casual_professionalism	discard	add_casual_professionalism
4890	5.212	the_feel_felt_found+ownership_language	discard	temp_0.90
4891	5.625	the_feel_felt_found+ownership_language	discard	tone_change
4892	4.825	the_feel_felt_found	discard	remove_ownership_language
4893	5.550	the_feel_felt_found+ownership_language	discard	crossover
4894	5.237	the_feel_felt_found+ownership_language	discard	tone_change
4895	5.325	ownership_language	discard	remove_the_feel_felt_found
4896	4.700	the_feel_felt_found+ownership_language+genuine_admission	discard	add_genuine_admission
4897	5.237	the_feel_felt_found+ownership_language	discard	tone_change
4898	5.450	the_feel_felt_found+ownership_language	discard	tone_change
4899	4.925	the_feel_felt_found+ownership_language	discard	crossover
4900	5.138	the_feel_felt_found+ownership_language	discard	tone_change
4901	5.525	the_feel_felt_found+ownership_language+warmth_injection	discard	add_warmth_injection
4902	5.450	the_feel_felt_found+ownership_language+concrete_next_steps	discard	add_concrete_next_steps
4903	5.325	the_feel_felt_found+ownership_language	discard	crossover
4904	4.600	the_feel_felt_found+ownership_language	discard	crossover
4905	5.450	the_feel_felt_found+ownership_language	discard	temp_0.95
4906	5.438	the_feel_felt_found+ownership_language+personal_touch	discard	add_personal_touch
4907	4.825	the_feel_felt_found+strategic_agreement	discard	swap_ownership_language_for_strategic_agreement
4908	5.650	the_feel_felt_found+validation_before_solution	discard	swap_ownership_language_for_validation_before_solution
4909	4.925	ownership_language	discard	remove_the_feel_felt_found
4910	5.325	the_feel_felt_found+ownership_language+warmth_injection	discard	add_warmth_injection
4911	5.550	the_feel_felt_found+ownership_language	discard	crossover
4912	5.425	the_feel_felt_found+ownership_language	discard	temp_0.85
4913	5.013	the_feel_felt_found+ownership_language	discard	tone_change
4914	5.112	the_feel_felt_found+ownership_language	discard	tone_change
4915	4.725	ownership_language+energy_matching	discard	swap_the_feel_felt_found_for_energy_matching
4916	5.237	the_feel_felt_found+ownership_language+warmth_injection	discard	add_warmth_injection
4917	5.450	the_feel_felt_found+ownership_language	discard	tone_change
4918	5.338	the_feel_felt_found+ownership_language	discard	tone_change
4919	5.238	the_feel_felt_found+warmth_injection	discard	swap_ownership_language_for_warmth_injection
4920	5.550	the_feel_felt_found+ownership_language+genuine_admission	discard	add_genuine_admission
4921	5.325	ownership_language	discard	remove_the_feel_felt_found
4922	5.650	ownership_language	discard	remove_the_feel_felt_found
4923	5.525	ownership_language+concrete_next_steps	discard	swap_the_feel_felt_found_for_concrete_next_steps
4924	5.238	the_feel_felt_found+ownership_language	discard	tone_change
4925	4.825	the_feel_felt_found+emotional_labeling	discard	swap_ownership_language_for_emotional_labeling
4926	5.013	the_feel_felt_found+never_say_calm_down	discard	swap_ownership_language_for_never_say_calm_down
4927	5.137	the_feel_felt_found+ownership_language+proactive_extras	discard	add_proactive_extras
4928	5.238	ownership_language+never_say_calm_down	discard	swap_the_feel_felt_found_for_never_say_calm_down
4929	5.200	the_feel_felt_found+ownership_language	discard	crossover
4930	5.650	the_feel_felt_found+ownership_language+warmth_injection	discard	add_warmth_injection
4931	5.138	ownership_language	discard	remove_the_feel_felt_found
4932	5.450	the_feel_felt_found+ownership_language	discard	tone_change
4933	5.237	the_feel_felt_found+ownership_language	discard	crossover
4934	4.925	the_feel_felt_found+ownership_language	discard	crossover
4935	5.237	ownership_language	discard	remove_the_feel_felt_found
4936	5.237	the_feel_felt_found+ownership_language	discard	tone_change
4937	4.925	the_feel_felt_found+ownership_language	discard	tone_change
4938	5.425	the_feel_felt_found	discard	crossover
4939	5.650	the_feel_felt_found+ownership_language	discard	temp_0.90
4940	5.112	the_feel_felt_found+ownership_language	discard	tone_change
4941	5.425	ownership_language+never_say_calm_down	discard	swap_the_feel_felt_found_for_never_say_calm_down
4942	5.138	the_feel_felt_found+ownership_language+concrete_next_steps	discard	add_concrete_next_steps
4943	5.100	the_feel_felt_found+ownership_language	discard	temp_0.95
4944	5.112	the_feel_felt_found+ownership_language	discard	tone_change
4945	5.013	the_feel_felt_found+ownership_language+energy_matching	discard	add_energy_matching
4946	5.125	ownership_language+validation_before_solution	discard	swap_the_feel_felt_found_for_validation_before_solution
4947	5.075	ownership_language+casual_professionalism	discard	swap_the_feel_felt_found_for_casual_professionalism
4948	5.237	ownership_language+mirroring	discard	swap_the_feel_felt_found_for_mirroring
4949	5.550	the_feel_felt_found+ownership_language	discard	tone_change
4950	5.450	the_feel_felt_found+ownership_language	discard	tone_change
4951	5.112	the_feel_felt_found+ownership_language	discard	temp_0.75
4952	5.200	the_feel_felt_found+ownership_language+genuine_admission	discard	add_genuine_admission
4953	5.125	the_feel_felt_found+ownership_language	discard	tone_change
4954	5.237	the_feel_felt_found+ownership_language+personal_touch	discard	add_personal_touch
4955	5.550	the_feel_felt_found+ownership_language	discard	tone_change
4956	4.700	the_feel_felt_found+mirroring	discard	swap_ownership_language_for_mirroring
4957	5.450	the_feel_felt_found+ownership_language	discard	temp_0.75
4958	5.550	ownership_language	discard	remove_the_feel_felt_found
4959	5.350	the_feel_felt_found+ownership_language+genuine_admission	discard	add_genuine_admission
4960	5.138	ownership_language+validation_before_solution	discard	swap_the_feel_felt_found_for_validation_before_solution
4961	5.112	the_feel_felt_found+ownership_language	discard	tone_change
4962	5.450	the_feel_felt_found	discard	crossover
4963	5.237	the_feel_felt_found+ownership_language	discard	tone_change
4964	5.450	the_feel_felt_found+ownership_language	discard	crossover
4965	5.325	the_feel_felt_found+ownership_language	discard	temp_0.65
4966	5.112	the_feel_felt_found+ownership_language	discard	crossover
4967	5.338	ownership_language	discard	crossover
4968	5.325	ownership_language	discard	crossover
4969	5.138	the_feel_felt_found+emotional_labeling	discard	swap_ownership_language_for_emotional_labeling
4970	4.825	the_feel_felt_found	discard	remove_ownership_language
4971	5.525	the_feel_felt_found+ownership_language	discard	crossover
4972	5.138	the_feel_felt_found+ownership_language	discard	tone_change
4973	5.112	the_feel_felt_found+ownership_language	discard	temp_0.75
4974	5.550	ownership_language	discard	crossover
4975	5.450	the_feel_felt_found+ownership_language+never_say_calm_down	discard	add_never_say_calm_down
4976	4.612	the_feel_felt_found+ownership_language	discard	tone_change
4977	5.013	the_feel_felt_found+ownership_language+personal_touch	discard	add_personal_touch
4978	5.650	the_feel_felt_found+ownership_language	discard	temp_0.70
4979	5.450	the_feel_felt_found+ownership_language	discard	tone_change
4980	5.237	the_feel_felt_found+ownership_language	discard	tone_change
4981	5.237	the_feel_felt_found+ownership_language	discard	temp_0.95
4982	5.237	the_feel_felt_found+ownership_language+genuine_admission	discard	add_genuine_admission
4983	5.138	the_feel_felt_found+ownership_language	discard	temp_0.95
4984	5.025	the_feel_felt_found+ownership_language	discard	tone_change
4985	5.238	the_feel_felt_found+ownership_language+warmth_injection	discard	add_warmth_injection
4986	5.325	ownership_language+emotional_labeling	discard	swap_the_feel_felt_found_for_emotional_labeling
4987	5.550	ownership_language	discard	remove_the_feel_felt_found
4988	5.325	the_feel_felt_found+ownership_language	discard	crossover
4989	5.425	the_feel_felt_found+ownership_language+personal_touch	discard	add_personal_touch
4990	4.925	the_feel_felt_found+ownership_language	discard	tone_change
4991	5.550	the_feel_felt_found+ownership_language	discard	crossover
4992	5.525	the_feel_felt_found+ownership_language+personal_touch	discard	add_personal_touch
4993	5.650	ownership_language+casual_professionalism	discard	swap_the_feel_felt_found_for_casual_professionalism
4994	5.425	ownership_language+casual_professionalism	discard	swap_the_feel_felt_found_for_casual_professionalism
4995	5.325	the_feel_felt_found+ownership_language+never_say_calm_down	discard	add_never_say_calm_down
4996	5.550	the_feel_felt_found+ownership_language+strategic_agreement	discard	add_strategic_agreement
4997	5.450	the_feel_felt_found+ownership_language+validation_before_solution	discard	add_validation_before_solution
4998	4.825	the_feel_felt_found+ownership_language	discard	temp_0.70
4999	5.112	the_feel_felt_found+ownership_language+never_say_calm_down	discard	add_never_say_calm_down
5000	5.112	the_feel_felt_found+ownership_language+strategic_agreement	discard	add_strategic_agreement
5001	5.550	none	discard	crossover
5002	5.550	the_feel_felt_found+ownership_language	discard	tone_change
5003	5.013	the_feel_felt_found+ownership_language	discard	tone_change
5004	4.987	the_feel_felt_found+ownership_language	discard	temp_0.90
5005	5.550	the_feel_felt_found+ownership_language	discard	tone_change
5006	5.550	the_feel_felt_found+ownership_language	discard	temp_0.95
5007	5.325	the_feel_felt_found+ownership_language	discard	tone_change
5008	5.237	the_feel_felt_found+ownership_language	discard	tone_change
5009	5.450	the_feel_felt_found+genuine_admission	discard	swap_ownership_language_for_genuine_admission
5010	4.825	ownership_language+never_say_calm_down	discard	swap_the_feel_felt_found_for_never_say_calm_down
5011	5.300	the_feel_felt_found+ownership_language	discard	crossover
5012	5.550	the_feel_felt_found+ownership_language+proactive_extras	discard	add_proactive_extras
5013	4.825	the_feel_felt_found	discard	crossover
5014	4.812	the_feel_felt_found+ownership_language	discard	temp_0.90
5015	4.938	the_feel_felt_found+ownership_language+validation_before_solution	discard	add_validation_before_solution
5016	5.038	the_feel_felt_found+ownership_language+strategic_agreement	discard	add_strategic_agreement
5017	4.925	the_feel_felt_found+ownership_language	discard	tone_change
5018	4.863	the_feel_felt_found+ownership_language+personal_touch	discard	add_personal_touch
5019	4.800	ownership_language+mirroring	discard	swap_the_feel_felt_found_for_mirroring
5020	5.450	ownership_language	discard	crossover
5021	5.112	the_feel_felt_found+ownership_language	discard	temp_0.75
5022	5.300	the_feel_felt_found+ownership_language	discard	temp_0.90
5023	4.925	the_feel_felt_found	discard	remove_ownership_language
5024	5.237	the_feel_felt_found+ownership_language+warmth_injection	discard	add_warmth_injection
5025	4.925	the_feel_felt_found+ownership_language	discard	tone_change
5026	5.350	the_feel_felt_found+ownership_language+warmth_injection	discard	add_warmth_injection
5027	5.238	the_feel_felt_found	discard	remove_ownership_language
5028	5.450	the_feel_felt_found+ownership_language	discard	tone_change
5029	4.912	the_feel_felt_found+ownership_language+casual_professionalism	discard	add_casual_professionalism
5030	5.025	the_feel_felt_found+ownership_language+proactive_extras	discard	add_proactive_extras
5031	5.550	the_feel_felt_found+ownership_language+never_say_calm_down	discard	add_never_say_calm_down
5032	4.888	the_feel_felt_found+ownership_language+validation_before_solution	discard	add_validation_before_solution
5033	4.925	the_feel_felt_found+ownership_language	discard	temp_0.95
5034	4.725	the_feel_felt_found+ownership_language	discard	tone_change
5035	5.037	the_feel_felt_found+ownership_language	discard	crossover
5036	5.200	the_feel_felt_found+ownership_language+strategic_agreement	discard	add_strategic_agreement
5037	5.450	the_feel_felt_found+ownership_language	discard	temp_0.95
5038	5.225	the_feel_felt_found+ownership_language+energy_matching	discard	add_energy_matching
5039	5.225	the_feel_felt_found+ownership_language	discard	tone_change
5040	5.225	the_feel_felt_found+ownership_language	discard	tone_change
5041	5.013	the_feel_felt_found+ownership_language	discard	temp_0.95
5042	5.138	ownership_language	discard	remove_the_feel_felt_found
5043	5.325	ownership_language	discard	crossover
