generation	eq_score	techniques	status	description
6976	5.450	the_feel_felt_found+ownership_language	discard	tone_change
6977	5.200	the_feel_felt_found+ownership_language+warmth_injection	discard	add_warmth_injection
6978	5.325	the_feel_felt_found+ownership_language+validation_before_solution	discard	add_validation_before_solution
6979	5.450	the_feel_felt_found+ownership_language	discard	crossover
6980	5.550	the_feel_felt_found	discard	remove_ownership_language
6981	5.337	the_feel_felt_found	discard	crossover
6982	5.450	the_feel_felt_found+strategic_agreement	discard	swap_ownership_language_for_strategic_agreement
6983	5.325	the_feel_felt_found+ownership_language+emotional_labeling	discard	add_emotional_labeling
6984	5.237	ownership_language+concrete_next_steps	discard	swap_the_feel_felt_found_for_concrete_next_steps
6985	5.013	the_feel_felt_found+ownership_language	discard	tone_change
6986	5.325	the_feel_felt_found+ownership_language	discard	tone_change
6987	5.350	the_feel_felt_found+ownership_language+energy_matching	discard	add_energy_matching
6988	5.650	the_feel_felt_found+ownership_language	discard	tone_change
6989	4.825	the_feel_felt_found+ownership_language+never_say_calm_down	discard	add_never_say_calm_down
6990	5.112	ownership_language+concrete_next_steps	discard	swap_the_feel_felt_found_for_concrete_next_steps
6991	4.925	the_feel_felt_found+ownership_language+warmth_injection	discard	add_warmth_injection
6992	5.550	ownership_language	discard	remove_the_feel_felt_found
6993	5.300	the_feel_felt_found+ownership_language	discard	tone_change
6994	5.013	the_feel_felt_found	discard	crossover
6995	5.013	the_feel_felt_found+ownership_language	discard	temp_0.85
6996	5.237	ownership_language	discard	remove_the_feel_felt_found
6997	5.650	the_feel_felt_found	discard	remove_ownership_language
6998	5.450	the_feel_felt_found+ownership_language+validation_before_solution	discard	add_validation_before_solution
6999	4.825	the_feel_felt_found+ownership_language	discard	tone_change
7000	5.225	the_feel_felt_found+ownership_language	discard	tone_change
7001	5.138	the_feel_felt_found+ownership_language+genuine_admission	discard	add_genuine_admission
7002	5.550	ownership_language	discard	remove_the_feel_felt_found
7003	5.138	the_feel_felt_found+never_say_calm_down	discard	swap_ownership_language_for_never_say_calm_down
7004	5.225	ownership_language	discard	remove_the_feel_felt_found
7005	5.025	the_feel_felt_found+ownership_language	discard	tone_change
7006	5.338	the_feel_felt_found+ownership_language	discard	temp_0.70
7007	5.750	the_feel_felt_found+ownership_language+personal_touch	discard	add_personal_touch
7008	4.825	the_feel_felt_found+ownership_language+mirroring	discard	add_mirroring
7009	5.213	the_feel_felt_found+ownership_language	discard	tone_change
7010	5.200	the_feel_felt_found+concrete_next_steps	discard	swap_ownership_language_for_concrete_next_steps
7011	5.200	ownership_language	discard	crossover
7012	5.325	ownership_language	discard	remove_the_feel_felt_found
7013	5.037	the_feel_felt_found+ownership_language	discard	temp_0.65
7014	5.112	the_feel_felt_found+ownership_language	discard	tone_change
7015	5.450	the_feel_felt_found+ownership_language	discard	tone_change
7016	5.325	the_feel_felt_found+ownership_language	discard	tone_change
7017	5.112	the_feel_felt_found+ownership_language+proactive_extras	discard	add_proactive_extras
7018	5.138	the_feel_felt_found+ownership_language	discard	temp_0.95
7019	5.237	the_feel_felt_found+ownership_language+proactive_extras	discard	add_proactive_extras
7020	5.025	the_feel_felt_found+ownership_language	discard	tone_change
7021	4.925	the_feel_felt_found+strategic_agreement	discard	swap_ownership_language_for_strategic_agreement
7022	5.138	the_feel_felt_found+mirroring	discard	swap_ownership_language_for_mirroring
7023	5.525	the_feel_felt_found+validation_before_solution	discard	swap_ownership_language_for_validation_before_solution
7024	4.825	the_feel_felt_found+ownership_language	discard	crossover
7025	5.237	the_feel_felt_found+ownership_language+concrete_next_steps	discard	add_concrete_next_steps
7026	5.450	the_feel_felt_found+ownership_language	discard	tone_change
7027	5.550	the_feel_felt_found+ownership_language	discard	crossover
7028	4.912	the_feel_felt_found+ownership_language+strategic_agreement	discard	add_strategic_agreement
7029	5.337	the_feel_felt_found+ownership_language+never_say_calm_down	discard	add_never_say_calm_down
7030	4.925	the_feel_felt_found+ownership_language	discard	tone_change
7031	5.550	ownership_language+mirroring	discard	swap_the_feel_felt_found_for_mirroring
7032	5.013	the_feel_felt_found+ownership_language	discard	crossover
7033	5.450	the_feel_felt_found+ownership_language	discard	tone_change
7034	5.138	the_feel_felt_found+ownership_language	discard	temp_0.95
7035	5.112	the_feel_felt_found+ownership_language	discard	temp_0.90
7036	5.450	the_feel_felt_found+ownership_language	discard	crossover
7037	5.138	none	discard	crossover
7038	5.138	the_feel_felt_found+ownership_language	discard	tone_change
7039	5.300	the_feel_felt_found+ownership_language	discard	tone_change
7040	5.425	the_feel_felt_found+ownership_language	discard	crossover
7041	5.112	ownership_language+concrete_next_steps	discard	swap_the_feel_felt_found_for_concrete_next_steps
7042	5.138	ownership_language	discard	remove_the_feel_felt_found
7043	5.425	the_feel_felt_found+casual_professionalism	discard	swap_ownership_language_for_casual_professionalism
7044	5.075	the_feel_felt_found+ownership_language	discard	crossover
7045	5.338	the_feel_felt_found	discard	crossover
7046	5.450	the_feel_felt_found+ownership_language	discard	crossover
7047	5.237	the_feel_felt_found	discard	remove_ownership_language
7048	5.650	the_feel_felt_found+ownership_language+strategic_agreement	discard	add_strategic_agreement
7049	5.138	the_feel_felt_found+ownership_language	discard	crossover
7050	5.425	the_feel_felt_found+ownership_language	discard	temp_0.70
7051	5.025	the_feel_felt_found+emotional_labeling	discard	swap_ownership_language_for_emotional_labeling
7052	4.825	the_feel_felt_found+ownership_language+warmth_injection	discard	add_warmth_injection
7053	5.138	the_feel_felt_found+ownership_language	discard	tone_change
7054	5.450	ownership_language+validation_before_solution	discard	swap_the_feel_felt_found_for_validation_before_solution
7055	4.787	the_feel_felt_found+ownership_language+concrete_next_steps	discard	add_concrete_next_steps
7056	5.325	ownership_language+genuine_admission	discard	swap_the_feel_felt_found_for_genuine_admission
7057	5.550	ownership_language+proactive_extras	discard	swap_the_feel_felt_found_for_proactive_extras
7058	4.825	the_feel_felt_found+ownership_language+strategic_agreement	discard	add_strategic_agreement
7059	5.325	the_feel_felt_found	discard	remove_ownership_language
7060	5.013	the_feel_felt_found	discard	remove_ownership_language
7061	5.438	the_feel_felt_found+ownership_language+strategic_agreement	discard	add_strategic_agreement
7062	5.550	the_feel_felt_found+ownership_language	discard	tone_change
7063	5.425	ownership_language	discard	remove_the_feel_felt_found
7064	5.325	the_feel_felt_found+ownership_language+warmth_injection	discard	add_warmth_injection
7065	5.550	the_feel_felt_found+ownership_language	discard	tone_change
7066	4.800	the_feel_felt_found+ownership_language+concrete_next_steps	discard	add_concrete_next_steps
7067	4.700	ownership_language	discard	crossover
7068	4.912	the_feel_felt_found	discard	remove_ownership_language
7069	5.113	the_feel_felt_found+ownership_language	discard	tone_change
7070	5.450	the_feel_felt_found	discard	remove_ownership_language
7071	5.550	the_feel_felt_found+ownership_language+validation_before_solution	discard	add_validation_before_solution
7072	5.450	the_feel_felt_found+ownership_language+strategic_agreement	discard	add_strategic_agreement
7073	5.425	the_feel_felt_found+ownership_language	discard	tone_change
7074	5.650	the_feel_felt_found	discard	remove_ownership_language
7075	4.725	the_feel_felt_found+ownership_language+personal_touch	discard	add_personal_touch
7076	5.425	the_feel_felt_found+ownership_language	discard	tone_change
7077	5.113	the_feel_felt_found+ownership_language	discard	temp_0.95
7078	5.650	ownership_language	discard	remove_the_feel_felt_found
7079	5.325	the_feel_felt_found+ownership_language	discard	tone_change
7080	5.425	the_feel_felt_found+ownership_language	discard	crossover
7081	5.238	the_feel_felt_found+genuine_admission	discard	swap_ownership_language_for_genuine_admission
7082	4.888	the_feel_felt_found+ownership_language+emotional_labeling	discard	add_emotional_labeling
7083	5.138	the_feel_felt_found	discard	crossover
7084	4.200	the_feel_felt_found+ownership_language	discard	tone_change
7085	5.225	the_feel_felt_found+validation_before_solution	discard	swap_ownership_language_for_validation_before_solution
7086	5.112	the_feel_felt_found+ownership_language	discard	temp_0.90
7087	5.138	the_feel_felt_found+ownership_language	discard	temp_0.70
7088	5.013	the_feel_felt_found+ownership_language+genuine_admission	discard	add_genuine_admission
7089	5.550	the_feel_felt_found+proactive_extras	discard	swap_ownership_language_for_proactive_extras
7090	5.112	the_feel_felt_found+ownership_language	discard	tone_change
7091	5.237	the_feel_felt_found+proactive_extras	discard	swap_ownership_language_for_proactive_extras
7092	5.325	the_feel_felt_found+ownership_language	discard	temp_0.95
7093	5.325	the_feel_felt_found+ownership_language+personal_touch	discard	add_personal_touch
7094	5.450	none	discard	crossover
7095	5.200	the_feel_felt_found+ownership_language	discard	temp_0.75
7096	4.987	the_feel_felt_found+ownership_language+emotional_labeling	discard	add_emotional_labeling
7097	5.325	the_feel_felt_found+genuine_admission	discard	swap_ownership_language_for_genuine_admission
7098	5.350	the_feel_felt_found+ownership_language	discard	tone_change
7099	5.113	ownership_language+proactive_extras	discard	swap_the_feel_felt_found_for_proactive_extras
7100	5.013	the_feel_felt_found+ownership_language	discard	tone_change
7101	5.450	ownership_language+mirroring	discard	swap_the_feel_felt_found_for_mirroring
7102	5.237	ownership_language+casual_professionalism	discard	swap_the_feel_felt_found_for_casual_professionalism
7103	5.325	the_feel_felt_found+ownership_language	discard	temp_0.90
7104	4.913	the_feel_felt_found+ownership_language	discard	tone_change
7105	4.912	the_feel_felt_found+ownership_language	discard	tone_change
7106	5.325	the_feel_felt_found+ownership_language+warmth_injection	discard	add_warmth_injection
7107	5.325	the_feel_felt_found+ownership_language+personal_touch	discard	add_personal_touch
7108	5.525	ownership_language	discard	crossover
7109	5.325	the_feel_felt_found+ownership_language	discard	tone_change
7110	5.325	the_feel_felt_found+ownership_language	discard	tone_change
7111	5.550	ownership_language	discard	crossover
7112	5.113	the_feel_felt_found+warmth_injection	discard	swap_ownership_language_for_warmth_injection
7113	4.725	ownership_language	discard	crossover
7114	5.112	the_feel_felt_found+ownership_language	discard	tone_change
7115	5.112	the_feel_felt_found+ownership_language	discard	temp_0.70
7116	4.700	ownership_language	discard	remove_the_feel_felt_found
7117	5.300	the_feel_felt_found+ownership_language	discard	tone_change
7118	5.425	ownership_language+genuine_admission	discard	swap_the_feel_felt_found_for_genuine_admission
7119	4.825	the_feel_felt_found+ownership_language	discard	crossover
7120	5.650	ownership_language	discard	remove_the_feel_felt_found
7121	5.138	the_feel_felt_found+ownership_language	discard	tone_change
7122	5.325	the_feel_felt_found+ownership_language+warmth_injection	discard	add_warmth_injection
7123	5.312	the_feel_felt_found+ownership_language+validation_before_solution	discard	add_validation_before_solution
7124	5.138	ownership_language+casual_professionalism	discard	swap_the_feel_felt_found_for_casual_professionalism
7125	5.200	the_feel_felt_found+ownership_language	discard	tone_change
7126	5.425	the_feel_felt_found+ownership_language	discard	temp_0.75
7127	5.450	none	discard	crossover
7128	5.550	the_feel_felt_found+ownership_language+never_say_calm_down	discard	add_never_say_calm_down
7129	5.650	ownership_language+personal_touch	discard	swap_the_feel_felt_found_for_personal_touch
7130	5.450	the_feel_felt_found+ownership_language+strategic_agreement	discard	add_strategic_agreement
7131	4.725	the_feel_felt_found+ownership_language	discard	tone_change
7132	5.325	the_feel_felt_found+warmth_injection	discard	swap_ownership_language_for_warmth_injection
7133	5.338	ownership_language	discard	remove_the_feel_felt_found
7134	5.325	the_feel_felt_found+ownership_language	discard	crossover
7135	4.825	ownership_language	discard	crossover
7136	4.825	the_feel_felt_found+ownership_language	discard	tone_change
7137	5.013	the_feel_felt_found+ownership_language+validation_before_solution	discard	add_validation_before_solution
7138	5.450	the_feel_felt_found+casual_professionalism	discard	swap_ownership_language_for_casual_professionalism
7139	5.237	the_feel_felt_found	discard	crossover
7140	5.450	the_feel_felt_found	discard	crossover
7141	5.450	the_feel_felt_found+ownership_language+emotional_labeling	discard	add_emotional_labeling
7142	5.425	the_feel_felt_found+ownership_language	discard	tone_change
7143	4.825	the_feel_felt_found+ownership_language	discard	temp_0.95
7144	5.450	the_feel_felt_found+ownership_language+proactive_extras	discard	add_proactive_extras
7145	5.013	the_feel_felt_found+ownership_language	discard	crossover
7146	5.225	the_feel_felt_found+ownership_language+warmth_injection	discard	add_warmth_injection
7147	5.112	the_feel_felt_found+ownership_language+validation_before_solution	discard	add_validation_before_solution
7148	5.425	the_feel_felt_found+never_say_calm_down	discard	swap_ownership_language_for_never_say_calm_down
7149	5.238	the_feel_felt_found+ownership_language	discard	crossover
7150	5.200	the_feel_felt_found	discard	crossover
7151	5.325	ownership_language+proactive_extras	discard	swap_the_feel_felt_found_for_proactive_extras
7152	5.237	the_feel_felt_found+ownership_language	discard	tone_change
7153	5.312	ownership_language	discard	remove_the_feel_felt_found
7154	4.925	the_feel_felt_found+ownership_language	discard	crossover
7155	5.013	ownership_language+genuine_admission	discard	swap_the_feel_felt_found_for_genuine_admission
7156	5.013	the_feel_felt_found+ownership_language	discard	temp_0.85
7157	5.325	ownership_language	discard	crossover
7158	5.650	the_feel_felt_found	discard	crossover
7159	5.013	the_feel_felt_found+ownership_language	discard	temp_0.90
7160	5.112	the_feel_felt_found+ownership_language	discard	tone_change
7161	5.112	ownership_language	discard	crossover
7162	5.237	the_feel_felt_found+ownership_language	discard	tone_change
7163	5.112	the_feel_felt_found+ownership_language	discard	tone_change
7164	5.088	the_feel_felt_found+ownership_language+never_say_calm_down	discard	add_never_say_calm_down
7165	5.037	the_feel_felt_found	discard	crossover
7166	5.112	the_feel_felt_found+genuine_admission	discard	swap_ownership_language_for_genuine_admission
7167	5.550	ownership_language+concrete_next_steps	discard	swap_the_feel_felt_found_for_concrete_next_steps
7168	5.450	the_feel_felt_found+ownership_language+never_say_calm_down	discard	add_never_say_calm_down
7169	5.138	ownership_language	discard	crossover
7170	5.337	the_feel_felt_found	discard	crossover
7171	4.938	the_feel_felt_found+ownership_language	discard	temp_0.90
7172	5.237	the_feel_felt_found+ownership_language	discard	tone_change
7173	5.325	the_feel_felt_found+ownership_language	discard	tone_change
7174	5.338	the_feel_felt_found+ownership_language+validation_before_solution	discard	add_validation_before_solution
7175	5.325	the_feel_felt_found+ownership_language+energy_matching	discard	add_energy_matching
7176	5.450	the_feel_felt_found+ownership_language+genuine_admission	discard	add_genuine_admission
7177	5.112	the_feel_felt_found+ownership_language	discard	crossover
7178	5.138	the_feel_felt_found+ownership_language	discard	tone_change
7179	5.425	the_feel_felt_found+ownership_language	discard	tone_change
7180	4.825	the_feel_felt_found+ownership_language	discard	crossover
7181	5.325	the_feel_felt_found	discard	remove_ownership_language
7182	5.200	the_feel_felt_found+ownership_language	discard	crossover
7183	5.225	the_feel_felt_found+ownership_language+never_say_calm_down	discard	add_never_say_calm_down
7184	4.700	the_feel_felt_found+ownership_language	discard	crossover
7185	5.425	the_feel_felt_found+ownership_language	discard	tone_change
7186	5.337	the_feel_felt_found+ownership_language	discard	crossover
7187	5.325	ownership_language	discard	remove_the_feel_felt_found
7188	5.350	the_feel_felt_found+ownership_language	discard	tone_change
7189	5.437	the_feel_felt_found+ownership_language	discard	tone_change
7190	4.950	ownership_language+strategic_agreement	discard	swap_the_feel_felt_found_for_strategic_agreement
7191	4.725	ownership_language+concrete_next_steps	discard	swap_the_feel_felt_found_for_concrete_next_steps
7192	4.825	the_feel_felt_found+ownership_language	discard	tone_change
7193	5.550	the_feel_felt_found+ownership_language+genuine_admission	discard	add_genuine_admission
7194	5.213	the_feel_felt_found+ownership_language	discard	crossover
7195	5.075	the_feel_felt_found+ownership_language	discard	tone_change
7196	5.550	the_feel_felt_found+ownership_language	discard	crossover
7197	5.213	the_feel_felt_found+ownership_language	discard	tone_change
7198	5.225	the_feel_felt_found+ownership_language	discard	tone_change
7199	5.138	the_feel_felt_found+ownership_language+emotional_labeling	discard	add_emotional_labeling
7200	5.138	the_feel_felt_found+ownership_language+mirroring	discard	add_mirroring
7201	5.325	the_feel_felt_found+ownership_language	discard	tone_change
7202	4.975	the_feel_felt_found+ownership_language	discard	crossover
7203	5.113	the_feel_felt_found+personal_touch	discard	swap_ownership_language_for_personal_touch
7204	4.825	the_feel_felt_found+ownership_language	discard	tone_change
7205	5.450	the_feel_felt_found+ownership_language+casual_professionalism	discard	add_casual_professionalism
7206	5.550	the_feel_felt_found+ownership_language	discard	tone_change
7207	5.338	the_feel_felt_found+ownership_language	discard	temp_0.65
7208	5.450	the_feel_felt_found	discard	crossover
7209	5.650	the_feel_felt_found+ownership_language	discard	tone_change
7210	5.013	the_feel_felt_found+ownership_language+personal_touch	discard	add_personal_touch
7211	5.650	the_feel_felt_found+ownership_language	discard	tone_change
7212	5.650	ownership_language+mirroring	discard	swap_the_feel_felt_found_for_mirroring
7213	5.425	the_feel_felt_found+ownership_language+emotional_labeling	discard	add_emotional_labeling
7214	5.237	the_feel_felt_found+ownership_language+energy_matching	discard	add_energy_matching
7215	5.425	the_feel_felt_found	discard	remove_ownership_language
7216	5.425	the_feel_felt_found+proactive_extras	discard	swap_ownership_language_for_proactive_extras
7217	5.138	the_feel_felt_found+ownership_language+validation_before_solution	discard	add_validation_before_solution
7218	5.450	the_feel_felt_found+ownership_language	discard	tone_change
7219	5.450	the_feel_felt_found+ownership_language	discard	tone_change
7220	4.925	the_feel_felt_found+ownership_language	discard	crossover
7221	5.325	ownership_language+validation_before_solution	discard	swap_the_feel_felt_found_for_validation_before_solution
7222	5.013	the_feel_felt_found+ownership_language+energy_matching	discard	add_energy_matching
7223	5.238	the_feel_felt_found	discard	crossover
7224	5.237	the_feel_felt_found	discard	remove_ownership_language
7225	4.913	the_feel_felt_found+ownership_language	discard	crossover
7226	5.013	the_feel_felt_found+ownership_language+energy_matching	discard	add_energy_matching
7227	5.350	ownership_language	discard	crossover
7228	5.425	the_feel_felt_found+ownership_language+personal_touch	discard	add_personal_touch
7229	5.350	ownership_language+mirroring	discard	swap_the_feel_felt_found_for_mirroring
7230	5.138	the_feel_felt_found+ownership_language+strategic_agreement	discard	add_strategic_agreement
7231	5.225	the_feel_felt_found+ownership_language	discard	temp_0.90
7232	5.300	ownership_language+proactive_extras	discard	swap_the_feel_felt_found_for_proactive_extras
7233	5.200	the_feel_felt_found+ownership_language	discard	tone_change
7234	5.550	the_feel_felt_found+ownership_language	discard	temp_0.65
7235	5.250	the_feel_felt_found+ownership_language	discard	crossover
7236	5.238	the_feel_felt_found+ownership_language	discard	temp_0.90
7237	5.450	the_feel_felt_found	discard	crossover
7238	5.237	the_feel_felt_found+ownership_language+strategic_agreement	discard	add_strategic_agreement
7239	5.425	the_feel_felt_found	discard	crossover
7240	5.325	the_feel_felt_found+ownership_language	discard	temp_0.75
7241	4.925	the_feel_felt_found	discard	crossover
7242	5.450	ownership_language+validation_before_solution	discard	swap_the_feel_felt_found_for_validation_before_solution
7243	4.988	the_feel_felt_found+ownership_language	discard	tone_change
7244	5.550	the_feel_felt_found+ownership_language	discard	crossover
7245	5.325	the_feel_felt_found	discard	remove_ownership_language
7246	5.325	the_feel_felt_found+genuine_admission	discard	swap_ownership_language_for_genuine_admission
7247	5.037	the_feel_felt_found+ownership_language	discard	tone_change
7248	5.450	the_feel_felt_found+ownership_language+concrete_next_steps	discard	add_concrete_next_steps
7249	5.013	the_feel_felt_found+ownership_language+never_say_calm_down	discard	add_never_say_calm_down
7250	5.325	the_feel_felt_found+ownership_language	discard	temp_0.85
7251	5.550	the_feel_felt_found+ownership_language	discard	crossover
7252	5.325	the_feel_felt_found+ownership_language	discard	crossover
7253	4.825	the_feel_felt_found+ownership_language	discard	tone_change
