generation	eq_score	techniques	status	description
6705	5.525	the_feel_felt_found+ownership_language+energy_matching	discard	add_energy_matching
6706	5.450	the_feel_felt_found+ownership_language	discard	tone_change
6707	5.138	the_feel_felt_found+ownership_language+proactive_extras	discard	add_proactive_extras
6708	5.025	the_feel_felt_found+ownership_language+personal_touch	discard	add_personal_touch
6709	5.350	the_feel_felt_found+ownership_language+concrete_next_steps	discard	add_concrete_next_steps
6710	5.237	ownership_language	discard	remove_the_feel_felt_found
6711	5.425	the_feel_felt_found+ownership_language+energy_matching	discard	add_energy_matching
6712	5.238	the_feel_felt_found+ownership_language+genuine_admission	discard	add_genuine_admission
6713	5.038	the_feel_felt_found+ownership_language	discard	temp_0.65
6714	5.112	ownership_language+warmth_injection	discard	swap_the_feel_felt_found_for_warmth_injection
6715	5.450	the_feel_felt_found+ownership_language	discard	temp_0.85
6716	5.138	the_feel_felt_found	discard	crossover
6717	5.325	the_feel_felt_found+ownership_language	discard	tone_change
6718	5.237	the_feel_felt_found+ownership_language	discard	temp_0.70
6719	5.550	the_feel_felt_found+ownership_language	discard	temp_0.95
6720	5.437	the_feel_felt_found+personal_touch	discard	swap_ownership_language_for_personal_touch
6721	5.200	the_feel_felt_found	discard	remove_ownership_language
6722	5.025	the_feel_felt_found+ownership_language	discard	crossover
6723	5.013	the_feel_felt_found+ownership_language+genuine_admission	discard	add_genuine_admission
6724	4.612	ownership_language+personal_touch	discard	swap_the_feel_felt_found_for_personal_touch
6725	5.325	the_feel_felt_found+ownership_language+energy_matching	discard	add_energy_matching
6726	5.200	the_feel_felt_found+ownership_language+emotional_labeling	discard	add_emotional_labeling
6727	4.888	the_feel_felt_found+ownership_language+casual_professionalism	discard	add_casual_professionalism
6728	5.450	the_feel_felt_found+ownership_language	discard	crossover
6729	5.237	the_feel_felt_found+ownership_language+concrete_next_steps	discard	add_concrete_next_steps
6730	5.337	the_feel_felt_found	discard	remove_ownership_language
6731	5.450	the_feel_felt_found+ownership_language	discard	crossover
6732	5.550	the_feel_felt_found+ownership_language	discard	temp_0.70
6733	5.325	the_feel_felt_found+ownership_language+never_say_calm_down	discard	add_never_say_calm_down
6734	5.450	the_feel_felt_found	discard	crossover
6735	4.925	the_feel_felt_found+ownership_language	discard	tone_change
6736	5.013	the_feel_felt_found+ownership_language	discard	tone_change
6737	5.425	ownership_language+warmth_injection	discard	swap_the_feel_felt_found_for_warmth_injection
6738	5.325	the_feel_felt_found	discard	crossover
6739	5.425	the_feel_felt_found+ownership_language	discard	tone_change
6740	5.175	the_feel_felt_found+emotional_labeling	discard	swap_ownership_language_for_emotional_labeling
6741	5.425	the_feel_felt_found+ownership_language	discard	tone_change
6742	5.112	ownership_language+warmth_injection	discard	swap_the_feel_felt_found_for_warmth_injection
6743	5.450	ownership_language	discard	crossover
6744	4.925	the_feel_felt_found+ownership_language	discard	tone_change
6745	5.013	the_feel_felt_found+ownership_language	discard	tone_change
6746	5.325	the_feel_felt_found+ownership_language	discard	crossover
6747	5.200	the_feel_felt_found+emotional_labeling	discard	swap_ownership_language_for_emotional_labeling
6748	5.425	the_feel_felt_found+ownership_language+validation_before_solution	discard	add_validation_before_solution
6749	4.700	the_feel_felt_found+ownership_language+strategic_agreement	discard	add_strategic_agreement
6750	5.450	ownership_language	discard	remove_the_feel_felt_found
6751	5.325	ownership_language+proactive_extras	discard	swap_the_feel_felt_found_for_proactive_extras
6752	5.037	the_feel_felt_found+ownership_language	discard	temp_0.90
6753	5.425	the_feel_felt_found+ownership_language+warmth_injection	discard	add_warmth_injection
6754	5.450	the_feel_felt_found+ownership_language	discard	temp_0.65
6755	4.825	the_feel_felt_found+ownership_language+genuine_admission	discard	add_genuine_admission
6756	5.138	the_feel_felt_found+ownership_language	discard	temp_0.85
6757	5.450	the_feel_felt_found+ownership_language	discard	tone_change
6758	5.200	the_feel_felt_found+never_say_calm_down	discard	swap_ownership_language_for_never_say_calm_down
6759	5.250	the_feel_felt_found+warmth_injection	discard	swap_ownership_language_for_warmth_injection
6760	5.350	the_feel_felt_found+ownership_language+never_say_calm_down	discard	add_never_say_calm_down
6761	5.450	the_feel_felt_found+ownership_language	discard	tone_change
6762	5.013	the_feel_felt_found+ownership_language+warmth_injection	discard	add_warmth_injection
6763	5.025	the_feel_felt_found+ownership_language+mirroring	discard	add_mirroring
6764	5.450	the_feel_felt_found	discard	crossover
6765	4.925	the_feel_felt_found+ownership_language	discard	tone_change
6766	5.550	the_feel_felt_found+ownership_language+personal_touch	discard	add_personal_touch
6767	5.125	the_feel_felt_found+ownership_language+energy_matching	discard	add_energy_matching
6768	5.325	the_feel_felt_found+ownership_language	discard	temp_0.70
6769	5.013	the_feel_felt_found+ownership_language	discard	crossover
6770	5.550	the_feel_felt_found+ownership_language	discard	tone_change
6771	4.900	ownership_language	discard	crossover
6772	5.550	the_feel_felt_found+ownership_language	discard	tone_change
6773	5.225	the_feel_felt_found+ownership_language+validation_before_solution	discard	add_validation_before_solution
6774	4.800	the_feel_felt_found+ownership_language+emotional_labeling	discard	add_emotional_labeling
6775	5.550	ownership_language	discard	remove_the_feel_felt_found
6776	5.238	the_feel_felt_found+ownership_language	discard	temp_0.70
6777	4.700	the_feel_felt_found+ownership_language+warmth_injection	discard	add_warmth_injection
6778	5.100	the_feel_felt_found+ownership_language	discard	tone_change
6779	5.138	ownership_language+strategic_agreement	discard	swap_the_feel_felt_found_for_strategic_agreement
6780	5.213	the_feel_felt_found+ownership_language	discard	tone_change
6781	5.138	the_feel_felt_found+ownership_language	discard	tone_change
6782	5.450	the_feel_felt_found+ownership_language	discard	crossover
6783	5.225	ownership_language+proactive_extras	discard	swap_the_feel_felt_found_for_proactive_extras
6784	5.550	the_feel_felt_found+ownership_language	discard	crossover
6785	5.113	ownership_language+proactive_extras	discard	swap_the_feel_felt_found_for_proactive_extras
6786	5.200	the_feel_felt_found+ownership_language+personal_touch	discard	add_personal_touch
6787	5.550	the_feel_felt_found+mirroring	discard	swap_ownership_language_for_mirroring
6788	5.138	the_feel_felt_found+ownership_language+concrete_next_steps	discard	add_concrete_next_steps
6789	4.763	the_feel_felt_found+ownership_language	discard	crossover
6790	4.700	the_feel_felt_found	discard	remove_ownership_language
6791	4.825	the_feel_felt_found+ownership_language+proactive_extras	discard	add_proactive_extras
6792	5.450	ownership_language+casual_professionalism	discard	swap_the_feel_felt_found_for_casual_professionalism
6793	5.550	the_feel_felt_found+ownership_language+genuine_admission	discard	add_genuine_admission
6794	5.200	the_feel_felt_found+ownership_language	discard	tone_change
6795	5.450	the_feel_felt_found+ownership_language	discard	tone_change
6796	5.350	the_feel_felt_found+ownership_language+warmth_injection	discard	add_warmth_injection
6797	5.138	the_feel_felt_found+validation_before_solution	discard	swap_ownership_language_for_validation_before_solution
6798	5.650	the_feel_felt_found+ownership_language	discard	tone_change
6799	5.250	the_feel_felt_found+ownership_language	discard	temp_0.85
6800	4.825	the_feel_felt_found+ownership_language	discard	tone_change
6801	5.013	the_feel_felt_found+ownership_language	discard	tone_change
6802	5.450	the_feel_felt_found+ownership_language	discard	tone_change
6803	5.550	the_feel_felt_found+ownership_language+casual_professionalism	discard	add_casual_professionalism
6804	5.138	the_feel_felt_found+ownership_language	discard	tone_change
6805	5.213	the_feel_felt_found+ownership_language	discard	tone_change
6806	5.112	the_feel_felt_found+ownership_language	discard	temp_0.65
6807	5.312	ownership_language	discard	remove_the_feel_felt_found
6808	4.575	the_feel_felt_found+ownership_language+validation_before_solution	discard	add_validation_before_solution
6809	5.200	the_feel_felt_found	discard	crossover
6810	5.138	the_feel_felt_found+ownership_language	discard	tone_change
6811	5.225	the_feel_felt_found+ownership_language+personal_touch	discard	add_personal_touch
6812	5.450	the_feel_felt_found+ownership_language+genuine_admission	discard	add_genuine_admission
6813	5.138	the_feel_felt_found+ownership_language+warmth_injection	discard	add_warmth_injection
6814	5.325	the_feel_felt_found+warmth_injection	discard	swap_ownership_language_for_warmth_injection
6815	5.350	the_feel_felt_found+ownership_language	discard	tone_change
6816	5.337	the_feel_felt_found+ownership_language	discard	temp_0.70
6817	5.138	the_feel_felt_found+ownership_language	discard	tone_change
6818	4.612	the_feel_felt_found+ownership_language	discard	temp_0.95
6819	5.325	ownership_language	discard	remove_the_feel_felt_found
6820	5.112	the_feel_felt_found+ownership_language	discard	tone_change
6821	5.138	the_feel_felt_found+ownership_language	discard	crossover
6822	5.237	ownership_language	discard	crossover
6823	5.450	the_feel_felt_found+ownership_language	discard	tone_change
6824	5.550	the_feel_felt_found+casual_professionalism	discard	swap_ownership_language_for_casual_professionalism
6825	4.825	the_feel_felt_found+ownership_language+proactive_extras	discard	add_proactive_extras
6826	5.550	the_feel_felt_found+ownership_language	discard	crossover
6827	5.325	the_feel_felt_found+ownership_language	discard	crossover
6828	4.900	the_feel_felt_found	discard	crossover
6829	5.013	the_feel_felt_found+ownership_language+concrete_next_steps	discard	add_concrete_next_steps
6830	5.550	the_feel_felt_found+ownership_language	discard	crossover
6831	5.338	the_feel_felt_found+ownership_language	discard	temp_0.90
6832	5.350	ownership_language+mirroring	discard	swap_the_feel_felt_found_for_mirroring
6833	5.550	the_feel_felt_found+ownership_language+casual_professionalism	discard	add_casual_professionalism
6834	5.013	ownership_language+mirroring	discard	swap_the_feel_felt_found_for_mirroring
6835	5.200	ownership_language	discard	crossover
6836	5.013	the_feel_felt_found+ownership_language	discard	crossover
6837	5.225	the_feel_felt_found+ownership_language	discard	tone_change
6838	5.225	the_feel_felt_found+ownership_language	discard	tone_change
6839	5.325	the_feel_felt_found+personal_touch	discard	swap_ownership_language_for_personal_touch
6840	5.138	the_feel_felt_found+ownership_language+energy_matching	discard	add_energy_matching
6841	5.138	the_feel_felt_found+ownership_language+personal_touch	discard	add_personal_touch
6842	4.987	the_feel_felt_found+ownership_language	discard	tone_change
6843	5.138	ownership_language+warmth_injection	discard	swap_the_feel_felt_found_for_warmth_injection
6844	5.112	the_feel_felt_found+ownership_language	discard	temp_0.90
6845	4.925	the_feel_felt_found	discard	crossover
6846	5.200	the_feel_felt_found+ownership_language+energy_matching	discard	add_energy_matching
6847	5.013	the_feel_felt_found+ownership_language+validation_before_solution	discard	add_validation_before_solution
6848	5.550	ownership_language+validation_before_solution	discard	swap_the_feel_felt_found_for_validation_before_solution
6849	5.525	the_feel_felt_found+ownership_language	discard	tone_change
6850	5.425	the_feel_felt_found+ownership_language	discard	tone_change
6851	5.325	ownership_language+genuine_admission	discard	swap_the_feel_felt_found_for_genuine_admission
6852	5.138	the_feel_felt_found+ownership_language	discard	temp_0.90
6853	4.925	the_feel_felt_found+ownership_language+never_say_calm_down	discard	add_never_say_calm_down
6854	5.138	the_feel_felt_found+ownership_language	discard	crossover
6855	5.138	the_feel_felt_found+ownership_language+never_say_calm_down	discard	add_never_say_calm_down
6856	5.237	the_feel_felt_found+ownership_language+strategic_agreement	discard	add_strategic_agreement
6857	5.325	the_feel_felt_found	discard	remove_ownership_language
6858	5.450	the_feel_felt_found+ownership_language+energy_matching	discard	add_energy_matching
6859	5.238	the_feel_felt_found+ownership_language	discard	temp_0.65
6860	4.763	the_feel_felt_found+ownership_language	discard	tone_change
6861	5.338	the_feel_felt_found+ownership_language	discard	temp_0.85
6862	5.425	ownership_language+concrete_next_steps	discard	swap_the_feel_felt_found_for_concrete_next_steps
6863	5.550	the_feel_felt_found+ownership_language	discard	tone_change
6864	5.237	the_feel_felt_found+ownership_language+genuine_admission	discard	add_genuine_admission
6865	5.237	ownership_language	discard	remove_the_feel_felt_found
6866	4.987	ownership_language+concrete_next_steps	discard	swap_the_feel_felt_found_for_concrete_next_steps
6867	5.238	the_feel_felt_found+ownership_language	discard	crossover
6868	5.450	the_feel_felt_found+concrete_next_steps	discard	swap_ownership_language_for_concrete_next_steps
6869	5.450	the_feel_felt_found	discard	crossover
6870	5.312	ownership_language+energy_matching	discard	swap_the_feel_felt_found_for_energy_matching
6871	5.237	the_feel_felt_found+ownership_language+concrete_next_steps	discard	add_concrete_next_steps
6872	5.013	ownership_language+casual_professionalism	discard	swap_the_feel_felt_found_for_casual_professionalism
6873	4.600	the_feel_felt_found+concrete_next_steps	discard	swap_ownership_language_for_concrete_next_steps
6874	5.238	the_feel_felt_found+mirroring	discard	swap_ownership_language_for_mirroring
6875	5.112	the_feel_felt_found+ownership_language+warmth_injection	discard	add_warmth_injection
6876	5.025	ownership_language	discard	crossover
6877	5.325	the_feel_felt_found	discard	remove_ownership_language
6878	5.325	the_feel_felt_found+ownership_language+genuine_admission	discard	add_genuine_admission
6879	5.337	the_feel_felt_found+ownership_language	discard	temp_0.90
6880	5.013	the_feel_felt_found+ownership_language	discard	tone_change
6881	5.650	the_feel_felt_found+ownership_language	discard	tone_change
6882	4.700	the_feel_felt_found+ownership_language	discard	tone_change
6883	5.037	the_feel_felt_found	discard	remove_ownership_language
6884	5.100	the_feel_felt_found+ownership_language	discard	temp_0.85
6885	5.550	the_feel_felt_found+ownership_language	discard	temp_0.85
6886	4.825	the_feel_felt_found+ownership_language	discard	crossover
6887	5.112	the_feel_felt_found+ownership_language+genuine_admission	discard	add_genuine_admission
6888	5.300	ownership_language	discard	crossover
6889	5.213	the_feel_felt_found+ownership_language	discard	tone_change
6890	5.450	the_feel_felt_found+ownership_language	discard	tone_change
6891	5.338	the_feel_felt_found+ownership_language	discard	tone_change
6892	5.138	the_feel_felt_found+ownership_language+mirroring	discard	add_mirroring
6893	5.650	the_feel_felt_found+ownership_language	discard	crossover
6894	5.450	the_feel_felt_found+ownership_language	discard	crossover
6895	5.550	the_feel_felt_found+ownership_language+strategic_agreement	discard	add_strategic_agreement
6896	4.925	the_feel_felt_found+ownership_language+energy_matching	discard	add_energy_matching
6897	5.450	the_feel_felt_found+casual_professionalism	discard	swap_ownership_language_for_casual_professionalism
6898	5.325	the_feel_felt_found+ownership_language	discard	tone_change
6899	4.925	the_feel_felt_found	discard	remove_ownership_language
6900	5.450	the_feel_felt_found+ownership_language	discard	crossover
6901	5.650	ownership_language	discard	crossover
6902	5.112	the_feel_felt_found+ownership_language	discard	tone_change
6903	5.550	the_feel_felt_found+ownership_language	discard	temp_0.75
6904	5.325	ownership_language+warmth_injection	discard	swap_the_feel_felt_found_for_warmth_injection
6905	5.325	the_feel_felt_found+ownership_language	discard	tone_change
6906	5.138	the_feel_felt_found+ownership_language	discard	temp_0.65
6907	5.450	the_feel_felt_found	discard	remove_ownership_language
6908	5.013	the_feel_felt_found+ownership_language	discard	tone_change
6909	5.013	ownership_language+personal_touch	discard	swap_the_feel_felt_found_for_personal_touch
6910	5.450	the_feel_felt_found+ownership_language+proactive_extras	discard	add_proactive_extras
6911	4.600	the_feel_felt_found+ownership_language	discard	temp_0.70
6912	4.800	the_feel_felt_found+casual_professionalism	discard	swap_ownership_language_for_casual_professionalism
6913	5.325	the_feel_felt_found+ownership_language	discard	tone_change
6914	5.550	the_feel_felt_found+ownership_language+genuine_admission	discard	add_genuine_admission
6915	5.450	ownership_language	discard	crossover
6916	5.138	ownership_language+concrete_next_steps	discard	swap_the_feel_felt_found_for_concrete_next_steps
6917	5.138	the_feel_felt_found	discard	crossover
6918	5.112	the_feel_felt_found+ownership_language	discard	temp_0.75
6919	5.550	the_feel_felt_found+ownership_language	discard	tone_change
6920	4.925	the_feel_felt_found+ownership_language	discard	tone_change
6921	5.338	the_feel_felt_found+ownership_language	discard	crossover
6922	5.013	ownership_language	discard	remove_the_feel_felt_found
6923	5.325	none	discard	crossover
6924	5.325	the_feel_felt_found+ownership_language+energy_matching	discard	add_energy_matching
6925	5.525	the_feel_felt_found+ownership_language	discard	tone_change
6926	5.325	the_feel_felt_found+ownership_language+never_say_calm_down	discard	add_never_say_calm_down
6927	5.013	ownership_language+warmth_injection	discard	swap_the_feel_felt_found_for_warmth_injection
6928	5.525	ownership_language	discard	remove_the_feel_felt_found
6929	5.450	the_feel_felt_found+ownership_language+mirroring	discard	add_mirroring
6930	4.800	the_feel_felt_found+ownership_language	discard	tone_change
6931	5.213	ownership_language+casual_professionalism	discard	swap_the_feel_felt_found_for_casual_professionalism
6932	5.425	the_feel_felt_found+ownership_language	discard	temp_0.90
6933	5.138	the_feel_felt_found+ownership_language	discard	crossover
6934	5.200	the_feel_felt_found+ownership_language	discard	tone_change
6935	5.237	the_feel_felt_found+ownership_language+energy_matching	discard	add_energy_matching
6936	5.112	the_feel_felt_found+ownership_language	discard	temp_0.85
6937	5.325	the_feel_felt_found+ownership_language+validation_before_solution	discard	add_validation_before_solution
6938	5.138	the_feel_felt_found+ownership_language	discard	crossover
6939	5.112	the_feel_felt_found+ownership_language	discard	crossover
6940	5.425	the_feel_felt_found+ownership_language+genuine_admission	discard	add_genuine_admission
6941	4.888	the_feel_felt_found+ownership_language	discard	tone_change
6942	4.700	the_feel_felt_found+ownership_language+concrete_next_steps	discard	add_concrete_next_steps
6943	5.213	the_feel_felt_found+ownership_language	discard	tone_change
6944	4.825	the_feel_felt_found+ownership_language	discard	tone_change
6945	5.237	the_feel_felt_found+never_say_calm_down	discard	swap_ownership_language_for_never_say_calm_down
6946	5.200	the_feel_felt_found+ownership_language+casual_professionalism	discard	add_casual_professionalism
6947	5.550	the_feel_felt_found+ownership_language	discard	temp_0.75
6948	5.325	the_feel_felt_found+ownership_language+casual_professionalism	discard	add_casual_professionalism
6949	5.138	the_feel_felt_found+ownership_language+concrete_next_steps	discard	add_concrete_next_steps
6950	5.350	the_feel_felt_found+ownership_language	discard	crossover
6951	5.325	ownership_language	discard	crossover
6952	5.425	the_feel_felt_found+emotional_labeling	discard	swap_ownership_language_for_emotional_labeling
6953	5.550	ownership_language+never_say_calm_down	discard	swap_the_feel_felt_found_for_never_say_calm_down
6954	4.888	the_feel_felt_found+ownership_language	discard	crossover
6955	5.650	the_feel_felt_found+ownership_language	discard	tone_change
6956	5.200	ownership_language+emotional_labeling	discard	swap_the_feel_felt_found_for_emotional_labeling
6957	4.925	the_feel_felt_found+ownership_language+validation_before_solution	discard	add_validation_before_solution
6958	5.237	the_feel_felt_found+ownership_language	discard	tone_change
6959	5.550	the_feel_felt_found+ownership_language	discard	tone_change
6960	5.650	the_feel_felt_found+genuine_admission	discard	swap_ownership_language_for_genuine_admission
6961	5.237	the_feel_felt_found+ownership_language	discard	tone_change
6962	5.650	the_feel_felt_found+ownership_language	discard	tone_change
6963	5.450	ownership_language	discard	crossover
6964	5.650	the_feel_felt_found+ownership_language+validation_before_solution	discard	add_validation_before_solution
6965	5.550	the_feel_felt_found+ownership_language	discard	tone_change
6966	5.213	the_feel_felt_found+ownership_language+concrete_next_steps	discard	add_concrete_next_steps
6967	5.450	the_feel_felt_found+emotional_labeling	discard	swap_ownership_language_for_emotional_labeling
6968	5.075	the_feel_felt_found+ownership_language	discard	temp_0.70
6969	5.138	the_feel_felt_found+ownership_language	discard	crossover
6970	5.350	the_feel_felt_found+ownership_language	discard	tone_change
6971	5.138	the_feel_felt_found+ownership_language+genuine_admission	discard	add_genuine_admission
6972	5.338	the_feel_felt_found+warmth_injection	discard	swap_ownership_language_for_warmth_injection
6973	5.325	the_feel_felt_found+ownership_language	discard	tone_change
6974	5.112	the_feel_felt_found+ownership_language	discard	crossover
6975	5.450	the_feel_felt_found+ownership_language+personal_touch	discard	add_personal_touch
