generation	eq_score	techniques	status	description
12461	5.450	the_feel_felt_found	discard	remove_ownership_language
12462	5.237	the_feel_felt_found+ownership_language	discard	tone_change
12463	5.112	the_feel_felt_found+ownership_language	discard	tone_change
12464	5.013	the_feel_felt_found+ownership_language	discard	temp_0.75
12465	5.013	the_feel_felt_found+ownership_language	discard	tone_change
12466	5.200	the_feel_felt_found+ownership_language	discard	crossover
12467	5.450	the_feel_felt_found+concrete_next_steps	discard	swap_ownership_language_for_concrete_next_steps
12468	5.138	the_feel_felt_found+ownership_language+mirroring	discard	add_mirroring
12469	5.325	the_feel_felt_found+ownership_language	discard	temp_0.90
12470	5.013	the_feel_felt_found+ownership_language+proactive_extras	discard	add_proactive_extras
12471	5.138	the_feel_felt_found+ownership_language	discard	crossover
12472	5.038	the_feel_felt_found+ownership_language	discard	crossover
12473	5.550	the_feel_felt_found+ownership_language	discard	tone_change
12474	5.325	the_feel_felt_found+ownership_language+proactive_extras	discard	add_proactive_extras
12475	5.450	the_feel_felt_found	discard	remove_ownership_language
12476	5.450	the_feel_felt_found+ownership_language	discard	tone_change
12477	5.450	the_feel_felt_found+ownership_language+mirroring	discard	add_mirroring
12478	5.550	the_feel_felt_found+ownership_language+mirroring	discard	add_mirroring
12479	5.013	the_feel_felt_found	discard	remove_ownership_language
12480	5.550	the_feel_felt_found+ownership_language+personal_touch	discard	add_personal_touch
12481	4.700	the_feel_felt_found+ownership_language+concrete_next_steps	discard	add_concrete_next_steps
12482	5.138	the_feel_felt_found+emotional_labeling	discard	swap_ownership_language_for_emotional_labeling
12483	5.325	the_feel_felt_found+casual_professionalism	discard	swap_ownership_language_for_casual_professionalism
12484	5.125	the_feel_felt_found+ownership_language	discard	crossover
12485	5.238	the_feel_felt_found	discard	crossover
12486	5.325	the_feel_felt_found+ownership_language	discard	tone_change
12487	4.925	the_feel_felt_found+ownership_language+proactive_extras	discard	add_proactive_extras
12488	5.238	the_feel_felt_found+ownership_language	discard	temp_0.65
12489	5.138	the_feel_felt_found	discard	remove_ownership_language
12490	5.450	the_feel_felt_found+ownership_language	discard	crossover
12491	5.213	ownership_language+casual_professionalism	discard	swap_the_feel_felt_found_for_casual_professionalism
12492	5.550	the_feel_felt_found+ownership_language	discard	temp_0.70
12493	5.550	the_feel_felt_found+ownership_language+mirroring	discard	add_mirroring
12494	4.825	the_feel_felt_found+ownership_language+energy_matching	discard	add_energy_matching
12495	5.112	ownership_language+proactive_extras	discard	swap_the_feel_felt_found_for_proactive_extras
12496	5.650	ownership_language	discard	remove_the_feel_felt_found
12497	5.550	ownership_language	discard	crossover
12498	5.237	the_feel_felt_found+ownership_language	discard	crossover
12499	5.138	the_feel_felt_found+ownership_language	discard	temp_0.75
12500	5.225	the_feel_felt_found+ownership_language	discard	crossover
12501	5.213	the_feel_felt_found+ownership_language	discard	tone_change
12502	5.450	the_feel_felt_found+ownership_language	discard	tone_change
12503	5.138	the_feel_felt_found+personal_touch	discard	swap_ownership_language_for_personal_touch
12504	5.450	the_feel_felt_found+ownership_language	discard	temp_0.65
12505	5.450	the_feel_felt_found+ownership_language	discard	tone_change
12506	5.425	the_feel_felt_found	discard	remove_ownership_language
12507	5.450	the_feel_felt_found+ownership_language	discard	temp_0.90
12508	5.225	the_feel_felt_found+ownership_language	discard	temp_0.90
12509	5.013	the_feel_felt_found+ownership_language	discard	crossover
12510	5.300	the_feel_felt_found+ownership_language+energy_matching	discard	add_energy_matching
12511	5.325	the_feel_felt_found	discard	remove_ownership_language
12512	5.325	ownership_language	discard	crossover
12513	5.450	the_feel_felt_found+ownership_language+genuine_admission	discard	add_genuine_admission
12514	5.225	the_feel_felt_found+ownership_language	discard	temp_0.85
12515	5.338	the_feel_felt_found+ownership_language	discard	tone_change
12516	5.138	the_feel_felt_found+ownership_language	discard	tone_change
12517	5.450	the_feel_felt_found	discard	remove_ownership_language
12518	5.450	the_feel_felt_found	discard	crossover
12519	5.138	the_feel_felt_found+mirroring	discard	swap_ownership_language_for_mirroring
12520	4.825	the_feel_felt_found+emotional_labeling	discard	swap_ownership_language_for_emotional_labeling
12521	5.013	the_feel_felt_found+ownership_language+validation_before_solution	discard	add_validation_before_solution
12522	5.450	the_feel_felt_found+ownership_language	discard	crossover
12523	5.013	the_feel_felt_found+ownership_language	discard	tone_change
12524	5.338	none	discard	crossover
12525	5.550	the_feel_felt_found+ownership_language+proactive_extras	discard	add_proactive_extras
12526	5.138	the_feel_felt_found+ownership_language	discard	tone_change
12527	5.337	the_feel_felt_found+mirroring	discard	swap_ownership_language_for_mirroring
12528	5.237	the_feel_felt_found+ownership_language	discard	crossover
12529	5.013	the_feel_felt_found	discard	crossover
12530	5.013	the_feel_felt_found+ownership_language	discard	temp_0.90
12531	5.112	the_feel_felt_found+ownership_language	discard	tone_change
12532	5.325	the_feel_felt_found+ownership_language	discard	tone_change
12533	5.013	the_feel_felt_found+ownership_language+mirroring	discard	add_mirroring
12534	5.450	the_feel_felt_found+ownership_language	discard	crossover
12535	5.225	the_feel_felt_found+ownership_language+emotional_labeling	discard	add_emotional_labeling
12536	5.325	the_feel_felt_found+ownership_language+validation_before_solution	discard	add_validation_before_solution
12537	5.425	ownership_language+casual_professionalism	discard	swap_the_feel_felt_found_for_casual_professionalism
12538	4.925	the_feel_felt_found+ownership_language+genuine_admission	discard	add_genuine_admission
12539	5.338	the_feel_felt_found+ownership_language	discard	tone_change
12540	4.912	the_feel_felt_found	discard	crossover
12541	5.525	the_feel_felt_found+ownership_language	discard	crossover
12542	5.237	ownership_language	discard	crossover
12543	5.450	ownership_language	discard	crossover
12544	5.138	the_feel_felt_found+ownership_language	discard	crossover
12545	5.450	the_feel_felt_found+ownership_language+genuine_admission	discard	add_genuine_admission
12546	5.425	the_feel_felt_found+ownership_language+emotional_labeling	discard	add_emotional_labeling
12547	5.438	the_feel_felt_found+ownership_language	discard	temp_0.75
12548	5.250	the_feel_felt_found+ownership_language	discard	tone_change
12549	5.200	the_feel_felt_found+ownership_language	discard	tone_change
12550	5.237	ownership_language+strategic_agreement	discard	swap_the_feel_felt_found_for_strategic_agreement
12551	5.325	the_feel_felt_found+ownership_language	discard	tone_change
12552	5.138	ownership_language	discard	remove_the_feel_felt_found
12553	5.300	the_feel_felt_found+ownership_language	discard	crossover
12554	5.437	the_feel_felt_found+ownership_language	discard	temp_0.65
12555	5.425	the_feel_felt_found+ownership_language+strategic_agreement	discard	add_strategic_agreement
12556	5.112	the_feel_felt_found+ownership_language	discard	temp_0.65
12557	4.700	the_feel_felt_found+ownership_language	discard	tone_change
12558	5.450	the_feel_felt_found+ownership_language	discard	temp_0.65
12559	5.112	the_feel_felt_found+ownership_language+mirroring	discard	add_mirroring
12560	4.912	the_feel_felt_found	discard	remove_ownership_language
12561	5.013	the_feel_felt_found+ownership_language	discard	tone_change
12562	5.550	ownership_language+mirroring	discard	swap_the_feel_felt_found_for_mirroring
12563	4.825	ownership_language	discard	crossover
12564	5.425	the_feel_felt_found+ownership_language+emotional_labeling	discard	add_emotional_labeling
12565	5.550	ownership_language	discard	remove_the_feel_felt_found
12566	5.138	the_feel_felt_found+ownership_language	discard	tone_change
12567	5.012	the_feel_felt_found+ownership_language	discard	crossover
12568	5.225	the_feel_felt_found+ownership_language	discard	tone_change
12569	4.513	the_feel_felt_found+ownership_language+proactive_extras	discard	add_proactive_extras
12570	5.425	the_feel_felt_found+ownership_language	discard	tone_change
12571	5.450	the_feel_felt_found+ownership_language	discard	temp_0.90
12572	5.325	the_feel_felt_found+ownership_language+casual_professionalism	discard	add_casual_professionalism
12573	5.113	the_feel_felt_found+ownership_language	discard	crossover
12574	5.425	the_feel_felt_found+ownership_language+validation_before_solution	discard	add_validation_before_solution
12575	5.350	the_feel_felt_found+ownership_language	discard	temp_0.85
12576	5.200	the_feel_felt_found+ownership_language	discard	temp_0.95
12577	5.550	the_feel_felt_found+ownership_language+emotional_labeling	discard	add_emotional_labeling
12578	5.225	the_feel_felt_found+ownership_language+genuine_admission	discard	add_genuine_admission
12579	5.137	the_feel_felt_found+ownership_language+proactive_extras	discard	add_proactive_extras
12580	4.987	the_feel_felt_found+ownership_language+genuine_admission	discard	add_genuine_admission
12581	5.112	ownership_language+personal_touch	discard	swap_the_feel_felt_found_for_personal_touch
12582	5.238	ownership_language	discard	crossover
12583	5.525	the_feel_felt_found+ownership_language+validation_before_solution	discard	add_validation_before_solution
12584	5.013	the_feel_felt_found+ownership_language+validation_before_solution	discard	add_validation_before_solution
12585	5.450	ownership_language	discard	remove_the_feel_felt_found
12586	5.138	the_feel_felt_found+ownership_language+genuine_admission	discard	add_genuine_admission
12587	5.550	the_feel_felt_found+ownership_language	discard	crossover
12588	5.138	the_feel_felt_found+ownership_language+concrete_next_steps	discard	add_concrete_next_steps
12589	5.238	the_feel_felt_found+ownership_language+genuine_admission	discard	add_genuine_admission
12590	5.112	the_feel_felt_found+ownership_language	discard	tone_change
12591	5.013	the_feel_felt_found+ownership_language+energy_matching	discard	add_energy_matching
12592	5.325	the_feel_felt_found+ownership_language	discard	temp_0.85
12593	5.425	the_feel_felt_found+energy_matching	discard	swap_ownership_language_for_energy_matching
12594	5.325	the_feel_felt_found+ownership_language+emotional_labeling	discard	add_emotional_labeling
12595	5.237	the_feel_felt_found+ownership_language	discard	crossover
12596	4.825	the_feel_felt_found+ownership_language+never_say_calm_down	discard	add_never_say_calm_down
12597	5.450	the_feel_felt_found+ownership_language	discard	tone_change
12598	5.450	the_feel_felt_found+ownership_language	discard	crossover
12599	5.013	ownership_language	discard	remove_the_feel_felt_found
12600	5.325	the_feel_felt_found	discard	remove_ownership_language
12601	5.650	the_feel_felt_found	discard	remove_ownership_language
12602	5.200	the_feel_felt_found+ownership_language+validation_before_solution	discard	add_validation_before_solution
12603	4.700	the_feel_felt_found+emotional_labeling	discard	swap_ownership_language_for_emotional_labeling
12604	5.138	the_feel_felt_found+genuine_admission	discard	swap_ownership_language_for_genuine_admission
12605	5.325	the_feel_felt_found+ownership_language	discard	tone_change
12606	5.237	the_feel_felt_found+ownership_language	discard	crossover
12607	5.325	the_feel_felt_found+ownership_language+genuine_admission	discard	add_genuine_admission
12608	5.325	the_feel_felt_found+ownership_language+casual_professionalism	discard	add_casual_professionalism
12609	5.175	the_feel_felt_found+ownership_language	discard	tone_change
12610	5.425	the_feel_felt_found+ownership_language+energy_matching	discard	add_energy_matching
12611	5.138	ownership_language	discard	crossover
12612	5.013	the_feel_felt_found+ownership_language	discard	temp_0.65
12613	5.037	ownership_language+energy_matching	discard	swap_the_feel_felt_found_for_energy_matching
12614	5.138	ownership_language	discard	crossover
12615	5.325	the_feel_felt_found+ownership_language	discard	temp_0.75
12616	5.237	the_feel_felt_found+emotional_labeling	discard	swap_ownership_language_for_emotional_labeling
12617	5.350	the_feel_felt_found+emotional_labeling	discard	swap_ownership_language_for_emotional_labeling
12618	5.550	ownership_language	discard	crossover
12619	5.425	the_feel_felt_found	discard	crossover
12620	5.650	the_feel_felt_found+energy_matching	discard	swap_ownership_language_for_energy_matching
12621	5.013	the_feel_felt_found+ownership_language	discard	tone_change
12622	5.013	the_feel_felt_found+ownership_language	discard	tone_change
12623	5.450	ownership_language+emotional_labeling	discard	swap_the_feel_felt_found_for_emotional_labeling
12624	5.338	the_feel_felt_found+ownership_language	discard	temp_0.70
12625	5.425	the_feel_felt_found+ownership_language	discard	tone_change
12626	5.338	the_feel_felt_found+genuine_admission	discard	swap_ownership_language_for_genuine_admission
12627	5.325	the_feel_felt_found+ownership_language	discard	temp_0.70
12628	5.025	the_feel_felt_found+ownership_language	discard	tone_change
12629	5.425	the_feel_felt_found+ownership_language	discard	temp_0.65
12630	5.350	the_feel_felt_found+ownership_language	discard	crossover
12631	5.525	the_feel_felt_found+ownership_language	discard	tone_change
12632	5.237	the_feel_felt_found+casual_professionalism	discard	swap_ownership_language_for_casual_professionalism
12633	5.425	the_feel_felt_found+ownership_language+energy_matching	discard	add_energy_matching
12634	5.013	ownership_language	discard	remove_the_feel_felt_found
12635	5.200	the_feel_felt_found+ownership_language	discard	crossover
12636	5.525	the_feel_felt_found+emotional_labeling	discard	swap_ownership_language_for_emotional_labeling
12637	4.925	the_feel_felt_found+ownership_language+personal_touch	discard	add_personal_touch
12638	5.237	the_feel_felt_found+ownership_language	discard	temp_0.75
12639	5.425	the_feel_felt_found+ownership_language	discard	tone_change
12640	5.425	the_feel_felt_found+validation_before_solution	discard	swap_ownership_language_for_validation_before_solution
12641	5.450	the_feel_felt_found	discard	crossover
12642	5.550	the_feel_felt_found+ownership_language+genuine_admission	discard	add_genuine_admission
12643	5.425	the_feel_felt_found+ownership_language+personal_touch	discard	add_personal_touch
12644	5.225	the_feel_felt_found+ownership_language	discard	crossover
12645	5.013	the_feel_felt_found+ownership_language	discard	tone_change
12646	5.450	the_feel_felt_found+ownership_language	discard	crossover
12647	5.037	the_feel_felt_found+ownership_language+concrete_next_steps	discard	add_concrete_next_steps
12648	4.888	the_feel_felt_found+ownership_language+genuine_admission	discard	add_genuine_admission
12649	5.138	the_feel_felt_found+ownership_language	discard	temp_0.65
12650	4.900	the_feel_felt_found+ownership_language	discard	temp_0.65
12651	5.438	ownership_language	discard	remove_the_feel_felt_found
12652	4.987	ownership_language	discard	crossover
12653	5.237	the_feel_felt_found+ownership_language	discard	temp_0.95
12654	5.450	ownership_language	discard	remove_the_feel_felt_found
12655	5.200	the_feel_felt_found+ownership_language	discard	temp_0.65
12656	4.888	the_feel_felt_found+ownership_language	discard	tone_change
12657	5.138	the_feel_felt_found+ownership_language	discard	tone_change
12658	5.237	ownership_language	discard	remove_the_feel_felt_found
12659	5.325	the_feel_felt_found+ownership_language	discard	tone_change
12660	5.425	the_feel_felt_found+ownership_language	discard	tone_change
12661	4.825	ownership_language+strategic_agreement	discard	swap_the_feel_felt_found_for_strategic_agreement
12662	5.138	ownership_language+personal_touch	discard	swap_the_feel_felt_found_for_personal_touch
12663	5.325	the_feel_felt_found+ownership_language+personal_touch	discard	add_personal_touch
12664	5.025	the_feel_felt_found+ownership_language	discard	tone_change
12665	5.138	the_feel_felt_found+ownership_language	discard	crossover
12666	5.138	the_feel_felt_found	discard	crossover
12667	5.450	the_feel_felt_found+ownership_language	discard	tone_change
12668	4.925	none	discard	crossover
12669	5.325	the_feel_felt_found+ownership_language	discard	tone_change
12670	5.450	ownership_language	discard	remove_the_feel_felt_found
12671	5.550	the_feel_felt_found+ownership_language	discard	tone_change
12672	5.137	the_feel_felt_found+ownership_language	discard	temp_0.70
12673	5.325	the_feel_felt_found+ownership_language	discard	tone_change
12674	4.800	ownership_language+proactive_extras	discard	swap_the_feel_felt_found_for_proactive_extras
12675	4.825	the_feel_felt_found+ownership_language	discard	tone_change
12676	5.325	the_feel_felt_found+ownership_language+concrete_next_steps	discard	add_concrete_next_steps
12677	5.325	the_feel_felt_found+ownership_language	discard	tone_change
12678	5.450	ownership_language+proactive_extras	discard	swap_the_feel_felt_found_for_proactive_extras
12679	5.425	the_feel_felt_found+ownership_language+proactive_extras	discard	add_proactive_extras
12680	4.925	the_feel_felt_found+proactive_extras	discard	swap_ownership_language_for_proactive_extras
12681	5.338	the_feel_felt_found+ownership_language	discard	tone_change
12682	5.450	the_feel_felt_found+ownership_language+emotional_labeling	discard	add_emotional_labeling
12683	5.138	the_feel_felt_found+ownership_language+warmth_injection	discard	add_warmth_injection
12684	5.550	the_feel_felt_found+ownership_language	discard	tone_change
12685	5.450	the_feel_felt_found	discard	remove_ownership_language
12686	5.037	the_feel_felt_found+ownership_language+personal_touch	discard	add_personal_touch
12687	4.925	the_feel_felt_found+ownership_language+mirroring	discard	add_mirroring
12688	5.225	the_feel_felt_found+ownership_language+warmth_injection	discard	add_warmth_injection
12689	5.138	the_feel_felt_found+ownership_language	discard	crossover
12690	5.200	the_feel_felt_found+ownership_language	discard	temp_0.70
12691	5.037	the_feel_felt_found+ownership_language	discard	tone_change
12692	5.325	the_feel_felt_found+ownership_language	discard	tone_change
12693	5.350	the_feel_felt_found+ownership_language+mirroring	discard	add_mirroring
12694	5.550	the_feel_felt_found+ownership_language+mirroring	discard	add_mirroring
12695	5.237	the_feel_felt_found+proactive_extras	discard	swap_ownership_language_for_proactive_extras
12696	5.138	the_feel_felt_found+ownership_language+mirroring	discard	add_mirroring
12697	5.225	the_feel_felt_found+ownership_language+energy_matching	discard	add_energy_matching
12698	5.013	ownership_language+genuine_admission	discard	swap_the_feel_felt_found_for_genuine_admission
12699	5.425	the_feel_felt_found+ownership_language	discard	temp_0.90
12700	5.325	the_feel_felt_found+ownership_language+warmth_injection	discard	add_warmth_injection
12701	5.425	ownership_language+never_say_calm_down	discard	swap_the_feel_felt_found_for_never_say_calm_down
12702	4.925	the_feel_felt_found+ownership_language	discard	temp_0.85
12703	5.450	the_feel_felt_found+ownership_language	discard	tone_change
12704	5.425	the_feel_felt_found+ownership_language	discard	crossover
12705	5.112	the_feel_felt_found+ownership_language	discard	tone_change
12706	5.237	the_feel_felt_found+ownership_language+warmth_injection	discard	add_warmth_injection
12707	4.513	the_feel_felt_found+ownership_language	discard	tone_change
12708	5.200	ownership_language	discard	crossover
12709	5.237	the_feel_felt_found+ownership_language	discard	tone_change
12710	5.225	ownership_language+mirroring	discard	swap_the_feel_felt_found_for_mirroring
12711	5.650	the_feel_felt_found+ownership_language	discard	temp_0.70
12712	5.138	the_feel_felt_found+ownership_language	discard	tone_change
12713	5.213	the_feel_felt_found+ownership_language+mirroring	discard	add_mirroring
12714	5.238	ownership_language+concrete_next_steps	discard	swap_the_feel_felt_found_for_concrete_next_steps
12715	5.325	the_feel_felt_found+ownership_language+energy_matching	discard	add_energy_matching
12716	5.138	the_feel_felt_found+ownership_language	discard	temp_0.65
12717	5.237	the_feel_felt_found+ownership_language	discard	tone_change
12718	5.325	ownership_language	discard	remove_the_feel_felt_found
12719	5.450	ownership_language	discard	remove_the_feel_felt_found
12720	5.037	the_feel_felt_found+ownership_language	discard	crossover
12721	5.337	the_feel_felt_found+ownership_language	discard	temp_0.95
12722	5.238	the_feel_felt_found+ownership_language	discard	tone_change
12723	5.200	the_feel_felt_found+ownership_language	discard	temp_0.75
12724	5.338	the_feel_felt_found+ownership_language+genuine_admission	discard	add_genuine_admission
12725	5.325	the_feel_felt_found+ownership_language+genuine_admission	discard	add_genuine_admission
12726	5.013	the_feel_felt_found+ownership_language	discard	tone_change
12727	5.325	none	discard	crossover
12728	5.237	the_feel_felt_found+ownership_language	discard	tone_change
12729	5.037	the_feel_felt_found+ownership_language	discard	tone_change
12730	5.238	the_feel_felt_found+ownership_language	discard	temp_0.65
12731	5.013	the_feel_felt_found+ownership_language+warmth_injection	discard	add_warmth_injection
12732	5.450	the_feel_felt_found+ownership_language+warmth_injection	discard	add_warmth_injection
12733	5.013	the_feel_felt_found+ownership_language+warmth_injection	discard	add_warmth_injection
12734	5.138	the_feel_felt_found+proactive_extras	discard	swap_ownership_language_for_proactive_extras
12735	5.550	the_feel_felt_found+ownership_language+genuine_admission	discard	add_genuine_admission
12736	5.450	the_feel_felt_found+ownership_language+strategic_agreement	discard	add_strategic_agreement
