generation	eq_score	techniques	status	description
10822	5.138	ownership_language+emotional_labeling	discard	swap_the_feel_felt_found_for_emotional_labeling
10823	5.450	the_feel_felt_found+ownership_language	discard	tone_change
10824	5.137	the_feel_felt_found+ownership_language	discard	tone_change
10825	4.513	the_feel_felt_found+warmth_injection	discard	swap_ownership_language_for_warmth_injection
10826	5.200	the_feel_felt_found+proactive_extras	discard	swap_ownership_language_for_proactive_extras
10827	5.550	the_feel_felt_found+ownership_language+warmth_injection	discard	add_warmth_injection
10828	5.550	the_feel_felt_found+ownership_language+personal_touch	discard	add_personal_touch
10829	5.138	the_feel_felt_found+casual_professionalism	discard	swap_ownership_language_for_casual_professionalism
10830	4.825	the_feel_felt_found	discard	remove_ownership_language
10831	5.350	ownership_language	discard	remove_the_feel_felt_found
10832	5.325	the_feel_felt_found+ownership_language	discard	temp_0.85
10833	5.112	the_feel_felt_found+ownership_language	discard	tone_change
10834	5.238	the_feel_felt_found+ownership_language	discard	tone_change
10835	5.450	the_feel_felt_found+ownership_language	discard	crossover
10836	5.550	the_feel_felt_found+concrete_next_steps	discard	swap_ownership_language_for_concrete_next_steps
10837	5.325	the_feel_felt_found+never_say_calm_down	discard	swap_ownership_language_for_never_say_calm_down
10838	5.138	the_feel_felt_found+personal_touch	discard	swap_ownership_language_for_personal_touch
10839	5.138	the_feel_felt_found+proactive_extras	discard	swap_ownership_language_for_proactive_extras
10840	5.213	the_feel_felt_found+ownership_language	discard	tone_change
10841	5.237	the_feel_felt_found+ownership_language	discard	crossover
10842	5.138	ownership_language	discard	crossover
10843	5.550	the_feel_felt_found+ownership_language+proactive_extras	discard	add_proactive_extras
10844	4.513	the_feel_felt_found+ownership_language	discard	tone_change
10845	5.237	the_feel_felt_found+ownership_language+mirroring	discard	add_mirroring
10846	5.325	the_feel_felt_found+personal_touch	discard	swap_ownership_language_for_personal_touch
10847	5.425	the_feel_felt_found+ownership_language	discard	tone_change
10848	5.138	the_feel_felt_found+ownership_language+personal_touch	discard	add_personal_touch
10849	5.350	the_feel_felt_found+ownership_language	discard	temp_0.75
10850	5.450	the_feel_felt_found+ownership_language	discard	tone_change
10851	5.550	the_feel_felt_found+ownership_language	discard	tone_change
10852	5.238	the_feel_felt_found+warmth_injection	discard	swap_ownership_language_for_warmth_injection
10853	5.113	the_feel_felt_found+warmth_injection	discard	swap_ownership_language_for_warmth_injection
10854	5.450	the_feel_felt_found+genuine_admission	discard	swap_ownership_language_for_genuine_admission
10855	5.013	the_feel_felt_found+ownership_language+concrete_next_steps	discard	add_concrete_next_steps
10856	5.550	the_feel_felt_found+warmth_injection	discard	swap_ownership_language_for_warmth_injection
10857	5.350	the_feel_felt_found+ownership_language+concrete_next_steps	discard	add_concrete_next_steps
10858	5.138	the_feel_felt_found+ownership_language+casual_professionalism	discard	add_casual_professionalism
10859	5.550	the_feel_felt_found+ownership_language	discard	tone_change
10860	5.112	the_feel_felt_found+ownership_language	discard	tone_change
10861	4.612	the_feel_felt_found+ownership_language+genuine_admission	discard	add_genuine_admission
10862	4.988	the_feel_felt_found+ownership_language	discard	tone_change
10863	5.325	the_feel_felt_found+ownership_language+energy_matching	discard	add_energy_matching
10864	5.350	the_feel_felt_found+ownership_language+warmth_injection	discard	add_warmth_injection
10865	5.550	the_feel_felt_found+ownership_language	discard	crossover
10866	5.138	the_feel_felt_found+ownership_language	discard	tone_change
10867	4.925	the_feel_felt_found+ownership_language	discard	tone_change
10868	5.525	the_feel_felt_found+ownership_language	discard	tone_change
10869	5.237	the_feel_felt_found+ownership_language	discard	crossover
10870	5.112	the_feel_felt_found+ownership_language	discard	crossover
10871	5.650	the_feel_felt_found+ownership_language+mirroring	discard	add_mirroring
10872	5.325	the_feel_felt_found+ownership_language+genuine_admission	discard	add_genuine_admission
10873	5.138	the_feel_felt_found+ownership_language	discard	tone_change
10874	5.200	the_feel_felt_found+ownership_language	discard	tone_change
10875	5.325	the_feel_felt_found+ownership_language	discard	tone_change
10876	5.650	none	discard	crossover
10877	5.425	none	discard	crossover
10878	5.200	the_feel_felt_found	discard	crossover
10879	5.038	the_feel_felt_found+ownership_language	discard	crossover
10880	5.650	the_feel_felt_found+ownership_language	discard	temp_0.85
10881	5.450	ownership_language+strategic_agreement	discard	swap_the_feel_felt_found_for_strategic_agreement
10882	5.450	the_feel_felt_found+ownership_language	discard	tone_change
10883	5.237	the_feel_felt_found+ownership_language+concrete_next_steps	discard	add_concrete_next_steps
10884	5.138	the_feel_felt_found+personal_touch	discard	swap_ownership_language_for_personal_touch
10885	5.300	the_feel_felt_found+ownership_language	discard	crossover
10886	5.425	none	discard	crossover
10887	5.425	the_feel_felt_found+ownership_language	discard	tone_change
10888	5.237	ownership_language+validation_before_solution	discard	swap_the_feel_felt_found_for_validation_before_solution
10889	5.325	the_feel_felt_found+ownership_language	discard	tone_change
10890	5.138	the_feel_felt_found+ownership_language+casual_professionalism	discard	add_casual_professionalism
10891	5.175	ownership_language	discard	remove_the_feel_felt_found
10892	5.650	the_feel_felt_found+ownership_language+casual_professionalism	discard	add_casual_professionalism
10893	5.013	the_feel_felt_found+ownership_language	discard	temp_0.95
10894	5.550	the_feel_felt_found+ownership_language	discard	tone_change
10895	5.425	the_feel_felt_found+ownership_language	discard	crossover
10896	5.013	ownership_language	discard	crossover
10897	5.550	the_feel_felt_found+ownership_language	discard	temp_0.95
10898	5.450	the_feel_felt_found+energy_matching	discard	swap_ownership_language_for_energy_matching
10899	5.237	the_feel_felt_found+ownership_language+mirroring	discard	add_mirroring
10900	5.550	the_feel_felt_found+ownership_language+concrete_next_steps	discard	add_concrete_next_steps
10901	5.550	the_feel_felt_found+warmth_injection	discard	swap_ownership_language_for_warmth_injection
10902	5.175	the_feel_felt_found	discard	remove_ownership_language
10903	5.237	the_feel_felt_found	discard	crossover
10904	4.800	the_feel_felt_found+ownership_language	discard	crossover
10905	5.325	the_feel_felt_found	discard	crossover
10906	5.325	the_feel_felt_found+ownership_language	discard	tone_change
10907	4.925	the_feel_felt_found+ownership_language	discard	tone_change
10908	5.325	the_feel_felt_found+validation_before_solution	discard	swap_ownership_language_for_validation_before_solution
10909	5.338	the_feel_felt_found	discard	remove_ownership_language
10910	5.450	the_feel_felt_found+ownership_language	discard	temp_0.65
10911	5.237	the_feel_felt_found+ownership_language	discard	crossover
10912	4.700	the_feel_felt_found+ownership_language	discard	temp_0.65
10913	5.350	ownership_language+warmth_injection	discard	swap_the_feel_felt_found_for_warmth_injection
10914	4.825	the_feel_felt_found+ownership_language+strategic_agreement	discard	add_strategic_agreement
10915	5.338	the_feel_felt_found+ownership_language+casual_professionalism	discard	add_casual_professionalism
10916	5.013	the_feel_felt_found+ownership_language	discard	temp_0.65
10917	5.112	the_feel_felt_found+ownership_language	discard	temp_0.70
10918	4.888	ownership_language	discard	crossover
10919	5.138	the_feel_felt_found+mirroring	discard	swap_ownership_language_for_mirroring
10920	5.237	the_feel_felt_found+ownership_language+validation_before_solution	discard	add_validation_before_solution
10921	5.138	the_feel_felt_found+ownership_language	discard	temp_0.75
10922	5.138	the_feel_felt_found+casual_professionalism	discard	swap_ownership_language_for_casual_professionalism
10923	5.325	the_feel_felt_found+ownership_language	discard	temp_0.85
10924	5.138	the_feel_felt_found+ownership_language+concrete_next_steps	discard	add_concrete_next_steps
10925	5.138	the_feel_felt_found+genuine_admission	discard	swap_ownership_language_for_genuine_admission
10926	5.325	the_feel_felt_found+ownership_language	discard	tone_change
10927	5.325	the_feel_felt_found+ownership_language	discard	tone_change
10928	5.237	ownership_language	discard	crossover
10929	5.450	the_feel_felt_found+ownership_language+mirroring	discard	add_mirroring
10930	5.013	the_feel_felt_found+ownership_language+never_say_calm_down	discard	add_never_say_calm_down
10931	5.112	ownership_language+casual_professionalism	discard	swap_the_feel_felt_found_for_casual_professionalism
10932	5.550	the_feel_felt_found	discard	crossover
10933	5.200	the_feel_felt_found+ownership_language+validation_before_solution	discard	add_validation_before_solution
10934	5.450	the_feel_felt_found+ownership_language	discard	crossover
10935	5.425	the_feel_felt_found+ownership_language+validation_before_solution	discard	add_validation_before_solution
10936	5.450	the_feel_felt_found+mirroring	discard	swap_ownership_language_for_mirroring
10937	4.825	ownership_language+warmth_injection	discard	swap_the_feel_felt_found_for_warmth_injection
10938	5.075	the_feel_felt_found+ownership_language+concrete_next_steps	discard	add_concrete_next_steps
10939	4.987	ownership_language	discard	remove_the_feel_felt_found
10940	5.425	the_feel_felt_found+ownership_language	discard	tone_change
10941	5.013	the_feel_felt_found	discard	remove_ownership_language
10942	5.112	the_feel_felt_found+ownership_language	discard	temp_0.90
10943	5.325	the_feel_felt_found	discard	remove_ownership_language
10944	5.325	the_feel_felt_found+ownership_language	discard	crossover
10945	5.025	ownership_language	discard	crossover
10946	5.237	the_feel_felt_found+ownership_language	discard	temp_0.85
10947	5.013	the_feel_felt_found+ownership_language	discard	temp_0.90
10948	5.450	the_feel_felt_found+ownership_language	discard	crossover
10949	4.988	the_feel_felt_found+ownership_language+energy_matching	discard	add_energy_matching
10950	5.138	the_feel_felt_found+ownership_language	discard	crossover
10951	5.338	ownership_language+emotional_labeling	discard	swap_the_feel_felt_found_for_emotional_labeling
10952	5.013	the_feel_felt_found+ownership_language+validation_before_solution	discard	add_validation_before_solution
10953	5.037	the_feel_felt_found+energy_matching	discard	swap_ownership_language_for_energy_matching
10954	5.213	the_feel_felt_found+ownership_language	discard	temp_0.70
10955	5.450	the_feel_felt_found+ownership_language+energy_matching	discard	add_energy_matching
10956	5.013	ownership_language+strategic_agreement	discard	swap_the_feel_felt_found_for_strategic_agreement
10957	5.450	the_feel_felt_found	discard	remove_ownership_language
10958	5.525	the_feel_felt_found+ownership_language	discard	tone_change
10959	4.612	the_feel_felt_found+ownership_language+genuine_admission	discard	add_genuine_admission
10960	5.450	the_feel_felt_found+ownership_language	discard	tone_change
10961	5.138	ownership_language	discard	crossover
10962	5.338	the_feel_felt_found+ownership_language	discard	tone_change
10963	4.700	the_feel_felt_found+ownership_language+warmth_injection	discard	add_warmth_injection
10964	5.650	the_feel_felt_found+ownership_language	discard	temp_0.90
10965	5.138	the_feel_felt_found+ownership_language	discard	tone_change
10966	5.525	the_feel_felt_found+ownership_language+energy_matching	discard	add_energy_matching
10967	4.725	the_feel_felt_found+ownership_language+validation_before_solution	discard	add_validation_before_solution
10968	5.237	the_feel_felt_found	discard	crossover
10969	4.575	the_feel_felt_found+ownership_language	discard	tone_change
10970	5.450	the_feel_felt_found+ownership_language	discard	crossover
10971	5.350	ownership_language+casual_professionalism	discard	swap_the_feel_felt_found_for_casual_professionalism
10972	5.013	the_feel_felt_found+ownership_language	discard	crossover
10973	5.325	the_feel_felt_found+ownership_language	discard	crossover
10974	4.925	ownership_language	discard	crossover
10975	5.450	the_feel_felt_found+ownership_language	discard	temp_0.70
10976	4.825	the_feel_felt_found+ownership_language	discard	tone_change
10977	5.325	the_feel_felt_found+ownership_language+strategic_agreement	discard	add_strategic_agreement
10978	5.013	the_feel_felt_found+ownership_language+personal_touch	discard	add_personal_touch
10979	5.138	ownership_language	discard	crossover
10980	4.700	the_feel_felt_found+casual_professionalism	discard	swap_ownership_language_for_casual_professionalism
10981	5.338	the_feel_felt_found+ownership_language+mirroring	discard	add_mirroring
10982	5.325	the_feel_felt_found+ownership_language+energy_matching	discard	add_energy_matching
10983	5.425	the_feel_felt_found+ownership_language+strategic_agreement	discard	add_strategic_agreement
10984	5.238	ownership_language+genuine_admission	discard	swap_the_feel_felt_found_for_genuine_admission
10985	5.338	the_feel_felt_found+ownership_language	discard	tone_change
10986	5.450	the_feel_felt_found+ownership_language	discard	crossover
10987	5.325	ownership_language	discard	remove_the_feel_felt_found
10988	5.013	the_feel_felt_found+ownership_language	discard	tone_change
10989	5.325	the_feel_felt_found+energy_matching	discard	swap_ownership_language_for_energy_matching
10990	5.138	the_feel_felt_found+ownership_language	discard	tone_change
10991	5.425	the_feel_felt_found+ownership_language	discard	tone_change
10992	5.450	the_feel_felt_found+ownership_language+emotional_labeling	discard	add_emotional_labeling
10993	5.200	the_feel_felt_found+ownership_language	discard	temp_0.65
10994	5.325	the_feel_felt_found+ownership_language	discard	tone_change
10995	5.237	the_feel_felt_found+ownership_language+casual_professionalism	discard	add_casual_professionalism
10996	5.450	the_feel_felt_found+ownership_language+energy_matching	discard	add_energy_matching
10997	5.450	the_feel_felt_found+ownership_language	discard	crossover
10998	5.450	the_feel_felt_found+ownership_language	discard	temp_0.95
10999	5.138	the_feel_felt_found+ownership_language+emotional_labeling	discard	add_emotional_labeling
11000	5.325	the_feel_felt_found+ownership_language+genuine_admission	discard	add_genuine_admission
11001	5.250	the_feel_felt_found+ownership_language	discard	crossover
11002	5.013	the_feel_felt_found+casual_professionalism	discard	swap_ownership_language_for_casual_professionalism
11003	5.337	ownership_language	discard	crossover
11004	5.650	the_feel_felt_found	discard	remove_ownership_language
11005	5.325	the_feel_felt_found+ownership_language+casual_professionalism	discard	add_casual_professionalism
11006	5.237	the_feel_felt_found+emotional_labeling	discard	swap_ownership_language_for_emotional_labeling
11007	5.138	ownership_language+casual_professionalism	discard	swap_the_feel_felt_found_for_casual_professionalism
11008	5.425	none	discard	crossover
11009	5.425	the_feel_felt_found+ownership_language	discard	crossover
11010	5.013	the_feel_felt_found+ownership_language	discard	temp_0.95
11011	5.338	ownership_language	discard	remove_the_feel_felt_found
11012	5.525	the_feel_felt_found+ownership_language+mirroring	discard	add_mirroring
11013	5.450	the_feel_felt_found+ownership_language	discard	crossover
11014	5.200	the_feel_felt_found+ownership_language	discard	tone_change
11015	4.825	the_feel_felt_found+ownership_language	discard	crossover
11016	4.888	the_feel_felt_found+ownership_language+mirroring	discard	add_mirroring
11017	4.925	the_feel_felt_found+ownership_language	discard	tone_change
11018	4.825	the_feel_felt_found+ownership_language	discard	crossover
11019	5.450	ownership_language	discard	remove_the_feel_felt_found
11020	5.200	the_feel_felt_found+ownership_language+mirroring	discard	add_mirroring
11021	5.138	the_feel_felt_found+ownership_language	discard	tone_change
11022	5.325	the_feel_felt_found	discard	remove_ownership_language
11023	5.112	the_feel_felt_found+ownership_language+concrete_next_steps	discard	add_concrete_next_steps
11024	5.550	the_feel_felt_found+ownership_language+concrete_next_steps	discard	add_concrete_next_steps
11025	5.450	ownership_language+warmth_injection	discard	swap_the_feel_felt_found_for_warmth_injection
11026	5.112	the_feel_felt_found+ownership_language+casual_professionalism	discard	add_casual_professionalism
11027	5.425	the_feel_felt_found+ownership_language+emotional_labeling	discard	add_emotional_labeling
11028	5.425	the_feel_felt_found+ownership_language	discard	tone_change
11029	5.525	the_feel_felt_found	discard	remove_ownership_language
11030	4.925	the_feel_felt_found+ownership_language	discard	temp_0.85
11031	4.888	ownership_language+genuine_admission	discard	swap_the_feel_felt_found_for_genuine_admission
11032	5.550	the_feel_felt_found+ownership_language	discard	tone_change
11033	5.212	the_feel_felt_found+ownership_language	discard	temp_0.65
11034	4.925	the_feel_felt_found+ownership_language	discard	temp_0.65
11035	5.650	the_feel_felt_found+ownership_language	discard	tone_change
11036	5.013	the_feel_felt_found+ownership_language	discard	crossover
11037	5.025	the_feel_felt_found	discard	remove_ownership_language
11038	5.450	the_feel_felt_found+ownership_language	discard	tone_change
11039	5.450	the_feel_felt_found+genuine_admission	discard	swap_ownership_language_for_genuine_admission
11040	5.350	the_feel_felt_found+ownership_language	discard	tone_change
11041	5.450	the_feel_felt_found+ownership_language	discard	crossover
11042	5.075	the_feel_felt_found+casual_professionalism	discard	swap_ownership_language_for_casual_professionalism
11043	5.325	the_feel_felt_found+ownership_language	discard	crossover
11044	5.525	the_feel_felt_found+ownership_language	discard	tone_change
11045	5.337	the_feel_felt_found+ownership_language+proactive_extras	discard	add_proactive_extras
11046	5.337	ownership_language+energy_matching	discard	swap_the_feel_felt_found_for_energy_matching
11047	5.238	the_feel_felt_found+ownership_language	discard	tone_change
11048	5.550	the_feel_felt_found+ownership_language	discard	temp_0.85
11049	5.450	the_feel_felt_found+ownership_language	discard	tone_change
11050	5.350	the_feel_felt_found+ownership_language+validation_before_solution	discard	add_validation_before_solution
11051	5.138	the_feel_felt_found+ownership_language	discard	temp_0.90
11052	5.113	the_feel_felt_found+ownership_language	discard	tone_change
11053	5.325	the_feel_felt_found+ownership_language+never_say_calm_down	discard	add_never_say_calm_down
11054	5.138	the_feel_felt_found+ownership_language	discard	tone_change
11055	5.550	ownership_language+concrete_next_steps	discard	swap_the_feel_felt_found_for_concrete_next_steps
11056	5.112	the_feel_felt_found	discard	remove_ownership_language
11057	5.013	ownership_language	discard	crossover
11058	5.213	the_feel_felt_found	discard	crossover
11059	4.612	the_feel_felt_found+ownership_language+emotional_labeling	discard	add_emotional_labeling
11060	5.525	the_feel_felt_found+ownership_language	discard	temp_0.70
11061	5.138	the_feel_felt_found+warmth_injection	discard	swap_ownership_language_for_warmth_injection
11062	5.037	the_feel_felt_found+ownership_language	discard	tone_change
11063	5.125	ownership_language+emotional_labeling	discard	swap_the_feel_felt_found_for_emotional_labeling
11064	5.425	the_feel_felt_found+ownership_language+warmth_injection	discard	add_warmth_injection
11065	5.750	ownership_language+never_say_calm_down	discard	swap_the_feel_felt_found_for_never_say_calm_down
11066	5.237	the_feel_felt_found	discard	remove_ownership_language
11067	5.425	the_feel_felt_found+ownership_language	discard	crossover
11068	5.225	the_feel_felt_found+ownership_language	discard	tone_change
11069	4.700	the_feel_felt_found+ownership_language+personal_touch	discard	add_personal_touch
11070	5.350	the_feel_felt_found+ownership_language+emotional_labeling	discard	add_emotional_labeling
11071	4.825	the_feel_felt_found+ownership_language	discard	tone_change
11072	5.550	the_feel_felt_found+ownership_language+validation_before_solution	discard	add_validation_before_solution
11073	5.350	the_feel_felt_found+ownership_language	discard	tone_change
11074	5.113	the_feel_felt_found+ownership_language	discard	tone_change
11075	4.825	the_feel_felt_found+ownership_language	discard	tone_change
11076	5.138	the_feel_felt_found+ownership_language+mirroring	discard	add_mirroring
11077	4.900	the_feel_felt_found+ownership_language	discard	tone_change
11078	5.112	the_feel_felt_found+ownership_language+energy_matching	discard	add_energy_matching
11079	5.138	ownership_language+personal_touch	discard	swap_the_feel_felt_found_for_personal_touch
11080	5.425	the_feel_felt_found+ownership_language	discard	tone_change
11081	5.237	ownership_language+genuine_admission	discard	swap_the_feel_felt_found_for_genuine_admission
11082	5.237	the_feel_felt_found+ownership_language	discard	temp_0.75
11083	5.325	ownership_language+genuine_admission	discard	swap_the_feel_felt_found_for_genuine_admission
11084	5.550	the_feel_felt_found+ownership_language	discard	temp_0.70
11085	5.450	the_feel_felt_found+ownership_language	discard	tone_change
11086	5.237	the_feel_felt_found+ownership_language	discard	tone_change
11087	4.700	the_feel_felt_found	discard	crossover
11088	5.138	the_feel_felt_found+ownership_language+mirroring	discard	add_mirroring
11089	5.325	the_feel_felt_found+ownership_language+energy_matching	discard	add_energy_matching
11090	4.613	the_feel_felt_found+concrete_next_steps	discard	swap_ownership_language_for_concrete_next_steps
