generation	eq_score	techniques	status	description
12186	5.450	none	discard	crossover
12187	5.075	the_feel_felt_found+ownership_language	discard	crossover
12188	5.325	ownership_language+energy_matching	discard	swap_the_feel_felt_found_for_energy_matching
12189	5.225	the_feel_felt_found+ownership_language+emotional_labeling	discard	add_emotional_labeling
12190	5.112	the_feel_felt_found+ownership_language+casual_professionalism	discard	add_casual_professionalism
12191	4.888	the_feel_felt_found+ownership_language	discard	tone_change
12192	5.550	ownership_language+mirroring	discard	swap_the_feel_felt_found_for_mirroring
12193	4.825	ownership_language	discard	crossover
12194	5.138	the_feel_felt_found+ownership_language	discard	crossover
12195	5.138	the_feel_felt_found+ownership_language+proactive_extras	discard	add_proactive_extras
12196	5.225	the_feel_felt_found+ownership_language	discard	tone_change
12197	4.888	the_feel_felt_found+validation_before_solution	discard	swap_ownership_language_for_validation_before_solution
12198	5.350	ownership_language	discard	remove_the_feel_felt_found
12199	5.237	the_feel_felt_found+ownership_language	discard	tone_change
12200	5.425	the_feel_felt_found+ownership_language	discard	crossover
12201	5.138	the_feel_felt_found+ownership_language+personal_touch	discard	add_personal_touch
12202	5.138	the_feel_felt_found+ownership_language	discard	crossover
12203	5.325	ownership_language+personal_touch	discard	swap_the_feel_felt_found_for_personal_touch
12204	5.425	ownership_language	discard	remove_the_feel_felt_found
12205	5.137	the_feel_felt_found+ownership_language+validation_before_solution	discard	add_validation_before_solution
12206	5.200	the_feel_felt_found+ownership_language+genuine_admission	discard	add_genuine_admission
12207	5.450	the_feel_felt_found+casual_professionalism	discard	swap_ownership_language_for_casual_professionalism
12208	5.550	the_feel_felt_found+ownership_language+proactive_extras	discard	add_proactive_extras
12209	5.450	the_feel_felt_found+ownership_language	discard	temp_0.70
12210	5.338	the_feel_felt_found+ownership_language	discard	tone_change
12211	4.700	the_feel_felt_found+ownership_language	discard	crossover
12212	5.138	the_feel_felt_found+emotional_labeling	discard	swap_ownership_language_for_emotional_labeling
12213	4.575	ownership_language+never_say_calm_down	discard	swap_the_feel_felt_found_for_never_say_calm_down
12214	5.425	the_feel_felt_found+ownership_language	discard	tone_change
12215	5.425	the_feel_felt_found+ownership_language+validation_before_solution	discard	add_validation_before_solution
12216	5.237	the_feel_felt_found+ownership_language	discard	tone_change
12217	5.025	the_feel_felt_found+ownership_language	discard	crossover
12218	4.925	ownership_language+validation_before_solution	discard	swap_the_feel_felt_found_for_validation_before_solution
12219	5.013	the_feel_felt_found+ownership_language+validation_before_solution	discard	add_validation_before_solution
12220	5.125	the_feel_felt_found+ownership_language	discard	temp_0.75
12221	4.900	the_feel_felt_found+energy_matching	discard	swap_ownership_language_for_energy_matching
12222	4.825	the_feel_felt_found+ownership_language+warmth_injection	discard	add_warmth_injection
12223	4.612	the_feel_felt_found+warmth_injection	discard	swap_ownership_language_for_warmth_injection
12224	5.225	the_feel_felt_found+ownership_language+warmth_injection	discard	add_warmth_injection
12225	5.137	the_feel_felt_found+ownership_language	discard	temp_0.70
12226	5.200	the_feel_felt_found+ownership_language+casual_professionalism	discard	add_casual_professionalism
12227	5.325	the_feel_felt_found	discard	crossover
12228	5.138	the_feel_felt_found+ownership_language+proactive_extras	discard	add_proactive_extras
12229	5.425	the_feel_felt_found+ownership_language	discard	temp_0.70
12230	5.350	ownership_language+proactive_extras	discard	swap_the_feel_felt_found_for_proactive_extras
12231	5.138	the_feel_felt_found+emotional_labeling	discard	swap_ownership_language_for_emotional_labeling
12232	5.113	the_feel_felt_found+ownership_language+emotional_labeling	discard	add_emotional_labeling
12233	5.325	the_feel_felt_found+ownership_language	discard	tone_change
12234	5.650	the_feel_felt_found+ownership_language	discard	temp_0.85
12235	5.550	the_feel_felt_found+ownership_language+mirroring	discard	add_mirroring
12236	5.237	the_feel_felt_found+ownership_language+never_say_calm_down	discard	add_never_say_calm_down
12237	5.138	the_feel_felt_found+ownership_language+personal_touch	discard	add_personal_touch
12238	5.450	ownership_language	discard	remove_the_feel_felt_found
12239	4.513	the_feel_felt_found+ownership_language+genuine_admission	discard	add_genuine_admission
12240	4.925	the_feel_felt_found+ownership_language+warmth_injection	discard	add_warmth_injection
12241	5.138	the_feel_felt_found+ownership_language	discard	crossover
12242	5.025	the_feel_felt_found+ownership_language	discard	temp_0.95
12243	5.238	the_feel_felt_found+ownership_language	discard	crossover
12244	5.237	the_feel_felt_found+ownership_language	discard	tone_change
12245	5.138	the_feel_felt_found+ownership_language+validation_before_solution	discard	add_validation_before_solution
12246	5.550	the_feel_felt_found+warmth_injection	discard	swap_ownership_language_for_warmth_injection
12247	4.888	the_feel_felt_found+ownership_language+emotional_labeling	discard	add_emotional_labeling
12248	5.550	the_feel_felt_found+ownership_language	discard	temp_0.85
12249	5.237	the_feel_felt_found+ownership_language+proactive_extras	discard	add_proactive_extras
12250	5.237	the_feel_felt_found+ownership_language	discard	tone_change
12251	5.225	the_feel_felt_found+ownership_language	discard	tone_change
12252	4.987	the_feel_felt_found+ownership_language+never_say_calm_down	discard	add_never_say_calm_down
12253	5.325	the_feel_felt_found+ownership_language	discard	crossover
12254	4.987	the_feel_felt_found+ownership_language	discard	temp_0.95
12255	4.513	the_feel_felt_found+ownership_language	discard	tone_change
12256	4.888	the_feel_felt_found+ownership_language	discard	crossover
12257	4.825	ownership_language+personal_touch	discard	swap_the_feel_felt_found_for_personal_touch
12258	5.138	the_feel_felt_found	discard	remove_ownership_language
12259	5.138	ownership_language+emotional_labeling	discard	swap_the_feel_felt_found_for_emotional_labeling
12260	5.325	the_feel_felt_found+ownership_language	discard	tone_change
12261	5.138	the_feel_felt_found+ownership_language+strategic_agreement	discard	add_strategic_agreement
12262	5.550	the_feel_felt_found	discard	remove_ownership_language
12263	5.113	the_feel_felt_found+ownership_language	discard	temp_0.95
12264	5.425	the_feel_felt_found+ownership_language	discard	tone_change
12265	5.325	ownership_language	discard	remove_the_feel_felt_found
12266	5.337	ownership_language+proactive_extras	discard	swap_the_feel_felt_found_for_proactive_extras
12267	5.325	the_feel_felt_found+ownership_language	discard	temp_0.85
12268	5.225	the_feel_felt_found+ownership_language+strategic_agreement	discard	add_strategic_agreement
12269	5.138	the_feel_felt_found+ownership_language	discard	crossover
12270	5.425	the_feel_felt_found+ownership_language	discard	tone_change
12271	5.237	ownership_language	discard	remove_the_feel_felt_found
12272	5.138	the_feel_felt_found+casual_professionalism	discard	swap_ownership_language_for_casual_professionalism
12273	5.425	the_feel_felt_found+ownership_language+never_say_calm_down	discard	add_never_say_calm_down
12274	5.013	the_feel_felt_found	discard	remove_ownership_language
12275	5.525	the_feel_felt_found+ownership_language	discard	crossover
12276	4.613	the_feel_felt_found+strategic_agreement	discard	swap_ownership_language_for_strategic_agreement
12277	5.325	the_feel_felt_found+ownership_language+mirroring	discard	add_mirroring
12278	5.013	the_feel_felt_found	discard	crossover
12279	5.338	the_feel_felt_found	discard	crossover
12280	4.925	the_feel_felt_found+ownership_language	discard	tone_change
12281	5.550	the_feel_felt_found+ownership_language+warmth_injection	discard	add_warmth_injection
12282	5.113	the_feel_felt_found+ownership_language	discard	crossover
12283	5.550	the_feel_felt_found+ownership_language+concrete_next_steps	discard	add_concrete_next_steps
12284	5.237	the_feel_felt_found+ownership_language	discard	temp_0.70
12285	5.550	ownership_language	discard	remove_the_feel_felt_found
12286	5.425	the_feel_felt_found+ownership_language	discard	tone_change
12287	4.700	the_feel_felt_found+ownership_language+concrete_next_steps	discard	add_concrete_next_steps
12288	5.138	the_feel_felt_found+ownership_language+casual_professionalism	discard	add_casual_professionalism
12289	5.237	the_feel_felt_found+strategic_agreement	discard	swap_ownership_language_for_strategic_agreement
12290	5.225	the_feel_felt_found	discard	crossover
12291	5.325	the_feel_felt_found+ownership_language	discard	temp_0.65
12292	5.138	the_feel_felt_found+ownership_language	discard	crossover
12293	4.725	ownership_language	discard	remove_the_feel_felt_found
12294	5.237	the_feel_felt_found+ownership_language+never_say_calm_down	discard	add_never_say_calm_down
12295	5.425	ownership_language	discard	remove_the_feel_felt_found
12296	5.450	the_feel_felt_found+ownership_language	discard	temp_0.95
12297	5.300	ownership_language+warmth_injection	discard	swap_the_feel_felt_found_for_warmth_injection
12298	5.013	the_feel_felt_found+mirroring	discard	swap_ownership_language_for_mirroring
12299	5.450	the_feel_felt_found	discard	crossover
12300	5.550	the_feel_felt_found+ownership_language	discard	temp_0.70
12301	5.550	the_feel_felt_found+ownership_language	discard	crossover
12302	5.138	the_feel_felt_found+ownership_language	discard	temp_0.65
12303	5.450	the_feel_felt_found+ownership_language+validation_before_solution	discard	add_validation_before_solution
12304	4.825	the_feel_felt_found	discard	crossover
12305	5.650	the_feel_felt_found+ownership_language	discard	crossover
12306	5.650	the_feel_felt_found	discard	crossover
12307	5.450	ownership_language	discard	remove_the_feel_felt_found
12308	4.825	the_feel_felt_found+ownership_language	discard	crossover
12309	4.713	the_feel_felt_found+ownership_language	discard	crossover
12310	5.225	ownership_language+proactive_extras	discard	swap_the_feel_felt_found_for_proactive_extras
12311	5.550	the_feel_felt_found+genuine_admission	discard	swap_ownership_language_for_genuine_admission
12312	5.325	the_feel_felt_found+ownership_language	discard	crossover
12313	4.800	the_feel_felt_found+ownership_language	discard	tone_change
12314	5.325	the_feel_felt_found+genuine_admission	discard	swap_ownership_language_for_genuine_admission
12315	5.225	the_feel_felt_found+ownership_language+warmth_injection	discard	add_warmth_injection
12316	5.200	the_feel_felt_found+ownership_language	discard	tone_change
12317	5.200	the_feel_felt_found+ownership_language+personal_touch	discard	add_personal_touch
12318	5.200	none	discard	crossover
12319	5.238	the_feel_felt_found+ownership_language+emotional_labeling	discard	add_emotional_labeling
12320	5.138	the_feel_felt_found+ownership_language	discard	crossover
12321	4.613	the_feel_felt_found	discard	remove_ownership_language
12322	5.338	the_feel_felt_found+concrete_next_steps	discard	swap_ownership_language_for_concrete_next_steps
12323	5.350	the_feel_felt_found	discard	crossover
12324	5.550	the_feel_felt_found+ownership_language	discard	crossover
12325	5.138	the_feel_felt_found+ownership_language	discard	temp_0.85
12326	5.013	the_feel_felt_found+ownership_language	discard	temp_0.65
12327	5.200	ownership_language	discard	crossover
12328	5.238	the_feel_felt_found	discard	crossover
12329	5.237	the_feel_felt_found+ownership_language+mirroring	discard	add_mirroring
12330	5.550	the_feel_felt_found+ownership_language	discard	crossover
12331	5.450	the_feel_felt_found+ownership_language	discard	crossover
12332	5.438	the_feel_felt_found+ownership_language	discard	tone_change
12333	5.013	ownership_language	discard	remove_the_feel_felt_found
12334	5.025	the_feel_felt_found+ownership_language	discard	crossover
12335	5.013	the_feel_felt_found	discard	crossover
12336	4.700	the_feel_felt_found+ownership_language	discard	tone_change
12337	5.425	the_feel_felt_found+ownership_language	discard	tone_change
12338	5.550	the_feel_felt_found+strategic_agreement	discard	swap_ownership_language_for_strategic_agreement
12339	5.650	the_feel_felt_found+ownership_language+genuine_admission	discard	add_genuine_admission
12340	5.450	the_feel_felt_found+ownership_language	discard	tone_change
12341	4.912	the_feel_felt_found+ownership_language+validation_before_solution	discard	add_validation_before_solution
12342	5.200	the_feel_felt_found+ownership_language	discard	tone_change
12343	5.200	the_feel_felt_found+ownership_language	discard	tone_change
12344	5.138	ownership_language	discard	remove_the_feel_felt_found
12345	5.325	the_feel_felt_found+ownership_language	discard	tone_change
12346	5.450	ownership_language	discard	crossover
12347	5.138	ownership_language+emotional_labeling	discard	swap_the_feel_felt_found_for_emotional_labeling
12348	5.138	the_feel_felt_found+ownership_language	discard	crossover
12349	5.325	the_feel_felt_found+ownership_language	discard	temp_0.85
12350	5.237	ownership_language	discard	remove_the_feel_felt_found
12351	5.350	the_feel_felt_found+ownership_language+proactive_extras	discard	add_proactive_extras
12352	5.425	the_feel_felt_found+ownership_language+strategic_agreement	discard	add_strategic_agreement
12353	5.325	the_feel_felt_found+concrete_next_steps	discard	swap_ownership_language_for_concrete_next_steps
12354	5.337	the_feel_felt_found+ownership_language+energy_matching	discard	add_energy_matching
12355	4.925	the_feel_felt_found+ownership_language	discard	temp_0.65
12356	5.138	the_feel_felt_found+never_say_calm_down	discard	swap_ownership_language_for_never_say_calm_down
12357	4.950	the_feel_felt_found+ownership_language	discard	tone_change
12358	5.450	the_feel_felt_found+ownership_language	discard	tone_change
12359	4.825	the_feel_felt_found+ownership_language+strategic_agreement	discard	add_strategic_agreement
12360	5.200	the_feel_felt_found	discard	crossover
12361	4.800	the_feel_felt_found+ownership_language	discard	temp_0.95
12362	4.825	the_feel_felt_found+ownership_language	discard	temp_0.65
12363	5.525	the_feel_felt_found+ownership_language	discard	temp_0.85
12364	5.550	ownership_language	discard	crossover
12365	5.550	the_feel_felt_found+ownership_language	discard	temp_0.90
12366	5.650	ownership_language	discard	remove_the_feel_felt_found
12367	5.200	ownership_language+warmth_injection	discard	swap_the_feel_felt_found_for_warmth_injection
12368	5.525	the_feel_felt_found+ownership_language+emotional_labeling	discard	add_emotional_labeling
12369	5.200	the_feel_felt_found+ownership_language	discard	tone_change
12370	5.525	the_feel_felt_found+ownership_language	discard	tone_change
12371	5.325	none	discard	crossover
12372	5.138	ownership_language	discard	crossover
12373	5.550	ownership_language	discard	crossover
12374	5.237	none	discard	crossover
12375	5.450	ownership_language+casual_professionalism	discard	swap_the_feel_felt_found_for_casual_professionalism
12376	5.138	the_feel_felt_found	discard	remove_ownership_language
12377	5.013	the_feel_felt_found+ownership_language	discard	tone_change
12378	4.925	the_feel_felt_found+ownership_language	discard	temp_0.85
12379	5.338	the_feel_felt_found+ownership_language	discard	temp_0.85
12380	5.450	the_feel_felt_found	discard	remove_ownership_language
12381	5.238	the_feel_felt_found	discard	remove_ownership_language
12382	5.250	the_feel_felt_found+ownership_language	discard	tone_change
12383	5.325	the_feel_felt_found+ownership_language	discard	temp_0.85
12384	5.350	the_feel_felt_found+ownership_language+casual_professionalism	discard	add_casual_professionalism
12385	5.025	the_feel_felt_found	discard	crossover
12386	5.450	the_feel_felt_found+ownership_language	discard	crossover
12387	4.888	the_feel_felt_found+ownership_language+personal_touch	discard	add_personal_touch
12388	5.138	the_feel_felt_found+ownership_language	discard	crossover
12389	4.825	the_feel_felt_found	discard	crossover
12390	4.825	the_feel_felt_found+ownership_language	discard	temp_0.95
12391	5.112	the_feel_felt_found+ownership_language	discard	temp_0.95
12392	5.138	the_feel_felt_found+ownership_language+never_say_calm_down	discard	add_never_say_calm_down
12393	4.925	the_feel_felt_found+ownership_language	discard	temp_0.95
12394	5.450	ownership_language+casual_professionalism	discard	swap_the_feel_felt_found_for_casual_professionalism
12395	5.338	the_feel_felt_found+ownership_language	discard	tone_change
12396	5.138	ownership_language	discard	crossover
12397	5.112	ownership_language+strategic_agreement	discard	swap_the_feel_felt_found_for_strategic_agreement
12398	5.237	the_feel_felt_found+ownership_language+casual_professionalism	discard	add_casual_professionalism
12399	5.325	ownership_language	discard	remove_the_feel_felt_found
12400	5.350	the_feel_felt_found+ownership_language+warmth_injection	discard	add_warmth_injection
12401	4.925	ownership_language+warmth_injection	discard	swap_the_feel_felt_found_for_warmth_injection
12402	5.138	the_feel_felt_found+ownership_language+emotional_labeling	discard	add_emotional_labeling
12403	4.700	the_feel_felt_found	discard	remove_ownership_language
12404	4.925	the_feel_felt_found	discard	remove_ownership_language
12405	5.013	the_feel_felt_found+ownership_language+casual_professionalism	discard	add_casual_professionalism
12406	5.550	the_feel_felt_found+ownership_language	discard	tone_change
12407	4.825	the_feel_felt_found+ownership_language	discard	temp_0.95
12408	5.025	the_feel_felt_found+ownership_language	discard	crossover
12409	5.450	the_feel_felt_found+ownership_language	discard	temp_0.95
12410	5.550	the_feel_felt_found+ownership_language	discard	tone_change
12411	5.113	the_feel_felt_found+ownership_language+emotional_labeling	discard	add_emotional_labeling
12412	5.013	ownership_language	discard	crossover
12413	5.425	the_feel_felt_found+ownership_language+energy_matching	discard	add_energy_matching
12414	5.450	the_feel_felt_found+ownership_language	discard	temp_0.65
12415	5.425	ownership_language+mirroring	discard	swap_the_feel_felt_found_for_mirroring
12416	4.925	the_feel_felt_found+ownership_language	discard	tone_change
12417	4.825	the_feel_felt_found+ownership_language	discard	tone_change
12418	5.350	the_feel_felt_found+ownership_language+concrete_next_steps	discard	add_concrete_next_steps
12419	5.238	the_feel_felt_found+ownership_language+energy_matching	discard	add_energy_matching
12420	5.550	the_feel_felt_found+ownership_language+energy_matching	discard	add_energy_matching
12421	5.550	the_feel_felt_found+ownership_language+energy_matching	discard	add_energy_matching
12422	4.912	the_feel_felt_found	discard	crossover
12423	5.338	the_feel_felt_found+ownership_language	discard	temp_0.95
12424	5.138	the_feel_felt_found+ownership_language	discard	temp_0.95
12425	5.425	the_feel_felt_found+ownership_language+strategic_agreement	discard	add_strategic_agreement
12426	5.138	the_feel_felt_found+ownership_language	discard	tone_change
12427	5.138	none	discard	crossover
12428	5.238	the_feel_felt_found+ownership_language	discard	tone_change
12429	5.325	none	discard	crossover
12430	5.450	the_feel_felt_found+ownership_language	discard	tone_change
12431	5.013	the_feel_felt_found+ownership_language	discard	crossover
12432	5.138	the_feel_felt_found+ownership_language	discard	tone_change
12433	5.237	the_feel_felt_found+ownership_language	discard	tone_change
12434	4.700	the_feel_felt_found+ownership_language	discard	tone_change
12435	5.138	the_feel_felt_found+ownership_language	discard	temp_0.85
12436	5.450	the_feel_felt_found+ownership_language	discard	temp_0.65
12437	4.825	the_feel_felt_found	discard	remove_ownership_language
12438	5.225	the_feel_felt_found	discard	crossover
12439	5.450	the_feel_felt_found+ownership_language	discard	crossover
12440	5.013	the_feel_felt_found	discard	crossover
12441	5.450	the_feel_felt_found+ownership_language+never_say_calm_down	discard	add_never_say_calm_down
12442	4.925	the_feel_felt_found+ownership_language	discard	tone_change
12443	5.550	the_feel_felt_found+ownership_language	discard	crossover
12444	5.337	the_feel_felt_found+ownership_language	discard	temp_0.85
12445	5.025	the_feel_felt_found+casual_professionalism	discard	swap_ownership_language_for_casual_professionalism
12446	5.138	the_feel_felt_found+ownership_language+strategic_agreement	discard	add_strategic_agreement
12447	5.138	the_feel_felt_found+ownership_language	discard	tone_change
12448	5.100	the_feel_felt_found+ownership_language	discard	temp_0.90
12449	5.425	the_feel_felt_found+ownership_language+concrete_next_steps	discard	add_concrete_next_steps
12450	5.550	ownership_language+casual_professionalism	discard	swap_the_feel_felt_found_for_casual_professionalism
12451	4.987	the_feel_felt_found+ownership_language+casual_professionalism	discard	add_casual_professionalism
12452	5.238	the_feel_felt_found	discard	remove_ownership_language
12453	5.025	the_feel_felt_found+validation_before_solution	discard	swap_ownership_language_for_validation_before_solution
12454	5.112	the_feel_felt_found+concrete_next_steps	discard	swap_ownership_language_for_concrete_next_steps
12455	5.425	the_feel_felt_found+ownership_language+casual_professionalism	discard	add_casual_professionalism
12456	5.550	the_feel_felt_found+ownership_language	discard	tone_change
12457	4.825	the_feel_felt_found+ownership_language	discard	tone_change
12458	5.037	ownership_language+proactive_extras	discard	swap_the_feel_felt_found_for_proactive_extras
12459	5.325	the_feel_felt_found+energy_matching	discard	swap_ownership_language_for_energy_matching
12460	5.450	the_feel_felt_found+ownership_language+validation_before_solution	discard	add_validation_before_solution
