generation	eq_score	techniques	status	description
14923	5.037	the_feel_felt_found+ownership_language+strategic_agreement	discard	add_strategic_agreement
14924	5.237	the_feel_felt_found+ownership_language	discard	tone_change
14925	5.138	the_feel_felt_found+ownership_language	discard	tone_change
14926	5.325	the_feel_felt_found+ownership_language	discard	crossover
14927	5.237	the_feel_felt_found+ownership_language+warmth_injection	discard	add_warmth_injection
14928	5.350	ownership_language+energy_matching	discard	swap_the_feel_felt_found_for_energy_matching
14929	5.138	ownership_language+mirroring	discard	swap_the_feel_felt_found_for_mirroring
14930	5.450	the_feel_felt_found+ownership_language+genuine_admission	discard	add_genuine_admission
14931	5.450	ownership_language	discard	crossover
14932	5.450	the_feel_felt_found+ownership_language	discard	temp_0.95
14933	5.237	ownership_language+proactive_extras	discard	swap_the_feel_felt_found_for_proactive_extras
14934	4.925	ownership_language+mirroring	discard	swap_the_feel_felt_found_for_mirroring
14935	5.200	the_feel_felt_found+proactive_extras	discard	swap_ownership_language_for_proactive_extras
14936	5.325	the_feel_felt_found+ownership_language+concrete_next_steps	discard	add_concrete_next_steps
14937	5.550	ownership_language	discard	remove_the_feel_felt_found
14938	5.550	the_feel_felt_found+ownership_language+validation_before_solution	discard	add_validation_before_solution
14939	5.550	the_feel_felt_found	discard	crossover
14940	5.137	ownership_language	discard	crossover
14941	5.112	the_feel_felt_found+ownership_language	discard	tone_change
14942	5.200	the_feel_felt_found+ownership_language	discard	tone_change
14943	5.013	the_feel_felt_found+ownership_language	discard	tone_change
14944	5.450	the_feel_felt_found+ownership_language	discard	crossover
14945	5.012	none	discard	crossover
14946	5.137	ownership_language	discard	crossover
14947	5.138	the_feel_felt_found+ownership_language	discard	tone_change
14948	5.325	the_feel_felt_found	discard	remove_ownership_language
14949	5.237	the_feel_felt_found	discard	remove_ownership_language
14950	5.338	the_feel_felt_found+ownership_language+concrete_next_steps	discard	add_concrete_next_steps
14951	5.325	the_feel_felt_found+personal_touch	discard	swap_ownership_language_for_personal_touch
14952	5.237	the_feel_felt_found+genuine_admission	discard	swap_ownership_language_for_genuine_admission
14953	4.925	the_feel_felt_found+ownership_language	discard	tone_change
14954	4.925	the_feel_felt_found+ownership_language+energy_matching	discard	add_energy_matching
14955	5.138	the_feel_felt_found+ownership_language	discard	temp_0.75
14956	4.825	the_feel_felt_found+ownership_language	discard	temp_0.95
14957	5.237	the_feel_felt_found+ownership_language	discard	temp_0.95
14958	5.125	the_feel_felt_found	discard	remove_ownership_language
14959	5.113	the_feel_felt_found+ownership_language	discard	tone_change
14960	4.925	the_feel_felt_found+ownership_language	discard	tone_change
14961	5.237	ownership_language+validation_before_solution	discard	swap_the_feel_felt_found_for_validation_before_solution
14962	5.138	the_feel_felt_found+ownership_language+personal_touch	discard	add_personal_touch
14963	5.138	the_feel_felt_found+ownership_language+mirroring	discard	add_mirroring
14964	5.325	the_feel_felt_found+ownership_language+personal_touch	discard	add_personal_touch
14965	5.025	the_feel_felt_found	discard	crossover
14966	4.812	the_feel_felt_found+ownership_language+concrete_next_steps	discard	add_concrete_next_steps
14967	5.138	the_feel_felt_found+ownership_language	discard	tone_change
14968	5.237	ownership_language+emotional_labeling	discard	swap_the_feel_felt_found_for_emotional_labeling
14969	5.237	the_feel_felt_found	discard	crossover
14970	5.325	ownership_language	discard	crossover
14971	5.013	the_feel_felt_found+personal_touch	discard	swap_ownership_language_for_personal_touch
14972	5.237	ownership_language+validation_before_solution	discard	swap_the_feel_felt_found_for_validation_before_solution
14973	5.550	ownership_language	discard	remove_the_feel_felt_found
14974	5.113	ownership_language	discard	remove_the_feel_felt_found
14975	5.750	the_feel_felt_found+ownership_language+genuine_admission	discard	add_genuine_admission
14976	5.138	the_feel_felt_found+ownership_language	discard	tone_change
14977	5.325	the_feel_felt_found+ownership_language+proactive_extras	discard	add_proactive_extras
14978	5.025	the_feel_felt_found+warmth_injection	discard	swap_ownership_language_for_warmth_injection
14979	5.550	ownership_language+energy_matching	discard	swap_the_feel_felt_found_for_energy_matching
14980	5.325	the_feel_felt_found+ownership_language	discard	crossover
14981	5.525	the_feel_felt_found+proactive_extras	discard	swap_ownership_language_for_proactive_extras
14982	5.650	ownership_language+validation_before_solution	discard	swap_the_feel_felt_found_for_validation_before_solution
14983	5.425	the_feel_felt_found+ownership_language	discard	crossover
14984	5.450	the_feel_felt_found+ownership_language	discard	tone_change
14985	5.425	the_feel_felt_found+ownership_language	discard	temp_0.90
14986	5.650	the_feel_felt_found+ownership_language	discard	tone_change
14987	4.900	the_feel_felt_found+ownership_language+concrete_next_steps	discard	add_concrete_next_steps
14988	5.138	the_feel_felt_found+ownership_language+emotional_labeling	discard	add_emotional_labeling
14989	5.550	the_feel_felt_found+ownership_language	discard	tone_change
14990	5.550	the_feel_felt_found+ownership_language	discard	crossover
14991	5.325	the_feel_felt_found+ownership_language	discard	tone_change
14992	5.550	ownership_language	discard	crossover
14993	5.550	the_feel_felt_found+ownership_language	discard	tone_change
14994	5.237	the_feel_felt_found+ownership_language	discard	temp_0.75
14995	5.238	the_feel_felt_found+ownership_language	discard	crossover
14996	5.450	the_feel_felt_found+ownership_language	discard	crossover
14997	5.550	ownership_language	discard	remove_the_feel_felt_found
14998	5.237	the_feel_felt_found	discard	remove_ownership_language
14999	5.112	ownership_language	discard	remove_the_feel_felt_found
15000	5.650	ownership_language	discard	crossover
15001	5.325	the_feel_felt_found+ownership_language+concrete_next_steps	discard	add_concrete_next_steps
15002	4.700	the_feel_felt_found+ownership_language	discard	tone_change
15003	4.675	the_feel_felt_found+ownership_language	discard	tone_change
15004	5.338	the_feel_felt_found+ownership_language+never_say_calm_down	discard	add_never_say_calm_down
15005	5.200	the_feel_felt_found+ownership_language	discard	crossover
15006	4.888	the_feel_felt_found+personal_touch	discard	swap_ownership_language_for_personal_touch
15007	5.438	the_feel_felt_found+ownership_language	discard	crossover
15008	5.113	none	discard	crossover
15009	5.425	the_feel_felt_found+ownership_language	discard	crossover
15010	5.037	ownership_language+energy_matching	discard	swap_the_feel_felt_found_for_energy_matching
15011	5.450	ownership_language	discard	remove_the_feel_felt_found
15012	5.138	the_feel_felt_found+ownership_language+proactive_extras	discard	add_proactive_extras
15013	5.138	the_feel_felt_found	discard	remove_ownership_language
15014	5.425	ownership_language	discard	remove_the_feel_felt_found
15015	5.425	the_feel_felt_found+ownership_language	discard	temp_0.85
15016	5.350	the_feel_felt_found+ownership_language+warmth_injection	discard	add_warmth_injection
15017	4.925	the_feel_felt_found+ownership_language	discard	temp_0.75
15018	5.325	the_feel_felt_found	discard	crossover
15019	5.450	the_feel_felt_found+ownership_language	discard	tone_change
15020	5.325	the_feel_felt_found+validation_before_solution	discard	swap_ownership_language_for_validation_before_solution
15021	5.037	the_feel_felt_found+ownership_language	discard	temp_0.85
15022	4.825	the_feel_felt_found+ownership_language+energy_matching	discard	add_energy_matching
15023	5.300	the_feel_felt_found+ownership_language	discard	temp_0.70
15024	4.925	ownership_language+genuine_admission	discard	swap_the_feel_felt_found_for_genuine_admission
15025	5.075	the_feel_felt_found+ownership_language	discard	temp_0.75
15026	5.550	the_feel_felt_found+casual_professionalism	discard	swap_ownership_language_for_casual_professionalism
15027	5.450	ownership_language	discard	remove_the_feel_felt_found
15028	5.650	the_feel_felt_found+ownership_language+never_say_calm_down	discard	add_never_say_calm_down
15029	5.450	ownership_language+strategic_agreement	discard	swap_the_feel_felt_found_for_strategic_agreement
15030	5.113	the_feel_felt_found+ownership_language	discard	temp_0.95
15031	5.450	the_feel_felt_found+ownership_language	discard	tone_change
15032	5.450	ownership_language+energy_matching	discard	swap_the_feel_felt_found_for_energy_matching
15033	5.650	the_feel_felt_found	discard	crossover
15034	5.425	the_feel_felt_found+energy_matching	discard	swap_ownership_language_for_energy_matching
15035	4.987	the_feel_felt_found+ownership_language	discard	temp_0.70
15036	5.075	the_feel_felt_found+ownership_language	discard	tone_change
15037	4.925	the_feel_felt_found+ownership_language+strategic_agreement	discard	add_strategic_agreement
15038	5.425	the_feel_felt_found+ownership_language+proactive_extras	discard	add_proactive_extras
15039	5.013	the_feel_felt_found+ownership_language	discard	crossover
15040	5.112	the_feel_felt_found+ownership_language+strategic_agreement	discard	add_strategic_agreement
15041	5.325	ownership_language+warmth_injection	discard	swap_the_feel_felt_found_for_warmth_injection
15042	4.938	the_feel_felt_found+ownership_language	discard	tone_change
15043	5.138	ownership_language	discard	crossover
15044	5.013	the_feel_felt_found+ownership_language	discard	temp_0.85
15045	4.487	ownership_language	discard	crossover
15046	4.888	the_feel_felt_found+ownership_language+casual_professionalism	discard	add_casual_professionalism
15047	5.013	the_feel_felt_found+ownership_language+proactive_extras	discard	add_proactive_extras
15048	5.450	the_feel_felt_found+ownership_language+strategic_agreement	discard	add_strategic_agreement
15049	5.025	the_feel_felt_found+ownership_language	discard	temp_0.90
15050	5.112	the_feel_felt_found	discard	remove_ownership_language
15051	5.650	the_feel_felt_found+strategic_agreement	discard	swap_ownership_language_for_strategic_agreement
15052	5.350	the_feel_felt_found+ownership_language	discard	temp_0.95
15053	5.013	the_feel_felt_found+ownership_language	discard	temp_0.65
15054	5.200	the_feel_felt_found	discard	crossover
15055	5.225	the_feel_felt_found+never_say_calm_down	discard	swap_ownership_language_for_never_say_calm_down
15056	5.237	the_feel_felt_found+ownership_language	discard	tone_change
15057	5.450	the_feel_felt_found+ownership_language	discard	temp_0.85
15058	5.237	the_feel_felt_found+ownership_language	discard	temp_0.90
15059	5.550	the_feel_felt_found+emotional_labeling	discard	swap_ownership_language_for_emotional_labeling
15060	5.450	ownership_language	discard	crossover
15061	5.138	ownership_language	discard	remove_the_feel_felt_found
15062	5.138	the_feel_felt_found+ownership_language	discard	tone_change
15063	4.825	the_feel_felt_found+ownership_language	discard	tone_change
15064	5.213	the_feel_felt_found+ownership_language+validation_before_solution	discard	add_validation_before_solution
15065	5.300	the_feel_felt_found+ownership_language	discard	crossover
15066	5.138	the_feel_felt_found+ownership_language+warmth_injection	discard	add_warmth_injection
15067	4.800	the_feel_felt_found+ownership_language	discard	temp_0.95
15068	5.237	the_feel_felt_found+ownership_language	discard	tone_change
15069	4.888	the_feel_felt_found+ownership_language	discard	tone_change
15070	5.325	the_feel_felt_found+ownership_language	discard	tone_change
15071	5.237	the_feel_felt_found+ownership_language+emotional_labeling	discard	add_emotional_labeling
15072	5.113	the_feel_felt_found+ownership_language+genuine_admission	discard	add_genuine_admission
15073	4.612	the_feel_felt_found+ownership_language	discard	tone_change
15074	5.113	none	discard	crossover
15075	4.487	the_feel_felt_found+ownership_language+never_say_calm_down	discard	add_never_say_calm_down
15076	5.550	the_feel_felt_found+ownership_language	discard	crossover
15077	5.138	ownership_language+mirroring	discard	swap_the_feel_felt_found_for_mirroring
15078	5.450	the_feel_felt_found+ownership_language	discard	temp_0.65
15079	5.325	ownership_language	discard	remove_the_feel_felt_found
15080	5.013	none	discard	crossover
15081	5.450	the_feel_felt_found+ownership_language	discard	temp_0.75
15082	5.200	the_feel_felt_found+ownership_language	discard	tone_change
15083	5.138	the_feel_felt_found+ownership_language+warmth_injection	discard	add_warmth_injection
15084	5.037	the_feel_felt_found+ownership_language+strategic_agreement	discard	add_strategic_agreement
15085	5.237	the_feel_felt_found+ownership_language+emotional_labeling	discard	add_emotional_labeling
15086	5.088	the_feel_felt_found	discard	remove_ownership_language
15087	5.550	the_feel_felt_found+ownership_language	discard	tone_change
15088	5.038	the_feel_felt_found+ownership_language+proactive_extras	discard	add_proactive_extras
15089	4.988	ownership_language+genuine_admission	discard	swap_the_feel_felt_found_for_genuine_admission
15090	5.350	the_feel_felt_found+never_say_calm_down	discard	swap_ownership_language_for_never_say_calm_down
15091	4.513	ownership_language	discard	remove_the_feel_felt_found
15092	5.300	the_feel_felt_found+ownership_language	discard	crossover
15093	5.013	the_feel_felt_found	discard	crossover
15094	5.138	the_feel_felt_found+ownership_language+warmth_injection	discard	add_warmth_injection
15095	5.338	the_feel_felt_found+ownership_language+never_say_calm_down	discard	add_never_say_calm_down
15096	5.450	ownership_language	discard	remove_the_feel_felt_found
15097	4.825	the_feel_felt_found+ownership_language+concrete_next_steps	discard	add_concrete_next_steps
15098	5.450	the_feel_felt_found+ownership_language+concrete_next_steps	discard	add_concrete_next_steps
15099	5.438	ownership_language	discard	crossover
15100	4.700	the_feel_felt_found+ownership_language+never_say_calm_down	discard	add_never_say_calm_down
15101	5.112	the_feel_felt_found+ownership_language	discard	tone_change
15102	5.350	the_feel_felt_found	discard	crossover
15103	5.450	the_feel_felt_found+ownership_language	discard	tone_change
15104	5.138	the_feel_felt_found+ownership_language	discard	tone_change
15105	4.925	the_feel_felt_found	discard	crossover
15106	5.250	the_feel_felt_found+ownership_language+casual_professionalism	discard	add_casual_professionalism
15107	5.238	the_feel_felt_found	discard	crossover
15108	5.025	the_feel_felt_found+ownership_language	discard	temp_0.95
15109	5.037	ownership_language	discard	remove_the_feel_felt_found
15110	5.138	the_feel_felt_found+ownership_language	discard	tone_change
15111	4.513	the_feel_felt_found+ownership_language+warmth_injection	discard	add_warmth_injection
15112	5.138	the_feel_felt_found+ownership_language	discard	tone_change
15113	5.325	ownership_language	discard	crossover
15114	4.825	the_feel_felt_found+ownership_language+warmth_injection	discard	add_warmth_injection
15115	5.225	ownership_language	discard	crossover
15116	5.138	the_feel_felt_found+ownership_language+mirroring	discard	add_mirroring
15117	5.550	the_feel_felt_found+ownership_language	discard	tone_change
15118	4.925	the_feel_felt_found+ownership_language+mirroring	discard	add_mirroring
15119	5.325	the_feel_felt_found+ownership_language	discard	tone_change
15120	5.012	ownership_language+emotional_labeling	discard	swap_the_feel_felt_found_for_emotional_labeling
15121	4.925	the_feel_felt_found+warmth_injection	discard	swap_ownership_language_for_warmth_injection
15122	5.425	the_feel_felt_found+ownership_language	discard	temp_0.65
15123	5.450	none	discard	crossover
15124	5.425	the_feel_felt_found+ownership_language	discard	temp_0.85
15125	5.013	the_feel_felt_found+casual_professionalism	discard	swap_ownership_language_for_casual_professionalism
15126	5.237	the_feel_felt_found+proactive_extras	discard	swap_ownership_language_for_proactive_extras
15127	5.325	ownership_language	discard	crossover
15128	5.550	the_feel_felt_found+ownership_language+strategic_agreement	discard	add_strategic_agreement
15129	5.425	the_feel_felt_found+warmth_injection	discard	swap_ownership_language_for_warmth_injection
15130	5.138	the_feel_felt_found+ownership_language	discard	temp_0.85
15131	5.325	the_feel_felt_found+ownership_language+validation_before_solution	discard	add_validation_before_solution
15132	5.325	ownership_language+warmth_injection	discard	swap_the_feel_felt_found_for_warmth_injection
15133	5.650	ownership_language	discard	crossover
15134	5.325	the_feel_felt_found+ownership_language	discard	tone_change
15135	5.450	the_feel_felt_found+ownership_language	discard	temp_0.70
15136	4.725	the_feel_felt_found+ownership_language	discard	temp_0.65
15137	5.125	the_feel_felt_found+ownership_language	discard	temp_0.85
15138	5.338	the_feel_felt_found+ownership_language	discard	crossover
15139	5.450	ownership_language	discard	remove_the_feel_felt_found
15140	5.425	the_feel_felt_found+ownership_language+concrete_next_steps	discard	add_concrete_next_steps
15141	5.138	the_feel_felt_found+ownership_language+genuine_admission	discard	add_genuine_admission
15142	4.713	ownership_language+emotional_labeling	discard	swap_the_feel_felt_found_for_emotional_labeling
15143	5.013	the_feel_felt_found+ownership_language+personal_touch	discard	add_personal_touch
15144	5.325	ownership_language	discard	crossover
15145	5.138	the_feel_felt_found+ownership_language+emotional_labeling	discard	add_emotional_labeling
15146	5.550	the_feel_felt_found+ownership_language+casual_professionalism	discard	add_casual_professionalism
15147	4.837	the_feel_felt_found+ownership_language	discard	tone_change
15148	5.338	the_feel_felt_found+ownership_language	discard	tone_change
15149	5.450	the_feel_felt_found+ownership_language+never_say_calm_down	discard	add_never_say_calm_down
15150	5.450	the_feel_felt_found+ownership_language	discard	crossover
15151	5.550	the_feel_felt_found+energy_matching	discard	swap_ownership_language_for_energy_matching
15152	5.550	the_feel_felt_found+ownership_language+personal_touch	discard	add_personal_touch
15153	5.237	the_feel_felt_found+ownership_language+genuine_admission	discard	add_genuine_admission
15154	5.237	the_feel_felt_found+ownership_language	discard	tone_change
15155	5.013	ownership_language	discard	remove_the_feel_felt_found
15156	5.425	the_feel_felt_found+ownership_language+warmth_injection	discard	add_warmth_injection
15157	5.200	the_feel_felt_found+ownership_language	discard	tone_change
15158	5.450	the_feel_felt_found	discard	crossover
15159	5.325	the_feel_felt_found+ownership_language+validation_before_solution	discard	add_validation_before_solution
15160	5.350	the_feel_felt_found+ownership_language+casual_professionalism	discard	add_casual_professionalism
15161	5.425	ownership_language+casual_professionalism	discard	swap_the_feel_felt_found_for_casual_professionalism
15162	5.237	the_feel_felt_found+ownership_language+proactive_extras	discard	add_proactive_extras
15163	4.825	the_feel_felt_found+ownership_language+personal_touch	discard	add_personal_touch
15164	5.237	the_feel_felt_found+ownership_language+strategic_agreement	discard	add_strategic_agreement
15165	5.450	ownership_language+genuine_admission	discard	swap_the_feel_felt_found_for_genuine_admission
15166	5.013	the_feel_felt_found+validation_before_solution	discard	swap_ownership_language_for_validation_before_solution
15167	5.213	the_feel_felt_found+ownership_language	discard	temp_0.70
15168	5.300	the_feel_felt_found+energy_matching	discard	swap_ownership_language_for_energy_matching
15169	5.750	the_feel_felt_found	discard	crossover
15170	5.650	the_feel_felt_found+ownership_language+personal_touch	discard	add_personal_touch
15171	5.325	the_feel_felt_found+ownership_language+strategic_agreement	discard	add_strategic_agreement
15172	5.650	the_feel_felt_found+ownership_language+never_say_calm_down	discard	add_never_say_calm_down
15173	5.013	the_feel_felt_found+ownership_language+concrete_next_steps	discard	add_concrete_next_steps
15174	5.237	the_feel_felt_found+ownership_language	discard	temp_0.90
15175	5.300	the_feel_felt_found+ownership_language	discard	crossover
15176	5.250	the_feel_felt_found+validation_before_solution	discard	swap_ownership_language_for_validation_before_solution
15177	4.588	ownership_language	discard	crossover
15178	5.550	the_feel_felt_found	discard	crossover
15179	4.888	the_feel_felt_found+ownership_language	discard	crossover
15180	5.013	ownership_language	discard	remove_the_feel_felt_found
15181	5.213	ownership_language+genuine_admission	discard	swap_the_feel_felt_found_for_genuine_admission
15182	4.300	the_feel_felt_found+proactive_extras	discard	swap_ownership_language_for_proactive_extras
15183	5.237	the_feel_felt_found+ownership_language+genuine_admission	discard	add_genuine_admission
15184	5.325	ownership_language+casual_professionalism	discard	swap_the_feel_felt_found_for_casual_professionalism
15185	4.888	the_feel_felt_found+genuine_admission	discard	swap_ownership_language_for_genuine_admission
15186	5.237	the_feel_felt_found+ownership_language+concrete_next_steps	discard	add_concrete_next_steps
15187	5.075	the_feel_felt_found+ownership_language+proactive_extras	discard	add_proactive_extras
15188	5.237	the_feel_felt_found+ownership_language+concrete_next_steps	discard	add_concrete_next_steps
15189	5.525	the_feel_felt_found	discard	crossover
15190	5.650	the_feel_felt_found+ownership_language	discard	temp_0.75
15191	5.425	the_feel_felt_found+ownership_language	discard	tone_change
15192	5.350	the_feel_felt_found+mirroring	discard	swap_ownership_language_for_mirroring
15193	5.350	the_feel_felt_found+ownership_language+emotional_labeling	discard	add_emotional_labeling
