generation	eq_score	techniques	status	description
17680	4.925	the_feel_felt_found+ownership_language+proactive_extras	discard	add_proactive_extras
17681	5.237	the_feel_felt_found+ownership_language	discard	crossover
17682	5.550	the_feel_felt_found+ownership_language	discard	tone_change
17683	5.525	the_feel_felt_found	discard	crossover
17684	4.900	the_feel_felt_found+concrete_next_steps	discard	swap_ownership_language_for_concrete_next_steps
17685	5.237	ownership_language+never_say_calm_down	discard	swap_the_feel_felt_found_for_never_say_calm_down
17686	5.425	the_feel_felt_found+ownership_language+energy_matching	discard	add_energy_matching
17687	5.100	the_feel_felt_found+ownership_language	discard	crossover
17688	4.888	the_feel_felt_found+ownership_language+never_say_calm_down	discard	add_never_say_calm_down
17689	4.925	the_feel_felt_found+ownership_language+warmth_injection	discard	add_warmth_injection
17690	5.450	the_feel_felt_found+ownership_language	discard	tone_change
17691	5.100	the_feel_felt_found+ownership_language+proactive_extras	discard	add_proactive_extras
17692	5.425	the_feel_felt_found+ownership_language	discard	tone_change
17693	5.425	the_feel_felt_found+ownership_language	discard	tone_change
17694	5.113	the_feel_felt_found+ownership_language+validation_before_solution	discard	add_validation_before_solution
17695	5.450	the_feel_felt_found+ownership_language	discard	crossover
17696	4.987	ownership_language	discard	remove_the_feel_felt_found
17697	4.825	the_feel_felt_found+ownership_language+casual_professionalism	discard	add_casual_professionalism
17698	5.200	the_feel_felt_found+ownership_language	discard	tone_change
17699	5.350	the_feel_felt_found+ownership_language+mirroring	discard	add_mirroring
17700	5.325	the_feel_felt_found+ownership_language	discard	tone_change
17701	5.325	the_feel_felt_found+ownership_language+emotional_labeling	discard	add_emotional_labeling
17702	5.425	ownership_language	discard	crossover
17703	5.237	the_feel_felt_found+ownership_language+warmth_injection	discard	add_warmth_injection
17704	5.237	ownership_language	discard	remove_the_feel_felt_found
17705	5.325	the_feel_felt_found+ownership_language+genuine_admission	discard	add_genuine_admission
17706	5.200	the_feel_felt_found+ownership_language	discard	tone_change
17707	5.550	the_feel_felt_found+ownership_language+strategic_agreement	discard	add_strategic_agreement
17708	5.450	the_feel_felt_found+ownership_language	discard	tone_change
17709	5.425	the_feel_felt_found+ownership_language	discard	crossover
17710	5.650	the_feel_felt_found+ownership_language	discard	tone_change
17711	5.112	the_feel_felt_found+ownership_language	discard	tone_change
17712	5.525	the_feel_felt_found+ownership_language	discard	tone_change
17713	5.200	the_feel_felt_found+ownership_language	discard	tone_change
17714	5.037	the_feel_felt_found+ownership_language	discard	crossover
17715	5.550	the_feel_felt_found+ownership_language+strategic_agreement	discard	add_strategic_agreement
17716	5.325	the_feel_felt_found+ownership_language	discard	crossover
17717	5.550	the_feel_felt_found+ownership_language	discard	tone_change
17718	5.450	the_feel_felt_found+ownership_language	discard	temp_0.90
17719	4.925	the_feel_felt_found	discard	remove_ownership_language
17720	5.325	the_feel_felt_found+ownership_language	discard	crossover
17721	5.113	the_feel_felt_found+ownership_language	discard	tone_change
17722	5.013	the_feel_felt_found+ownership_language	discard	crossover
17723	5.138	none	discard	crossover
17724	5.650	ownership_language+emotional_labeling	discard	swap_the_feel_felt_found_for_emotional_labeling
17725	5.325	ownership_language+never_say_calm_down	discard	swap_the_feel_felt_found_for_never_say_calm_down
17726	5.325	ownership_language	discard	crossover
17727	5.000	the_feel_felt_found+ownership_language	discard	temp_0.95
17728	4.825	the_feel_felt_found+ownership_language	discard	temp_0.65
17729	4.925	the_feel_felt_found+ownership_language	discard	crossover
17730	5.113	the_feel_felt_found+ownership_language+casual_professionalism	discard	add_casual_professionalism
17731	5.200	the_feel_felt_found+ownership_language	discard	tone_change
17732	5.325	the_feel_felt_found+ownership_language+warmth_injection	discard	add_warmth_injection
17733	5.450	the_feel_felt_found+ownership_language	discard	tone_change
17734	5.450	the_feel_felt_found+ownership_language+never_say_calm_down	discard	add_never_say_calm_down
17735	5.013	the_feel_felt_found+ownership_language	discard	tone_change
17736	5.138	the_feel_felt_found+ownership_language	discard	temp_0.85
17737	5.325	the_feel_felt_found	discard	crossover
17738	5.450	the_feel_felt_found	discard	crossover
17739	5.012	the_feel_felt_found+ownership_language+strategic_agreement	discard	add_strategic_agreement
17740	5.300	the_feel_felt_found+concrete_next_steps	discard	swap_ownership_language_for_concrete_next_steps
17741	5.650	the_feel_felt_found+ownership_language	discard	tone_change
17742	5.450	ownership_language+emotional_labeling	discard	swap_the_feel_felt_found_for_emotional_labeling
17743	5.425	the_feel_felt_found+ownership_language	discard	crossover
17744	5.137	the_feel_felt_found+ownership_language+casual_professionalism	discard	add_casual_professionalism
17745	5.200	the_feel_felt_found+ownership_language+strategic_agreement	discard	add_strategic_agreement
17746	5.237	the_feel_felt_found+ownership_language+never_say_calm_down	discard	add_never_say_calm_down
17747	5.425	the_feel_felt_found+energy_matching	discard	swap_ownership_language_for_energy_matching
17748	5.237	the_feel_felt_found+ownership_language	discard	temp_0.70
17749	5.037	the_feel_felt_found+ownership_language+energy_matching	discard	add_energy_matching
17750	5.425	the_feel_felt_found+casual_professionalism	discard	swap_ownership_language_for_casual_professionalism
17751	5.350	the_feel_felt_found+ownership_language+warmth_injection	discard	add_warmth_injection
17752	5.238	the_feel_felt_found	discard	remove_ownership_language
17753	5.450	the_feel_felt_found+ownership_language	discard	temp_0.75
17754	5.237	the_feel_felt_found+ownership_language+mirroring	discard	add_mirroring
17755	5.037	the_feel_felt_found+ownership_language+concrete_next_steps	discard	add_concrete_next_steps
17756	5.550	ownership_language	discard	remove_the_feel_felt_found
17757	4.700	the_feel_felt_found+ownership_language	discard	tone_change
17758	5.112	the_feel_felt_found+ownership_language	discard	tone_change
17759	5.350	the_feel_felt_found+ownership_language+concrete_next_steps	discard	add_concrete_next_steps
17760	5.325	ownership_language	discard	crossover
17761	5.138	ownership_language	discard	remove_the_feel_felt_found
17762	5.550	the_feel_felt_found+ownership_language	discard	tone_change
17763	5.525	none	discard	crossover
17764	5.200	the_feel_felt_found+ownership_language	discard	crossover
17765	5.237	ownership_language+personal_touch	discard	swap_the_feel_felt_found_for_personal_touch
17766	5.250	the_feel_felt_found+ownership_language	discard	tone_change
17767	5.112	the_feel_felt_found+ownership_language	discard	crossover
17768	5.425	the_feel_felt_found+ownership_language	discard	temp_0.75
17769	5.325	the_feel_felt_found+ownership_language+validation_before_solution	discard	add_validation_before_solution
17770	5.650	the_feel_felt_found+ownership_language	discard	tone_change
17771	4.713	the_feel_felt_found+ownership_language	discard	temp_0.90
17772	5.550	the_feel_felt_found+ownership_language	discard	temp_0.90
17773	5.325	ownership_language	discard	crossover
17774	5.013	ownership_language+proactive_extras	discard	swap_the_feel_felt_found_for_proactive_extras
17775	5.750	the_feel_felt_found+ownership_language+mirroring	discard	add_mirroring
17776	5.450	the_feel_felt_found+ownership_language	discard	tone_change
17777	5.137	the_feel_felt_found+ownership_language+energy_matching	discard	add_energy_matching
17778	5.112	the_feel_felt_found+ownership_language	discard	temp_0.75
17779	5.300	the_feel_felt_found+genuine_admission	discard	swap_ownership_language_for_genuine_admission
17780	4.800	the_feel_felt_found+ownership_language	discard	temp_0.65
17781	5.237	the_feel_felt_found+strategic_agreement	discard	swap_ownership_language_for_strategic_agreement
17782	5.112	the_feel_felt_found+ownership_language	discard	tone_change
17783	5.450	the_feel_felt_found+ownership_language	discard	tone_change
17784	5.138	none	discard	crossover
17785	4.912	the_feel_felt_found+ownership_language	discard	tone_change
17786	4.888	ownership_language+proactive_extras	discard	swap_the_feel_felt_found_for_proactive_extras
17787	5.075	the_feel_felt_found+ownership_language+emotional_labeling	discard	add_emotional_labeling
17788	5.350	the_feel_felt_found+ownership_language	discard	temp_0.90
17789	5.138	the_feel_felt_found+ownership_language+never_say_calm_down	discard	add_never_say_calm_down
17790	5.237	the_feel_felt_found+ownership_language	discard	temp_0.95
17791	5.013	the_feel_felt_found	discard	crossover
17792	4.925	the_feel_felt_found+ownership_language+strategic_agreement	discard	add_strategic_agreement
17793	5.325	the_feel_felt_found	discard	crossover
17794	5.650	the_feel_felt_found+ownership_language	discard	tone_change
17795	5.325	ownership_language+strategic_agreement	discard	swap_the_feel_felt_found_for_strategic_agreement
17796	5.337	the_feel_felt_found+ownership_language	discard	tone_change
17797	5.438	the_feel_felt_found+ownership_language+strategic_agreement	discard	add_strategic_agreement
17798	5.213	the_feel_felt_found+ownership_language	discard	temp_0.95
17799	4.700	the_feel_felt_found+ownership_language	discard	tone_change
17800	5.438	ownership_language	discard	remove_the_feel_felt_found
17801	5.650	ownership_language	discard	remove_the_feel_felt_found
17802	4.800	the_feel_felt_found+ownership_language	discard	crossover
17803	5.237	the_feel_felt_found+ownership_language+energy_matching	discard	add_energy_matching
17804	5.450	ownership_language+emotional_labeling	discard	swap_the_feel_felt_found_for_emotional_labeling
17805	5.650	the_feel_felt_found+mirroring	discard	swap_ownership_language_for_mirroring
17806	5.325	the_feel_felt_found+ownership_language+never_say_calm_down	discard	add_never_say_calm_down
17807	4.925	the_feel_felt_found+ownership_language	discard	tone_change
17808	5.550	the_feel_felt_found+ownership_language	discard	tone_change
17809	5.325	the_feel_felt_found+ownership_language+mirroring	discard	add_mirroring
17810	5.138	the_feel_felt_found	discard	crossover
17811	5.650	the_feel_felt_found+casual_professionalism	discard	swap_ownership_language_for_casual_professionalism
17812	5.237	ownership_language+never_say_calm_down	discard	swap_the_feel_felt_found_for_never_say_calm_down
17813	5.525	the_feel_felt_found	discard	crossover
17814	5.750	the_feel_felt_found+ownership_language	discard	tone_change
17815	5.225	the_feel_felt_found+ownership_language+energy_matching	discard	add_energy_matching
17816	5.250	the_feel_felt_found+ownership_language	discard	crossover
17817	5.250	the_feel_felt_found+ownership_language	discard	temp_0.90
17818	5.112	the_feel_felt_found+ownership_language+casual_professionalism	discard	add_casual_professionalism
17819	5.237	the_feel_felt_found	discard	remove_ownership_language
17820	5.237	the_feel_felt_found+ownership_language+strategic_agreement	discard	add_strategic_agreement
17821	5.550	the_feel_felt_found+ownership_language	discard	crossover
17822	5.338	the_feel_felt_found+ownership_language	discard	crossover
17823	4.787	the_feel_felt_found+ownership_language+personal_touch	discard	add_personal_touch
17824	5.425	ownership_language+strategic_agreement	discard	swap_the_feel_felt_found_for_strategic_agreement
17825	5.350	the_feel_felt_found+ownership_language	discard	tone_change
17826	5.450	the_feel_felt_found+genuine_admission	discard	swap_ownership_language_for_genuine_admission
17827	5.237	the_feel_felt_found	discard	remove_ownership_language
17828	5.238	the_feel_felt_found+ownership_language+concrete_next_steps	discard	add_concrete_next_steps
17829	5.450	the_feel_felt_found+ownership_language	discard	tone_change
17830	5.138	the_feel_felt_found+energy_matching	discard	swap_ownership_language_for_energy_matching
17831	5.550	the_feel_felt_found+ownership_language+strategic_agreement	discard	add_strategic_agreement
17832	5.325	the_feel_felt_found+ownership_language	discard	tone_change
17833	5.138	the_feel_felt_found+ownership_language+personal_touch	discard	add_personal_touch
17834	5.425	the_feel_felt_found+warmth_injection	discard	swap_ownership_language_for_warmth_injection
17835	5.138	the_feel_felt_found+ownership_language+genuine_admission	discard	add_genuine_admission
17836	5.338	the_feel_felt_found+ownership_language	discard	tone_change
17837	5.200	ownership_language+personal_touch	discard	swap_the_feel_felt_found_for_personal_touch
17838	5.325	the_feel_felt_found+ownership_language+mirroring	discard	add_mirroring
17839	5.338	ownership_language	discard	remove_the_feel_felt_found
17840	5.013	the_feel_felt_found+ownership_language	discard	temp_0.85
17841	5.200	the_feel_felt_found+ownership_language	discard	tone_change
17842	5.325	the_feel_felt_found+ownership_language+genuine_admission	discard	add_genuine_admission
17843	5.013	ownership_language+casual_professionalism	discard	swap_the_feel_felt_found_for_casual_professionalism
17844	5.138	the_feel_felt_found+ownership_language	discard	temp_0.65
17845	5.238	the_feel_felt_found+ownership_language+proactive_extras	discard	add_proactive_extras
17846	4.613	the_feel_felt_found+ownership_language	discard	tone_change
17847	5.550	the_feel_felt_found+ownership_language+proactive_extras	discard	add_proactive_extras
17848	5.237	the_feel_felt_found+ownership_language	discard	tone_change
17849	5.250	the_feel_felt_found+ownership_language	discard	tone_change
17850	5.225	the_feel_felt_found+ownership_language	discard	temp_0.70
17851	4.825	the_feel_felt_found+ownership_language	discard	temp_0.95
17852	5.525	ownership_language+mirroring	discard	swap_the_feel_felt_found_for_mirroring
17853	5.112	the_feel_felt_found+ownership_language	discard	tone_change
17854	5.037	the_feel_felt_found+ownership_language	discard	temp_0.85
17855	5.138	the_feel_felt_found+mirroring	discard	swap_ownership_language_for_mirroring
17856	5.425	the_feel_felt_found+ownership_language	discard	tone_change
17857	5.013	the_feel_felt_found+ownership_language+strategic_agreement	discard	add_strategic_agreement
17858	5.450	the_feel_felt_found+ownership_language+emotional_labeling	discard	add_emotional_labeling
17859	5.338	the_feel_felt_found+ownership_language	discard	tone_change
17860	5.450	the_feel_felt_found+ownership_language	discard	temp_0.90
17861	5.550	the_feel_felt_found+ownership_language+personal_touch	discard	add_personal_touch
17862	5.200	the_feel_felt_found+ownership_language	discard	temp_0.90
17863	5.450	the_feel_felt_found+ownership_language	discard	temp_0.95
17864	5.013	the_feel_felt_found+ownership_language+personal_touch	discard	add_personal_touch
17865	5.112	the_feel_felt_found+ownership_language+casual_professionalism	discard	add_casual_professionalism
17866	5.450	the_feel_felt_found+ownership_language+personal_touch	discard	add_personal_touch
17867	4.888	ownership_language	discard	remove_the_feel_felt_found
17868	5.138	the_feel_felt_found+ownership_language+genuine_admission	discard	add_genuine_admission
17869	5.138	the_feel_felt_found+ownership_language	discard	tone_change
17870	5.550	the_feel_felt_found+ownership_language	discard	tone_change
17871	4.925	the_feel_felt_found+ownership_language	discard	crossover
17872	5.450	the_feel_felt_found+ownership_language	discard	crossover
17873	5.450	the_feel_felt_found+ownership_language+concrete_next_steps	discard	add_concrete_next_steps
17874	5.125	ownership_language	discard	remove_the_feel_felt_found
17875	5.450	ownership_language	discard	remove_the_feel_felt_found
17876	5.013	the_feel_felt_found+ownership_language	discard	temp_0.90
17877	5.038	the_feel_felt_found+ownership_language	discard	tone_change
17878	5.237	the_feel_felt_found+ownership_language	discard	crossover
17879	5.112	the_feel_felt_found+ownership_language+casual_professionalism	discard	add_casual_professionalism
17880	5.237	the_feel_felt_found+ownership_language+personal_touch	discard	add_personal_touch
17881	5.138	the_feel_felt_found+ownership_language+personal_touch	discard	add_personal_touch
17882	5.650	the_feel_felt_found+ownership_language+personal_touch	discard	add_personal_touch
17883	5.325	the_feel_felt_found+ownership_language+mirroring	discard	add_mirroring
17884	4.925	the_feel_felt_found+ownership_language+emotional_labeling	discard	add_emotional_labeling
17885	5.450	ownership_language+never_say_calm_down	discard	swap_the_feel_felt_found_for_never_say_calm_down
17886	5.325	the_feel_felt_found	discard	remove_ownership_language
17887	5.213	the_feel_felt_found+ownership_language+never_say_calm_down	discard	add_never_say_calm_down
17888	5.550	the_feel_felt_found+ownership_language+casual_professionalism	discard	add_casual_professionalism
17889	5.450	the_feel_felt_found+ownership_language	discard	crossover
17890	5.325	the_feel_felt_found+ownership_language	discard	crossover
17891	5.138	the_feel_felt_found+ownership_language+proactive_extras	discard	add_proactive_extras
17892	5.325	ownership_language+mirroring	discard	swap_the_feel_felt_found_for_mirroring
17893	4.800	the_feel_felt_found+ownership_language+concrete_next_steps	discard	add_concrete_next_steps
17894	5.237	ownership_language	discard	remove_the_feel_felt_found
17895	5.325	the_feel_felt_found+ownership_language	discard	tone_change
17896	4.925	the_feel_felt_found+ownership_language+mirroring	discard	add_mirroring
17897	5.138	ownership_language+concrete_next_steps	discard	swap_the_feel_felt_found_for_concrete_next_steps
17898	5.013	the_feel_felt_found+ownership_language	discard	temp_0.95
17899	5.450	the_feel_felt_found+ownership_language	discard	crossover
17900	5.138	the_feel_felt_found+ownership_language	discard	tone_change
17901	5.112	the_feel_felt_found+ownership_language	discard	tone_change
17902	5.138	the_feel_felt_found+ownership_language	discard	tone_change
17903	5.450	the_feel_felt_found+ownership_language	discard	tone_change
17904	5.200	the_feel_felt_found+ownership_language	discard	tone_change
17905	5.425	the_feel_felt_found+ownership_language	discard	crossover
17906	5.300	the_feel_felt_found+ownership_language+strategic_agreement	discard	add_strategic_agreement
17907	5.550	the_feel_felt_found+ownership_language	discard	tone_change
17908	4.888	the_feel_felt_found	discard	crossover
17909	5.450	the_feel_felt_found+ownership_language+never_say_calm_down	discard	add_never_say_calm_down
17910	5.238	the_feel_felt_found+ownership_language	discard	tone_change
17911	5.450	the_feel_felt_found+ownership_language	discard	tone_change
17912	5.337	the_feel_felt_found+ownership_language	discard	tone_change
17913	5.425	the_feel_felt_found+ownership_language+personal_touch	discard	add_personal_touch
17914	5.013	ownership_language	discard	crossover
17915	4.513	the_feel_felt_found+ownership_language	discard	temp_0.75
17916	5.350	the_feel_felt_found+ownership_language	discard	tone_change
17917	4.888	the_feel_felt_found	discard	crossover
17918	5.325	the_feel_felt_found	discard	crossover
17919	5.025	the_feel_felt_found+ownership_language	discard	crossover
17920	5.137	the_feel_felt_found+ownership_language	discard	temp_0.95
17921	5.550	the_feel_felt_found+ownership_language+proactive_extras	discard	add_proactive_extras
17922	5.325	the_feel_felt_found	discard	remove_ownership_language
17923	4.825	ownership_language+casual_professionalism	discard	swap_the_feel_felt_found_for_casual_professionalism
17924	5.013	the_feel_felt_found+ownership_language+strategic_agreement	discard	add_strategic_agreement
17925	4.700	the_feel_felt_found+ownership_language	discard	tone_change
17926	5.425	the_feel_felt_found+strategic_agreement	discard	swap_ownership_language_for_strategic_agreement
17927	5.113	the_feel_felt_found+ownership_language+emotional_labeling	discard	add_emotional_labeling
17928	5.138	none	discard	crossover
17929	5.213	the_feel_felt_found+casual_professionalism	discard	swap_ownership_language_for_casual_professionalism
17930	5.325	the_feel_felt_found+ownership_language	discard	crossover
17931	5.450	the_feel_felt_found+strategic_agreement	discard	swap_ownership_language_for_strategic_agreement
17932	5.312	the_feel_felt_found+ownership_language	discard	crossover
17933	5.013	the_feel_felt_found+personal_touch	discard	swap_ownership_language_for_personal_touch
17934	5.137	the_feel_felt_found+ownership_language	discard	tone_change
17935	4.925	the_feel_felt_found	discard	crossover
17936	5.425	none	discard	crossover
17937	4.912	the_feel_felt_found+ownership_language+energy_matching	discard	add_energy_matching
17938	5.138	the_feel_felt_found+ownership_language	discard	temp_0.70
17939	5.150	the_feel_felt_found+warmth_injection	discard	swap_ownership_language_for_warmth_injection
17940	5.237	ownership_language+casual_professionalism	discard	swap_the_feel_felt_found_for_casual_professionalism
17941	5.138	the_feel_felt_found	discard	remove_ownership_language
17942	5.525	the_feel_felt_found+ownership_language	discard	tone_change
17943	5.075	the_feel_felt_found	discard	crossover
17944	5.450	ownership_language+never_say_calm_down	discard	swap_the_feel_felt_found_for_never_say_calm_down
17945	5.550	the_feel_felt_found+ownership_language+genuine_admission	discard	add_genuine_admission
17946	5.325	the_feel_felt_found	discard	crossover
17947	5.338	the_feel_felt_found+ownership_language+never_say_calm_down	discard	add_never_say_calm_down
17948	5.013	the_feel_felt_found	discard	crossover
17949	5.013	the_feel_felt_found+ownership_language	discard	tone_change
17950	5.200	the_feel_felt_found+ownership_language	discard	tone_change
17951	5.200	the_feel_felt_found	discard	crossover
