generation	eq_score	techniques	status	description
6431	5.550	ownership_language	discard	crossover
6432	5.025	the_feel_felt_found+ownership_language	discard	temp_0.85
6433	5.325	the_feel_felt_found+ownership_language	discard	temp_0.65
6434	5.450	the_feel_felt_found+ownership_language	discard	tone_change
6435	5.450	the_feel_felt_found+ownership_language+proactive_extras	discard	add_proactive_extras
6436	5.450	the_feel_felt_found+ownership_language+emotional_labeling	discard	add_emotional_labeling
6437	5.325	the_feel_felt_found+ownership_language+casual_professionalism	discard	add_casual_professionalism
6438	5.013	the_feel_felt_found+ownership_language	discard	tone_change
6439	5.237	the_feel_felt_found+ownership_language	discard	crossover
6440	5.138	the_feel_felt_found	discard	remove_ownership_language
6441	5.138	the_feel_felt_found+ownership_language+concrete_next_steps	discard	add_concrete_next_steps
6442	4.925	ownership_language+mirroring	discard	swap_the_feel_felt_found_for_mirroring
6443	5.237	ownership_language+never_say_calm_down	discard	swap_the_feel_felt_found_for_never_say_calm_down
6444	5.213	the_feel_felt_found+ownership_language+validation_before_solution	discard	add_validation_before_solution
6445	5.450	the_feel_felt_found+never_say_calm_down	discard	swap_ownership_language_for_never_say_calm_down
6446	5.425	ownership_language+mirroring	discard	swap_the_feel_felt_found_for_mirroring
6447	5.437	the_feel_felt_found+ownership_language+proactive_extras	discard	add_proactive_extras
6448	5.450	the_feel_felt_found+ownership_language+strategic_agreement	discard	add_strategic_agreement
6449	5.138	the_feel_felt_found	discard	crossover
6450	5.013	the_feel_felt_found+ownership_language	discard	temp_0.75
6451	5.325	the_feel_felt_found+ownership_language	discard	crossover
6452	5.038	the_feel_felt_found+ownership_language	discard	crossover
6453	5.550	the_feel_felt_found	discard	crossover
6454	5.325	the_feel_felt_found	discard	crossover
6455	5.550	the_feel_felt_found+ownership_language+casual_professionalism	discard	add_casual_professionalism
6456	5.138	the_feel_felt_found+ownership_language+validation_before_solution	discard	add_validation_before_solution
6457	5.325	the_feel_felt_found+never_say_calm_down	discard	swap_ownership_language_for_never_say_calm_down
6458	5.450	the_feel_felt_found+ownership_language	discard	tone_change
6459	5.650	the_feel_felt_found+casual_professionalism	discard	swap_ownership_language_for_casual_professionalism
6460	5.550	the_feel_felt_found	discard	remove_ownership_language
6461	5.237	the_feel_felt_found+ownership_language	discard	tone_change
6462	5.237	the_feel_felt_found+ownership_language	discard	temp_0.90
6463	5.325	the_feel_felt_found+ownership_language	discard	crossover
6464	5.425	the_feel_felt_found+ownership_language+casual_professionalism	discard	add_casual_professionalism
6465	5.425	ownership_language+genuine_admission	discard	swap_the_feel_felt_found_for_genuine_admission
6466	5.325	the_feel_felt_found+ownership_language	discard	temp_0.75
6467	5.425	ownership_language+genuine_admission	discard	swap_the_feel_felt_found_for_genuine_admission
6468	4.888	the_feel_felt_found+ownership_language	discard	temp_0.70
6469	5.237	the_feel_felt_found+never_say_calm_down	discard	swap_ownership_language_for_never_say_calm_down
6470	5.113	the_feel_felt_found+ownership_language	discard	tone_change
6471	5.425	the_feel_felt_found+ownership_language	discard	crossover
6472	5.338	the_feel_felt_found	discard	remove_ownership_language
6473	5.325	the_feel_felt_found+ownership_language+validation_before_solution	discard	add_validation_before_solution
6474	5.550	the_feel_felt_found+ownership_language+genuine_admission	discard	add_genuine_admission
6475	4.825	the_feel_felt_found+ownership_language	discard	crossover
6476	5.650	ownership_language+concrete_next_steps	discard	swap_the_feel_felt_found_for_concrete_next_steps
6477	5.038	the_feel_felt_found+ownership_language	discard	tone_change
6478	5.550	none	discard	crossover
6479	5.300	the_feel_felt_found+ownership_language+concrete_next_steps	discard	add_concrete_next_steps
6480	5.350	the_feel_felt_found+ownership_language+mirroring	discard	add_mirroring
6481	5.013	the_feel_felt_found+ownership_language+energy_matching	discard	add_energy_matching
6482	4.825	the_feel_felt_found+ownership_language+never_say_calm_down	discard	add_never_say_calm_down
6483	5.338	the_feel_felt_found+ownership_language+concrete_next_steps	discard	add_concrete_next_steps
6484	5.325	the_feel_felt_found+ownership_language+genuine_admission	discard	add_genuine_admission
6485	5.213	the_feel_felt_found+ownership_language+mirroring	discard	add_mirroring
6486	4.925	the_feel_felt_found+ownership_language+casual_professionalism	discard	add_casual_professionalism
6487	5.200	the_feel_felt_found+ownership_language	discard	crossover
6488	5.138	the_feel_felt_found+ownership_language+genuine_admission	discard	add_genuine_admission
6489	5.112	the_feel_felt_found+ownership_language+emotional_labeling	discard	add_emotional_labeling
6490	4.925	the_feel_felt_found+ownership_language	discard	crossover
6491	5.013	the_feel_felt_found+ownership_language	discard	tone_change
6492	5.550	the_feel_felt_found+ownership_language	discard	tone_change
6493	5.237	the_feel_felt_found+ownership_language+energy_matching	discard	add_energy_matching
6494	5.550	the_feel_felt_found+ownership_language	discard	tone_change
6495	5.138	the_feel_felt_found+ownership_language	discard	tone_change
6496	5.550	ownership_language	discard	crossover
6497	5.300	ownership_language+mirroring	discard	swap_the_feel_felt_found_for_mirroring
6498	5.325	none	discard	crossover
6499	5.037	the_feel_felt_found	discard	remove_ownership_language
6500	5.350	the_feel_felt_found+ownership_language+casual_professionalism	discard	add_casual_professionalism
6501	5.325	the_feel_felt_found	discard	crossover
6502	5.325	the_feel_felt_found+ownership_language	discard	crossover
6503	5.112	ownership_language	discard	crossover
6504	5.450	the_feel_felt_found+warmth_injection	discard	swap_ownership_language_for_warmth_injection
6505	5.237	the_feel_felt_found+ownership_language	discard	tone_change
6506	5.450	the_feel_felt_found+ownership_language+personal_touch	discard	add_personal_touch
6507	4.925	the_feel_felt_found+ownership_language+casual_professionalism	discard	add_casual_professionalism
6508	5.025	ownership_language+emotional_labeling	discard	swap_the_feel_felt_found_for_emotional_labeling
6509	4.700	the_feel_felt_found+ownership_language	discard	tone_change
6510	5.425	ownership_language	discard	remove_the_feel_felt_found
6511	5.450	the_feel_felt_found+ownership_language+genuine_admission	discard	add_genuine_admission
6512	5.550	the_feel_felt_found+ownership_language	discard	temp_0.75
6513	5.338	the_feel_felt_found+ownership_language+validation_before_solution	discard	add_validation_before_solution
6514	5.300	the_feel_felt_found+ownership_language+proactive_extras	discard	add_proactive_extras
6515	5.550	the_feel_felt_found	discard	crossover
6516	5.212	the_feel_felt_found+ownership_language	discard	crossover
6517	5.325	ownership_language+energy_matching	discard	swap_the_feel_felt_found_for_energy_matching
6518	5.225	the_feel_felt_found+strategic_agreement	discard	swap_ownership_language_for_strategic_agreement
6519	5.325	the_feel_felt_found+emotional_labeling	discard	swap_ownership_language_for_emotional_labeling
6520	5.425	the_feel_felt_found+ownership_language	discard	tone_change
6521	5.550	the_feel_felt_found+ownership_language	discard	crossover
6522	5.225	ownership_language+genuine_admission	discard	swap_the_feel_felt_found_for_genuine_admission
6523	4.700	the_feel_felt_found	discard	crossover
6524	5.138	the_feel_felt_found+ownership_language+strategic_agreement	discard	add_strategic_agreement
6525	5.550	the_feel_felt_found+ownership_language	discard	tone_change
6526	5.200	the_feel_felt_found+ownership_language+energy_matching	discard	add_energy_matching
6527	5.650	the_feel_felt_found+ownership_language	discard	temp_0.65
6528	5.137	the_feel_felt_found+ownership_language+never_say_calm_down	discard	add_never_say_calm_down
6529	5.112	ownership_language+energy_matching	discard	swap_the_feel_felt_found_for_energy_matching
6530	4.800	the_feel_felt_found+ownership_language	discard	crossover
6531	5.325	the_feel_felt_found+proactive_extras	discard	swap_ownership_language_for_proactive_extras
6532	5.013	the_feel_felt_found+ownership_language+mirroring	discard	add_mirroring
6533	5.338	ownership_language+proactive_extras	discard	swap_the_feel_felt_found_for_proactive_extras
6534	5.650	the_feel_felt_found+warmth_injection	discard	swap_ownership_language_for_warmth_injection
6535	5.550	the_feel_felt_found+strategic_agreement	discard	swap_ownership_language_for_strategic_agreement
6536	4.612	the_feel_felt_found+energy_matching	discard	swap_ownership_language_for_energy_matching
6537	5.325	the_feel_felt_found+ownership_language+concrete_next_steps	discard	add_concrete_next_steps
6538	5.325	the_feel_felt_found+ownership_language	discard	crossover
6539	4.825	ownership_language+never_say_calm_down	discard	swap_the_feel_felt_found_for_never_say_calm_down
6540	4.888	ownership_language	discard	crossover
6541	5.138	ownership_language	discard	remove_the_feel_felt_found
6542	5.037	the_feel_felt_found+ownership_language+concrete_next_steps	discard	add_concrete_next_steps
6543	5.300	the_feel_felt_found+ownership_language+never_say_calm_down	discard	add_never_say_calm_down
6544	4.700	the_feel_felt_found	discard	crossover
6545	4.612	the_feel_felt_found+ownership_language	discard	crossover
6546	5.550	the_feel_felt_found+ownership_language+concrete_next_steps	discard	add_concrete_next_steps
6547	5.325	the_feel_felt_found+ownership_language	discard	crossover
6548	5.550	the_feel_felt_found+ownership_language	discard	tone_change
6549	5.013	ownership_language	discard	crossover
6550	5.450	ownership_language	discard	remove_the_feel_felt_found
6551	5.013	the_feel_felt_found+ownership_language	discard	tone_change
6552	5.113	the_feel_felt_found	discard	remove_ownership_language
6553	5.213	the_feel_felt_found+proactive_extras	discard	swap_ownership_language_for_proactive_extras
6554	5.350	ownership_language	discard	remove_the_feel_felt_found
6555	5.750	the_feel_felt_found+ownership_language	discard	temp_0.65
6556	5.525	the_feel_felt_found+ownership_language	discard	tone_change
6557	4.888	the_feel_felt_found+validation_before_solution	discard	swap_ownership_language_for_validation_before_solution
6558	5.550	ownership_language	discard	remove_the_feel_felt_found
6559	5.550	the_feel_felt_found+ownership_language+strategic_agreement	discard	add_strategic_agreement
6560	5.525	the_feel_felt_found+ownership_language	discard	tone_change
6561	5.112	ownership_language	discard	crossover
6562	5.338	ownership_language	discard	remove_the_feel_felt_found
6563	5.450	the_feel_felt_found+ownership_language+proactive_extras	discard	add_proactive_extras
6564	4.713	ownership_language+energy_matching	discard	swap_the_feel_felt_found_for_energy_matching
6565	5.525	the_feel_felt_found+mirroring	discard	swap_ownership_language_for_mirroring
6566	5.013	the_feel_felt_found+ownership_language	discard	crossover
6567	5.037	the_feel_felt_found+ownership_language	discard	tone_change
6568	5.450	ownership_language	discard	crossover
6569	5.013	the_feel_felt_found	discard	crossover
6570	4.825	the_feel_felt_found+ownership_language	discard	tone_change
6571	5.525	ownership_language	discard	remove_the_feel_felt_found
6572	5.450	the_feel_felt_found+ownership_language	discard	crossover
6573	5.450	the_feel_felt_found+ownership_language	discard	tone_change
6574	5.650	the_feel_felt_found+ownership_language	discard	temp_0.75
6575	5.450	the_feel_felt_found+ownership_language+strategic_agreement	discard	add_strategic_agreement
6576	5.450	the_feel_felt_found	discard	crossover
6577	4.913	the_feel_felt_found+ownership_language	discard	crossover
6578	5.325	the_feel_felt_found+ownership_language	discard	tone_change
6579	5.325	the_feel_felt_found+ownership_language+concrete_next_steps	discard	add_concrete_next_steps
6580	5.138	the_feel_felt_found+ownership_language	discard	temp_0.90
6581	4.925	the_feel_felt_found+ownership_language+emotional_labeling	discard	add_emotional_labeling
6582	4.975	the_feel_felt_found+ownership_language	discard	tone_change
6583	4.825	ownership_language+mirroring	discard	swap_the_feel_felt_found_for_mirroring
6584	5.425	the_feel_felt_found+ownership_language+mirroring	discard	add_mirroring
6585	5.138	ownership_language	discard	crossover
6586	5.525	the_feel_felt_found+ownership_language	discard	tone_change
6587	5.038	the_feel_felt_found+ownership_language	discard	crossover
6588	5.138	the_feel_felt_found+energy_matching	discard	swap_ownership_language_for_energy_matching
6589	5.325	the_feel_felt_found+mirroring	discard	swap_ownership_language_for_mirroring
6590	5.013	the_feel_felt_found+ownership_language+concrete_next_steps	discard	add_concrete_next_steps
6591	5.350	the_feel_felt_found+ownership_language	discard	crossover
6592	5.200	the_feel_felt_found+ownership_language+energy_matching	discard	add_energy_matching
6593	5.325	the_feel_felt_found+ownership_language+personal_touch	discard	add_personal_touch
6594	5.450	the_feel_felt_found	discard	crossover
6595	5.013	the_feel_felt_found+ownership_language	discard	temp_0.70
6596	5.200	the_feel_felt_found+ownership_language+energy_matching	discard	add_energy_matching
6597	5.200	the_feel_felt_found+ownership_language+emotional_labeling	discard	add_emotional_labeling
6598	5.450	the_feel_felt_found+ownership_language	discard	temp_0.95
6599	4.925	the_feel_felt_found+ownership_language+genuine_admission	discard	add_genuine_admission
6600	4.513	ownership_language+warmth_injection	discard	swap_the_feel_felt_found_for_warmth_injection
6601	5.338	the_feel_felt_found+ownership_language	discard	temp_0.75
6602	5.550	the_feel_felt_found+ownership_language+genuine_admission	discard	add_genuine_admission
6603	5.238	the_feel_felt_found+ownership_language	discard	crossover
6604	5.425	ownership_language+never_say_calm_down	discard	swap_the_feel_felt_found_for_never_say_calm_down
6605	5.138	the_feel_felt_found+casual_professionalism	discard	swap_ownership_language_for_casual_professionalism
6606	5.237	ownership_language	discard	remove_the_feel_felt_found
6607	5.425	ownership_language+validation_before_solution	discard	swap_the_feel_felt_found_for_validation_before_solution
6608	5.175	the_feel_felt_found+ownership_language	discard	tone_change
6609	5.550	the_feel_felt_found+ownership_language	discard	tone_change
6610	5.112	the_feel_felt_found+ownership_language+strategic_agreement	discard	add_strategic_agreement
6611	5.138	the_feel_felt_found+warmth_injection	discard	swap_ownership_language_for_warmth_injection
6612	5.350	the_feel_felt_found+ownership_language	discard	temp_0.75
6613	5.550	the_feel_felt_found+ownership_language+energy_matching	discard	add_energy_matching
6614	5.013	the_feel_felt_found	discard	crossover
6615	5.338	the_feel_felt_found+ownership_language	discard	tone_change
6616	5.325	the_feel_felt_found+ownership_language	discard	tone_change
6617	5.450	the_feel_felt_found+ownership_language	discard	tone_change
6618	5.450	the_feel_felt_found+ownership_language	discard	tone_change
6619	4.613	the_feel_felt_found+proactive_extras	discard	swap_ownership_language_for_proactive_extras
6620	5.338	ownership_language	discard	remove_the_feel_felt_found
6621	5.450	the_feel_felt_found+ownership_language+emotional_labeling	discard	add_emotional_labeling
6622	5.425	the_feel_felt_found+ownership_language+strategic_agreement	discard	add_strategic_agreement
6623	5.438	the_feel_felt_found+ownership_language+casual_professionalism	discard	add_casual_professionalism
6624	5.750	the_feel_felt_found+ownership_language	discard	tone_change
6625	5.450	the_feel_felt_found	discard	crossover
6626	4.825	the_feel_felt_found+ownership_language	discard	tone_change
6627	4.825	the_feel_felt_found+ownership_language	discard	tone_change
6628	5.450	the_feel_felt_found	discard	crossover
6629	5.237	ownership_language	discard	remove_the_feel_felt_found
6630	5.200	the_feel_felt_found+ownership_language+personal_touch	discard	add_personal_touch
6631	5.125	the_feel_felt_found+ownership_language	discard	crossover
6632	5.350	the_feel_felt_found	discard	remove_ownership_language
6633	5.350	the_feel_felt_found+ownership_language+never_say_calm_down	discard	add_never_say_calm_down
6634	5.237	the_feel_felt_found+ownership_language	discard	temp_0.85
6635	4.913	the_feel_felt_found+concrete_next_steps	discard	swap_ownership_language_for_concrete_next_steps
6636	5.013	the_feel_felt_found+strategic_agreement	discard	swap_ownership_language_for_strategic_agreement
6637	4.988	the_feel_felt_found+ownership_language	discard	crossover
6638	5.225	the_feel_felt_found+ownership_language+personal_touch	discard	add_personal_touch
6639	5.138	the_feel_felt_found+ownership_language	discard	tone_change
6640	4.888	the_feel_felt_found+ownership_language	discard	crossover
6641	5.425	the_feel_felt_found+ownership_language	discard	tone_change
6642	5.325	the_feel_felt_found+ownership_language+energy_matching	discard	add_energy_matching
6643	5.450	the_feel_felt_found+emotional_labeling	discard	swap_ownership_language_for_emotional_labeling
6644	5.013	the_feel_felt_found+ownership_language	discard	tone_change
6645	5.450	the_feel_felt_found	discard	crossover
6646	5.213	the_feel_felt_found+ownership_language	discard	tone_change
6647	5.325	the_feel_felt_found+ownership_language	discard	temp_0.85
6648	5.037	ownership_language+casual_professionalism	discard	swap_the_feel_felt_found_for_casual_professionalism
6649	5.550	the_feel_felt_found+ownership_language	discard	temp_0.65
6650	5.450	the_feel_felt_found+ownership_language+casual_professionalism	discard	add_casual_professionalism
6651	5.338	the_feel_felt_found	discard	remove_ownership_language
6652	5.037	the_feel_felt_found+ownership_language+emotional_labeling	discard	add_emotional_labeling
6653	5.338	the_feel_felt_found+ownership_language	discard	temp_0.70
6654	5.200	ownership_language+never_say_calm_down	discard	swap_the_feel_felt_found_for_never_say_calm_down
6655	5.237	the_feel_felt_found+ownership_language+casual_professionalism	discard	add_casual_professionalism
6656	5.013	the_feel_felt_found+ownership_language+genuine_admission	discard	add_genuine_admission
6657	5.325	ownership_language	discard	remove_the_feel_felt_found
6658	5.225	the_feel_felt_found+ownership_language	discard	tone_change
6659	5.300	the_feel_felt_found+proactive_extras	discard	swap_ownership_language_for_proactive_extras
6660	5.338	the_feel_felt_found+ownership_language	discard	crossover
6661	5.138	ownership_language	discard	remove_the_feel_felt_found
6662	5.137	the_feel_felt_found+ownership_language	discard	tone_change
6663	5.450	ownership_language	discard	remove_the_feel_felt_found
6664	5.237	ownership_language	discard	crossover
6665	4.925	the_feel_felt_found+ownership_language+emotional_labeling	discard	add_emotional_labeling
6666	5.350	the_feel_felt_found+ownership_language	discard	crossover
6667	4.600	the_feel_felt_found+warmth_injection	discard	swap_ownership_language_for_warmth_injection
6668	5.250	the_feel_felt_found+ownership_language+never_say_calm_down	discard	add_never_say_calm_down
6669	4.800	the_feel_felt_found+ownership_language+strategic_agreement	discard	add_strategic_agreement
6670	5.013	the_feel_felt_found+ownership_language	discard	temp_0.75
6671	5.325	ownership_language	discard	crossover
6672	5.237	the_feel_felt_found+ownership_language+strategic_agreement	discard	add_strategic_agreement
6673	4.825	ownership_language	discard	remove_the_feel_felt_found
6674	5.300	the_feel_felt_found+ownership_language	discard	tone_change
6675	5.450	the_feel_felt_found+ownership_language	discard	crossover
6676	5.112	ownership_language	discard	crossover
6677	5.325	the_feel_felt_found	discard	crossover
6678	5.013	the_feel_felt_found+ownership_language	discard	temp_0.70
6679	5.450	the_feel_felt_found+casual_professionalism	discard	swap_ownership_language_for_casual_professionalism
6680	5.300	the_feel_felt_found+ownership_language+never_say_calm_down	discard	add_never_say_calm_down
6681	5.550	the_feel_felt_found+ownership_language	discard	temp_0.90
6682	5.550	the_feel_felt_found+ownership_language	discard	tone_change
6683	5.450	ownership_language	discard	crossover
6684	5.425	the_feel_felt_found+ownership_language	discard	temp_0.65
6685	5.125	the_feel_felt_found	discard	remove_ownership_language
6686	5.325	the_feel_felt_found+ownership_language	discard	temp_0.85
6687	5.550	the_feel_felt_found+ownership_language	discard	temp_0.85
6688	5.137	the_feel_felt_found+ownership_language+casual_professionalism	discard	add_casual_professionalism
6689	4.713	the_feel_felt_found+ownership_language+mirroring	discard	add_mirroring
6690	5.450	the_feel_felt_found+ownership_language	discard	tone_change
6691	5.450	the_feel_felt_found+ownership_language	discard	crossover
6692	5.013	the_feel_felt_found	discard	crossover
6693	5.138	the_feel_felt_found+ownership_language+casual_professionalism	discard	add_casual_professionalism
6694	4.513	the_feel_felt_found+ownership_language	discard	temp_0.90
6695	5.550	the_feel_felt_found+ownership_language	discard	tone_change
6696	5.237	the_feel_felt_found+ownership_language+emotional_labeling	discard	add_emotional_labeling
6697	5.350	the_feel_felt_found+ownership_language+mirroring	discard	add_mirroring
6698	5.112	the_feel_felt_found	discard	remove_ownership_language
6699	5.138	the_feel_felt_found+ownership_language	discard	temp_0.85
6700	5.550	the_feel_felt_found+ownership_language	discard	tone_change
6701	5.325	the_feel_felt_found+ownership_language	discard	temp_0.65
6702	5.425	the_feel_felt_found	discard	crossover
6703	5.112	the_feel_felt_found	discard	crossover
6704	5.013	the_feel_felt_found+ownership_language	discard	tone_change
