generation	eq_score	techniques	status	description
864	5.325	the_feel_felt_found+ownership_language	discard	temp_0.65
865	5.138	ownership_language+genuine_admission	discard	swap_the_feel_felt_found_for_genuine_admission
866	5.325	the_feel_felt_found+ownership_language	discard	crossover
867	5.338	the_feel_felt_found	discard	crossover
868	5.112	the_feel_felt_found+ownership_language+energy_matching	discard	add_energy_matching
869	5.550	ownership_language+personal_touch	discard	swap_the_feel_felt_found_for_personal_touch
870	5.450	the_feel_felt_found+ownership_language	discard	tone_change
871	4.925	the_feel_felt_found+ownership_language+proactive_extras	discard	add_proactive_extras
872	4.825	the_feel_felt_found+ownership_language+energy_matching	discard	add_energy_matching
873	5.138	ownership_language	discard	remove_the_feel_felt_found
874	5.238	the_feel_felt_found+ownership_language	discard	crossover
875	5.425	the_feel_felt_found+ownership_language	discard	temp_0.90
876	5.438	the_feel_felt_found+ownership_language	discard	crossover
877	4.900	ownership_language	discard	crossover
878	4.825	the_feel_felt_found+ownership_language	discard	temp_0.65
879	5.113	the_feel_felt_found+ownership_language+personal_touch	discard	add_personal_touch
880	5.425	ownership_language	discard	crossover
881	5.325	the_feel_felt_found+ownership_language	discard	temp_0.70
882	5.550	the_feel_felt_found+ownership_language	discard	tone_change
883	5.112	the_feel_felt_found+ownership_language+strategic_agreement	discard	add_strategic_agreement
884	5.550	the_feel_felt_found+ownership_language+warmth_injection	discard	add_warmth_injection
885	5.450	the_feel_felt_found+ownership_language+mirroring	discard	add_mirroring
886	5.013	ownership_language	discard	remove_the_feel_felt_found
887	5.450	the_feel_felt_found	discard	crossover
888	5.200	the_feel_felt_found+ownership_language	discard	crossover
889	4.825	the_feel_felt_found+ownership_language	discard	tone_change
890	5.425	the_feel_felt_found	discard	crossover
891	5.138	the_feel_felt_found+ownership_language	discard	temp_0.65
892	4.612	ownership_language+emotional_labeling	discard	swap_the_feel_felt_found_for_emotional_labeling
893	5.013	the_feel_felt_found+ownership_language	discard	tone_change
894	5.450	ownership_language	discard	crossover
895	5.138	the_feel_felt_found+ownership_language	discard	tone_change
896	5.300	the_feel_felt_found+ownership_language	discard	crossover
897	4.925	the_feel_felt_found+ownership_language+casual_professionalism	discard	add_casual_professionalism
898	5.013	the_feel_felt_found+ownership_language	discard	tone_change
899	5.550	the_feel_felt_found	discard	remove_ownership_language
900	5.450	the_feel_felt_found	discard	remove_ownership_language
901	5.013	the_feel_felt_found+ownership_language	discard	temp_0.65
902	5.237	ownership_language	discard	crossover
903	5.025	the_feel_felt_found+ownership_language	discard	tone_change
904	5.550	the_feel_felt_found+ownership_language+mirroring	discard	add_mirroring
905	5.237	the_feel_felt_found+ownership_language+emotional_labeling	discard	add_emotional_labeling
906	4.888	ownership_language	discard	crossover
907	5.138	the_feel_felt_found+ownership_language	discard	tone_change
908	5.013	the_feel_felt_found	discard	crossover
909	5.325	the_feel_felt_found+ownership_language+personal_touch	discard	add_personal_touch
910	5.037	the_feel_felt_found+ownership_language	discard	tone_change
911	5.400	the_feel_felt_found+ownership_language	discard	temp_0.85
912	5.450	the_feel_felt_found+ownership_language	discard	crossover
913	5.225	the_feel_felt_found+ownership_language	discard	tone_change
914	5.325	the_feel_felt_found+ownership_language+genuine_admission	discard	add_genuine_admission
915	5.425	the_feel_felt_found+personal_touch	discard	swap_ownership_language_for_personal_touch
916	5.325	the_feel_felt_found+mirroring	discard	swap_ownership_language_for_mirroring
917	5.350	ownership_language	discard	crossover
918	5.325	the_feel_felt_found+ownership_language	discard	temp_0.95
919	5.450	the_feel_felt_found+ownership_language+energy_matching	discard	add_energy_matching
920	5.013	the_feel_felt_found+ownership_language+mirroring	discard	add_mirroring
921	4.888	none	discard	crossover
922	5.225	the_feel_felt_found+ownership_language+emotional_labeling	discard	add_emotional_labeling
923	5.425	the_feel_felt_found+ownership_language	discard	tone_change
924	5.138	ownership_language	discard	crossover
925	5.350	the_feel_felt_found+ownership_language+strategic_agreement	discard	add_strategic_agreement
926	5.550	the_feel_felt_found+concrete_next_steps	discard	swap_ownership_language_for_concrete_next_steps
927	5.237	the_feel_felt_found+casual_professionalism	discard	swap_ownership_language_for_casual_professionalism
928	5.237	the_feel_felt_found+ownership_language+warmth_injection	discard	add_warmth_injection
929	5.450	the_feel_felt_found+ownership_language+strategic_agreement	discard	add_strategic_agreement
930	5.425	the_feel_felt_found+ownership_language	discard	tone_change
931	5.325	the_feel_felt_found+ownership_language	discard	temp_0.65
932	4.825	the_feel_felt_found+ownership_language	discard	crossover
933	5.450	ownership_language	discard	remove_the_feel_felt_found
934	5.237	the_feel_felt_found+ownership_language	discard	temp_0.70
935	5.238	the_feel_felt_found+ownership_language+emotional_labeling	discard	add_emotional_labeling
936	5.238	ownership_language	discard	crossover
937	5.125	the_feel_felt_found+ownership_language+mirroring	discard	add_mirroring
938	5.013	the_feel_felt_found+ownership_language	discard	crossover
939	5.138	the_feel_felt_found+warmth_injection	discard	swap_ownership_language_for_warmth_injection
940	5.213	ownership_language	discard	remove_the_feel_felt_found
941	5.350	the_feel_felt_found+mirroring	discard	swap_ownership_language_for_mirroring
942	5.038	ownership_language+genuine_admission	discard	swap_the_feel_felt_found_for_genuine_admission
943	5.450	ownership_language	discard	crossover
944	5.338	the_feel_felt_found+ownership_language	discard	tone_change
945	5.338	the_feel_felt_found+ownership_language	discard	tone_change
946	5.425	the_feel_felt_found+ownership_language	discard	tone_change
947	5.450	the_feel_felt_found+ownership_language	discard	tone_change
948	5.138	the_feel_felt_found+ownership_language+never_say_calm_down	discard	add_never_say_calm_down
949	4.925	the_feel_felt_found	discard	crossover
950	5.138	the_feel_felt_found+ownership_language	discard	temp_0.75
951	5.425	the_feel_felt_found+ownership_language	discard	temp_0.95
952	5.138	the_feel_felt_found+ownership_language+personal_touch	discard	add_personal_touch
953	5.237	ownership_language+genuine_admission	discard	swap_the_feel_felt_found_for_genuine_admission
954	5.138	the_feel_felt_found+ownership_language+casual_professionalism	discard	add_casual_professionalism
955	5.013	the_feel_felt_found+ownership_language+proactive_extras	discard	add_proactive_extras
956	4.513	none	discard	crossover
957	5.138	ownership_language+proactive_extras	discard	swap_the_feel_felt_found_for_proactive_extras
958	5.013	the_feel_felt_found+strategic_agreement	discard	swap_ownership_language_for_strategic_agreement
959	5.138	ownership_language	discard	remove_the_feel_felt_found
960	5.450	ownership_language+strategic_agreement	discard	swap_the_feel_felt_found_for_strategic_agreement
961	4.825	the_feel_felt_found+ownership_language	discard	tone_change
962	4.913	the_feel_felt_found	discard	crossover
963	4.925	ownership_language	discard	crossover
964	5.325	the_feel_felt_found+ownership_language+genuine_admission	discard	add_genuine_admission
965	5.550	the_feel_felt_found+ownership_language	discard	tone_change
966	5.325	ownership_language+validation_before_solution	discard	swap_the_feel_felt_found_for_validation_before_solution
967	5.325	ownership_language	discard	remove_the_feel_felt_found
968	5.438	the_feel_felt_found+ownership_language	discard	temp_0.85
969	5.550	the_feel_felt_found+ownership_language+emotional_labeling	discard	add_emotional_labeling
970	5.425	the_feel_felt_found+ownership_language	discard	tone_change
971	5.237	the_feel_felt_found+ownership_language	discard	tone_change
972	5.450	the_feel_felt_found+ownership_language	discard	crossover
973	5.550	ownership_language+genuine_admission	discard	swap_the_feel_felt_found_for_genuine_admission
974	5.550	the_feel_felt_found+validation_before_solution	discard	swap_ownership_language_for_validation_before_solution
975	5.350	the_feel_felt_found+ownership_language	discard	tone_change
976	5.425	the_feel_felt_found+ownership_language+casual_professionalism	discard	add_casual_professionalism
977	5.425	the_feel_felt_found+ownership_language+never_say_calm_down	discard	add_never_say_calm_down
978	5.125	the_feel_felt_found+ownership_language	discard	tone_change
979	4.925	the_feel_felt_found+ownership_language+proactive_extras	discard	add_proactive_extras
980	5.025	the_feel_felt_found+ownership_language+casual_professionalism	discard	add_casual_professionalism
981	5.550	the_feel_felt_found	discard	crossover
982	5.237	the_feel_felt_found+ownership_language	discard	tone_change
983	5.013	the_feel_felt_found+ownership_language	discard	crossover
984	4.888	the_feel_felt_found+ownership_language	discard	tone_change
985	5.425	the_feel_felt_found+ownership_language	discard	crossover
986	5.025	ownership_language	discard	remove_the_feel_felt_found
987	5.175	the_feel_felt_found+ownership_language+personal_touch	discard	add_personal_touch
988	5.338	ownership_language+emotional_labeling	discard	swap_the_feel_felt_found_for_emotional_labeling
989	5.450	the_feel_felt_found+ownership_language	discard	temp_0.90
990	5.325	the_feel_felt_found+ownership_language+mirroring	discard	add_mirroring
991	5.025	the_feel_felt_found+emotional_labeling	discard	swap_ownership_language_for_emotional_labeling
992	5.338	the_feel_felt_found+ownership_language	discard	temp_0.65
993	5.325	the_feel_felt_found+ownership_language	discard	temp_0.95
994	4.700	the_feel_felt_found+ownership_language	discard	crossover
995	5.138	the_feel_felt_found+ownership_language	discard	temp_0.95
996	5.013	the_feel_felt_found+ownership_language+proactive_extras	discard	add_proactive_extras
997	5.325	the_feel_felt_found	discard	crossover
998	5.325	the_feel_felt_found+ownership_language	discard	tone_change
999	5.425	the_feel_felt_found+ownership_language+energy_matching	discard	add_energy_matching
1000	5.237	the_feel_felt_found	discard	crossover
1001	5.425	the_feel_felt_found	discard	remove_ownership_language
1002	5.450	ownership_language+personal_touch	discard	swap_the_feel_felt_found_for_personal_touch
1003	5.450	the_feel_felt_found+ownership_language	discard	tone_change
1004	5.013	the_feel_felt_found+ownership_language	discard	tone_change
1005	5.200	the_feel_felt_found+ownership_language+emotional_labeling	discard	add_emotional_labeling
1006	5.450	the_feel_felt_found+ownership_language	discard	temp_0.65
1007	5.325	ownership_language+warmth_injection	discard	swap_the_feel_felt_found_for_warmth_injection
1008	5.325	the_feel_felt_found+ownership_language+mirroring	discard	add_mirroring
1009	4.987	the_feel_felt_found+ownership_language+warmth_injection	discard	add_warmth_injection
1010	4.713	the_feel_felt_found+ownership_language	discard	tone_change
1011	5.325	ownership_language+energy_matching	discard	swap_the_feel_felt_found_for_energy_matching
1012	5.550	the_feel_felt_found	discard	crossover
1013	5.113	the_feel_felt_found+ownership_language+concrete_next_steps	discard	add_concrete_next_steps
1014	5.238	the_feel_felt_found+energy_matching	discard	swap_ownership_language_for_energy_matching
1015	5.237	the_feel_felt_found+warmth_injection	discard	swap_ownership_language_for_warmth_injection
1016	5.338	the_feel_felt_found+proactive_extras	discard	swap_ownership_language_for_proactive_extras
1017	5.325	the_feel_felt_found+ownership_language+validation_before_solution	discard	add_validation_before_solution
1018	4.925	ownership_language+mirroring	discard	swap_the_feel_felt_found_for_mirroring
1019	5.450	the_feel_felt_found+ownership_language	discard	tone_change
1020	5.112	the_feel_felt_found+ownership_language+personal_touch	discard	add_personal_touch
1021	5.112	the_feel_felt_found+ownership_language	discard	tone_change
1022	5.138	the_feel_felt_found+ownership_language	discard	temp_0.70
1023	4.700	the_feel_felt_found+ownership_language	discard	tone_change
1024	4.888	the_feel_felt_found+ownership_language+casual_professionalism	discard	add_casual_professionalism
1025	5.013	the_feel_felt_found+ownership_language	discard	crossover
1026	5.238	the_feel_felt_found+ownership_language	discard	tone_change
1027	5.550	the_feel_felt_found+ownership_language+energy_matching	discard	add_energy_matching
1028	5.013	the_feel_felt_found+ownership_language	discard	tone_change
1029	5.450	the_feel_felt_found+ownership_language	discard	temp_0.75
1030	5.138	ownership_language	discard	crossover
1031	4.800	the_feel_felt_found+ownership_language	discard	crossover
1032	5.425	the_feel_felt_found+ownership_language	discard	crossover
1033	5.550	the_feel_felt_found+ownership_language	discard	tone_change
1034	5.238	ownership_language	discard	crossover
1035	5.013	the_feel_felt_found+ownership_language+warmth_injection	discard	add_warmth_injection
1036	5.237	the_feel_felt_found+ownership_language	discard	tone_change
1037	5.450	the_feel_felt_found+ownership_language	discard	tone_change
1038	5.300	the_feel_felt_found+ownership_language+strategic_agreement	discard	add_strategic_agreement
1039	5.350	ownership_language	discard	remove_the_feel_felt_found
1040	5.425	none	discard	crossover
1041	5.450	the_feel_felt_found+ownership_language+personal_touch	discard	add_personal_touch
1042	5.338	ownership_language	discard	remove_the_feel_felt_found
1043	5.138	the_feel_felt_found+ownership_language+personal_touch	discard	add_personal_touch
1044	5.138	ownership_language	discard	remove_the_feel_felt_found
1045	5.450	the_feel_felt_found+ownership_language	discard	tone_change
1046	5.450	the_feel_felt_found+ownership_language	discard	temp_0.75
1047	5.550	ownership_language	discard	crossover
1048	5.550	ownership_language+proactive_extras	discard	swap_the_feel_felt_found_for_proactive_extras
1049	5.138	ownership_language+proactive_extras	discard	swap_the_feel_felt_found_for_proactive_extras
1050	5.237	the_feel_felt_found+energy_matching	discard	swap_ownership_language_for_energy_matching
1051	5.450	ownership_language	discard	crossover
1052	5.113	the_feel_felt_found+ownership_language	discard	temp_0.70
1053	5.238	the_feel_felt_found+ownership_language+validation_before_solution	discard	add_validation_before_solution
1054	5.338	ownership_language+concrete_next_steps	discard	swap_the_feel_felt_found_for_concrete_next_steps
1055	4.713	the_feel_felt_found+ownership_language+personal_touch	discard	add_personal_touch
1056	5.237	ownership_language	discard	remove_the_feel_felt_found
1057	4.825	the_feel_felt_found+ownership_language	discard	tone_change
1058	4.925	ownership_language+strategic_agreement	discard	swap_the_feel_felt_found_for_strategic_agreement
1059	5.350	the_feel_felt_found+casual_professionalism	discard	swap_ownership_language_for_casual_professionalism
1060	5.325	the_feel_felt_found+ownership_language+mirroring	discard	add_mirroring
1061	5.550	the_feel_felt_found+ownership_language	discard	crossover
1062	5.237	ownership_language	discard	crossover
1063	4.700	the_feel_felt_found+ownership_language	discard	crossover
1064	5.450	ownership_language+concrete_next_steps	discard	swap_the_feel_felt_found_for_concrete_next_steps
1065	5.650	the_feel_felt_found+ownership_language	discard	tone_change
1066	4.888	ownership_language	discard	crossover
1067	5.225	the_feel_felt_found	discard	crossover
1068	5.450	the_feel_felt_found+ownership_language	discard	tone_change
1069	4.700	the_feel_felt_found+ownership_language	discard	tone_change
1070	4.925	the_feel_felt_found+ownership_language	discard	tone_change
1071	5.450	the_feel_felt_found+strategic_agreement	discard	swap_ownership_language_for_strategic_agreement
1072	5.450	the_feel_felt_found+ownership_language+never_say_calm_down	discard	add_never_say_calm_down
1073	5.013	the_feel_felt_found	discard	crossover
1074	5.237	the_feel_felt_found	discard	remove_ownership_language
1075	5.325	the_feel_felt_found+ownership_language	discard	tone_change
1076	5.425	the_feel_felt_found+ownership_language	discard	crossover
1077	5.425	the_feel_felt_found+ownership_language	discard	tone_change
1078	5.112	the_feel_felt_found+ownership_language	discard	tone_change
1079	5.325	none	discard	crossover
1080	5.138	ownership_language+mirroring	discard	swap_the_feel_felt_found_for_mirroring
1081	4.825	ownership_language+emotional_labeling	discard	swap_the_feel_felt_found_for_emotional_labeling
1082	5.138	ownership_language+strategic_agreement	discard	swap_the_feel_felt_found_for_strategic_agreement
1083	5.350	the_feel_felt_found+strategic_agreement	discard	swap_ownership_language_for_strategic_agreement
1084	5.450	the_feel_felt_found+casual_professionalism	discard	swap_ownership_language_for_casual_professionalism
1085	5.238	the_feel_felt_found+ownership_language	discard	crossover
1086	5.325	the_feel_felt_found+ownership_language	discard	temp_0.65
1087	5.138	ownership_language	discard	remove_the_feel_felt_found
1088	4.912	the_feel_felt_found+ownership_language+strategic_agreement	discard	add_strategic_agreement
1089	5.112	ownership_language	discard	remove_the_feel_felt_found
1090	5.550	ownership_language+never_say_calm_down	discard	swap_the_feel_felt_found_for_never_say_calm_down
1091	5.525	the_feel_felt_found+ownership_language+validation_before_solution	discard	add_validation_before_solution
1092	5.338	the_feel_felt_found+ownership_language+emotional_labeling	discard	add_emotional_labeling
1093	5.200	ownership_language+strategic_agreement	discard	swap_the_feel_felt_found_for_strategic_agreement
1094	5.013	none	discard	crossover
1095	5.550	the_feel_felt_found	discard	crossover
1096	5.013	the_feel_felt_found+ownership_language	discard	tone_change
1097	5.225	the_feel_felt_found+ownership_language	discard	tone_change
1098	5.150	the_feel_felt_found+ownership_language	discard	temp_0.90
1099	5.138	the_feel_felt_found+ownership_language+genuine_admission	discard	add_genuine_admission
1100	5.550	the_feel_felt_found+ownership_language+proactive_extras	discard	add_proactive_extras
1101	5.138	ownership_language+validation_before_solution	discard	swap_the_feel_felt_found_for_validation_before_solution
1102	5.138	ownership_language	discard	remove_the_feel_felt_found
1103	5.225	the_feel_felt_found+ownership_language	discard	temp_0.75
1104	5.225	the_feel_felt_found+ownership_language+concrete_next_steps	discard	add_concrete_next_steps
1105	5.138	the_feel_felt_found	discard	remove_ownership_language
1106	5.325	the_feel_felt_found+ownership_language	discard	tone_change
1107	5.112	the_feel_felt_found+ownership_language	discard	tone_change
1108	5.200	the_feel_felt_found+ownership_language	discard	tone_change
1109	5.013	the_feel_felt_found+ownership_language	discard	temp_0.75
1110	5.237	the_feel_felt_found+ownership_language	discard	tone_change
1111	4.675	the_feel_felt_found+ownership_language	discard	tone_change
1112	5.550	the_feel_felt_found+ownership_language	discard	crossover
1113	5.237	ownership_language	discard	crossover
1114	5.525	the_feel_felt_found+ownership_language+validation_before_solution	discard	add_validation_before_solution
1115	5.200	the_feel_felt_found+validation_before_solution	discard	swap_ownership_language_for_validation_before_solution
1116	5.138	ownership_language	discard	crossover
1117	5.138	the_feel_felt_found+ownership_language	discard	tone_change
1118	5.425	the_feel_felt_found	discard	remove_ownership_language
1119	5.013	ownership_language+mirroring	discard	swap_the_feel_felt_found_for_mirroring
1120	5.338	the_feel_felt_found+personal_touch	discard	swap_ownership_language_for_personal_touch
1121	5.650	the_feel_felt_found+ownership_language	discard	temp_0.65
1122	5.550	the_feel_felt_found	discard	remove_ownership_language
1123	5.300	the_feel_felt_found+ownership_language	discard	temp_0.70
1124	5.550	the_feel_felt_found+personal_touch	discard	swap_ownership_language_for_personal_touch
1125	5.450	the_feel_felt_found+ownership_language	discard	temp_0.90
1126	5.237	the_feel_felt_found+ownership_language+energy_matching	discard	add_energy_matching
1127	5.550	the_feel_felt_found+ownership_language	discard	temp_0.85
1128	5.237	the_feel_felt_found	discard	crossover
1129	5.350	the_feel_felt_found+ownership_language+never_say_calm_down	discard	add_never_say_calm_down
1130	5.138	the_feel_felt_found+ownership_language+validation_before_solution	discard	add_validation_before_solution
1131	4.825	the_feel_felt_found+ownership_language	discard	temp_0.95
1132	5.013	the_feel_felt_found+emotional_labeling	discard	swap_ownership_language_for_emotional_labeling
1133	5.100	the_feel_felt_found+ownership_language	discard	tone_change
1134	5.237	the_feel_felt_found+ownership_language	discard	temp_0.90
1135	5.325	ownership_language+concrete_next_steps	discard	swap_the_feel_felt_found_for_concrete_next_steps
1136	5.350	the_feel_felt_found+ownership_language	discard	crossover
1137	5.037	the_feel_felt_found	discard	crossover
1138	5.338	the_feel_felt_found+ownership_language	discard	temp_0.95
1139	5.138	the_feel_felt_found+ownership_language+proactive_extras	discard	add_proactive_extras
1140	5.138	the_feel_felt_found+ownership_language	discard	tone_change
1141	5.325	the_feel_felt_found+ownership_language	discard	tone_change
1142	5.113	the_feel_felt_found+ownership_language	discard	crossover
1143	5.550	the_feel_felt_found+ownership_language+concrete_next_steps	discard	add_concrete_next_steps
1144	4.825	the_feel_felt_found+ownership_language	discard	crossover
1145	5.037	the_feel_felt_found+ownership_language	discard	tone_change
1146	5.212	the_feel_felt_found+ownership_language	discard	tone_change
