generation	eq_score	techniques	status	description
11909	5.450	the_feel_felt_found+ownership_language+genuine_admission	discard	add_genuine_admission
11910	4.700	the_feel_felt_found+ownership_language+never_say_calm_down	discard	add_never_say_calm_down
11911	5.138	ownership_language+personal_touch	discard	swap_the_feel_felt_found_for_personal_touch
11912	5.237	the_feel_felt_found+ownership_language	discard	temp_0.85
11913	5.138	none	discard	crossover
11914	5.437	the_feel_felt_found+ownership_language	discard	tone_change
11915	5.450	ownership_language	discard	crossover
11916	5.138	the_feel_felt_found+warmth_injection	discard	swap_ownership_language_for_warmth_injection
11917	5.650	the_feel_felt_found+ownership_language	discard	temp_0.65
11918	5.450	the_feel_felt_found+ownership_language	discard	temp_0.85
11919	5.113	the_feel_felt_found+ownership_language+mirroring	discard	add_mirroring
11920	5.650	the_feel_felt_found+ownership_language	discard	tone_change
11921	5.550	the_feel_felt_found+ownership_language	discard	tone_change
11922	5.013	the_feel_felt_found+ownership_language	discard	tone_change
11923	5.350	the_feel_felt_found+ownership_language	discard	temp_0.65
11924	5.013	the_feel_felt_found	discard	remove_ownership_language
11925	5.237	ownership_language	discard	remove_the_feel_felt_found
11926	5.450	the_feel_felt_found+ownership_language	discard	tone_change
11927	5.550	the_feel_felt_found+ownership_language	discard	tone_change
11928	4.612	the_feel_felt_found+ownership_language+personal_touch	discard	add_personal_touch
11929	4.825	none	discard	crossover
11930	5.225	the_feel_felt_found	discard	crossover
11931	5.237	the_feel_felt_found+ownership_language+strategic_agreement	discard	add_strategic_agreement
11932	5.213	the_feel_felt_found+ownership_language	discard	temp_0.65
11933	5.437	the_feel_felt_found+ownership_language+proactive_extras	discard	add_proactive_extras
11934	4.925	ownership_language	discard	crossover
11935	5.325	ownership_language	discard	remove_the_feel_felt_found
11936	5.237	the_feel_felt_found+ownership_language	discard	tone_change
11937	5.025	the_feel_felt_found+ownership_language+warmth_injection	discard	add_warmth_injection
11938	5.013	the_feel_felt_found	discard	crossover
11939	5.200	none	discard	crossover
11940	5.225	the_feel_felt_found+ownership_language+warmth_injection	discard	add_warmth_injection
11941	5.025	the_feel_felt_found+never_say_calm_down	discard	swap_ownership_language_for_never_say_calm_down
11942	5.325	the_feel_felt_found+ownership_language	discard	crossover
11943	5.100	ownership_language	discard	remove_the_feel_felt_found
11944	5.450	the_feel_felt_found+ownership_language	discard	tone_change
11945	5.138	the_feel_felt_found+proactive_extras	discard	swap_ownership_language_for_proactive_extras
11946	5.450	ownership_language+proactive_extras	discard	swap_the_feel_felt_found_for_proactive_extras
11947	5.112	the_feel_felt_found+ownership_language	discard	crossover
11948	5.238	the_feel_felt_found+ownership_language	discard	crossover
11949	5.300	the_feel_felt_found+ownership_language	discard	crossover
11950	5.225	the_feel_felt_found	discard	crossover
11951	5.138	the_feel_felt_found+ownership_language+energy_matching	discard	add_energy_matching
11952	5.013	the_feel_felt_found+ownership_language+emotional_labeling	discard	add_emotional_labeling
11953	5.237	the_feel_felt_found+ownership_language	discard	temp_0.85
11954	5.325	the_feel_felt_found+ownership_language	discard	temp_0.75
11955	5.237	the_feel_felt_found+ownership_language+strategic_agreement	discard	add_strategic_agreement
11956	4.825	the_feel_felt_found+ownership_language	discard	tone_change
11957	4.800	ownership_language+genuine_admission	discard	swap_the_feel_felt_found_for_genuine_admission
11958	5.013	ownership_language	discard	remove_the_feel_felt_found
11959	5.550	ownership_language	discard	crossover
11960	5.425	the_feel_felt_found+ownership_language	discard	tone_change
11961	5.237	the_feel_felt_found+ownership_language	discard	tone_change
11962	4.800	ownership_language	discard	crossover
11963	5.138	ownership_language+validation_before_solution	discard	swap_the_feel_felt_found_for_validation_before_solution
11964	5.450	the_feel_felt_found+ownership_language+concrete_next_steps	discard	add_concrete_next_steps
11965	5.237	the_feel_felt_found+ownership_language+warmth_injection	discard	add_warmth_injection
11966	5.200	the_feel_felt_found+ownership_language	discard	crossover
11967	4.825	ownership_language+mirroring	discard	swap_the_feel_felt_found_for_mirroring
11968	5.237	the_feel_felt_found+ownership_language	discard	tone_change
11969	5.550	the_feel_felt_found+ownership_language+never_say_calm_down	discard	add_never_say_calm_down
11970	4.925	the_feel_felt_found+proactive_extras	discard	swap_ownership_language_for_proactive_extras
11971	5.550	the_feel_felt_found+ownership_language+personal_touch	discard	add_personal_touch
11972	5.037	the_feel_felt_found	discard	remove_ownership_language
11973	5.138	the_feel_felt_found+ownership_language	discard	temp_0.85
11974	5.438	the_feel_felt_found+ownership_language+genuine_admission	discard	add_genuine_admission
11975	5.550	the_feel_felt_found+ownership_language+genuine_admission	discard	add_genuine_admission
11976	5.013	the_feel_felt_found+ownership_language+strategic_agreement	discard	add_strategic_agreement
11977	5.325	the_feel_felt_found+ownership_language+proactive_extras	discard	add_proactive_extras
11978	5.650	the_feel_felt_found+ownership_language	discard	tone_change
11979	5.450	the_feel_felt_found+ownership_language+warmth_injection	discard	add_warmth_injection
11980	5.200	the_feel_felt_found+ownership_language+never_say_calm_down	discard	add_never_say_calm_down
11981	5.112	the_feel_felt_found+ownership_language	discard	temp_0.65
11982	4.825	the_feel_felt_found+energy_matching	discard	swap_ownership_language_for_energy_matching
11983	5.625	the_feel_felt_found+ownership_language+concrete_next_steps	discard	add_concrete_next_steps
11984	5.425	ownership_language	discard	remove_the_feel_felt_found
11985	5.525	ownership_language+validation_before_solution	discard	swap_the_feel_felt_found_for_validation_before_solution
11986	4.825	the_feel_felt_found+ownership_language	discard	crossover
11987	4.787	ownership_language	discard	remove_the_feel_felt_found
11988	5.112	ownership_language	discard	crossover
11989	5.037	the_feel_felt_found+emotional_labeling	discard	swap_ownership_language_for_emotional_labeling
11990	5.550	the_feel_felt_found+ownership_language+never_say_calm_down	discard	add_never_say_calm_down
11991	5.238	the_feel_felt_found+ownership_language	discard	tone_change
11992	5.225	the_feel_felt_found+ownership_language	discard	crossover
11993	5.312	the_feel_felt_found+ownership_language	discard	temp_0.90
11994	5.225	the_feel_felt_found	discard	crossover
11995	5.550	the_feel_felt_found+ownership_language	discard	tone_change
11996	5.325	ownership_language	discard	remove_the_feel_felt_found
11997	5.138	the_feel_felt_found+ownership_language	discard	tone_change
11998	5.325	the_feel_felt_found+ownership_language	discard	tone_change
11999	5.237	the_feel_felt_found+ownership_language	discard	crossover
12000	4.925	the_feel_felt_found+ownership_language	discard	temp_0.95
12001	4.888	the_feel_felt_found+ownership_language	discard	tone_change
12002	4.913	ownership_language+energy_matching	discard	swap_the_feel_felt_found_for_energy_matching
12003	5.450	the_feel_felt_found	discard	remove_ownership_language
12004	5.138	the_feel_felt_found+ownership_language+genuine_admission	discard	add_genuine_admission
12005	5.075	the_feel_felt_found	discard	remove_ownership_language
12006	5.550	ownership_language	discard	crossover
12007	4.925	the_feel_felt_found+proactive_extras	discard	swap_ownership_language_for_proactive_extras
12008	5.138	the_feel_felt_found+ownership_language	discard	tone_change
12009	5.013	the_feel_felt_found	discard	crossover
12010	5.237	ownership_language+warmth_injection	discard	swap_the_feel_felt_found_for_warmth_injection
12011	5.138	the_feel_felt_found+ownership_language	discard	crossover
12012	5.213	the_feel_felt_found	discard	crossover
12013	4.612	the_feel_felt_found+ownership_language	discard	tone_change
12014	4.925	the_feel_felt_found+ownership_language+personal_touch	discard	add_personal_touch
12015	5.013	the_feel_felt_found+ownership_language	discard	crossover
12016	4.925	the_feel_felt_found+ownership_language	discard	crossover
12017	5.425	the_feel_felt_found	discard	crossover
12018	5.550	ownership_language+mirroring	discard	swap_the_feel_felt_found_for_mirroring
12019	5.550	the_feel_felt_found+ownership_language	discard	tone_change
12020	5.337	the_feel_felt_found+ownership_language	discard	tone_change
12021	5.112	the_feel_felt_found+ownership_language+casual_professionalism	discard	add_casual_professionalism
12022	5.450	the_feel_felt_found+casual_professionalism	discard	swap_ownership_language_for_casual_professionalism
12023	4.800	the_feel_felt_found+casual_professionalism	discard	swap_ownership_language_for_casual_professionalism
12024	5.325	the_feel_felt_found+ownership_language	discard	temp_0.85
12025	5.138	the_feel_felt_found+ownership_language	discard	tone_change
12026	5.013	the_feel_felt_found+ownership_language	discard	temp_0.65
12027	5.550	the_feel_felt_found+ownership_language+mirroring	discard	add_mirroring
12028	5.038	the_feel_felt_found+ownership_language	discard	tone_change
12029	5.325	the_feel_felt_found+ownership_language	discard	tone_change
12030	5.138	the_feel_felt_found+ownership_language	discard	crossover
12031	5.450	the_feel_felt_found+ownership_language+casual_professionalism	discard	add_casual_professionalism
12032	5.325	the_feel_felt_found+ownership_language	discard	temp_0.70
12033	5.550	the_feel_felt_found+ownership_language+never_say_calm_down	discard	add_never_say_calm_down
12034	5.138	the_feel_felt_found+ownership_language	discard	crossover
12035	5.113	the_feel_felt_found+ownership_language	discard	temp_0.70
12036	5.300	the_feel_felt_found+ownership_language	discard	crossover
12037	5.550	the_feel_felt_found+energy_matching	discard	swap_ownership_language_for_energy_matching
12038	4.825	ownership_language+warmth_injection	discard	swap_the_feel_felt_found_for_warmth_injection
12039	4.987	the_feel_felt_found+ownership_language	discard	tone_change
12040	5.300	the_feel_felt_found+ownership_language	discard	tone_change
12041	4.888	the_feel_felt_found+ownership_language+never_say_calm_down	discard	add_never_say_calm_down
12042	5.650	the_feel_felt_found	discard	crossover
12043	5.337	the_feel_felt_found+ownership_language	discard	tone_change
12044	5.325	the_feel_felt_found+ownership_language+casual_professionalism	discard	add_casual_professionalism
12045	5.425	the_feel_felt_found+ownership_language	discard	tone_change
12046	5.237	the_feel_felt_found	discard	crossover
12047	5.325	the_feel_felt_found+ownership_language+genuine_admission	discard	add_genuine_admission
12048	5.325	the_feel_felt_found+ownership_language	discard	tone_change
12049	5.138	the_feel_felt_found+ownership_language	discard	tone_change
12050	5.238	ownership_language	discard	crossover
12051	5.350	the_feel_felt_found+ownership_language+mirroring	discard	add_mirroring
12052	4.888	the_feel_felt_found+ownership_language+strategic_agreement	discard	add_strategic_agreement
12053	5.013	the_feel_felt_found+ownership_language	discard	tone_change
12054	5.425	the_feel_felt_found+ownership_language	discard	tone_change
12055	5.550	the_feel_felt_found+ownership_language	discard	crossover
12056	5.450	the_feel_felt_found+ownership_language	discard	tone_change
12057	5.138	the_feel_felt_found+ownership_language	discard	tone_change
12058	5.138	the_feel_felt_found+ownership_language	discard	tone_change
12059	5.200	the_feel_felt_found+ownership_language	discard	tone_change
12060	4.925	the_feel_felt_found+genuine_admission	discard	swap_ownership_language_for_genuine_admission
12061	4.700	the_feel_felt_found+ownership_language	discard	tone_change
12062	5.212	the_feel_felt_found+ownership_language	discard	tone_change
12063	5.450	the_feel_felt_found+ownership_language+energy_matching	discard	add_energy_matching
12064	5.137	the_feel_felt_found+ownership_language	discard	temp_0.75
12065	5.013	the_feel_felt_found+ownership_language	discard	tone_change
12066	5.225	the_feel_felt_found+ownership_language	discard	temp_0.70
12067	5.750	the_feel_felt_found+ownership_language+casual_professionalism	discard	add_casual_professionalism
12068	5.037	the_feel_felt_found+ownership_language+genuine_admission	discard	add_genuine_admission
12069	5.550	ownership_language+energy_matching	discard	swap_the_feel_felt_found_for_energy_matching
12070	5.112	the_feel_felt_found+ownership_language+emotional_labeling	discard	add_emotional_labeling
12071	5.325	the_feel_felt_found+ownership_language	discard	crossover
12072	5.037	the_feel_felt_found+ownership_language	discard	temp_0.85
12073	5.013	ownership_language	discard	crossover
12074	5.200	the_feel_felt_found+personal_touch	discard	swap_ownership_language_for_personal_touch
12075	5.137	the_feel_felt_found	discard	remove_ownership_language
12076	5.550	the_feel_felt_found+ownership_language	discard	crossover
12077	4.800	the_feel_felt_found+emotional_labeling	discard	swap_ownership_language_for_emotional_labeling
12078	5.138	the_feel_felt_found+ownership_language	discard	temp_0.65
12079	5.325	the_feel_felt_found+ownership_language	discard	tone_change
12080	5.037	the_feel_felt_found+ownership_language	discard	temp_0.85
12081	5.112	the_feel_felt_found+ownership_language	discard	tone_change
12082	5.138	the_feel_felt_found+ownership_language	discard	crossover
12083	4.825	the_feel_felt_found+ownership_language	discard	tone_change
12084	5.450	the_feel_felt_found+ownership_language	discard	tone_change
12085	5.138	the_feel_felt_found+ownership_language	discard	tone_change
12086	5.138	ownership_language	discard	remove_the_feel_felt_found
12087	5.237	the_feel_felt_found	discard	remove_ownership_language
12088	5.237	the_feel_felt_found+ownership_language+strategic_agreement	discard	add_strategic_agreement
12089	4.700	the_feel_felt_found+strategic_agreement	discard	swap_ownership_language_for_strategic_agreement
12090	5.450	the_feel_felt_found+ownership_language+never_say_calm_down	discard	add_never_say_calm_down
12091	4.825	ownership_language+emotional_labeling	discard	swap_the_feel_felt_found_for_emotional_labeling
12092	5.013	the_feel_felt_found+ownership_language	discard	temp_0.65
12093	4.800	the_feel_felt_found+warmth_injection	discard	swap_ownership_language_for_warmth_injection
12094	5.337	the_feel_felt_found+energy_matching	discard	swap_ownership_language_for_energy_matching
12095	5.550	the_feel_felt_found+validation_before_solution	discard	swap_ownership_language_for_validation_before_solution
12096	5.237	the_feel_felt_found+ownership_language	discard	tone_change
12097	5.425	ownership_language+strategic_agreement	discard	swap_the_feel_felt_found_for_strategic_agreement
12098	5.013	ownership_language	discard	crossover
12099	5.450	the_feel_felt_found+ownership_language	discard	temp_0.75
12100	5.013	the_feel_felt_found+ownership_language+proactive_extras	discard	add_proactive_extras
12101	5.138	the_feel_felt_found+ownership_language+strategic_agreement	discard	add_strategic_agreement
12102	5.112	the_feel_felt_found+ownership_language	discard	temp_0.90
12103	5.213	the_feel_felt_found+energy_matching	discard	swap_ownership_language_for_energy_matching
12104	5.138	ownership_language+validation_before_solution	discard	swap_the_feel_felt_found_for_validation_before_solution
12105	5.425	the_feel_felt_found+ownership_language+concrete_next_steps	discard	add_concrete_next_steps
12106	5.225	the_feel_felt_found+ownership_language	discard	tone_change
12107	5.450	the_feel_felt_found+ownership_language	discard	crossover
12108	5.425	the_feel_felt_found+ownership_language	discard	crossover
12109	5.138	ownership_language	discard	crossover
12110	5.237	the_feel_felt_found+ownership_language+warmth_injection	discard	add_warmth_injection
12111	5.325	the_feel_felt_found+ownership_language	discard	temp_0.95
12112	4.825	the_feel_felt_found+ownership_language+never_say_calm_down	discard	add_never_say_calm_down
12113	5.550	the_feel_felt_found+ownership_language+mirroring	discard	add_mirroring
12114	5.438	the_feel_felt_found+concrete_next_steps	discard	swap_ownership_language_for_concrete_next_steps
12115	5.325	the_feel_felt_found	discard	crossover
12116	5.750	the_feel_felt_found+ownership_language	discard	crossover
12117	5.225	the_feel_felt_found	discard	remove_ownership_language
12118	5.225	the_feel_felt_found+ownership_language	discard	tone_change
12119	5.450	ownership_language	discard	crossover
12120	5.650	the_feel_felt_found+ownership_language+never_say_calm_down	discard	add_never_say_calm_down
12121	5.138	the_feel_felt_found+ownership_language+casual_professionalism	discard	add_casual_professionalism
12122	5.138	the_feel_felt_found+ownership_language	discard	temp_0.90
12123	4.987	the_feel_felt_found+ownership_language+mirroring	discard	add_mirroring
12124	5.550	the_feel_felt_found+ownership_language	discard	temp_0.70
12125	5.325	ownership_language+genuine_admission	discard	swap_the_feel_felt_found_for_genuine_admission
12126	5.325	the_feel_felt_found+ownership_language	discard	crossover
12127	5.325	the_feel_felt_found+ownership_language	discard	crossover
12128	5.450	ownership_language	discard	crossover
12129	5.025	the_feel_felt_found+ownership_language+personal_touch	discard	add_personal_touch
12130	5.450	ownership_language+strategic_agreement	discard	swap_the_feel_felt_found_for_strategic_agreement
12131	5.550	the_feel_felt_found+ownership_language+concrete_next_steps	discard	add_concrete_next_steps
12132	5.450	the_feel_felt_found+personal_touch	discard	swap_ownership_language_for_personal_touch
12133	5.025	ownership_language	discard	crossover
12134	5.237	the_feel_felt_found+ownership_language	discard	tone_change
12135	5.013	the_feel_felt_found+ownership_language+energy_matching	discard	add_energy_matching
12136	5.425	the_feel_felt_found+ownership_language+personal_touch	discard	add_personal_touch
12137	5.138	the_feel_felt_found+ownership_language	discard	tone_change
12138	5.450	the_feel_felt_found	discard	remove_ownership_language
12139	5.425	ownership_language+strategic_agreement	discard	swap_the_feel_felt_found_for_strategic_agreement
12140	5.238	ownership_language+genuine_admission	discard	swap_the_feel_felt_found_for_genuine_admission
12141	5.300	the_feel_felt_found+ownership_language+personal_touch	discard	add_personal_touch
12142	5.650	the_feel_felt_found+mirroring	discard	swap_ownership_language_for_mirroring
12143	5.237	ownership_language	discard	crossover
12144	5.425	the_feel_felt_found+ownership_language	discard	tone_change
12145	5.450	ownership_language	discard	remove_the_feel_felt_found
12146	5.300	the_feel_felt_found+ownership_language	discard	tone_change
12147	5.112	ownership_language	discard	remove_the_feel_felt_found
12148	5.025	the_feel_felt_found+ownership_language+proactive_extras	discard	add_proactive_extras
12149	5.325	the_feel_felt_found+ownership_language	discard	temp_0.70
12150	5.425	the_feel_felt_found+ownership_language	discard	crossover
12151	5.550	ownership_language	discard	remove_the_feel_felt_found
12152	5.650	the_feel_felt_found+ownership_language	discard	tone_change
12153	5.350	the_feel_felt_found+ownership_language	discard	temp_0.95
12154	4.825	ownership_language+genuine_admission	discard	swap_the_feel_felt_found_for_genuine_admission
12155	5.550	the_feel_felt_found+ownership_language+mirroring	discard	add_mirroring
12156	5.213	the_feel_felt_found+ownership_language	discard	temp_0.70
12157	5.025	the_feel_felt_found+concrete_next_steps	discard	swap_ownership_language_for_concrete_next_steps
12158	5.138	the_feel_felt_found+ownership_language	discard	crossover
12159	5.550	none	discard	crossover
12160	5.450	the_feel_felt_found+ownership_language	discard	tone_change
12161	5.025	the_feel_felt_found+ownership_language+emotional_labeling	discard	add_emotional_labeling
12162	5.450	the_feel_felt_found+ownership_language+warmth_injection	discard	add_warmth_injection
12163	5.037	ownership_language+concrete_next_steps	discard	swap_the_feel_felt_found_for_concrete_next_steps
12164	5.550	ownership_language	discard	crossover
12165	5.138	the_feel_felt_found+ownership_language+genuine_admission	discard	add_genuine_admission
12166	5.550	the_feel_felt_found+ownership_language	discard	tone_change
12167	5.550	the_feel_felt_found+proactive_extras	discard	swap_ownership_language_for_proactive_extras
12168	5.013	the_feel_felt_found+ownership_language	discard	crossover
12169	5.300	the_feel_felt_found+ownership_language+warmth_injection	discard	add_warmth_injection
12170	5.225	the_feel_felt_found+ownership_language	discard	temp_0.95
12171	5.450	the_feel_felt_found+ownership_language+energy_matching	discard	add_energy_matching
12172	5.237	ownership_language+personal_touch	discard	swap_the_feel_felt_found_for_personal_touch
12173	5.225	the_feel_felt_found	discard	crossover
12174	5.237	the_feel_felt_found+ownership_language	discard	tone_change
12175	5.650	the_feel_felt_found	discard	remove_ownership_language
12176	5.650	ownership_language	discard	remove_the_feel_felt_found
12177	4.513	the_feel_felt_found+ownership_language	discard	tone_change
12178	5.550	the_feel_felt_found+ownership_language	discard	crossover
12179	5.425	the_feel_felt_found+ownership_language+mirroring	discard	add_mirroring
12180	5.550	ownership_language+proactive_extras	discard	swap_the_feel_felt_found_for_proactive_extras
12181	5.200	ownership_language	discard	crossover
12182	5.013	the_feel_felt_found+ownership_language	discard	crossover
12183	5.112	ownership_language+casual_professionalism	discard	swap_the_feel_felt_found_for_casual_professionalism
12184	5.237	the_feel_felt_found+ownership_language	discard	temp_0.75
12185	5.325	the_feel_felt_found	discard	remove_ownership_language
