generation	eq_score	techniques	status	description
2537	5.350	the_feel_felt_found+warmth_injection	discard	swap_ownership_language_for_warmth_injection
2538	5.138	ownership_language	discard	crossover
2539	5.138	the_feel_felt_found+ownership_language	discard	crossover
2540	5.237	the_feel_felt_found+ownership_language+warmth_injection	discard	add_warmth_injection
2541	5.550	the_feel_felt_found+ownership_language	discard	temp_0.85
2542	4.825	the_feel_felt_found	discard	remove_ownership_language
2543	5.112	ownership_language+strategic_agreement	discard	swap_the_feel_felt_found_for_strategic_agreement
2544	5.425	the_feel_felt_found+ownership_language	discard	temp_0.65
2545	4.950	the_feel_felt_found+ownership_language	discard	temp_0.85
2546	5.200	the_feel_felt_found+validation_before_solution	discard	swap_ownership_language_for_validation_before_solution
2547	5.550	the_feel_felt_found	discard	crossover
2548	4.925	the_feel_felt_found+ownership_language	discard	crossover
2549	5.425	ownership_language	discard	remove_the_feel_felt_found
2550	5.425	the_feel_felt_found+ownership_language+concrete_next_steps	discard	add_concrete_next_steps
2551	5.325	the_feel_felt_found+ownership_language	discard	tone_change
2552	5.550	the_feel_felt_found+ownership_language	discard	tone_change
2553	4.912	the_feel_felt_found+ownership_language+emotional_labeling	discard	add_emotional_labeling
2554	5.325	the_feel_felt_found+ownership_language	discard	crossover
2555	5.112	the_feel_felt_found+ownership_language+proactive_extras	discard	add_proactive_extras
2556	5.650	the_feel_felt_found+ownership_language	discard	crossover
2557	5.237	the_feel_felt_found+ownership_language	discard	tone_change
2558	5.350	ownership_language	discard	crossover
2559	5.425	none	discard	crossover
2560	5.037	the_feel_felt_found+ownership_language+warmth_injection	discard	add_warmth_injection
2561	5.138	ownership_language+emotional_labeling	discard	swap_the_feel_felt_found_for_emotional_labeling
2562	4.925	the_feel_felt_found+ownership_language	discard	tone_change
2563	5.425	ownership_language+casual_professionalism	discard	swap_the_feel_felt_found_for_casual_professionalism
2564	5.225	the_feel_felt_found+energy_matching	discard	swap_ownership_language_for_energy_matching
2565	4.825	the_feel_felt_found+ownership_language+concrete_next_steps	discard	add_concrete_next_steps
2566	5.325	ownership_language	discard	remove_the_feel_felt_found
2567	4.725	the_feel_felt_found+strategic_agreement	discard	swap_ownership_language_for_strategic_agreement
2568	5.450	ownership_language	discard	crossover
2569	5.550	the_feel_felt_found	discard	crossover
2570	5.138	the_feel_felt_found+ownership_language	discard	temp_0.75
2571	5.138	the_feel_felt_found+ownership_language+casual_professionalism	discard	add_casual_professionalism
2572	5.250	the_feel_felt_found+ownership_language	discard	tone_change
2573	5.013	the_feel_felt_found+ownership_language+casual_professionalism	discard	add_casual_professionalism
2574	5.550	the_feel_felt_found+ownership_language+validation_before_solution	discard	add_validation_before_solution
2575	5.238	ownership_language+personal_touch	discard	swap_the_feel_felt_found_for_personal_touch
2576	5.013	the_feel_felt_found+ownership_language	discard	temp_0.85
2577	5.113	the_feel_felt_found+ownership_language	discard	tone_change
2578	5.138	the_feel_felt_found+ownership_language	discard	tone_change
2579	5.013	the_feel_felt_found+ownership_language	discard	tone_change
2580	5.200	ownership_language+casual_professionalism	discard	swap_the_feel_felt_found_for_casual_professionalism
2581	5.325	ownership_language+concrete_next_steps	discard	swap_the_feel_felt_found_for_concrete_next_steps
2582	5.325	the_feel_felt_found+ownership_language	discard	crossover
2583	5.125	the_feel_felt_found	discard	crossover
2584	4.613	the_feel_felt_found+ownership_language	discard	tone_change
2585	5.550	the_feel_felt_found+ownership_language+strategic_agreement	discard	add_strategic_agreement
2586	5.550	the_feel_felt_found+ownership_language+genuine_admission	discard	add_genuine_admission
2587	5.350	the_feel_felt_found+ownership_language+mirroring	discard	add_mirroring
2588	4.925	the_feel_felt_found+ownership_language	discard	temp_0.95
2589	5.138	the_feel_felt_found+ownership_language+emotional_labeling	discard	add_emotional_labeling
2590	5.450	the_feel_felt_found+ownership_language	discard	crossover
2591	4.825	the_feel_felt_found+ownership_language	discard	crossover
2592	5.650	the_feel_felt_found	discard	remove_ownership_language
2593	5.225	the_feel_felt_found+ownership_language	discard	crossover
2594	5.138	the_feel_felt_found+ownership_language	discard	crossover
2595	5.200	the_feel_felt_found+ownership_language	discard	temp_0.70
2596	5.025	the_feel_felt_found	discard	remove_ownership_language
2597	5.550	the_feel_felt_found+ownership_language	discard	crossover
2598	5.450	the_feel_felt_found+ownership_language	discard	tone_change
2599	5.450	the_feel_felt_found	discard	remove_ownership_language
2600	5.237	the_feel_felt_found+ownership_language+concrete_next_steps	discard	add_concrete_next_steps
2601	4.825	the_feel_felt_found+ownership_language	discard	tone_change
2602	5.450	the_feel_felt_found+ownership_language	discard	temp_0.90
2603	5.138	the_feel_felt_found+ownership_language+proactive_extras	discard	add_proactive_extras
2604	5.338	the_feel_felt_found+ownership_language	discard	temp_0.65
2605	5.550	the_feel_felt_found+ownership_language	discard	tone_change
2606	5.550	the_feel_felt_found+ownership_language	discard	tone_change
2607	5.325	the_feel_felt_found+ownership_language	discard	crossover
2608	5.200	the_feel_felt_found+ownership_language	discard	crossover
2609	5.237	the_feel_felt_found+casual_professionalism	discard	swap_ownership_language_for_casual_professionalism
2610	5.650	ownership_language+casual_professionalism	discard	swap_the_feel_felt_found_for_casual_professionalism
2611	5.337	ownership_language	discard	crossover
2612	5.138	the_feel_felt_found+ownership_language	discard	crossover
2613	5.350	the_feel_felt_found+ownership_language	discard	tone_change
2614	5.013	ownership_language	discard	remove_the_feel_felt_found
2615	5.138	the_feel_felt_found+ownership_language	discard	temp_0.70
2616	5.200	the_feel_felt_found	discard	remove_ownership_language
2617	5.037	the_feel_felt_found+ownership_language	discard	crossover
2618	4.988	ownership_language	discard	remove_the_feel_felt_found
2619	5.013	the_feel_felt_found+ownership_language	discard	temp_0.75
2620	5.237	the_feel_felt_found+ownership_language+genuine_admission	discard	add_genuine_admission
2621	5.650	the_feel_felt_found+ownership_language	discard	tone_change
2622	5.113	the_feel_felt_found+ownership_language	discard	temp_0.75
2623	5.338	the_feel_felt_found+mirroring	discard	swap_ownership_language_for_mirroring
2624	5.425	ownership_language+strategic_agreement	discard	swap_the_feel_felt_found_for_strategic_agreement
2625	5.138	ownership_language	discard	remove_the_feel_felt_found
2626	5.425	the_feel_felt_found+ownership_language	discard	tone_change
2627	5.650	the_feel_felt_found+ownership_language	discard	tone_change
2628	5.550	the_feel_felt_found+ownership_language+personal_touch	discard	add_personal_touch
2629	5.300	the_feel_felt_found+ownership_language	discard	crossover
2630	4.825	the_feel_felt_found+ownership_language	discard	temp_0.90
2631	5.425	ownership_language+strategic_agreement	discard	swap_the_feel_felt_found_for_strategic_agreement
2632	5.200	the_feel_felt_found+ownership_language	discard	temp_0.95
2633	4.825	the_feel_felt_found+ownership_language	discard	tone_change
2634	5.237	the_feel_felt_found	discard	remove_ownership_language
2635	5.112	the_feel_felt_found+ownership_language+emotional_labeling	discard	add_emotional_labeling
2636	5.438	the_feel_felt_found+ownership_language	discard	tone_change
2637	5.450	the_feel_felt_found+ownership_language+genuine_admission	discard	add_genuine_admission
2638	5.137	ownership_language+emotional_labeling	discard	swap_the_feel_felt_found_for_emotional_labeling
2639	4.487	the_feel_felt_found+mirroring	discard	swap_ownership_language_for_mirroring
2640	5.450	the_feel_felt_found+ownership_language	discard	tone_change
2641	5.338	ownership_language	discard	crossover
2642	5.350	the_feel_felt_found+ownership_language	discard	crossover
2643	5.200	ownership_language+validation_before_solution	discard	swap_the_feel_felt_found_for_validation_before_solution
2644	5.138	the_feel_felt_found+ownership_language	discard	crossover
2645	5.550	the_feel_felt_found+ownership_language+warmth_injection	discard	add_warmth_injection
2646	5.138	the_feel_felt_found+ownership_language	discard	crossover
2647	5.325	ownership_language	discard	crossover
2648	5.550	the_feel_felt_found	discard	remove_ownership_language
2649	5.138	the_feel_felt_found+ownership_language	discard	temp_0.65
2650	5.237	the_feel_felt_found+ownership_language	discard	crossover
2651	5.325	the_feel_felt_found+ownership_language	discard	tone_change
2652	5.450	the_feel_felt_found+validation_before_solution	discard	swap_ownership_language_for_validation_before_solution
2653	5.550	the_feel_felt_found+ownership_language	discard	temp_0.90
2654	5.237	the_feel_felt_found+ownership_language+personal_touch	discard	add_personal_touch
2655	5.137	the_feel_felt_found+ownership_language	discard	tone_change
2656	4.913	the_feel_felt_found+ownership_language+personal_touch	discard	add_personal_touch
2657	5.025	the_feel_felt_found	discard	remove_ownership_language
2658	5.425	the_feel_felt_found+ownership_language	discard	tone_change
2659	4.912	the_feel_felt_found+ownership_language	discard	crossover
2660	5.138	the_feel_felt_found+ownership_language	discard	temp_0.90
2661	4.575	the_feel_felt_found	discard	crossover
2662	5.237	ownership_language+strategic_agreement	discard	swap_the_feel_felt_found_for_strategic_agreement
2663	5.225	the_feel_felt_found+ownership_language	discard	tone_change
2664	4.925	the_feel_felt_found+ownership_language+energy_matching	discard	add_energy_matching
2665	5.425	ownership_language+emotional_labeling	discard	swap_the_feel_felt_found_for_emotional_labeling
2666	4.800	the_feel_felt_found+personal_touch	discard	swap_ownership_language_for_personal_touch
2667	5.337	the_feel_felt_found+ownership_language+proactive_extras	discard	add_proactive_extras
2668	5.200	the_feel_felt_found+ownership_language	discard	tone_change
2669	5.400	none	discard	crossover
2670	5.425	the_feel_felt_found+ownership_language	discard	tone_change
2671	5.300	the_feel_felt_found+ownership_language	discard	tone_change
2672	4.888	the_feel_felt_found+ownership_language	discard	tone_change
2673	5.425	the_feel_felt_found+ownership_language+mirroring	discard	add_mirroring
2674	5.138	the_feel_felt_found+ownership_language	discard	temp_0.75
2675	4.888	the_feel_felt_found+ownership_language	discard	tone_change
2676	4.925	ownership_language+energy_matching	discard	swap_the_feel_felt_found_for_energy_matching
2677	5.338	ownership_language	discard	crossover
2678	5.238	ownership_language	discard	crossover
2679	5.200	the_feel_felt_found+ownership_language	discard	temp_0.90
2680	5.450	ownership_language	discard	remove_the_feel_felt_found
2681	5.425	ownership_language+validation_before_solution	discard	swap_the_feel_felt_found_for_validation_before_solution
2682	5.138	ownership_language+personal_touch	discard	swap_the_feel_felt_found_for_personal_touch
2683	5.450	the_feel_felt_found+ownership_language	discard	tone_change
2684	5.400	the_feel_felt_found+energy_matching	discard	swap_ownership_language_for_energy_matching
2685	5.350	the_feel_felt_found+ownership_language	discard	crossover
2686	5.338	none	discard	crossover
2687	5.350	the_feel_felt_found+ownership_language+proactive_extras	discard	add_proactive_extras
2688	4.612	the_feel_felt_found+ownership_language+proactive_extras	discard	add_proactive_extras
2689	5.138	the_feel_felt_found+ownership_language	discard	tone_change
2690	5.100	the_feel_felt_found+ownership_language+genuine_admission	discard	add_genuine_admission
2691	4.513	the_feel_felt_found+ownership_language+strategic_agreement	discard	add_strategic_agreement
2692	5.325	the_feel_felt_found	discard	remove_ownership_language
2693	5.138	ownership_language	discard	crossover
2694	5.350	the_feel_felt_found	discard	remove_ownership_language
2695	5.338	the_feel_felt_found+never_say_calm_down	discard	swap_ownership_language_for_never_say_calm_down
2696	5.200	the_feel_felt_found+ownership_language	discard	tone_change
2697	5.425	none	discard	crossover
2698	5.237	none	discard	crossover
2699	4.925	the_feel_felt_found+ownership_language+genuine_admission	discard	add_genuine_admission
2700	4.925	the_feel_felt_found+ownership_language	discard	tone_change
2701	5.025	the_feel_felt_found+ownership_language	discard	temp_0.85
2702	5.325	ownership_language	discard	remove_the_feel_felt_found
2703	5.425	the_feel_felt_found+ownership_language	discard	tone_change
2704	5.237	ownership_language	discard	remove_the_feel_felt_found
2705	5.550	the_feel_felt_found+ownership_language	discard	crossover
2706	4.825	the_feel_felt_found+ownership_language	discard	tone_change
2707	5.350	the_feel_felt_found+ownership_language	discard	crossover
2708	5.237	the_feel_felt_found+ownership_language	discard	temp_0.95
2709	5.225	the_feel_felt_found+ownership_language+casual_professionalism	discard	add_casual_professionalism
2710	4.513	the_feel_felt_found+ownership_language	discard	temp_0.85
2711	5.013	the_feel_felt_found+ownership_language	discard	tone_change
2712	4.825	the_feel_felt_found+ownership_language+casual_professionalism	discard	add_casual_professionalism
2713	5.112	the_feel_felt_found+energy_matching	discard	swap_ownership_language_for_energy_matching
2714	5.250	the_feel_felt_found+ownership_language	discard	temp_0.65
2715	5.113	the_feel_felt_found+ownership_language+energy_matching	discard	add_energy_matching
2716	5.325	the_feel_felt_found+ownership_language	discard	crossover
2717	5.450	ownership_language+warmth_injection	discard	swap_the_feel_felt_found_for_warmth_injection
2718	5.300	the_feel_felt_found+ownership_language	discard	temp_0.95
2719	5.013	the_feel_felt_found	discard	crossover
2720	5.525	the_feel_felt_found+ownership_language	discard	temp_0.90
2721	4.800	the_feel_felt_found+ownership_language	discard	tone_change
2722	4.713	none	discard	crossover
2723	5.425	the_feel_felt_found+ownership_language	discard	crossover
2724	5.237	the_feel_felt_found+ownership_language	discard	temp_0.75
2725	4.988	ownership_language+emotional_labeling	discard	swap_the_feel_felt_found_for_emotional_labeling
2726	5.450	the_feel_felt_found+ownership_language	discard	temp_0.85
2727	5.550	ownership_language+proactive_extras	discard	swap_the_feel_felt_found_for_proactive_extras
2728	5.112	ownership_language+validation_before_solution	discard	swap_the_feel_felt_found_for_validation_before_solution
2729	5.325	the_feel_felt_found+ownership_language+emotional_labeling	discard	add_emotional_labeling
2730	5.138	ownership_language	discard	crossover
2731	5.013	the_feel_felt_found+casual_professionalism	discard	swap_ownership_language_for_casual_professionalism
2732	5.425	the_feel_felt_found	discard	crossover
2733	5.450	the_feel_felt_found+ownership_language+warmth_injection	discard	add_warmth_injection
2734	5.112	the_feel_felt_found+ownership_language	discard	temp_0.90
2735	5.013	the_feel_felt_found+ownership_language	discard	temp_0.90
2736	5.550	the_feel_felt_found+ownership_language+proactive_extras	discard	add_proactive_extras
2737	5.450	the_feel_felt_found+strategic_agreement	discard	swap_ownership_language_for_strategic_agreement
2738	5.138	the_feel_felt_found+ownership_language+proactive_extras	discard	add_proactive_extras
2739	5.138	the_feel_felt_found+ownership_language	discard	temp_0.75
2740	5.238	the_feel_felt_found+ownership_language	discard	temp_0.85
2741	4.925	ownership_language	discard	crossover
2742	5.237	ownership_language	discard	remove_the_feel_felt_found
2743	5.013	the_feel_felt_found+ownership_language+proactive_extras	discard	add_proactive_extras
2744	5.550	the_feel_felt_found+ownership_language	discard	temp_0.85
2745	5.338	the_feel_felt_found+ownership_language	discard	crossover
2746	5.213	the_feel_felt_found+ownership_language	discard	temp_0.65
2747	5.450	ownership_language	discard	remove_the_feel_felt_found
2748	5.350	ownership_language+strategic_agreement	discard	swap_the_feel_felt_found_for_strategic_agreement
2749	5.138	the_feel_felt_found+ownership_language+validation_before_solution	discard	add_validation_before_solution
2750	5.550	none	discard	crossover
2751	5.250	the_feel_felt_found+ownership_language	discard	temp_0.65
2752	5.550	ownership_language+concrete_next_steps	discard	swap_the_feel_felt_found_for_concrete_next_steps
2753	5.113	the_feel_felt_found+ownership_language	discard	tone_change
2754	5.238	the_feel_felt_found+ownership_language+concrete_next_steps	discard	add_concrete_next_steps
2755	5.450	the_feel_felt_found+ownership_language	discard	tone_change
2756	5.237	the_feel_felt_found	discard	remove_ownership_language
2757	4.925	the_feel_felt_found+ownership_language	discard	crossover
2758	5.138	the_feel_felt_found+ownership_language	discard	crossover
2759	5.100	the_feel_felt_found+ownership_language+validation_before_solution	discard	add_validation_before_solution
2760	5.013	the_feel_felt_found+ownership_language	discard	tone_change
2761	5.350	the_feel_felt_found+ownership_language	discard	temp_0.95
2762	5.450	the_feel_felt_found+ownership_language+mirroring	discard	add_mirroring
2763	5.013	the_feel_felt_found+ownership_language	discard	tone_change
2764	5.012	the_feel_felt_found+ownership_language+never_say_calm_down	discard	add_never_say_calm_down
2765	5.325	ownership_language+strategic_agreement	discard	swap_the_feel_felt_found_for_strategic_agreement
2766	5.237	the_feel_felt_found+ownership_language+casual_professionalism	discard	add_casual_professionalism
2767	5.550	the_feel_felt_found+ownership_language	discard	temp_0.85
2768	5.750	ownership_language	discard	crossover
2769	4.925	the_feel_felt_found+ownership_language	discard	tone_change
2770	4.913	ownership_language	discard	crossover
2771	5.325	the_feel_felt_found+ownership_language+proactive_extras	discard	add_proactive_extras
2772	5.138	the_feel_felt_found+ownership_language	discard	tone_change
2773	5.650	the_feel_felt_found+ownership_language	discard	tone_change
2774	5.325	the_feel_felt_found+ownership_language+proactive_extras	discard	add_proactive_extras
2775	5.450	the_feel_felt_found+ownership_language	discard	tone_change
2776	5.112	the_feel_felt_found+ownership_language	discard	crossover
2777	5.525	the_feel_felt_found+ownership_language	discard	tone_change
2778	5.112	the_feel_felt_found+ownership_language	discard	temp_0.65
2779	5.113	the_feel_felt_found+ownership_language+casual_professionalism	discard	add_casual_professionalism
2780	5.075	ownership_language	discard	crossover
2781	5.425	the_feel_felt_found	discard	remove_ownership_language
2782	5.113	ownership_language	discard	remove_the_feel_felt_found
2783	5.450	the_feel_felt_found+ownership_language	discard	tone_change
2784	4.888	the_feel_felt_found+ownership_language	discard	temp_0.95
2785	5.300	the_feel_felt_found+ownership_language+emotional_labeling	discard	add_emotional_labeling
2786	5.013	the_feel_felt_found+ownership_language	discard	temp_0.90
2787	5.450	the_feel_felt_found	discard	crossover
2788	5.550	ownership_language	discard	remove_the_feel_felt_found
2789	5.013	the_feel_felt_found+ownership_language+concrete_next_steps	discard	add_concrete_next_steps
2790	5.113	the_feel_felt_found+casual_professionalism	discard	swap_ownership_language_for_casual_professionalism
2791	4.912	the_feel_felt_found+ownership_language+energy_matching	discard	add_energy_matching
2792	5.450	the_feel_felt_found+ownership_language	discard	temp_0.65
2793	5.138	ownership_language+energy_matching	discard	swap_the_feel_felt_found_for_energy_matching
2794	5.550	the_feel_felt_found	discard	remove_ownership_language
2795	5.550	the_feel_felt_found+ownership_language	discard	tone_change
2796	5.013	the_feel_felt_found+ownership_language+never_say_calm_down	discard	add_never_say_calm_down
2797	5.338	the_feel_felt_found+ownership_language+genuine_admission	discard	add_genuine_admission
2798	4.925	the_feel_felt_found+ownership_language	discard	crossover
2799	5.013	the_feel_felt_found+proactive_extras	discard	swap_ownership_language_for_proactive_extras
2800	5.037	ownership_language	discard	crossover
2801	5.450	the_feel_felt_found+ownership_language+personal_touch	discard	add_personal_touch
2802	5.550	the_feel_felt_found+ownership_language	discard	tone_change
2803	5.237	the_feel_felt_found+ownership_language	discard	tone_change
2804	5.450	the_feel_felt_found+ownership_language	discard	tone_change
2805	5.237	none	discard	crossover
2806	5.038	the_feel_felt_found+ownership_language	discard	tone_change
2807	4.825	ownership_language+concrete_next_steps	discard	swap_the_feel_felt_found_for_concrete_next_steps
2808	5.250	the_feel_felt_found+ownership_language	discard	tone_change
2809	5.025	the_feel_felt_found	discard	remove_ownership_language
2810	5.237	the_feel_felt_found+ownership_language	discard	tone_change
2811	5.750	the_feel_felt_found+ownership_language	discard	tone_change
2812	5.325	the_feel_felt_found+ownership_language	discard	tone_change
2813	5.338	the_feel_felt_found	discard	crossover
2814	5.138	the_feel_felt_found+ownership_language	discard	temp_0.75
2815	5.350	the_feel_felt_found+ownership_language	discard	temp_0.65
2816	5.550	the_feel_felt_found+ownership_language+warmth_injection	discard	add_warmth_injection
2817	5.450	the_feel_felt_found+ownership_language+warmth_injection	discard	add_warmth_injection
2818	5.013	ownership_language	discard	crossover
2819	4.987	none	discard	crossover
2820	5.013	the_feel_felt_found+ownership_language+energy_matching	discard	add_energy_matching
