generation	eq_score	techniques	status	description
5044	5.425	the_feel_felt_found+ownership_language	discard	tone_change
5045	5.550	ownership_language	discard	remove_the_feel_felt_found
5046	5.537	the_feel_felt_found+ownership_language	discard	tone_change
5047	5.550	the_feel_felt_found+ownership_language	discard	temp_0.65
5048	5.450	the_feel_felt_found+ownership_language	discard	crossover
5049	5.013	the_feel_felt_found+ownership_language	discard	temp_0.95
5050	4.825	the_feel_felt_found+ownership_language+casual_professionalism	discard	add_casual_professionalism
5051	4.825	the_feel_felt_found+ownership_language	discard	temp_0.75
5052	5.550	the_feel_felt_found+ownership_language+never_say_calm_down	discard	add_never_say_calm_down
5053	4.912	ownership_language+concrete_next_steps	discard	swap_the_feel_felt_found_for_concrete_next_steps
5054	5.450	ownership_language	discard	remove_the_feel_felt_found
5055	5.138	ownership_language+warmth_injection	discard	swap_the_feel_felt_found_for_warmth_injection
5056	5.237	the_feel_felt_found+ownership_language+casual_professionalism	discard	add_casual_professionalism
5057	5.237	none	discard	crossover
5058	5.400	the_feel_felt_found	discard	remove_ownership_language
5059	5.213	the_feel_felt_found+ownership_language	discard	temp_0.70
5060	5.138	the_feel_felt_found+ownership_language	discard	tone_change
5061	5.013	the_feel_felt_found+ownership_language	discard	tone_change
5062	5.550	the_feel_felt_found+ownership_language+concrete_next_steps	discard	add_concrete_next_steps
5063	5.350	the_feel_felt_found+ownership_language+concrete_next_steps	discard	add_concrete_next_steps
5064	5.525	the_feel_felt_found+ownership_language	discard	tone_change
5065	5.325	the_feel_felt_found+ownership_language	discard	crossover
5066	4.600	ownership_language	discard	crossover
5067	4.613	the_feel_felt_found+ownership_language	discard	temp_0.95
5068	5.138	the_feel_felt_found+ownership_language+personal_touch	discard	add_personal_touch
5069	5.100	the_feel_felt_found+ownership_language	discard	tone_change
5070	5.550	the_feel_felt_found+ownership_language+strategic_agreement	discard	add_strategic_agreement
5071	5.450	the_feel_felt_found+ownership_language	discard	tone_change
5072	5.325	the_feel_felt_found	discard	remove_ownership_language
5073	5.450	the_feel_felt_found+ownership_language	discard	temp_0.65
5074	5.138	the_feel_felt_found+concrete_next_steps	discard	swap_ownership_language_for_concrete_next_steps
5075	5.138	ownership_language+never_say_calm_down	discard	swap_the_feel_felt_found_for_never_say_calm_down
5076	5.237	the_feel_felt_found+ownership_language	discard	temp_0.90
5077	5.325	the_feel_felt_found+ownership_language+casual_professionalism	discard	add_casual_professionalism
5078	5.138	the_feel_felt_found	discard	remove_ownership_language
5079	5.450	the_feel_felt_found+ownership_language	discard	crossover
5080	5.550	the_feel_felt_found+ownership_language	discard	temp_0.65
5081	5.325	the_feel_felt_found+ownership_language	discard	tone_change
5082	4.800	the_feel_felt_found+ownership_language	discard	tone_change
5083	5.013	the_feel_felt_found+ownership_language	discard	tone_change
5084	5.113	the_feel_felt_found	discard	remove_ownership_language
5085	5.013	the_feel_felt_found+ownership_language	discard	tone_change
5086	4.888	the_feel_felt_found+ownership_language	discard	tone_change
5087	5.325	the_feel_felt_found+energy_matching	discard	swap_ownership_language_for_energy_matching
5088	5.450	the_feel_felt_found+ownership_language	discard	crossover
5089	5.550	the_feel_felt_found+ownership_language	discard	crossover
5090	5.450	the_feel_felt_found+ownership_language	discard	crossover
5091	5.138	the_feel_felt_found+concrete_next_steps	discard	swap_ownership_language_for_concrete_next_steps
5092	5.238	the_feel_felt_found+ownership_language	discard	tone_change
5093	5.450	the_feel_felt_found+ownership_language+concrete_next_steps	discard	add_concrete_next_steps
5094	5.325	ownership_language+warmth_injection	discard	swap_the_feel_felt_found_for_warmth_injection
5095	5.650	the_feel_felt_found+ownership_language+genuine_admission	discard	add_genuine_admission
5096	5.450	the_feel_felt_found+ownership_language	discard	temp_0.85
5097	5.225	the_feel_felt_found+ownership_language	discard	tone_change
5098	5.350	the_feel_felt_found+ownership_language	discard	temp_0.95
5099	5.550	the_feel_felt_found	discard	crossover
5100	5.238	the_feel_felt_found+ownership_language	discard	crossover
5101	4.975	the_feel_felt_found+ownership_language	discard	crossover
5102	5.112	the_feel_felt_found+ownership_language	discard	crossover
5103	5.138	the_feel_felt_found+ownership_language	discard	temp_0.85
5104	5.238	the_feel_felt_found+casual_professionalism	discard	swap_ownership_language_for_casual_professionalism
5105	5.113	the_feel_felt_found+ownership_language	discard	tone_change
5106	5.137	the_feel_felt_found	discard	crossover
5107	5.138	the_feel_felt_found+ownership_language	discard	tone_change
5108	5.450	the_feel_felt_found+ownership_language	discard	temp_0.65
5109	5.325	the_feel_felt_found+ownership_language+strategic_agreement	discard	add_strategic_agreement
5110	5.237	the_feel_felt_found	discard	crossover
5111	5.237	the_feel_felt_found+ownership_language+casual_professionalism	discard	add_casual_professionalism
5112	5.200	the_feel_felt_found+ownership_language	discard	tone_change
5113	5.325	the_feel_felt_found+ownership_language+energy_matching	discard	add_energy_matching
5114	5.237	ownership_language	discard	crossover
5115	5.450	ownership_language+mirroring	discard	swap_the_feel_felt_found_for_mirroring
5116	5.238	the_feel_felt_found+ownership_language	discard	tone_change
5117	5.238	ownership_language	discard	remove_the_feel_felt_found
5118	4.925	the_feel_felt_found	discard	remove_ownership_language
5119	4.700	the_feel_felt_found	discard	crossover
5120	5.550	the_feel_felt_found+ownership_language+proactive_extras	discard	add_proactive_extras
5121	5.450	the_feel_felt_found+ownership_language	discard	crossover
5122	5.338	the_feel_felt_found+ownership_language	discard	tone_change
5123	5.225	ownership_language	discard	remove_the_feel_felt_found
5124	5.025	the_feel_felt_found+ownership_language+energy_matching	discard	add_energy_matching
5125	5.013	ownership_language	discard	remove_the_feel_felt_found
5126	5.325	the_feel_felt_found+ownership_language+mirroring	discard	add_mirroring
5127	4.825	ownership_language+genuine_admission	discard	swap_the_feel_felt_found_for_genuine_admission
5128	5.650	the_feel_felt_found+ownership_language+casual_professionalism	discard	add_casual_professionalism
5129	5.450	the_feel_felt_found+ownership_language	discard	temp_0.75
5130	5.138	ownership_language	discard	remove_the_feel_felt_found
5131	4.987	the_feel_felt_found+ownership_language+never_say_calm_down	discard	add_never_say_calm_down
5132	5.237	the_feel_felt_found+ownership_language	discard	tone_change
5133	5.138	the_feel_felt_found	discard	crossover
5134	5.237	ownership_language+emotional_labeling	discard	swap_the_feel_felt_found_for_emotional_labeling
5135	5.013	the_feel_felt_found+ownership_language+validation_before_solution	discard	add_validation_before_solution
5136	5.550	the_feel_felt_found+ownership_language	discard	crossover
5137	5.550	the_feel_felt_found+ownership_language	discard	temp_0.65
5138	5.338	the_feel_felt_found+ownership_language+emotional_labeling	discard	add_emotional_labeling
5139	5.650	the_feel_felt_found+ownership_language+strategic_agreement	discard	add_strategic_agreement
5140	5.450	the_feel_felt_found+ownership_language	discard	crossover
5141	5.013	the_feel_felt_found+ownership_language	discard	temp_0.65
5142	5.038	ownership_language+never_say_calm_down	discard	swap_the_feel_felt_found_for_never_say_calm_down
5143	5.750	the_feel_felt_found+warmth_injection	discard	swap_ownership_language_for_warmth_injection
5144	5.138	the_feel_felt_found+ownership_language	discard	temp_0.65
5145	5.450	the_feel_felt_found+ownership_language+never_say_calm_down	discard	add_never_say_calm_down
5146	5.112	the_feel_felt_found	discard	crossover
5147	5.438	ownership_language+casual_professionalism	discard	swap_the_feel_felt_found_for_casual_professionalism
5148	5.138	the_feel_felt_found	discard	crossover
5149	5.450	the_feel_felt_found+ownership_language	discard	crossover
5150	5.550	the_feel_felt_found+ownership_language	discard	tone_change
5151	5.300	the_feel_felt_found+ownership_language	discard	temp_0.75
5152	5.013	the_feel_felt_found+ownership_language+casual_professionalism	discard	add_casual_professionalism
5153	5.450	the_feel_felt_found+ownership_language	discard	temp_0.90
5154	5.138	ownership_language+proactive_extras	discard	swap_the_feel_felt_found_for_proactive_extras
5155	5.550	the_feel_felt_found+ownership_language+personal_touch	discard	add_personal_touch
5156	5.013	the_feel_felt_found+ownership_language	discard	tone_change
5157	5.550	ownership_language	discard	crossover
5158	5.013	the_feel_felt_found+ownership_language	discard	tone_change
5159	5.450	ownership_language+never_say_calm_down	discard	swap_the_feel_felt_found_for_never_say_calm_down
5160	5.325	ownership_language	discard	crossover
5161	5.450	ownership_language	discard	remove_the_feel_felt_found
5162	5.450	the_feel_felt_found+ownership_language+proactive_extras	discard	add_proactive_extras
5163	5.325	the_feel_felt_found+ownership_language	discard	crossover
5164	5.138	ownership_language	discard	remove_the_feel_felt_found
5165	5.438	the_feel_felt_found+ownership_language	discard	temp_0.75
5166	5.013	the_feel_felt_found+ownership_language+concrete_next_steps	discard	add_concrete_next_steps
5167	5.325	the_feel_felt_found+ownership_language+energy_matching	discard	add_energy_matching
5168	5.450	none	discard	crossover
5169	5.138	the_feel_felt_found+ownership_language	discard	temp_0.90
5170	5.213	ownership_language	discard	crossover
5171	5.013	the_feel_felt_found+ownership_language	discard	tone_change
5172	5.450	the_feel_felt_found+ownership_language	discard	crossover
5173	5.350	the_feel_felt_found+warmth_injection	discard	swap_ownership_language_for_warmth_injection
5174	5.325	the_feel_felt_found	discard	remove_ownership_language
5175	5.425	the_feel_felt_found+ownership_language	discard	crossover
5176	5.300	ownership_language	discard	crossover
5177	5.200	the_feel_felt_found+ownership_language+personal_touch	discard	add_personal_touch
5178	5.013	ownership_language+proactive_extras	discard	swap_the_feel_felt_found_for_proactive_extras
5179	5.450	the_feel_felt_found+ownership_language+emotional_labeling	discard	add_emotional_labeling
5180	5.325	the_feel_felt_found+ownership_language	discard	tone_change
5181	5.550	the_feel_felt_found+ownership_language+warmth_injection	discard	add_warmth_injection
5182	5.450	the_feel_felt_found+ownership_language+validation_before_solution	discard	add_validation_before_solution
5183	5.450	the_feel_felt_found+ownership_language	discard	tone_change
5184	5.450	ownership_language+concrete_next_steps	discard	swap_the_feel_felt_found_for_concrete_next_steps
5185	5.138	the_feel_felt_found+proactive_extras	discard	swap_ownership_language_for_proactive_extras
5186	5.550	the_feel_felt_found+ownership_language+proactive_extras	discard	add_proactive_extras
5187	4.612	ownership_language	discard	remove_the_feel_felt_found
5188	4.513	the_feel_felt_found+concrete_next_steps	discard	swap_ownership_language_for_concrete_next_steps
5189	5.200	the_feel_felt_found+ownership_language	discard	temp_0.75
5190	5.650	the_feel_felt_found+ownership_language	discard	crossover
5191	5.237	the_feel_felt_found+ownership_language+emotional_labeling	discard	add_emotional_labeling
5192	5.550	ownership_language+never_say_calm_down	discard	swap_the_feel_felt_found_for_never_say_calm_down
5193	5.325	the_feel_felt_found+ownership_language	discard	tone_change
5194	5.337	ownership_language	discard	remove_the_feel_felt_found
5195	4.763	ownership_language+validation_before_solution	discard	swap_the_feel_felt_found_for_validation_before_solution
5196	5.237	the_feel_felt_found+ownership_language	discard	tone_change
5197	5.550	the_feel_felt_found+ownership_language	discard	tone_change
5198	5.325	the_feel_felt_found+casual_professionalism	discard	swap_ownership_language_for_casual_professionalism
5199	5.425	ownership_language+mirroring	discard	swap_the_feel_felt_found_for_mirroring
5200	5.338	the_feel_felt_found+ownership_language	discard	crossover
5201	4.825	ownership_language	discard	remove_the_feel_felt_found
5202	4.925	the_feel_felt_found+ownership_language+genuine_admission	discard	add_genuine_admission
5203	5.138	the_feel_felt_found+warmth_injection	discard	swap_ownership_language_for_warmth_injection
5204	5.325	the_feel_felt_found+ownership_language	discard	tone_change
5205	5.450	the_feel_felt_found+ownership_language	discard	temp_0.95
5206	5.237	the_feel_felt_found+ownership_language+proactive_extras	discard	add_proactive_extras
5207	5.237	the_feel_felt_found+ownership_language	discard	tone_change
5208	5.450	ownership_language+personal_touch	discard	swap_the_feel_felt_found_for_personal_touch
5209	5.237	the_feel_felt_found+ownership_language+mirroring	discard	add_mirroring
5210	5.013	the_feel_felt_found+ownership_language	discard	temp_0.90
5211	5.200	the_feel_felt_found+ownership_language+personal_touch	discard	add_personal_touch
5212	5.350	ownership_language+genuine_admission	discard	swap_the_feel_felt_found_for_genuine_admission
5213	5.325	ownership_language+casual_professionalism	discard	swap_the_feel_felt_found_for_casual_professionalism
5214	5.325	the_feel_felt_found+ownership_language	discard	crossover
5215	4.825	the_feel_felt_found+ownership_language	discard	temp_0.95
5216	5.138	none	discard	crossover
5217	5.425	the_feel_felt_found+ownership_language+never_say_calm_down	discard	add_never_say_calm_down
5218	5.338	the_feel_felt_found+ownership_language	discard	temp_0.95
5219	5.450	the_feel_felt_found+ownership_language+mirroring	discard	add_mirroring
5220	5.013	the_feel_felt_found+ownership_language	discard	tone_change
5221	5.238	ownership_language+never_say_calm_down	discard	swap_the_feel_felt_found_for_never_say_calm_down
5222	5.325	the_feel_felt_found+ownership_language	discard	temp_0.85
5223	5.138	the_feel_felt_found+ownership_language	discard	tone_change
5224	4.825	ownership_language+emotional_labeling	discard	swap_the_feel_felt_found_for_emotional_labeling
5225	5.112	the_feel_felt_found+ownership_language+warmth_injection	discard	add_warmth_injection
5226	5.450	the_feel_felt_found+ownership_language+energy_matching	discard	add_energy_matching
5227	5.450	the_feel_felt_found+ownership_language	discard	tone_change
5228	5.450	the_feel_felt_found+ownership_language	discard	crossover
5229	5.325	the_feel_felt_found	discard	crossover
5230	5.550	the_feel_felt_found+ownership_language	discard	crossover
5231	5.450	the_feel_felt_found+never_say_calm_down	discard	swap_ownership_language_for_never_say_calm_down
5232	5.200	the_feel_felt_found+ownership_language+concrete_next_steps	discard	add_concrete_next_steps
5233	5.325	the_feel_felt_found+ownership_language	discard	crossover
5234	5.013	the_feel_felt_found+ownership_language	discard	temp_0.90
5235	5.325	the_feel_felt_found+ownership_language	discard	tone_change
5236	5.450	ownership_language	discard	remove_the_feel_felt_found
5237	5.650	ownership_language+personal_touch	discard	swap_the_feel_felt_found_for_personal_touch
5238	4.888	ownership_language	discard	crossover
5239	5.088	the_feel_felt_found+ownership_language	discard	temp_0.85
5240	4.800	the_feel_felt_found	discard	remove_ownership_language
5241	5.325	ownership_language	discard	remove_the_feel_felt_found
5242	5.550	the_feel_felt_found	discard	remove_ownership_language
5243	5.200	none	discard	crossover
5244	5.650	the_feel_felt_found+warmth_injection	discard	swap_ownership_language_for_warmth_injection
5245	5.238	ownership_language+proactive_extras	discard	swap_the_feel_felt_found_for_proactive_extras
5246	5.138	the_feel_felt_found+ownership_language+proactive_extras	discard	add_proactive_extras
5247	5.550	the_feel_felt_found+ownership_language+validation_before_solution	discard	add_validation_before_solution
5248	5.537	ownership_language	discard	remove_the_feel_felt_found
5249	5.450	the_feel_felt_found+ownership_language+mirroring	discard	add_mirroring
5250	5.450	the_feel_felt_found+ownership_language+concrete_next_steps	discard	add_concrete_next_steps
5251	5.250	the_feel_felt_found+ownership_language	discard	temp_0.95
5252	5.550	the_feel_felt_found+ownership_language	discard	tone_change
5253	5.138	the_feel_felt_found+ownership_language+energy_matching	discard	add_energy_matching
5254	5.525	the_feel_felt_found+concrete_next_steps	discard	swap_ownership_language_for_concrete_next_steps
5255	5.112	the_feel_felt_found+ownership_language	discard	temp_0.85
5256	5.338	the_feel_felt_found+ownership_language+emotional_labeling	discard	add_emotional_labeling
5257	5.325	the_feel_felt_found+ownership_language	discard	crossover
5258	5.237	the_feel_felt_found+ownership_language+personal_touch	discard	add_personal_touch
5259	5.400	the_feel_felt_found	discard	remove_ownership_language
5260	5.325	the_feel_felt_found+ownership_language	discard	tone_change
5261	5.213	the_feel_felt_found+ownership_language	discard	tone_change
5262	5.013	the_feel_felt_found+ownership_language	discard	tone_change
5263	5.200	the_feel_felt_found+proactive_extras	discard	swap_ownership_language_for_proactive_extras
5264	5.038	the_feel_felt_found+proactive_extras	discard	swap_ownership_language_for_proactive_extras
5265	5.425	the_feel_felt_found+ownership_language	discard	crossover
5266	5.138	the_feel_felt_found+ownership_language+strategic_agreement	discard	add_strategic_agreement
5267	5.237	ownership_language+emotional_labeling	discard	swap_the_feel_felt_found_for_emotional_labeling
5268	5.237	the_feel_felt_found+ownership_language+energy_matching	discard	add_energy_matching
5269	5.138	the_feel_felt_found+validation_before_solution	discard	swap_ownership_language_for_validation_before_solution
5270	5.013	the_feel_felt_found+casual_professionalism	discard	swap_ownership_language_for_casual_professionalism
5271	4.925	the_feel_felt_found+ownership_language+validation_before_solution	discard	add_validation_before_solution
5272	4.912	the_feel_felt_found+concrete_next_steps	discard	swap_ownership_language_for_concrete_next_steps
5273	5.550	the_feel_felt_found+energy_matching	discard	swap_ownership_language_for_energy_matching
5274	5.450	the_feel_felt_found+ownership_language	discard	crossover
5275	5.425	the_feel_felt_found+ownership_language+casual_professionalism	discard	add_casual_professionalism
5276	5.550	the_feel_felt_found+ownership_language+genuine_admission	discard	add_genuine_admission
5277	5.250	the_feel_felt_found	discard	crossover
5278	5.425	the_feel_felt_found+ownership_language	discard	temp_0.90
5279	4.988	the_feel_felt_found+ownership_language	discard	tone_change
5280	5.350	the_feel_felt_found+ownership_language	discard	tone_change
5281	4.575	the_feel_felt_found+ownership_language	discard	temp_0.85
5282	5.312	the_feel_felt_found	discard	remove_ownership_language
5283	5.237	the_feel_felt_found+ownership_language	discard	crossover
5284	5.237	the_feel_felt_found+concrete_next_steps	discard	swap_ownership_language_for_concrete_next_steps
5285	5.325	the_feel_felt_found+ownership_language	discard	temp_0.75
5286	5.238	the_feel_felt_found+ownership_language+mirroring	discard	add_mirroring
5287	5.425	the_feel_felt_found	discard	remove_ownership_language
5288	5.237	the_feel_felt_found+ownership_language	discard	tone_change
5289	5.450	ownership_language+concrete_next_steps	discard	swap_the_feel_felt_found_for_concrete_next_steps
5290	5.138	the_feel_felt_found+ownership_language+strategic_agreement	discard	add_strategic_agreement
5291	5.425	the_feel_felt_found+ownership_language+strategic_agreement	discard	add_strategic_agreement
5292	5.450	the_feel_felt_found+ownership_language+casual_professionalism	discard	add_casual_professionalism
5293	5.113	the_feel_felt_found+never_say_calm_down	discard	swap_ownership_language_for_never_say_calm_down
5294	5.237	the_feel_felt_found+ownership_language	discard	tone_change
5295	5.037	ownership_language+concrete_next_steps	discard	swap_the_feel_felt_found_for_concrete_next_steps
5296	5.450	the_feel_felt_found+personal_touch	discard	swap_ownership_language_for_personal_touch
5297	5.200	ownership_language+strategic_agreement	discard	swap_the_feel_felt_found_for_strategic_agreement
5298	5.237	the_feel_felt_found+ownership_language	discard	crossover
5299	5.650	none	discard	crossover
5300	5.425	the_feel_felt_found+ownership_language+strategic_agreement	discard	add_strategic_agreement
5301	5.300	the_feel_felt_found+ownership_language	discard	tone_change
5302	5.425	ownership_language	discard	remove_the_feel_felt_found
5303	5.012	the_feel_felt_found+ownership_language+genuine_admission	discard	add_genuine_admission
5304	4.987	the_feel_felt_found+ownership_language	discard	crossover
5305	5.225	the_feel_felt_found+ownership_language	discard	temp_0.75
5306	5.325	the_feel_felt_found+ownership_language	discard	tone_change
5307	5.525	the_feel_felt_found+ownership_language+casual_professionalism	discard	add_casual_professionalism
5308	5.100	the_feel_felt_found+ownership_language+concrete_next_steps	discard	add_concrete_next_steps
5309	5.237	ownership_language	discard	remove_the_feel_felt_found
5310	4.812	the_feel_felt_found	discard	crossover
5311	5.350	the_feel_felt_found	discard	crossover
5312	4.713	the_feel_felt_found+concrete_next_steps	discard	swap_ownership_language_for_concrete_next_steps
5313	5.213	the_feel_felt_found+ownership_language	discard	temp_0.65
5314	5.325	the_feel_felt_found+ownership_language+never_say_calm_down	discard	add_never_say_calm_down
5315	5.237	ownership_language	discard	crossover
5316	5.338	the_feel_felt_found+ownership_language+validation_before_solution	discard	add_validation_before_solution
