generation	eq_score	techniques	status	description
14380	5.113	the_feel_felt_found+ownership_language	discard	temp_0.90
14381	4.612	the_feel_felt_found+ownership_language+emotional_labeling	discard	add_emotional_labeling
14382	4.725	the_feel_felt_found+ownership_language	discard	tone_change
14383	5.525	the_feel_felt_found+ownership_language	discard	tone_change
14384	5.550	ownership_language+energy_matching	discard	swap_the_feel_felt_found_for_energy_matching
14385	4.700	the_feel_felt_found+ownership_language	discard	tone_change
14386	5.025	the_feel_felt_found+strategic_agreement	discard	swap_ownership_language_for_strategic_agreement
14387	5.237	the_feel_felt_found+ownership_language	discard	tone_change
14388	5.350	the_feel_felt_found+ownership_language	discard	tone_change
14389	5.525	the_feel_felt_found+ownership_language	discard	temp_0.70
14390	5.138	the_feel_felt_found+ownership_language	discard	tone_change
14391	4.938	the_feel_felt_found+ownership_language	discard	temp_0.65
14392	5.037	the_feel_felt_found+ownership_language	discard	temp_0.95
14393	5.237	the_feel_felt_found+ownership_language+validation_before_solution	discard	add_validation_before_solution
14394	4.825	the_feel_felt_found+ownership_language	discard	tone_change
14395	5.650	the_feel_felt_found	discard	crossover
14396	5.100	the_feel_felt_found+ownership_language	discard	tone_change
14397	5.325	the_feel_felt_found+ownership_language+never_say_calm_down	discard	add_never_say_calm_down
14398	5.038	the_feel_felt_found+ownership_language+validation_before_solution	discard	add_validation_before_solution
14399	5.550	the_feel_felt_found+ownership_language	discard	tone_change
14400	5.350	the_feel_felt_found+ownership_language	discard	crossover
14401	5.425	the_feel_felt_found+ownership_language+strategic_agreement	discard	add_strategic_agreement
14402	5.450	ownership_language+personal_touch	discard	swap_the_feel_felt_found_for_personal_touch
14403	5.425	the_feel_felt_found+ownership_language	discard	tone_change
14404	5.025	the_feel_felt_found+ownership_language	discard	temp_0.65
14405	5.037	the_feel_felt_found	discard	remove_ownership_language
14406	5.550	the_feel_felt_found+ownership_language+emotional_labeling	discard	add_emotional_labeling
14407	5.350	the_feel_felt_found+ownership_language+validation_before_solution	discard	add_validation_before_solution
14408	5.325	the_feel_felt_found+ownership_language	discard	tone_change
14409	5.088	the_feel_felt_found	discard	crossover
14410	5.138	ownership_language	discard	crossover
14411	5.525	the_feel_felt_found+ownership_language	discard	tone_change
14412	5.138	the_feel_felt_found+ownership_language	discard	tone_change
14413	5.138	ownership_language+casual_professionalism	discard	swap_the_feel_felt_found_for_casual_professionalism
14414	5.425	the_feel_felt_found+ownership_language	discard	temp_0.85
14415	4.700	the_feel_felt_found	discard	crossover
14416	5.450	ownership_language+energy_matching	discard	swap_the_feel_felt_found_for_energy_matching
14417	5.325	the_feel_felt_found+ownership_language+proactive_extras	discard	add_proactive_extras
14418	5.350	the_feel_felt_found+ownership_language	discard	temp_0.85
14419	5.237	the_feel_felt_found+ownership_language	discard	tone_change
14420	5.138	the_feel_felt_found+ownership_language	discard	temp_0.70
14421	5.325	the_feel_felt_found+ownership_language	discard	crossover
14422	5.425	the_feel_felt_found+ownership_language+casual_professionalism	discard	add_casual_professionalism
14423	5.425	the_feel_felt_found	discard	crossover
14424	5.350	the_feel_felt_found+ownership_language	discard	tone_change
14425	5.138	the_feel_felt_found+ownership_language	discard	crossover
14426	4.925	the_feel_felt_found+ownership_language	discard	tone_change
14427	5.225	the_feel_felt_found+ownership_language+mirroring	discard	add_mirroring
14428	4.700	the_feel_felt_found+ownership_language	discard	crossover
14429	5.438	the_feel_felt_found+ownership_language+strategic_agreement	discard	add_strategic_agreement
14430	5.025	the_feel_felt_found+ownership_language+concrete_next_steps	discard	add_concrete_next_steps
14431	5.213	ownership_language	discard	crossover
14432	5.325	the_feel_felt_found+ownership_language	discard	tone_change
14433	4.925	the_feel_felt_found+ownership_language+emotional_labeling	discard	add_emotional_labeling
14434	4.938	the_feel_felt_found+ownership_language	discard	tone_change
14435	5.425	the_feel_felt_found+ownership_language+warmth_injection	discard	add_warmth_injection
14436	5.338	the_feel_felt_found+ownership_language+concrete_next_steps	discard	add_concrete_next_steps
14437	5.425	the_feel_felt_found+ownership_language	discard	tone_change
14438	5.138	the_feel_felt_found+ownership_language+mirroring	discard	add_mirroring
14439	4.988	the_feel_felt_found+ownership_language	discard	temp_0.95
14440	5.325	the_feel_felt_found+ownership_language	discard	crossover
14441	5.325	the_feel_felt_found+personal_touch	discard	swap_ownership_language_for_personal_touch
14442	5.450	the_feel_felt_found+ownership_language+casual_professionalism	discard	add_casual_professionalism
14443	5.425	ownership_language	discard	remove_the_feel_felt_found
14444	5.325	the_feel_felt_found+ownership_language+personal_touch	discard	add_personal_touch
14445	5.525	the_feel_felt_found+ownership_language	discard	tone_change
14446	5.350	the_feel_felt_found+ownership_language	discard	temp_0.65
14447	5.138	the_feel_felt_found	discard	remove_ownership_language
14448	5.425	the_feel_felt_found+ownership_language	discard	tone_change
14449	4.825	ownership_language+warmth_injection	discard	swap_the_feel_felt_found_for_warmth_injection
14450	4.675	the_feel_felt_found+ownership_language	discard	tone_change
14451	5.112	the_feel_felt_found+warmth_injection	discard	swap_ownership_language_for_warmth_injection
14452	5.113	the_feel_felt_found+ownership_language	discard	temp_0.65
14453	5.112	the_feel_felt_found+ownership_language	discard	tone_change
14454	5.525	the_feel_felt_found	discard	remove_ownership_language
14455	5.450	ownership_language+energy_matching	discard	swap_the_feel_felt_found_for_energy_matching
14456	5.100	the_feel_felt_found+concrete_next_steps	discard	swap_ownership_language_for_concrete_next_steps
14457	5.237	ownership_language	discard	crossover
14458	5.550	the_feel_felt_found+ownership_language	discard	tone_change
14459	5.300	the_feel_felt_found+genuine_admission	discard	swap_ownership_language_for_genuine_admission
14460	5.350	the_feel_felt_found+ownership_language	discard	tone_change
14461	5.213	the_feel_felt_found+ownership_language	discard	crossover
14462	5.037	ownership_language+emotional_labeling	discard	swap_the_feel_felt_found_for_emotional_labeling
14463	4.700	the_feel_felt_found+ownership_language	discard	temp_0.85
14464	5.450	the_feel_felt_found+ownership_language+personal_touch	discard	add_personal_touch
14465	5.112	ownership_language+casual_professionalism	discard	swap_the_feel_felt_found_for_casual_professionalism
14466	5.138	the_feel_felt_found+ownership_language+casual_professionalism	discard	add_casual_professionalism
14467	5.237	the_feel_felt_found+ownership_language+proactive_extras	discard	add_proactive_extras
14468	5.550	the_feel_felt_found+ownership_language	discard	tone_change
14469	5.112	ownership_language+emotional_labeling	discard	swap_the_feel_felt_found_for_emotional_labeling
14470	5.013	the_feel_felt_found+ownership_language+personal_touch	discard	add_personal_touch
14471	5.450	the_feel_felt_found+ownership_language	discard	tone_change
14472	4.700	the_feel_felt_found	discard	crossover
14473	4.800	the_feel_felt_found+ownership_language+mirroring	discard	add_mirroring
14474	5.550	the_feel_felt_found+energy_matching	discard	swap_ownership_language_for_energy_matching
14475	5.350	the_feel_felt_found+ownership_language	discard	crossover
14476	4.825	ownership_language+casual_professionalism	discard	swap_the_feel_felt_found_for_casual_professionalism
14477	5.425	the_feel_felt_found	discard	crossover
14478	4.700	the_feel_felt_found+ownership_language	discard	crossover
14479	5.200	the_feel_felt_found+ownership_language	discard	temp_0.90
14480	5.138	the_feel_felt_found+ownership_language	discard	tone_change
14481	5.338	ownership_language	discard	crossover
14482	5.013	the_feel_felt_found+ownership_language	discard	tone_change
14483	4.888	the_feel_felt_found+concrete_next_steps	discard	swap_ownership_language_for_concrete_next_steps
14484	5.325	ownership_language+personal_touch	discard	swap_the_feel_felt_found_for_personal_touch
14485	5.525	the_feel_felt_found+warmth_injection	discard	swap_ownership_language_for_warmth_injection
14486	5.200	ownership_language+proactive_extras	discard	swap_the_feel_felt_found_for_proactive_extras
14487	4.888	the_feel_felt_found+ownership_language	discard	crossover
14488	5.138	the_feel_felt_found+ownership_language+warmth_injection	discard	add_warmth_injection
14489	5.212	the_feel_felt_found+ownership_language+genuine_admission	discard	add_genuine_admission
14490	5.550	the_feel_felt_found+ownership_language+emotional_labeling	discard	add_emotional_labeling
14491	5.425	ownership_language	discard	crossover
14492	5.550	the_feel_felt_found+ownership_language+emotional_labeling	discard	add_emotional_labeling
14493	5.450	the_feel_felt_found+ownership_language+validation_before_solution	discard	add_validation_before_solution
14494	5.338	ownership_language	discard	remove_the_feel_felt_found
14495	4.888	the_feel_felt_found+ownership_language+energy_matching	discard	add_energy_matching
14496	5.425	the_feel_felt_found+genuine_admission	discard	swap_ownership_language_for_genuine_admission
14497	5.325	the_feel_felt_found+ownership_language	discard	temp_0.90
14498	5.325	the_feel_felt_found+ownership_language	discard	tone_change
14499	5.013	the_feel_felt_found+ownership_language	discard	tone_change
14500	5.200	the_feel_felt_found+energy_matching	discard	swap_ownership_language_for_energy_matching
14501	5.325	the_feel_felt_found+ownership_language	discard	tone_change
14502	5.325	the_feel_felt_found+ownership_language	discard	crossover
14503	4.888	the_feel_felt_found+energy_matching	discard	swap_ownership_language_for_energy_matching
14504	5.138	the_feel_felt_found	discard	remove_ownership_language
14505	5.138	the_feel_felt_found+ownership_language	discard	tone_change
14506	5.013	the_feel_felt_found+ownership_language+strategic_agreement	discard	add_strategic_agreement
14507	5.300	the_feel_felt_found+mirroring	discard	swap_ownership_language_for_mirroring
14508	5.138	the_feel_felt_found+ownership_language+proactive_extras	discard	add_proactive_extras
14509	5.237	the_feel_felt_found+ownership_language+concrete_next_steps	discard	add_concrete_next_steps
14510	5.237	the_feel_felt_found+ownership_language	discard	tone_change
14511	5.450	ownership_language	discard	remove_the_feel_felt_found
14512	4.913	the_feel_felt_found+ownership_language	discard	temp_0.70
14513	5.450	the_feel_felt_found+ownership_language	discard	tone_change
14514	5.200	the_feel_felt_found	discard	crossover
14515	5.138	the_feel_felt_found+ownership_language+genuine_admission	discard	add_genuine_admission
14516	4.925	the_feel_felt_found+ownership_language	discard	crossover
14517	5.112	ownership_language+emotional_labeling	discard	swap_the_feel_felt_found_for_emotional_labeling
14518	5.212	the_feel_felt_found+ownership_language+genuine_admission	discard	add_genuine_admission
14519	5.450	the_feel_felt_found+ownership_language	discard	temp_0.85
14520	5.350	the_feel_felt_found+ownership_language	discard	temp_0.85
14521	4.825	the_feel_felt_found+genuine_admission	discard	swap_ownership_language_for_genuine_admission
14522	5.237	the_feel_felt_found+ownership_language+warmth_injection	discard	add_warmth_injection
14523	5.550	the_feel_felt_found+ownership_language+proactive_extras	discard	add_proactive_extras
14524	5.138	the_feel_felt_found+ownership_language	discard	tone_change
14525	5.138	the_feel_felt_found+ownership_language	discard	tone_change
14526	5.350	the_feel_felt_found	discard	remove_ownership_language
14527	5.000	ownership_language+casual_professionalism	discard	swap_the_feel_felt_found_for_casual_professionalism
14528	5.213	the_feel_felt_found	discard	crossover
14529	5.013	the_feel_felt_found+ownership_language	discard	tone_change
14530	5.238	the_feel_felt_found+ownership_language	discard	temp_0.95
14531	4.575	the_feel_felt_found+ownership_language+concrete_next_steps	discard	add_concrete_next_steps
14532	5.138	ownership_language	discard	crossover
14533	4.675	the_feel_felt_found	discard	crossover
14534	4.725	ownership_language	discard	crossover
14535	5.237	ownership_language	discard	crossover
14536	5.450	the_feel_felt_found+ownership_language+genuine_admission	discard	add_genuine_admission
14537	4.925	the_feel_felt_found+ownership_language	discard	crossover
14538	5.450	the_feel_felt_found+never_say_calm_down	discard	swap_ownership_language_for_never_say_calm_down
14539	5.013	the_feel_felt_found+ownership_language	discard	tone_change
14540	4.888	the_feel_felt_found+ownership_language+genuine_admission	discard	add_genuine_admission
14541	5.325	the_feel_felt_found+ownership_language+validation_before_solution	discard	add_validation_before_solution
14542	5.337	ownership_language+emotional_labeling	discard	swap_the_feel_felt_found_for_emotional_labeling
14543	5.325	the_feel_felt_found+ownership_language	discard	tone_change
14544	5.200	ownership_language+concrete_next_steps	discard	swap_the_feel_felt_found_for_concrete_next_steps
14545	5.450	ownership_language+strategic_agreement	discard	swap_the_feel_felt_found_for_strategic_agreement
14546	5.550	the_feel_felt_found+ownership_language	discard	crossover
14547	4.988	the_feel_felt_found+ownership_language	discard	tone_change
14548	4.800	the_feel_felt_found+ownership_language+proactive_extras	discard	add_proactive_extras
14549	5.450	ownership_language	discard	remove_the_feel_felt_found
14550	5.125	ownership_language+strategic_agreement	discard	swap_the_feel_felt_found_for_strategic_agreement
14551	5.650	the_feel_felt_found	discard	crossover
14552	5.200	the_feel_felt_found+ownership_language+never_say_calm_down	discard	add_never_say_calm_down
14553	5.425	none	discard	crossover
14554	5.112	ownership_language	discard	crossover
14555	4.513	ownership_language+mirroring	discard	swap_the_feel_felt_found_for_mirroring
14556	5.338	the_feel_felt_found+ownership_language+genuine_admission	discard	add_genuine_admission
14557	4.925	ownership_language+concrete_next_steps	discard	swap_the_feel_felt_found_for_concrete_next_steps
14558	5.013	the_feel_felt_found+ownership_language	discard	tone_change
14559	5.400	ownership_language	discard	remove_the_feel_felt_found
14560	5.550	the_feel_felt_found+ownership_language+strategic_agreement	discard	add_strategic_agreement
14561	5.550	the_feel_felt_found+ownership_language	discard	tone_change
14562	5.225	the_feel_felt_found+ownership_language+warmth_injection	discard	add_warmth_injection
14563	5.625	the_feel_felt_found+ownership_language+emotional_labeling	discard	add_emotional_labeling
14564	5.200	the_feel_felt_found+ownership_language+never_say_calm_down	discard	add_never_say_calm_down
14565	5.525	the_feel_felt_found+ownership_language+validation_before_solution	discard	add_validation_before_solution
14566	5.350	the_feel_felt_found+ownership_language+personal_touch	discard	add_personal_touch
14567	5.112	the_feel_felt_found+mirroring	discard	swap_ownership_language_for_mirroring
14568	5.013	the_feel_felt_found+ownership_language	discard	tone_change
14569	5.450	the_feel_felt_found	discard	remove_ownership_language
14570	5.450	ownership_language+personal_touch	discard	swap_the_feel_felt_found_for_personal_touch
14571	5.325	the_feel_felt_found+ownership_language+casual_professionalism	discard	add_casual_professionalism
14572	5.550	the_feel_felt_found+ownership_language	discard	tone_change
14573	5.138	the_feel_felt_found+energy_matching	discard	swap_ownership_language_for_energy_matching
14574	5.425	the_feel_felt_found+ownership_language+casual_professionalism	discard	add_casual_professionalism
14575	5.425	the_feel_felt_found+ownership_language	discard	crossover
14576	5.450	the_feel_felt_found+ownership_language	discard	tone_change
14577	5.650	the_feel_felt_found	discard	remove_ownership_language
14578	5.112	the_feel_felt_found+ownership_language+warmth_injection	discard	add_warmth_injection
14579	5.550	the_feel_felt_found+ownership_language+concrete_next_steps	discard	add_concrete_next_steps
14580	5.338	the_feel_felt_found+ownership_language	discard	temp_0.95
14581	5.300	the_feel_felt_found+ownership_language+proactive_extras	discard	add_proactive_extras
14582	5.013	the_feel_felt_found+ownership_language	discard	temp_0.70
14583	5.550	ownership_language	discard	remove_the_feel_felt_found
14584	5.237	the_feel_felt_found+ownership_language	discard	temp_0.65
14585	5.237	the_feel_felt_found+ownership_language+personal_touch	discard	add_personal_touch
14586	4.825	the_feel_felt_found+ownership_language+strategic_agreement	discard	add_strategic_agreement
14587	5.550	the_feel_felt_found	discard	remove_ownership_language
14588	5.450	the_feel_felt_found+ownership_language	discard	tone_change
14589	5.013	the_feel_felt_found+ownership_language	discard	temp_0.95
14590	5.037	the_feel_felt_found+ownership_language	discard	temp_0.70
14591	5.425	the_feel_felt_found+ownership_language	discard	crossover
14592	4.987	the_feel_felt_found+ownership_language+personal_touch	discard	add_personal_touch
14593	5.325	the_feel_felt_found+ownership_language+warmth_injection	discard	add_warmth_injection
14594	5.450	the_feel_felt_found+ownership_language+validation_before_solution	discard	add_validation_before_solution
14595	4.825	the_feel_felt_found+ownership_language	discard	tone_change
14596	5.337	ownership_language	discard	remove_the_feel_felt_found
14597	5.550	the_feel_felt_found+ownership_language	discard	tone_change
14598	4.700	the_feel_felt_found+ownership_language	discard	temp_0.65
14599	5.138	ownership_language+genuine_admission	discard	swap_the_feel_felt_found_for_genuine_admission
14600	5.350	the_feel_felt_found+ownership_language	discard	tone_change
14601	5.450	the_feel_felt_found+ownership_language	discard	tone_change
14602	5.550	the_feel_felt_found+ownership_language	discard	tone_change
14603	5.425	the_feel_felt_found+ownership_language	discard	tone_change
14604	5.212	the_feel_felt_found+ownership_language	discard	crossover
14605	5.238	ownership_language+personal_touch	discard	swap_the_feel_felt_found_for_personal_touch
14606	5.650	ownership_language+energy_matching	discard	swap_the_feel_felt_found_for_energy_matching
14607	5.225	the_feel_felt_found+concrete_next_steps	discard	swap_ownership_language_for_concrete_next_steps
14608	5.338	the_feel_felt_found	discard	remove_ownership_language
14609	4.700	ownership_language+never_say_calm_down	discard	swap_the_feel_felt_found_for_never_say_calm_down
14610	5.112	the_feel_felt_found+ownership_language	discard	crossover
14611	5.125	the_feel_felt_found+ownership_language+warmth_injection	discard	add_warmth_injection
14612	5.650	the_feel_felt_found+ownership_language	discard	temp_0.95
14613	4.888	the_feel_felt_found	discard	remove_ownership_language
14614	5.450	none	discard	crossover
14615	5.338	the_feel_felt_found+ownership_language+mirroring	discard	add_mirroring
14616	5.450	the_feel_felt_found+ownership_language	discard	crossover
14617	5.550	the_feel_felt_found	discard	crossover
14618	4.925	the_feel_felt_found+ownership_language+strategic_agreement	discard	add_strategic_agreement
14619	5.650	the_feel_felt_found+ownership_language	discard	tone_change
14620	5.325	the_feel_felt_found+ownership_language	discard	tone_change
14621	5.338	the_feel_felt_found	discard	crossover
14622	5.138	the_feel_felt_found+ownership_language	discard	temp_0.75
14623	5.138	the_feel_felt_found+ownership_language	discard	temp_0.85
14624	5.138	the_feel_felt_found+ownership_language	discard	temp_0.70
14625	5.450	the_feel_felt_found+ownership_language	discard	crossover
14626	5.138	the_feel_felt_found+ownership_language	discard	temp_0.75
14627	5.550	the_feel_felt_found+concrete_next_steps	discard	swap_ownership_language_for_concrete_next_steps
14628	5.138	ownership_language	discard	crossover
14629	4.912	the_feel_felt_found+ownership_language	discard	tone_change
14630	5.450	the_feel_felt_found+warmth_injection	discard	swap_ownership_language_for_warmth_injection
14631	5.550	the_feel_felt_found	discard	crossover
14632	5.450	ownership_language+never_say_calm_down	discard	swap_the_feel_felt_found_for_never_say_calm_down
14633	5.138	the_feel_felt_found+ownership_language	discard	temp_0.85
14634	4.700	the_feel_felt_found	discard	remove_ownership_language
14635	5.450	the_feel_felt_found+ownership_language	discard	crossover
14636	5.237	the_feel_felt_found+mirroring	discard	swap_ownership_language_for_mirroring
14637	5.550	the_feel_felt_found+ownership_language+validation_before_solution	discard	add_validation_before_solution
14638	4.900	the_feel_felt_found+ownership_language	discard	crossover
14639	5.450	the_feel_felt_found+ownership_language+genuine_admission	discard	add_genuine_admission
14640	4.925	the_feel_felt_found+mirroring	discard	swap_ownership_language_for_mirroring
14641	4.888	the_feel_felt_found+ownership_language+personal_touch	discard	add_personal_touch
14642	5.025	the_feel_felt_found+ownership_language	discard	temp_0.65
14643	5.550	the_feel_felt_found	discard	remove_ownership_language
14644	5.550	the_feel_felt_found+ownership_language	discard	tone_change
14645	5.237	the_feel_felt_found+ownership_language	discard	tone_change
14646	5.112	the_feel_felt_found+ownership_language	discard	crossover
14647	5.425	the_feel_felt_found+ownership_language	discard	temp_0.85
14648	5.237	the_feel_felt_found+ownership_language+casual_professionalism	discard	add_casual_professionalism
14649	4.513	the_feel_felt_found+ownership_language	discard	tone_change
