generation	eq_score	techniques	status	description
12737	5.200	the_feel_felt_found+ownership_language	discard	tone_change
12738	4.825	ownership_language	discard	remove_the_feel_felt_found
12739	5.325	ownership_language	discard	remove_the_feel_felt_found
12740	5.138	ownership_language+proactive_extras	discard	swap_the_feel_felt_found_for_proactive_extras
12741	5.325	the_feel_felt_found+warmth_injection	discard	swap_ownership_language_for_warmth_injection
12742	5.325	ownership_language+never_say_calm_down	discard	swap_the_feel_felt_found_for_never_say_calm_down
12743	4.925	the_feel_felt_found+ownership_language	discard	temp_0.75
12744	5.325	the_feel_felt_found+ownership_language	discard	crossover
12745	5.250	the_feel_felt_found	discard	remove_ownership_language
12746	4.825	ownership_language+emotional_labeling	discard	swap_the_feel_felt_found_for_emotional_labeling
12747	5.438	the_feel_felt_found+ownership_language+strategic_agreement	discard	add_strategic_agreement
12748	5.237	the_feel_felt_found+ownership_language+warmth_injection	discard	add_warmth_injection
12749	5.237	the_feel_felt_found	discard	remove_ownership_language
12750	5.350	the_feel_felt_found	discard	crossover
12751	5.450	the_feel_felt_found+ownership_language	discard	tone_change
12752	5.425	ownership_language+energy_matching	discard	swap_the_feel_felt_found_for_energy_matching
12753	5.113	the_feel_felt_found+ownership_language	discard	crossover
12754	4.725	the_feel_felt_found	discard	crossover
12755	5.138	ownership_language	discard	remove_the_feel_felt_found
12756	4.800	the_feel_felt_found+ownership_language	discard	tone_change
12757	5.325	the_feel_felt_found+ownership_language	discard	crossover
12758	4.825	ownership_language	discard	remove_the_feel_felt_found
12759	5.013	the_feel_felt_found+genuine_admission	discard	swap_ownership_language_for_genuine_admission
12760	5.425	the_feel_felt_found+ownership_language+strategic_agreement	discard	add_strategic_agreement
12761	5.550	the_feel_felt_found	discard	crossover
12762	5.325	ownership_language+concrete_next_steps	discard	swap_the_feel_felt_found_for_concrete_next_steps
12763	5.013	the_feel_felt_found+ownership_language	discard	tone_change
12764	4.825	ownership_language	discard	crossover
12765	5.325	the_feel_felt_found+ownership_language	discard	temp_0.70
12766	5.450	the_feel_felt_found+ownership_language	discard	temp_0.70
12767	5.138	the_feel_felt_found+ownership_language	discard	temp_0.75
12768	5.237	the_feel_felt_found+ownership_language	discard	temp_0.75
12769	4.800	the_feel_felt_found+ownership_language+casual_professionalism	discard	add_casual_professionalism
12770	5.237	ownership_language+strategic_agreement	discard	swap_the_feel_felt_found_for_strategic_agreement
12771	4.787	the_feel_felt_found+ownership_language	discard	temp_0.75
12772	5.650	the_feel_felt_found+ownership_language+energy_matching	discard	add_energy_matching
12773	5.138	ownership_language	discard	crossover
12774	5.325	the_feel_felt_found+ownership_language+concrete_next_steps	discard	add_concrete_next_steps
12775	5.425	the_feel_felt_found+ownership_language	discard	crossover
12776	5.438	the_feel_felt_found+ownership_language	discard	tone_change
12777	5.450	ownership_language+concrete_next_steps	discard	swap_the_feel_felt_found_for_concrete_next_steps
12778	5.138	ownership_language	discard	remove_the_feel_felt_found
12779	5.300	the_feel_felt_found+ownership_language+energy_matching	discard	add_energy_matching
12780	5.037	the_feel_felt_found	discard	crossover
12781	5.013	the_feel_felt_found+ownership_language	discard	tone_change
12782	5.550	the_feel_felt_found+ownership_language	discard	crossover
12783	5.450	the_feel_felt_found+ownership_language	discard	crossover
12784	5.325	the_feel_felt_found+ownership_language+concrete_next_steps	discard	add_concrete_next_steps
12785	5.325	the_feel_felt_found+ownership_language	discard	crossover
12786	5.425	the_feel_felt_found+ownership_language	discard	temp_0.95
12787	5.450	the_feel_felt_found+emotional_labeling	discard	swap_ownership_language_for_emotional_labeling
12788	5.338	the_feel_felt_found+ownership_language	discard	crossover
12789	5.550	ownership_language	discard	crossover
12790	5.113	the_feel_felt_found	discard	remove_ownership_language
12791	5.325	the_feel_felt_found	discard	crossover
12792	5.038	the_feel_felt_found+ownership_language+energy_matching	discard	add_energy_matching
12793	5.225	the_feel_felt_found+ownership_language	discard	tone_change
12794	5.525	ownership_language	discard	remove_the_feel_felt_found
12795	5.138	the_feel_felt_found+ownership_language	discard	tone_change
12796	4.900	the_feel_felt_found+ownership_language	discard	temp_0.75
12797	5.113	the_feel_felt_found+ownership_language	discard	tone_change
12798	5.138	the_feel_felt_found+ownership_language+validation_before_solution	discard	add_validation_before_solution
12799	5.013	the_feel_felt_found+ownership_language+concrete_next_steps	discard	add_concrete_next_steps
12800	5.200	the_feel_felt_found+ownership_language	discard	temp_0.65
12801	5.525	the_feel_felt_found	discard	remove_ownership_language
12802	4.925	ownership_language	discard	crossover
12803	5.138	the_feel_felt_found+ownership_language	discard	temp_0.95
12804	5.350	the_feel_felt_found+ownership_language	discard	crossover
12805	5.225	the_feel_felt_found	discard	crossover
12806	5.450	the_feel_felt_found	discard	crossover
12807	5.325	the_feel_felt_found+casual_professionalism	discard	swap_ownership_language_for_casual_professionalism
12808	4.925	the_feel_felt_found+ownership_language+proactive_extras	discard	add_proactive_extras
12809	5.325	the_feel_felt_found+ownership_language	discard	tone_change
12810	5.338	the_feel_felt_found+ownership_language	discard	tone_change
12811	5.025	the_feel_felt_found+ownership_language+validation_before_solution	discard	add_validation_before_solution
12812	4.825	the_feel_felt_found+ownership_language+genuine_admission	discard	add_genuine_admission
12813	5.550	the_feel_felt_found+ownership_language+concrete_next_steps	discard	add_concrete_next_steps
12814	5.237	the_feel_felt_found+ownership_language	discard	tone_change
12815	5.425	the_feel_felt_found+ownership_language	discard	crossover
12816	5.013	the_feel_felt_found+ownership_language+casual_professionalism	discard	add_casual_professionalism
12817	5.650	the_feel_felt_found+ownership_language	discard	temp_0.70
12818	5.450	the_feel_felt_found+ownership_language+warmth_injection	discard	add_warmth_injection
12819	5.200	the_feel_felt_found+ownership_language	discard	tone_change
12820	5.013	ownership_language	discard	remove_the_feel_felt_found
12821	5.113	ownership_language+warmth_injection	discard	swap_the_feel_felt_found_for_warmth_injection
12822	5.337	the_feel_felt_found+ownership_language	discard	temp_0.85
12823	5.112	ownership_language+genuine_admission	discard	swap_the_feel_felt_found_for_genuine_admission
12824	5.138	the_feel_felt_found+ownership_language	discard	tone_change
12825	5.138	the_feel_felt_found+ownership_language	discard	temp_0.65
12826	4.700	the_feel_felt_found+ownership_language	discard	tone_change
12827	4.513	the_feel_felt_found	discard	crossover
12828	5.325	the_feel_felt_found+personal_touch	discard	swap_ownership_language_for_personal_touch
12829	5.450	the_feel_felt_found+ownership_language+genuine_admission	discard	add_genuine_admission
12830	5.750	the_feel_felt_found+ownership_language+personal_touch	discard	add_personal_touch
12831	5.237	the_feel_felt_found+ownership_language+energy_matching	discard	add_energy_matching
12832	5.138	the_feel_felt_found+ownership_language	discard	crossover
12833	5.013	the_feel_felt_found+ownership_language	discard	crossover
12834	5.112	the_feel_felt_found+ownership_language	discard	crossover
12835	5.350	the_feel_felt_found+ownership_language+strategic_agreement	discard	add_strategic_agreement
12836	4.700	the_feel_felt_found+ownership_language+energy_matching	discard	add_energy_matching
12837	5.013	the_feel_felt_found+ownership_language+genuine_admission	discard	add_genuine_admission
12838	4.888	the_feel_felt_found+ownership_language	discard	crossover
12839	5.138	the_feel_felt_found+ownership_language+casual_professionalism	discard	add_casual_professionalism
12840	4.800	the_feel_felt_found+ownership_language+genuine_admission	discard	add_genuine_admission
12841	5.325	the_feel_felt_found	discard	remove_ownership_language
12842	5.450	the_feel_felt_found+ownership_language+warmth_injection	discard	add_warmth_injection
12843	5.325	the_feel_felt_found+ownership_language+personal_touch	discard	add_personal_touch
12844	5.450	the_feel_felt_found+ownership_language	discard	tone_change
12845	4.675	the_feel_felt_found+ownership_language+mirroring	discard	add_mirroring
12846	5.650	the_feel_felt_found+ownership_language+mirroring	discard	add_mirroring
12847	5.425	the_feel_felt_found+ownership_language	discard	temp_0.95
12848	5.013	the_feel_felt_found+ownership_language	discard	tone_change
12849	4.925	ownership_language+personal_touch	discard	swap_the_feel_felt_found_for_personal_touch
12850	5.525	ownership_language	discard	remove_the_feel_felt_found
12851	5.013	the_feel_felt_found+ownership_language	discard	tone_change
12852	5.325	the_feel_felt_found+ownership_language	discard	temp_0.65
12853	4.900	none	discard	crossover
12854	5.138	ownership_language	discard	remove_the_feel_felt_found
12855	5.112	the_feel_felt_found	discard	crossover
12856	4.987	ownership_language+validation_before_solution	discard	swap_the_feel_felt_found_for_validation_before_solution
12857	5.200	the_feel_felt_found+ownership_language+mirroring	discard	add_mirroring
12858	5.300	the_feel_felt_found+ownership_language+strategic_agreement	discard	add_strategic_agreement
12859	5.013	the_feel_felt_found+never_say_calm_down	discard	swap_ownership_language_for_never_say_calm_down
12860	5.550	the_feel_felt_found	discard	crossover
12861	4.987	the_feel_felt_found+ownership_language	discard	temp_0.65
12862	5.325	ownership_language	discard	crossover
12863	4.700	the_feel_felt_found+ownership_language	discard	temp_0.65
12864	5.112	the_feel_felt_found	discard	crossover
12865	5.425	the_feel_felt_found+ownership_language	discard	tone_change
12866	5.237	the_feel_felt_found+ownership_language	discard	tone_change
12867	5.325	the_feel_felt_found+ownership_language	discard	tone_change
12868	5.013	the_feel_felt_found+ownership_language	discard	tone_change
12869	5.325	the_feel_felt_found+ownership_language+emotional_labeling	discard	add_emotional_labeling
12870	5.350	the_feel_felt_found+ownership_language	discard	tone_change
12871	5.450	the_feel_felt_found+ownership_language	discard	tone_change
12872	5.138	the_feel_felt_found+ownership_language	discard	tone_change
12873	5.350	the_feel_felt_found+warmth_injection	discard	swap_ownership_language_for_warmth_injection
12874	5.450	the_feel_felt_found+ownership_language+mirroring	discard	add_mirroring
12875	5.750	ownership_language	discard	remove_the_feel_felt_found
12876	5.425	the_feel_felt_found+ownership_language+personal_touch	discard	add_personal_touch
12877	5.237	the_feel_felt_found+ownership_language	discard	tone_change
12878	5.038	ownership_language+proactive_extras	discard	swap_the_feel_felt_found_for_proactive_extras
12879	5.550	the_feel_felt_found+ownership_language	discard	tone_change
12880	5.137	the_feel_felt_found+ownership_language+validation_before_solution	discard	add_validation_before_solution
12881	5.550	the_feel_felt_found+ownership_language	discard	temp_0.90
12882	5.200	the_feel_felt_found	discard	crossover
12883	5.450	the_feel_felt_found+ownership_language	discard	tone_change
12884	5.013	ownership_language	discard	remove_the_feel_felt_found
12885	5.338	the_feel_felt_found+ownership_language+proactive_extras	discard	add_proactive_extras
12886	4.825	the_feel_felt_found+ownership_language	discard	temp_0.65
12887	5.325	the_feel_felt_found+ownership_language	discard	tone_change
12888	5.237	none	discard	crossover
12889	5.550	ownership_language	discard	remove_the_feel_felt_found
12890	5.200	the_feel_felt_found+ownership_language	discard	crossover
12891	5.138	the_feel_felt_found+ownership_language	discard	tone_change
12892	5.013	the_feel_felt_found+ownership_language	discard	tone_change
12893	5.525	the_feel_felt_found+ownership_language	discard	crossover
12894	5.025	the_feel_felt_found+ownership_language+mirroring	discard	add_mirroring
12895	5.550	the_feel_felt_found+ownership_language	discard	temp_0.65
12896	5.300	the_feel_felt_found+ownership_language+energy_matching	discard	add_energy_matching
12897	5.138	the_feel_felt_found+ownership_language	discard	crossover
12898	5.450	the_feel_felt_found	discard	crossover
12899	5.350	none	discard	crossover
12900	5.450	the_feel_felt_found+ownership_language+validation_before_solution	discard	add_validation_before_solution
12901	5.425	the_feel_felt_found+ownership_language	discard	temp_0.75
12902	5.425	ownership_language	discard	crossover
12903	5.112	the_feel_felt_found+ownership_language+warmth_injection	discard	add_warmth_injection
12904	5.200	the_feel_felt_found+validation_before_solution	discard	swap_ownership_language_for_validation_before_solution
12905	5.550	the_feel_felt_found+ownership_language+never_say_calm_down	discard	add_never_say_calm_down
12906	5.112	the_feel_felt_found	discard	crossover
12907	5.075	the_feel_felt_found+ownership_language	discard	crossover
12908	5.237	the_feel_felt_found+ownership_language	discard	tone_change
12909	5.013	the_feel_felt_found+ownership_language+warmth_injection	discard	add_warmth_injection
12910	5.650	the_feel_felt_found+ownership_language+concrete_next_steps	discard	add_concrete_next_steps
12911	5.550	the_feel_felt_found+ownership_language	discard	crossover
12912	5.450	ownership_language+strategic_agreement	discard	swap_the_feel_felt_found_for_strategic_agreement
12913	5.550	ownership_language	discard	remove_the_feel_felt_found
12914	5.237	ownership_language	discard	crossover
12915	5.013	the_feel_felt_found+ownership_language	discard	crossover
12916	5.350	ownership_language+strategic_agreement	discard	swap_the_feel_felt_found_for_strategic_agreement
12917	5.013	the_feel_felt_found+ownership_language+concrete_next_steps	discard	add_concrete_next_steps
12918	5.550	the_feel_felt_found+ownership_language	discard	tone_change
12919	4.800	the_feel_felt_found+ownership_language+concrete_next_steps	discard	add_concrete_next_steps
12920	5.325	the_feel_felt_found+ownership_language+concrete_next_steps	discard	add_concrete_next_steps
12921	5.025	ownership_language	discard	crossover
12922	5.350	the_feel_felt_found+ownership_language+genuine_admission	discard	add_genuine_admission
12923	5.325	the_feel_felt_found+ownership_language	discard	crossover
12924	5.225	the_feel_felt_found+ownership_language	discard	temp_0.70
12925	5.338	the_feel_felt_found+ownership_language+energy_matching	discard	add_energy_matching
12926	5.300	the_feel_felt_found+ownership_language	discard	tone_change
12927	5.113	the_feel_felt_found+ownership_language+proactive_extras	discard	add_proactive_extras
12928	5.237	the_feel_felt_found+ownership_language	discard	crossover
12929	5.550	the_feel_felt_found+ownership_language+genuine_admission	discard	add_genuine_admission
12930	5.237	the_feel_felt_found+ownership_language	discard	tone_change
12931	5.138	the_feel_felt_found+ownership_language	discard	temp_0.70
12932	4.725	ownership_language	discard	remove_the_feel_felt_found
12933	4.713	the_feel_felt_found+ownership_language+never_say_calm_down	discard	add_never_say_calm_down
12934	5.013	ownership_language	discard	crossover
12935	5.212	ownership_language	discard	crossover
12936	5.425	ownership_language+proactive_extras	discard	swap_the_feel_felt_found_for_proactive_extras
12937	4.800	the_feel_felt_found+ownership_language	discard	crossover
12938	5.200	the_feel_felt_found+ownership_language+validation_before_solution	discard	add_validation_before_solution
12939	5.238	the_feel_felt_found	discard	crossover
12940	5.425	the_feel_felt_found	discard	crossover
12941	5.112	the_feel_felt_found+ownership_language	discard	tone_change
12942	4.612	the_feel_felt_found+ownership_language	discard	temp_0.95
12943	5.550	the_feel_felt_found+ownership_language	discard	tone_change
12944	5.138	the_feel_felt_found+ownership_language	discard	crossover
12945	5.425	ownership_language+validation_before_solution	discard	swap_the_feel_felt_found_for_validation_before_solution
12946	5.013	the_feel_felt_found+ownership_language	discard	tone_change
12947	5.037	the_feel_felt_found+ownership_language	discard	tone_change
12948	5.450	ownership_language	discard	crossover
12949	5.025	the_feel_felt_found+ownership_language	discard	temp_0.75
12950	4.825	the_feel_felt_found+ownership_language	discard	temp_0.85
12951	4.987	the_feel_felt_found+energy_matching	discard	swap_ownership_language_for_energy_matching
12952	4.800	the_feel_felt_found+ownership_language+validation_before_solution	discard	add_validation_before_solution
12953	5.550	the_feel_felt_found+ownership_language+energy_matching	discard	add_energy_matching
12954	4.912	the_feel_felt_found+ownership_language	discard	temp_0.70
12955	5.350	the_feel_felt_found+ownership_language	discard	temp_0.65
12956	5.250	the_feel_felt_found+ownership_language	discard	temp_0.90
12957	4.888	ownership_language+proactive_extras	discard	swap_the_feel_felt_found_for_proactive_extras
12958	5.112	the_feel_felt_found+ownership_language+proactive_extras	discard	add_proactive_extras
12959	5.138	the_feel_felt_found+ownership_language	discard	tone_change
12960	5.138	the_feel_felt_found+ownership_language	discard	temp_0.90
12961	4.763	the_feel_felt_found+ownership_language	discard	temp_0.90
12962	5.013	the_feel_felt_found+ownership_language	discard	temp_0.85
12963	5.237	the_feel_felt_found+ownership_language+casual_professionalism	discard	add_casual_professionalism
12964	5.012	the_feel_felt_found+ownership_language	discard	temp_0.95
12965	5.237	the_feel_felt_found+ownership_language	discard	crossover
12966	5.450	the_feel_felt_found+ownership_language	discard	temp_0.65
12967	5.237	the_feel_felt_found+ownership_language	discard	crossover
12968	5.200	the_feel_felt_found+ownership_language	discard	tone_change
12969	4.487	the_feel_felt_found+ownership_language+emotional_labeling	discard	add_emotional_labeling
12970	5.450	the_feel_felt_found+ownership_language+genuine_admission	discard	add_genuine_admission
12971	4.612	the_feel_felt_found+ownership_language	discard	tone_change
12972	5.325	the_feel_felt_found+ownership_language+mirroring	discard	add_mirroring
12973	5.225	the_feel_felt_found+ownership_language	discard	temp_0.90
12974	4.888	the_feel_felt_found+ownership_language	discard	tone_change
12975	5.550	ownership_language+proactive_extras	discard	swap_the_feel_felt_found_for_proactive_extras
12976	4.825	the_feel_felt_found+ownership_language+validation_before_solution	discard	add_validation_before_solution
12977	5.013	the_feel_felt_found+ownership_language+validation_before_solution	discard	add_validation_before_solution
12978	5.325	the_feel_felt_found+ownership_language	discard	crossover
12979	5.450	the_feel_felt_found+ownership_language	discard	crossover
12980	5.750	the_feel_felt_found+ownership_language	discard	tone_change
12981	5.138	the_feel_felt_found+genuine_admission	discard	swap_ownership_language_for_genuine_admission
12982	5.237	the_feel_felt_found+ownership_language	discard	tone_change
12983	5.112	ownership_language	discard	crossover
12984	5.450	the_feel_felt_found+ownership_language	discard	temp_0.85
12985	5.450	none	discard	crossover
12986	5.450	the_feel_felt_found+ownership_language	discard	tone_change
12987	5.450	the_feel_felt_found+ownership_language	discard	crossover
12988	5.550	the_feel_felt_found+ownership_language	discard	crossover
12989	5.325	the_feel_felt_found+ownership_language	discard	temp_0.85
12990	4.925	ownership_language	discard	remove_the_feel_felt_found
12991	5.238	ownership_language	discard	crossover
12992	5.425	the_feel_felt_found+ownership_language	discard	tone_change
12993	5.650	the_feel_felt_found+ownership_language	discard	tone_change
12994	5.425	ownership_language	discard	remove_the_feel_felt_found
12995	5.425	the_feel_felt_found+ownership_language	discard	temp_0.85
12996	5.138	the_feel_felt_found+ownership_language	discard	temp_0.90
12997	4.725	the_feel_felt_found+ownership_language+proactive_extras	discard	add_proactive_extras
12998	4.888	the_feel_felt_found+ownership_language	discard	tone_change
12999	5.237	the_feel_felt_found+ownership_language	discard	crossover
13000	5.200	the_feel_felt_found+ownership_language	discard	tone_change
13001	4.913	the_feel_felt_found	discard	crossover
13002	5.237	the_feel_felt_found+ownership_language	discard	temp_0.85
13003	5.350	the_feel_felt_found+ownership_language	discard	tone_change
13004	5.450	the_feel_felt_found+ownership_language	discard	tone_change
13005	5.112	the_feel_felt_found+ownership_language	discard	tone_change
13006	5.237	the_feel_felt_found+ownership_language+casual_professionalism	discard	add_casual_professionalism
13007	4.825	the_feel_felt_found+ownership_language	discard	crossover
13008	5.113	ownership_language	discard	remove_the_feel_felt_found
13009	5.450	the_feel_felt_found+ownership_language+genuine_admission	discard	add_genuine_admission
13010	5.138	none	discard	crossover
13011	5.225	the_feel_felt_found+ownership_language	discard	tone_change
13012	5.237	the_feel_felt_found+ownership_language	discard	tone_change
13013	5.138	the_feel_felt_found+mirroring	discard	swap_ownership_language_for_mirroring
13014	5.450	the_feel_felt_found+ownership_language	discard	temp_0.75
13015	5.425	the_feel_felt_found+ownership_language+mirroring	discard	add_mirroring
13016	5.225	the_feel_felt_found+casual_professionalism	discard	swap_ownership_language_for_casual_professionalism
13017	5.325	the_feel_felt_found+ownership_language	discard	temp_0.75
13018	4.700	the_feel_felt_found+ownership_language+concrete_next_steps	discard	add_concrete_next_steps
