generation	eq_score	techniques	status	description
11364	5.425	the_feel_felt_found+ownership_language	discard	tone_change
11365	5.225	the_feel_felt_found+strategic_agreement	discard	swap_ownership_language_for_strategic_agreement
11366	4.912	the_feel_felt_found+ownership_language	discard	tone_change
11367	5.113	the_feel_felt_found+ownership_language+warmth_injection	discard	add_warmth_injection
11368	5.138	the_feel_felt_found+ownership_language+concrete_next_steps	discard	add_concrete_next_steps
11369	4.925	the_feel_felt_found+ownership_language	discard	temp_0.85
11370	5.138	the_feel_felt_found+ownership_language+concrete_next_steps	discard	add_concrete_next_steps
11371	5.025	the_feel_felt_found	discard	crossover
11372	5.112	the_feel_felt_found+ownership_language	discard	tone_change
11373	5.237	ownership_language	discard	crossover
11374	4.888	the_feel_felt_found+ownership_language	discard	tone_change
11375	5.138	the_feel_felt_found+ownership_language	discard	tone_change
11376	5.138	the_feel_felt_found+ownership_language	discard	tone_change
11377	5.338	the_feel_felt_found+ownership_language+casual_professionalism	discard	add_casual_professionalism
11378	5.138	the_feel_felt_found+ownership_language	discard	tone_change
11379	5.550	the_feel_felt_found+ownership_language	discard	temp_0.75
11380	5.112	ownership_language+warmth_injection	discard	swap_the_feel_felt_found_for_warmth_injection
11381	5.450	the_feel_felt_found	discard	crossover
11382	5.325	the_feel_felt_found+ownership_language	discard	tone_change
11383	5.025	the_feel_felt_found+ownership_language+casual_professionalism	discard	add_casual_professionalism
11384	5.238	the_feel_felt_found+ownership_language	discard	tone_change
11385	4.700	the_feel_felt_found+ownership_language	discard	crossover
11386	5.112	the_feel_felt_found+ownership_language+validation_before_solution	discard	add_validation_before_solution
11387	5.325	the_feel_felt_found+ownership_language	discard	crossover
11388	5.450	the_feel_felt_found+ownership_language	discard	tone_change
11389	5.000	ownership_language	discard	remove_the_feel_felt_found
11390	5.300	ownership_language	discard	remove_the_feel_felt_found
11391	5.138	ownership_language+genuine_admission	discard	swap_the_feel_felt_found_for_genuine_admission
11392	4.825	the_feel_felt_found+ownership_language	discard	temp_0.65
11393	5.138	the_feel_felt_found+ownership_language	discard	tone_change
11394	5.250	the_feel_felt_found+ownership_language+energy_matching	discard	add_energy_matching
11395	5.350	none	discard	crossover
11396	5.013	ownership_language	discard	crossover
11397	4.825	the_feel_felt_found+ownership_language	discard	tone_change
11398	5.013	ownership_language	discard	remove_the_feel_felt_found
11399	5.037	the_feel_felt_found	discard	remove_ownership_language
11400	5.112	the_feel_felt_found+ownership_language	discard	tone_change
11401	5.550	the_feel_felt_found	discard	crossover
11402	5.138	the_feel_felt_found	discard	crossover
11403	5.200	the_feel_felt_found+ownership_language	discard	crossover
11404	5.450	the_feel_felt_found+ownership_language+validation_before_solution	discard	add_validation_before_solution
11405	4.888	the_feel_felt_found+ownership_language	discard	crossover
11406	5.237	the_feel_felt_found+strategic_agreement	discard	swap_ownership_language_for_strategic_agreement
11407	5.237	ownership_language	discard	crossover
11408	5.138	ownership_language	discard	remove_the_feel_felt_found
11409	5.325	ownership_language	discard	crossover
11410	5.450	the_feel_felt_found+ownership_language	discard	tone_change
11411	5.325	the_feel_felt_found+ownership_language	discard	tone_change
11412	4.700	the_feel_felt_found+ownership_language+strategic_agreement	discard	add_strategic_agreement
11413	5.550	the_feel_felt_found+ownership_language	discard	tone_change
11414	5.237	the_feel_felt_found+energy_matching	discard	swap_ownership_language_for_energy_matching
11415	5.425	the_feel_felt_found	discard	crossover
11416	5.138	the_feel_felt_found+ownership_language+casual_professionalism	discard	add_casual_professionalism
11417	5.550	ownership_language	discard	crossover
11418	5.450	the_feel_felt_found+personal_touch	discard	swap_ownership_language_for_personal_touch
11419	5.013	the_feel_felt_found+ownership_language	discard	tone_change
11420	5.112	the_feel_felt_found	discard	remove_ownership_language
11421	4.825	the_feel_felt_found	discard	remove_ownership_language
11422	5.113	the_feel_felt_found+mirroring	discard	swap_ownership_language_for_mirroring
11423	5.200	the_feel_felt_found+personal_touch	discard	swap_ownership_language_for_personal_touch
11424	4.825	the_feel_felt_found+ownership_language	discard	tone_change
11425	5.450	the_feel_felt_found	discard	crossover
11426	5.025	the_feel_felt_found+ownership_language+proactive_extras	discard	add_proactive_extras
11427	5.550	the_feel_felt_found+ownership_language	discard	tone_change
11428	5.237	the_feel_felt_found+ownership_language	discard	tone_change
11429	5.550	the_feel_felt_found+ownership_language	discard	crossover
11430	5.200	the_feel_felt_found+ownership_language	discard	tone_change
11431	4.925	the_feel_felt_found+ownership_language+genuine_admission	discard	add_genuine_admission
11432	4.825	the_feel_felt_found+emotional_labeling	discard	swap_ownership_language_for_emotional_labeling
11433	5.300	ownership_language+personal_touch	discard	swap_the_feel_felt_found_for_personal_touch
11434	4.825	the_feel_felt_found+ownership_language+casual_professionalism	discard	add_casual_professionalism
11435	4.925	the_feel_felt_found+ownership_language	discard	tone_change
11436	5.438	the_feel_felt_found+ownership_language	discard	crossover
11437	5.025	the_feel_felt_found	discard	crossover
11438	5.138	the_feel_felt_found+ownership_language+warmth_injection	discard	add_warmth_injection
11439	4.825	the_feel_felt_found+ownership_language+casual_professionalism	discard	add_casual_professionalism
11440	4.925	the_feel_felt_found+ownership_language+proactive_extras	discard	add_proactive_extras
11441	4.825	none	discard	crossover
11442	5.112	the_feel_felt_found+ownership_language	discard	tone_change
11443	5.138	the_feel_felt_found+emotional_labeling	discard	swap_ownership_language_for_emotional_labeling
11444	5.337	the_feel_felt_found+ownership_language+emotional_labeling	discard	add_emotional_labeling
11445	5.113	the_feel_felt_found+ownership_language+emotional_labeling	discard	add_emotional_labeling
11446	5.112	the_feel_felt_found+personal_touch	discard	swap_ownership_language_for_personal_touch
11447	5.550	the_feel_felt_found+casual_professionalism	discard	swap_ownership_language_for_casual_professionalism
11448	5.088	the_feel_felt_found+ownership_language	discard	temp_0.85
11449	5.200	ownership_language	discard	crossover
11450	5.450	the_feel_felt_found+ownership_language+genuine_admission	discard	add_genuine_admission
11451	5.325	the_feel_felt_found	discard	remove_ownership_language
11452	5.550	ownership_language+never_say_calm_down	discard	swap_the_feel_felt_found_for_never_say_calm_down
11453	5.112	the_feel_felt_found+ownership_language	discard	temp_0.65
11454	5.237	the_feel_felt_found+ownership_language	discard	crossover
11455	5.550	ownership_language+personal_touch	discard	swap_the_feel_felt_found_for_personal_touch
11456	5.550	the_feel_felt_found	discard	crossover
11457	5.450	the_feel_felt_found+ownership_language+mirroring	discard	add_mirroring
11458	5.138	the_feel_felt_found+ownership_language	discard	temp_0.65
11459	5.325	the_feel_felt_found+ownership_language	discard	temp_0.90
11460	4.888	the_feel_felt_found+ownership_language	discard	tone_change
11461	5.138	the_feel_felt_found+mirroring	discard	swap_ownership_language_for_mirroring
11462	5.550	the_feel_felt_found+casual_professionalism	discard	swap_ownership_language_for_casual_professionalism
11463	5.037	the_feel_felt_found+ownership_language+warmth_injection	discard	add_warmth_injection
11464	5.550	the_feel_felt_found+ownership_language+mirroring	discard	add_mirroring
11465	4.825	the_feel_felt_found+ownership_language	discard	temp_0.90
11466	4.987	the_feel_felt_found+ownership_language	discard	tone_change
11467	5.138	the_feel_felt_found	discard	crossover
11468	5.112	the_feel_felt_found+ownership_language+warmth_injection	discard	add_warmth_injection
11469	5.025	the_feel_felt_found+ownership_language	discard	temp_0.70
11470	5.213	the_feel_felt_found+ownership_language	discard	temp_0.90
11471	5.237	the_feel_felt_found	discard	remove_ownership_language
11472	4.675	the_feel_felt_found	discard	crossover
11473	5.425	the_feel_felt_found	discard	remove_ownership_language
11474	5.013	the_feel_felt_found+ownership_language	discard	crossover
11475	5.013	the_feel_felt_found+ownership_language+mirroring	discard	add_mirroring
11476	5.237	the_feel_felt_found+personal_touch	discard	swap_ownership_language_for_personal_touch
11477	5.013	the_feel_felt_found+energy_matching	discard	swap_ownership_language_for_energy_matching
11478	5.013	the_feel_felt_found+ownership_language	discard	crossover
11479	5.350	the_feel_felt_found+ownership_language	discard	tone_change
11480	4.612	ownership_language	discard	crossover
11481	5.525	the_feel_felt_found+ownership_language	discard	crossover
11482	5.550	the_feel_felt_found+ownership_language	discard	temp_0.95
11483	5.450	the_feel_felt_found+ownership_language+strategic_agreement	discard	add_strategic_agreement
11484	5.038	the_feel_felt_found+ownership_language	discard	temp_0.95
11485	4.925	none	discard	crossover
11486	5.450	the_feel_felt_found+ownership_language	discard	crossover
11487	5.350	the_feel_felt_found+ownership_language	discard	tone_change
11488	4.913	ownership_language+emotional_labeling	discard	swap_the_feel_felt_found_for_emotional_labeling
11489	4.825	the_feel_felt_found+ownership_language	discard	tone_change
11490	5.238	the_feel_felt_found+ownership_language	discard	crossover
11491	5.112	the_feel_felt_found	discard	crossover
11492	5.750	the_feel_felt_found+ownership_language+concrete_next_steps	discard	add_concrete_next_steps
11493	5.425	the_feel_felt_found+never_say_calm_down	discard	swap_ownership_language_for_never_say_calm_down
11494	5.750	the_feel_felt_found+casual_professionalism	discard	swap_ownership_language_for_casual_professionalism
11495	5.138	the_feel_felt_found+ownership_language	discard	tone_change
11496	5.013	the_feel_felt_found	discard	remove_ownership_language
11497	4.925	the_feel_felt_found+ownership_language	discard	tone_change
11498	5.138	ownership_language	discard	remove_the_feel_felt_found
11499	5.237	the_feel_felt_found+ownership_language+warmth_injection	discard	add_warmth_injection
11500	5.550	the_feel_felt_found	discard	remove_ownership_language
11501	5.425	the_feel_felt_found+ownership_language	discard	tone_change
11502	5.112	the_feel_felt_found+ownership_language	discard	tone_change
11503	5.038	the_feel_felt_found+ownership_language+personal_touch	discard	add_personal_touch
11504	5.138	the_feel_felt_found+ownership_language+never_say_calm_down	discard	add_never_say_calm_down
11505	5.213	ownership_language	discard	crossover
11506	4.800	the_feel_felt_found+ownership_language	discard	tone_change
11507	4.388	the_feel_felt_found	discard	crossover
11508	5.250	the_feel_felt_found+ownership_language+mirroring	discard	add_mirroring
11509	4.987	the_feel_felt_found+ownership_language+proactive_extras	discard	add_proactive_extras
11510	5.450	the_feel_felt_found+ownership_language+casual_professionalism	discard	add_casual_professionalism
11511	5.338	the_feel_felt_found+ownership_language	discard	crossover
11512	5.425	the_feel_felt_found+ownership_language	discard	temp_0.85
11513	5.450	the_feel_felt_found+ownership_language	discard	tone_change
11514	5.138	the_feel_felt_found+ownership_language	discard	temp_0.90
11515	5.100	the_feel_felt_found+ownership_language	discard	temp_0.95
11516	5.138	the_feel_felt_found	discard	remove_ownership_language
11517	5.325	the_feel_felt_found+ownership_language	discard	crossover
11518	5.300	the_feel_felt_found+genuine_admission	discard	swap_ownership_language_for_genuine_admission
11519	5.650	the_feel_felt_found+ownership_language	discard	temp_0.85
11520	4.888	ownership_language	discard	remove_the_feel_felt_found
11521	5.113	the_feel_felt_found+ownership_language	discard	tone_change
11522	5.138	ownership_language	discard	remove_the_feel_felt_found
11523	5.550	the_feel_felt_found+ownership_language	discard	temp_0.75
11524	5.013	the_feel_felt_found+ownership_language+mirroring	discard	add_mirroring
11525	5.013	the_feel_felt_found+ownership_language	discard	tone_change
11526	5.238	the_feel_felt_found+ownership_language+genuine_admission	discard	add_genuine_admission
11527	5.325	the_feel_felt_found+ownership_language	discard	crossover
11528	5.238	the_feel_felt_found	discard	crossover
11529	5.450	the_feel_felt_found+ownership_language	discard	crossover
11530	4.200	the_feel_felt_found+ownership_language+personal_touch	discard	add_personal_touch
11531	5.013	ownership_language+mirroring	discard	swap_the_feel_felt_found_for_mirroring
11532	4.987	the_feel_felt_found+ownership_language+personal_touch	discard	add_personal_touch
11533	5.112	the_feel_felt_found+ownership_language	discard	crossover
11534	5.450	the_feel_felt_found+ownership_language+never_say_calm_down	discard	add_never_say_calm_down
11535	5.312	the_feel_felt_found	discard	crossover
11536	5.237	ownership_language+casual_professionalism	discard	swap_the_feel_felt_found_for_casual_professionalism
11537	5.250	the_feel_felt_found	discard	remove_ownership_language
11538	5.325	the_feel_felt_found+ownership_language+emotional_labeling	discard	add_emotional_labeling
11539	5.350	the_feel_felt_found+ownership_language	discard	tone_change
11540	5.650	the_feel_felt_found+ownership_language	discard	tone_change
11541	4.900	the_feel_felt_found	discard	remove_ownership_language
11542	5.550	the_feel_felt_found+emotional_labeling	discard	swap_ownership_language_for_emotional_labeling
11543	5.137	ownership_language+personal_touch	discard	swap_the_feel_felt_found_for_personal_touch
11544	5.338	the_feel_felt_found+ownership_language+never_say_calm_down	discard	add_never_say_calm_down
11545	5.650	the_feel_felt_found+genuine_admission	discard	swap_ownership_language_for_genuine_admission
11546	5.337	the_feel_felt_found+ownership_language	discard	temp_0.95
11547	5.525	the_feel_felt_found+ownership_language+validation_before_solution	discard	add_validation_before_solution
11548	5.225	the_feel_felt_found+ownership_language	discard	crossover
11549	5.200	the_feel_felt_found+ownership_language	discard	tone_change
11550	5.250	the_feel_felt_found+ownership_language+concrete_next_steps	discard	add_concrete_next_steps
11551	5.200	the_feel_felt_found+ownership_language+warmth_injection	discard	add_warmth_injection
11552	5.650	the_feel_felt_found+ownership_language+warmth_injection	discard	add_warmth_injection
11553	5.138	ownership_language+energy_matching	discard	swap_the_feel_felt_found_for_energy_matching
11554	5.200	the_feel_felt_found+casual_professionalism	discard	swap_ownership_language_for_casual_professionalism
11555	5.550	ownership_language+strategic_agreement	discard	swap_the_feel_felt_found_for_strategic_agreement
11556	5.037	the_feel_felt_found+ownership_language+strategic_agreement	discard	add_strategic_agreement
11557	5.350	ownership_language+strategic_agreement	discard	swap_the_feel_felt_found_for_strategic_agreement
11558	5.650	the_feel_felt_found	discard	remove_ownership_language
11559	5.525	the_feel_felt_found+ownership_language	discard	temp_0.70
11560	5.550	the_feel_felt_found+ownership_language	discard	crossover
11561	5.525	the_feel_felt_found+ownership_language+personal_touch	discard	add_personal_touch
11562	5.350	the_feel_felt_found+ownership_language+never_say_calm_down	discard	add_never_say_calm_down
11563	5.650	the_feel_felt_found+ownership_language+warmth_injection	discard	add_warmth_injection
11564	5.113	the_feel_felt_found+ownership_language	discard	crossover
11565	5.213	the_feel_felt_found+ownership_language	discard	crossover
11566	5.550	the_feel_felt_found+ownership_language+personal_touch	discard	add_personal_touch
11567	5.138	the_feel_felt_found	discard	crossover
11568	5.237	the_feel_felt_found+ownership_language	discard	crossover
11569	5.113	the_feel_felt_found+ownership_language	discard	crossover
11570	5.037	the_feel_felt_found+ownership_language+mirroring	discard	add_mirroring
11571	5.137	the_feel_felt_found+ownership_language	discard	tone_change
11572	5.013	the_feel_felt_found+ownership_language	discard	crossover
11573	5.650	the_feel_felt_found+ownership_language+strategic_agreement	discard	add_strategic_agreement
11574	4.925	the_feel_felt_found+ownership_language+casual_professionalism	discard	add_casual_professionalism
11575	5.200	the_feel_felt_found+ownership_language+concrete_next_steps	discard	add_concrete_next_steps
11576	5.225	the_feel_felt_found+ownership_language+casual_professionalism	discard	add_casual_professionalism
11577	5.138	the_feel_felt_found+ownership_language+proactive_extras	discard	add_proactive_extras
11578	5.450	the_feel_felt_found+ownership_language	discard	tone_change
11579	5.138	the_feel_felt_found+ownership_language	discard	crossover
11580	5.225	ownership_language+mirroring	discard	swap_the_feel_felt_found_for_mirroring
11581	5.550	the_feel_felt_found	discard	crossover
11582	5.138	the_feel_felt_found+ownership_language	discard	tone_change
11583	5.237	the_feel_felt_found	discard	remove_ownership_language
11584	5.038	the_feel_felt_found+ownership_language+warmth_injection	discard	add_warmth_injection
11585	5.550	the_feel_felt_found+warmth_injection	discard	swap_ownership_language_for_warmth_injection
11586	4.887	the_feel_felt_found	discard	crossover
11587	5.113	the_feel_felt_found	discard	remove_ownership_language
11588	5.225	the_feel_felt_found	discard	crossover
11589	5.550	the_feel_felt_found+ownership_language+strategic_agreement	discard	add_strategic_agreement
11590	5.138	the_feel_felt_found+ownership_language	discard	crossover
11591	5.550	the_feel_felt_found+ownership_language+concrete_next_steps	discard	add_concrete_next_steps
11592	5.550	the_feel_felt_found+never_say_calm_down	discard	swap_ownership_language_for_never_say_calm_down
11593	5.138	the_feel_felt_found+strategic_agreement	discard	swap_ownership_language_for_strategic_agreement
11594	5.650	the_feel_felt_found+ownership_language	discard	temp_0.95
11595	5.238	the_feel_felt_found+ownership_language+energy_matching	discard	add_energy_matching
11596	5.550	the_feel_felt_found+ownership_language	discard	tone_change
11597	5.112	the_feel_felt_found+ownership_language	discard	tone_change
11598	5.338	the_feel_felt_found+ownership_language	discard	tone_change
11599	4.700	the_feel_felt_found+ownership_language	discard	temp_0.85
11600	5.650	the_feel_felt_found	discard	remove_ownership_language
11601	5.138	the_feel_felt_found+ownership_language	discard	tone_change
11602	5.350	the_feel_felt_found+strategic_agreement	discard	swap_ownership_language_for_strategic_agreement
11603	5.138	the_feel_felt_found+proactive_extras	discard	swap_ownership_language_for_proactive_extras
11604	5.450	ownership_language	discard	crossover
11605	5.550	ownership_language+energy_matching	discard	swap_the_feel_felt_found_for_energy_matching
11606	5.450	the_feel_felt_found+ownership_language+warmth_injection	discard	add_warmth_injection
11607	5.350	ownership_language	discard	crossover
11608	5.088	the_feel_felt_found+ownership_language+personal_touch	discard	add_personal_touch
11609	5.425	the_feel_felt_found+ownership_language	discard	crossover
11610	5.325	the_feel_felt_found+ownership_language+emotional_labeling	discard	add_emotional_labeling
11611	4.713	the_feel_felt_found+ownership_language+never_say_calm_down	discard	add_never_say_calm_down
11612	5.200	ownership_language+proactive_extras	discard	swap_the_feel_felt_found_for_proactive_extras
11613	5.013	the_feel_felt_found+ownership_language	discard	tone_change
11614	5.325	the_feel_felt_found+ownership_language+concrete_next_steps	discard	add_concrete_next_steps
11615	5.112	the_feel_felt_found+casual_professionalism	discard	swap_ownership_language_for_casual_professionalism
11616	5.338	ownership_language	discard	crossover
11617	4.913	the_feel_felt_found+ownership_language+personal_touch	discard	add_personal_touch
11618	5.425	the_feel_felt_found	discard	crossover
11619	5.112	the_feel_felt_found+ownership_language	discard	tone_change
11620	5.300	the_feel_felt_found+ownership_language	discard	tone_change
11621	4.913	the_feel_felt_found+ownership_language	discard	tone_change
11622	5.112	the_feel_felt_found+ownership_language	discard	tone_change
11623	5.450	the_feel_felt_found+ownership_language	discard	tone_change
11624	5.237	the_feel_felt_found+ownership_language	discard	crossover
11625	4.900	the_feel_felt_found+ownership_language	discard	tone_change
11626	5.013	the_feel_felt_found+ownership_language+emotional_labeling	discard	add_emotional_labeling
11627	5.138	the_feel_felt_found+ownership_language	discard	crossover
11628	5.237	the_feel_felt_found+ownership_language	discard	crossover
11629	5.425	ownership_language+validation_before_solution	discard	swap_the_feel_felt_found_for_validation_before_solution
11630	4.612	the_feel_felt_found+ownership_language	discard	temp_0.90
11631	5.213	the_feel_felt_found	discard	crossover
11632	5.225	the_feel_felt_found+ownership_language	discard	temp_0.75
11633	5.237	the_feel_felt_found+ownership_language	discard	temp_0.70
11634	4.800	ownership_language+emotional_labeling	discard	swap_the_feel_felt_found_for_emotional_labeling
11635	5.550	the_feel_felt_found+ownership_language+casual_professionalism	discard	add_casual_professionalism
11636	5.013	the_feel_felt_found+strategic_agreement	discard	swap_ownership_language_for_strategic_agreement
11637	5.013	ownership_language+emotional_labeling	discard	swap_the_feel_felt_found_for_emotional_labeling
11638	4.613	the_feel_felt_found+ownership_language	discard	tone_change
