generation	eq_score	techniques	status	description
1697	5.550	the_feel_felt_found+warmth_injection	discard	swap_ownership_language_for_warmth_injection
1698	5.013	the_feel_felt_found+ownership_language+warmth_injection	discard	add_warmth_injection
1699	5.238	ownership_language+concrete_next_steps	discard	swap_the_feel_felt_found_for_concrete_next_steps
1700	5.325	the_feel_felt_found+ownership_language	discard	temp_0.70
1701	5.238	ownership_language	discard	crossover
1702	5.200	the_feel_felt_found	discard	remove_ownership_language
1703	5.425	the_feel_felt_found+ownership_language	discard	temp_0.75
1704	5.200	ownership_language	discard	remove_the_feel_felt_found
1705	5.237	ownership_language	discard	crossover
1706	5.138	the_feel_felt_found+ownership_language	discard	crossover
1707	5.238	the_feel_felt_found+ownership_language	discard	crossover
1708	5.550	the_feel_felt_found+ownership_language	discard	tone_change
1709	5.138	the_feel_felt_found+ownership_language	discard	tone_change
1710	5.138	the_feel_felt_found+ownership_language	discard	crossover
1711	5.325	the_feel_felt_found+ownership_language+personal_touch	discard	add_personal_touch
1712	5.325	the_feel_felt_found	discard	crossover
1713	5.138	the_feel_felt_found+ownership_language	discard	temp_0.70
1714	5.325	the_feel_felt_found+validation_before_solution	discard	swap_ownership_language_for_validation_before_solution
1715	5.137	the_feel_felt_found+ownership_language+concrete_next_steps	discard	add_concrete_next_steps
1716	5.550	ownership_language+mirroring	discard	swap_the_feel_felt_found_for_mirroring
1717	4.487	the_feel_felt_found+ownership_language+genuine_admission	discard	add_genuine_admission
1718	5.350	the_feel_felt_found+emotional_labeling	discard	swap_ownership_language_for_emotional_labeling
1719	5.337	the_feel_felt_found+ownership_language	discard	temp_0.70
1720	5.013	the_feel_felt_found+ownership_language+casual_professionalism	discard	add_casual_professionalism
1721	4.725	the_feel_felt_found+ownership_language	discard	crossover
1722	5.450	the_feel_felt_found	discard	remove_ownership_language
1723	5.450	the_feel_felt_found+ownership_language	discard	tone_change
1724	4.888	the_feel_felt_found+ownership_language+validation_before_solution	discard	add_validation_before_solution
1725	5.438	none	discard	crossover
1726	5.450	the_feel_felt_found+ownership_language	discard	tone_change
1727	5.325	ownership_language	discard	crossover
1728	4.825	ownership_language	discard	remove_the_feel_felt_found
1729	5.525	the_feel_felt_found	discard	remove_ownership_language
1730	4.825	the_feel_felt_found+ownership_language	discard	crossover
1731	5.238	the_feel_felt_found+ownership_language	discard	temp_0.95
1732	5.138	the_feel_felt_found+ownership_language	discard	crossover
1733	5.350	none	discard	crossover
1734	5.650	the_feel_felt_found+ownership_language	discard	tone_change
1735	5.138	ownership_language	discard	remove_the_feel_felt_found
1736	5.138	the_feel_felt_found+ownership_language	discard	tone_change
1737	5.850	the_feel_felt_found+ownership_language	discard	tone_change
1738	5.450	ownership_language+strategic_agreement	discard	swap_the_feel_felt_found_for_strategic_agreement
1739	5.325	the_feel_felt_found+ownership_language+validation_before_solution	discard	add_validation_before_solution
1740	5.650	the_feel_felt_found+ownership_language	discard	tone_change
1741	4.925	the_feel_felt_found+ownership_language	discard	crossover
1742	5.325	the_feel_felt_found+ownership_language+concrete_next_steps	discard	add_concrete_next_steps
1743	5.013	ownership_language	discard	remove_the_feel_felt_found
1744	5.138	ownership_language+validation_before_solution	discard	swap_the_feel_felt_found_for_validation_before_solution
1745	5.138	the_feel_felt_found+ownership_language+strategic_agreement	discard	add_strategic_agreement
1746	5.138	the_feel_felt_found+ownership_language+personal_touch	discard	add_personal_touch
1747	4.825	the_feel_felt_found+ownership_language+mirroring	discard	add_mirroring
1748	4.725	the_feel_felt_found+ownership_language	discard	tone_change
1749	5.550	ownership_language+strategic_agreement	discard	swap_the_feel_felt_found_for_strategic_agreement
1750	5.237	the_feel_felt_found+ownership_language	discard	tone_change
1751	4.575	the_feel_felt_found+ownership_language	discard	crossover
1752	4.825	ownership_language	discard	remove_the_feel_felt_found
1753	5.525	the_feel_felt_found+ownership_language	discard	tone_change
1754	5.325	ownership_language	discard	crossover
1755	5.350	ownership_language	discard	remove_the_feel_felt_found
1756	5.138	the_feel_felt_found	discard	remove_ownership_language
1757	5.237	ownership_language	discard	remove_the_feel_felt_found
1758	5.013	none	discard	crossover
1759	5.550	ownership_language+strategic_agreement	discard	swap_the_feel_felt_found_for_strategic_agreement
1760	5.425	the_feel_felt_found+ownership_language+personal_touch	discard	add_personal_touch
1761	5.113	the_feel_felt_found	discard	crossover
1762	5.325	ownership_language+casual_professionalism	discard	swap_the_feel_felt_found_for_casual_professionalism
1763	5.238	the_feel_felt_found+ownership_language+concrete_next_steps	discard	add_concrete_next_steps
1764	5.025	the_feel_felt_found+ownership_language	discard	crossover
1765	5.013	the_feel_felt_found+ownership_language+mirroring	discard	add_mirroring
1766	5.550	the_feel_felt_found+ownership_language	discard	tone_change
1767	4.725	ownership_language	discard	remove_the_feel_felt_found
1768	5.550	ownership_language+warmth_injection	discard	swap_the_feel_felt_found_for_warmth_injection
1769	5.650	the_feel_felt_found+ownership_language	discard	tone_change
1770	5.450	the_feel_felt_found+ownership_language+personal_touch	discard	add_personal_touch
1771	5.550	the_feel_felt_found+ownership_language	discard	tone_change
1772	5.013	the_feel_felt_found+ownership_language	discard	temp_0.90
1773	5.138	the_feel_felt_found+ownership_language	discard	tone_change
1774	5.650	the_feel_felt_found+ownership_language	discard	tone_change
1775	5.525	the_feel_felt_found+ownership_language	discard	tone_change
1776	5.425	the_feel_felt_found+ownership_language	discard	temp_0.65
1777	5.138	ownership_language+genuine_admission	discard	swap_the_feel_felt_found_for_genuine_admission
1778	5.013	the_feel_felt_found+ownership_language	discard	tone_change
1779	5.025	none	discard	crossover
1780	5.425	the_feel_felt_found+ownership_language	discard	tone_change
1781	4.825	the_feel_felt_found+ownership_language	discard	tone_change
1782	5.450	the_feel_felt_found+ownership_language	discard	temp_0.95
1783	5.325	the_feel_felt_found+ownership_language	discard	crossover
1784	5.450	the_feel_felt_found+ownership_language	discard	tone_change
1785	5.237	the_feel_felt_found	discard	remove_ownership_language
1786	5.525	the_feel_felt_found+ownership_language+emotional_labeling	discard	add_emotional_labeling
1787	5.425	the_feel_felt_found+ownership_language+warmth_injection	discard	add_warmth_injection
1788	5.013	the_feel_felt_found+ownership_language+casual_professionalism	discard	add_casual_professionalism
1789	5.137	the_feel_felt_found+ownership_language	discard	tone_change
1790	5.325	the_feel_felt_found+ownership_language	discard	tone_change
1791	4.925	the_feel_felt_found+ownership_language	discard	temp_0.95
1792	5.013	the_feel_felt_found	discard	remove_ownership_language
1793	5.138	the_feel_felt_found	discard	remove_ownership_language
1794	5.325	the_feel_felt_found+ownership_language	discard	crossover
1795	5.013	the_feel_felt_found+ownership_language	discard	tone_change
1796	5.200	the_feel_felt_found+ownership_language	discard	crossover
1797	5.037	the_feel_felt_found+ownership_language+warmth_injection	discard	add_warmth_injection
1798	5.013	the_feel_felt_found	discard	crossover
1799	5.013	the_feel_felt_found	discard	crossover
1800	5.013	the_feel_felt_found	discard	remove_ownership_language
1801	5.450	the_feel_felt_found+ownership_language+validation_before_solution	discard	add_validation_before_solution
1802	5.137	the_feel_felt_found+ownership_language+genuine_admission	discard	add_genuine_admission
1803	5.450	the_feel_felt_found+ownership_language	discard	tone_change
1804	5.038	the_feel_felt_found+proactive_extras	discard	swap_ownership_language_for_proactive_extras
1805	5.550	the_feel_felt_found+ownership_language	discard	tone_change
1806	4.888	ownership_language	discard	crossover
1807	5.450	ownership_language+warmth_injection	discard	swap_the_feel_felt_found_for_warmth_injection
1808	5.325	the_feel_felt_found+ownership_language+genuine_admission	discard	add_genuine_admission
1809	5.550	the_feel_felt_found+ownership_language	discard	crossover
1810	5.325	the_feel_felt_found+ownership_language	discard	tone_change
1811	4.700	the_feel_felt_found+ownership_language	discard	crossover
1812	5.237	the_feel_felt_found+ownership_language	discard	tone_change
1813	5.250	the_feel_felt_found+ownership_language+warmth_injection	discard	add_warmth_injection
1814	5.200	the_feel_felt_found+ownership_language	discard	temp_0.65
1815	5.325	ownership_language	discard	remove_the_feel_felt_found
1816	5.225	ownership_language+genuine_admission	discard	swap_the_feel_felt_found_for_genuine_admission
1817	5.338	ownership_language	discard	remove_the_feel_felt_found
1818	5.450	ownership_language	discard	crossover
1819	5.550	the_feel_felt_found+ownership_language	discard	tone_change
1820	5.450	the_feel_felt_found+ownership_language	discard	temp_0.70
1821	5.450	the_feel_felt_found+ownership_language	discard	crossover
1822	5.300	the_feel_felt_found+ownership_language+mirroring	discard	add_mirroring
1823	5.237	the_feel_felt_found+ownership_language+mirroring	discard	add_mirroring
1824	4.825	the_feel_felt_found+ownership_language+concrete_next_steps	discard	add_concrete_next_steps
1825	5.325	the_feel_felt_found+ownership_language+warmth_injection	discard	add_warmth_injection
1826	5.013	the_feel_felt_found	discard	remove_ownership_language
1827	5.350	ownership_language	discard	remove_the_feel_felt_found
1828	4.513	none	discard	crossover
1829	5.450	the_feel_felt_found+ownership_language	discard	tone_change
1830	5.038	the_feel_felt_found+ownership_language	discard	temp_0.70
1831	4.700	the_feel_felt_found+ownership_language	discard	tone_change
1832	5.450	the_feel_felt_found+ownership_language	discard	crossover
1833	5.037	the_feel_felt_found+ownership_language	discard	temp_0.75
1834	5.138	the_feel_felt_found+ownership_language	discard	tone_change
1835	5.425	the_feel_felt_found+ownership_language+mirroring	discard	add_mirroring
1836	5.450	ownership_language+casual_professionalism	discard	swap_the_feel_felt_found_for_casual_professionalism
1837	5.325	the_feel_felt_found	discard	crossover
1838	5.425	the_feel_felt_found+ownership_language+never_say_calm_down	discard	add_never_say_calm_down
1839	5.450	the_feel_felt_found+ownership_language+casual_professionalism	discard	add_casual_professionalism
1840	5.112	the_feel_felt_found+ownership_language+mirroring	discard	add_mirroring
1841	5.325	the_feel_felt_found+concrete_next_steps	discard	swap_ownership_language_for_concrete_next_steps
1842	5.450	the_feel_felt_found+ownership_language	discard	crossover
1843	5.225	the_feel_felt_found+ownership_language+genuine_admission	discard	add_genuine_admission
1844	5.325	the_feel_felt_found+ownership_language+warmth_injection	discard	add_warmth_injection
1845	4.888	the_feel_felt_found	discard	crossover
1846	4.925	the_feel_felt_found	discard	remove_ownership_language
1847	5.025	the_feel_felt_found	discard	crossover
1848	5.013	the_feel_felt_found+ownership_language	discard	crossover
1849	5.550	the_feel_felt_found+ownership_language	discard	tone_change
1850	5.237	the_feel_felt_found+ownership_language+mirroring	discard	add_mirroring
1851	5.300	the_feel_felt_found+ownership_language+genuine_admission	discard	add_genuine_admission
1852	5.138	the_feel_felt_found+ownership_language+personal_touch	discard	add_personal_touch
1853	5.650	the_feel_felt_found+ownership_language	discard	temp_0.70
1854	5.450	ownership_language	discard	remove_the_feel_felt_found
1855	5.350	the_feel_felt_found	discard	remove_ownership_language
1856	5.037	the_feel_felt_found+genuine_admission	discard	swap_ownership_language_for_genuine_admission
1857	4.825	the_feel_felt_found+ownership_language	discard	crossover
1858	5.338	ownership_language+never_say_calm_down	discard	swap_the_feel_felt_found_for_never_say_calm_down
1859	5.450	ownership_language+strategic_agreement	discard	swap_the_feel_felt_found_for_strategic_agreement
1860	4.925	the_feel_felt_found+personal_touch	discard	swap_ownership_language_for_personal_touch
1861	5.325	the_feel_felt_found+ownership_language	discard	temp_0.75
1862	5.100	the_feel_felt_found+ownership_language+casual_professionalism	discard	add_casual_professionalism
1863	5.138	the_feel_felt_found+mirroring	discard	swap_ownership_language_for_mirroring
1864	4.888	the_feel_felt_found+ownership_language	discard	temp_0.65
1865	4.925	the_feel_felt_found+ownership_language	discard	tone_change
1866	5.425	the_feel_felt_found+strategic_agreement	discard	swap_ownership_language_for_strategic_agreement
1867	5.037	the_feel_felt_found+personal_touch	discard	swap_ownership_language_for_personal_touch
1868	5.138	the_feel_felt_found+ownership_language+genuine_admission	discard	add_genuine_admission
1869	5.550	the_feel_felt_found+never_say_calm_down	discard	swap_ownership_language_for_never_say_calm_down
1870	5.138	the_feel_felt_found+ownership_language	discard	tone_change
1871	5.525	ownership_language+strategic_agreement	discard	swap_the_feel_felt_found_for_strategic_agreement
1872	5.237	the_feel_felt_found+ownership_language+genuine_admission	discard	add_genuine_admission
1873	5.450	the_feel_felt_found+ownership_language	discard	temp_0.70
1874	5.300	the_feel_felt_found+ownership_language+never_say_calm_down	discard	add_never_say_calm_down
1875	4.700	ownership_language+warmth_injection	discard	swap_the_feel_felt_found_for_warmth_injection
1876	5.450	the_feel_felt_found	discard	remove_ownership_language
1877	5.013	the_feel_felt_found+ownership_language+proactive_extras	discard	add_proactive_extras
1878	4.613	ownership_language	discard	remove_the_feel_felt_found
1879	5.450	the_feel_felt_found+ownership_language	discard	crossover
1880	5.550	the_feel_felt_found+ownership_language	discard	crossover
1881	5.325	ownership_language	discard	crossover
1882	5.138	the_feel_felt_found+ownership_language	discard	crossover
1883	5.113	the_feel_felt_found	discard	remove_ownership_language
1884	4.800	the_feel_felt_found+ownership_language	discard	crossover
1885	5.300	the_feel_felt_found+ownership_language+validation_before_solution	discard	add_validation_before_solution
1886	5.137	the_feel_felt_found+ownership_language	discard	crossover
1887	5.337	the_feel_felt_found+mirroring	discard	swap_ownership_language_for_mirroring
1888	5.013	the_feel_felt_found+ownership_language	discard	temp_0.75
1889	5.013	the_feel_felt_found+ownership_language+concrete_next_steps	discard	add_concrete_next_steps
1890	5.350	the_feel_felt_found+ownership_language	discard	tone_change
1891	5.450	the_feel_felt_found+mirroring	discard	swap_ownership_language_for_mirroring
1892	5.325	the_feel_felt_found+ownership_language	discard	crossover
1893	5.138	the_feel_felt_found+ownership_language	discard	tone_change
1894	4.513	the_feel_felt_found+ownership_language+proactive_extras	discard	add_proactive_extras
1895	4.800	the_feel_felt_found+ownership_language	discard	crossover
1896	5.225	ownership_language	discard	remove_the_feel_felt_found
1897	4.888	the_feel_felt_found+ownership_language	discard	crossover
1898	5.425	the_feel_felt_found+ownership_language+warmth_injection	discard	add_warmth_injection
1899	5.450	the_feel_felt_found+ownership_language	discard	crossover
1900	5.550	the_feel_felt_found+ownership_language	discard	tone_change
1901	4.800	the_feel_felt_found+ownership_language	discard	tone_change
1902	5.425	the_feel_felt_found+ownership_language	discard	tone_change
1903	5.550	ownership_language+energy_matching	discard	swap_the_feel_felt_found_for_energy_matching
1904	5.138	the_feel_felt_found+ownership_language	discard	tone_change
1905	5.112	the_feel_felt_found+ownership_language+genuine_admission	discard	add_genuine_admission
1906	5.450	the_feel_felt_found+ownership_language+genuine_admission	discard	add_genuine_admission
1907	5.125	the_feel_felt_found+ownership_language	discard	temp_0.70
1908	5.013	the_feel_felt_found+ownership_language+genuine_admission	discard	add_genuine_admission
1909	5.325	the_feel_felt_found+ownership_language+energy_matching	discard	add_energy_matching
1910	5.350	ownership_language+emotional_labeling	discard	swap_the_feel_felt_found_for_emotional_labeling
1911	5.212	the_feel_felt_found+ownership_language	discard	temp_0.65
1912	5.037	the_feel_felt_found+never_say_calm_down	discard	swap_ownership_language_for_never_say_calm_down
1913	5.237	the_feel_felt_found+ownership_language+mirroring	discard	add_mirroring
1914	5.138	the_feel_felt_found+ownership_language	discard	crossover
1915	5.550	the_feel_felt_found+ownership_language+warmth_injection	discard	add_warmth_injection
1916	4.700	the_feel_felt_found+ownership_language	discard	crossover
1917	5.138	the_feel_felt_found+ownership_language	discard	tone_change
1918	5.550	the_feel_felt_found+ownership_language	discard	temp_0.65
1919	5.450	ownership_language	discard	crossover
1920	5.238	the_feel_felt_found+ownership_language	discard	tone_change
1921	4.925	the_feel_felt_found+ownership_language	discard	crossover
1922	5.750	the_feel_felt_found+ownership_language+personal_touch	discard	add_personal_touch
1923	5.325	the_feel_felt_found+strategic_agreement	discard	swap_ownership_language_for_strategic_agreement
1924	4.825	the_feel_felt_found+ownership_language	discard	crossover
1925	5.350	the_feel_felt_found+ownership_language	discard	crossover
1926	4.700	the_feel_felt_found+ownership_language+concrete_next_steps	discard	add_concrete_next_steps
1927	5.013	the_feel_felt_found+ownership_language	discard	tone_change
1928	5.338	the_feel_felt_found+never_say_calm_down	discard	swap_ownership_language_for_never_say_calm_down
1929	5.337	the_feel_felt_found+ownership_language+strategic_agreement	discard	add_strategic_agreement
1930	4.800	the_feel_felt_found+ownership_language	discard	tone_change
1931	5.013	the_feel_felt_found+ownership_language	discard	tone_change
1932	5.112	the_feel_felt_found+ownership_language	discard	tone_change
1933	5.650	the_feel_felt_found+ownership_language	discard	tone_change
1934	5.550	the_feel_felt_found+ownership_language	discard	temp_0.90
1935	5.325	the_feel_felt_found+ownership_language+emotional_labeling	discard	add_emotional_labeling
1936	5.138	the_feel_felt_found+ownership_language+energy_matching	discard	add_energy_matching
1937	4.925	the_feel_felt_found+ownership_language+proactive_extras	discard	add_proactive_extras
1938	5.325	the_feel_felt_found	discard	remove_ownership_language
1939	5.450	the_feel_felt_found+warmth_injection	discard	swap_ownership_language_for_warmth_injection
1940	5.450	the_feel_felt_found+ownership_language+warmth_injection	discard	add_warmth_injection
1941	5.550	the_feel_felt_found+ownership_language	discard	temp_0.70
1942	5.350	the_feel_felt_found+ownership_language	discard	crossover
1943	5.550	the_feel_felt_found+ownership_language	discard	temp_0.95
1944	5.238	the_feel_felt_found+ownership_language	discard	tone_change
1945	5.450	the_feel_felt_found+ownership_language+energy_matching	discard	add_energy_matching
1946	5.013	the_feel_felt_found+ownership_language	discard	tone_change
1947	5.125	the_feel_felt_found+ownership_language	discard	temp_0.95
1948	5.200	the_feel_felt_found	discard	crossover
1949	5.137	the_feel_felt_found+ownership_language+strategic_agreement	discard	add_strategic_agreement
1950	5.450	the_feel_felt_found+ownership_language+emotional_labeling	discard	add_emotional_labeling
1951	4.825	ownership_language	discard	remove_the_feel_felt_found
1952	5.550	the_feel_felt_found+proactive_extras	discard	swap_ownership_language_for_proactive_extras
1953	5.113	ownership_language	discard	crossover
1954	5.438	the_feel_felt_found+ownership_language+emotional_labeling	discard	add_emotional_labeling
1955	5.525	the_feel_felt_found+ownership_language	discard	temp_0.75
1956	4.513	the_feel_felt_found	discard	crossover
1957	5.112	the_feel_felt_found+ownership_language	discard	tone_change
1958	5.237	the_feel_felt_found+ownership_language+casual_professionalism	discard	add_casual_professionalism
1959	5.450	the_feel_felt_found+ownership_language+never_say_calm_down	discard	add_never_say_calm_down
1960	5.025	the_feel_felt_found+ownership_language	discard	tone_change
1961	5.038	the_feel_felt_found+ownership_language+energy_matching	discard	add_energy_matching
1962	5.125	ownership_language	discard	remove_the_feel_felt_found
1963	4.600	the_feel_felt_found+ownership_language+personal_touch	discard	add_personal_touch
1964	4.825	ownership_language	discard	remove_the_feel_felt_found
1965	5.450	the_feel_felt_found+ownership_language+strategic_agreement	discard	add_strategic_agreement
1966	4.925	the_feel_felt_found+ownership_language	discard	crossover
1967	5.550	the_feel_felt_found+ownership_language	discard	tone_change
1968	4.912	the_feel_felt_found+ownership_language+casual_professionalism	discard	add_casual_professionalism
1969	5.450	the_feel_felt_found+ownership_language	discard	tone_change
1970	5.013	the_feel_felt_found	discard	remove_ownership_language
1971	4.725	the_feel_felt_found	discard	crossover
1972	5.450	the_feel_felt_found+ownership_language+strategic_agreement	discard	add_strategic_agreement
1973	5.450	ownership_language+personal_touch	discard	swap_the_feel_felt_found_for_personal_touch
1974	4.925	the_feel_felt_found+ownership_language	discard	temp_0.65
1975	5.013	the_feel_felt_found+ownership_language	discard	tone_change
1976	4.713	the_feel_felt_found+ownership_language+never_say_calm_down	discard	add_never_say_calm_down
