generation	eq_score	techniques	status	description
13019	5.425	the_feel_felt_found+ownership_language+emotional_labeling	discard	add_emotional_labeling
13020	4.925	the_feel_felt_found+ownership_language+casual_professionalism	discard	add_casual_professionalism
13021	5.138	the_feel_felt_found+ownership_language	discard	crossover
13022	5.113	the_feel_felt_found+ownership_language	discard	tone_change
13023	5.300	the_feel_felt_found+ownership_language+casual_professionalism	discard	add_casual_professionalism
13024	5.650	the_feel_felt_found+ownership_language	discard	temp_0.65
13025	5.013	the_feel_felt_found+ownership_language+strategic_agreement	discard	add_strategic_agreement
13026	5.013	ownership_language	discard	crossover
13027	5.137	the_feel_felt_found+ownership_language	discard	crossover
13028	5.450	the_feel_felt_found+ownership_language+warmth_injection	discard	add_warmth_injection
13029	5.425	the_feel_felt_found	discard	remove_ownership_language
13030	4.975	the_feel_felt_found	discard	remove_ownership_language
13031	5.237	the_feel_felt_found+ownership_language	discard	temp_0.85
13032	5.138	the_feel_felt_found+ownership_language	discard	crossover
13033	5.425	the_feel_felt_found+ownership_language	discard	crossover
13034	5.300	the_feel_felt_found	discard	crossover
13035	4.888	the_feel_felt_found+ownership_language	discard	crossover
13036	5.200	the_feel_felt_found+ownership_language+strategic_agreement	discard	add_strategic_agreement
13037	5.325	ownership_language+emotional_labeling	discard	swap_the_feel_felt_found_for_emotional_labeling
13038	5.425	ownership_language	discard	crossover
13039	5.325	the_feel_felt_found+ownership_language	discard	crossover
13040	5.450	the_feel_felt_found+ownership_language+concrete_next_steps	discard	add_concrete_next_steps
13041	5.450	the_feel_felt_found	discard	crossover
13042	4.988	the_feel_felt_found+ownership_language	discard	tone_change
13043	4.825	the_feel_felt_found+ownership_language	discard	tone_change
13044	5.200	the_feel_felt_found+ownership_language+personal_touch	discard	add_personal_touch
13045	4.888	the_feel_felt_found+ownership_language+validation_before_solution	discard	add_validation_before_solution
13046	5.325	ownership_language	discard	remove_the_feel_felt_found
13047	5.450	ownership_language	discard	crossover
13048	5.238	ownership_language+genuine_admission	discard	swap_the_feel_felt_found_for_genuine_admission
13049	5.450	the_feel_felt_found+ownership_language	discard	tone_change
13050	5.200	ownership_language	discard	remove_the_feel_felt_found
13051	5.325	the_feel_felt_found+personal_touch	discard	swap_ownership_language_for_personal_touch
13052	5.550	the_feel_felt_found+ownership_language	discard	tone_change
13053	5.200	the_feel_felt_found+ownership_language	discard	temp_0.65
13054	5.325	the_feel_felt_found+energy_matching	discard	swap_ownership_language_for_energy_matching
13055	5.325	the_feel_felt_found+ownership_language+concrete_next_steps	discard	add_concrete_next_steps
13056	5.113	the_feel_felt_found+ownership_language	discard	tone_change
13057	5.138	the_feel_felt_found+emotional_labeling	discard	swap_ownership_language_for_emotional_labeling
13058	4.825	ownership_language	discard	remove_the_feel_felt_found
13059	5.550	the_feel_felt_found+ownership_language+validation_before_solution	discard	add_validation_before_solution
13060	5.650	the_feel_felt_found+ownership_language	discard	temp_0.90
13061	4.513	the_feel_felt_found+ownership_language	discard	tone_change
13062	5.450	the_feel_felt_found	discard	crossover
13063	5.337	ownership_language	discard	remove_the_feel_felt_found
13064	5.237	the_feel_felt_found+ownership_language	discard	temp_0.90
13065	5.237	ownership_language+validation_before_solution	discard	swap_the_feel_felt_found_for_validation_before_solution
13066	5.325	the_feel_felt_found+ownership_language	discard	tone_change
13067	5.325	the_feel_felt_found+ownership_language+emotional_labeling	discard	add_emotional_labeling
13068	4.825	the_feel_felt_found+ownership_language	discard	tone_change
13069	5.425	the_feel_felt_found+ownership_language	discard	tone_change
13070	5.112	the_feel_felt_found+ownership_language	discard	tone_change
13071	5.450	the_feel_felt_found+ownership_language+warmth_injection	discard	add_warmth_injection
13072	5.325	the_feel_felt_found+ownership_language+concrete_next_steps	discard	add_concrete_next_steps
13073	4.825	ownership_language	discard	crossover
13074	5.013	the_feel_felt_found	discard	remove_ownership_language
13075	5.450	the_feel_felt_found+ownership_language	discard	temp_0.70
13076	5.237	the_feel_felt_found+ownership_language	discard	tone_change
13077	5.112	the_feel_felt_found+ownership_language+strategic_agreement	discard	add_strategic_agreement
13078	4.825	the_feel_felt_found+ownership_language	discard	crossover
13079	5.450	the_feel_felt_found+emotional_labeling	discard	swap_ownership_language_for_emotional_labeling
13080	5.025	the_feel_felt_found+ownership_language	discard	temp_0.90
13081	5.100	the_feel_felt_found+ownership_language	discard	temp_0.95
13082	5.237	the_feel_felt_found+ownership_language	discard	tone_change
13083	5.013	the_feel_felt_found+ownership_language	discard	tone_change
13084	5.425	the_feel_felt_found+ownership_language	discard	tone_change
13085	5.138	the_feel_felt_found+ownership_language+genuine_admission	discard	add_genuine_admission
13086	5.450	the_feel_felt_found+ownership_language	discard	temp_0.65
13087	5.138	the_feel_felt_found+ownership_language	discard	temp_0.75
13088	5.325	the_feel_felt_found+ownership_language	discard	tone_change
13089	4.700	the_feel_felt_found	discard	remove_ownership_language
13090	5.013	the_feel_felt_found+ownership_language	discard	tone_change
13091	5.137	the_feel_felt_found+emotional_labeling	discard	swap_ownership_language_for_emotional_labeling
13092	5.525	the_feel_felt_found+ownership_language	discard	crossover
13093	5.013	the_feel_felt_found+validation_before_solution	discard	swap_ownership_language_for_validation_before_solution
13094	5.325	the_feel_felt_found	discard	remove_ownership_language
13095	5.013	the_feel_felt_found+ownership_language+never_say_calm_down	discard	add_never_say_calm_down
13096	5.550	the_feel_felt_found	discard	crossover
13097	5.350	the_feel_felt_found+ownership_language	discard	temp_0.85
13098	5.138	the_feel_felt_found+ownership_language+personal_touch	discard	add_personal_touch
13099	4.925	the_feel_felt_found+ownership_language+mirroring	discard	add_mirroring
13100	5.112	the_feel_felt_found+ownership_language+strategic_agreement	discard	add_strategic_agreement
13101	5.013	the_feel_felt_found+ownership_language	discard	temp_0.95
13102	5.550	the_feel_felt_found+ownership_language+personal_touch	discard	add_personal_touch
13103	5.450	the_feel_felt_found+ownership_language	discard	crossover
13104	5.138	the_feel_felt_found+ownership_language+energy_matching	discard	add_energy_matching
13105	4.987	the_feel_felt_found+ownership_language+warmth_injection	discard	add_warmth_injection
13106	5.238	the_feel_felt_found+ownership_language	discard	temp_0.95
13107	4.800	the_feel_felt_found+ownership_language	discard	tone_change
13108	5.013	the_feel_felt_found+ownership_language	discard	temp_0.95
13109	5.025	the_feel_felt_found+ownership_language	discard	tone_change
13110	5.237	the_feel_felt_found+ownership_language	discard	tone_change
13111	4.888	the_feel_felt_found+ownership_language	discard	crossover
13112	5.425	the_feel_felt_found+strategic_agreement	discard	swap_ownership_language_for_strategic_agreement
13113	5.325	the_feel_felt_found+ownership_language	discard	tone_change
13114	4.825	ownership_language	discard	crossover
13115	5.012	ownership_language+concrete_next_steps	discard	swap_the_feel_felt_found_for_concrete_next_steps
13116	4.925	the_feel_felt_found+ownership_language+genuine_admission	discard	add_genuine_admission
13117	5.450	the_feel_felt_found+ownership_language+warmth_injection	discard	add_warmth_injection
13118	4.513	the_feel_felt_found+ownership_language	discard	temp_0.70
13119	5.138	the_feel_felt_found+ownership_language	discard	crossover
13120	5.550	the_feel_felt_found+ownership_language	discard	temp_0.65
13121	5.012	ownership_language	discard	remove_the_feel_felt_found
13122	4.700	the_feel_felt_found+ownership_language	discard	temp_0.75
13123	5.350	the_feel_felt_found+ownership_language+validation_before_solution	discard	add_validation_before_solution
13124	5.238	the_feel_felt_found+ownership_language	discard	tone_change
13125	5.325	the_feel_felt_found+ownership_language	discard	temp_0.75
13126	4.825	ownership_language+concrete_next_steps	discard	swap_the_feel_felt_found_for_concrete_next_steps
13127	5.138	the_feel_felt_found+ownership_language	discard	temp_0.75
13128	5.550	the_feel_felt_found+ownership_language	discard	tone_change
13129	5.325	the_feel_felt_found	discard	crossover
13130	4.925	ownership_language+personal_touch	discard	swap_the_feel_felt_found_for_personal_touch
13131	5.013	the_feel_felt_found	discard	remove_ownership_language
13132	5.550	the_feel_felt_found+ownership_language	discard	temp_0.70
13133	5.425	the_feel_felt_found+ownership_language+emotional_labeling	discard	add_emotional_labeling
13134	5.325	the_feel_felt_found+concrete_next_steps	discard	swap_ownership_language_for_concrete_next_steps
13135	5.550	the_feel_felt_found+energy_matching	discard	swap_ownership_language_for_energy_matching
13136	5.425	the_feel_felt_found+emotional_labeling	discard	swap_ownership_language_for_emotional_labeling
13137	5.325	the_feel_felt_found+ownership_language	discard	tone_change
13138	5.550	the_feel_felt_found+ownership_language+warmth_injection	discard	add_warmth_injection
13139	5.238	the_feel_felt_found+ownership_language	discard	tone_change
13140	5.550	the_feel_felt_found+ownership_language	discard	tone_change
13141	5.237	the_feel_felt_found+ownership_language	discard	temp_0.70
13142	5.238	the_feel_felt_found+ownership_language	discard	crossover
13143	5.550	the_feel_felt_found+ownership_language	discard	tone_change
13144	5.238	the_feel_felt_found+ownership_language+genuine_admission	discard	add_genuine_admission
13145	5.450	the_feel_felt_found+ownership_language	discard	temp_0.95
13146	5.138	ownership_language+never_say_calm_down	discard	swap_the_feel_felt_found_for_never_say_calm_down
13147	5.037	the_feel_felt_found	discard	remove_ownership_language
13148	5.450	the_feel_felt_found+ownership_language	discard	tone_change
13149	5.013	the_feel_felt_found+ownership_language+proactive_extras	discard	add_proactive_extras
13150	5.238	the_feel_felt_found+casual_professionalism	discard	swap_ownership_language_for_casual_professionalism
13151	5.013	the_feel_felt_found+ownership_language	discard	tone_change
13152	4.800	the_feel_felt_found	discard	crossover
13153	5.450	ownership_language	discard	crossover
13154	5.425	ownership_language	discard	remove_the_feel_felt_found
13155	5.112	ownership_language	discard	crossover
13156	5.325	ownership_language+never_say_calm_down	discard	swap_the_feel_felt_found_for_never_say_calm_down
13157	5.250	the_feel_felt_found+ownership_language+strategic_agreement	discard	add_strategic_agreement
13158	4.675	the_feel_felt_found+ownership_language	discard	crossover
13159	5.338	the_feel_felt_found+ownership_language	discard	tone_change
13160	5.237	the_feel_felt_found+ownership_language	discard	temp_0.95
13161	5.200	ownership_language	discard	crossover
13162	5.425	the_feel_felt_found+ownership_language	discard	tone_change
13163	5.325	the_feel_felt_found+casual_professionalism	discard	swap_ownership_language_for_casual_professionalism
13164	5.425	the_feel_felt_found	discard	remove_ownership_language
13165	5.325	ownership_language	discard	remove_the_feel_felt_found
13166	5.650	the_feel_felt_found+ownership_language+concrete_next_steps	discard	add_concrete_next_steps
13167	5.325	the_feel_felt_found+personal_touch	discard	swap_ownership_language_for_personal_touch
13168	5.425	the_feel_felt_found+genuine_admission	discard	swap_ownership_language_for_genuine_admission
13169	5.325	the_feel_felt_found+ownership_language	discard	tone_change
13170	5.325	the_feel_felt_found+ownership_language+warmth_injection	discard	add_warmth_injection
13171	4.925	ownership_language+energy_matching	discard	swap_the_feel_felt_found_for_energy_matching
13172	5.138	the_feel_felt_found+ownership_language	discard	tone_change
13173	5.525	ownership_language	discard	crossover
13174	5.237	the_feel_felt_found+casual_professionalism	discard	swap_ownership_language_for_casual_professionalism
13175	5.325	ownership_language	discard	remove_the_feel_felt_found
13176	5.550	ownership_language+genuine_admission	discard	swap_the_feel_felt_found_for_genuine_admission
13177	5.238	the_feel_felt_found+ownership_language	discard	tone_change
13178	5.425	the_feel_felt_found+ownership_language+genuine_admission	discard	add_genuine_admission
13179	5.325	the_feel_felt_found+ownership_language	discard	crossover
13180	5.238	the_feel_felt_found+warmth_injection	discard	swap_ownership_language_for_warmth_injection
13181	5.113	the_feel_felt_found+ownership_language+emotional_labeling	discard	add_emotional_labeling
13182	5.350	ownership_language	discard	remove_the_feel_felt_found
13183	5.650	the_feel_felt_found+ownership_language	discard	temp_0.85
13184	4.725	the_feel_felt_found+ownership_language	discard	tone_change
13185	5.450	the_feel_felt_found+ownership_language+warmth_injection	discard	add_warmth_injection
13186	5.325	the_feel_felt_found	discard	crossover
13187	5.112	the_feel_felt_found	discard	crossover
13188	5.450	the_feel_felt_found+ownership_language	discard	tone_change
13189	5.550	the_feel_felt_found+ownership_language	discard	crossover
13190	5.325	none	discard	crossover
13191	5.325	the_feel_felt_found+ownership_language+mirroring	discard	add_mirroring
13192	4.825	the_feel_felt_found+ownership_language+concrete_next_steps	discard	add_concrete_next_steps
13193	5.025	ownership_language	discard	crossover
13194	5.037	the_feel_felt_found+ownership_language	discard	tone_change
13195	5.225	the_feel_felt_found+ownership_language	discard	tone_change
13196	5.550	the_feel_felt_found+ownership_language	discard	crossover
13197	5.450	the_feel_felt_found+ownership_language+casual_professionalism	discard	add_casual_professionalism
13198	5.325	the_feel_felt_found+ownership_language	discard	tone_change
13199	5.213	the_feel_felt_found+validation_before_solution	discard	swap_ownership_language_for_validation_before_solution
13200	5.550	the_feel_felt_found+ownership_language+emotional_labeling	discard	add_emotional_labeling
13201	5.300	the_feel_felt_found+ownership_language	discard	tone_change
13202	5.338	the_feel_felt_found+ownership_language+proactive_extras	discard	add_proactive_extras
13203	5.450	the_feel_felt_found+ownership_language+validation_before_solution	discard	add_validation_before_solution
13204	5.200	the_feel_felt_found+ownership_language	discard	crossover
13205	5.138	the_feel_felt_found+ownership_language+never_say_calm_down	discard	add_never_say_calm_down
13206	5.137	ownership_language	discard	crossover
13207	5.550	ownership_language+validation_before_solution	discard	swap_the_feel_felt_found_for_validation_before_solution
13208	5.550	the_feel_felt_found+ownership_language	discard	tone_change
13209	5.138	the_feel_felt_found	discard	remove_ownership_language
13210	5.138	the_feel_felt_found+ownership_language	discard	temp_0.95
13211	5.325	ownership_language+genuine_admission	discard	swap_the_feel_felt_found_for_genuine_admission
13212	5.138	the_feel_felt_found+ownership_language+personal_touch	discard	add_personal_touch
13213	5.325	none	discard	crossover
13214	5.550	the_feel_felt_found+ownership_language+genuine_admission	discard	add_genuine_admission
13215	4.713	the_feel_felt_found	discard	crossover
13216	5.325	the_feel_felt_found+ownership_language	discard	crossover
13217	5.338	the_feel_felt_found+ownership_language	discard	temp_0.65
13218	5.137	ownership_language+casual_professionalism	discard	swap_the_feel_felt_found_for_casual_professionalism
13219	5.237	the_feel_felt_found+ownership_language	discard	temp_0.95
13220	5.013	the_feel_felt_found+emotional_labeling	discard	swap_ownership_language_for_emotional_labeling
13221	5.013	ownership_language+energy_matching	discard	swap_the_feel_felt_found_for_energy_matching
13222	5.138	the_feel_felt_found+ownership_language	discard	tone_change
13223	4.925	the_feel_felt_found+ownership_language	discard	tone_change
13224	5.137	the_feel_felt_found+ownership_language	discard	temp_0.85
13225	5.650	the_feel_felt_found+ownership_language	discard	tone_change
13226	5.138	the_feel_felt_found+ownership_language	discard	tone_change
13227	5.450	the_feel_felt_found+validation_before_solution	discard	swap_ownership_language_for_validation_before_solution
13228	5.250	none	discard	crossover
13229	4.700	the_feel_felt_found+ownership_language	discard	tone_change
13230	5.337	the_feel_felt_found+ownership_language+casual_professionalism	discard	add_casual_professionalism
13231	5.200	the_feel_felt_found+ownership_language	discard	temp_0.85
13232	4.700	ownership_language	discard	remove_the_feel_felt_found
13233	5.213	the_feel_felt_found+ownership_language	discard	tone_change
13234	5.138	the_feel_felt_found+ownership_language	discard	tone_change
13235	5.200	the_feel_felt_found+ownership_language	discard	crossover
13236	4.888	none	discard	crossover
13237	5.325	the_feel_felt_found+ownership_language	discard	tone_change
13238	5.425	the_feel_felt_found+ownership_language	discard	tone_change
13239	5.550	ownership_language	discard	remove_the_feel_felt_found
13240	5.238	ownership_language+validation_before_solution	discard	swap_the_feel_felt_found_for_validation_before_solution
13241	5.550	ownership_language+emotional_labeling	discard	swap_the_feel_felt_found_for_emotional_labeling
13242	5.237	the_feel_felt_found+ownership_language	discard	tone_change
13243	5.138	the_feel_felt_found+ownership_language	discard	tone_change
13244	5.450	the_feel_felt_found+ownership_language	discard	tone_change
13245	5.450	the_feel_felt_found+ownership_language+genuine_admission	discard	add_genuine_admission
13246	5.237	ownership_language+proactive_extras	discard	swap_the_feel_felt_found_for_proactive_extras
13247	5.037	the_feel_felt_found+ownership_language+never_say_calm_down	discard	add_never_say_calm_down
13248	5.138	the_feel_felt_found+ownership_language+warmth_injection	discard	add_warmth_injection
13249	5.325	the_feel_felt_found+ownership_language+concrete_next_steps	discard	add_concrete_next_steps
13250	5.650	the_feel_felt_found	discard	crossover
13251	5.325	the_feel_felt_found+ownership_language+warmth_injection	discard	add_warmth_injection
13252	5.237	the_feel_felt_found+ownership_language	discard	crossover
13253	4.925	the_feel_felt_found+ownership_language	discard	tone_change
13254	5.325	the_feel_felt_found+ownership_language+never_say_calm_down	discard	add_never_say_calm_down
13255	5.350	the_feel_felt_found+genuine_admission	discard	swap_ownership_language_for_genuine_admission
13256	5.550	the_feel_felt_found+ownership_language	discard	tone_change
13257	5.450	ownership_language	discard	remove_the_feel_felt_found
13258	5.237	ownership_language+casual_professionalism	discard	swap_the_feel_felt_found_for_casual_professionalism
13259	5.450	the_feel_felt_found+personal_touch	discard	swap_ownership_language_for_personal_touch
13260	5.113	the_feel_felt_found+ownership_language+validation_before_solution	discard	add_validation_before_solution
13261	5.237	the_feel_felt_found+ownership_language+mirroring	discard	add_mirroring
13262	5.450	the_feel_felt_found+ownership_language	discard	tone_change
13263	5.550	the_feel_felt_found+ownership_language	discard	crossover
13264	5.138	the_feel_felt_found+ownership_language	discard	tone_change
13265	5.237	the_feel_felt_found+ownership_language	discard	tone_change
13266	5.350	the_feel_felt_found+ownership_language	discard	crossover
13267	5.325	the_feel_felt_found+ownership_language	discard	temp_0.75
13268	5.112	the_feel_felt_found+ownership_language	discard	crossover
13269	4.925	the_feel_felt_found+ownership_language+casual_professionalism	discard	add_casual_professionalism
13270	5.450	the_feel_felt_found+ownership_language	discard	tone_change
13271	5.213	ownership_language	discard	crossover
13272	5.325	the_feel_felt_found+ownership_language	discard	crossover
13273	5.038	the_feel_felt_found+ownership_language+energy_matching	discard	add_energy_matching
13274	5.138	the_feel_felt_found+ownership_language	discard	temp_0.95
13275	5.325	the_feel_felt_found+ownership_language	discard	temp_0.75
13276	5.138	the_feel_felt_found+ownership_language+genuine_admission	discard	add_genuine_admission
13277	4.575	the_feel_felt_found+ownership_language+warmth_injection	discard	add_warmth_injection
13278	5.450	the_feel_felt_found+ownership_language	discard	crossover
13279	5.450	the_feel_felt_found+ownership_language+genuine_admission	discard	add_genuine_admission
13280	5.350	the_feel_felt_found	discard	crossover
13281	5.550	the_feel_felt_found	discard	remove_ownership_language
13282	5.200	the_feel_felt_found+ownership_language+warmth_injection	discard	add_warmth_injection
13283	5.300	the_feel_felt_found+ownership_language	discard	temp_0.70
13284	5.200	the_feel_felt_found+ownership_language+never_say_calm_down	discard	add_never_say_calm_down
13285	5.450	the_feel_felt_found+ownership_language+casual_professionalism	discard	add_casual_professionalism
13286	5.237	the_feel_felt_found+ownership_language+concrete_next_steps	discard	add_concrete_next_steps
13287	4.925	ownership_language	discard	crossover
13288	5.138	the_feel_felt_found+ownership_language	discard	tone_change
13289	5.450	the_feel_felt_found+ownership_language	discard	tone_change
13290	5.325	the_feel_felt_found+ownership_language	discard	tone_change
13291	5.237	the_feel_felt_found+ownership_language	discard	temp_0.90
13292	5.238	the_feel_felt_found+strategic_agreement	discard	swap_ownership_language_for_strategic_agreement
