generation	eq_score	techniques	status	description
14111	5.213	the_feel_felt_found+ownership_language	discard	temp_0.65
14112	5.087	the_feel_felt_found+concrete_next_steps	discard	swap_ownership_language_for_concrete_next_steps
14113	5.238	the_feel_felt_found+ownership_language	discard	tone_change
14114	5.350	the_feel_felt_found+ownership_language	discard	crossover
14115	5.325	the_feel_felt_found+ownership_language+concrete_next_steps	discard	add_concrete_next_steps
14116	5.025	the_feel_felt_found+ownership_language+proactive_extras	discard	add_proactive_extras
14117	5.112	the_feel_felt_found+ownership_language+casual_professionalism	discard	add_casual_professionalism
14118	4.925	the_feel_felt_found+ownership_language+strategic_agreement	discard	add_strategic_agreement
14119	5.550	the_feel_felt_found+proactive_extras	discard	swap_ownership_language_for_proactive_extras
14120	4.925	the_feel_felt_found+ownership_language+genuine_admission	discard	add_genuine_admission
14121	5.138	the_feel_felt_found+ownership_language+proactive_extras	discard	add_proactive_extras
14122	4.725	ownership_language	discard	crossover
14123	5.450	the_feel_felt_found+ownership_language	discard	tone_change
14124	5.325	the_feel_felt_found+ownership_language	discard	crossover
14125	5.237	the_feel_felt_found+strategic_agreement	discard	swap_ownership_language_for_strategic_agreement
14126	5.138	none	discard	crossover
14127	5.138	the_feel_felt_found+ownership_language	discard	tone_change
14128	5.450	the_feel_felt_found+ownership_language	discard	temp_0.65
14129	4.825	the_feel_felt_found+ownership_language	discard	tone_change
14130	5.450	the_feel_felt_found+ownership_language+warmth_injection	discard	add_warmth_injection
14131	5.038	the_feel_felt_found+ownership_language	discard	temp_0.65
14132	5.450	the_feel_felt_found+ownership_language+mirroring	discard	add_mirroring
14133	5.750	the_feel_felt_found+ownership_language+energy_matching	discard	add_energy_matching
14134	5.237	the_feel_felt_found+strategic_agreement	discard	swap_ownership_language_for_strategic_agreement
14135	5.237	the_feel_felt_found+ownership_language	discard	tone_change
14136	5.350	the_feel_felt_found+energy_matching	discard	swap_ownership_language_for_energy_matching
14137	4.825	ownership_language+personal_touch	discard	swap_the_feel_felt_found_for_personal_touch
14138	5.550	the_feel_felt_found+ownership_language+proactive_extras	discard	add_proactive_extras
14139	5.550	the_feel_felt_found+ownership_language+strategic_agreement	discard	add_strategic_agreement
14140	5.450	the_feel_felt_found+ownership_language+casual_professionalism	discard	add_casual_professionalism
14141	4.825	the_feel_felt_found+ownership_language+strategic_agreement	discard	add_strategic_agreement
14142	5.112	the_feel_felt_found+ownership_language+personal_touch	discard	add_personal_touch
14143	5.312	the_feel_felt_found+ownership_language	discard	tone_change
14144	5.450	the_feel_felt_found+ownership_language+concrete_next_steps	discard	add_concrete_next_steps
14145	5.138	ownership_language+proactive_extras	discard	swap_the_feel_felt_found_for_proactive_extras
14146	4.700	the_feel_felt_found+ownership_language	discard	temp_0.90
14147	4.825	ownership_language+strategic_agreement	discard	swap_the_feel_felt_found_for_strategic_agreement
14148	5.550	the_feel_felt_found+ownership_language	discard	temp_0.95
14149	5.138	ownership_language	discard	remove_the_feel_felt_found
14150	4.800	the_feel_felt_found+ownership_language	discard	tone_change
14151	5.350	the_feel_felt_found+ownership_language	discard	crossover
14152	5.425	ownership_language	discard	remove_the_feel_felt_found
14153	5.350	the_feel_felt_found+ownership_language	discard	tone_change
14154	5.450	the_feel_felt_found+ownership_language	discard	tone_change
14155	5.325	the_feel_felt_found+ownership_language+validation_before_solution	discard	add_validation_before_solution
14156	4.925	the_feel_felt_found+mirroring	discard	swap_ownership_language_for_mirroring
14157	5.225	the_feel_felt_found	discard	crossover
14158	5.113	the_feel_felt_found+strategic_agreement	discard	swap_ownership_language_for_strategic_agreement
14159	4.925	the_feel_felt_found+ownership_language	discard	tone_change
14160	5.237	the_feel_felt_found+ownership_language	discard	temp_0.90
14161	5.350	the_feel_felt_found+ownership_language+strategic_agreement	discard	add_strategic_agreement
14162	5.425	ownership_language+genuine_admission	discard	swap_the_feel_felt_found_for_genuine_admission
14163	5.013	the_feel_felt_found+proactive_extras	discard	swap_ownership_language_for_proactive_extras
14164	5.238	the_feel_felt_found+ownership_language+casual_professionalism	discard	add_casual_professionalism
14165	4.800	the_feel_felt_found+proactive_extras	discard	swap_ownership_language_for_proactive_extras
14166	5.450	the_feel_felt_found+ownership_language	discard	crossover
14167	5.300	ownership_language	discard	crossover
14168	5.237	the_feel_felt_found+ownership_language	discard	tone_change
14169	5.237	the_feel_felt_found+ownership_language	discard	crossover
14170	5.450	the_feel_felt_found+ownership_language+validation_before_solution	discard	add_validation_before_solution
14171	5.337	ownership_language	discard	remove_the_feel_felt_found
14172	5.350	the_feel_felt_found	discard	remove_ownership_language
14173	5.300	the_feel_felt_found+ownership_language	discard	tone_change
14174	5.037	the_feel_felt_found+ownership_language	discard	tone_change
14175	5.450	ownership_language+emotional_labeling	discard	swap_the_feel_felt_found_for_emotional_labeling
14176	4.700	the_feel_felt_found+ownership_language	discard	crossover
14177	5.138	the_feel_felt_found+emotional_labeling	discard	swap_ownership_language_for_emotional_labeling
14178	5.213	the_feel_felt_found+ownership_language	discard	tone_change
14179	4.888	the_feel_felt_found+ownership_language	discard	temp_0.65
14180	5.013	the_feel_felt_found+ownership_language	discard	temp_0.70
14181	5.138	the_feel_felt_found+ownership_language	discard	temp_0.85
14182	5.300	the_feel_felt_found+ownership_language	discard	tone_change
14183	5.013	the_feel_felt_found+ownership_language	discard	temp_0.65
14184	5.550	the_feel_felt_found+ownership_language+concrete_next_steps	discard	add_concrete_next_steps
14185	5.037	the_feel_felt_found+ownership_language	discard	crossover
14186	5.438	the_feel_felt_found+ownership_language	discard	temp_0.90
14187	5.025	the_feel_felt_found+ownership_language+emotional_labeling	discard	add_emotional_labeling
14188	5.237	the_feel_felt_found	discard	remove_ownership_language
14189	5.325	the_feel_felt_found+ownership_language	discard	tone_change
14190	5.325	the_feel_felt_found	discard	remove_ownership_language
14191	5.237	the_feel_felt_found+ownership_language+warmth_injection	discard	add_warmth_injection
14192	5.200	the_feel_felt_found+ownership_language+casual_professionalism	discard	add_casual_professionalism
14193	4.700	the_feel_felt_found+ownership_language	discard	tone_change
14194	5.013	the_feel_felt_found+ownership_language+never_say_calm_down	discard	add_never_say_calm_down
14195	4.825	the_feel_felt_found+ownership_language+casual_professionalism	discard	add_casual_professionalism
14196	5.525	the_feel_felt_found+ownership_language+validation_before_solution	discard	add_validation_before_solution
14197	5.550	the_feel_felt_found+ownership_language+energy_matching	discard	add_energy_matching
14198	5.550	the_feel_felt_found+ownership_language	discard	tone_change
14199	4.938	the_feel_felt_found+ownership_language	discard	temp_0.85
14200	5.025	the_feel_felt_found+ownership_language+personal_touch	discard	add_personal_touch
14201	5.450	the_feel_felt_found+personal_touch	discard	swap_ownership_language_for_personal_touch
14202	5.325	the_feel_felt_found+ownership_language+casual_professionalism	discard	add_casual_professionalism
14203	5.350	the_feel_felt_found+ownership_language	discard	crossover
14204	5.013	the_feel_felt_found+ownership_language+emotional_labeling	discard	add_emotional_labeling
14205	5.450	the_feel_felt_found+ownership_language	discard	tone_change
14206	5.525	the_feel_felt_found+ownership_language+energy_matching	discard	add_energy_matching
14207	5.425	the_feel_felt_found+ownership_language	discard	temp_0.90
14208	5.550	the_feel_felt_found+ownership_language	discard	crossover
14209	5.237	the_feel_felt_found+ownership_language+mirroring	discard	add_mirroring
14210	5.550	the_feel_felt_found	discard	crossover
14211	5.550	the_feel_felt_found+ownership_language	discard	temp_0.90
14212	5.525	the_feel_felt_found+ownership_language	discard	tone_change
14213	5.225	the_feel_felt_found+ownership_language	discard	temp_0.65
14214	5.138	the_feel_felt_found	discard	remove_ownership_language
14215	4.900	the_feel_felt_found+energy_matching	discard	swap_ownership_language_for_energy_matching
14216	5.138	the_feel_felt_found+ownership_language	discard	temp_0.70
14217	4.825	the_feel_felt_found+ownership_language+warmth_injection	discard	add_warmth_injection
14218	4.925	the_feel_felt_found+ownership_language	discard	crossover
14219	5.325	the_feel_felt_found+ownership_language	discard	tone_change
14220	5.238	the_feel_felt_found+ownership_language	discard	temp_0.65
14221	5.225	the_feel_felt_found+ownership_language	discard	tone_change
14222	4.800	the_feel_felt_found+ownership_language	discard	temp_0.85
14223	4.900	the_feel_felt_found	discard	crossover
14224	5.225	the_feel_felt_found+ownership_language	discard	crossover
14225	5.037	ownership_language	discard	crossover
14226	5.037	the_feel_felt_found+warmth_injection	discard	swap_ownership_language_for_warmth_injection
14227	5.450	the_feel_felt_found+warmth_injection	discard	swap_ownership_language_for_warmth_injection
14228	5.113	the_feel_felt_found+ownership_language+never_say_calm_down	discard	add_never_say_calm_down
14229	5.138	the_feel_felt_found+ownership_language	discard	tone_change
14230	5.550	the_feel_felt_found+ownership_language	discard	temp_0.75
14231	5.113	the_feel_felt_found+ownership_language	discard	tone_change
14232	5.025	the_feel_felt_found+ownership_language	discard	crossover
14233	5.238	ownership_language	discard	crossover
14234	5.325	the_feel_felt_found+ownership_language+personal_touch	discard	add_personal_touch
14235	5.138	the_feel_felt_found+ownership_language	discard	temp_0.85
14236	5.338	the_feel_felt_found+ownership_language+proactive_extras	discard	add_proactive_extras
14237	5.013	the_feel_felt_found+ownership_language+never_say_calm_down	discard	add_never_say_calm_down
14238	5.650	the_feel_felt_found+ownership_language+strategic_agreement	discard	add_strategic_agreement
14239	5.237	the_feel_felt_found+ownership_language	discard	crossover
14240	5.075	the_feel_felt_found+ownership_language	discard	tone_change
14241	5.200	the_feel_felt_found	discard	remove_ownership_language
14242	5.450	the_feel_felt_found+ownership_language+emotional_labeling	discard	add_emotional_labeling
14243	4.825	the_feel_felt_found+warmth_injection	discard	swap_ownership_language_for_warmth_injection
14244	5.237	the_feel_felt_found+ownership_language+personal_touch	discard	add_personal_touch
14245	5.225	the_feel_felt_found+ownership_language+strategic_agreement	discard	add_strategic_agreement
14246	5.137	the_feel_felt_found+ownership_language	discard	temp_0.75
14247	5.237	ownership_language	discard	crossover
14248	5.550	the_feel_felt_found+emotional_labeling	discard	swap_ownership_language_for_emotional_labeling
14249	5.550	the_feel_felt_found+ownership_language+never_say_calm_down	discard	add_never_say_calm_down
14250	4.825	ownership_language	discard	crossover
14251	5.550	the_feel_felt_found+ownership_language	discard	temp_0.85
14252	5.137	the_feel_felt_found+ownership_language	discard	tone_change
14253	4.700	ownership_language+strategic_agreement	discard	swap_the_feel_felt_found_for_strategic_agreement
14254	5.138	ownership_language+emotional_labeling	discard	swap_the_feel_felt_found_for_emotional_labeling
14255	5.238	the_feel_felt_found+ownership_language	discard	tone_change
14256	5.138	the_feel_felt_found+ownership_language+strategic_agreement	discard	add_strategic_agreement
14257	5.325	the_feel_felt_found+ownership_language	discard	tone_change
14258	5.237	the_feel_felt_found	discard	remove_ownership_language
14259	5.237	the_feel_felt_found+ownership_language+never_say_calm_down	discard	add_never_say_calm_down
14260	5.237	the_feel_felt_found+ownership_language	discard	temp_0.65
14261	4.912	the_feel_felt_found+ownership_language	discard	tone_change
14262	5.112	the_feel_felt_found+ownership_language	discard	crossover
14263	5.450	the_feel_felt_found+ownership_language	discard	temp_0.85
14264	4.825	the_feel_felt_found+ownership_language+proactive_extras	discard	add_proactive_extras
14265	5.750	the_feel_felt_found+ownership_language	discard	tone_change
14266	5.525	the_feel_felt_found+ownership_language+never_say_calm_down	discard	add_never_say_calm_down
14267	5.450	the_feel_felt_found+ownership_language+warmth_injection	discard	add_warmth_injection
14268	5.013	the_feel_felt_found+ownership_language	discard	tone_change
14269	5.325	ownership_language+energy_matching	discard	swap_the_feel_felt_found_for_energy_matching
14270	4.825	the_feel_felt_found+ownership_language+mirroring	discard	add_mirroring
14271	5.138	ownership_language	discard	crossover
14272	5.138	ownership_language+validation_before_solution	discard	swap_the_feel_felt_found_for_validation_before_solution
14273	5.088	the_feel_felt_found+ownership_language	discard	crossover
14274	5.237	the_feel_felt_found+ownership_language	discard	tone_change
14275	5.225	the_feel_felt_found+ownership_language	discard	crossover
14276	5.200	the_feel_felt_found+ownership_language	discard	crossover
14277	5.650	ownership_language+genuine_admission	discard	swap_the_feel_felt_found_for_genuine_admission
14278	4.825	the_feel_felt_found+ownership_language	discard	tone_change
14279	5.338	the_feel_felt_found+ownership_language+strategic_agreement	discard	add_strategic_agreement
14280	5.075	the_feel_felt_found+ownership_language	discard	temp_0.65
14281	5.113	the_feel_felt_found+ownership_language	discard	tone_change
14282	5.013	ownership_language	discard	crossover
14283	5.450	the_feel_felt_found+ownership_language	discard	temp_0.90
14284	4.800	the_feel_felt_found+ownership_language+genuine_admission	discard	add_genuine_admission
14285	5.550	the_feel_felt_found+ownership_language	discard	temp_0.75
14286	5.450	the_feel_felt_found+ownership_language	discard	crossover
14287	4.888	the_feel_felt_found+ownership_language	discard	temp_0.75
14288	5.450	ownership_language+emotional_labeling	discard	swap_the_feel_felt_found_for_emotional_labeling
14289	5.237	the_feel_felt_found+ownership_language	discard	crossover
14290	5.300	the_feel_felt_found+concrete_next_steps	discard	swap_ownership_language_for_concrete_next_steps
14291	4.700	the_feel_felt_found+ownership_language	discard	crossover
14292	5.450	the_feel_felt_found+ownership_language	discard	crossover
14293	5.200	the_feel_felt_found+ownership_language	discard	crossover
14294	5.013	the_feel_felt_found+ownership_language	discard	temp_0.65
14295	5.112	the_feel_felt_found+ownership_language+emotional_labeling	discard	add_emotional_labeling
14296	5.550	the_feel_felt_found+ownership_language	discard	crossover
14297	5.138	the_feel_felt_found+ownership_language+never_say_calm_down	discard	add_never_say_calm_down
14298	5.425	the_feel_felt_found+ownership_language	discard	tone_change
14299	5.237	the_feel_felt_found+ownership_language	discard	crossover
14300	5.750	the_feel_felt_found+validation_before_solution	discard	swap_ownership_language_for_validation_before_solution
14301	5.112	the_feel_felt_found+ownership_language	discard	temp_0.95
14302	5.112	the_feel_felt_found	discard	crossover
14303	5.325	the_feel_felt_found+ownership_language+energy_matching	discard	add_energy_matching
14304	4.612	the_feel_felt_found	discard	crossover
14305	5.425	ownership_language	discard	crossover
14306	5.300	ownership_language+never_say_calm_down	discard	swap_the_feel_felt_found_for_never_say_calm_down
14307	5.237	the_feel_felt_found+ownership_language+warmth_injection	discard	add_warmth_injection
14308	5.325	the_feel_felt_found+ownership_language	discard	temp_0.70
14309	5.425	the_feel_felt_found	discard	remove_ownership_language
14310	5.425	the_feel_felt_found	discard	crossover
14311	4.487	the_feel_felt_found+ownership_language+validation_before_solution	discard	add_validation_before_solution
14312	5.225	ownership_language+strategic_agreement	discard	swap_the_feel_felt_found_for_strategic_agreement
14313	5.013	the_feel_felt_found+ownership_language	discard	crossover
14314	5.450	the_feel_felt_found+ownership_language	discard	tone_change
14315	5.237	the_feel_felt_found	discard	remove_ownership_language
14316	4.913	the_feel_felt_found+ownership_language	discard	crossover
14317	5.300	the_feel_felt_found+energy_matching	discard	swap_ownership_language_for_energy_matching
14318	5.425	the_feel_felt_found+ownership_language	discard	temp_0.75
14319	5.425	the_feel_felt_found+mirroring	discard	swap_ownership_language_for_mirroring
14320	5.138	the_feel_felt_found+ownership_language	discard	temp_0.70
14321	5.037	the_feel_felt_found+ownership_language	discard	tone_change
14322	4.825	the_feel_felt_found+ownership_language	discard	crossover
14323	5.237	ownership_language+concrete_next_steps	discard	swap_the_feel_felt_found_for_concrete_next_steps
14324	5.138	the_feel_felt_found+ownership_language	discard	tone_change
14325	5.200	the_feel_felt_found+ownership_language	discard	tone_change
14326	5.025	ownership_language	discard	remove_the_feel_felt_found
14327	5.550	the_feel_felt_found	discard	remove_ownership_language
14328	5.337	the_feel_felt_found+ownership_language	discard	crossover
14329	5.013	the_feel_felt_found+ownership_language	discard	tone_change
14330	4.825	the_feel_felt_found+ownership_language	discard	tone_change
14331	5.237	the_feel_felt_found+ownership_language	discard	tone_change
14332	5.450	ownership_language	discard	remove_the_feel_felt_found
14333	4.825	the_feel_felt_found+ownership_language	discard	temp_0.75
14334	5.325	the_feel_felt_found+ownership_language	discard	tone_change
14335	5.138	the_feel_felt_found	discard	crossover
14336	5.225	the_feel_felt_found	discard	remove_ownership_language
14337	5.138	the_feel_felt_found	discard	crossover
14338	4.800	the_feel_felt_found+ownership_language	discard	temp_0.70
14339	5.325	ownership_language+proactive_extras	discard	swap_the_feel_felt_found_for_proactive_extras
14340	5.325	ownership_language+genuine_admission	discard	swap_the_feel_felt_found_for_genuine_admission
14341	5.550	the_feel_felt_found+ownership_language	discard	crossover
14342	5.550	the_feel_felt_found+warmth_injection	discard	swap_ownership_language_for_warmth_injection
14343	5.250	the_feel_felt_found+ownership_language	discard	crossover
14344	5.350	the_feel_felt_found+ownership_language	discard	temp_0.90
14345	5.338	the_feel_felt_found+ownership_language+genuine_admission	discard	add_genuine_admission
14346	5.112	the_feel_felt_found+validation_before_solution	discard	swap_ownership_language_for_validation_before_solution
14347	5.100	the_feel_felt_found+emotional_labeling	discard	swap_ownership_language_for_emotional_labeling
14348	5.325	the_feel_felt_found+ownership_language+warmth_injection	discard	add_warmth_injection
14349	5.550	the_feel_felt_found+strategic_agreement	discard	swap_ownership_language_for_strategic_agreement
14350	5.138	the_feel_felt_found	discard	remove_ownership_language
14351	5.338	the_feel_felt_found+ownership_language+never_say_calm_down	discard	add_never_say_calm_down
14352	5.013	the_feel_felt_found+ownership_language+proactive_extras	discard	add_proactive_extras
14353	4.925	the_feel_felt_found+ownership_language	discard	crossover
14354	4.925	the_feel_felt_found+concrete_next_steps	discard	swap_ownership_language_for_concrete_next_steps
14355	5.550	the_feel_felt_found+ownership_language	discard	crossover
14356	5.450	the_feel_felt_found+ownership_language	discard	tone_change
14357	5.325	the_feel_felt_found+ownership_language	discard	temp_0.65
14358	5.438	the_feel_felt_found+ownership_language	discard	tone_change
14359	5.338	the_feel_felt_found+ownership_language+emotional_labeling	discard	add_emotional_labeling
14360	5.550	ownership_language+proactive_extras	discard	swap_the_feel_felt_found_for_proactive_extras
14361	5.138	the_feel_felt_found+ownership_language+concrete_next_steps	discard	add_concrete_next_steps
14362	5.125	the_feel_felt_found	discard	crossover
14363	4.888	the_feel_felt_found+ownership_language	discard	temp_0.75
14364	5.450	the_feel_felt_found+ownership_language	discard	crossover
14365	5.300	the_feel_felt_found+ownership_language+concrete_next_steps	discard	add_concrete_next_steps
14366	5.300	the_feel_felt_found+ownership_language	discard	temp_0.75
14367	5.237	the_feel_felt_found+ownership_language	discard	crossover
14368	4.925	the_feel_felt_found+ownership_language	discard	temp_0.85
14369	5.425	the_feel_felt_found+ownership_language+genuine_admission	discard	add_genuine_admission
14370	5.025	the_feel_felt_found+ownership_language+proactive_extras	discard	add_proactive_extras
14371	5.350	ownership_language+mirroring	discard	swap_the_feel_felt_found_for_mirroring
14372	5.237	ownership_language+genuine_admission	discard	swap_the_feel_felt_found_for_genuine_admission
14373	5.013	the_feel_felt_found+ownership_language+genuine_admission	discard	add_genuine_admission
14374	5.200	the_feel_felt_found+ownership_language	discard	tone_change
14375	5.112	the_feel_felt_found+ownership_language	discard	temp_0.75
14376	5.138	the_feel_felt_found+ownership_language	discard	temp_0.75
14377	5.650	the_feel_felt_found+ownership_language	discard	tone_change
14378	5.337	the_feel_felt_found+ownership_language+genuine_admission	discard	add_genuine_admission
14379	5.138	the_feel_felt_found+ownership_language+emotional_labeling	discard	add_emotional_labeling
