generation	eq_score	techniques	status	description
10009	5.338	ownership_language+energy_matching	discard	swap_the_feel_felt_found_for_energy_matching
10010	5.012	ownership_language	discard	remove_the_feel_felt_found
10011	4.913	the_feel_felt_found+ownership_language	discard	temp_0.70
10012	5.325	the_feel_felt_found+ownership_language+validation_before_solution	discard	add_validation_before_solution
10013	5.525	ownership_language+mirroring	discard	swap_the_feel_felt_found_for_mirroring
10014	5.350	the_feel_felt_found+ownership_language	discard	tone_change
10015	5.238	the_feel_felt_found+ownership_language+emotional_labeling	discard	add_emotional_labeling
10016	5.013	the_feel_felt_found+ownership_language	discard	tone_change
10017	5.225	the_feel_felt_found+ownership_language+genuine_admission	discard	add_genuine_admission
10018	5.013	the_feel_felt_found+ownership_language	discard	crossover
10019	4.987	ownership_language+personal_touch	discard	swap_the_feel_felt_found_for_personal_touch
10020	5.450	the_feel_felt_found+ownership_language	discard	tone_change
10021	5.213	the_feel_felt_found+ownership_language+concrete_next_steps	discard	add_concrete_next_steps
10022	5.425	the_feel_felt_found	discard	crossover
10023	5.200	ownership_language+emotional_labeling	discard	swap_the_feel_felt_found_for_emotional_labeling
10024	5.325	ownership_language+genuine_admission	discard	swap_the_feel_felt_found_for_genuine_admission
10025	4.925	the_feel_felt_found+ownership_language+genuine_admission	discard	add_genuine_admission
10026	5.200	the_feel_felt_found+ownership_language	discard	tone_change
10027	5.325	the_feel_felt_found+ownership_language	discard	tone_change
10028	4.825	ownership_language+never_say_calm_down	discard	swap_the_feel_felt_found_for_never_say_calm_down
10029	5.400	the_feel_felt_found+ownership_language+casual_professionalism	discard	add_casual_professionalism
10030	5.237	the_feel_felt_found	discard	remove_ownership_language
10031	5.350	the_feel_felt_found+ownership_language	discard	tone_change
10032	4.900	the_feel_felt_found+ownership_language+strategic_agreement	discard	add_strategic_agreement
10033	5.650	none	discard	crossover
10034	5.325	the_feel_felt_found+ownership_language+personal_touch	discard	add_personal_touch
10035	4.712	the_feel_felt_found+ownership_language	discard	crossover
10036	5.350	the_feel_felt_found+warmth_injection	discard	swap_ownership_language_for_warmth_injection
10037	5.112	the_feel_felt_found+ownership_language	discard	crossover
10038	5.300	the_feel_felt_found+ownership_language+personal_touch	discard	add_personal_touch
10039	5.325	ownership_language	discard	remove_the_feel_felt_found
10040	5.450	the_feel_felt_found+ownership_language	discard	tone_change
10041	5.125	the_feel_felt_found+ownership_language+emotional_labeling	discard	add_emotional_labeling
10042	5.350	the_feel_felt_found	discard	crossover
10043	5.325	the_feel_felt_found+ownership_language	discard	temp_0.75
10044	5.550	the_feel_felt_found+ownership_language	discard	crossover
10045	5.038	the_feel_felt_found+ownership_language	discard	crossover
10046	5.138	the_feel_felt_found+ownership_language	discard	tone_change
10047	5.450	the_feel_felt_found+ownership_language	discard	tone_change
10048	5.425	the_feel_felt_found+ownership_language	discard	tone_change
10049	5.325	the_feel_felt_found+genuine_admission	discard	swap_ownership_language_for_genuine_admission
10050	5.350	the_feel_felt_found+ownership_language+personal_touch	discard	add_personal_touch
10051	5.213	the_feel_felt_found+mirroring	discard	swap_ownership_language_for_mirroring
10052	5.037	the_feel_felt_found+ownership_language+casual_professionalism	discard	add_casual_professionalism
10053	4.925	the_feel_felt_found+ownership_language	discard	crossover
10054	5.550	the_feel_felt_found+ownership_language+concrete_next_steps	discard	add_concrete_next_steps
10055	5.425	the_feel_felt_found+ownership_language+emotional_labeling	discard	add_emotional_labeling
10056	5.450	the_feel_felt_found+emotional_labeling	discard	swap_ownership_language_for_emotional_labeling
10057	5.550	the_feel_felt_found+ownership_language	discard	temp_0.70
10058	5.450	the_feel_felt_found+ownership_language	discard	temp_0.90
10059	5.437	none	discard	crossover
10060	5.225	the_feel_felt_found+ownership_language	discard	temp_0.85
10061	5.450	the_feel_felt_found+ownership_language+proactive_extras	discard	add_proactive_extras
10062	5.425	ownership_language	discard	remove_the_feel_felt_found
10063	5.237	the_feel_felt_found+ownership_language	discard	temp_0.90
10064	5.237	the_feel_felt_found	discard	remove_ownership_language
10065	4.925	the_feel_felt_found+ownership_language	discard	temp_0.85
10066	5.237	the_feel_felt_found+ownership_language	discard	tone_change
10067	5.450	ownership_language+concrete_next_steps	discard	swap_the_feel_felt_found_for_concrete_next_steps
10068	5.237	the_feel_felt_found+ownership_language+warmth_injection	discard	add_warmth_injection
10069	5.325	the_feel_felt_found+ownership_language+validation_before_solution	discard	add_validation_before_solution
10070	5.450	the_feel_felt_found+ownership_language+validation_before_solution	discard	add_validation_before_solution
10071	5.325	the_feel_felt_found+ownership_language	discard	tone_change
10072	4.513	the_feel_felt_found+ownership_language	discard	tone_change
10073	4.725	the_feel_felt_found+ownership_language	discard	tone_change
10074	5.550	the_feel_felt_found+ownership_language+warmth_injection	discard	add_warmth_injection
10075	5.350	ownership_language+mirroring	discard	swap_the_feel_felt_found_for_mirroring
10076	4.800	the_feel_felt_found	discard	remove_ownership_language
10077	5.138	ownership_language	discard	remove_the_feel_felt_found
10078	5.550	the_feel_felt_found+ownership_language+personal_touch	discard	add_personal_touch
10079	5.200	the_feel_felt_found+ownership_language	discard	crossover
10080	5.325	the_feel_felt_found+personal_touch	discard	swap_ownership_language_for_personal_touch
10081	5.138	the_feel_felt_found	discard	remove_ownership_language
10082	5.325	the_feel_felt_found+ownership_language	discard	tone_change
10083	4.925	the_feel_felt_found+ownership_language+concrete_next_steps	discard	add_concrete_next_steps
10084	5.088	ownership_language	discard	crossover
10085	5.112	the_feel_felt_found+ownership_language+concrete_next_steps	discard	add_concrete_next_steps
10086	5.325	ownership_language	discard	crossover
10087	4.925	the_feel_felt_found	discard	crossover
10088	5.450	the_feel_felt_found+validation_before_solution	discard	swap_ownership_language_for_validation_before_solution
10089	5.200	the_feel_felt_found+ownership_language+warmth_injection	discard	add_warmth_injection
10090	5.550	the_feel_felt_found+ownership_language	discard	tone_change
10091	5.325	ownership_language	discard	crossover
10092	5.425	the_feel_felt_found	discard	crossover
10093	5.025	the_feel_felt_found+ownership_language	discard	tone_change
10094	5.338	ownership_language+genuine_admission	discard	swap_the_feel_felt_found_for_genuine_admission
10095	5.138	the_feel_felt_found+ownership_language	discard	tone_change
10096	4.888	the_feel_felt_found+ownership_language	discard	temp_0.75
10097	5.425	ownership_language+strategic_agreement	discard	swap_the_feel_felt_found_for_strategic_agreement
10098	5.138	the_feel_felt_found+ownership_language	discard	crossover
10099	5.450	the_feel_felt_found+warmth_injection	discard	swap_ownership_language_for_warmth_injection
10100	4.800	the_feel_felt_found+ownership_language	discard	tone_change
10101	5.650	the_feel_felt_found+ownership_language	discard	tone_change
10102	5.450	the_feel_felt_found+ownership_language+casual_professionalism	discard	add_casual_professionalism
10103	5.425	the_feel_felt_found+ownership_language	discard	crossover
10104	5.350	the_feel_felt_found+ownership_language	discard	tone_change
10105	5.450	the_feel_felt_found+ownership_language+genuine_admission	discard	add_genuine_admission
10106	5.138	the_feel_felt_found+ownership_language	discard	tone_change
10107	5.337	ownership_language+never_say_calm_down	discard	swap_the_feel_felt_found_for_never_say_calm_down
10108	5.350	the_feel_felt_found+ownership_language	discard	tone_change
10109	5.425	the_feel_felt_found+ownership_language+validation_before_solution	discard	add_validation_before_solution
10110	5.212	the_feel_felt_found+ownership_language+warmth_injection	discard	add_warmth_injection
10111	5.425	the_feel_felt_found+ownership_language+proactive_extras	discard	add_proactive_extras
10112	5.013	the_feel_felt_found+validation_before_solution	discard	swap_ownership_language_for_validation_before_solution
10113	5.550	the_feel_felt_found+validation_before_solution	discard	swap_ownership_language_for_validation_before_solution
10114	5.138	the_feel_felt_found+ownership_language+concrete_next_steps	discard	add_concrete_next_steps
10115	5.013	the_feel_felt_found+casual_professionalism	discard	swap_ownership_language_for_casual_professionalism
10116	5.025	the_feel_felt_found+ownership_language	discard	crossover
10117	5.312	the_feel_felt_found+ownership_language+personal_touch	discard	add_personal_touch
10118	5.325	the_feel_felt_found+ownership_language	discard	temp_0.95
10119	4.888	the_feel_felt_found+ownership_language+casual_professionalism	discard	add_casual_professionalism
10120	5.338	the_feel_felt_found+ownership_language+never_say_calm_down	discard	add_never_say_calm_down
10121	5.450	ownership_language+concrete_next_steps	discard	swap_the_feel_felt_found_for_concrete_next_steps
10122	5.138	the_feel_felt_found+ownership_language	discard	crossover
10123	5.450	the_feel_felt_found+ownership_language	discard	crossover
10124	5.013	the_feel_felt_found+ownership_language+strategic_agreement	discard	add_strategic_agreement
10125	5.237	the_feel_felt_found+ownership_language	discard	tone_change
10126	5.013	ownership_language	discard	remove_the_feel_felt_found
10127	5.013	the_feel_felt_found+ownership_language+emotional_labeling	discard	add_emotional_labeling
10128	5.450	ownership_language	discard	crossover
10129	5.425	ownership_language	discard	crossover
10130	5.138	the_feel_felt_found+never_say_calm_down	discard	swap_ownership_language_for_never_say_calm_down
10131	5.350	ownership_language	discard	remove_the_feel_felt_found
10132	5.237	the_feel_felt_found+ownership_language+warmth_injection	discard	add_warmth_injection
10133	5.237	the_feel_felt_found+ownership_language+mirroring	discard	add_mirroring
10134	5.238	the_feel_felt_found+ownership_language	discard	tone_change
10135	5.200	the_feel_felt_found+ownership_language	discard	tone_change
10136	5.300	the_feel_felt_found+ownership_language	discard	tone_change
10137	5.650	ownership_language+warmth_injection	discard	swap_the_feel_felt_found_for_warmth_injection
10138	5.013	the_feel_felt_found+ownership_language	discard	tone_change
10139	5.425	the_feel_felt_found	discard	crossover
10140	5.325	the_feel_felt_found	discard	crossover
10141	5.213	ownership_language+concrete_next_steps	discard	swap_the_feel_felt_found_for_concrete_next_steps
10142	4.800	the_feel_felt_found+ownership_language	discard	crossover
10143	5.325	the_feel_felt_found+ownership_language	discard	tone_change
10144	5.450	the_feel_felt_found+ownership_language+genuine_admission	discard	add_genuine_admission
10145	5.113	the_feel_felt_found+ownership_language+concrete_next_steps	discard	add_concrete_next_steps
10146	5.237	the_feel_felt_found+ownership_language	discard	temp_0.75
10147	5.550	the_feel_felt_found+ownership_language	discard	crossover
10148	5.425	ownership_language+warmth_injection	discard	swap_the_feel_felt_found_for_warmth_injection
10149	5.650	the_feel_felt_found	discard	crossover
10150	4.912	the_feel_felt_found+ownership_language+concrete_next_steps	discard	add_concrete_next_steps
10151	5.450	the_feel_felt_found	discard	remove_ownership_language
10152	5.550	the_feel_felt_found+ownership_language	discard	temp_0.90
10153	5.200	ownership_language	discard	crossover
10154	5.438	the_feel_felt_found+ownership_language+warmth_injection	discard	add_warmth_injection
10155	5.325	the_feel_felt_found+ownership_language	discard	tone_change
10156	5.650	the_feel_felt_found+ownership_language+personal_touch	discard	add_personal_touch
10157	5.450	the_feel_felt_found+ownership_language	discard	temp_0.75
10158	5.425	the_feel_felt_found+ownership_language	discard	tone_change
10159	5.200	ownership_language	discard	crossover
10160	5.550	the_feel_felt_found+ownership_language+energy_matching	discard	add_energy_matching
10161	5.350	the_feel_felt_found	discard	crossover
10162	5.138	the_feel_felt_found+ownership_language+validation_before_solution	discard	add_validation_before_solution
10163	4.800	the_feel_felt_found+ownership_language	discard	crossover
10164	5.200	the_feel_felt_found+mirroring	discard	swap_ownership_language_for_mirroring
10165	5.138	the_feel_felt_found+ownership_language	discard	tone_change
10166	5.325	the_feel_felt_found	discard	remove_ownership_language
10167	5.338	the_feel_felt_found+ownership_language	discard	tone_change
10168	5.525	the_feel_felt_found+personal_touch	discard	swap_ownership_language_for_personal_touch
10169	5.013	ownership_language	discard	remove_the_feel_felt_found
10170	5.138	the_feel_felt_found+ownership_language	discard	tone_change
10171	5.550	ownership_language	discard	crossover
10172	5.137	the_feel_felt_found+warmth_injection	discard	swap_ownership_language_for_warmth_injection
10173	5.550	the_feel_felt_found+ownership_language	discard	temp_0.90
10174	5.112	the_feel_felt_found+ownership_language	discard	tone_change
10175	5.338	the_feel_felt_found+genuine_admission	discard	swap_ownership_language_for_genuine_admission
10176	5.550	the_feel_felt_found+casual_professionalism	discard	swap_ownership_language_for_casual_professionalism
10177	5.237	the_feel_felt_found+ownership_language	discard	tone_change
10178	5.425	the_feel_felt_found+ownership_language	discard	tone_change
10179	5.112	the_feel_felt_found+ownership_language	discard	tone_change
10180	5.450	the_feel_felt_found+ownership_language	discard	tone_change
10181	5.112	the_feel_felt_found+emotional_labeling	discard	swap_ownership_language_for_emotional_labeling
10182	5.325	ownership_language+casual_professionalism	discard	swap_the_feel_felt_found_for_casual_professionalism
10183	5.013	the_feel_felt_found+ownership_language	discard	tone_change
10184	4.613	the_feel_felt_found+ownership_language+mirroring	discard	add_mirroring
10185	4.712	the_feel_felt_found+ownership_language+validation_before_solution	discard	add_validation_before_solution
10186	4.825	the_feel_felt_found+ownership_language	discard	temp_0.85
10187	5.350	the_feel_felt_found+ownership_language	discard	temp_0.85
10188	5.100	the_feel_felt_found+ownership_language	discard	crossover
10189	5.237	ownership_language	discard	remove_the_feel_felt_found
10190	5.200	the_feel_felt_found+ownership_language	discard	temp_0.85
10191	5.013	the_feel_felt_found+warmth_injection	discard	swap_ownership_language_for_warmth_injection
10192	5.550	the_feel_felt_found+personal_touch	discard	swap_ownership_language_for_personal_touch
10193	4.800	the_feel_felt_found+ownership_language	discard	tone_change
10194	5.450	the_feel_felt_found+ownership_language+genuine_admission	discard	add_genuine_admission
10195	5.138	ownership_language	discard	remove_the_feel_felt_found
10196	5.138	the_feel_felt_found+ownership_language+mirroring	discard	add_mirroring
10197	5.138	the_feel_felt_found+ownership_language+casual_professionalism	discard	add_casual_professionalism
10198	4.700	ownership_language+validation_before_solution	discard	swap_the_feel_felt_found_for_validation_before_solution
10199	5.450	ownership_language	discard	remove_the_feel_felt_found
10200	5.138	the_feel_felt_found+ownership_language	discard	tone_change
10201	5.525	ownership_language	discard	remove_the_feel_felt_found
10202	4.800	ownership_language	discard	remove_the_feel_felt_found
10203	5.237	the_feel_felt_found+ownership_language	discard	crossover
10204	5.200	the_feel_felt_found+ownership_language+validation_before_solution	discard	add_validation_before_solution
10205	5.237	the_feel_felt_found+ownership_language	discard	tone_change
10206	5.338	the_feel_felt_found+ownership_language	discard	tone_change
10207	5.238	the_feel_felt_found+proactive_extras	discard	swap_ownership_language_for_proactive_extras
10208	5.112	the_feel_felt_found+ownership_language+strategic_agreement	discard	add_strategic_agreement
10209	5.525	the_feel_felt_found+ownership_language	discard	tone_change
10210	4.925	ownership_language+personal_touch	discard	swap_the_feel_felt_found_for_personal_touch
10211	5.450	the_feel_felt_found	discard	remove_ownership_language
10212	5.237	the_feel_felt_found+ownership_language	discard	crossover
10213	5.237	the_feel_felt_found+ownership_language	discard	crossover
10214	5.550	ownership_language+strategic_agreement	discard	swap_the_feel_felt_found_for_strategic_agreement
10215	5.450	the_feel_felt_found+ownership_language+strategic_agreement	discard	add_strategic_agreement
10216	5.225	the_feel_felt_found+ownership_language	discard	temp_0.85
10217	5.138	ownership_language+validation_before_solution	discard	swap_the_feel_felt_found_for_validation_before_solution
10218	5.113	the_feel_felt_found+ownership_language	discard	tone_change
10219	5.013	the_feel_felt_found	discard	remove_ownership_language
10220	5.138	the_feel_felt_found+ownership_language	discard	tone_change
10221	5.112	the_feel_felt_found+ownership_language	discard	temp_0.90
10222	4.412	ownership_language	discard	remove_the_feel_felt_found
10223	5.237	the_feel_felt_found+ownership_language+energy_matching	discard	add_energy_matching
10224	5.337	the_feel_felt_found	discard	remove_ownership_language
10225	5.450	the_feel_felt_found+mirroring	discard	swap_ownership_language_for_mirroring
10226	5.013	the_feel_felt_found+proactive_extras	discard	swap_ownership_language_for_proactive_extras
10227	5.025	the_feel_felt_found+ownership_language	discard	tone_change
10228	5.238	the_feel_felt_found+ownership_language+strategic_agreement	discard	add_strategic_agreement
10229	5.338	the_feel_felt_found+emotional_labeling	discard	swap_ownership_language_for_emotional_labeling
10230	4.612	ownership_language	discard	remove_the_feel_felt_found
10231	5.550	the_feel_felt_found+ownership_language	discard	temp_0.90
10232	5.525	the_feel_felt_found	discard	crossover
10233	5.038	the_feel_felt_found+ownership_language	discard	tone_change
10234	5.325	the_feel_felt_found+ownership_language	discard	temp_0.65
10235	5.138	ownership_language+never_say_calm_down	discard	swap_the_feel_felt_found_for_never_say_calm_down
10236	5.450	the_feel_felt_found+ownership_language	discard	tone_change
10237	4.825	none	discard	crossover
10238	5.325	ownership_language	discard	crossover
10239	5.037	the_feel_felt_found+ownership_language+strategic_agreement	discard	add_strategic_agreement
10240	5.325	ownership_language	discard	remove_the_feel_felt_found
10241	5.138	the_feel_felt_found+ownership_language	discard	tone_change
10242	5.450	the_feel_felt_found+warmth_injection	discard	swap_ownership_language_for_warmth_injection
10243	5.138	the_feel_felt_found	discard	remove_ownership_language
10244	5.213	the_feel_felt_found+ownership_language+warmth_injection	discard	add_warmth_injection
10245	4.987	the_feel_felt_found	discard	crossover
10246	4.888	the_feel_felt_found+concrete_next_steps	discard	swap_ownership_language_for_concrete_next_steps
10247	5.138	the_feel_felt_found+ownership_language+proactive_extras	discard	add_proactive_extras
10248	5.013	ownership_language+genuine_admission	discard	swap_the_feel_felt_found_for_genuine_admission
10249	5.237	the_feel_felt_found+ownership_language	discard	tone_change
10250	4.825	the_feel_felt_found+ownership_language	discard	tone_change
10251	4.925	the_feel_felt_found	discard	remove_ownership_language
10252	5.200	ownership_language+personal_touch	discard	swap_the_feel_felt_found_for_personal_touch
10253	5.450	the_feel_felt_found+ownership_language	discard	crossover
10254	4.912	the_feel_felt_found+ownership_language	discard	temp_0.75
10255	5.400	the_feel_felt_found+ownership_language+casual_professionalism	discard	add_casual_professionalism
10256	5.138	the_feel_felt_found	discard	remove_ownership_language
10257	5.550	the_feel_felt_found+ownership_language	discard	crossover
10258	5.138	the_feel_felt_found+ownership_language+personal_touch	discard	add_personal_touch
10259	5.325	the_feel_felt_found	discard	crossover
10260	4.763	ownership_language+energy_matching	discard	swap_the_feel_felt_found_for_energy_matching
10261	5.025	none	discard	crossover
10262	5.237	the_feel_felt_found+ownership_language+casual_professionalism	discard	add_casual_professionalism
10263	4.925	the_feel_felt_found	discard	crossover
10264	5.138	the_feel_felt_found+ownership_language+warmth_injection	discard	add_warmth_injection
10265	5.013	the_feel_felt_found+ownership_language	discard	temp_0.70
10266	5.238	ownership_language	discard	crossover
10267	5.650	the_feel_felt_found	discard	crossover
10268	5.450	the_feel_felt_found+ownership_language	discard	temp_0.85
10269	5.425	ownership_language	discard	remove_the_feel_felt_found
10270	5.138	the_feel_felt_found+ownership_language+proactive_extras	discard	add_proactive_extras
10271	5.025	the_feel_felt_found+ownership_language	discard	temp_0.65
10272	5.138	the_feel_felt_found	discard	remove_ownership_language
10273	5.450	the_feel_felt_found+validation_before_solution	discard	swap_ownership_language_for_validation_before_solution
10274	4.388	the_feel_felt_found+ownership_language	discard	tone_change
10275	5.350	ownership_language+genuine_admission	discard	swap_the_feel_felt_found_for_genuine_admission
10276	5.013	the_feel_felt_found+ownership_language	discard	crossover
10277	5.450	the_feel_felt_found+ownership_language	discard	tone_change
10278	5.013	the_feel_felt_found+ownership_language+warmth_injection	discard	add_warmth_injection
