generation	eq_score	techniques	status	description
2821	5.550	the_feel_felt_found+ownership_language+concrete_next_steps	discard	add_concrete_next_steps
2822	5.113	the_feel_felt_found+ownership_language	discard	tone_change
2823	5.350	the_feel_felt_found+ownership_language	discard	temp_0.70
2824	4.925	the_feel_felt_found+ownership_language	discard	tone_change
2825	5.013	ownership_language	discard	remove_the_feel_felt_found
2826	5.113	the_feel_felt_found+ownership_language	discard	tone_change
2827	5.237	the_feel_felt_found+ownership_language	discard	temp_0.95
2828	5.237	the_feel_felt_found+ownership_language	discard	temp_0.65
2829	4.825	the_feel_felt_found+ownership_language+concrete_next_steps	discard	add_concrete_next_steps
2830	5.350	the_feel_felt_found+ownership_language	discard	temp_0.65
2831	5.550	the_feel_felt_found+ownership_language+concrete_next_steps	discard	add_concrete_next_steps
2832	5.325	the_feel_felt_found+mirroring	discard	swap_ownership_language_for_mirroring
2833	5.200	the_feel_felt_found+ownership_language	discard	tone_change
2834	5.338	ownership_language	discard	crossover
2835	5.138	the_feel_felt_found	discard	crossover
2836	5.450	the_feel_felt_found+genuine_admission	discard	swap_ownership_language_for_genuine_admission
2837	5.450	the_feel_felt_found+ownership_language	discard	tone_change
2838	5.013	the_feel_felt_found+ownership_language	discard	temp_0.65
2839	5.350	the_feel_felt_found+ownership_language	discard	tone_change
2840	5.350	the_feel_felt_found+ownership_language	discard	temp_0.95
2841	5.550	the_feel_felt_found+ownership_language+validation_before_solution	discard	add_validation_before_solution
2842	5.137	the_feel_felt_found+ownership_language	discard	crossover
2843	5.137	the_feel_felt_found+ownership_language+mirroring	discard	add_mirroring
2844	4.900	ownership_language	discard	remove_the_feel_felt_found
2845	5.325	the_feel_felt_found+ownership_language	discard	tone_change
2846	5.350	the_feel_felt_found+energy_matching	discard	swap_ownership_language_for_energy_matching
2847	5.450	the_feel_felt_found+ownership_language+emotional_labeling	discard	add_emotional_labeling
2848	5.100	the_feel_felt_found+ownership_language+personal_touch	discard	add_personal_touch
2849	5.013	the_feel_felt_found+ownership_language	discard	tone_change
2850	5.013	the_feel_felt_found+ownership_language	discard	temp_0.65
2851	5.450	the_feel_felt_found+ownership_language+proactive_extras	discard	add_proactive_extras
2852	5.350	ownership_language	discard	remove_the_feel_felt_found
2853	5.138	ownership_language	discard	remove_the_feel_felt_found
2854	5.138	the_feel_felt_found+ownership_language	discard	temp_0.90
2855	5.200	the_feel_felt_found+ownership_language	discard	tone_change
2856	4.800	the_feel_felt_found+ownership_language	discard	tone_change
2857	5.550	the_feel_felt_found+ownership_language	discard	tone_change
2858	5.450	the_feel_felt_found+ownership_language+strategic_agreement	discard	add_strategic_agreement
2859	5.238	the_feel_felt_found+ownership_language+warmth_injection	discard	add_warmth_injection
2860	5.037	the_feel_felt_found+ownership_language+casual_professionalism	discard	add_casual_professionalism
2861	5.237	none	discard	crossover
2862	5.138	the_feel_felt_found+ownership_language+casual_professionalism	discard	add_casual_professionalism
2863	4.888	the_feel_felt_found+ownership_language	discard	crossover
2864	5.225	the_feel_felt_found+warmth_injection	discard	swap_ownership_language_for_warmth_injection
2865	5.325	the_feel_felt_found+ownership_language	discard	temp_0.75
2866	5.237	the_feel_felt_found+ownership_language+genuine_admission	discard	add_genuine_admission
2867	5.338	ownership_language	discard	crossover
2868	5.138	the_feel_felt_found+ownership_language	discard	tone_change
2869	5.450	the_feel_felt_found+ownership_language	discard	tone_change
2870	5.138	the_feel_felt_found+ownership_language	discard	tone_change
2871	5.350	the_feel_felt_found+ownership_language+proactive_extras	discard	add_proactive_extras
2872	5.112	none	discard	crossover
2873	5.238	the_feel_felt_found+ownership_language+validation_before_solution	discard	add_validation_before_solution
2874	5.112	the_feel_felt_found+ownership_language	discard	crossover
2875	4.912	the_feel_felt_found+energy_matching	discard	swap_ownership_language_for_energy_matching
2876	5.138	the_feel_felt_found+ownership_language+proactive_extras	discard	add_proactive_extras
2877	5.213	the_feel_felt_found+ownership_language	discard	tone_change
2878	5.200	the_feel_felt_found+ownership_language+casual_professionalism	discard	add_casual_professionalism
2879	5.650	the_feel_felt_found+concrete_next_steps	discard	swap_ownership_language_for_concrete_next_steps
2880	5.238	the_feel_felt_found+emotional_labeling	discard	swap_ownership_language_for_emotional_labeling
2881	4.725	the_feel_felt_found+ownership_language	discard	tone_change
2882	4.800	ownership_language+genuine_admission	discard	swap_the_feel_felt_found_for_genuine_admission
2883	4.575	the_feel_felt_found+ownership_language	discard	tone_change
2884	5.325	the_feel_felt_found+ownership_language	discard	crossover
2885	5.325	ownership_language+emotional_labeling	discard	swap_the_feel_felt_found_for_emotional_labeling
2886	5.300	the_feel_felt_found	discard	remove_ownership_language
2887	4.988	the_feel_felt_found+ownership_language	discard	tone_change
2888	4.925	the_feel_felt_found	discard	crossover
2889	4.825	the_feel_felt_found+ownership_language+never_say_calm_down	discard	add_never_say_calm_down
2890	5.225	ownership_language	discard	crossover
2891	5.450	the_feel_felt_found	discard	crossover
2892	5.138	the_feel_felt_found+ownership_language	discard	crossover
2893	5.338	the_feel_felt_found+ownership_language	discard	temp_0.90
2894	5.325	the_feel_felt_found+ownership_language	discard	temp_0.90
2895	5.138	the_feel_felt_found	discard	crossover
2896	5.450	the_feel_felt_found	discard	crossover
2897	4.825	the_feel_felt_found+ownership_language	discard	tone_change
2898	5.238	the_feel_felt_found+ownership_language	discard	tone_change
2899	5.013	ownership_language	discard	crossover
2900	5.337	the_feel_felt_found+ownership_language	discard	tone_change
2901	5.200	the_feel_felt_found+ownership_language+emotional_labeling	discard	add_emotional_labeling
2902	5.238	the_feel_felt_found+ownership_language	discard	tone_change
2903	4.513	the_feel_felt_found+ownership_language+mirroring	discard	add_mirroring
2904	5.075	the_feel_felt_found+ownership_language	discard	tone_change
2905	5.450	the_feel_felt_found+ownership_language	discard	tone_change
2906	4.988	ownership_language	discard	crossover
2907	5.213	the_feel_felt_found+ownership_language+energy_matching	discard	add_energy_matching
2908	5.350	the_feel_felt_found+ownership_language	discard	temp_0.95
2909	5.550	none	discard	crossover
2910	4.825	the_feel_felt_found+ownership_language	discard	tone_change
2911	5.112	none	discard	crossover
2912	5.438	the_feel_felt_found	discard	crossover
2913	5.425	the_feel_felt_found+ownership_language+validation_before_solution	discard	add_validation_before_solution
2914	4.700	the_feel_felt_found+casual_professionalism	discard	swap_ownership_language_for_casual_professionalism
2915	5.425	the_feel_felt_found+ownership_language	discard	temp_0.70
2916	4.800	the_feel_felt_found+ownership_language	discard	tone_change
2917	5.100	the_feel_felt_found+ownership_language	discard	temp_0.70
2918	5.550	ownership_language	discard	crossover
2919	5.237	the_feel_felt_found+ownership_language+concrete_next_steps	discard	add_concrete_next_steps
2920	5.337	the_feel_felt_found+ownership_language+genuine_admission	discard	add_genuine_admission
2921	5.112	the_feel_felt_found	discard	remove_ownership_language
2922	5.138	ownership_language+warmth_injection	discard	swap_the_feel_felt_found_for_warmth_injection
2923	5.325	the_feel_felt_found+energy_matching	discard	swap_ownership_language_for_energy_matching
2924	5.425	the_feel_felt_found+ownership_language+casual_professionalism	discard	add_casual_professionalism
2925	5.237	the_feel_felt_found+ownership_language	discard	crossover
2926	5.138	the_feel_felt_found+ownership_language	discard	tone_change
2927	5.013	the_feel_felt_found+ownership_language+warmth_injection	discard	add_warmth_injection
2928	4.925	the_feel_felt_found	discard	crossover
2929	5.138	the_feel_felt_found+ownership_language	discard	tone_change
2930	5.138	ownership_language+warmth_injection	discard	swap_the_feel_felt_found_for_warmth_injection
2931	4.575	ownership_language+concrete_next_steps	discard	swap_the_feel_felt_found_for_concrete_next_steps
2932	5.325	the_feel_felt_found+ownership_language	discard	temp_0.95
2933	5.237	the_feel_felt_found	discard	crossover
2934	5.338	the_feel_felt_found+ownership_language+energy_matching	discard	add_energy_matching
2935	5.450	the_feel_felt_found+personal_touch	discard	swap_ownership_language_for_personal_touch
2936	5.550	ownership_language	discard	remove_the_feel_felt_found
2937	5.325	the_feel_felt_found+validation_before_solution	discard	swap_ownership_language_for_validation_before_solution
2938	5.450	the_feel_felt_found+ownership_language	discard	temp_0.70
2939	5.138	ownership_language	discard	crossover
2940	5.200	the_feel_felt_found+ownership_language	discard	tone_change
2941	5.013	the_feel_felt_found+ownership_language+strategic_agreement	discard	add_strategic_agreement
2942	5.237	ownership_language+personal_touch	discard	swap_the_feel_felt_found_for_personal_touch
2943	5.013	the_feel_felt_found+personal_touch	discard	swap_ownership_language_for_personal_touch
2944	5.138	ownership_language	discard	crossover
2945	5.550	the_feel_felt_found+ownership_language+validation_before_solution	discard	add_validation_before_solution
2946	5.213	the_feel_felt_found+ownership_language	discard	tone_change
2947	4.700	the_feel_felt_found+ownership_language	discard	crossover
2948	5.425	the_feel_felt_found+ownership_language+casual_professionalism	discard	add_casual_professionalism
2949	5.450	ownership_language	discard	remove_the_feel_felt_found
2950	4.900	the_feel_felt_found+ownership_language	discard	tone_change
2951	5.225	the_feel_felt_found+ownership_language	discard	temp_0.90
2952	5.138	the_feel_felt_found+ownership_language	discard	tone_change
2953	5.450	the_feel_felt_found+ownership_language+never_say_calm_down	discard	add_never_say_calm_down
2954	5.038	the_feel_felt_found+ownership_language+proactive_extras	discard	add_proactive_extras
2955	5.237	the_feel_felt_found+ownership_language	discard	tone_change
2956	4.825	the_feel_felt_found+ownership_language+validation_before_solution	discard	add_validation_before_solution
2957	5.338	ownership_language+emotional_labeling	discard	swap_the_feel_felt_found_for_emotional_labeling
2958	5.650	the_feel_felt_found+ownership_language+genuine_admission	discard	add_genuine_admission
2959	5.525	the_feel_felt_found+ownership_language	discard	tone_change
2960	5.237	the_feel_felt_found+ownership_language+mirroring	discard	add_mirroring
2961	5.450	the_feel_felt_found+ownership_language+concrete_next_steps	discard	add_concrete_next_steps
2962	5.525	the_feel_felt_found+ownership_language+never_say_calm_down	discard	add_never_say_calm_down
2963	5.213	the_feel_felt_found+ownership_language	discard	tone_change
2964	5.237	the_feel_felt_found+personal_touch	discard	swap_ownership_language_for_personal_touch
2965	5.325	the_feel_felt_found+ownership_language	discard	tone_change
2966	4.800	the_feel_felt_found+ownership_language	discard	tone_change
2967	5.625	the_feel_felt_found+ownership_language	discard	tone_change
2968	4.487	the_feel_felt_found+ownership_language+casual_professionalism	discard	add_casual_professionalism
2969	5.425	the_feel_felt_found+ownership_language+never_say_calm_down	discard	add_never_say_calm_down
2970	5.300	the_feel_felt_found+ownership_language	discard	tone_change
2971	5.013	the_feel_felt_found+validation_before_solution	discard	swap_ownership_language_for_validation_before_solution
2972	5.225	ownership_language+casual_professionalism	discard	swap_the_feel_felt_found_for_casual_professionalism
2973	4.825	the_feel_felt_found+ownership_language+emotional_labeling	discard	add_emotional_labeling
2974	5.237	the_feel_felt_found+ownership_language	discard	temp_0.95
2975	5.112	the_feel_felt_found	discard	crossover
2976	5.325	the_feel_felt_found	discard	remove_ownership_language
2977	5.237	the_feel_felt_found	discard	remove_ownership_language
2978	5.013	the_feel_felt_found+ownership_language	discard	crossover
2979	5.138	the_feel_felt_found+ownership_language	discard	tone_change
2980	4.800	ownership_language	discard	remove_the_feel_felt_found
2981	5.013	the_feel_felt_found+ownership_language	discard	tone_change
2982	5.112	the_feel_felt_found+ownership_language	discard	tone_change
2983	5.013	the_feel_felt_found+ownership_language	discard	crossover
2984	5.113	the_feel_felt_found+ownership_language	discard	temp_0.65
2985	5.325	the_feel_felt_found+ownership_language	discard	tone_change
2986	5.550	the_feel_felt_found	discard	crossover
2987	5.238	ownership_language+validation_before_solution	discard	swap_the_feel_felt_found_for_validation_before_solution
2988	5.438	the_feel_felt_found+strategic_agreement	discard	swap_ownership_language_for_strategic_agreement
2989	5.550	the_feel_felt_found+ownership_language	discard	tone_change
2990	5.237	the_feel_felt_found+ownership_language	discard	tone_change
2991	5.225	the_feel_felt_found+ownership_language	discard	crossover
2992	5.338	the_feel_felt_found+ownership_language	discard	tone_change
2993	5.350	the_feel_felt_found+ownership_language	discard	tone_change
2994	5.325	the_feel_felt_found+ownership_language	discard	temp_0.70
2995	5.112	the_feel_felt_found+ownership_language	discard	temp_0.85
2996	5.550	the_feel_felt_found+ownership_language+strategic_agreement	discard	add_strategic_agreement
2997	5.425	the_feel_felt_found+ownership_language	discard	tone_change
2998	5.013	ownership_language+never_say_calm_down	discard	swap_the_feel_felt_found_for_never_say_calm_down
2999	5.300	the_feel_felt_found+ownership_language	discard	tone_change
3000	5.325	ownership_language	discard	remove_the_feel_felt_found
3001	5.200	the_feel_felt_found+ownership_language	discard	tone_change
3002	4.912	the_feel_felt_found+ownership_language	discard	tone_change
3003	5.425	the_feel_felt_found+ownership_language	discard	tone_change
3004	5.650	the_feel_felt_found+ownership_language	discard	crossover
3005	4.925	the_feel_felt_found+ownership_language+validation_before_solution	discard	add_validation_before_solution
3006	5.450	the_feel_felt_found+ownership_language	discard	crossover
3007	5.425	ownership_language+never_say_calm_down	discard	swap_the_feel_felt_found_for_never_say_calm_down
3008	5.425	the_feel_felt_found	discard	remove_ownership_language
3009	4.987	the_feel_felt_found+ownership_language+mirroring	discard	add_mirroring
3010	5.013	the_feel_felt_found+ownership_language	discard	tone_change
3011	5.337	the_feel_felt_found+ownership_language	discard	tone_change
3012	5.338	the_feel_felt_found+ownership_language	discard	crossover
3013	5.112	ownership_language	discard	remove_the_feel_felt_found
3014	5.650	the_feel_felt_found+ownership_language+strategic_agreement	discard	add_strategic_agreement
3015	5.300	the_feel_felt_found+ownership_language	discard	crossover
3016	5.237	ownership_language+warmth_injection	discard	swap_the_feel_felt_found_for_warmth_injection
3017	5.325	the_feel_felt_found+ownership_language+energy_matching	discard	add_energy_matching
3018	5.425	ownership_language+warmth_injection	discard	swap_the_feel_felt_found_for_warmth_injection
3019	4.825	ownership_language+proactive_extras	discard	swap_the_feel_felt_found_for_proactive_extras
3020	5.450	the_feel_felt_found+ownership_language	discard	tone_change
3021	5.325	the_feel_felt_found+ownership_language+energy_matching	discard	add_energy_matching
3022	4.888	the_feel_felt_found+ownership_language+warmth_injection	discard	add_warmth_injection
3023	5.075	the_feel_felt_found+ownership_language+warmth_injection	discard	add_warmth_injection
3024	5.325	the_feel_felt_found+ownership_language	discard	temp_0.95
3025	5.438	the_feel_felt_found+ownership_language	discard	tone_change
3026	5.338	the_feel_felt_found+ownership_language	discard	tone_change
3027	5.138	the_feel_felt_found+ownership_language	discard	tone_change
3028	4.888	the_feel_felt_found+validation_before_solution	discard	swap_ownership_language_for_validation_before_solution
3029	4.725	the_feel_felt_found	discard	crossover
3030	5.125	the_feel_felt_found+ownership_language	discard	temp_0.70
3031	5.237	the_feel_felt_found+ownership_language	discard	crossover
3032	5.450	the_feel_felt_found+ownership_language	discard	temp_0.90
3033	4.825	the_feel_felt_found+ownership_language+casual_professionalism	discard	add_casual_professionalism
3034	5.037	ownership_language+validation_before_solution	discard	swap_the_feel_felt_found_for_validation_before_solution
3035	5.450	the_feel_felt_found+ownership_language+energy_matching	discard	add_energy_matching
3036	5.550	the_feel_felt_found+ownership_language	discard	temp_0.95
3037	5.312	the_feel_felt_found+ownership_language	discard	tone_change
3038	4.725	the_feel_felt_found+ownership_language	discard	crossover
3039	5.013	the_feel_felt_found+ownership_language+concrete_next_steps	discard	add_concrete_next_steps
3040	4.925	the_feel_felt_found+ownership_language	discard	tone_change
3041	4.925	the_feel_felt_found+ownership_language+strategic_agreement	discard	add_strategic_agreement
3042	5.325	the_feel_felt_found+emotional_labeling	discard	swap_ownership_language_for_emotional_labeling
3043	4.613	the_feel_felt_found+ownership_language+casual_professionalism	discard	add_casual_professionalism
3044	5.425	the_feel_felt_found	discard	remove_ownership_language
3045	4.925	the_feel_felt_found+ownership_language	discard	crossover
3046	5.450	the_feel_felt_found+ownership_language	discard	tone_change
3047	5.138	the_feel_felt_found+proactive_extras	discard	swap_ownership_language_for_proactive_extras
3048	5.325	the_feel_felt_found+ownership_language	discard	crossover
3049	5.138	the_feel_felt_found+ownership_language	discard	crossover
3050	5.237	none	discard	crossover
3051	5.037	the_feel_felt_found+ownership_language	discard	tone_change
3052	5.325	the_feel_felt_found+ownership_language+validation_before_solution	discard	add_validation_before_solution
3053	5.425	none	discard	crossover
3054	5.200	the_feel_felt_found	discard	crossover
3055	5.425	ownership_language+never_say_calm_down	discard	swap_the_feel_felt_found_for_never_say_calm_down
3056	5.138	the_feel_felt_found+ownership_language+casual_professionalism	discard	add_casual_professionalism
3057	5.450	ownership_language+concrete_next_steps	discard	swap_the_feel_felt_found_for_concrete_next_steps
3058	5.450	the_feel_felt_found+ownership_language+personal_touch	discard	add_personal_touch
3059	5.550	ownership_language	discard	remove_the_feel_felt_found
3060	5.450	the_feel_felt_found+ownership_language	discard	temp_0.70
3061	5.325	the_feel_felt_found	discard	crossover
3062	4.888	ownership_language	discard	crossover
3063	5.350	the_feel_felt_found+ownership_language	discard	crossover
3064	5.237	the_feel_felt_found+ownership_language	discard	tone_change
3065	5.450	the_feel_felt_found	discard	crossover
3066	5.350	the_feel_felt_found+strategic_agreement	discard	swap_ownership_language_for_strategic_agreement
3067	5.113	the_feel_felt_found+never_say_calm_down	discard	swap_ownership_language_for_never_say_calm_down
3068	5.450	the_feel_felt_found+ownership_language	discard	tone_change
3069	5.138	the_feel_felt_found+ownership_language	discard	crossover
3070	4.713	the_feel_felt_found+validation_before_solution	discard	swap_ownership_language_for_validation_before_solution
3071	5.550	the_feel_felt_found+ownership_language+mirroring	discard	add_mirroring
3072	5.550	the_feel_felt_found+ownership_language	discard	tone_change
3073	5.112	the_feel_felt_found+ownership_language	discard	tone_change
3074	5.237	the_feel_felt_found+ownership_language	discard	temp_0.85
3075	5.112	the_feel_felt_found+ownership_language+strategic_agreement	discard	add_strategic_agreement
3076	5.237	the_feel_felt_found	discard	remove_ownership_language
3077	5.338	the_feel_felt_found+ownership_language+genuine_admission	discard	add_genuine_admission
3078	5.450	the_feel_felt_found+ownership_language	discard	tone_change
3079	5.450	the_feel_felt_found+ownership_language+strategic_agreement	discard	add_strategic_agreement
3080	5.138	the_feel_felt_found+ownership_language	discard	temp_0.85
3081	5.550	ownership_language+casual_professionalism	discard	swap_the_feel_felt_found_for_casual_professionalism
3082	5.250	the_feel_felt_found+ownership_language+strategic_agreement	discard	add_strategic_agreement
3083	5.138	the_feel_felt_found+ownership_language	discard	crossover
3084	5.237	ownership_language+personal_touch	discard	swap_the_feel_felt_found_for_personal_touch
3085	5.013	the_feel_felt_found+validation_before_solution	discard	swap_ownership_language_for_validation_before_solution
3086	5.525	the_feel_felt_found+ownership_language	discard	temp_0.70
3087	5.138	the_feel_felt_found+proactive_extras	discard	swap_ownership_language_for_proactive_extras
3088	5.550	the_feel_felt_found+ownership_language+never_say_calm_down	discard	add_never_say_calm_down
3089	5.550	ownership_language	discard	crossover
3090	5.425	the_feel_felt_found+ownership_language+mirroring	discard	add_mirroring
3091	5.450	the_feel_felt_found+ownership_language	discard	crossover
3092	5.350	the_feel_felt_found+ownership_language+strategic_agreement	discard	add_strategic_agreement
3093	5.425	the_feel_felt_found+ownership_language	discard	temp_0.70
3094	5.650	the_feel_felt_found+ownership_language	discard	crossover
3095	5.338	the_feel_felt_found+ownership_language+genuine_admission	discard	add_genuine_admission
3096	5.125	the_feel_felt_found	discard	crossover
3097	5.325	ownership_language	discard	crossover
