generation	eq_score	techniques	status	description
8077	4.800	the_feel_felt_found+ownership_language+emotional_labeling	discard	add_emotional_labeling
8078	5.425	ownership_language+personal_touch	discard	swap_the_feel_felt_found_for_personal_touch
8079	5.138	the_feel_felt_found	discard	remove_ownership_language
8080	4.700	the_feel_felt_found+ownership_language	discard	tone_change
8081	5.325	the_feel_felt_found+ownership_language	discard	tone_change
8082	5.450	the_feel_felt_found	discard	remove_ownership_language
8083	5.138	ownership_language	discard	crossover
8084	4.513	the_feel_felt_found+ownership_language	discard	tone_change
8085	5.325	the_feel_felt_found+ownership_language	discard	crossover
8086	5.237	the_feel_felt_found+proactive_extras	discard	swap_ownership_language_for_proactive_extras
8087	5.438	the_feel_felt_found+ownership_language+mirroring	discard	add_mirroring
8088	5.750	the_feel_felt_found	discard	crossover
8089	5.550	the_feel_felt_found+ownership_language+emotional_labeling	discard	add_emotional_labeling
8090	5.350	the_feel_felt_found+ownership_language+never_say_calm_down	discard	add_never_say_calm_down
8091	4.800	the_feel_felt_found+ownership_language+personal_touch	discard	add_personal_touch
8092	5.325	ownership_language+warmth_injection	discard	swap_the_feel_felt_found_for_warmth_injection
8093	5.137	the_feel_felt_found+ownership_language+mirroring	discard	add_mirroring
8094	5.138	the_feel_felt_found	discard	crossover
8095	5.112	the_feel_felt_found+ownership_language+proactive_extras	discard	add_proactive_extras
8096	5.325	the_feel_felt_found+ownership_language+never_say_calm_down	discard	add_never_say_calm_down
8097	5.138	the_feel_felt_found+ownership_language+strategic_agreement	discard	add_strategic_agreement
8098	5.038	the_feel_felt_found+ownership_language	discard	crossover
8099	5.550	the_feel_felt_found+ownership_language	discard	temp_0.70
8100	5.138	the_feel_felt_found+ownership_language+genuine_admission	discard	add_genuine_admission
8101	5.237	the_feel_felt_found+ownership_language	discard	tone_change
8102	5.438	the_feel_felt_found+ownership_language+energy_matching	discard	add_energy_matching
8103	5.013	the_feel_felt_found+warmth_injection	discard	swap_ownership_language_for_warmth_injection
8104	4.912	ownership_language	discard	crossover
8105	5.450	the_feel_felt_found+ownership_language+mirroring	discard	add_mirroring
8106	5.450	the_feel_felt_found+ownership_language	discard	crossover
8107	4.925	ownership_language+proactive_extras	discard	swap_the_feel_felt_found_for_proactive_extras
8108	5.013	ownership_language+mirroring	discard	swap_the_feel_felt_found_for_mirroring
8109	5.013	ownership_language+casual_professionalism	discard	swap_the_feel_felt_found_for_casual_professionalism
8110	5.138	ownership_language+warmth_injection	discard	swap_the_feel_felt_found_for_warmth_injection
8111	5.237	the_feel_felt_found+ownership_language+genuine_admission	discard	add_genuine_admission
8112	4.925	the_feel_felt_found+ownership_language	discard	tone_change
8113	5.200	the_feel_felt_found+ownership_language	discard	tone_change
8114	5.338	ownership_language+genuine_admission	discard	swap_the_feel_felt_found_for_genuine_admission
8115	4.888	the_feel_felt_found+ownership_language	discard	temp_0.65
8116	5.425	the_feel_felt_found	discard	crossover
8117	5.013	the_feel_felt_found+proactive_extras	discard	swap_ownership_language_for_proactive_extras
8118	5.138	none	discard	crossover
8119	5.550	the_feel_felt_found+ownership_language+energy_matching	discard	add_energy_matching
8120	5.425	the_feel_felt_found+ownership_language	discard	crossover
8121	5.225	the_feel_felt_found+emotional_labeling	discard	swap_ownership_language_for_emotional_labeling
8122	5.450	ownership_language+proactive_extras	discard	swap_the_feel_felt_found_for_proactive_extras
8123	5.237	the_feel_felt_found+ownership_language+mirroring	discard	add_mirroring
8124	5.350	the_feel_felt_found+ownership_language+warmth_injection	discard	add_warmth_injection
8125	5.325	the_feel_felt_found+ownership_language	discard	temp_0.85
8126	5.450	the_feel_felt_found+ownership_language	discard	crossover
8127	4.938	ownership_language	discard	crossover
8128	4.825	the_feel_felt_found	discard	crossover
8129	5.200	the_feel_felt_found+ownership_language	discard	crossover
8130	5.450	the_feel_felt_found+ownership_language	discard	tone_change
8131	5.225	the_feel_felt_found+ownership_language	discard	tone_change
8132	5.325	none	discard	crossover
8133	4.513	ownership_language	discard	remove_the_feel_felt_found
8134	5.013	the_feel_felt_found+ownership_language	discard	tone_change
8135	5.550	the_feel_felt_found	discard	crossover
8136	4.700	the_feel_felt_found+ownership_language	discard	tone_change
8137	5.213	the_feel_felt_found+ownership_language	discard	tone_change
8138	5.425	the_feel_felt_found	discard	remove_ownership_language
8139	5.338	ownership_language	discard	remove_the_feel_felt_found
8140	5.450	the_feel_felt_found	discard	crossover
8141	5.350	the_feel_felt_found+ownership_language	discard	temp_0.90
8142	5.113	the_feel_felt_found+ownership_language+casual_professionalism	discard	add_casual_professionalism
8143	5.250	the_feel_felt_found	discard	crossover
8144	5.138	the_feel_felt_found+ownership_language	discard	tone_change
8145	5.012	ownership_language	discard	remove_the_feel_felt_found
8146	5.325	the_feel_felt_found	discard	crossover
8147	5.137	the_feel_felt_found+mirroring	discard	swap_ownership_language_for_mirroring
8148	5.112	ownership_language+emotional_labeling	discard	swap_the_feel_felt_found_for_emotional_labeling
8149	5.137	the_feel_felt_found+ownership_language+personal_touch	discard	add_personal_touch
8150	5.300	the_feel_felt_found+ownership_language	discard	tone_change
8151	5.425	the_feel_felt_found+ownership_language	discard	temp_0.65
8152	5.650	the_feel_felt_found+ownership_language	discard	temp_0.85
8153	5.450	the_feel_felt_found+ownership_language	discard	crossover
8154	5.325	the_feel_felt_found+ownership_language	discard	temp_0.75
8155	5.450	the_feel_felt_found	discard	crossover
8156	5.750	the_feel_felt_found+ownership_language	discard	crossover
8157	5.550	ownership_language	discard	crossover
8158	5.350	the_feel_felt_found+ownership_language+energy_matching	discard	add_energy_matching
8159	5.450	the_feel_felt_found	discard	remove_ownership_language
8160	5.425	the_feel_felt_found+ownership_language+energy_matching	discard	add_energy_matching
8161	5.013	the_feel_felt_found+ownership_language+concrete_next_steps	discard	add_concrete_next_steps
8162	5.138	the_feel_felt_found+validation_before_solution	discard	swap_ownership_language_for_validation_before_solution
8163	4.888	the_feel_felt_found	discard	crossover
8164	5.550	the_feel_felt_found+ownership_language	discard	tone_change
8165	5.325	the_feel_felt_found+ownership_language	discard	crossover
8166	4.888	the_feel_felt_found+ownership_language	discard	tone_change
8167	5.525	the_feel_felt_found+ownership_language+concrete_next_steps	discard	add_concrete_next_steps
8168	4.912	ownership_language+mirroring	discard	swap_the_feel_felt_found_for_mirroring
8169	5.037	ownership_language	discard	remove_the_feel_felt_found
8170	5.438	the_feel_felt_found+ownership_language	discard	tone_change
8171	5.550	the_feel_felt_found+ownership_language	discard	tone_change
8172	5.100	the_feel_felt_found+ownership_language	discard	temp_0.95
8173	5.550	the_feel_felt_found	discard	remove_ownership_language
8174	5.337	the_feel_felt_found	discard	crossover
8175	5.325	the_feel_felt_found+ownership_language+strategic_agreement	discard	add_strategic_agreement
8176	5.138	the_feel_felt_found+ownership_language+concrete_next_steps	discard	add_concrete_next_steps
8177	5.425	ownership_language+emotional_labeling	discard	swap_the_feel_felt_found_for_emotional_labeling
8178	5.237	ownership_language	discard	crossover
8179	5.138	the_feel_felt_found+ownership_language	discard	tone_change
8180	4.513	the_feel_felt_found	discard	remove_ownership_language
8181	5.325	the_feel_felt_found+personal_touch	discard	swap_ownership_language_for_personal_touch
8182	5.237	the_feel_felt_found+ownership_language+validation_before_solution	discard	add_validation_before_solution
8183	4.888	the_feel_felt_found+ownership_language	discard	crossover
8184	5.550	the_feel_felt_found+ownership_language	discard	crossover
8185	5.237	the_feel_felt_found	discard	crossover
8186	5.200	the_feel_felt_found+ownership_language	discard	temp_0.95
8187	5.237	the_feel_felt_found	discard	remove_ownership_language
8188	5.450	the_feel_felt_found+ownership_language	discard	temp_0.70
8189	5.350	the_feel_felt_found+ownership_language	discard	temp_0.70
8190	5.425	none	discard	crossover
8191	5.450	the_feel_felt_found+validation_before_solution	discard	swap_ownership_language_for_validation_before_solution
8192	5.650	the_feel_felt_found+ownership_language+validation_before_solution	discard	add_validation_before_solution
8193	5.237	the_feel_felt_found+ownership_language	discard	tone_change
8194	5.325	the_feel_felt_found+ownership_language	discard	crossover
8195	4.700	the_feel_felt_found	discard	crossover
8196	5.550	the_feel_felt_found+emotional_labeling	discard	swap_ownership_language_for_emotional_labeling
8197	4.825	the_feel_felt_found+proactive_extras	discard	swap_ownership_language_for_proactive_extras
8198	4.900	the_feel_felt_found+ownership_language+proactive_extras	discard	add_proactive_extras
8199	5.025	the_feel_felt_found+concrete_next_steps	discard	swap_ownership_language_for_concrete_next_steps
8200	4.575	the_feel_felt_found	discard	remove_ownership_language
8201	5.325	the_feel_felt_found+ownership_language	discard	crossover
8202	5.138	the_feel_felt_found	discard	remove_ownership_language
8203	5.450	the_feel_felt_found+ownership_language+mirroring	discard	add_mirroring
8204	5.325	ownership_language+validation_before_solution	discard	swap_the_feel_felt_found_for_validation_before_solution
8205	4.925	the_feel_felt_found+ownership_language	discard	tone_change
8206	5.237	the_feel_felt_found	discard	remove_ownership_language
8207	5.100	the_feel_felt_found+ownership_language	discard	crossover
8208	5.112	the_feel_felt_found+ownership_language	discard	crossover
8209	4.975	the_feel_felt_found+ownership_language	discard	temp_0.65
8210	4.987	the_feel_felt_found+ownership_language	discard	crossover
8211	4.888	the_feel_felt_found+ownership_language	discard	crossover
8212	5.550	the_feel_felt_found+warmth_injection	discard	swap_ownership_language_for_warmth_injection
8213	5.237	the_feel_felt_found+ownership_language+strategic_agreement	discard	add_strategic_agreement
8214	5.113	the_feel_felt_found+ownership_language	discard	tone_change
8215	5.013	the_feel_felt_found+ownership_language+energy_matching	discard	add_energy_matching
8216	5.325	the_feel_felt_found+ownership_language+strategic_agreement	discard	add_strategic_agreement
8217	5.550	the_feel_felt_found+ownership_language+proactive_extras	discard	add_proactive_extras
8218	5.113	the_feel_felt_found+ownership_language+concrete_next_steps	discard	add_concrete_next_steps
8219	5.200	the_feel_felt_found+ownership_language	discard	tone_change
8220	5.450	the_feel_felt_found+ownership_language	discard	tone_change
8221	5.137	the_feel_felt_found+ownership_language	discard	crossover
8222	5.300	ownership_language	discard	crossover
8223	5.113	the_feel_felt_found+ownership_language	discard	temp_0.90
8224	5.325	the_feel_felt_found	discard	remove_ownership_language
8225	4.825	the_feel_felt_found+ownership_language+personal_touch	discard	add_personal_touch
8226	5.113	the_feel_felt_found+ownership_language+genuine_admission	discard	add_genuine_admission
8227	5.325	the_feel_felt_found+ownership_language	discard	crossover
8228	5.325	the_feel_felt_found+ownership_language	discard	temp_0.70
8229	4.912	the_feel_felt_found+ownership_language+validation_before_solution	discard	add_validation_before_solution
8230	5.237	the_feel_felt_found+ownership_language+concrete_next_steps	discard	add_concrete_next_steps
8231	5.425	the_feel_felt_found+ownership_language+casual_professionalism	discard	add_casual_professionalism
8232	5.013	the_feel_felt_found+validation_before_solution	discard	swap_ownership_language_for_validation_before_solution
8233	5.300	the_feel_felt_found+warmth_injection	discard	swap_ownership_language_for_warmth_injection
8234	5.550	the_feel_felt_found+ownership_language+validation_before_solution	discard	add_validation_before_solution
8235	5.550	the_feel_felt_found+ownership_language	discard	crossover
8236	5.013	the_feel_felt_found	discard	crossover
8237	5.400	none	discard	crossover
8238	5.425	the_feel_felt_found+ownership_language	discard	tone_change
8239	5.237	ownership_language+mirroring	discard	swap_the_feel_felt_found_for_mirroring
8240	5.138	the_feel_felt_found+proactive_extras	discard	swap_ownership_language_for_proactive_extras
8241	5.550	the_feel_felt_found+ownership_language+emotional_labeling	discard	add_emotional_labeling
8242	5.525	ownership_language	discard	crossover
8243	5.425	the_feel_felt_found+ownership_language	discard	tone_change
8244	5.138	the_feel_felt_found+ownership_language	discard	temp_0.65
8245	5.425	the_feel_felt_found+ownership_language	discard	temp_0.75
8246	5.650	ownership_language	discard	remove_the_feel_felt_found
8247	5.338	the_feel_felt_found+ownership_language+casual_professionalism	discard	add_casual_professionalism
8248	4.825	the_feel_felt_found+ownership_language	discard	tone_change
8249	5.425	the_feel_felt_found+ownership_language+proactive_extras	discard	add_proactive_extras
8250	5.550	the_feel_felt_found	discard	remove_ownership_language
8251	5.450	the_feel_felt_found+ownership_language	discard	tone_change
8252	4.925	the_feel_felt_found+mirroring	discard	swap_ownership_language_for_mirroring
8253	5.650	ownership_language	discard	remove_the_feel_felt_found
8254	5.450	ownership_language+proactive_extras	discard	swap_the_feel_felt_found_for_proactive_extras
8255	4.513	the_feel_felt_found+strategic_agreement	discard	swap_ownership_language_for_strategic_agreement
8256	5.037	the_feel_felt_found+ownership_language	discard	crossover
8257	5.237	the_feel_felt_found+mirroring	discard	swap_ownership_language_for_mirroring
8258	5.137	the_feel_felt_found+warmth_injection	discard	swap_ownership_language_for_warmth_injection
8259	5.450	the_feel_felt_found+ownership_language	discard	tone_change
8260	5.550	the_feel_felt_found+ownership_language	discard	tone_change
8261	5.550	the_feel_felt_found+ownership_language	discard	temp_0.85
8262	5.425	the_feel_felt_found+ownership_language+proactive_extras	discard	add_proactive_extras
8263	5.550	the_feel_felt_found+ownership_language+strategic_agreement	discard	add_strategic_agreement
8264	5.200	the_feel_felt_found+ownership_language	discard	tone_change
8265	4.900	the_feel_felt_found+ownership_language	discard	crossover
8266	5.450	the_feel_felt_found+ownership_language	discard	tone_change
8267	5.550	the_feel_felt_found+ownership_language+strategic_agreement	discard	add_strategic_agreement
8268	5.450	the_feel_felt_found+ownership_language	discard	temp_0.65
8269	5.238	ownership_language	discard	crossover
8270	5.450	the_feel_felt_found+ownership_language	discard	temp_0.95
8271	5.237	the_feel_felt_found+ownership_language	discard	crossover
8272	5.337	the_feel_felt_found+ownership_language	discard	temp_0.95
8273	5.200	ownership_language	discard	remove_the_feel_felt_found
8274	4.513	the_feel_felt_found+genuine_admission	discard	swap_ownership_language_for_genuine_admission
8275	5.200	the_feel_felt_found+ownership_language+proactive_extras	discard	add_proactive_extras
8276	5.550	the_feel_felt_found+ownership_language+warmth_injection	discard	add_warmth_injection
8277	5.450	the_feel_felt_found+ownership_language	discard	tone_change
8278	5.450	ownership_language	discard	remove_the_feel_felt_found
8279	5.137	ownership_language+casual_professionalism	discard	swap_the_feel_felt_found_for_casual_professionalism
8280	4.575	ownership_language	discard	crossover
8281	5.550	the_feel_felt_found+ownership_language	discard	tone_change
8282	5.350	ownership_language	discard	crossover
8283	5.650	the_feel_felt_found+ownership_language	discard	tone_change
8284	5.550	ownership_language+mirroring	discard	swap_the_feel_felt_found_for_mirroring
8285	5.300	ownership_language	discard	remove_the_feel_felt_found
8286	5.425	ownership_language+energy_matching	discard	swap_the_feel_felt_found_for_energy_matching
8287	5.237	the_feel_felt_found+ownership_language	discard	temp_0.85
8288	5.238	the_feel_felt_found+ownership_language	discard	temp_0.70
8289	5.450	the_feel_felt_found+ownership_language	discard	tone_change
8290	5.100	the_feel_felt_found+ownership_language+concrete_next_steps	discard	add_concrete_next_steps
8291	5.013	the_feel_felt_found+ownership_language	discard	crossover
8292	5.325	the_feel_felt_found	discard	remove_ownership_language
8293	5.138	ownership_language+genuine_admission	discard	swap_the_feel_felt_found_for_genuine_admission
8294	4.912	the_feel_felt_found+mirroring	discard	swap_ownership_language_for_mirroring
8295	4.825	the_feel_felt_found+ownership_language	discard	tone_change
8296	5.113	the_feel_felt_found+ownership_language	discard	tone_change
8297	5.425	the_feel_felt_found+ownership_language	discard	tone_change
8298	5.425	the_feel_felt_found+ownership_language+never_say_calm_down	discard	add_never_say_calm_down
8299	5.237	the_feel_felt_found+ownership_language+energy_matching	discard	add_energy_matching
8300	5.200	the_feel_felt_found+ownership_language	discard	temp_0.95
8301	5.013	ownership_language+casual_professionalism	discard	swap_the_feel_felt_found_for_casual_professionalism
8302	5.138	ownership_language+energy_matching	discard	swap_the_feel_felt_found_for_energy_matching
8303	5.237	the_feel_felt_found+ownership_language+personal_touch	discard	add_personal_touch
8304	5.450	the_feel_felt_found+ownership_language	discard	temp_0.95
8305	5.113	the_feel_felt_found+ownership_language	discard	tone_change
8306	5.550	the_feel_felt_found+ownership_language	discard	tone_change
8307	4.612	the_feel_felt_found+ownership_language	discard	temp_0.75
8308	5.425	the_feel_felt_found+ownership_language	discard	temp_0.75
8309	5.112	the_feel_felt_found+ownership_language+mirroring	discard	add_mirroring
8310	5.138	the_feel_felt_found+ownership_language	discard	crossover
8311	5.112	the_feel_felt_found+ownership_language	discard	tone_change
8312	5.100	the_feel_felt_found+ownership_language	discard	crossover
8313	4.700	the_feel_felt_found+ownership_language	discard	tone_change
8314	4.825	the_feel_felt_found+never_say_calm_down	discard	swap_ownership_language_for_never_say_calm_down
8315	5.013	the_feel_felt_found+ownership_language+never_say_calm_down	discard	add_never_say_calm_down
8316	5.112	the_feel_felt_found+energy_matching	discard	swap_ownership_language_for_energy_matching
8317	5.237	the_feel_felt_found+ownership_language+casual_professionalism	discard	add_casual_professionalism
8318	5.138	the_feel_felt_found+ownership_language+proactive_extras	discard	add_proactive_extras
8319	4.788	the_feel_felt_found+ownership_language	discard	temp_0.95
8320	5.138	the_feel_felt_found+ownership_language	discard	tone_change
8321	5.325	the_feel_felt_found	discard	remove_ownership_language
8322	5.325	the_feel_felt_found+ownership_language+emotional_labeling	discard	add_emotional_labeling
8323	5.425	none	discard	crossover
8324	5.138	ownership_language	discard	remove_the_feel_felt_found
8325	5.450	the_feel_felt_found+ownership_language	discard	crossover
8326	5.325	the_feel_felt_found	discard	remove_ownership_language
8327	5.425	the_feel_felt_found+ownership_language+concrete_next_steps	discard	add_concrete_next_steps
8328	5.438	the_feel_felt_found+ownership_language+emotional_labeling	discard	add_emotional_labeling
8329	5.300	the_feel_felt_found+ownership_language	discard	temp_0.95
8330	5.138	the_feel_felt_found+ownership_language	discard	crossover
8331	5.350	the_feel_felt_found+ownership_language+mirroring	discard	add_mirroring
8332	5.425	the_feel_felt_found+ownership_language+energy_matching	discard	add_energy_matching
8333	4.825	the_feel_felt_found+ownership_language	discard	tone_change
8334	5.100	the_feel_felt_found+ownership_language	discard	tone_change
8335	4.700	the_feel_felt_found	discard	remove_ownership_language
8336	5.138	the_feel_felt_found+validation_before_solution	discard	swap_ownership_language_for_validation_before_solution
8337	5.650	the_feel_felt_found+ownership_language+personal_touch	discard	add_personal_touch
8338	4.888	ownership_language+personal_touch	discard	swap_the_feel_felt_found_for_personal_touch
8339	5.550	ownership_language	discard	remove_the_feel_felt_found
8340	5.138	the_feel_felt_found+ownership_language+energy_matching	discard	add_energy_matching
8341	5.112	the_feel_felt_found+ownership_language	discard	crossover
8342	4.700	the_feel_felt_found+ownership_language	discard	temp_0.70
8343	5.550	ownership_language	discard	crossover
8344	5.237	the_feel_felt_found+ownership_language	discard	tone_change
8345	4.925	the_feel_felt_found+ownership_language+never_say_calm_down	discard	add_never_say_calm_down
8346	5.338	ownership_language	discard	remove_the_feel_felt_found
8347	5.138	the_feel_felt_found+ownership_language+concrete_next_steps	discard	add_concrete_next_steps
8348	5.138	ownership_language+proactive_extras	discard	swap_the_feel_felt_found_for_proactive_extras
8349	5.350	the_feel_felt_found+ownership_language	discard	temp_0.95
8350	5.225	the_feel_felt_found+ownership_language+personal_touch	discard	add_personal_touch
8351	5.025	the_feel_felt_found+ownership_language	discard	tone_change
8352	4.725	the_feel_felt_found+ownership_language	discard	crossover
8353	5.112	ownership_language	discard	crossover
8354	5.325	the_feel_felt_found+ownership_language+proactive_extras	discard	add_proactive_extras
8355	5.325	the_feel_felt_found+ownership_language	discard	temp_0.75
8356	5.450	the_feel_felt_found+ownership_language+genuine_admission	discard	add_genuine_admission
