generation	eq_score	techniques	status	description
579	5.550	ownership_language+emotional_labeling	discard	swap_the_feel_felt_found_for_emotional_labeling
580	5.450	the_feel_felt_found	discard	crossover
581	5.550	the_feel_felt_found+ownership_language+genuine_admission	discard	add_genuine_admission
582	5.112	ownership_language+casual_professionalism	discard	swap_the_feel_felt_found_for_casual_professionalism
583	5.325	the_feel_felt_found+ownership_language	discard	temp_0.65
584	5.237	the_feel_felt_found	discard	crossover
585	5.237	ownership_language	discard	remove_the_feel_felt_found
586	5.037	the_feel_felt_found+ownership_language+personal_touch	discard	add_personal_touch
587	5.138	the_feel_felt_found+personal_touch	discard	swap_ownership_language_for_personal_touch
588	5.550	the_feel_felt_found+ownership_language+energy_matching	discard	add_energy_matching
589	5.325	the_feel_felt_found+ownership_language	discard	temp_0.70
590	5.013	the_feel_felt_found+ownership_language+proactive_extras	discard	add_proactive_extras
591	5.325	the_feel_felt_found+ownership_language	discard	crossover
592	4.988	the_feel_felt_found+ownership_language	discard	tone_change
593	5.325	the_feel_felt_found+ownership_language	discard	tone_change
594	5.450	the_feel_felt_found+warmth_injection	discard	swap_ownership_language_for_warmth_injection
595	5.350	the_feel_felt_found	discard	remove_ownership_language
596	5.075	the_feel_felt_found+ownership_language+genuine_admission	discard	add_genuine_admission
597	5.450	the_feel_felt_found+ownership_language	discard	tone_change
598	5.650	the_feel_felt_found+ownership_language+genuine_admission	discard	add_genuine_admission
599	5.450	ownership_language+casual_professionalism	discard	swap_the_feel_felt_found_for_casual_professionalism
600	5.238	the_feel_felt_found+ownership_language	discard	tone_change
601	5.112	the_feel_felt_found+ownership_language	discard	temp_0.75
602	5.325	the_feel_felt_found+ownership_language	discard	tone_change
603	5.350	the_feel_felt_found+ownership_language+strategic_agreement	discard	add_strategic_agreement
604	4.925	the_feel_felt_found+ownership_language	discard	tone_change
605	5.200	the_feel_felt_found+ownership_language+warmth_injection	discard	add_warmth_injection
606	5.237	the_feel_felt_found+ownership_language+mirroring	discard	add_mirroring
607	5.325	ownership_language	discard	crossover
608	5.350	the_feel_felt_found+ownership_language+mirroring	discard	add_mirroring
609	5.237	ownership_language+genuine_admission	discard	swap_the_feel_felt_found_for_genuine_admission
610	4.925	the_feel_felt_found+ownership_language	discard	tone_change
611	5.237	the_feel_felt_found	discard	remove_ownership_language
612	5.525	the_feel_felt_found+ownership_language	discard	temp_0.65
613	4.612	ownership_language	discard	remove_the_feel_felt_found
614	4.825	the_feel_felt_found+ownership_language+casual_professionalism	discard	add_casual_professionalism
615	5.350	the_feel_felt_found+ownership_language	discard	crossover
616	4.913	the_feel_felt_found+mirroring	discard	swap_ownership_language_for_mirroring
617	5.550	the_feel_felt_found+ownership_language+energy_matching	discard	add_energy_matching
618	5.550	the_feel_felt_found+ownership_language+personal_touch	discard	add_personal_touch
619	5.325	the_feel_felt_found+strategic_agreement	discard	swap_ownership_language_for_strategic_agreement
620	4.700	the_feel_felt_found+ownership_language	discard	crossover
621	5.650	the_feel_felt_found+ownership_language+casual_professionalism	discard	add_casual_professionalism
622	5.200	the_feel_felt_found+ownership_language	discard	temp_0.65
623	5.138	the_feel_felt_found+ownership_language	discard	tone_change
624	5.325	the_feel_felt_found+ownership_language	discard	crossover
625	5.325	the_feel_felt_found+ownership_language	discard	temp_0.75
626	4.825	the_feel_felt_found+ownership_language	discard	crossover
627	5.450	the_feel_felt_found+ownership_language	discard	tone_change
628	5.350	the_feel_felt_found+concrete_next_steps	discard	swap_ownership_language_for_concrete_next_steps
629	5.338	none	discard	crossover
630	4.725	ownership_language+casual_professionalism	discard	swap_the_feel_felt_found_for_casual_professionalism
631	5.138	ownership_language+personal_touch	discard	swap_the_feel_felt_found_for_personal_touch
632	5.325	the_feel_felt_found+ownership_language	discard	temp_0.75
633	5.650	the_feel_felt_found+ownership_language	discard	temp_0.85
634	5.138	the_feel_felt_found+strategic_agreement	discard	swap_ownership_language_for_strategic_agreement
635	5.650	the_feel_felt_found+ownership_language+concrete_next_steps	discard	add_concrete_next_steps
636	4.987	ownership_language+mirroring	discard	swap_the_feel_felt_found_for_mirroring
637	5.025	the_feel_felt_found+ownership_language+personal_touch	discard	add_personal_touch
638	5.325	the_feel_felt_found+ownership_language+energy_matching	discard	add_energy_matching
639	5.325	the_feel_felt_found+ownership_language+personal_touch	discard	add_personal_touch
640	5.450	the_feel_felt_found+ownership_language	discard	tone_change
641	5.237	the_feel_felt_found+ownership_language	discard	temp_0.90
642	5.112	the_feel_felt_found+ownership_language+strategic_agreement	discard	add_strategic_agreement
643	5.525	the_feel_felt_found+ownership_language+proactive_extras	discard	add_proactive_extras
644	4.925	the_feel_felt_found+mirroring	discard	swap_ownership_language_for_mirroring
645	5.450	the_feel_felt_found+ownership_language	discard	crossover
646	5.037	ownership_language	discard	crossover
647	5.425	the_feel_felt_found+ownership_language+validation_before_solution	discard	add_validation_before_solution
648	4.913	the_feel_felt_found+ownership_language	discard	tone_change
649	5.237	the_feel_felt_found+ownership_language	discard	temp_0.65
650	5.425	ownership_language+strategic_agreement	discard	swap_the_feel_felt_found_for_strategic_agreement
651	5.525	ownership_language	discard	remove_the_feel_felt_found
652	5.550	ownership_language+casual_professionalism	discard	swap_the_feel_felt_found_for_casual_professionalism
653	5.013	the_feel_felt_found+ownership_language+genuine_admission	discard	add_genuine_admission
654	5.550	the_feel_felt_found+ownership_language	discard	temp_0.85
655	5.237	ownership_language+never_say_calm_down	discard	swap_the_feel_felt_found_for_never_say_calm_down
656	4.825	the_feel_felt_found+ownership_language+genuine_admission	discard	add_genuine_admission
657	5.438	ownership_language	discard	remove_the_feel_felt_found
658	5.112	the_feel_felt_found+ownership_language+energy_matching	discard	add_energy_matching
659	5.425	the_feel_felt_found+ownership_language	discard	tone_change
660	5.138	the_feel_felt_found+ownership_language	discard	tone_change
661	5.138	the_feel_felt_found+ownership_language	discard	crossover
662	5.238	ownership_language	discard	crossover
663	5.225	the_feel_felt_found+ownership_language	discard	tone_change
664	5.300	the_feel_felt_found+ownership_language	discard	tone_change
665	5.350	the_feel_felt_found+ownership_language+genuine_admission	discard	add_genuine_admission
666	5.013	the_feel_felt_found+ownership_language	discard	crossover
667	5.138	the_feel_felt_found+ownership_language	discard	temp_0.70
668	5.338	the_feel_felt_found+ownership_language+proactive_extras	discard	add_proactive_extras
669	5.650	ownership_language+emotional_labeling	discard	swap_the_feel_felt_found_for_emotional_labeling
670	5.525	the_feel_felt_found+ownership_language	discard	tone_change
671	5.013	the_feel_felt_found+energy_matching	discard	swap_ownership_language_for_energy_matching
672	5.075	none	discard	crossover
673	5.400	the_feel_felt_found+ownership_language+never_say_calm_down	discard	add_never_say_calm_down
674	5.013	the_feel_felt_found+ownership_language	discard	tone_change
675	5.013	the_feel_felt_found+ownership_language+genuine_admission	discard	add_genuine_admission
676	5.425	the_feel_felt_found+ownership_language	discard	temp_0.70
677	4.925	ownership_language+proactive_extras	discard	swap_the_feel_felt_found_for_proactive_extras
678	5.237	the_feel_felt_found+ownership_language	discard	tone_change
679	5.450	the_feel_felt_found+ownership_language	discard	tone_change
680	5.237	ownership_language	discard	crossover
681	5.550	the_feel_felt_found+ownership_language+warmth_injection	discard	add_warmth_injection
682	5.550	the_feel_felt_found+ownership_language	discard	crossover
683	4.888	the_feel_felt_found+ownership_language+energy_matching	discard	add_energy_matching
684	5.238	the_feel_felt_found+energy_matching	discard	swap_ownership_language_for_energy_matching
685	5.113	the_feel_felt_found+ownership_language	discard	crossover
686	4.925	the_feel_felt_found+ownership_language	discard	tone_change
687	5.013	the_feel_felt_found+ownership_language+proactive_extras	discard	add_proactive_extras
688	5.038	ownership_language	discard	crossover
689	5.450	the_feel_felt_found+ownership_language	discard	temp_0.95
690	5.425	the_feel_felt_found+ownership_language	discard	crossover
691	5.112	the_feel_felt_found+ownership_language	discard	tone_change
692	5.138	the_feel_felt_found+ownership_language	discard	crossover
693	4.888	the_feel_felt_found	discard	crossover
694	5.450	the_feel_felt_found+ownership_language	discard	temp_0.85
695	5.138	ownership_language+never_say_calm_down	discard	swap_the_feel_felt_found_for_never_say_calm_down
696	5.112	the_feel_felt_found+ownership_language+casual_professionalism	discard	add_casual_professionalism
697	5.013	the_feel_felt_found+ownership_language	discard	temp_0.65
698	5.025	the_feel_felt_found+ownership_language	discard	tone_change
699	4.800	the_feel_felt_found+ownership_language+energy_matching	discard	add_energy_matching
700	4.913	ownership_language	discard	crossover
701	5.225	none	discard	crossover
702	5.213	the_feel_felt_found+ownership_language+genuine_admission	discard	add_genuine_admission
703	5.013	ownership_language	discard	remove_the_feel_felt_found
704	5.325	the_feel_felt_found	discard	crossover
705	4.575	ownership_language	discard	crossover
706	4.388	the_feel_felt_found+ownership_language	discard	crossover
707	5.325	the_feel_felt_found+mirroring	discard	swap_ownership_language_for_mirroring
708	5.112	none	discard	crossover
709	5.025	the_feel_felt_found+ownership_language	discard	tone_change
710	5.350	the_feel_felt_found+ownership_language+concrete_next_steps	discard	add_concrete_next_steps
711	5.325	the_feel_felt_found+never_say_calm_down	discard	swap_ownership_language_for_never_say_calm_down
712	5.238	ownership_language+genuine_admission	discard	swap_the_feel_felt_found_for_genuine_admission
713	4.925	the_feel_felt_found	discard	crossover
714	5.112	the_feel_felt_found	discard	remove_ownership_language
715	5.337	the_feel_felt_found+ownership_language	discard	temp_0.90
716	5.325	the_feel_felt_found	discard	remove_ownership_language
717	4.925	the_feel_felt_found+ownership_language	discard	crossover
718	5.112	the_feel_felt_found+never_say_calm_down	discard	swap_ownership_language_for_never_say_calm_down
719	5.013	the_feel_felt_found+ownership_language	discard	temp_0.75
720	5.013	ownership_language	discard	crossover
721	5.450	the_feel_felt_found+ownership_language	discard	tone_change
722	5.350	the_feel_felt_found+ownership_language+mirroring	discard	add_mirroring
723	5.237	ownership_language	discard	crossover
724	5.350	the_feel_felt_found+ownership_language	discard	tone_change
725	5.537	the_feel_felt_found+ownership_language	discard	crossover
726	5.325	the_feel_felt_found+ownership_language	discard	tone_change
727	5.237	the_feel_felt_found+ownership_language	discard	crossover
728	4.925	the_feel_felt_found	discard	crossover
729	5.650	the_feel_felt_found	discard	remove_ownership_language
730	5.450	the_feel_felt_found+ownership_language	discard	tone_change
731	5.425	the_feel_felt_found+mirroring	discard	swap_ownership_language_for_mirroring
732	5.013	the_feel_felt_found+ownership_language	discard	temp_0.85
733	5.450	the_feel_felt_found+ownership_language	discard	tone_change
734	5.237	the_feel_felt_found	discard	crossover
735	5.550	the_feel_felt_found+ownership_language	discard	temp_0.70
736	5.237	the_feel_felt_found+ownership_language	discard	tone_change
737	5.138	the_feel_felt_found+ownership_language	discard	tone_change
738	5.112	the_feel_felt_found+ownership_language	discard	tone_change
739	5.237	the_feel_felt_found+ownership_language	discard	crossover
740	5.138	the_feel_felt_found+emotional_labeling	discard	swap_ownership_language_for_emotional_labeling
741	5.237	the_feel_felt_found	discard	crossover
742	5.200	the_feel_felt_found+ownership_language	discard	tone_change
743	5.450	the_feel_felt_found+ownership_language+casual_professionalism	discard	add_casual_professionalism
744	4.613	the_feel_felt_found+never_say_calm_down	discard	swap_ownership_language_for_never_say_calm_down
745	4.512	the_feel_felt_found+ownership_language+proactive_extras	discard	add_proactive_extras
746	5.425	the_feel_felt_found+ownership_language	discard	crossover
747	5.112	the_feel_felt_found+ownership_language	discard	tone_change
748	5.013	the_feel_felt_found+ownership_language	discard	tone_change
749	5.450	the_feel_felt_found	discard	crossover
750	5.138	the_feel_felt_found+ownership_language	discard	temp_0.95
751	5.325	the_feel_felt_found+ownership_language+proactive_extras	discard	add_proactive_extras
752	5.525	the_feel_felt_found+ownership_language	discard	tone_change
753	5.550	the_feel_felt_found+casual_professionalism	discard	swap_ownership_language_for_casual_professionalism
754	5.138	ownership_language+proactive_extras	discard	swap_the_feel_felt_found_for_proactive_extras
755	5.525	the_feel_felt_found	discard	crossover
756	5.550	the_feel_felt_found	discard	crossover
757	5.325	the_feel_felt_found+ownership_language	discard	tone_change
758	5.037	the_feel_felt_found+ownership_language	discard	temp_0.65
759	5.338	the_feel_felt_found+ownership_language+strategic_agreement	discard	add_strategic_agreement
760	5.750	the_feel_felt_found+proactive_extras	discard	swap_ownership_language_for_proactive_extras
761	4.800	ownership_language	discard	crossover
762	5.350	the_feel_felt_found+ownership_language+warmth_injection	discard	add_warmth_injection
763	5.550	the_feel_felt_found+ownership_language	discard	temp_0.85
764	5.650	the_feel_felt_found+ownership_language+proactive_extras	discard	add_proactive_extras
765	5.325	the_feel_felt_found+ownership_language	discard	tone_change
766	5.550	the_feel_felt_found+proactive_extras	discard	swap_ownership_language_for_proactive_extras
767	5.450	the_feel_felt_found+ownership_language+personal_touch	discard	add_personal_touch
768	5.300	the_feel_felt_found+ownership_language+casual_professionalism	discard	add_casual_professionalism
769	5.338	the_feel_felt_found	discard	remove_ownership_language
770	4.888	the_feel_felt_found	discard	remove_ownership_language
771	5.550	the_feel_felt_found+ownership_language	discard	temp_0.85
772	5.650	ownership_language	discard	crossover
773	5.425	the_feel_felt_found+ownership_language+validation_before_solution	discard	add_validation_before_solution
774	5.138	the_feel_felt_found	discard	crossover
775	5.138	the_feel_felt_found+ownership_language	discard	tone_change
776	5.138	ownership_language+personal_touch	discard	swap_the_feel_felt_found_for_personal_touch
777	4.888	the_feel_felt_found+ownership_language+genuine_admission	discard	add_genuine_admission
778	4.825	the_feel_felt_found+casual_professionalism	discard	swap_ownership_language_for_casual_professionalism
779	5.450	the_feel_felt_found+ownership_language	discard	tone_change
780	5.325	the_feel_felt_found+ownership_language	discard	temp_0.65
781	5.013	the_feel_felt_found+ownership_language	discard	tone_change
782	5.550	the_feel_felt_found+ownership_language	discard	temp_0.95
783	4.988	the_feel_felt_found	discard	crossover
784	4.925	the_feel_felt_found	discard	crossover
785	5.225	the_feel_felt_found+ownership_language	discard	tone_change
786	5.013	the_feel_felt_found+ownership_language	discard	tone_change
787	5.200	the_feel_felt_found+ownership_language	discard	tone_change
788	5.450	the_feel_felt_found+ownership_language	discard	temp_0.90
789	5.450	the_feel_felt_found+ownership_language	discard	tone_change
790	5.237	the_feel_felt_found	discard	remove_ownership_language
791	5.325	ownership_language	discard	crossover
792	4.513	ownership_language+emotional_labeling	discard	swap_the_feel_felt_found_for_emotional_labeling
793	5.425	the_feel_felt_found+ownership_language	discard	temp_0.95
794	5.112	the_feel_felt_found+ownership_language	discard	tone_change
795	5.025	the_feel_felt_found+ownership_language+strategic_agreement	discard	add_strategic_agreement
796	5.237	the_feel_felt_found+ownership_language	discard	temp_0.90
797	5.325	the_feel_felt_found+ownership_language	discard	temp_0.95
798	5.200	the_feel_felt_found	discard	crossover
799	4.825	the_feel_felt_found+ownership_language+personal_touch	discard	add_personal_touch
800	5.550	the_feel_felt_found+ownership_language	discard	temp_0.95
801	5.300	none	discard	crossover
802	4.888	the_feel_felt_found	discard	remove_ownership_language
803	5.300	the_feel_felt_found+ownership_language+personal_touch	discard	add_personal_touch
804	5.137	the_feel_felt_found+ownership_language+warmth_injection	discard	add_warmth_injection
805	4.825	the_feel_felt_found+ownership_language	discard	temp_0.65
806	5.425	the_feel_felt_found+ownership_language	discard	temp_0.90
807	5.112	the_feel_felt_found+ownership_language	discard	tone_change
808	5.237	the_feel_felt_found+ownership_language+casual_professionalism	discard	add_casual_professionalism
809	5.550	the_feel_felt_found+concrete_next_steps	discard	swap_ownership_language_for_concrete_next_steps
810	5.425	the_feel_felt_found+ownership_language	discard	crossover
811	5.750	ownership_language+emotional_labeling	discard	swap_the_feel_felt_found_for_emotional_labeling
812	5.113	the_feel_felt_found+ownership_language	discard	tone_change
813	5.238	the_feel_felt_found+strategic_agreement	discard	swap_ownership_language_for_strategic_agreement
814	4.825	ownership_language+personal_touch	discard	swap_the_feel_felt_found_for_personal_touch
815	5.138	the_feel_felt_found+never_say_calm_down	discard	swap_ownership_language_for_never_say_calm_down
816	5.200	the_feel_felt_found+ownership_language+mirroring	discard	add_mirroring
817	5.337	the_feel_felt_found+ownership_language	discard	temp_0.75
818	5.550	none	discard	crossover
819	5.325	the_feel_felt_found	discard	remove_ownership_language
820	4.700	the_feel_felt_found+ownership_language+genuine_admission	discard	add_genuine_admission
821	5.325	the_feel_felt_found	discard	crossover
822	5.650	the_feel_felt_found+ownership_language	discard	temp_0.85
823	5.350	the_feel_felt_found+ownership_language+proactive_extras	discard	add_proactive_extras
824	4.825	the_feel_felt_found+ownership_language+casual_professionalism	discard	add_casual_professionalism
825	5.013	the_feel_felt_found	discard	crossover
826	5.237	the_feel_felt_found+ownership_language	discard	temp_0.70
827	5.237	the_feel_felt_found+ownership_language+genuine_admission	discard	add_genuine_admission
828	5.337	the_feel_felt_found	discard	crossover
829	4.713	the_feel_felt_found+ownership_language	discard	tone_change
830	5.450	ownership_language	discard	crossover
831	5.238	the_feel_felt_found+ownership_language	discard	crossover
832	5.325	the_feel_felt_found+ownership_language+never_say_calm_down	discard	add_never_say_calm_down
833	4.925	the_feel_felt_found+ownership_language+personal_touch	discard	add_personal_touch
834	5.138	the_feel_felt_found+validation_before_solution	discard	swap_ownership_language_for_validation_before_solution
835	5.550	the_feel_felt_found+ownership_language+mirroring	discard	add_mirroring
836	4.925	the_feel_felt_found+ownership_language	discard	tone_change
837	5.212	the_feel_felt_found+ownership_language+strategic_agreement	discard	add_strategic_agreement
838	5.450	the_feel_felt_found+ownership_language+casual_professionalism	discard	add_casual_professionalism
839	5.037	the_feel_felt_found+ownership_language	discard	tone_change
840	5.200	the_feel_felt_found+ownership_language	discard	temp_0.75
841	5.450	the_feel_felt_found+ownership_language+proactive_extras	discard	add_proactive_extras
842	5.338	the_feel_felt_found+ownership_language	discard	tone_change
843	5.138	the_feel_felt_found	discard	crossover
844	5.225	the_feel_felt_found+ownership_language	discard	tone_change
845	5.338	the_feel_felt_found+casual_professionalism	discard	swap_ownership_language_for_casual_professionalism
846	5.013	the_feel_felt_found+ownership_language+casual_professionalism	discard	add_casual_professionalism
847	5.550	the_feel_felt_found+ownership_language	discard	crossover
848	5.238	the_feel_felt_found+ownership_language+warmth_injection	discard	add_warmth_injection
849	5.650	the_feel_felt_found+personal_touch	discard	swap_ownership_language_for_personal_touch
850	5.450	the_feel_felt_found+ownership_language	discard	tone_change
851	5.237	the_feel_felt_found+ownership_language+personal_touch	discard	add_personal_touch
852	5.338	the_feel_felt_found+ownership_language+genuine_admission	discard	add_genuine_admission
853	4.700	the_feel_felt_found+ownership_language	discard	crossover
854	5.350	the_feel_felt_found+ownership_language+mirroring	discard	add_mirroring
855	5.425	the_feel_felt_found+ownership_language	discard	tone_change
856	4.925	ownership_language+proactive_extras	discard	swap_the_feel_felt_found_for_proactive_extras
857	5.137	the_feel_felt_found+proactive_extras	discard	swap_ownership_language_for_proactive_extras
858	5.450	the_feel_felt_found+ownership_language	discard	tone_change
859	5.550	the_feel_felt_found+ownership_language	discard	temp_0.85
860	5.200	the_feel_felt_found+ownership_language	discard	crossover
861	4.825	the_feel_felt_found	discard	remove_ownership_language
862	5.013	the_feel_felt_found+ownership_language+personal_touch	discard	add_personal_touch
863	5.550	the_feel_felt_found+ownership_language	discard	crossover
