generation	eq_score	techniques	status	description
17133	5.325	the_feel_felt_found+warmth_injection	discard	swap_ownership_language_for_warmth_injection
17134	5.325	the_feel_felt_found+concrete_next_steps	discard	swap_ownership_language_for_concrete_next_steps
17135	5.325	the_feel_felt_found+ownership_language	discard	tone_change
17136	5.138	the_feel_felt_found+ownership_language	discard	crossover
17137	5.450	ownership_language+emotional_labeling	discard	swap_the_feel_felt_found_for_emotional_labeling
17138	4.925	ownership_language+casual_professionalism	discard	swap_the_feel_felt_found_for_casual_professionalism
17139	5.325	the_feel_felt_found+ownership_language	discard	temp_0.70
17140	5.338	the_feel_felt_found+ownership_language+warmth_injection	discard	add_warmth_injection
17141	5.025	the_feel_felt_found+ownership_language	discard	crossover
17142	5.450	the_feel_felt_found+ownership_language	discard	tone_change
17143	5.325	the_feel_felt_found+ownership_language	discard	tone_change
17144	5.550	the_feel_felt_found+ownership_language	discard	tone_change
17145	4.825	the_feel_felt_found+energy_matching	discard	swap_ownership_language_for_energy_matching
17146	5.450	the_feel_felt_found+ownership_language+never_say_calm_down	discard	add_never_say_calm_down
17147	4.925	the_feel_felt_found+ownership_language	discard	temp_0.70
17148	5.025	the_feel_felt_found+ownership_language+casual_professionalism	discard	add_casual_professionalism
17149	5.450	the_feel_felt_found+ownership_language+never_say_calm_down	discard	add_never_say_calm_down
17150	4.925	the_feel_felt_found+ownership_language	discard	crossover
17151	5.550	the_feel_felt_found+ownership_language	discard	temp_0.85
17152	5.238	the_feel_felt_found+ownership_language+energy_matching	discard	add_energy_matching
17153	5.225	the_feel_felt_found+ownership_language	discard	tone_change
17154	4.800	the_feel_felt_found+ownership_language	discard	tone_change
17155	4.925	the_feel_felt_found+ownership_language	discard	temp_0.85
17156	5.138	the_feel_felt_found+ownership_language+casual_professionalism	discard	add_casual_professionalism
17157	5.013	the_feel_felt_found+ownership_language	discard	crossover
17158	5.550	the_feel_felt_found+ownership_language	discard	tone_change
17159	5.325	the_feel_felt_found+ownership_language+validation_before_solution	discard	add_validation_before_solution
17160	5.237	the_feel_felt_found+ownership_language	discard	temp_0.75
17161	5.138	the_feel_felt_found+ownership_language	discard	tone_change
17162	5.225	the_feel_felt_found+ownership_language	discard	temp_0.75
17163	5.038	the_feel_felt_found+ownership_language+concrete_next_steps	discard	add_concrete_next_steps
17164	5.450	the_feel_felt_found+ownership_language	discard	tone_change
17165	4.388	the_feel_felt_found+casual_professionalism	discard	swap_ownership_language_for_casual_professionalism
17166	5.338	the_feel_felt_found+ownership_language	discard	temp_0.85
17167	5.425	the_feel_felt_found	discard	crossover
17168	5.138	the_feel_felt_found+ownership_language	discard	temp_0.85
17169	5.138	ownership_language	discard	remove_the_feel_felt_found
17170	5.450	the_feel_felt_found+ownership_language+personal_touch	discard	add_personal_touch
17171	5.550	the_feel_felt_found	discard	remove_ownership_language
17172	5.550	the_feel_felt_found	discard	remove_ownership_language
17173	5.138	the_feel_felt_found+ownership_language	discard	tone_change
17174	5.138	the_feel_felt_found+ownership_language	discard	temp_0.75
17175	5.200	the_feel_felt_found+ownership_language	discard	crossover
17176	5.350	the_feel_felt_found	discard	remove_ownership_language
17177	4.900	the_feel_felt_found+ownership_language	discard	crossover
17178	5.138	ownership_language	discard	crossover
17179	5.425	ownership_language+strategic_agreement	discard	swap_the_feel_felt_found_for_strategic_agreement
17180	5.425	the_feel_felt_found+strategic_agreement	discard	swap_ownership_language_for_strategic_agreement
17181	5.550	the_feel_felt_found+ownership_language	discard	tone_change
17182	5.325	the_feel_felt_found+ownership_language	discard	crossover
17183	5.425	the_feel_felt_found+validation_before_solution	discard	swap_ownership_language_for_validation_before_solution
17184	5.138	the_feel_felt_found	discard	crossover
17185	5.450	the_feel_felt_found+ownership_language	discard	tone_change
17186	5.300	ownership_language	discard	crossover
17187	5.350	the_feel_felt_found+ownership_language	discard	crossover
17188	5.238	the_feel_felt_found+ownership_language+strategic_agreement	discard	add_strategic_agreement
17189	5.550	the_feel_felt_found+ownership_language	discard	crossover
17190	5.237	ownership_language+strategic_agreement	discard	swap_the_feel_felt_found_for_strategic_agreement
17191	5.225	the_feel_felt_found+warmth_injection	discard	swap_ownership_language_for_warmth_injection
17192	5.325	none	discard	crossover
17193	5.650	the_feel_felt_found+ownership_language	discard	temp_0.75
17194	5.425	the_feel_felt_found+ownership_language+validation_before_solution	discard	add_validation_before_solution
17195	5.237	the_feel_felt_found+proactive_extras	discard	swap_ownership_language_for_proactive_extras
17196	5.038	the_feel_felt_found+ownership_language+casual_professionalism	discard	add_casual_professionalism
17197	5.350	the_feel_felt_found+ownership_language	discard	tone_change
17198	4.825	none	discard	crossover
17199	5.450	the_feel_felt_found+ownership_language	discard	tone_change
17200	5.200	the_feel_felt_found	discard	remove_ownership_language
17201	5.000	the_feel_felt_found+ownership_language	discard	tone_change
17202	5.013	the_feel_felt_found	discard	crossover
17203	5.325	ownership_language+strategic_agreement	discard	swap_the_feel_felt_found_for_strategic_agreement
17204	5.325	the_feel_felt_found+casual_professionalism	discard	swap_ownership_language_for_casual_professionalism
17205	5.138	the_feel_felt_found+ownership_language	discard	tone_change
17206	4.787	the_feel_felt_found+ownership_language	discard	crossover
17207	5.112	the_feel_felt_found+ownership_language	discard	tone_change
17208	5.237	ownership_language+casual_professionalism	discard	swap_the_feel_felt_found_for_casual_professionalism
17209	5.337	ownership_language	discard	remove_the_feel_felt_found
17210	4.825	ownership_language+casual_professionalism	discard	swap_the_feel_felt_found_for_casual_professionalism
17211	5.013	the_feel_felt_found+ownership_language	discard	tone_change
17212	5.138	the_feel_felt_found	discard	remove_ownership_language
17213	5.450	the_feel_felt_found+ownership_language	discard	crossover
17214	5.325	the_feel_felt_found+ownership_language	discard	tone_change
17215	4.925	the_feel_felt_found+ownership_language+mirroring	discard	add_mirroring
17216	5.450	the_feel_felt_found+ownership_language	discard	temp_0.75
17217	5.550	the_feel_felt_found+ownership_language	discard	tone_change
17218	5.425	the_feel_felt_found+ownership_language+mirroring	discard	add_mirroring
17219	5.750	the_feel_felt_found+ownership_language+concrete_next_steps	discard	add_concrete_next_steps
17220	5.425	the_feel_felt_found+never_say_calm_down	discard	swap_ownership_language_for_never_say_calm_down
17221	5.138	none	discard	crossover
17222	5.450	the_feel_felt_found+ownership_language	discard	crossover
17223	5.138	the_feel_felt_found+ownership_language	discard	tone_change
17224	5.450	the_feel_felt_found+ownership_language	discard	temp_0.90
17225	5.325	the_feel_felt_found+ownership_language	discard	tone_change
17226	4.888	ownership_language+warmth_injection	discard	swap_the_feel_felt_found_for_warmth_injection
17227	5.225	ownership_language	discard	crossover
17228	5.138	the_feel_felt_found+ownership_language	discard	tone_change
17229	5.450	the_feel_felt_found	discard	remove_ownership_language
17230	5.325	the_feel_felt_found+ownership_language+concrete_next_steps	discard	add_concrete_next_steps
17231	5.038	the_feel_felt_found+never_say_calm_down	discard	swap_ownership_language_for_never_say_calm_down
17232	5.350	the_feel_felt_found+ownership_language	discard	temp_0.65
17233	4.700	the_feel_felt_found+ownership_language	discard	crossover
17234	5.013	the_feel_felt_found+ownership_language	discard	crossover
17235	5.450	the_feel_felt_found+ownership_language+casual_professionalism	discard	add_casual_professionalism
17236	4.825	the_feel_felt_found+ownership_language+emotional_labeling	discard	add_emotional_labeling
17237	5.325	the_feel_felt_found+ownership_language	discard	crossover
17238	5.138	the_feel_felt_found+ownership_language	discard	crossover
17239	5.237	the_feel_felt_found+ownership_language	discard	tone_change
17240	4.925	the_feel_felt_found	discard	crossover
17241	5.338	the_feel_felt_found	discard	remove_ownership_language
17242	4.925	the_feel_felt_found+ownership_language	discard	tone_change
17243	5.237	the_feel_felt_found+ownership_language	discard	crossover
17244	5.350	the_feel_felt_found+ownership_language	discard	tone_change
17245	5.325	the_feel_felt_found+ownership_language+emotional_labeling	discard	add_emotional_labeling
17246	5.112	ownership_language	discard	remove_the_feel_felt_found
17247	5.237	the_feel_felt_found+ownership_language	discard	tone_change
17248	5.013	the_feel_felt_found+concrete_next_steps	discard	swap_ownership_language_for_concrete_next_steps
17249	5.450	the_feel_felt_found+ownership_language	discard	tone_change
17250	5.450	the_feel_felt_found+ownership_language+strategic_agreement	discard	add_strategic_agreement
17251	5.112	the_feel_felt_found+ownership_language	discard	tone_change
17252	5.200	the_feel_felt_found+ownership_language	discard	temp_0.90
17253	5.450	ownership_language+warmth_injection	discard	swap_the_feel_felt_found_for_warmth_injection
17254	5.325	the_feel_felt_found+ownership_language	discard	tone_change
17255	5.425	the_feel_felt_found+ownership_language	discard	tone_change
17256	5.200	the_feel_felt_found+proactive_extras	discard	swap_ownership_language_for_proactive_extras
17257	5.550	the_feel_felt_found+ownership_language	discard	tone_change
17258	5.113	the_feel_felt_found+ownership_language	discard	temp_0.75
17259	5.325	the_feel_felt_found+ownership_language	discard	crossover
17260	5.138	the_feel_felt_found+ownership_language	discard	tone_change
17261	5.112	the_feel_felt_found+ownership_language+mirroring	discard	add_mirroring
17262	5.138	the_feel_felt_found+ownership_language+warmth_injection	discard	add_warmth_injection
17263	4.700	the_feel_felt_found+ownership_language	discard	temp_0.75
17264	5.450	the_feel_felt_found+ownership_language	discard	temp_0.65
17265	5.138	the_feel_felt_found+ownership_language	discard	tone_change
17266	5.550	ownership_language+never_say_calm_down	discard	swap_the_feel_felt_found_for_never_say_calm_down
17267	5.438	the_feel_felt_found+ownership_language+proactive_extras	discard	add_proactive_extras
17268	5.550	ownership_language+concrete_next_steps	discard	swap_the_feel_felt_found_for_concrete_next_steps
17269	5.338	the_feel_felt_found+ownership_language	discard	temp_0.70
17270	5.138	the_feel_felt_found+ownership_language	discard	crossover
17271	5.325	the_feel_felt_found	discard	crossover
17272	5.013	the_feel_felt_found+ownership_language+never_say_calm_down	discard	add_never_say_calm_down
17273	5.550	the_feel_felt_found+ownership_language	discard	tone_change
17274	5.550	ownership_language+never_say_calm_down	discard	swap_the_feel_felt_found_for_never_say_calm_down
17275	5.237	ownership_language	discard	crossover
17276	5.237	the_feel_felt_found+ownership_language	discard	tone_change
17277	5.112	the_feel_felt_found+ownership_language+concrete_next_steps	discard	add_concrete_next_steps
17278	4.825	the_feel_felt_found+ownership_language	discard	tone_change
17279	5.237	the_feel_felt_found+ownership_language+emotional_labeling	discard	add_emotional_labeling
17280	5.425	the_feel_felt_found	discard	remove_ownership_language
17281	5.550	the_feel_felt_found	discard	crossover
17282	5.325	ownership_language+personal_touch	discard	swap_the_feel_felt_found_for_personal_touch
17283	4.388	the_feel_felt_found+ownership_language+personal_touch	discard	add_personal_touch
17284	5.425	the_feel_felt_found+ownership_language	discard	temp_0.70
17285	5.550	the_feel_felt_found+ownership_language	discard	tone_change
17286	5.350	the_feel_felt_found	discard	crossover
17287	5.550	the_feel_felt_found+ownership_language	discard	tone_change
17288	5.225	the_feel_felt_found+ownership_language+mirroring	discard	add_mirroring
17289	5.237	the_feel_felt_found	discard	remove_ownership_language
17290	5.450	the_feel_felt_found+ownership_language	discard	tone_change
17291	5.450	the_feel_felt_found+energy_matching	discard	swap_ownership_language_for_energy_matching
17292	4.825	the_feel_felt_found+ownership_language	discard	tone_change
17293	5.138	the_feel_felt_found+ownership_language+genuine_admission	discard	add_genuine_admission
17294	5.250	ownership_language+emotional_labeling	discard	swap_the_feel_felt_found_for_emotional_labeling
17295	5.237	the_feel_felt_found+ownership_language	discard	tone_change
17296	5.450	the_feel_felt_found	discard	crossover
17297	5.325	the_feel_felt_found+ownership_language+mirroring	discard	add_mirroring
17298	5.550	the_feel_felt_found+ownership_language	discard	crossover
17299	5.138	the_feel_felt_found+ownership_language	discard	tone_change
17300	5.425	the_feel_felt_found+ownership_language+proactive_extras	discard	add_proactive_extras
17301	5.237	the_feel_felt_found	discard	remove_ownership_language
17302	5.325	ownership_language+casual_professionalism	discard	swap_the_feel_felt_found_for_casual_professionalism
17303	5.450	ownership_language+strategic_agreement	discard	swap_the_feel_felt_found_for_strategic_agreement
17304	5.237	the_feel_felt_found+ownership_language	discard	tone_change
17305	5.525	the_feel_felt_found+ownership_language+concrete_next_steps	discard	add_concrete_next_steps
17306	5.125	the_feel_felt_found+ownership_language	discard	tone_change
17307	5.200	the_feel_felt_found+ownership_language+strategic_agreement	discard	add_strategic_agreement
17308	4.900	the_feel_felt_found+ownership_language+warmth_injection	discard	add_warmth_injection
17309	5.325	the_feel_felt_found+ownership_language	discard	tone_change
17310	5.650	the_feel_felt_found	discard	remove_ownership_language
17311	5.450	the_feel_felt_found+ownership_language	discard	crossover
17312	5.550	the_feel_felt_found+energy_matching	discard	swap_ownership_language_for_energy_matching
17313	4.925	the_feel_felt_found+ownership_language	discard	tone_change
17314	5.237	the_feel_felt_found	discard	remove_ownership_language
17315	5.325	the_feel_felt_found	discard	remove_ownership_language
17316	5.138	the_feel_felt_found+ownership_language+proactive_extras	discard	add_proactive_extras
17317	5.013	the_feel_felt_found+ownership_language	discard	crossover
17318	5.138	the_feel_felt_found	discard	remove_ownership_language
17319	5.138	the_feel_felt_found+ownership_language+validation_before_solution	discard	add_validation_before_solution
17320	5.225	the_feel_felt_found+genuine_admission	discard	swap_ownership_language_for_genuine_admission
17321	5.237	ownership_language	discard	crossover
17322	5.138	ownership_language	discard	crossover
17323	5.438	ownership_language+emotional_labeling	discard	swap_the_feel_felt_found_for_emotional_labeling
17324	5.338	the_feel_felt_found	discard	crossover
17325	5.338	the_feel_felt_found+ownership_language	discard	tone_change
17326	5.450	the_feel_felt_found	discard	crossover
17327	5.237	ownership_language+emotional_labeling	discard	swap_the_feel_felt_found_for_emotional_labeling
17328	5.112	ownership_language	discard	remove_the_feel_felt_found
17329	5.138	ownership_language	discard	crossover
17330	5.237	the_feel_felt_found+ownership_language+casual_professionalism	discard	add_casual_professionalism
17331	5.138	the_feel_felt_found+ownership_language	discard	crossover
17332	5.112	the_feel_felt_found+ownership_language	discard	tone_change
17333	5.138	the_feel_felt_found+ownership_language	discard	temp_0.65
17334	5.213	none	discard	crossover
17335	5.200	the_feel_felt_found+ownership_language+mirroring	discard	add_mirroring
17336	4.825	the_feel_felt_found	discard	crossover
17337	5.037	the_feel_felt_found+ownership_language+never_say_calm_down	discard	add_never_say_calm_down
17338	5.138	the_feel_felt_found	discard	remove_ownership_language
17339	5.350	ownership_language+warmth_injection	discard	swap_the_feel_felt_found_for_warmth_injection
17340	5.013	ownership_language	discard	remove_the_feel_felt_found
17341	4.825	ownership_language	discard	remove_the_feel_felt_found
17342	5.013	the_feel_felt_found	discard	remove_ownership_language
17343	5.013	none	discard	crossover
17344	4.800	the_feel_felt_found+ownership_language+casual_professionalism	discard	add_casual_professionalism
17345	5.138	the_feel_felt_found+ownership_language	discard	tone_change
17346	5.138	the_feel_felt_found+ownership_language	discard	tone_change
17347	4.825	the_feel_felt_found+ownership_language	discard	tone_change
17348	5.112	the_feel_felt_found+ownership_language	discard	tone_change
17349	5.338	the_feel_felt_found+ownership_language	discard	tone_change
17350	5.350	the_feel_felt_found+ownership_language+strategic_agreement	discard	add_strategic_agreement
17351	5.450	the_feel_felt_found+ownership_language+proactive_extras	discard	add_proactive_extras
17352	5.450	the_feel_felt_found+ownership_language	discard	crossover
17353	5.325	the_feel_felt_found+ownership_language	discard	crossover
17354	5.138	the_feel_felt_found+ownership_language	discard	tone_change
17355	5.425	the_feel_felt_found+ownership_language	discard	tone_change
17356	5.450	the_feel_felt_found+ownership_language	discard	crossover
17357	5.325	ownership_language+casual_professionalism	discard	swap_the_feel_felt_found_for_casual_professionalism
17358	5.450	the_feel_felt_found+ownership_language	discard	crossover
17359	5.425	the_feel_felt_found+ownership_language	discard	temp_0.85
17360	5.225	the_feel_felt_found+ownership_language	discard	tone_change
17361	5.338	the_feel_felt_found+casual_professionalism	discard	swap_ownership_language_for_casual_professionalism
17362	5.450	the_feel_felt_found	discard	crossover
17363	5.325	the_feel_felt_found+ownership_language	discard	tone_change
17364	4.612	the_feel_felt_found+ownership_language	discard	temp_0.85
17365	5.100	none	discard	crossover
17366	4.925	none	discard	crossover
17367	5.450	the_feel_felt_found+ownership_language	discard	crossover
17368	5.025	the_feel_felt_found	discard	crossover
17369	5.213	ownership_language	discard	crossover
17370	4.825	the_feel_felt_found+ownership_language	discard	tone_change
17371	5.325	ownership_language+mirroring	discard	swap_the_feel_felt_found_for_mirroring
17372	5.237	the_feel_felt_found+ownership_language	discard	crossover
17373	4.825	the_feel_felt_found+ownership_language	discard	tone_change
17374	5.425	the_feel_felt_found+ownership_language+strategic_agreement	discard	add_strategic_agreement
17375	5.200	ownership_language+concrete_next_steps	discard	swap_the_feel_felt_found_for_concrete_next_steps
17376	5.550	ownership_language	discard	remove_the_feel_felt_found
17377	5.237	the_feel_felt_found+ownership_language+warmth_injection	discard	add_warmth_injection
17378	5.238	the_feel_felt_found+ownership_language	discard	tone_change
17379	5.338	the_feel_felt_found+ownership_language+concrete_next_steps	discard	add_concrete_next_steps
17380	5.138	the_feel_felt_found+ownership_language+proactive_extras	discard	add_proactive_extras
17381	5.200	the_feel_felt_found+ownership_language	discard	temp_0.95
17382	5.350	ownership_language	discard	remove_the_feel_felt_found
17383	5.450	ownership_language+emotional_labeling	discard	swap_the_feel_felt_found_for_emotional_labeling
17384	4.612	the_feel_felt_found+ownership_language+genuine_admission	discard	add_genuine_admission
17385	5.425	the_feel_felt_found+ownership_language	discard	tone_change
17386	5.138	ownership_language+energy_matching	discard	swap_the_feel_felt_found_for_energy_matching
17387	5.550	the_feel_felt_found+ownership_language+personal_touch	discard	add_personal_touch
17388	5.438	the_feel_felt_found+ownership_language+energy_matching	discard	add_energy_matching
17389	5.338	the_feel_felt_found+ownership_language	discard	temp_0.65
17390	4.912	the_feel_felt_found+ownership_language+strategic_agreement	discard	add_strategic_agreement
17391	5.112	the_feel_felt_found+ownership_language+warmth_injection	discard	add_warmth_injection
17392	5.425	the_feel_felt_found+ownership_language	discard	tone_change
17393	5.112	the_feel_felt_found+warmth_injection	discard	swap_ownership_language_for_warmth_injection
17394	4.725	the_feel_felt_found+ownership_language	discard	temp_0.90
17395	5.338	the_feel_felt_found+ownership_language	discard	temp_0.95
17396	4.925	the_feel_felt_found+ownership_language	discard	crossover
17397	4.925	the_feel_felt_found+concrete_next_steps	discard	swap_ownership_language_for_concrete_next_steps
17398	5.325	the_feel_felt_found+ownership_language	discard	temp_0.70
17399	5.013	ownership_language	discard	crossover
17400	5.338	the_feel_felt_found+ownership_language+casual_professionalism	discard	add_casual_professionalism
17401	5.325	ownership_language+casual_professionalism	discard	swap_the_feel_felt_found_for_casual_professionalism
17402	5.325	the_feel_felt_found	discard	crossover
17403	5.525	ownership_language	discard	remove_the_feel_felt_found
17404	5.013	the_feel_felt_found+proactive_extras	discard	swap_ownership_language_for_proactive_extras
17405	5.237	the_feel_felt_found+ownership_language	discard	temp_0.90
17406	5.338	the_feel_felt_found+ownership_language+emotional_labeling	discard	add_emotional_labeling
17407	5.525	ownership_language+proactive_extras	discard	swap_the_feel_felt_found_for_proactive_extras
17408	5.138	the_feel_felt_found+ownership_language	discard	tone_change
17409	5.325	the_feel_felt_found+ownership_language	discard	tone_change
17410	5.450	the_feel_felt_found+ownership_language	discard	tone_change
