generation	eq_score	techniques	status	description
15744	5.338	the_feel_felt_found+never_say_calm_down	discard	swap_ownership_language_for_never_say_calm_down
15745	5.450	the_feel_felt_found+ownership_language	discard	temp_0.75
15746	5.300	the_feel_felt_found+ownership_language	discard	tone_change
15747	5.138	the_feel_felt_found+ownership_language	discard	crossover
15748	5.237	the_feel_felt_found+ownership_language	discard	tone_change
15749	5.550	the_feel_felt_found+ownership_language+personal_touch	discard	add_personal_touch
15750	5.025	ownership_language+strategic_agreement	discard	swap_the_feel_felt_found_for_strategic_agreement
15751	5.325	the_feel_felt_found	discard	crossover
15752	5.037	the_feel_felt_found+ownership_language	discard	temp_0.95
15753	5.550	ownership_language+concrete_next_steps	discard	swap_the_feel_felt_found_for_concrete_next_steps
15754	5.325	the_feel_felt_found+proactive_extras	discard	swap_ownership_language_for_proactive_extras
15755	5.450	the_feel_felt_found+ownership_language	discard	tone_change
15756	5.450	the_feel_felt_found+ownership_language+energy_matching	discard	add_energy_matching
15757	5.138	the_feel_felt_found	discard	remove_ownership_language
15758	5.338	ownership_language	discard	remove_the_feel_felt_found
15759	5.450	the_feel_felt_found+ownership_language	discard	temp_0.90
15760	5.425	the_feel_felt_found+ownership_language	discard	crossover
15761	5.550	the_feel_felt_found+ownership_language+genuine_admission	discard	add_genuine_admission
15762	5.450	ownership_language+warmth_injection	discard	swap_the_feel_felt_found_for_warmth_injection
15763	5.350	the_feel_felt_found+ownership_language	discard	tone_change
15764	5.200	the_feel_felt_found	discard	crossover
15765	5.300	the_feel_felt_found+ownership_language	discard	tone_change
15766	5.425	the_feel_felt_found+ownership_language	discard	tone_change
15767	5.237	the_feel_felt_found+ownership_language	discard	tone_change
15768	5.450	the_feel_felt_found+ownership_language	discard	tone_change
15769	5.013	the_feel_felt_found+ownership_language	discard	tone_change
15770	5.138	the_feel_felt_found+ownership_language	discard	crossover
15771	5.237	the_feel_felt_found+ownership_language	discard	tone_change
15772	4.912	the_feel_felt_found+ownership_language	discard	crossover
15773	5.125	the_feel_felt_found+emotional_labeling	discard	swap_ownership_language_for_emotional_labeling
15774	5.300	the_feel_felt_found+ownership_language+validation_before_solution	discard	add_validation_before_solution
15775	5.112	the_feel_felt_found+ownership_language	discard	tone_change
15776	5.625	ownership_language+personal_touch	discard	swap_the_feel_felt_found_for_personal_touch
15777	4.888	the_feel_felt_found+ownership_language	discard	crossover
15778	5.300	ownership_language+personal_touch	discard	swap_the_feel_felt_found_for_personal_touch
15779	5.138	the_feel_felt_found+ownership_language+never_say_calm_down	discard	add_never_say_calm_down
15780	4.800	the_feel_felt_found+ownership_language	discard	tone_change
15781	4.987	the_feel_felt_found+ownership_language	discard	tone_change
15782	5.137	the_feel_felt_found+ownership_language	discard	tone_change
15783	5.325	the_feel_felt_found+ownership_language	discard	tone_change
15784	5.350	the_feel_felt_found+ownership_language	discard	tone_change
15785	5.138	the_feel_felt_found+ownership_language+emotional_labeling	discard	add_emotional_labeling
15786	5.350	the_feel_felt_found+ownership_language+concrete_next_steps	discard	add_concrete_next_steps
15787	5.013	the_feel_felt_found+ownership_language	discard	tone_change
15788	5.425	ownership_language+strategic_agreement	discard	swap_the_feel_felt_found_for_strategic_agreement
15789	5.325	the_feel_felt_found	discard	remove_ownership_language
15790	5.013	the_feel_felt_found+ownership_language	discard	temp_0.95
15791	5.200	ownership_language+energy_matching	discard	swap_the_feel_felt_found_for_energy_matching
15792	5.525	the_feel_felt_found	discard	remove_ownership_language
15793	5.650	none	discard	crossover
15794	5.525	the_feel_felt_found+ownership_language	discard	crossover
15795	5.550	the_feel_felt_found+ownership_language	discard	temp_0.65
15796	5.038	the_feel_felt_found+ownership_language	discard	crossover
15797	4.800	the_feel_felt_found+ownership_language	discard	temp_0.75
15798	5.138	the_feel_felt_found	discard	remove_ownership_language
15799	5.113	the_feel_felt_found+mirroring	discard	swap_ownership_language_for_mirroring
15800	5.425	the_feel_felt_found+ownership_language+validation_before_solution	discard	add_validation_before_solution
15801	5.013	the_feel_felt_found+ownership_language	discard	tone_change
15802	5.238	ownership_language+emotional_labeling	discard	swap_the_feel_felt_found_for_emotional_labeling
15803	4.912	ownership_language	discard	remove_the_feel_felt_found
15804	5.138	the_feel_felt_found+ownership_language+genuine_admission	discard	add_genuine_admission
15805	5.325	ownership_language+energy_matching	discard	swap_the_feel_felt_found_for_energy_matching
15806	5.138	the_feel_felt_found+ownership_language	discard	crossover
15807	5.237	the_feel_felt_found+ownership_language	discard	tone_change
15808	5.350	the_feel_felt_found+ownership_language+casual_professionalism	discard	add_casual_professionalism
15809	5.325	the_feel_felt_found	discard	remove_ownership_language
15810	4.700	the_feel_felt_found+ownership_language	discard	temp_0.75
15811	5.225	the_feel_felt_found+ownership_language	discard	temp_0.75
15812	5.450	the_feel_felt_found	discard	remove_ownership_language
15813	5.325	the_feel_felt_found+ownership_language+warmth_injection	discard	add_warmth_injection
15814	5.338	the_feel_felt_found+ownership_language+strategic_agreement	discard	add_strategic_agreement
15815	5.525	the_feel_felt_found+warmth_injection	discard	swap_ownership_language_for_warmth_injection
15816	5.013	ownership_language	discard	crossover
15817	4.513	the_feel_felt_found+ownership_language	discard	tone_change
15818	5.137	the_feel_felt_found+never_say_calm_down	discard	swap_ownership_language_for_never_say_calm_down
15819	5.450	the_feel_felt_found+ownership_language	discard	temp_0.70
15820	5.325	ownership_language+warmth_injection	discard	swap_the_feel_felt_found_for_warmth_injection
15821	5.450	the_feel_felt_found+ownership_language	discard	tone_change
15822	5.013	ownership_language	discard	remove_the_feel_felt_found
15823	5.350	the_feel_felt_found+ownership_language	discard	crossover
15824	5.013	the_feel_felt_found	discard	crossover
15825	5.350	ownership_language+mirroring	discard	swap_the_feel_felt_found_for_mirroring
15826	5.038	the_feel_felt_found+ownership_language	discard	tone_change
15827	5.325	the_feel_felt_found+ownership_language	discard	temp_0.90
15828	4.825	the_feel_felt_found+ownership_language	discard	tone_change
15829	4.825	the_feel_felt_found+ownership_language+casual_professionalism	discard	add_casual_professionalism
15830	5.338	ownership_language	discard	crossover
15831	5.338	the_feel_felt_found+genuine_admission	discard	swap_ownership_language_for_genuine_admission
15832	4.487	the_feel_felt_found	discard	crossover
15833	5.350	the_feel_felt_found+ownership_language+genuine_admission	discard	add_genuine_admission
15834	5.650	the_feel_felt_found+ownership_language	discard	temp_0.85
15835	5.450	the_feel_felt_found+ownership_language	discard	tone_change
15836	5.425	the_feel_felt_found	discard	remove_ownership_language
15837	5.113	the_feel_felt_found+ownership_language	discard	temp_0.70
15838	5.200	the_feel_felt_found+ownership_language	discard	tone_change
15839	5.013	the_feel_felt_found+ownership_language	discard	crossover
15840	5.650	the_feel_felt_found+never_say_calm_down	discard	swap_ownership_language_for_never_say_calm_down
15841	5.450	the_feel_felt_found+ownership_language	discard	crossover
15842	5.438	the_feel_felt_found+ownership_language+warmth_injection	discard	add_warmth_injection
15843	5.113	the_feel_felt_found+ownership_language	discard	temp_0.75
15844	4.925	the_feel_felt_found+ownership_language	discard	temp_0.95
15845	5.237	the_feel_felt_found+ownership_language	discard	tone_change
15846	5.025	ownership_language	discard	crossover
15847	5.450	ownership_language	discard	remove_the_feel_felt_found
15848	5.550	the_feel_felt_found+ownership_language	discard	temp_0.70
15849	5.550	the_feel_felt_found+ownership_language+emotional_labeling	discard	add_emotional_labeling
15850	5.337	ownership_language	discard	remove_the_feel_felt_found
15851	5.238	the_feel_felt_found	discard	remove_ownership_language
15852	5.100	the_feel_felt_found+ownership_language	discard	tone_change
15853	5.325	the_feel_felt_found+ownership_language+strategic_agreement	discard	add_strategic_agreement
15854	5.350	ownership_language	discard	remove_the_feel_felt_found
15855	5.325	ownership_language	discard	crossover
15856	5.550	the_feel_felt_found+ownership_language	discard	tone_change
15857	4.925	ownership_language	discard	crossover
15858	5.450	the_feel_felt_found+ownership_language	discard	temp_0.75
15859	5.450	the_feel_felt_found+ownership_language+emotional_labeling	discard	add_emotional_labeling
15860	5.013	the_feel_felt_found+ownership_language	discard	temp_0.65
15861	5.013	the_feel_felt_found+ownership_language	discard	temp_0.65
15862	5.325	the_feel_felt_found+ownership_language	discard	tone_change
15863	4.513	the_feel_felt_found+ownership_language+strategic_agreement	discard	add_strategic_agreement
15864	5.250	the_feel_felt_found+concrete_next_steps	discard	swap_ownership_language_for_concrete_next_steps
15865	5.350	the_feel_felt_found	discard	crossover
15866	5.013	the_feel_felt_found+ownership_language	discard	tone_change
15867	4.987	ownership_language+emotional_labeling	discard	swap_the_feel_felt_found_for_emotional_labeling
15868	5.013	the_feel_felt_found+ownership_language	discard	tone_change
15869	5.325	the_feel_felt_found+ownership_language	discard	temp_0.75
15870	5.237	the_feel_felt_found+ownership_language	discard	tone_change
15871	5.213	the_feel_felt_found+ownership_language	discard	temp_0.95
15872	5.200	the_feel_felt_found	discard	remove_ownership_language
15873	5.450	the_feel_felt_found	discard	crossover
15874	4.925	the_feel_felt_found+ownership_language	discard	temp_0.90
15875	5.325	the_feel_felt_found	discard	remove_ownership_language
15876	5.450	ownership_language+genuine_admission	discard	swap_the_feel_felt_found_for_genuine_admission
15877	5.112	the_feel_felt_found+ownership_language	discard	crossover
15878	4.800	the_feel_felt_found+ownership_language	discard	tone_change
15879	5.013	ownership_language	discard	remove_the_feel_felt_found
15880	5.138	ownership_language+never_say_calm_down	discard	swap_the_feel_felt_found_for_never_say_calm_down
15881	5.225	the_feel_felt_found+ownership_language+energy_matching	discard	add_energy_matching
15882	5.450	the_feel_felt_found+ownership_language	discard	tone_change
15883	5.338	the_feel_felt_found+ownership_language+strategic_agreement	discard	add_strategic_agreement
15884	5.350	the_feel_felt_found+never_say_calm_down	discard	swap_ownership_language_for_never_say_calm_down
15885	5.450	ownership_language+validation_before_solution	discard	swap_the_feel_felt_found_for_validation_before_solution
15886	5.300	the_feel_felt_found+ownership_language+proactive_extras	discard	add_proactive_extras
15887	5.113	the_feel_felt_found+ownership_language+warmth_injection	discard	add_warmth_injection
15888	4.888	the_feel_felt_found	discard	crossover
15889	5.550	ownership_language+mirroring	discard	swap_the_feel_felt_found_for_mirroring
15890	5.112	the_feel_felt_found+ownership_language+concrete_next_steps	discard	add_concrete_next_steps
15891	5.200	the_feel_felt_found+ownership_language	discard	tone_change
15892	5.325	the_feel_felt_found+ownership_language+strategic_agreement	discard	add_strategic_agreement
15893	5.138	the_feel_felt_found+ownership_language	discard	temp_0.85
15894	5.650	the_feel_felt_found+ownership_language+emotional_labeling	discard	add_emotional_labeling
15895	5.550	the_feel_felt_found+ownership_language	discard	temp_0.75
15896	5.213	the_feel_felt_found	discard	remove_ownership_language
15897	5.550	ownership_language+warmth_injection	discard	swap_the_feel_felt_found_for_warmth_injection
15898	4.700	the_feel_felt_found+ownership_language	discard	tone_change
15899	5.650	ownership_language	discard	remove_the_feel_felt_found
15900	5.138	the_feel_felt_found+ownership_language	discard	temp_0.65
15901	4.925	the_feel_felt_found+ownership_language	discard	tone_change
15902	5.450	the_feel_felt_found+ownership_language+energy_matching	discard	add_energy_matching
15903	5.100	the_feel_felt_found+ownership_language+validation_before_solution	discard	add_validation_before_solution
15904	4.513	the_feel_felt_found+mirroring	discard	swap_ownership_language_for_mirroring
15905	5.112	ownership_language+strategic_agreement	discard	swap_the_feel_felt_found_for_strategic_agreement
15906	5.138	the_feel_felt_found+ownership_language+personal_touch	discard	add_personal_touch
15907	4.925	ownership_language	discard	crossover
15908	5.100	ownership_language+never_say_calm_down	discard	swap_the_feel_felt_found_for_never_say_calm_down
15909	5.112	the_feel_felt_found+ownership_language+concrete_next_steps	discard	add_concrete_next_steps
15910	4.700	the_feel_felt_found+ownership_language	discard	temp_0.70
15911	4.888	the_feel_felt_found+ownership_language	discard	temp_0.75
15912	5.025	the_feel_felt_found+ownership_language	discard	tone_change
15913	4.513	the_feel_felt_found+ownership_language	discard	tone_change
15914	5.550	the_feel_felt_found+proactive_extras	discard	swap_ownership_language_for_proactive_extras
15915	4.925	the_feel_felt_found+ownership_language+genuine_admission	discard	add_genuine_admission
15916	5.425	the_feel_felt_found+ownership_language	discard	temp_0.85
15917	5.113	the_feel_felt_found+ownership_language	discard	tone_change
15918	4.713	the_feel_felt_found+ownership_language	discard	crossover
15919	5.338	ownership_language	discard	crossover
15920	5.300	the_feel_felt_found+ownership_language+energy_matching	discard	add_energy_matching
15921	4.888	the_feel_felt_found+ownership_language+concrete_next_steps	discard	add_concrete_next_steps
15922	5.237	the_feel_felt_found	discard	crossover
15923	5.450	the_feel_felt_found+ownership_language+concrete_next_steps	discard	add_concrete_next_steps
15924	5.550	the_feel_felt_found+ownership_language	discard	tone_change
15925	4.725	ownership_language	discard	crossover
15926	5.237	the_feel_felt_found+ownership_language	discard	temp_0.75
15927	5.112	the_feel_felt_found	discard	remove_ownership_language
15928	5.125	the_feel_felt_found+ownership_language+concrete_next_steps	discard	add_concrete_next_steps
15929	5.237	the_feel_felt_found+ownership_language	discard	tone_change
15930	4.800	the_feel_felt_found+ownership_language	discard	crossover
15931	5.325	none	discard	crossover
15932	4.925	the_feel_felt_found+ownership_language+genuine_admission	discard	add_genuine_admission
15933	5.138	the_feel_felt_found+mirroring	discard	swap_ownership_language_for_mirroring
15934	5.350	the_feel_felt_found+ownership_language	discard	temp_0.90
15935	5.237	the_feel_felt_found+proactive_extras	discard	swap_ownership_language_for_proactive_extras
15936	5.200	the_feel_felt_found+ownership_language	discard	temp_0.75
15937	5.225	the_feel_felt_found+ownership_language	discard	temp_0.70
15938	5.300	ownership_language+casual_professionalism	discard	swap_the_feel_felt_found_for_casual_professionalism
15939	5.650	the_feel_felt_found+ownership_language+strategic_agreement	discard	add_strategic_agreement
15940	5.425	the_feel_felt_found+ownership_language+strategic_agreement	discard	add_strategic_agreement
15941	5.112	the_feel_felt_found+never_say_calm_down	discard	swap_ownership_language_for_never_say_calm_down
15942	4.888	the_feel_felt_found+ownership_language+validation_before_solution	discard	add_validation_before_solution
15943	5.138	the_feel_felt_found+ownership_language	discard	crossover
15944	5.325	the_feel_felt_found+ownership_language	discard	crossover
15945	5.325	ownership_language+never_say_calm_down	discard	swap_the_feel_felt_found_for_never_say_calm_down
15946	5.138	the_feel_felt_found+ownership_language	discard	tone_change
15947	5.650	the_feel_felt_found+strategic_agreement	discard	swap_ownership_language_for_strategic_agreement
15948	5.450	the_feel_felt_found+ownership_language+never_say_calm_down	discard	add_never_say_calm_down
15949	5.037	the_feel_felt_found	discard	remove_ownership_language
15950	5.237	the_feel_felt_found+ownership_language	discard	tone_change
15951	5.525	ownership_language+warmth_injection	discard	swap_the_feel_felt_found_for_warmth_injection
15952	5.013	the_feel_felt_found	discard	crossover
15953	5.325	the_feel_felt_found+ownership_language	discard	tone_change
15954	5.325	the_feel_felt_found+ownership_language+concrete_next_steps	discard	add_concrete_next_steps
15955	5.325	the_feel_felt_found+ownership_language	discard	tone_change
15956	5.200	the_feel_felt_found	discard	crossover
15957	5.138	the_feel_felt_found+ownership_language+genuine_admission	discard	add_genuine_admission
15958	5.550	the_feel_felt_found+ownership_language	discard	temp_0.75
15959	5.013	the_feel_felt_found+casual_professionalism	discard	swap_ownership_language_for_casual_professionalism
15960	4.200	the_feel_felt_found+ownership_language+emotional_labeling	discard	add_emotional_labeling
15961	5.425	the_feel_felt_found+ownership_language+warmth_injection	discard	add_warmth_injection
15962	5.450	ownership_language+strategic_agreement	discard	swap_the_feel_felt_found_for_strategic_agreement
15963	5.425	none	discard	crossover
15964	5.425	the_feel_felt_found+ownership_language	discard	tone_change
15965	5.113	the_feel_felt_found+ownership_language	discard	crossover
15966	5.137	the_feel_felt_found+ownership_language	discard	temp_0.90
15967	5.550	the_feel_felt_found+ownership_language	discard	crossover
15968	5.013	the_feel_felt_found+ownership_language+emotional_labeling	discard	add_emotional_labeling
15969	5.038	the_feel_felt_found+warmth_injection	discard	swap_ownership_language_for_warmth_injection
15970	4.825	the_feel_felt_found+concrete_next_steps	discard	swap_ownership_language_for_concrete_next_steps
15971	5.338	ownership_language+emotional_labeling	discard	swap_the_feel_felt_found_for_emotional_labeling
15972	5.525	the_feel_felt_found+ownership_language	discard	tone_change
15973	5.138	the_feel_felt_found+ownership_language	discard	tone_change
15974	5.237	the_feel_felt_found+ownership_language+warmth_injection	discard	add_warmth_injection
15975	5.450	the_feel_felt_found+ownership_language	discard	crossover
15976	5.550	the_feel_felt_found+ownership_language	discard	tone_change
15977	4.925	the_feel_felt_found+ownership_language+validation_before_solution	discard	add_validation_before_solution
15978	5.350	the_feel_felt_found+ownership_language+mirroring	discard	add_mirroring
15979	5.350	ownership_language	discard	remove_the_feel_felt_found
15980	5.013	the_feel_felt_found+ownership_language	discard	crossover
15981	5.350	the_feel_felt_found+ownership_language	discard	tone_change
15982	5.450	the_feel_felt_found+ownership_language	discard	crossover
15983	4.700	the_feel_felt_found+ownership_language+warmth_injection	discard	add_warmth_injection
15984	5.237	ownership_language+never_say_calm_down	discard	swap_the_feel_felt_found_for_never_say_calm_down
15985	5.450	ownership_language+genuine_admission	discard	swap_the_feel_felt_found_for_genuine_admission
15986	5.138	the_feel_felt_found+ownership_language	discard	tone_change
15987	5.325	the_feel_felt_found+ownership_language+energy_matching	discard	add_energy_matching
15988	5.450	the_feel_felt_found+ownership_language	discard	tone_change
15989	5.450	the_feel_felt_found+ownership_language	discard	crossover
15990	5.450	the_feel_felt_found+ownership_language	discard	tone_change
15991	5.425	the_feel_felt_found+strategic_agreement	discard	swap_ownership_language_for_strategic_agreement
15992	5.300	the_feel_felt_found+ownership_language+warmth_injection	discard	add_warmth_injection
15993	4.675	the_feel_felt_found+ownership_language	discard	temp_0.85
15994	5.138	the_feel_felt_found+ownership_language+casual_professionalism	discard	add_casual_professionalism
15995	5.138	the_feel_felt_found	discard	remove_ownership_language
15996	5.550	the_feel_felt_found+ownership_language+concrete_next_steps	discard	add_concrete_next_steps
15997	5.138	the_feel_felt_found	discard	crossover
15998	5.325	the_feel_felt_found+ownership_language	discard	tone_change
15999	5.425	the_feel_felt_found+ownership_language	discard	tone_change
16000	5.550	the_feel_felt_found+ownership_language	discard	crossover
16001	5.138	ownership_language+personal_touch	discard	swap_the_feel_felt_found_for_personal_touch
16002	5.325	the_feel_felt_found+ownership_language+mirroring	discard	add_mirroring
16003	5.550	the_feel_felt_found+ownership_language+validation_before_solution	discard	add_validation_before_solution
16004	5.650	the_feel_felt_found	discard	remove_ownership_language
16005	4.700	the_feel_felt_found+ownership_language	discard	tone_change
16006	5.112	ownership_language	discard	remove_the_feel_felt_found
16007	5.013	the_feel_felt_found+strategic_agreement	discard	swap_ownership_language_for_strategic_agreement
16008	5.237	the_feel_felt_found+ownership_language+genuine_admission	discard	add_genuine_admission
16009	5.325	the_feel_felt_found+ownership_language	discard	crossover
16010	5.138	ownership_language+strategic_agreement	discard	swap_the_feel_felt_found_for_strategic_agreement
16011	5.112	the_feel_felt_found	discard	remove_ownership_language
16012	4.825	the_feel_felt_found+ownership_language	discard	tone_change
16013	4.925	the_feel_felt_found+ownership_language+casual_professionalism	discard	add_casual_professionalism
16014	5.013	the_feel_felt_found+ownership_language	discard	crossover
16015	5.112	the_feel_felt_found	discard	crossover
16016	5.325	ownership_language	discard	crossover
