generation	eq_score	techniques	status	description
16017	4.825	the_feel_felt_found+ownership_language+never_say_calm_down	discard	add_never_say_calm_down
16018	5.037	ownership_language+never_say_calm_down	discard	swap_the_feel_felt_found_for_never_say_calm_down
16019	5.650	the_feel_felt_found+ownership_language	discard	tone_change
16020	5.075	the_feel_felt_found+ownership_language	discard	tone_change
16021	5.138	the_feel_felt_found+ownership_language	discard	temp_0.75
16022	5.550	the_feel_felt_found+ownership_language	discard	temp_0.85
16023	5.450	the_feel_felt_found+ownership_language	discard	tone_change
16024	5.013	the_feel_felt_found+ownership_language	discard	tone_change
16025	5.113	the_feel_felt_found+ownership_language	discard	tone_change
16026	5.425	the_feel_felt_found+ownership_language+warmth_injection	discard	add_warmth_injection
16027	4.487	the_feel_felt_found+ownership_language	discard	temp_0.75
16028	5.213	ownership_language	discard	remove_the_feel_felt_found
16029	5.450	the_feel_felt_found+ownership_language	discard	tone_change
16030	5.650	the_feel_felt_found+ownership_language+energy_matching	discard	add_energy_matching
16031	5.138	ownership_language	discard	crossover
16032	5.300	the_feel_felt_found	discard	crossover
16033	5.425	ownership_language	discard	crossover
16034	5.350	the_feel_felt_found+ownership_language	discard	temp_0.85
16035	5.237	the_feel_felt_found+ownership_language	discard	crossover
16036	5.550	the_feel_felt_found+ownership_language	discard	crossover
16037	5.550	ownership_language	discard	crossover
16038	4.988	the_feel_felt_found+ownership_language	discard	crossover
16039	5.550	the_feel_felt_found+ownership_language+personal_touch	discard	add_personal_touch
16040	4.925	the_feel_felt_found+ownership_language	discard	temp_0.90
16041	4.800	the_feel_felt_found+ownership_language+emotional_labeling	discard	add_emotional_labeling
16042	5.325	ownership_language	discard	crossover
16043	5.525	the_feel_felt_found+ownership_language+warmth_injection	discard	add_warmth_injection
16044	5.237	the_feel_felt_found+never_say_calm_down	discard	swap_ownership_language_for_never_say_calm_down
16045	4.925	ownership_language+energy_matching	discard	swap_the_feel_felt_found_for_energy_matching
16046	5.100	ownership_language+concrete_next_steps	discard	swap_the_feel_felt_found_for_concrete_next_steps
16047	5.237	the_feel_felt_found+ownership_language	discard	temp_0.90
16048	5.650	ownership_language+validation_before_solution	discard	swap_the_feel_felt_found_for_validation_before_solution
16049	5.325	the_feel_felt_found+ownership_language+concrete_next_steps	discard	add_concrete_next_steps
16050	5.238	the_feel_felt_found+ownership_language+energy_matching	discard	add_energy_matching
16051	5.138	the_feel_felt_found+ownership_language	discard	temp_0.70
16052	5.112	the_feel_felt_found+ownership_language	discard	tone_change
16053	5.013	ownership_language+strategic_agreement	discard	swap_the_feel_felt_found_for_strategic_agreement
16054	4.825	the_feel_felt_found	discard	remove_ownership_language
16055	5.237	the_feel_felt_found+ownership_language	discard	tone_change
16056	5.350	none	discard	crossover
16057	5.025	the_feel_felt_found+ownership_language	discard	tone_change
16058	5.200	the_feel_felt_found+ownership_language	discard	tone_change
16059	4.700	the_feel_felt_found+ownership_language	discard	temp_0.85
16060	5.550	the_feel_felt_found+ownership_language	discard	crossover
16061	5.025	the_feel_felt_found	discard	remove_ownership_language
16062	5.225	the_feel_felt_found+ownership_language+personal_touch	discard	add_personal_touch
16063	5.550	the_feel_felt_found+ownership_language+mirroring	discard	add_mirroring
16064	5.238	none	discard	crossover
16065	5.025	the_feel_felt_found+ownership_language	discard	temp_0.85
16066	5.225	the_feel_felt_found+ownership_language+energy_matching	discard	add_energy_matching
16067	5.450	the_feel_felt_found+casual_professionalism	discard	swap_ownership_language_for_casual_professionalism
16068	5.325	the_feel_felt_found	discard	remove_ownership_language
16069	5.425	the_feel_felt_found+ownership_language	discard	tone_change
16070	5.013	the_feel_felt_found	discard	remove_ownership_language
16071	5.550	the_feel_felt_found+ownership_language+proactive_extras	discard	add_proactive_extras
16072	5.225	the_feel_felt_found+concrete_next_steps	discard	swap_ownership_language_for_concrete_next_steps
16073	5.425	the_feel_felt_found+ownership_language+validation_before_solution	discard	add_validation_before_solution
16074	5.425	the_feel_felt_found+ownership_language+mirroring	discard	add_mirroring
16075	5.237	ownership_language	discard	crossover
16076	5.425	the_feel_felt_found+ownership_language	discard	tone_change
16077	5.325	ownership_language	discard	remove_the_feel_felt_found
16078	5.125	the_feel_felt_found+ownership_language+warmth_injection	discard	add_warmth_injection
16079	5.525	the_feel_felt_found+ownership_language	discard	temp_0.65
16080	5.425	the_feel_felt_found+ownership_language	discard	tone_change
16081	5.237	the_feel_felt_found+ownership_language	discard	tone_change
16082	5.113	the_feel_felt_found+ownership_language	discard	tone_change
16083	4.800	ownership_language+genuine_admission	discard	swap_the_feel_felt_found_for_genuine_admission
16084	5.325	the_feel_felt_found	discard	remove_ownership_language
16085	5.238	the_feel_felt_found+ownership_language	discard	tone_change
16086	5.425	the_feel_felt_found+ownership_language	discard	tone_change
16087	4.513	the_feel_felt_found+ownership_language+validation_before_solution	discard	add_validation_before_solution
16088	5.337	the_feel_felt_found+energy_matching	discard	swap_ownership_language_for_energy_matching
16089	5.450	the_feel_felt_found+ownership_language+genuine_admission	discard	add_genuine_admission
16090	5.438	the_feel_felt_found+ownership_language	discard	tone_change
16091	5.450	the_feel_felt_found+ownership_language+validation_before_solution	discard	add_validation_before_solution
16092	5.650	the_feel_felt_found+ownership_language	discard	crossover
16093	5.237	the_feel_felt_found+ownership_language	discard	tone_change
16094	5.650	the_feel_felt_found+ownership_language	discard	tone_change
16095	5.650	the_feel_felt_found+ownership_language	discard	tone_change
16096	5.450	the_feel_felt_found+ownership_language	discard	tone_change
16097	5.300	the_feel_felt_found+ownership_language	discard	temp_0.70
16098	5.325	the_feel_felt_found+ownership_language+validation_before_solution	discard	add_validation_before_solution
16099	5.450	ownership_language	discard	remove_the_feel_felt_found
16100	4.825	the_feel_felt_found+ownership_language+personal_touch	discard	add_personal_touch
16101	4.800	the_feel_felt_found+ownership_language+validation_before_solution	discard	add_validation_before_solution
16102	5.013	the_feel_felt_found+casual_professionalism	discard	swap_ownership_language_for_casual_professionalism
16103	5.338	the_feel_felt_found+ownership_language	discard	tone_change
16104	5.350	the_feel_felt_found+ownership_language+casual_professionalism	discard	add_casual_professionalism
16105	4.787	ownership_language	discard	crossover
16106	4.625	the_feel_felt_found+ownership_language	discard	temp_0.75
16107	5.550	the_feel_felt_found+ownership_language	discard	tone_change
16108	5.550	the_feel_felt_found+never_say_calm_down	discard	swap_ownership_language_for_never_say_calm_down
16109	5.013	the_feel_felt_found+ownership_language	discard	temp_0.95
16110	5.450	ownership_language	discard	remove_the_feel_felt_found
16111	5.100	the_feel_felt_found+ownership_language+emotional_labeling	discard	add_emotional_labeling
16112	5.550	the_feel_felt_found+ownership_language	discard	tone_change
16113	4.800	the_feel_felt_found+ownership_language	discard	tone_change
16114	5.138	the_feel_felt_found+energy_matching	discard	swap_ownership_language_for_energy_matching
16115	5.750	none	discard	crossover
16116	4.700	ownership_language+mirroring	discard	swap_the_feel_felt_found_for_mirroring
16117	4.825	the_feel_felt_found+ownership_language+proactive_extras	discard	add_proactive_extras
16118	4.888	the_feel_felt_found+ownership_language	discard	tone_change
16119	4.888	the_feel_felt_found+ownership_language	discard	tone_change
16120	5.450	the_feel_felt_found+ownership_language+validation_before_solution	discard	add_validation_before_solution
16121	5.425	the_feel_felt_found+ownership_language	discard	tone_change
16122	5.113	the_feel_felt_found+genuine_admission	discard	swap_ownership_language_for_genuine_admission
16123	5.238	ownership_language	discard	crossover
16124	5.350	the_feel_felt_found+ownership_language	discard	tone_change
16125	5.450	the_feel_felt_found+ownership_language	discard	tone_change
16126	4.888	the_feel_felt_found+genuine_admission	discard	swap_ownership_language_for_genuine_admission
16127	5.200	the_feel_felt_found+ownership_language+concrete_next_steps	discard	add_concrete_next_steps
16128	5.237	the_feel_felt_found+ownership_language+warmth_injection	discard	add_warmth_injection
16129	5.537	the_feel_felt_found+ownership_language+casual_professionalism	discard	add_casual_professionalism
16130	5.112	the_feel_felt_found+ownership_language	discard	temp_0.65
16131	4.900	the_feel_felt_found+ownership_language	discard	crossover
16132	5.138	the_feel_felt_found+ownership_language+personal_touch	discard	add_personal_touch
16133	5.138	the_feel_felt_found+ownership_language	discard	temp_0.85
16134	5.450	the_feel_felt_found+ownership_language+mirroring	discard	add_mirroring
16135	5.138	the_feel_felt_found+ownership_language	discard	tone_change
16136	5.238	ownership_language+energy_matching	discard	swap_the_feel_felt_found_for_energy_matching
16137	5.325	the_feel_felt_found+ownership_language+concrete_next_steps	discard	add_concrete_next_steps
16138	5.075	the_feel_felt_found+ownership_language+strategic_agreement	discard	add_strategic_agreement
16139	5.225	the_feel_felt_found+ownership_language	discard	temp_0.70
16140	5.438	the_feel_felt_found+ownership_language	discard	temp_0.65
16141	5.325	the_feel_felt_found+ownership_language+validation_before_solution	discard	add_validation_before_solution
16142	5.450	the_feel_felt_found+strategic_agreement	discard	swap_ownership_language_for_strategic_agreement
16143	5.425	ownership_language+emotional_labeling	discard	swap_the_feel_felt_found_for_emotional_labeling
16144	5.237	the_feel_felt_found+ownership_language	discard	tone_change
16145	5.013	the_feel_felt_found+ownership_language	discard	crossover
16146	5.550	the_feel_felt_found+genuine_admission	discard	swap_ownership_language_for_genuine_admission
16147	5.013	the_feel_felt_found+ownership_language	discard	tone_change
16148	5.550	the_feel_felt_found+ownership_language+warmth_injection	discard	add_warmth_injection
16149	5.325	the_feel_felt_found+ownership_language	discard	tone_change
16150	5.038	the_feel_felt_found+ownership_language	discard	temp_0.85
16151	5.038	the_feel_felt_found+ownership_language+energy_matching	discard	add_energy_matching
16152	5.138	the_feel_felt_found+ownership_language	discard	tone_change
16153	5.338	the_feel_felt_found+ownership_language	discard	tone_change
16154	5.550	the_feel_felt_found	discard	remove_ownership_language
16155	5.225	the_feel_felt_found+ownership_language	discard	temp_0.90
16156	5.013	the_feel_felt_found+ownership_language	discard	temp_0.70
16157	5.213	the_feel_felt_found+personal_touch	discard	swap_ownership_language_for_personal_touch
16158	5.237	the_feel_felt_found+ownership_language	discard	temp_0.85
16159	5.425	the_feel_felt_found+ownership_language+validation_before_solution	discard	add_validation_before_solution
16160	4.825	ownership_language+mirroring	discard	swap_the_feel_felt_found_for_mirroring
16161	5.138	the_feel_felt_found+ownership_language+genuine_admission	discard	add_genuine_admission
16162	4.925	ownership_language	discard	remove_the_feel_felt_found
16163	5.450	ownership_language+emotional_labeling	discard	swap_the_feel_felt_found_for_emotional_labeling
16164	5.325	the_feel_felt_found	discard	remove_ownership_language
16165	5.237	the_feel_felt_found+ownership_language	discard	tone_change
16166	5.112	the_feel_felt_found+ownership_language	discard	tone_change
16167	5.013	the_feel_felt_found+ownership_language	discard	temp_0.95
16168	4.938	the_feel_felt_found+ownership_language	discard	tone_change
16169	5.325	the_feel_felt_found+ownership_language	discard	temp_0.70
16170	5.350	the_feel_felt_found+ownership_language	discard	tone_change
16171	5.550	ownership_language+never_say_calm_down	discard	swap_the_feel_felt_found_for_never_say_calm_down
16172	5.237	the_feel_felt_found+casual_professionalism	discard	swap_ownership_language_for_casual_professionalism
16173	5.138	the_feel_felt_found+ownership_language	discard	crossover
16174	4.925	the_feel_felt_found+ownership_language+strategic_agreement	discard	add_strategic_agreement
16175	5.138	none	discard	crossover
16176	5.450	the_feel_felt_found+ownership_language	discard	tone_change
16177	5.425	the_feel_felt_found+ownership_language+proactive_extras	discard	add_proactive_extras
16178	5.450	the_feel_felt_found+ownership_language	discard	tone_change
16179	5.325	the_feel_felt_found+ownership_language	discard	tone_change
16180	5.025	ownership_language	discard	crossover
16181	5.350	ownership_language	discard	crossover
16182	5.650	the_feel_felt_found+ownership_language	discard	temp_0.90
16183	5.425	the_feel_felt_found	discard	remove_ownership_language
16184	5.338	the_feel_felt_found+ownership_language+casual_professionalism	discard	add_casual_professionalism
16185	5.450	the_feel_felt_found+ownership_language	discard	tone_change
16186	4.925	the_feel_felt_found+ownership_language	discard	tone_change
16187	5.425	the_feel_felt_found+proactive_extras	discard	swap_ownership_language_for_proactive_extras
16188	4.925	the_feel_felt_found+ownership_language	discard	tone_change
16189	5.450	the_feel_felt_found	discard	crossover
16190	5.550	the_feel_felt_found+casual_professionalism	discard	swap_ownership_language_for_casual_professionalism
16191	5.225	the_feel_felt_found+ownership_language+never_say_calm_down	discard	add_never_say_calm_down
16192	5.525	ownership_language+personal_touch	discard	swap_the_feel_felt_found_for_personal_touch
16193	5.138	the_feel_felt_found+ownership_language	discard	tone_change
16194	5.200	the_feel_felt_found+ownership_language	discard	tone_change
16195	4.925	the_feel_felt_found+personal_touch	discard	swap_ownership_language_for_personal_touch
16196	5.550	the_feel_felt_found+ownership_language+personal_touch	discard	add_personal_touch
16197	5.013	ownership_language+concrete_next_steps	discard	swap_the_feel_felt_found_for_concrete_next_steps
16198	5.138	the_feel_felt_found+ownership_language	discard	crossover
16199	4.888	the_feel_felt_found+ownership_language+energy_matching	discard	add_energy_matching
16200	5.450	the_feel_felt_found+warmth_injection	discard	swap_ownership_language_for_warmth_injection
16201	5.200	the_feel_felt_found+ownership_language	discard	tone_change
16202	5.425	the_feel_felt_found+ownership_language	discard	crossover
16203	5.450	the_feel_felt_found+ownership_language	discard	tone_change
16204	4.925	the_feel_felt_found+ownership_language	discard	tone_change
16205	5.450	the_feel_felt_found+ownership_language	discard	crossover
16206	5.013	the_feel_felt_found+ownership_language+energy_matching	discard	add_energy_matching
16207	5.425	ownership_language	discard	remove_the_feel_felt_found
16208	5.237	the_feel_felt_found	discard	remove_ownership_language
16209	5.350	the_feel_felt_found+ownership_language	discard	crossover
16210	5.112	the_feel_felt_found+ownership_language	discard	crossover
16211	5.325	the_feel_felt_found+ownership_language	discard	temp_0.85
16212	5.338	the_feel_felt_found+ownership_language	discard	tone_change
16213	5.013	the_feel_felt_found+ownership_language	discard	crossover
16214	5.325	the_feel_felt_found+ownership_language+concrete_next_steps	discard	add_concrete_next_steps
16215	5.325	the_feel_felt_found+ownership_language	discard	temp_0.95
16216	5.113	the_feel_felt_found+ownership_language	discard	tone_change
16217	5.325	the_feel_felt_found	discard	crossover
16218	4.925	the_feel_felt_found+ownership_language	discard	tone_change
16219	5.550	the_feel_felt_found+ownership_language	discard	crossover
16220	5.550	the_feel_felt_found+ownership_language	discard	tone_change
16221	5.550	the_feel_felt_found+ownership_language	discard	tone_change
16222	5.200	the_feel_felt_found+ownership_language	discard	tone_change
16223	5.337	the_feel_felt_found+ownership_language	discard	tone_change
16224	5.237	the_feel_felt_found+ownership_language	discard	temp_0.75
16225	5.325	the_feel_felt_found+ownership_language+warmth_injection	discard	add_warmth_injection
16226	5.025	the_feel_felt_found+ownership_language	discard	tone_change
16227	5.250	the_feel_felt_found+ownership_language+strategic_agreement	discard	add_strategic_agreement
16228	5.213	the_feel_felt_found	discard	remove_ownership_language
16229	4.700	the_feel_felt_found+ownership_language	discard	crossover
16230	5.550	the_feel_felt_found+ownership_language	discard	tone_change
16231	5.300	the_feel_felt_found+ownership_language	discard	temp_0.85
16232	5.425	the_feel_felt_found+ownership_language+warmth_injection	discard	add_warmth_injection
16233	4.925	the_feel_felt_found	discard	crossover
16234	5.013	the_feel_felt_found+ownership_language	discard	tone_change
16235	4.825	the_feel_felt_found	discard	crossover
16236	5.113	the_feel_felt_found+ownership_language+warmth_injection	discard	add_warmth_injection
16237	5.138	the_feel_felt_found+ownership_language+personal_touch	discard	add_personal_touch
16238	4.825	the_feel_felt_found+ownership_language	discard	crossover
16239	5.425	ownership_language+warmth_injection	discard	swap_the_feel_felt_found_for_warmth_injection
16240	4.925	the_feel_felt_found+ownership_language	discard	temp_0.85
16241	5.450	the_feel_felt_found+ownership_language	discard	tone_change
16242	5.450	the_feel_felt_found+ownership_language	discard	tone_change
16243	5.013	the_feel_felt_found+ownership_language	discard	temp_0.70
16244	5.200	the_feel_felt_found+concrete_next_steps	discard	swap_ownership_language_for_concrete_next_steps
16245	4.912	the_feel_felt_found+ownership_language+energy_matching	discard	add_energy_matching
16246	5.525	the_feel_felt_found+ownership_language	discard	tone_change
16247	5.238	the_feel_felt_found	discard	crossover
16248	5.238	none	discard	crossover
16249	5.237	ownership_language+strategic_agreement	discard	swap_the_feel_felt_found_for_strategic_agreement
16250	5.013	the_feel_felt_found	discard	crossover
16251	4.925	the_feel_felt_found+ownership_language	discard	tone_change
16252	5.112	the_feel_felt_found	discard	crossover
16253	5.425	the_feel_felt_found+ownership_language+emotional_labeling	discard	add_emotional_labeling
16254	5.312	the_feel_felt_found+ownership_language	discard	tone_change
16255	5.450	ownership_language	discard	remove_the_feel_felt_found
16256	5.200	the_feel_felt_found	discard	crossover
16257	4.725	the_feel_felt_found+warmth_injection	discard	swap_ownership_language_for_warmth_injection
16258	5.138	the_feel_felt_found+ownership_language+warmth_injection	discard	add_warmth_injection
16259	5.013	the_feel_felt_found+ownership_language+energy_matching	discard	add_energy_matching
16260	5.325	the_feel_felt_found+ownership_language+energy_matching	discard	add_energy_matching
16261	5.013	the_feel_felt_found+ownership_language+never_say_calm_down	discard	add_never_say_calm_down
16262	5.025	the_feel_felt_found	discard	remove_ownership_language
16263	4.938	the_feel_felt_found+ownership_language	discard	temp_0.95
16264	5.237	the_feel_felt_found	discard	remove_ownership_language
16265	5.238	ownership_language+mirroring	discard	swap_the_feel_felt_found_for_mirroring
16266	5.550	the_feel_felt_found+ownership_language	discard	temp_0.75
16267	5.525	the_feel_felt_found+ownership_language+energy_matching	discard	add_energy_matching
16268	5.200	the_feel_felt_found+ownership_language+strategic_agreement	discard	add_strategic_agreement
16269	5.425	the_feel_felt_found+ownership_language+casual_professionalism	discard	add_casual_professionalism
16270	5.137	the_feel_felt_found	discard	crossover
16271	5.138	the_feel_felt_found+ownership_language+genuine_admission	discard	add_genuine_admission
16272	5.175	the_feel_felt_found	discard	crossover
16273	5.325	the_feel_felt_found+ownership_language	discard	crossover
16274	5.237	none	discard	crossover
16275	5.425	ownership_language	discard	crossover
16276	5.112	the_feel_felt_found+ownership_language	discard	temp_0.90
16277	5.450	the_feel_felt_found+ownership_language	discard	tone_change
16278	5.237	the_feel_felt_found	discard	crossover
16279	5.112	the_feel_felt_found+ownership_language+emotional_labeling	discard	add_emotional_labeling
16280	5.450	ownership_language	discard	crossover
16281	5.138	the_feel_felt_found+validation_before_solution	discard	swap_ownership_language_for_validation_before_solution
16282	5.013	the_feel_felt_found+ownership_language+proactive_extras	discard	add_proactive_extras
16283	5.138	the_feel_felt_found+validation_before_solution	discard	swap_ownership_language_for_validation_before_solution
16284	5.550	the_feel_felt_found+ownership_language	discard	tone_change
16285	5.112	the_feel_felt_found+ownership_language	discard	tone_change
16286	5.100	the_feel_felt_found	discard	remove_ownership_language
16287	4.888	ownership_language	discard	crossover
16288	5.450	ownership_language+energy_matching	discard	swap_the_feel_felt_found_for_energy_matching
16289	4.912	the_feel_felt_found+mirroring	discard	swap_ownership_language_for_mirroring
16290	5.325	the_feel_felt_found+ownership_language	discard	tone_change
16291	5.025	the_feel_felt_found+ownership_language	discard	crossover
16292	5.325	the_feel_felt_found+ownership_language	discard	tone_change
16293	5.450	the_feel_felt_found+ownership_language	discard	temp_0.65
