generation	eq_score	techniques	status	description
6151	5.225	the_feel_felt_found+ownership_language	discard	temp_0.90
6152	5.013	the_feel_felt_found	discard	crossover
6153	5.450	the_feel_felt_found+genuine_admission	discard	swap_ownership_language_for_genuine_admission
6154	5.350	none	discard	crossover
6155	4.725	ownership_language	discard	remove_the_feel_felt_found
6156	5.025	the_feel_felt_found+ownership_language	discard	crossover
6157	4.987	the_feel_felt_found+ownership_language	discard	tone_change
6158	5.338	the_feel_felt_found+ownership_language+strategic_agreement	discard	add_strategic_agreement
6159	4.800	the_feel_felt_found+ownership_language	discard	tone_change
6160	5.325	none	discard	crossover
6161	5.425	ownership_language+strategic_agreement	discard	swap_the_feel_felt_found_for_strategic_agreement
6162	5.237	ownership_language+warmth_injection	discard	swap_the_feel_felt_found_for_warmth_injection
6163	5.138	the_feel_felt_found+ownership_language	discard	temp_0.65
6164	4.925	the_feel_felt_found+ownership_language	discard	crossover
6165	5.238	the_feel_felt_found+genuine_admission	discard	swap_ownership_language_for_genuine_admission
6166	5.325	the_feel_felt_found+ownership_language	discard	tone_change
6167	5.225	the_feel_felt_found+ownership_language	discard	temp_0.75
6168	5.450	the_feel_felt_found+ownership_language	discard	tone_change
6169	5.237	the_feel_felt_found+ownership_language	discard	tone_change
6170	5.550	the_feel_felt_found+ownership_language	discard	crossover
6171	5.450	the_feel_felt_found+ownership_language	discard	temp_0.70
6172	5.013	the_feel_felt_found+energy_matching	discard	swap_ownership_language_for_energy_matching
6173	5.112	the_feel_felt_found+ownership_language+emotional_labeling	discard	add_emotional_labeling
6174	5.425	ownership_language+mirroring	discard	swap_the_feel_felt_found_for_mirroring
6175	5.037	the_feel_felt_found	discard	crossover
6176	5.237	the_feel_felt_found+ownership_language+proactive_extras	discard	add_proactive_extras
6177	5.325	the_feel_felt_found+ownership_language	discard	tone_change
6178	5.100	ownership_language	discard	remove_the_feel_felt_found
6179	5.425	ownership_language+concrete_next_steps	discard	swap_the_feel_felt_found_for_concrete_next_steps
6180	5.450	the_feel_felt_found+ownership_language+proactive_extras	discard	add_proactive_extras
6181	5.450	the_feel_felt_found	discard	remove_ownership_language
6182	5.013	the_feel_felt_found+ownership_language	discard	temp_0.70
6183	5.250	ownership_language+never_say_calm_down	discard	swap_the_feel_felt_found_for_never_say_calm_down
6184	4.825	the_feel_felt_found+concrete_next_steps	discard	swap_ownership_language_for_concrete_next_steps
6185	5.550	the_feel_felt_found+ownership_language	discard	tone_change
6186	5.338	the_feel_felt_found+ownership_language+concrete_next_steps	discard	add_concrete_next_steps
6187	5.025	the_feel_felt_found+mirroring	discard	swap_ownership_language_for_mirroring
6188	5.338	ownership_language+validation_before_solution	discard	swap_the_feel_felt_found_for_validation_before_solution
6189	5.425	the_feel_felt_found+ownership_language	discard	temp_0.75
6190	4.700	the_feel_felt_found+ownership_language+warmth_injection	discard	add_warmth_injection
6191	5.337	the_feel_felt_found	discard	crossover
6192	5.325	the_feel_felt_found+genuine_admission	discard	swap_ownership_language_for_genuine_admission
6193	5.550	the_feel_felt_found+ownership_language	discard	tone_change
6194	5.237	the_feel_felt_found+ownership_language	discard	temp_0.65
6195	5.138	the_feel_felt_found+ownership_language+concrete_next_steps	discard	add_concrete_next_steps
6196	5.200	the_feel_felt_found+never_say_calm_down	discard	swap_ownership_language_for_never_say_calm_down
6197	4.613	the_feel_felt_found	discard	remove_ownership_language
6198	4.825	the_feel_felt_found+ownership_language+energy_matching	discard	add_energy_matching
6199	5.013	the_feel_felt_found+ownership_language	discard	temp_0.90
6200	5.013	ownership_language+casual_professionalism	discard	swap_the_feel_felt_found_for_casual_professionalism
6201	5.450	the_feel_felt_found+ownership_language	discard	tone_change
6202	5.138	the_feel_felt_found+ownership_language+never_say_calm_down	discard	add_never_say_calm_down
6203	5.450	the_feel_felt_found+ownership_language	discard	tone_change
6204	5.238	the_feel_felt_found+ownership_language	discard	tone_change
6205	5.013	the_feel_felt_found+ownership_language	discard	tone_change
6206	5.237	the_feel_felt_found+ownership_language	discard	tone_change
6207	5.550	the_feel_felt_found+warmth_injection	discard	swap_ownership_language_for_warmth_injection
6208	5.425	the_feel_felt_found+ownership_language	discard	crossover
6209	5.325	the_feel_felt_found	discard	remove_ownership_language
6210	5.450	the_feel_felt_found+ownership_language	discard	crossover
6211	5.325	the_feel_felt_found+ownership_language+mirroring	discard	add_mirroring
6212	5.238	the_feel_felt_found+ownership_language	discard	crossover
6213	5.338	the_feel_felt_found+ownership_language	discard	tone_change
6214	5.550	the_feel_felt_found+ownership_language	discard	tone_change
6215	5.325	the_feel_felt_found+ownership_language	discard	temp_0.95
6216	5.138	the_feel_felt_found+ownership_language	discard	tone_change
6217	4.712	none	discard	crossover
6218	5.325	the_feel_felt_found+ownership_language	discard	temp_0.85
6219	5.525	ownership_language	discard	remove_the_feel_felt_found
6220	5.238	the_feel_felt_found+ownership_language+energy_matching	discard	add_energy_matching
6221	5.112	the_feel_felt_found+ownership_language+validation_before_solution	discard	add_validation_before_solution
6222	5.200	the_feel_felt_found+ownership_language+casual_professionalism	discard	add_casual_professionalism
6223	5.325	the_feel_felt_found+ownership_language+validation_before_solution	discard	add_validation_before_solution
6224	5.225	the_feel_felt_found+ownership_language+emotional_labeling	discard	add_emotional_labeling
6225	5.325	the_feel_felt_found+ownership_language	discard	temp_0.90
6226	5.212	the_feel_felt_found+ownership_language	discard	tone_change
6227	5.550	the_feel_felt_found+ownership_language	discard	crossover
6228	5.450	the_feel_felt_found	discard	remove_ownership_language
6229	5.338	the_feel_felt_found+validation_before_solution	discard	swap_ownership_language_for_validation_before_solution
6230	5.237	the_feel_felt_found+ownership_language	discard	temp_0.85
6231	5.550	the_feel_felt_found+ownership_language	discard	temp_0.90
6232	5.450	the_feel_felt_found+ownership_language+genuine_admission	discard	add_genuine_admission
6233	5.013	the_feel_felt_found+ownership_language	discard	tone_change
6234	5.112	the_feel_felt_found+ownership_language+energy_matching	discard	add_energy_matching
6235	5.012	the_feel_felt_found+ownership_language+warmth_injection	discard	add_warmth_injection
6236	5.325	the_feel_felt_found+ownership_language	discard	crossover
6237	5.112	the_feel_felt_found+ownership_language+casual_professionalism	discard	add_casual_professionalism
6238	5.138	the_feel_felt_found+ownership_language	discard	temp_0.90
6239	5.450	ownership_language	discard	crossover
6240	5.650	the_feel_felt_found+ownership_language+warmth_injection	discard	add_warmth_injection
6241	5.025	the_feel_felt_found+ownership_language	discard	crossover
6242	5.013	the_feel_felt_found+ownership_language	discard	temp_0.90
6243	5.237	the_feel_felt_found+ownership_language	discard	tone_change
6244	5.550	the_feel_felt_found+ownership_language	discard	temp_0.85
6245	5.550	the_feel_felt_found+ownership_language+mirroring	discard	add_mirroring
6246	5.550	ownership_language	discard	remove_the_feel_felt_found
6247	5.225	the_feel_felt_found+ownership_language+warmth_injection	discard	add_warmth_injection
6248	4.612	the_feel_felt_found+ownership_language+mirroring	discard	add_mirroring
6249	5.450	ownership_language+personal_touch	discard	swap_the_feel_felt_found_for_personal_touch
6250	5.137	ownership_language+mirroring	discard	swap_the_feel_felt_found_for_mirroring
6251	5.138	the_feel_felt_found+ownership_language+warmth_injection	discard	add_warmth_injection
6252	5.325	the_feel_felt_found+ownership_language	discard	crossover
6253	5.525	the_feel_felt_found+ownership_language	discard	crossover
6254	5.325	the_feel_felt_found+casual_professionalism	discard	swap_ownership_language_for_casual_professionalism
6255	5.200	the_feel_felt_found+ownership_language	discard	tone_change
6256	5.237	the_feel_felt_found+ownership_language	discard	tone_change
6257	5.550	the_feel_felt_found+ownership_language+never_say_calm_down	discard	add_never_say_calm_down
6258	5.037	the_feel_felt_found+warmth_injection	discard	swap_ownership_language_for_warmth_injection
6259	5.625	the_feel_felt_found+never_say_calm_down	discard	swap_ownership_language_for_never_say_calm_down
6260	5.237	the_feel_felt_found+ownership_language	discard	temp_0.95
6261	5.112	the_feel_felt_found+ownership_language	discard	crossover
6262	5.237	the_feel_felt_found+ownership_language	discard	crossover
6263	5.550	the_feel_felt_found+ownership_language	discard	tone_change
6264	5.450	the_feel_felt_found	discard	crossover
6265	5.113	the_feel_felt_found+ownership_language	discard	crossover
6266	5.350	the_feel_felt_found+ownership_language	discard	tone_change
6267	5.013	ownership_language	discard	crossover
6268	5.450	the_feel_felt_found+ownership_language+strategic_agreement	discard	add_strategic_agreement
6269	5.113	the_feel_felt_found+ownership_language+concrete_next_steps	discard	add_concrete_next_steps
6270	5.300	the_feel_felt_found+ownership_language	discard	tone_change
6271	5.237	the_feel_felt_found+ownership_language	discard	tone_change
6272	5.425	the_feel_felt_found+ownership_language	discard	tone_change
6273	4.825	none	discard	crossover
6274	5.075	ownership_language+validation_before_solution	discard	swap_the_feel_felt_found_for_validation_before_solution
6275	5.438	the_feel_felt_found+ownership_language	discard	temp_0.90
6276	5.013	the_feel_felt_found+ownership_language+proactive_extras	discard	add_proactive_extras
6277	5.025	none	discard	crossover
6278	5.013	ownership_language	discard	crossover
6279	5.550	the_feel_felt_found+emotional_labeling	discard	swap_ownership_language_for_emotional_labeling
6280	4.925	the_feel_felt_found+ownership_language+strategic_agreement	discard	add_strategic_agreement
6281	5.237	the_feel_felt_found	discard	remove_ownership_language
6282	5.325	ownership_language+mirroring	discard	swap_the_feel_felt_found_for_mirroring
6283	5.325	the_feel_felt_found+ownership_language	discard	crossover
6284	5.013	the_feel_felt_found+ownership_language	discard	temp_0.95
6285	5.425	the_feel_felt_found+ownership_language+validation_before_solution	discard	add_validation_before_solution
6286	5.000	the_feel_felt_found+ownership_language+mirroring	discard	add_mirroring
6287	4.825	the_feel_felt_found+ownership_language+energy_matching	discard	add_energy_matching
6288	5.200	the_feel_felt_found+ownership_language	discard	temp_0.65
6289	5.112	the_feel_felt_found+ownership_language+proactive_extras	discard	add_proactive_extras
6290	5.200	the_feel_felt_found+ownership_language	discard	tone_change
6291	5.350	the_feel_felt_found+ownership_language	discard	temp_0.70
6292	5.450	ownership_language+emotional_labeling	discard	swap_the_feel_felt_found_for_emotional_labeling
6293	5.138	the_feel_felt_found+ownership_language	discard	crossover
6294	4.725	the_feel_felt_found+ownership_language+personal_touch	discard	add_personal_touch
6295	5.525	the_feel_felt_found+ownership_language+emotional_labeling	discard	add_emotional_labeling
6296	4.825	the_feel_felt_found+ownership_language+energy_matching	discard	add_energy_matching
6297	5.013	the_feel_felt_found+ownership_language	discard	crossover
6298	5.312	the_feel_felt_found+ownership_language	discard	crossover
6299	4.987	the_feel_felt_found+ownership_language	discard	temp_0.90
6300	5.237	the_feel_felt_found+genuine_admission	discard	swap_ownership_language_for_genuine_admission
6301	5.138	the_feel_felt_found+validation_before_solution	discard	swap_ownership_language_for_validation_before_solution
6302	4.912	the_feel_felt_found+ownership_language	discard	tone_change
6303	5.550	ownership_language	discard	remove_the_feel_felt_found
6304	5.225	the_feel_felt_found	discard	remove_ownership_language
6305	5.250	the_feel_felt_found+ownership_language	discard	crossover
6306	5.200	the_feel_felt_found+ownership_language+energy_matching	discard	add_energy_matching
6307	5.013	the_feel_felt_found+ownership_language	discard	tone_change
6308	5.100	ownership_language+never_say_calm_down	discard	swap_the_feel_felt_found_for_never_say_calm_down
6309	4.900	the_feel_felt_found	discard	crossover
6310	5.013	the_feel_felt_found+ownership_language	discard	temp_0.90
6311	5.338	the_feel_felt_found+ownership_language+genuine_admission	discard	add_genuine_admission
6312	5.325	the_feel_felt_found+ownership_language	discard	crossover
6313	5.338	the_feel_felt_found+ownership_language	discard	crossover
6314	5.138	the_feel_felt_found+ownership_language+genuine_admission	discard	add_genuine_admission
6315	5.450	the_feel_felt_found+ownership_language+emotional_labeling	discard	add_emotional_labeling
6316	5.450	the_feel_felt_found	discard	crossover
6317	5.237	the_feel_felt_found+ownership_language	discard	tone_change
6318	4.987	the_feel_felt_found+ownership_language	discard	crossover
6319	5.350	the_feel_felt_found+ownership_language	discard	crossover
6320	5.450	the_feel_felt_found+ownership_language	discard	crossover
6321	5.425	the_feel_felt_found+ownership_language+strategic_agreement	discard	add_strategic_agreement
6322	4.725	ownership_language+genuine_admission	discard	swap_the_feel_felt_found_for_genuine_admission
6323	5.450	the_feel_felt_found+ownership_language	discard	temp_0.75
6324	5.013	the_feel_felt_found+ownership_language	discard	tone_change
6325	4.925	the_feel_felt_found+ownership_language	discard	temp_0.75
6326	5.112	ownership_language	discard	remove_the_feel_felt_found
6327	5.425	the_feel_felt_found+ownership_language	discard	tone_change
6328	5.650	the_feel_felt_found+ownership_language+validation_before_solution	discard	add_validation_before_solution
6329	5.238	the_feel_felt_found+ownership_language	discard	tone_change
6330	5.550	the_feel_felt_found+ownership_language	discard	temp_0.95
6331	5.238	the_feel_felt_found+energy_matching	discard	swap_ownership_language_for_energy_matching
6332	5.425	the_feel_felt_found+ownership_language	discard	tone_change
6333	5.225	the_feel_felt_found+ownership_language	discard	crossover
6334	5.550	the_feel_felt_found+ownership_language	discard	crossover
6335	5.237	the_feel_felt_found+ownership_language	discard	tone_change
6336	5.450	the_feel_felt_found+ownership_language+warmth_injection	discard	add_warmth_injection
6337	5.200	the_feel_felt_found+ownership_language+energy_matching	discard	add_energy_matching
6338	5.325	the_feel_felt_found+ownership_language	discard	temp_0.90
6339	5.013	ownership_language	discard	remove_the_feel_felt_found
6340	5.425	the_feel_felt_found+ownership_language+warmth_injection	discard	add_warmth_injection
6341	4.800	ownership_language	discard	crossover
6342	5.138	the_feel_felt_found+ownership_language	discard	tone_change
6343	5.325	the_feel_felt_found+ownership_language+mirroring	discard	add_mirroring
6344	5.238	the_feel_felt_found+ownership_language	discard	tone_change
6345	5.450	ownership_language+energy_matching	discard	swap_the_feel_felt_found_for_energy_matching
6346	5.300	the_feel_felt_found+ownership_language+emotional_labeling	discard	add_emotional_labeling
6347	4.825	the_feel_felt_found+ownership_language	discard	temp_0.75
6348	5.450	the_feel_felt_found+ownership_language+emotional_labeling	discard	add_emotional_labeling
6349	5.300	the_feel_felt_found+ownership_language	discard	crossover
6350	5.550	ownership_language	discard	crossover
6351	5.112	the_feel_felt_found+ownership_language	discard	temp_0.75
6352	5.450	the_feel_felt_found+ownership_language+proactive_extras	discard	add_proactive_extras
6353	5.550	the_feel_felt_found+ownership_language	discard	tone_change
6354	5.237	ownership_language	discard	remove_the_feel_felt_found
6355	5.650	the_feel_felt_found+ownership_language	discard	tone_change
6356	4.925	the_feel_felt_found+ownership_language+emotional_labeling	discard	add_emotional_labeling
6357	5.213	the_feel_felt_found	discard	remove_ownership_language
6358	5.013	the_feel_felt_found+ownership_language+mirroring	discard	add_mirroring
6359	5.450	the_feel_felt_found	discard	remove_ownership_language
6360	5.350	the_feel_felt_found	discard	remove_ownership_language
6361	5.237	the_feel_felt_found+validation_before_solution	discard	swap_ownership_language_for_validation_before_solution
6362	5.013	the_feel_felt_found+ownership_language	discard	tone_change
6363	5.138	the_feel_felt_found+ownership_language	discard	tone_change
6364	4.825	the_feel_felt_found+ownership_language	discard	tone_change
6365	4.613	ownership_language+strategic_agreement	discard	swap_the_feel_felt_found_for_strategic_agreement
6366	5.325	the_feel_felt_found+ownership_language+personal_touch	discard	add_personal_touch
6367	5.450	the_feel_felt_found+ownership_language+strategic_agreement	discard	add_strategic_agreement
6368	5.237	the_feel_felt_found+ownership_language	discard	crossover
6369	5.200	the_feel_felt_found	discard	crossover
6370	4.925	the_feel_felt_found+ownership_language	discard	crossover
6371	5.213	the_feel_felt_found+ownership_language	discard	temp_0.85
6372	4.800	the_feel_felt_found+ownership_language	discard	tone_change
6373	5.138	ownership_language	discard	crossover
6374	4.825	ownership_language	discard	crossover
6375	4.675	the_feel_felt_found	discard	crossover
6376	5.650	the_feel_felt_found	discard	crossover
6377	5.350	the_feel_felt_found+ownership_language	discard	crossover
6378	5.013	the_feel_felt_found+ownership_language+personal_touch	discard	add_personal_touch
6379	5.113	the_feel_felt_found+ownership_language	discard	temp_0.85
6380	5.237	the_feel_felt_found+ownership_language	discard	tone_change
6381	4.925	the_feel_felt_found+ownership_language	discard	temp_0.75
6382	5.325	the_feel_felt_found+ownership_language	discard	tone_change
6383	4.925	the_feel_felt_found+ownership_language+validation_before_solution	discard	add_validation_before_solution
6384	5.350	the_feel_felt_found+ownership_language	discard	tone_change
6385	5.138	the_feel_felt_found+ownership_language	discard	temp_0.90
6386	5.550	the_feel_felt_found+ownership_language	discard	tone_change
6387	4.888	ownership_language	discard	crossover
6388	5.550	the_feel_felt_found+ownership_language	discard	temp_0.95
6389	5.013	the_feel_felt_found	discard	remove_ownership_language
6390	5.237	the_feel_felt_found+ownership_language+never_say_calm_down	discard	add_never_say_calm_down
6391	5.237	ownership_language+strategic_agreement	discard	swap_the_feel_felt_found_for_strategic_agreement
6392	5.450	the_feel_felt_found+ownership_language+proactive_extras	discard	add_proactive_extras
6393	4.925	ownership_language+emotional_labeling	discard	swap_the_feel_felt_found_for_emotional_labeling
6394	5.425	the_feel_felt_found+ownership_language+emotional_labeling	discard	add_emotional_labeling
6395	5.425	none	discard	crossover
6396	5.550	the_feel_felt_found+ownership_language+proactive_extras	discard	add_proactive_extras
6397	5.425	the_feel_felt_found+ownership_language+casual_professionalism	discard	add_casual_professionalism
6398	5.325	the_feel_felt_found+ownership_language+personal_touch	discard	add_personal_touch
6399	5.225	the_feel_felt_found+ownership_language	discard	tone_change
6400	5.038	the_feel_felt_found	discard	remove_ownership_language
6401	5.025	the_feel_felt_found	discard	remove_ownership_language
6402	5.350	the_feel_felt_found+ownership_language	discard	crossover
6403	5.325	the_feel_felt_found+ownership_language	discard	tone_change
6404	5.550	the_feel_felt_found	discard	crossover
6405	5.225	the_feel_felt_found+ownership_language+emotional_labeling	discard	add_emotional_labeling
6406	5.350	the_feel_felt_found+ownership_language	discard	temp_0.85
6407	5.300	ownership_language	discard	crossover
6408	5.225	the_feel_felt_found	discard	remove_ownership_language
6409	5.425	the_feel_felt_found+ownership_language	discard	temp_0.95
6410	5.425	the_feel_felt_found+ownership_language	discard	crossover
6411	5.138	ownership_language	discard	crossover
6412	5.112	the_feel_felt_found	discard	crossover
6413	5.037	ownership_language	discard	crossover
6414	4.713	the_feel_felt_found+ownership_language+warmth_injection	discard	add_warmth_injection
6415	5.450	the_feel_felt_found+ownership_language	discard	tone_change
6416	5.425	the_feel_felt_found+ownership_language	discard	temp_0.75
6417	5.525	the_feel_felt_found+ownership_language+concrete_next_steps	discard	add_concrete_next_steps
6418	5.237	the_feel_felt_found+ownership_language	discard	temp_0.85
6419	5.088	the_feel_felt_found+ownership_language+genuine_admission	discard	add_genuine_admission
6420	5.325	ownership_language	discard	crossover
6421	4.600	the_feel_felt_found+ownership_language	discard	crossover
6422	5.200	the_feel_felt_found	discard	remove_ownership_language
6423	5.450	ownership_language+casual_professionalism	discard	swap_the_feel_felt_found_for_casual_professionalism
6424	5.138	the_feel_felt_found+ownership_language+energy_matching	discard	add_energy_matching
6425	4.700	the_feel_felt_found+validation_before_solution	discard	swap_ownership_language_for_validation_before_solution
6426	5.450	the_feel_felt_found+ownership_language	discard	crossover
6427	5.350	the_feel_felt_found+ownership_language+emotional_labeling	discard	add_emotional_labeling
6428	4.888	the_feel_felt_found+ownership_language+validation_before_solution	discard	add_validation_before_solution
6429	5.013	the_feel_felt_found+validation_before_solution	discard	swap_ownership_language_for_validation_before_solution
6430	5.325	ownership_language	discard	remove_the_feel_felt_found
