generation	eq_score	techniques	status	description
5317	4.825	the_feel_felt_found	discard	remove_ownership_language
5318	5.200	the_feel_felt_found+ownership_language+genuine_admission	discard	add_genuine_admission
5319	4.913	the_feel_felt_found+ownership_language	discard	temp_0.65
5320	4.800	the_feel_felt_found+ownership_language+personal_touch	discard	add_personal_touch
5321	5.237	the_feel_felt_found+ownership_language	discard	tone_change
5322	4.987	the_feel_felt_found+ownership_language+casual_professionalism	discard	add_casual_professionalism
5323	5.237	the_feel_felt_found+mirroring	discard	swap_ownership_language_for_mirroring
5324	4.888	ownership_language	discard	remove_the_feel_felt_found
5325	5.325	the_feel_felt_found	discard	crossover
5326	4.987	the_feel_felt_found+ownership_language	discard	crossover
5327	5.325	ownership_language+energy_matching	discard	swap_the_feel_felt_found_for_energy_matching
5328	4.825	the_feel_felt_found+ownership_language	discard	temp_0.95
5329	5.325	the_feel_felt_found+ownership_language	discard	tone_change
5330	5.450	the_feel_felt_found+ownership_language+emotional_labeling	discard	add_emotional_labeling
5331	5.237	the_feel_felt_found+ownership_language	discard	tone_change
5332	4.925	the_feel_felt_found+ownership_language	discard	temp_0.70
5333	5.237	the_feel_felt_found+ownership_language	discard	temp_0.65
5334	5.325	the_feel_felt_found+ownership_language+energy_matching	discard	add_energy_matching
5335	5.200	the_feel_felt_found	discard	crossover
5336	5.237	the_feel_felt_found+ownership_language+validation_before_solution	discard	add_validation_before_solution
5337	5.650	the_feel_felt_found+ownership_language+energy_matching	discard	add_energy_matching
5338	5.350	the_feel_felt_found+ownership_language	discard	tone_change
5339	5.300	the_feel_felt_found+ownership_language	discard	crossover
5340	5.013	the_feel_felt_found+ownership_language+proactive_extras	discard	add_proactive_extras
5341	5.112	the_feel_felt_found+ownership_language	discard	temp_0.95
5342	5.325	the_feel_felt_found	discard	crossover
5343	4.825	the_feel_felt_found+personal_touch	discard	swap_ownership_language_for_personal_touch
5344	5.237	the_feel_felt_found+ownership_language	discard	tone_change
5345	5.138	the_feel_felt_found+ownership_language	discard	temp_0.70
5346	4.825	ownership_language+personal_touch	discard	swap_the_feel_felt_found_for_personal_touch
5347	4.575	the_feel_felt_found+ownership_language	discard	crossover
5348	5.238	the_feel_felt_found+ownership_language	discard	crossover
5349	5.550	the_feel_felt_found+ownership_language	discard	temp_0.65
5350	5.400	the_feel_felt_found+mirroring	discard	swap_ownership_language_for_mirroring
5351	5.550	the_feel_felt_found+ownership_language+mirroring	discard	add_mirroring
5352	5.325	the_feel_felt_found+ownership_language	discard	tone_change
5353	5.075	ownership_language+strategic_agreement	discard	swap_the_feel_felt_found_for_strategic_agreement
5354	5.013	the_feel_felt_found+ownership_language+strategic_agreement	discard	add_strategic_agreement
5355	5.138	the_feel_felt_found+ownership_language	discard	tone_change
5356	4.613	the_feel_felt_found+ownership_language	discard	temp_0.95
5357	5.550	the_feel_felt_found+ownership_language+proactive_extras	discard	add_proactive_extras
5358	5.112	the_feel_felt_found+warmth_injection	discard	swap_ownership_language_for_warmth_injection
5359	5.225	the_feel_felt_found+ownership_language	discard	tone_change
5360	5.450	the_feel_felt_found+ownership_language+mirroring	discard	add_mirroring
5361	5.200	ownership_language	discard	crossover
5362	5.138	the_feel_felt_found+ownership_language	discard	temp_0.90
5363	5.013	the_feel_felt_found+ownership_language+validation_before_solution	discard	add_validation_before_solution
5364	5.450	ownership_language+genuine_admission	discard	swap_the_feel_felt_found_for_genuine_admission
5365	5.200	ownership_language	discard	remove_the_feel_felt_found
5366	5.325	the_feel_felt_found+ownership_language	discard	crossover
5367	5.450	the_feel_felt_found+ownership_language+never_say_calm_down	discard	add_never_say_calm_down
5368	5.450	ownership_language+mirroring	discard	swap_the_feel_felt_found_for_mirroring
5369	4.700	the_feel_felt_found+ownership_language	discard	crossover
5370	5.237	none	discard	crossover
5371	5.450	the_feel_felt_found+ownership_language+casual_professionalism	discard	add_casual_professionalism
5372	5.138	the_feel_felt_found+ownership_language	discard	crossover
5373	5.650	ownership_language	discard	remove_the_feel_felt_found
5374	5.425	the_feel_felt_found+ownership_language	discard	tone_change
5375	5.325	the_feel_felt_found+never_say_calm_down	discard	swap_ownership_language_for_never_say_calm_down
5376	5.650	the_feel_felt_found+ownership_language	discard	tone_change
5377	5.138	the_feel_felt_found	discard	crossover
5378	5.450	the_feel_felt_found+ownership_language	discard	tone_change
5379	5.450	the_feel_felt_found	discard	remove_ownership_language
5380	5.450	the_feel_felt_found+ownership_language	discard	temp_0.95
5381	5.138	ownership_language+mirroring	discard	swap_the_feel_felt_found_for_mirroring
5382	4.800	the_feel_felt_found+ownership_language	discard	tone_change
5383	5.425	the_feel_felt_found+ownership_language	discard	tone_change
5384	5.013	the_feel_felt_found+ownership_language	discard	tone_change
5385	5.325	the_feel_felt_found+ownership_language	discard	temp_0.95
5386	5.450	the_feel_felt_found	discard	crossover
5387	5.138	the_feel_felt_found+ownership_language	discard	tone_change
5388	5.550	the_feel_felt_found+ownership_language	discard	crossover
5389	5.138	the_feel_felt_found+ownership_language	discard	tone_change
5390	5.450	the_feel_felt_found+ownership_language	discard	temp_0.90
5391	5.350	the_feel_felt_found+ownership_language+concrete_next_steps	discard	add_concrete_next_steps
5392	4.925	the_feel_felt_found+ownership_language	discard	crossover
5393	4.925	the_feel_felt_found+ownership_language	discard	crossover
5394	5.650	the_feel_felt_found+ownership_language	discard	tone_change
5395	5.013	the_feel_felt_found	discard	remove_ownership_language
5396	4.588	ownership_language	discard	crossover
5397	5.138	the_feel_felt_found	discard	remove_ownership_language
5398	5.450	the_feel_felt_found+personal_touch	discard	swap_ownership_language_for_personal_touch
5399	4.925	the_feel_felt_found+ownership_language	discard	crossover
5400	5.438	the_feel_felt_found+ownership_language	discard	tone_change
5401	5.437	the_feel_felt_found+ownership_language	discard	temp_0.70
5402	5.325	ownership_language	discard	crossover
5403	5.013	the_feel_felt_found+ownership_language+concrete_next_steps	discard	add_concrete_next_steps
5404	5.138	the_feel_felt_found	discard	crossover
5405	4.925	the_feel_felt_found+ownership_language	discard	temp_0.90
5406	5.212	the_feel_felt_found+ownership_language+energy_matching	discard	add_energy_matching
5407	5.112	the_feel_felt_found+ownership_language	discard	temp_0.95
5408	5.113	ownership_language	discard	crossover
5409	5.450	the_feel_felt_found+ownership_language+proactive_extras	discard	add_proactive_extras
5410	5.250	the_feel_felt_found+validation_before_solution	discard	swap_ownership_language_for_validation_before_solution
5411	5.013	the_feel_felt_found+ownership_language	discard	temp_0.95
5412	5.200	the_feel_felt_found+ownership_language	discard	crossover
5413	4.725	the_feel_felt_found+personal_touch	discard	swap_ownership_language_for_personal_touch
5414	5.550	the_feel_felt_found+ownership_language	discard	tone_change
5415	5.450	the_feel_felt_found+ownership_language	discard	temp_0.65
5416	5.550	the_feel_felt_found+ownership_language	discard	crossover
5417	5.550	the_feel_felt_found+ownership_language+personal_touch	discard	add_personal_touch
5418	5.425	ownership_language	discard	crossover
5419	5.025	ownership_language	discard	remove_the_feel_felt_found
5420	5.237	the_feel_felt_found+ownership_language	discard	temp_0.75
5421	5.325	the_feel_felt_found+ownership_language	discard	tone_change
5422	5.138	the_feel_felt_found+ownership_language+never_say_calm_down	discard	add_never_say_calm_down
5423	5.137	the_feel_felt_found+ownership_language	discard	temp_0.85
5424	5.337	the_feel_felt_found+ownership_language	discard	temp_0.90
5425	5.200	the_feel_felt_found+ownership_language	discard	tone_change
5426	5.425	ownership_language	discard	crossover
5427	5.237	the_feel_felt_found+ownership_language+casual_professionalism	discard	add_casual_professionalism
5428	5.550	the_feel_felt_found+ownership_language	discard	tone_change
5429	5.550	the_feel_felt_found+ownership_language+validation_before_solution	discard	add_validation_before_solution
5430	5.550	the_feel_felt_found+emotional_labeling	discard	swap_ownership_language_for_emotional_labeling
5431	5.550	the_feel_felt_found+ownership_language+mirroring	discard	add_mirroring
5432	5.338	the_feel_felt_found+ownership_language+warmth_injection	discard	add_warmth_injection
5433	5.137	the_feel_felt_found+ownership_language	discard	temp_0.90
5434	5.450	the_feel_felt_found+ownership_language+genuine_admission	discard	add_genuine_admission
5435	5.338	the_feel_felt_found+ownership_language	discard	tone_change
5436	5.350	the_feel_felt_found+ownership_language	discard	temp_0.90
5437	5.225	ownership_language	discard	remove_the_feel_felt_found
5438	5.450	the_feel_felt_found+ownership_language	discard	tone_change
5439	5.012	none	discard	crossover
5440	4.925	the_feel_felt_found+ownership_language	discard	tone_change
5441	5.325	ownership_language+personal_touch	discard	swap_the_feel_felt_found_for_personal_touch
5442	5.550	the_feel_felt_found+ownership_language	discard	tone_change
5443	5.450	the_feel_felt_found	discard	crossover
5444	5.237	the_feel_felt_found+ownership_language	discard	temp_0.90
5445	5.450	the_feel_felt_found+ownership_language	discard	tone_change
5446	5.550	the_feel_felt_found+ownership_language	discard	crossover
5447	5.338	the_feel_felt_found+energy_matching	discard	swap_ownership_language_for_energy_matching
5448	4.825	the_feel_felt_found+energy_matching	discard	swap_ownership_language_for_energy_matching
5449	4.987	the_feel_felt_found+ownership_language	discard	tone_change
5450	5.138	the_feel_felt_found+ownership_language	discard	temp_0.75
5451	4.800	ownership_language+strategic_agreement	discard	swap_the_feel_felt_found_for_strategic_agreement
5452	5.238	the_feel_felt_found	discard	crossover
5453	5.013	the_feel_felt_found+ownership_language+casual_professionalism	discard	add_casual_professionalism
5454	4.825	ownership_language+energy_matching	discard	swap_the_feel_felt_found_for_energy_matching
5455	5.138	the_feel_felt_found+ownership_language	discard	tone_change
5456	5.450	the_feel_felt_found+ownership_language+mirroring	discard	add_mirroring
5457	5.112	the_feel_felt_found+concrete_next_steps	discard	swap_ownership_language_for_concrete_next_steps
5458	5.213	the_feel_felt_found+ownership_language	discard	tone_change
5459	4.825	the_feel_felt_found+validation_before_solution	discard	swap_ownership_language_for_validation_before_solution
5460	5.337	the_feel_felt_found+ownership_language	discard	crossover
5461	5.425	the_feel_felt_found	discard	remove_ownership_language
5462	5.237	ownership_language	discard	remove_the_feel_felt_found
5463	5.450	none	discard	crossover
5464	5.450	ownership_language	discard	remove_the_feel_felt_found
5465	5.200	the_feel_felt_found+ownership_language	discard	crossover
5466	5.525	the_feel_felt_found+ownership_language	discard	temp_0.85
5467	5.650	ownership_language+emotional_labeling	discard	swap_the_feel_felt_found_for_emotional_labeling
5468	5.025	the_feel_felt_found+ownership_language+casual_professionalism	discard	add_casual_professionalism
5469	5.013	the_feel_felt_found+ownership_language	discard	tone_change
5470	5.138	the_feel_felt_found+ownership_language+emotional_labeling	discard	add_emotional_labeling
5471	4.713	ownership_language	discard	crossover
5472	5.425	the_feel_felt_found+ownership_language	discard	tone_change
5473	4.925	the_feel_felt_found+ownership_language	discard	temp_0.95
5474	5.238	the_feel_felt_found+ownership_language	discard	tone_change
5475	5.300	the_feel_felt_found+ownership_language	discard	temp_0.85
5476	5.450	the_feel_felt_found+ownership_language	discard	tone_change
5477	5.025	the_feel_felt_found+ownership_language+concrete_next_steps	discard	add_concrete_next_steps
5478	5.450	the_feel_felt_found+ownership_language+emotional_labeling	discard	add_emotional_labeling
5479	5.425	the_feel_felt_found+ownership_language	discard	temp_0.90
5480	5.138	the_feel_felt_found+ownership_language+validation_before_solution	discard	add_validation_before_solution
5481	5.425	the_feel_felt_found+ownership_language	discard	temp_0.95
5482	5.013	ownership_language	discard	crossover
5483	5.550	the_feel_felt_found+ownership_language+strategic_agreement	discard	add_strategic_agreement
5484	5.450	the_feel_felt_found+ownership_language+emotional_labeling	discard	add_emotional_labeling
5485	5.338	ownership_language+genuine_admission	discard	swap_the_feel_felt_found_for_genuine_admission
5486	5.438	the_feel_felt_found+ownership_language	discard	temp_0.95
5487	5.112	ownership_language	discard	remove_the_feel_felt_found
5488	5.550	the_feel_felt_found	discard	remove_ownership_language
5489	4.925	the_feel_felt_found+ownership_language+concrete_next_steps	discard	add_concrete_next_steps
5490	5.237	the_feel_felt_found+ownership_language	discard	tone_change
5491	5.450	the_feel_felt_found+ownership_language+validation_before_solution	discard	add_validation_before_solution
5492	5.138	the_feel_felt_found+ownership_language+casual_professionalism	discard	add_casual_professionalism
5493	5.112	the_feel_felt_found	discard	remove_ownership_language
5494	5.650	the_feel_felt_found+ownership_language	discard	tone_change
5495	5.325	the_feel_felt_found+ownership_language	discard	crossover
5496	4.925	the_feel_felt_found+ownership_language	discard	tone_change
5497	5.425	ownership_language+never_say_calm_down	discard	swap_the_feel_felt_found_for_never_say_calm_down
5498	5.350	the_feel_felt_found+ownership_language	discard	tone_change
5499	5.325	ownership_language	discard	remove_the_feel_felt_found
5500	5.425	the_feel_felt_found	discard	remove_ownership_language
5501	5.238	the_feel_felt_found+ownership_language	discard	tone_change
5502	5.325	the_feel_felt_found+ownership_language+casual_professionalism	discard	add_casual_professionalism
5503	5.138	the_feel_felt_found	discard	crossover
5504	5.325	ownership_language+concrete_next_steps	discard	swap_the_feel_felt_found_for_concrete_next_steps
5505	5.088	the_feel_felt_found+ownership_language	discard	temp_0.90
5506	5.437	none	discard	crossover
5507	5.237	the_feel_felt_found+ownership_language+mirroring	discard	add_mirroring
5508	5.450	ownership_language+never_say_calm_down	discard	swap_the_feel_felt_found_for_never_say_calm_down
5509	5.338	the_feel_felt_found+ownership_language	discard	tone_change
5510	5.550	the_feel_felt_found+ownership_language+casual_professionalism	discard	add_casual_professionalism
5511	5.250	the_feel_felt_found+ownership_language	discard	temp_0.70
5512	5.325	the_feel_felt_found+ownership_language+never_say_calm_down	discard	add_never_say_calm_down
5513	5.450	the_feel_felt_found+ownership_language	discard	tone_change
5514	5.550	the_feel_felt_found	discard	crossover
5515	4.925	ownership_language	discard	crossover
5516	4.925	ownership_language+proactive_extras	discard	swap_the_feel_felt_found_for_proactive_extras
5517	5.325	ownership_language	discard	remove_the_feel_felt_found
5518	5.138	the_feel_felt_found+casual_professionalism	discard	swap_ownership_language_for_casual_professionalism
5519	4.725	the_feel_felt_found+ownership_language	discard	temp_0.85
5520	5.450	ownership_language	discard	crossover
5521	5.238	the_feel_felt_found+ownership_language	discard	temp_0.65
5522	5.550	the_feel_felt_found+ownership_language	discard	crossover
5523	5.425	the_feel_felt_found+ownership_language+proactive_extras	discard	add_proactive_extras
5524	5.425	the_feel_felt_found+ownership_language	discard	tone_change
5525	5.237	the_feel_felt_found+ownership_language+strategic_agreement	discard	add_strategic_agreement
5526	5.450	the_feel_felt_found+ownership_language	discard	crossover
5527	5.450	ownership_language+energy_matching	discard	swap_the_feel_felt_found_for_energy_matching
5528	5.225	the_feel_felt_found+ownership_language	discard	temp_0.65
5529	5.550	the_feel_felt_found+ownership_language	discard	tone_change
5530	5.337	ownership_language+personal_touch	discard	swap_the_feel_felt_found_for_personal_touch
5531	5.338	the_feel_felt_found+ownership_language	discard	tone_change
5532	5.225	the_feel_felt_found+ownership_language+proactive_extras	discard	add_proactive_extras
5533	5.450	the_feel_felt_found+ownership_language	discard	tone_change
5534	5.450	ownership_language	discard	remove_the_feel_felt_found
5535	5.138	the_feel_felt_found+ownership_language	discard	temp_0.85
5536	5.238	the_feel_felt_found+ownership_language+warmth_injection	discard	add_warmth_injection
5537	5.013	ownership_language+validation_before_solution	discard	swap_the_feel_felt_found_for_validation_before_solution
5538	5.237	the_feel_felt_found+ownership_language	discard	tone_change
5539	5.425	the_feel_felt_found+ownership_language	discard	tone_change
5540	5.037	the_feel_felt_found+ownership_language	discard	crossover
5541	5.650	the_feel_felt_found+ownership_language	discard	temp_0.85
5542	4.713	the_feel_felt_found+ownership_language	discard	tone_change
5543	5.138	ownership_language+strategic_agreement	discard	swap_the_feel_felt_found_for_strategic_agreement
5544	5.425	the_feel_felt_found+ownership_language+casual_professionalism	discard	add_casual_professionalism
5545	5.525	the_feel_felt_found+ownership_language	discard	temp_0.75
5546	5.650	the_feel_felt_found+ownership_language	discard	temp_0.65
5547	4.888	the_feel_felt_found+ownership_language+validation_before_solution	discard	add_validation_before_solution
5548	5.350	the_feel_felt_found+ownership_language	discard	tone_change
5549	5.325	the_feel_felt_found+ownership_language	discard	tone_change
5550	5.138	the_feel_felt_found+ownership_language+validation_before_solution	discard	add_validation_before_solution
5551	5.550	the_feel_felt_found+ownership_language+casual_professionalism	discard	add_casual_professionalism
5552	5.112	ownership_language	discard	crossover
5553	5.450	the_feel_felt_found+ownership_language	discard	tone_change
5554	5.325	the_feel_felt_found+ownership_language	discard	crossover
5555	5.450	ownership_language	discard	remove_the_feel_felt_found
5556	4.888	none	discard	crossover
5557	5.450	the_feel_felt_found+ownership_language	discard	tone_change
5558	5.450	the_feel_felt_found+ownership_language+proactive_extras	discard	add_proactive_extras
5559	5.138	the_feel_felt_found+ownership_language	discard	tone_change
5560	5.325	the_feel_felt_found	discard	remove_ownership_language
5561	5.450	ownership_language+genuine_admission	discard	swap_the_feel_felt_found_for_genuine_admission
5562	5.200	the_feel_felt_found+ownership_language	discard	temp_0.85
5563	5.350	the_feel_felt_found+ownership_language+proactive_extras	discard	add_proactive_extras
5564	5.550	the_feel_felt_found	discard	crossover
5565	5.337	the_feel_felt_found	discard	crossover
5566	5.550	the_feel_felt_found+ownership_language	discard	tone_change
5567	5.238	the_feel_felt_found+ownership_language+energy_matching	discard	add_energy_matching
5568	5.550	the_feel_felt_found+ownership_language	discard	tone_change
5569	5.425	the_feel_felt_found+ownership_language	discard	temp_0.65
5570	4.912	the_feel_felt_found+ownership_language	discard	temp_0.90
5571	5.125	the_feel_felt_found+ownership_language	discard	tone_change
5572	4.825	ownership_language	discard	crossover
5573	4.825	the_feel_felt_found+casual_professionalism	discard	swap_ownership_language_for_casual_professionalism
5574	4.913	the_feel_felt_found+ownership_language+warmth_injection	discard	add_warmth_injection
5575	5.425	the_feel_felt_found+ownership_language	discard	temp_0.90
5576	5.550	the_feel_felt_found+ownership_language	discard	crossover
5577	5.325	ownership_language	discard	remove_the_feel_felt_found
5578	5.138	ownership_language	discard	remove_the_feel_felt_found
5579	5.350	the_feel_felt_found+ownership_language	discard	tone_change
5580	5.200	the_feel_felt_found+ownership_language	discard	tone_change
5581	4.925	the_feel_felt_found+emotional_labeling	discard	swap_ownership_language_for_emotional_labeling
5582	5.425	the_feel_felt_found+ownership_language	discard	temp_0.90
5583	5.300	the_feel_felt_found+ownership_language	discard	tone_change
5584	5.237	the_feel_felt_found+strategic_agreement	discard	swap_ownership_language_for_strategic_agreement
5585	5.550	the_feel_felt_found+ownership_language	discard	tone_change
5586	5.238	the_feel_felt_found+genuine_admission	discard	swap_ownership_language_for_genuine_admission
5587	5.450	the_feel_felt_found+ownership_language	discard	tone_change
5588	5.450	the_feel_felt_found+strategic_agreement	discard	swap_ownership_language_for_strategic_agreement
5589	5.450	the_feel_felt_found+ownership_language	discard	tone_change
5590	4.412	the_feel_felt_found+ownership_language	discard	tone_change
5591	5.325	the_feel_felt_found+ownership_language+casual_professionalism	discard	add_casual_professionalism
5592	5.137	the_feel_felt_found+ownership_language	discard	crossover
5593	5.237	the_feel_felt_found+ownership_language+genuine_admission	discard	add_genuine_admission
5594	4.912	ownership_language	discard	crossover
5595	4.925	the_feel_felt_found+ownership_language	discard	temp_0.65
5596	5.325	the_feel_felt_found+ownership_language+emotional_labeling	discard	add_emotional_labeling
5597	5.250	the_feel_felt_found	discard	remove_ownership_language
5598	5.650	the_feel_felt_found+ownership_language	discard	temp_0.70
5599	5.325	the_feel_felt_found+ownership_language+genuine_admission	discard	add_genuine_admission
