generation	eq_score	techniques	status	description
7254	5.200	the_feel_felt_found+ownership_language	discard	tone_change
7255	4.888	the_feel_felt_found+ownership_language	discard	temp_0.75
7256	5.237	the_feel_felt_found+ownership_language	discard	crossover
7257	4.900	the_feel_felt_found+ownership_language+personal_touch	discard	add_personal_touch
7258	5.325	the_feel_felt_found+ownership_language	discard	temp_0.70
7259	5.550	the_feel_felt_found+ownership_language	discard	crossover
7260	5.425	the_feel_felt_found+ownership_language+emotional_labeling	discard	add_emotional_labeling
7261	5.013	the_feel_felt_found+ownership_language	discard	tone_change
7262	4.888	the_feel_felt_found+ownership_language+genuine_admission	discard	add_genuine_admission
7263	5.350	the_feel_felt_found+ownership_language+validation_before_solution	discard	add_validation_before_solution
7264	5.037	the_feel_felt_found+never_say_calm_down	discard	swap_ownership_language_for_never_say_calm_down
7265	5.325	the_feel_felt_found+ownership_language	discard	crossover
7266	5.325	the_feel_felt_found+ownership_language	discard	tone_change
7267	5.225	the_feel_felt_found+ownership_language	discard	tone_change
7268	5.550	the_feel_felt_found+ownership_language+personal_touch	discard	add_personal_touch
7269	5.038	the_feel_felt_found+ownership_language	discard	crossover
7270	5.325	the_feel_felt_found+casual_professionalism	discard	swap_ownership_language_for_casual_professionalism
7271	5.013	the_feel_felt_found+warmth_injection	discard	swap_ownership_language_for_warmth_injection
7272	5.550	the_feel_felt_found+ownership_language	discard	tone_change
7273	5.025	the_feel_felt_found+ownership_language	discard	crossover
7274	5.013	the_feel_felt_found	discard	crossover
7275	5.237	the_feel_felt_found+ownership_language+personal_touch	discard	add_personal_touch
7276	5.237	ownership_language+mirroring	discard	swap_the_feel_felt_found_for_mirroring
7277	5.237	the_feel_felt_found+ownership_language	discard	tone_change
7278	4.825	the_feel_felt_found+ownership_language+casual_professionalism	discard	add_casual_professionalism
7279	5.237	the_feel_felt_found+ownership_language+warmth_injection	discard	add_warmth_injection
7280	5.350	the_feel_felt_found+ownership_language+warmth_injection	discard	add_warmth_injection
7281	5.350	the_feel_felt_found+ownership_language	discard	temp_0.70
7282	4.700	the_feel_felt_found+ownership_language	discard	tone_change
7283	5.650	ownership_language+mirroring	discard	swap_the_feel_felt_found_for_mirroring
7284	5.450	the_feel_felt_found+ownership_language	discard	temp_0.70
7285	5.325	the_feel_felt_found+ownership_language+energy_matching	discard	add_energy_matching
7286	5.325	the_feel_felt_found+ownership_language	discard	crossover
7287	5.325	ownership_language+strategic_agreement	discard	swap_the_feel_felt_found_for_strategic_agreement
7288	5.325	the_feel_felt_found+ownership_language	discard	temp_0.65
7289	5.450	the_feel_felt_found+ownership_language+mirroring	discard	add_mirroring
7290	5.450	the_feel_felt_found+ownership_language	discard	tone_change
7291	5.325	the_feel_felt_found+ownership_language	discard	temp_0.90
7292	5.338	ownership_language	discard	crossover
7293	5.237	the_feel_felt_found+ownership_language	discard	crossover
7294	5.013	the_feel_felt_found	discard	crossover
7295	5.138	the_feel_felt_found+ownership_language+warmth_injection	discard	add_warmth_injection
7296	5.450	the_feel_felt_found+genuine_admission	discard	swap_ownership_language_for_genuine_admission
7297	5.425	ownership_language	discard	remove_the_feel_felt_found
7298	4.825	ownership_language	discard	crossover
7299	5.325	the_feel_felt_found+ownership_language	discard	temp_0.90
7300	4.700	the_feel_felt_found+ownership_language+genuine_admission	discard	add_genuine_admission
7301	4.925	the_feel_felt_found+ownership_language+concrete_next_steps	discard	add_concrete_next_steps
7302	5.450	the_feel_felt_found+ownership_language+validation_before_solution	discard	add_validation_before_solution
7303	5.138	ownership_language	discard	crossover
7304	5.550	ownership_language	discard	remove_the_feel_felt_found
7305	4.912	ownership_language+genuine_admission	discard	swap_the_feel_felt_found_for_genuine_admission
7306	5.450	the_feel_felt_found	discard	remove_ownership_language
7307	5.325	the_feel_felt_found+ownership_language	discard	crossover
7308	5.450	the_feel_felt_found+ownership_language	discard	temp_0.65
7309	5.200	the_feel_felt_found+ownership_language	discard	tone_change
7310	5.138	ownership_language+genuine_admission	discard	swap_the_feel_felt_found_for_genuine_admission
7311	5.225	ownership_language	discard	crossover
7312	5.138	the_feel_felt_found+ownership_language	discard	temp_0.85
7313	5.213	the_feel_felt_found+ownership_language	discard	temp_0.75
7314	5.013	the_feel_felt_found+energy_matching	discard	swap_ownership_language_for_energy_matching
7315	4.800	ownership_language+concrete_next_steps	discard	swap_the_feel_felt_found_for_concrete_next_steps
7316	5.550	the_feel_felt_found+ownership_language	discard	tone_change
7317	5.325	the_feel_felt_found+ownership_language	discard	temp_0.70
7318	5.550	the_feel_felt_found+ownership_language	discard	temp_0.70
7319	5.013	the_feel_felt_found+ownership_language	discard	tone_change
7320	5.425	the_feel_felt_found+ownership_language	discard	temp_0.70
7321	5.075	the_feel_felt_found+ownership_language	discard	crossover
7322	5.237	ownership_language+genuine_admission	discard	swap_the_feel_felt_found_for_genuine_admission
7323	5.325	the_feel_felt_found+ownership_language	discard	crossover
7324	5.100	the_feel_felt_found+ownership_language+energy_matching	discard	add_energy_matching
7325	5.138	the_feel_felt_found+ownership_language	discard	tone_change
7326	5.237	the_feel_felt_found+ownership_language	discard	tone_change
7327	5.325	the_feel_felt_found+ownership_language	discard	temp_0.65
7328	5.300	the_feel_felt_found	discard	remove_ownership_language
7329	5.013	the_feel_felt_found+ownership_language+validation_before_solution	discard	add_validation_before_solution
7330	5.450	ownership_language	discard	remove_the_feel_felt_found
7331	5.337	the_feel_felt_found+ownership_language+energy_matching	discard	add_energy_matching
7332	5.525	the_feel_felt_found+ownership_language	discard	crossover
7333	5.037	the_feel_felt_found+energy_matching	discard	swap_ownership_language_for_energy_matching
7334	5.450	the_feel_felt_found+ownership_language	discard	crossover
7335	5.550	the_feel_felt_found+casual_professionalism	discard	swap_ownership_language_for_casual_professionalism
7336	5.750	the_feel_felt_found+ownership_language	discard	tone_change
7337	5.237	the_feel_felt_found+ownership_language	discard	temp_0.70
7338	4.825	the_feel_felt_found+ownership_language+casual_professionalism	discard	add_casual_professionalism
7339	5.450	the_feel_felt_found+ownership_language	discard	tone_change
7340	5.350	the_feel_felt_found+ownership_language	discard	tone_change
7341	5.225	the_feel_felt_found+ownership_language+validation_before_solution	discard	add_validation_before_solution
7342	5.350	the_feel_felt_found+strategic_agreement	discard	swap_ownership_language_for_strategic_agreement
7343	5.138	the_feel_felt_found+casual_professionalism	discard	swap_ownership_language_for_casual_professionalism
7344	5.450	the_feel_felt_found+ownership_language	discard	tone_change
7345	5.013	the_feel_felt_found+ownership_language	discard	tone_change
7346	5.550	the_feel_felt_found+ownership_language	discard	crossover
7347	4.825	the_feel_felt_found+ownership_language+genuine_admission	discard	add_genuine_admission
7348	5.350	the_feel_felt_found+ownership_language	discard	temp_0.65
7349	5.338	the_feel_felt_found+ownership_language+emotional_labeling	discard	add_emotional_labeling
7350	5.325	the_feel_felt_found+ownership_language	discard	tone_change
7351	5.138	the_feel_felt_found+ownership_language	discard	temp_0.85
7352	5.450	the_feel_felt_found+ownership_language	discard	tone_change
7353	5.550	the_feel_felt_found+energy_matching	discard	swap_ownership_language_for_energy_matching
7354	5.450	the_feel_felt_found+ownership_language	discard	tone_change
7355	5.550	the_feel_felt_found	discard	crossover
7356	5.425	the_feel_felt_found+ownership_language	discard	temp_0.70
7357	5.025	none	discard	crossover
7358	5.450	the_feel_felt_found+ownership_language	discard	tone_change
7359	5.013	the_feel_felt_found+ownership_language	discard	crossover
7360	5.337	the_feel_felt_found+ownership_language	discard	crossover
7361	5.013	the_feel_felt_found+ownership_language	discard	tone_change
7362	5.325	the_feel_felt_found+ownership_language	discard	crossover
7363	5.112	the_feel_felt_found	discard	remove_ownership_language
7364	5.112	the_feel_felt_found+ownership_language+mirroring	discard	add_mirroring
7365	4.513	ownership_language	discard	remove_the_feel_felt_found
7366	5.550	the_feel_felt_found+ownership_language	discard	tone_change
7367	5.138	the_feel_felt_found+ownership_language	discard	tone_change
7368	5.650	the_feel_felt_found	discard	crossover
7369	5.325	the_feel_felt_found+ownership_language	discard	crossover
7370	5.450	the_feel_felt_found+ownership_language+emotional_labeling	discard	add_emotional_labeling
7371	5.025	the_feel_felt_found+ownership_language+validation_before_solution	discard	add_validation_before_solution
7372	5.112	ownership_language+never_say_calm_down	discard	swap_the_feel_felt_found_for_never_say_calm_down
7373	5.650	the_feel_felt_found+ownership_language	discard	crossover
7374	5.137	the_feel_felt_found+ownership_language	discard	crossover
7375	4.825	the_feel_felt_found+ownership_language	discard	temp_0.90
7376	5.138	ownership_language	discard	remove_the_feel_felt_found
7377	4.925	the_feel_felt_found+ownership_language	discard	temp_0.85
7378	4.988	ownership_language+casual_professionalism	discard	swap_the_feel_felt_found_for_casual_professionalism
7379	5.450	ownership_language	discard	crossover
7380	5.138	the_feel_felt_found+ownership_language+genuine_admission	discard	add_genuine_admission
7381	5.013	the_feel_felt_found+ownership_language	discard	tone_change
7382	4.700	the_feel_felt_found+ownership_language+casual_professionalism	discard	add_casual_professionalism
7383	5.137	the_feel_felt_found+ownership_language	discard	crossover
7384	5.138	the_feel_felt_found+ownership_language+emotional_labeling	discard	add_emotional_labeling
7385	5.550	the_feel_felt_found+ownership_language	discard	crossover
7386	5.138	the_feel_felt_found+ownership_language+personal_touch	discard	add_personal_touch
7387	4.900	the_feel_felt_found+ownership_language	discard	crossover
7388	5.350	ownership_language+warmth_injection	discard	swap_the_feel_felt_found_for_warmth_injection
7389	4.925	the_feel_felt_found+ownership_language	discard	temp_0.70
7390	4.987	the_feel_felt_found+ownership_language+mirroring	discard	add_mirroring
7391	5.450	ownership_language+warmth_injection	discard	swap_the_feel_felt_found_for_warmth_injection
7392	5.112	the_feel_felt_found+ownership_language+never_say_calm_down	discard	add_never_say_calm_down
7393	5.225	ownership_language	discard	remove_the_feel_felt_found
7394	5.425	the_feel_felt_found+ownership_language	discard	crossover
7395	4.800	the_feel_felt_found+ownership_language	discard	crossover
7396	5.138	ownership_language	discard	remove_the_feel_felt_found
7397	5.237	the_feel_felt_found+ownership_language+strategic_agreement	discard	add_strategic_agreement
7398	5.450	the_feel_felt_found+proactive_extras	discard	swap_ownership_language_for_proactive_extras
7399	5.325	the_feel_felt_found+ownership_language	discard	temp_0.90
7400	5.325	none	discard	crossover
7401	5.550	the_feel_felt_found+ownership_language+strategic_agreement	discard	add_strategic_agreement
7402	5.450	the_feel_felt_found+ownership_language	discard	crossover
7403	4.825	ownership_language	discard	remove_the_feel_felt_found
7404	5.200	ownership_language	discard	remove_the_feel_felt_found
7405	4.925	ownership_language	discard	crossover
7406	5.013	the_feel_felt_found+ownership_language+concrete_next_steps	discard	add_concrete_next_steps
7407	5.300	the_feel_felt_found+ownership_language	discard	tone_change
7408	5.113	the_feel_felt_found+ownership_language	discard	crossover
7409	5.112	the_feel_felt_found+ownership_language	discard	tone_change
7410	5.325	the_feel_felt_found+ownership_language	discard	tone_change
7411	5.112	the_feel_felt_found+ownership_language	discard	temp_0.75
7412	5.350	the_feel_felt_found+ownership_language	discard	tone_change
7413	5.550	the_feel_felt_found+ownership_language+genuine_admission	discard	add_genuine_admission
7414	5.325	the_feel_felt_found+personal_touch	discard	swap_ownership_language_for_personal_touch
7415	5.013	the_feel_felt_found+ownership_language	discard	tone_change
7416	5.138	the_feel_felt_found+ownership_language	discard	tone_change
7417	5.138	ownership_language+strategic_agreement	discard	swap_the_feel_felt_found_for_strategic_agreement
7418	4.925	the_feel_felt_found+ownership_language+energy_matching	discard	add_energy_matching
7419	5.237	the_feel_felt_found+ownership_language	discard	tone_change
7420	4.800	the_feel_felt_found+ownership_language	discard	tone_change
7421	5.437	the_feel_felt_found+personal_touch	discard	swap_ownership_language_for_personal_touch
7422	5.350	ownership_language+mirroring	discard	swap_the_feel_felt_found_for_mirroring
7423	4.700	the_feel_felt_found+ownership_language	discard	temp_0.90
7424	5.325	the_feel_felt_found+ownership_language+casual_professionalism	discard	add_casual_professionalism
7425	5.325	ownership_language	discard	remove_the_feel_felt_found
7426	5.125	ownership_language+concrete_next_steps	discard	swap_the_feel_felt_found_for_concrete_next_steps
7427	4.587	the_feel_felt_found+ownership_language+validation_before_solution	discard	add_validation_before_solution
7428	5.200	ownership_language	discard	crossover
7429	4.612	the_feel_felt_found+ownership_language+warmth_injection	discard	add_warmth_injection
7430	5.113	the_feel_felt_found+ownership_language+personal_touch	discard	add_personal_touch
7431	5.325	the_feel_felt_found+ownership_language+genuine_admission	discard	add_genuine_admission
7432	5.650	the_feel_felt_found	discard	crossover
7433	5.238	the_feel_felt_found+ownership_language	discard	tone_change
7434	5.450	the_feel_felt_found+ownership_language	discard	crossover
7435	5.237	ownership_language+never_say_calm_down	discard	swap_the_feel_felt_found_for_never_say_calm_down
7436	5.112	the_feel_felt_found+ownership_language	discard	crossover
7437	5.450	the_feel_felt_found+genuine_admission	discard	swap_ownership_language_for_genuine_admission
7438	5.450	the_feel_felt_found+ownership_language	discard	temp_0.95
7439	5.037	the_feel_felt_found+warmth_injection	discard	swap_ownership_language_for_warmth_injection
7440	5.550	the_feel_felt_found+ownership_language+energy_matching	discard	add_energy_matching
7441	5.037	the_feel_felt_found+ownership_language	discard	crossover
7442	5.237	the_feel_felt_found+ownership_language	discard	temp_0.65
7443	4.825	the_feel_felt_found+genuine_admission	discard	swap_ownership_language_for_genuine_admission
7444	5.238	none	discard	crossover
7445	5.338	the_feel_felt_found+ownership_language+concrete_next_steps	discard	add_concrete_next_steps
7446	5.200	the_feel_felt_found+ownership_language+never_say_calm_down	discard	add_never_say_calm_down
7447	5.350	none	discard	crossover
7448	5.237	the_feel_felt_found+personal_touch	discard	swap_ownership_language_for_personal_touch
7449	5.450	the_feel_felt_found+ownership_language	discard	tone_change
7450	5.650	the_feel_felt_found+ownership_language+validation_before_solution	discard	add_validation_before_solution
7451	5.013	ownership_language+never_say_calm_down	discard	swap_the_feel_felt_found_for_never_say_calm_down
7452	5.138	the_feel_felt_found	discard	remove_ownership_language
7453	5.013	ownership_language+never_say_calm_down	discard	swap_the_feel_felt_found_for_never_say_calm_down
7454	5.350	ownership_language	discard	remove_the_feel_felt_found
7455	5.650	the_feel_felt_found+ownership_language+genuine_admission	discard	add_genuine_admission
7456	4.825	ownership_language	discard	crossover
7457	4.987	the_feel_felt_found+ownership_language+validation_before_solution	discard	add_validation_before_solution
7458	5.037	the_feel_felt_found+ownership_language	discard	temp_0.90
7459	5.650	ownership_language	discard	remove_the_feel_felt_found
7460	5.113	the_feel_felt_found+ownership_language+concrete_next_steps	discard	add_concrete_next_steps
7461	4.925	the_feel_felt_found+ownership_language+strategic_agreement	discard	add_strategic_agreement
7462	5.350	the_feel_felt_found+ownership_language+casual_professionalism	discard	add_casual_professionalism
7463	5.450	the_feel_felt_found+ownership_language+warmth_injection	discard	add_warmth_injection
7464	5.325	the_feel_felt_found+ownership_language	discard	crossover
7465	4.925	the_feel_felt_found+ownership_language	discard	tone_change
7466	5.300	the_feel_felt_found+ownership_language+never_say_calm_down	discard	add_never_say_calm_down
7467	4.975	the_feel_felt_found+ownership_language	discard	temp_0.95
7468	5.238	the_feel_felt_found+ownership_language+emotional_labeling	discard	add_emotional_labeling
7469	5.338	the_feel_felt_found+ownership_language	discard	crossover
7470	4.987	the_feel_felt_found+ownership_language	discard	crossover
7471	4.612	none	discard	crossover
7472	5.138	ownership_language	discard	crossover
7473	5.325	the_feel_felt_found+ownership_language	discard	temp_0.85
7474	5.325	the_feel_felt_found+ownership_language	discard	temp_0.70
7475	4.925	the_feel_felt_found+ownership_language	discard	crossover
7476	5.650	the_feel_felt_found+ownership_language	discard	tone_change
7477	5.425	the_feel_felt_found+ownership_language+mirroring	discard	add_mirroring
7478	5.138	the_feel_felt_found+ownership_language+strategic_agreement	discard	add_strategic_agreement
7479	5.138	the_feel_felt_found+ownership_language	discard	tone_change
7480	5.450	the_feel_felt_found	discard	crossover
7481	5.450	the_feel_felt_found+ownership_language	discard	tone_change
7482	5.325	ownership_language+proactive_extras	discard	swap_the_feel_felt_found_for_proactive_extras
7483	5.525	the_feel_felt_found+ownership_language	discard	tone_change
7484	5.138	the_feel_felt_found+ownership_language	discard	crossover
7485	5.425	the_feel_felt_found	discard	crossover
7486	5.550	ownership_language	discard	crossover
7487	4.575	the_feel_felt_found+ownership_language	discard	temp_0.85
7488	5.200	the_feel_felt_found+ownership_language	discard	crossover
7489	5.550	the_feel_felt_found+ownership_language	discard	tone_change
7490	5.650	the_feel_felt_found+ownership_language+emotional_labeling	discard	add_emotional_labeling
7491	5.550	the_feel_felt_found+ownership_language+emotional_labeling	discard	add_emotional_labeling
7492	5.213	the_feel_felt_found	discard	crossover
7493	5.325	the_feel_felt_found+ownership_language+emotional_labeling	discard	add_emotional_labeling
7494	5.450	the_feel_felt_found+ownership_language	discard	tone_change
7495	5.138	the_feel_felt_found+ownership_language	discard	crossover
7496	5.450	the_feel_felt_found+ownership_language	discard	temp_0.75
7497	5.338	the_feel_felt_found+ownership_language+personal_touch	discard	add_personal_touch
7498	5.237	the_feel_felt_found+ownership_language	discard	temp_0.85
7499	5.300	the_feel_felt_found	discard	crossover
7500	5.650	the_feel_felt_found	discard	crossover
7501	5.200	the_feel_felt_found+ownership_language	discard	tone_change
7502	5.338	the_feel_felt_found+ownership_language	discard	tone_change
7503	5.450	the_feel_felt_found+ownership_language	discard	crossover
7504	4.987	ownership_language	discard	remove_the_feel_felt_found
7505	5.138	the_feel_felt_found	discard	crossover
7506	5.338	the_feel_felt_found+ownership_language+genuine_admission	discard	add_genuine_admission
7507	5.325	the_feel_felt_found+ownership_language+personal_touch	discard	add_personal_touch
7508	5.325	the_feel_felt_found+ownership_language	discard	tone_change
7509	5.013	the_feel_felt_found	discard	crossover
7510	5.525	ownership_language	discard	crossover
7511	5.013	the_feel_felt_found+personal_touch	discard	swap_ownership_language_for_personal_touch
7512	5.237	the_feel_felt_found+ownership_language+personal_touch	discard	add_personal_touch
7513	5.425	the_feel_felt_found+ownership_language	discard	temp_0.75
7514	5.550	the_feel_felt_found+ownership_language	discard	crossover
7515	5.338	the_feel_felt_found+ownership_language+genuine_admission	discard	add_genuine_admission
7516	5.013	the_feel_felt_found+ownership_language	discard	temp_0.75
7517	5.450	the_feel_felt_found+ownership_language	discard	tone_change
7518	5.325	the_feel_felt_found+ownership_language+concrete_next_steps	discard	add_concrete_next_steps
7519	5.113	the_feel_felt_found+ownership_language+concrete_next_steps	discard	add_concrete_next_steps
7520	5.325	the_feel_felt_found+ownership_language	discard	tone_change
7521	4.938	the_feel_felt_found+emotional_labeling	discard	swap_ownership_language_for_emotional_labeling
7522	4.825	the_feel_felt_found+ownership_language	discard	tone_change
7523	5.425	the_feel_felt_found+ownership_language+mirroring	discard	add_mirroring
7524	5.450	the_feel_felt_found+ownership_language	discard	crossover
7525	5.013	the_feel_felt_found+ownership_language+validation_before_solution	discard	add_validation_before_solution
7526	5.550	none	discard	crossover
7527	5.425	the_feel_felt_found+mirroring	discard	swap_ownership_language_for_mirroring
7528	5.325	the_feel_felt_found+ownership_language	discard	temp_0.70
7529	5.213	ownership_language+never_say_calm_down	discard	swap_the_feel_felt_found_for_never_say_calm_down
7530	5.237	the_feel_felt_found+ownership_language+validation_before_solution	discard	add_validation_before_solution
7531	5.112	the_feel_felt_found+ownership_language	discard	tone_change
7532	5.425	the_feel_felt_found+energy_matching	discard	swap_ownership_language_for_energy_matching
