generation	eq_score	techniques	status	description
4489	5.550	ownership_language+personal_touch	discard	swap_the_feel_felt_found_for_personal_touch
4490	5.250	ownership_language+emotional_labeling	discard	swap_the_feel_felt_found_for_emotional_labeling
4491	5.113	the_feel_felt_found+ownership_language	discard	temp_0.85
4492	5.213	the_feel_felt_found	discard	crossover
4493	5.238	ownership_language	discard	crossover
4494	5.338	the_feel_felt_found+ownership_language	discard	crossover
4495	5.138	the_feel_felt_found+ownership_language+proactive_extras	discard	add_proactive_extras
4496	5.225	the_feel_felt_found+ownership_language	discard	crossover
4497	5.425	the_feel_felt_found+ownership_language+energy_matching	discard	add_energy_matching
4498	5.138	ownership_language	discard	remove_the_feel_felt_found
4499	5.338	the_feel_felt_found+ownership_language+energy_matching	discard	add_energy_matching
4500	5.237	the_feel_felt_found+ownership_language+strategic_agreement	discard	add_strategic_agreement
4501	5.112	the_feel_felt_found+ownership_language	discard	temp_0.90
4502	5.237	the_feel_felt_found+ownership_language	discard	tone_change
4503	5.200	the_feel_felt_found+ownership_language+casual_professionalism	discard	add_casual_professionalism
4504	5.650	the_feel_felt_found+ownership_language	discard	crossover
4505	5.237	ownership_language	discard	crossover
4506	5.325	the_feel_felt_found+ownership_language	discard	temp_0.70
4507	5.138	the_feel_felt_found+ownership_language	discard	temp_0.95
4508	5.525	the_feel_felt_found+ownership_language+never_say_calm_down	discard	add_never_say_calm_down
4509	5.525	the_feel_felt_found+ownership_language	discard	temp_0.70
4510	5.450	the_feel_felt_found+ownership_language	discard	crossover
4511	5.112	the_feel_felt_found+ownership_language	discard	tone_change
4512	5.113	the_feel_felt_found+ownership_language+strategic_agreement	discard	add_strategic_agreement
4513	5.425	ownership_language+genuine_admission	discard	swap_the_feel_felt_found_for_genuine_admission
4514	5.325	the_feel_felt_found+ownership_language	discard	crossover
4515	5.750	the_feel_felt_found+ownership_language	discard	temp_0.90
4516	4.825	the_feel_felt_found+ownership_language+genuine_admission	discard	add_genuine_admission
4517	5.138	the_feel_felt_found+ownership_language	discard	temp_0.95
4518	5.325	the_feel_felt_found+ownership_language	discard	temp_0.95
4519	5.200	the_feel_felt_found+ownership_language+casual_professionalism	discard	add_casual_professionalism
4520	5.325	ownership_language+concrete_next_steps	discard	swap_the_feel_felt_found_for_concrete_next_steps
4521	4.388	the_feel_felt_found+ownership_language+casual_professionalism	discard	add_casual_professionalism
4522	5.325	the_feel_felt_found+ownership_language+validation_before_solution	discard	add_validation_before_solution
4523	5.213	the_feel_felt_found+ownership_language	discard	tone_change
4524	5.450	the_feel_felt_found+ownership_language	discard	temp_0.70
4525	5.237	the_feel_felt_found+ownership_language	discard	temp_0.70
4526	5.525	the_feel_felt_found+ownership_language	discard	temp_0.75
4527	5.425	the_feel_felt_found+ownership_language+strategic_agreement	discard	add_strategic_agreement
4528	5.550	the_feel_felt_found+strategic_agreement	discard	swap_ownership_language_for_strategic_agreement
4529	5.100	ownership_language+never_say_calm_down	discard	swap_the_feel_felt_found_for_never_say_calm_down
4530	5.425	the_feel_felt_found+ownership_language+validation_before_solution	discard	add_validation_before_solution
4531	5.138	ownership_language+mirroring	discard	swap_the_feel_felt_found_for_mirroring
4532	5.013	ownership_language	discard	remove_the_feel_felt_found
4533	5.550	the_feel_felt_found+ownership_language	discard	tone_change
4534	5.425	the_feel_felt_found+ownership_language+genuine_admission	discard	add_genuine_admission
4535	4.925	the_feel_felt_found	discard	crossover
4536	5.450	the_feel_felt_found+ownership_language+energy_matching	discard	add_energy_matching
4537	5.237	the_feel_felt_found+ownership_language	discard	temp_0.90
4538	5.550	the_feel_felt_found+ownership_language+casual_professionalism	discard	add_casual_professionalism
4539	5.450	ownership_language	discard	remove_the_feel_felt_found
4540	5.088	the_feel_felt_found+ownership_language+strategic_agreement	discard	add_strategic_agreement
4541	5.425	the_feel_felt_found+ownership_language	discard	tone_change
4542	5.325	the_feel_felt_found+ownership_language	discard	temp_0.85
4543	5.237	ownership_language	discard	remove_the_feel_felt_found
4544	5.138	none	discard	crossover
4545	5.550	the_feel_felt_found	discard	remove_ownership_language
4546	5.238	the_feel_felt_found+energy_matching	discard	swap_ownership_language_for_energy_matching
4547	5.238	ownership_language	discard	crossover
4548	5.300	the_feel_felt_found+ownership_language+concrete_next_steps	discard	add_concrete_next_steps
4549	5.350	the_feel_felt_found+ownership_language+never_say_calm_down	discard	add_never_say_calm_down
4550	5.237	the_feel_felt_found+ownership_language	discard	tone_change
4551	5.225	the_feel_felt_found+ownership_language	discard	tone_change
4552	5.425	the_feel_felt_found+ownership_language	discard	crossover
4553	5.750	the_feel_felt_found	discard	remove_ownership_language
4554	5.013	the_feel_felt_found+ownership_language	discard	crossover
4555	5.425	the_feel_felt_found+ownership_language	discard	temp_0.65
4556	5.025	the_feel_felt_found	discard	remove_ownership_language
4557	5.550	the_feel_felt_found+ownership_language+mirroring	discard	add_mirroring
4558	5.450	the_feel_felt_found+warmth_injection	discard	swap_ownership_language_for_warmth_injection
4559	4.700	the_feel_felt_found	discard	crossover
4560	4.888	the_feel_felt_found+ownership_language	discard	tone_change
4561	5.650	the_feel_felt_found+casual_professionalism	discard	swap_ownership_language_for_casual_professionalism
4562	5.750	the_feel_felt_found+emotional_labeling	discard	swap_ownership_language_for_emotional_labeling
4563	5.425	the_feel_felt_found+ownership_language	discard	temp_0.95
4564	5.425	the_feel_felt_found+ownership_language	discard	tone_change
4565	5.013	the_feel_felt_found+ownership_language+emotional_labeling	discard	add_emotional_labeling
4566	4.725	the_feel_felt_found+ownership_language+strategic_agreement	discard	add_strategic_agreement
4567	4.825	the_feel_felt_found+ownership_language	discard	crossover
4568	5.350	ownership_language	discard	remove_the_feel_felt_found
4569	5.550	ownership_language+mirroring	discard	swap_the_feel_felt_found_for_mirroring
4570	5.425	the_feel_felt_found+ownership_language+energy_matching	discard	add_energy_matching
4571	5.138	ownership_language+genuine_admission	discard	swap_the_feel_felt_found_for_genuine_admission
4572	5.325	the_feel_felt_found+ownership_language+proactive_extras	discard	add_proactive_extras
4573	5.325	the_feel_felt_found+ownership_language	discard	tone_change
4574	5.112	the_feel_felt_found+ownership_language	discard	crossover
4575	4.888	the_feel_felt_found+ownership_language	discard	tone_change
4576	5.237	the_feel_felt_found+ownership_language+casual_professionalism	discard	add_casual_professionalism
4577	5.550	ownership_language	discard	remove_the_feel_felt_found
4578	5.325	the_feel_felt_found+ownership_language+personal_touch	discard	add_personal_touch
4579	5.200	the_feel_felt_found+ownership_language	discard	tone_change
4580	5.213	the_feel_felt_found+ownership_language	discard	tone_change
4581	4.825	the_feel_felt_found+ownership_language+genuine_admission	discard	add_genuine_admission
4582	5.450	the_feel_felt_found+ownership_language+genuine_admission	discard	add_genuine_admission
4583	5.137	the_feel_felt_found+ownership_language+emotional_labeling	discard	add_emotional_labeling
4584	5.525	the_feel_felt_found+ownership_language+mirroring	discard	add_mirroring
4585	5.112	the_feel_felt_found+ownership_language+mirroring	discard	add_mirroring
4586	5.650	the_feel_felt_found+ownership_language	discard	tone_change
4587	4.825	the_feel_felt_found+ownership_language	discard	tone_change
4588	5.225	the_feel_felt_found+ownership_language+never_say_calm_down	discard	add_never_say_calm_down
4589	5.138	the_feel_felt_found+ownership_language	discard	temp_0.90
4590	5.325	the_feel_felt_found+ownership_language	discard	crossover
4591	5.138	the_feel_felt_found	discard	remove_ownership_language
4592	5.138	ownership_language+never_say_calm_down	discard	swap_the_feel_felt_found_for_never_say_calm_down
4593	5.550	ownership_language+warmth_injection	discard	swap_the_feel_felt_found_for_warmth_injection
4594	5.450	the_feel_felt_found+ownership_language+strategic_agreement	discard	add_strategic_agreement
4595	5.013	the_feel_felt_found+personal_touch	discard	swap_ownership_language_for_personal_touch
4596	5.238	the_feel_felt_found+ownership_language	discard	crossover
4597	5.013	the_feel_felt_found+ownership_language	discard	temp_0.70
4598	5.650	the_feel_felt_found+ownership_language+mirroring	discard	add_mirroring
4599	5.425	the_feel_felt_found+ownership_language+mirroring	discard	add_mirroring
4600	5.350	the_feel_felt_found+ownership_language	discard	temp_0.90
4601	5.450	the_feel_felt_found+ownership_language	discard	tone_change
4602	5.200	the_feel_felt_found+ownership_language	discard	crossover
4603	5.138	the_feel_felt_found+ownership_language	discard	temp_0.85
4604	5.350	the_feel_felt_found+ownership_language+strategic_agreement	discard	add_strategic_agreement
4605	5.138	the_feel_felt_found+ownership_language	discard	tone_change
4606	4.575	the_feel_felt_found+ownership_language	discard	tone_change
4607	5.238	the_feel_felt_found+ownership_language+mirroring	discard	add_mirroring
4608	5.400	the_feel_felt_found+ownership_language	discard	crossover
4609	4.713	the_feel_felt_found+ownership_language	discard	tone_change
4610	5.112	the_feel_felt_found	discard	remove_ownership_language
4611	5.550	ownership_language	discard	crossover
4612	5.138	the_feel_felt_found+ownership_language+proactive_extras	discard	add_proactive_extras
4613	5.325	the_feel_felt_found+ownership_language	discard	temp_0.90
4614	5.138	the_feel_felt_found+proactive_extras	discard	swap_ownership_language_for_proactive_extras
4615	5.550	the_feel_felt_found+ownership_language	discard	tone_change
4616	5.013	the_feel_felt_found+ownership_language	discard	tone_change
4617	5.450	ownership_language+proactive_extras	discard	swap_the_feel_felt_found_for_proactive_extras
4618	5.325	the_feel_felt_found+ownership_language	discard	crossover
4619	5.300	the_feel_felt_found+proactive_extras	discard	swap_ownership_language_for_proactive_extras
4620	5.325	the_feel_felt_found+ownership_language	discard	temp_0.90
4621	5.550	the_feel_felt_found+ownership_language	discard	temp_0.85
4622	5.138	the_feel_felt_found+ownership_language	discard	tone_change
4623	5.238	the_feel_felt_found+ownership_language+casual_professionalism	discard	add_casual_professionalism
4624	5.200	the_feel_felt_found+ownership_language+genuine_admission	discard	add_genuine_admission
4625	5.138	the_feel_felt_found+strategic_agreement	discard	swap_ownership_language_for_strategic_agreement
4626	5.325	the_feel_felt_found+ownership_language	discard	tone_change
4627	5.338	the_feel_felt_found+ownership_language	discard	crossover
4628	5.300	the_feel_felt_found+ownership_language	discard	temp_0.95
4629	4.825	the_feel_felt_found+ownership_language+mirroring	discard	add_mirroring
4630	5.425	the_feel_felt_found+ownership_language+personal_touch	discard	add_personal_touch
4631	5.112	the_feel_felt_found+energy_matching	discard	swap_ownership_language_for_energy_matching
4632	5.550	ownership_language	discard	crossover
4633	5.112	ownership_language+proactive_extras	discard	swap_the_feel_felt_found_for_proactive_extras
4634	5.325	the_feel_felt_found+ownership_language	discard	tone_change
4635	5.450	the_feel_felt_found	discard	remove_ownership_language
4636	5.550	the_feel_felt_found+ownership_language+emotional_labeling	discard	add_emotional_labeling
4637	5.525	ownership_language	discard	crossover
4638	5.350	the_feel_felt_found+ownership_language	discard	temp_0.70
4639	4.825	ownership_language	discard	crossover
4640	5.325	the_feel_felt_found+ownership_language+energy_matching	discard	add_energy_matching
4641	5.425	the_feel_felt_found+ownership_language+warmth_injection	discard	add_warmth_injection
4642	5.325	the_feel_felt_found+ownership_language+warmth_injection	discard	add_warmth_injection
4643	5.212	the_feel_felt_found+ownership_language	discard	tone_change
4644	4.987	the_feel_felt_found	discard	remove_ownership_language
4645	5.013	the_feel_felt_found+ownership_language	discard	tone_change
4646	5.450	the_feel_felt_found+ownership_language+genuine_admission	discard	add_genuine_admission
4647	5.038	the_feel_felt_found+ownership_language	discard	tone_change
4648	5.138	the_feel_felt_found+casual_professionalism	discard	swap_ownership_language_for_casual_professionalism
4649	5.550	ownership_language	discard	crossover
4650	5.338	the_feel_felt_found+ownership_language	discard	tone_change
4651	5.225	the_feel_felt_found+ownership_language+validation_before_solution	discard	add_validation_before_solution
4652	5.237	the_feel_felt_found+ownership_language	discard	temp_0.90
4653	4.388	the_feel_felt_found	discard	remove_ownership_language
4654	5.300	the_feel_felt_found	discard	remove_ownership_language
4655	5.525	the_feel_felt_found+ownership_language	discard	temp_0.75
4656	5.200	ownership_language	discard	crossover
4657	4.825	the_feel_felt_found	discard	crossover
4658	5.425	the_feel_felt_found	discard	remove_ownership_language
4659	5.450	the_feel_felt_found+ownership_language	discard	temp_0.95
4660	5.450	the_feel_felt_found+ownership_language+proactive_extras	discard	add_proactive_extras
4661	5.138	the_feel_felt_found+ownership_language	discard	temp_0.65
4662	5.238	the_feel_felt_found	discard	remove_ownership_language
4663	5.425	the_feel_felt_found+ownership_language	discard	tone_change
4664	4.888	the_feel_felt_found+validation_before_solution	discard	swap_ownership_language_for_validation_before_solution
4665	4.513	the_feel_felt_found+ownership_language	discard	tone_change
4666	5.237	the_feel_felt_found+ownership_language	discard	crossover
4667	4.825	the_feel_felt_found+ownership_language	discard	temp_0.70
4668	5.200	the_feel_felt_found+ownership_language	discard	crossover
4669	5.425	the_feel_felt_found+ownership_language	discard	tone_change
4670	5.450	the_feel_felt_found+ownership_language	discard	tone_change
4671	5.450	ownership_language+never_say_calm_down	discard	swap_the_feel_felt_found_for_never_say_calm_down
4672	5.025	the_feel_felt_found+ownership_language	discard	tone_change
4673	5.550	the_feel_felt_found	discard	crossover
4674	5.225	the_feel_felt_found+ownership_language	discard	crossover
4675	5.450	the_feel_felt_found+ownership_language	discard	tone_change
4676	5.238	ownership_language	discard	crossover
4677	5.225	none	discard	crossover
4678	5.750	the_feel_felt_found+ownership_language+emotional_labeling	discard	add_emotional_labeling
4679	5.138	the_feel_felt_found+strategic_agreement	discard	swap_ownership_language_for_strategic_agreement
4680	5.012	the_feel_felt_found+ownership_language	discard	temp_0.85
4681	5.550	ownership_language	discard	crossover
4682	5.550	the_feel_felt_found+ownership_language	discard	temp_0.90
4683	5.550	ownership_language	discard	remove_the_feel_felt_found
4684	5.138	the_feel_felt_found+ownership_language	discard	tone_change
4685	5.325	the_feel_felt_found+ownership_language	discard	tone_change
4686	5.338	ownership_language	discard	crossover
4687	5.088	the_feel_felt_found+ownership_language	discard	tone_change
4688	5.237	the_feel_felt_found+ownership_language	discard	crossover
4689	5.225	the_feel_felt_found+ownership_language	discard	temp_0.95
4690	5.450	the_feel_felt_found+ownership_language	discard	temp_0.75
4691	5.087	the_feel_felt_found+ownership_language+energy_matching	discard	add_energy_matching
4692	5.325	ownership_language+emotional_labeling	discard	swap_the_feel_felt_found_for_emotional_labeling
4693	5.350	ownership_language+warmth_injection	discard	swap_the_feel_felt_found_for_warmth_injection
4694	4.825	the_feel_felt_found+ownership_language+personal_touch	discard	add_personal_touch
4695	5.013	the_feel_felt_found+ownership_language	discard	crossover
4696	4.987	the_feel_felt_found+casual_professionalism	discard	swap_ownership_language_for_casual_professionalism
4697	5.550	the_feel_felt_found+ownership_language	discard	temp_0.75
4698	4.825	the_feel_felt_found+ownership_language	discard	tone_change
4699	5.550	the_feel_felt_found+ownership_language	discard	tone_change
4700	5.213	the_feel_felt_found+energy_matching	discard	swap_ownership_language_for_energy_matching
4701	5.013	the_feel_felt_found+ownership_language+never_say_calm_down	discard	add_never_say_calm_down
4702	5.225	ownership_language	discard	remove_the_feel_felt_found
4703	5.237	the_feel_felt_found+ownership_language	discard	crossover
4704	5.238	the_feel_felt_found+proactive_extras	discard	swap_ownership_language_for_proactive_extras
4705	5.550	the_feel_felt_found+ownership_language	discard	tone_change
4706	5.138	the_feel_felt_found	discard	crossover
4707	5.112	the_feel_felt_found+concrete_next_steps	discard	swap_ownership_language_for_concrete_next_steps
4708	4.888	the_feel_felt_found+ownership_language+proactive_extras	discard	add_proactive_extras
4709	5.550	ownership_language+casual_professionalism	discard	swap_the_feel_felt_found_for_casual_professionalism
4710	5.450	the_feel_felt_found+ownership_language+mirroring	discard	add_mirroring
4711	5.138	ownership_language+mirroring	discard	swap_the_feel_felt_found_for_mirroring
4712	5.450	ownership_language+warmth_injection	discard	swap_the_feel_felt_found_for_warmth_injection
4713	4.825	ownership_language+personal_touch	discard	swap_the_feel_felt_found_for_personal_touch
4714	5.650	ownership_language+strategic_agreement	discard	swap_the_feel_felt_found_for_strategic_agreement
4715	5.525	the_feel_felt_found+casual_professionalism	discard	swap_ownership_language_for_casual_professionalism
4716	5.025	the_feel_felt_found+ownership_language	discard	temp_0.85
4717	5.425	the_feel_felt_found+ownership_language	discard	tone_change
4718	4.800	the_feel_felt_found+ownership_language	discard	temp_0.85
4719	4.800	the_feel_felt_found+ownership_language	discard	tone_change
4720	4.988	the_feel_felt_found+ownership_language+emotional_labeling	discard	add_emotional_labeling
4721	5.350	the_feel_felt_found+ownership_language	discard	crossover
4722	5.112	the_feel_felt_found+ownership_language	discard	tone_change
4723	5.425	the_feel_felt_found	discard	crossover
4724	5.138	the_feel_felt_found	discard	crossover
4725	5.213	the_feel_felt_found+ownership_language+genuine_admission	discard	add_genuine_admission
4726	4.925	the_feel_felt_found	discard	crossover
4727	5.325	the_feel_felt_found+concrete_next_steps	discard	swap_ownership_language_for_concrete_next_steps
4728	4.925	the_feel_felt_found+ownership_language+warmth_injection	discard	add_warmth_injection
4729	5.325	the_feel_felt_found+ownership_language	discard	tone_change
4730	5.025	the_feel_felt_found	discard	crossover
4731	5.013	ownership_language+casual_professionalism	discard	swap_the_feel_felt_found_for_casual_professionalism
4732	5.350	the_feel_felt_found+ownership_language+mirroring	discard	add_mirroring
4733	5.200	the_feel_felt_found+energy_matching	discard	swap_ownership_language_for_energy_matching
4734	4.888	ownership_language+strategic_agreement	discard	swap_the_feel_felt_found_for_strategic_agreement
4735	4.888	ownership_language	discard	crossover
4736	5.525	the_feel_felt_found+ownership_language	discard	tone_change
4737	5.212	the_feel_felt_found+ownership_language+mirroring	discard	add_mirroring
4738	5.650	the_feel_felt_found+ownership_language	discard	crossover
4739	5.037	the_feel_felt_found+ownership_language	discard	tone_change
4740	5.425	the_feel_felt_found+never_say_calm_down	discard	swap_ownership_language_for_never_say_calm_down
4741	5.025	the_feel_felt_found+ownership_language+energy_matching	discard	add_energy_matching
4742	4.700	the_feel_felt_found+ownership_language+emotional_labeling	discard	add_emotional_labeling
4743	5.112	the_feel_felt_found	discard	crossover
4744	5.138	the_feel_felt_found+ownership_language	discard	tone_change
4745	5.550	the_feel_felt_found+ownership_language	discard	temp_0.95
4746	4.912	ownership_language+concrete_next_steps	discard	swap_the_feel_felt_found_for_concrete_next_steps
4747	5.550	the_feel_felt_found	discard	crossover
4748	5.425	the_feel_felt_found+ownership_language	discard	crossover
4749	5.137	the_feel_felt_found+ownership_language	discard	tone_change
4750	5.750	the_feel_felt_found+ownership_language	discard	crossover
4751	5.138	the_feel_felt_found	discard	remove_ownership_language
4752	5.325	the_feel_felt_found+ownership_language	discard	crossover
4753	5.325	the_feel_felt_found+ownership_language	discard	tone_change
4754	5.350	the_feel_felt_found+ownership_language+mirroring	discard	add_mirroring
4755	5.138	the_feel_felt_found+ownership_language	discard	crossover
4756	5.213	the_feel_felt_found+concrete_next_steps	discard	swap_ownership_language_for_concrete_next_steps
4757	4.938	the_feel_felt_found+ownership_language	discard	temp_0.95
4758	5.425	the_feel_felt_found+ownership_language	discard	tone_change
4759	4.912	the_feel_felt_found+ownership_language+validation_before_solution	discard	add_validation_before_solution
4760	5.225	the_feel_felt_found+ownership_language	discard	tone_change
4761	5.337	the_feel_felt_found+ownership_language+emotional_labeling	discard	add_emotional_labeling
4762	4.825	the_feel_felt_found+ownership_language	discard	tone_change
4763	4.900	the_feel_felt_found	discard	crossover
4764	5.550	the_feel_felt_found	discard	remove_ownership_language
4765	4.825	ownership_language	discard	crossover
4766	5.400	the_feel_felt_found	discard	crossover
4767	5.550	the_feel_felt_found+ownership_language	discard	tone_change
