generation	eq_score	techniques	status	description
17952	5.550	the_feel_felt_found+ownership_language+concrete_next_steps	discard	add_concrete_next_steps
17953	5.450	the_feel_felt_found+ownership_language	discard	crossover
17954	5.525	ownership_language+strategic_agreement	discard	swap_the_feel_felt_found_for_strategic_agreement
17955	5.238	the_feel_felt_found+ownership_language	discard	tone_change
17956	5.037	ownership_language+energy_matching	discard	swap_the_feel_felt_found_for_energy_matching
17957	5.450	the_feel_felt_found+warmth_injection	discard	swap_ownership_language_for_warmth_injection
17958	5.237	the_feel_felt_found+ownership_language	discard	tone_change
17959	5.237	the_feel_felt_found+ownership_language+personal_touch	discard	add_personal_touch
17960	5.138	the_feel_felt_found+concrete_next_steps	discard	swap_ownership_language_for_concrete_next_steps
17961	5.650	the_feel_felt_found+ownership_language	discard	temp_0.85
17962	5.650	ownership_language+personal_touch	discard	swap_the_feel_felt_found_for_personal_touch
17963	5.138	the_feel_felt_found	discard	remove_ownership_language
17964	5.450	ownership_language+proactive_extras	discard	swap_the_feel_felt_found_for_proactive_extras
17965	5.550	the_feel_felt_found+ownership_language+mirroring	discard	add_mirroring
17966	5.013	the_feel_felt_found+ownership_language	discard	crossover
17967	5.013	the_feel_felt_found	discard	remove_ownership_language
17968	5.300	the_feel_felt_found+ownership_language	discard	tone_change
17969	5.325	the_feel_felt_found+ownership_language	discard	tone_change
17970	5.238	the_feel_felt_found	discard	remove_ownership_language
17971	5.200	the_feel_felt_found+ownership_language+personal_touch	discard	add_personal_touch
17972	4.825	the_feel_felt_found	discard	crossover
17973	5.112	the_feel_felt_found+ownership_language	discard	temp_0.85
17974	5.550	the_feel_felt_found+ownership_language	discard	crossover
17975	5.237	the_feel_felt_found+ownership_language+emotional_labeling	discard	add_emotional_labeling
17976	5.325	the_feel_felt_found+ownership_language	discard	temp_0.85
17977	5.075	the_feel_felt_found+proactive_extras	discard	swap_ownership_language_for_proactive_extras
17978	4.513	the_feel_felt_found+ownership_language	discard	tone_change
17979	5.138	ownership_language	discard	remove_the_feel_felt_found
17980	4.925	the_feel_felt_found+ownership_language+casual_professionalism	discard	add_casual_professionalism
17981	5.450	the_feel_felt_found+ownership_language	discard	temp_0.70
17982	4.925	the_feel_felt_found	discard	remove_ownership_language
17983	4.700	the_feel_felt_found+ownership_language+never_say_calm_down	discard	add_never_say_calm_down
17984	5.013	the_feel_felt_found+ownership_language+proactive_extras	discard	add_proactive_extras
17985	5.138	the_feel_felt_found+ownership_language	discard	crossover
17986	5.200	the_feel_felt_found+ownership_language	discard	tone_change
17987	5.225	the_feel_felt_found+ownership_language+mirroring	discard	add_mirroring
17988	5.237	ownership_language+genuine_admission	discard	swap_the_feel_felt_found_for_genuine_admission
17989	5.112	the_feel_felt_found+ownership_language+proactive_extras	discard	add_proactive_extras
17990	5.525	ownership_language	discard	crossover
17991	5.650	the_feel_felt_found+ownership_language	discard	temp_0.95
17992	5.037	the_feel_felt_found+ownership_language	discard	tone_change
17993	5.125	ownership_language	discard	remove_the_feel_felt_found
17994	5.338	none	discard	crossover
17995	5.338	the_feel_felt_found	discard	remove_ownership_language
17996	5.112	the_feel_felt_found+ownership_language+mirroring	discard	add_mirroring
17997	5.650	the_feel_felt_found+ownership_language	discard	temp_0.90
17998	5.650	the_feel_felt_found+ownership_language	discard	tone_change
17999	5.112	the_feel_felt_found+ownership_language+energy_matching	discard	add_energy_matching
18000	5.550	ownership_language	discard	remove_the_feel_felt_found
18001	5.450	the_feel_felt_found+ownership_language+mirroring	discard	add_mirroring
18002	5.338	the_feel_felt_found	discard	remove_ownership_language
18003	5.650	the_feel_felt_found+ownership_language	discard	crossover
18004	5.325	ownership_language	discard	crossover
18005	5.650	the_feel_felt_found+ownership_language	discard	crossover
18006	5.450	the_feel_felt_found+ownership_language	discard	crossover
18007	5.550	the_feel_felt_found+ownership_language	discard	tone_change
18008	5.325	the_feel_felt_found+ownership_language	discard	crossover
18009	4.925	the_feel_felt_found+ownership_language+warmth_injection	discard	add_warmth_injection
18010	5.138	ownership_language	discard	remove_the_feel_felt_found
18011	5.237	ownership_language+concrete_next_steps	discard	swap_the_feel_felt_found_for_concrete_next_steps
18012	5.450	the_feel_felt_found+ownership_language+strategic_agreement	discard	add_strategic_agreement
18013	5.300	the_feel_felt_found+ownership_language+proactive_extras	discard	add_proactive_extras
18014	5.450	the_feel_felt_found+ownership_language	discard	temp_0.70
18015	5.338	the_feel_felt_found+never_say_calm_down	discard	swap_ownership_language_for_never_say_calm_down
18016	5.550	ownership_language	discard	crossover
18017	5.138	the_feel_felt_found+ownership_language	discard	crossover
18018	5.425	the_feel_felt_found	discard	crossover
18019	5.650	ownership_language	discard	crossover
18020	5.112	the_feel_felt_found+ownership_language	discard	tone_change
18021	5.138	ownership_language	discard	remove_the_feel_felt_found
18022	5.450	ownership_language	discard	remove_the_feel_felt_found
18023	5.550	the_feel_felt_found+ownership_language	discard	tone_change
18024	5.125	ownership_language+warmth_injection	discard	swap_the_feel_felt_found_for_warmth_injection
18025	4.825	the_feel_felt_found+ownership_language	discard	crossover
18026	5.550	the_feel_felt_found+validation_before_solution	discard	swap_ownership_language_for_validation_before_solution
18027	5.325	the_feel_felt_found+ownership_language	discard	tone_change
18028	5.138	the_feel_felt_found+ownership_language	discard	tone_change
18029	4.925	the_feel_felt_found+emotional_labeling	discard	swap_ownership_language_for_emotional_labeling
18030	5.013	the_feel_felt_found+ownership_language+strategic_agreement	discard	add_strategic_agreement
18031	5.037	the_feel_felt_found+strategic_agreement	discard	swap_ownership_language_for_strategic_agreement
18032	5.112	the_feel_felt_found+ownership_language	discard	temp_0.95
18033	5.325	the_feel_felt_found+ownership_language+casual_professionalism	discard	add_casual_professionalism
18034	5.550	the_feel_felt_found+ownership_language+never_say_calm_down	discard	add_never_say_calm_down
18035	5.038	the_feel_felt_found+ownership_language	discard	tone_change
18036	4.513	the_feel_felt_found	discard	remove_ownership_language
18037	5.212	the_feel_felt_found+ownership_language	discard	tone_change
18038	4.700	the_feel_felt_found+ownership_language+mirroring	discard	add_mirroring
18039	5.237	none	discard	crossover
18040	5.237	the_feel_felt_found+ownership_language+warmth_injection	discard	add_warmth_injection
18041	5.213	the_feel_felt_found+ownership_language	discard	temp_0.95
18042	5.237	ownership_language	discard	crossover
18043	5.013	the_feel_felt_found+energy_matching	discard	swap_ownership_language_for_energy_matching
18044	5.237	the_feel_felt_found+ownership_language	discard	crossover
18045	5.550	the_feel_felt_found+mirroring	discard	swap_ownership_language_for_mirroring
18046	5.237	the_feel_felt_found+ownership_language+never_say_calm_down	discard	add_never_say_calm_down
18047	5.237	the_feel_felt_found+ownership_language	discard	temp_0.90
18048	4.925	the_feel_felt_found+ownership_language	discard	tone_change
18049	5.325	the_feel_felt_found+ownership_language	discard	tone_change
18050	5.325	the_feel_felt_found+ownership_language	discard	tone_change
18051	5.238	the_feel_felt_found+ownership_language	discard	tone_change
18052	5.425	the_feel_felt_found+ownership_language	discard	tone_change
18053	5.138	the_feel_felt_found+genuine_admission	discard	swap_ownership_language_for_genuine_admission
18054	5.238	the_feel_felt_found+ownership_language	discard	temp_0.90
18055	5.450	the_feel_felt_found+ownership_language	discard	tone_change
18056	4.825	the_feel_felt_found+ownership_language	discard	crossover
18057	5.550	none	discard	crossover
18058	4.825	the_feel_felt_found+ownership_language+warmth_injection	discard	add_warmth_injection
18059	4.825	the_feel_felt_found+casual_professionalism	discard	swap_ownership_language_for_casual_professionalism
18060	5.200	the_feel_felt_found+concrete_next_steps	discard	swap_ownership_language_for_concrete_next_steps
18061	5.425	ownership_language	discard	remove_the_feel_felt_found
18062	4.825	ownership_language+never_say_calm_down	discard	swap_the_feel_felt_found_for_never_say_calm_down
18063	5.200	the_feel_felt_found+ownership_language	discard	tone_change
18064	5.550	the_feel_felt_found+genuine_admission	discard	swap_ownership_language_for_genuine_admission
18065	5.112	none	discard	crossover
18066	5.525	ownership_language+mirroring	discard	swap_the_feel_felt_found_for_mirroring
18067	5.238	the_feel_felt_found+ownership_language+never_say_calm_down	discard	add_never_say_calm_down
18068	5.237	the_feel_felt_found+ownership_language	discard	tone_change
18069	5.325	the_feel_felt_found+ownership_language+proactive_extras	discard	add_proactive_extras
18070	5.325	the_feel_felt_found+ownership_language	discard	tone_change
18071	5.138	the_feel_felt_found+warmth_injection	discard	swap_ownership_language_for_warmth_injection
18072	5.425	ownership_language+mirroring	discard	swap_the_feel_felt_found_for_mirroring
18073	5.013	the_feel_felt_found+ownership_language	discard	tone_change
18074	5.237	the_feel_felt_found+ownership_language+genuine_admission	discard	add_genuine_admission
18075	4.988	the_feel_felt_found+ownership_language	discard	tone_change
18076	4.800	ownership_language+mirroring	discard	swap_the_feel_felt_found_for_mirroring
18077	4.825	the_feel_felt_found+ownership_language	discard	tone_change
18078	5.112	the_feel_felt_found	discard	remove_ownership_language
18079	5.300	the_feel_felt_found+ownership_language+casual_professionalism	discard	add_casual_professionalism
18080	4.988	the_feel_felt_found	discard	crossover
18081	5.025	the_feel_felt_found+ownership_language	discard	tone_change
18082	5.450	the_feel_felt_found	discard	crossover
18083	5.237	the_feel_felt_found+ownership_language+genuine_admission	discard	add_genuine_admission
18084	5.213	the_feel_felt_found+ownership_language	discard	crossover
18085	5.325	the_feel_felt_found+ownership_language	discard	crossover
18086	5.425	the_feel_felt_found	discard	remove_ownership_language
18087	5.138	the_feel_felt_found+ownership_language	discard	tone_change
18088	5.550	ownership_language	discard	crossover
18089	5.650	ownership_language	discard	remove_the_feel_felt_found
18090	4.925	ownership_language	discard	remove_the_feel_felt_found
18091	5.550	the_feel_felt_found+ownership_language	discard	tone_change
18092	5.425	the_feel_felt_found+ownership_language	discard	temp_0.65
18093	5.450	the_feel_felt_found+concrete_next_steps	discard	swap_ownership_language_for_concrete_next_steps
18094	5.013	the_feel_felt_found+ownership_language+warmth_injection	discard	add_warmth_injection
18095	5.450	the_feel_felt_found+ownership_language	discard	temp_0.95
18096	5.013	the_feel_felt_found+ownership_language+genuine_admission	discard	add_genuine_admission
18097	5.113	the_feel_felt_found+ownership_language	discard	tone_change
18098	5.200	the_feel_felt_found+ownership_language	discard	temp_0.70
18099	5.550	the_feel_felt_found+ownership_language+energy_matching	discard	add_energy_matching
18100	5.138	the_feel_felt_found+ownership_language	discard	temp_0.75
18101	5.037	the_feel_felt_found+ownership_language+mirroring	discard	add_mirroring
18102	5.550	ownership_language	discard	remove_the_feel_felt_found
18103	5.325	ownership_language+mirroring	discard	swap_the_feel_felt_found_for_mirroring
18104	5.425	the_feel_felt_found+ownership_language+emotional_labeling	discard	add_emotional_labeling
18105	5.200	the_feel_felt_found+ownership_language	discard	crossover
18106	5.550	the_feel_felt_found	discard	crossover
18107	5.450	the_feel_felt_found+ownership_language+strategic_agreement	discard	add_strategic_agreement
18108	5.350	the_feel_felt_found+ownership_language+proactive_extras	discard	add_proactive_extras
18109	5.138	the_feel_felt_found+ownership_language+proactive_extras	discard	add_proactive_extras
18110	5.325	the_feel_felt_found+ownership_language+validation_before_solution	discard	add_validation_before_solution
18111	5.225	the_feel_felt_found+ownership_language+never_say_calm_down	discard	add_never_say_calm_down
18112	5.112	the_feel_felt_found+ownership_language	discard	crossover
18113	5.113	the_feel_felt_found+ownership_language	discard	crossover
18114	5.025	ownership_language	discard	remove_the_feel_felt_found
18115	5.138	the_feel_felt_found+ownership_language+warmth_injection	discard	add_warmth_injection
18116	4.925	the_feel_felt_found+ownership_language	discard	temp_0.85
18117	5.350	the_feel_felt_found+ownership_language+warmth_injection	discard	add_warmth_injection
18118	5.325	ownership_language+genuine_admission	discard	swap_the_feel_felt_found_for_genuine_admission
18119	5.237	ownership_language	discard	remove_the_feel_felt_found
18120	5.013	the_feel_felt_found+ownership_language	discard	crossover
18121	5.025	the_feel_felt_found+ownership_language+personal_touch	discard	add_personal_touch
18122	5.450	ownership_language+validation_before_solution	discard	swap_the_feel_felt_found_for_validation_before_solution
18123	5.325	the_feel_felt_found+ownership_language	discard	crossover
18124	5.450	the_feel_felt_found+ownership_language+validation_before_solution	discard	add_validation_before_solution
18125	5.138	the_feel_felt_found+ownership_language	discard	crossover
18126	4.713	the_feel_felt_found+ownership_language	discard	temp_0.85
18127	5.238	the_feel_felt_found+ownership_language	discard	tone_change
18128	5.037	ownership_language	discard	crossover
18129	4.888	ownership_language+personal_touch	discard	swap_the_feel_felt_found_for_personal_touch
18130	5.425	the_feel_felt_found+ownership_language+casual_professionalism	discard	add_casual_professionalism
18131	5.013	the_feel_felt_found+ownership_language+never_say_calm_down	discard	add_never_say_calm_down
18132	5.200	the_feel_felt_found+ownership_language	discard	temp_0.95
18133	4.925	the_feel_felt_found+ownership_language	discard	temp_0.85
18134	5.450	ownership_language	discard	crossover
18135	5.550	the_feel_felt_found+ownership_language	discard	crossover
18136	5.350	the_feel_felt_found+ownership_language	discard	tone_change
18137	5.325	the_feel_felt_found+ownership_language+mirroring	discard	add_mirroring
18138	5.025	ownership_language+warmth_injection	discard	swap_the_feel_felt_found_for_warmth_injection
18139	4.913	the_feel_felt_found	discard	crossover
18140	5.013	ownership_language	discard	remove_the_feel_felt_found
18141	5.550	the_feel_felt_found+ownership_language+energy_matching	discard	add_energy_matching
18142	5.138	ownership_language	discard	crossover
18143	5.325	ownership_language+mirroring	discard	swap_the_feel_felt_found_for_mirroring
18144	5.650	the_feel_felt_found+ownership_language	discard	tone_change
18145	5.238	the_feel_felt_found+ownership_language+genuine_admission	discard	add_genuine_admission
18146	5.237	the_feel_felt_found+ownership_language	discard	crossover
18147	5.200	the_feel_felt_found+ownership_language	discard	crossover
18148	5.450	the_feel_felt_found+ownership_language+casual_professionalism	discard	add_casual_professionalism
18149	5.425	the_feel_felt_found+ownership_language	discard	tone_change
18150	5.650	the_feel_felt_found+ownership_language	discard	tone_change
18151	5.425	ownership_language	discard	remove_the_feel_felt_found
18152	5.237	the_feel_felt_found+never_say_calm_down	discard	swap_ownership_language_for_never_say_calm_down
18153	5.238	the_feel_felt_found	discard	crossover
18154	5.013	the_feel_felt_found+ownership_language	discard	tone_change
18155	5.138	the_feel_felt_found	discard	crossover
18156	5.138	the_feel_felt_found+ownership_language	discard	temp_0.95
18157	5.325	the_feel_felt_found+ownership_language	discard	temp_0.90
18158	5.325	the_feel_felt_found+ownership_language	discard	temp_0.95
18159	5.013	the_feel_felt_found+ownership_language+mirroring	discard	add_mirroring
18160	5.237	the_feel_felt_found+emotional_labeling	discard	swap_ownership_language_for_emotional_labeling
18161	5.237	the_feel_felt_found+ownership_language	discard	temp_0.90
18162	5.550	the_feel_felt_found+ownership_language	discard	tone_change
18163	5.112	the_feel_felt_found+ownership_language+genuine_admission	discard	add_genuine_admission
18164	5.238	the_feel_felt_found+ownership_language+emotional_labeling	discard	add_emotional_labeling
18165	5.213	ownership_language	discard	crossover
18166	5.450	the_feel_felt_found+proactive_extras	discard	swap_ownership_language_for_proactive_extras
18167	5.337	the_feel_felt_found+ownership_language	discard	tone_change
18168	5.350	the_feel_felt_found+ownership_language	discard	crossover
18169	5.237	the_feel_felt_found	discard	remove_ownership_language
18170	5.138	the_feel_felt_found+ownership_language+emotional_labeling	discard	add_emotional_labeling
18171	5.013	the_feel_felt_found+ownership_language	discard	tone_change
18172	5.338	none	discard	crossover
18173	5.350	the_feel_felt_found+ownership_language	discard	crossover
18174	4.800	the_feel_felt_found+ownership_language	discard	tone_change
18175	5.450	the_feel_felt_found+ownership_language	discard	crossover
18176	5.213	the_feel_felt_found+ownership_language	discard	crossover
18177	5.425	the_feel_felt_found+ownership_language	discard	temp_0.85
18178	5.350	the_feel_felt_found+ownership_language+proactive_extras	discard	add_proactive_extras
18179	5.350	the_feel_felt_found+ownership_language	discard	tone_change
18180	5.337	the_feel_felt_found+emotional_labeling	discard	swap_ownership_language_for_emotional_labeling
18181	5.238	the_feel_felt_found+ownership_language	discard	tone_change
18182	4.925	the_feel_felt_found+casual_professionalism	discard	swap_ownership_language_for_casual_professionalism
18183	5.425	the_feel_felt_found+ownership_language	discard	crossover
18184	4.700	the_feel_felt_found+ownership_language	discard	crossover
18185	5.650	the_feel_felt_found+ownership_language	discard	tone_change
18186	5.325	the_feel_felt_found+ownership_language	discard	temp_0.85
18187	5.325	the_feel_felt_found+ownership_language	discard	crossover
18188	5.200	the_feel_felt_found+proactive_extras	discard	swap_ownership_language_for_proactive_extras
18189	5.325	the_feel_felt_found+ownership_language	discard	tone_change
18190	5.237	the_feel_felt_found+ownership_language+concrete_next_steps	discard	add_concrete_next_steps
18191	5.337	ownership_language+genuine_admission	discard	swap_the_feel_felt_found_for_genuine_admission
18192	5.750	ownership_language	discard	remove_the_feel_felt_found
18193	5.325	the_feel_felt_found+ownership_language	discard	tone_change
18194	4.888	the_feel_felt_found+ownership_language	discard	temp_0.90
18195	5.550	the_feel_felt_found+ownership_language	discard	tone_change
18196	5.138	the_feel_felt_found+ownership_language	discard	temp_0.90
18197	5.237	ownership_language	discard	crossover
18198	5.450	ownership_language	discard	remove_the_feel_felt_found
18199	4.800	the_feel_felt_found	discard	remove_ownership_language
18200	5.113	the_feel_felt_found+ownership_language+strategic_agreement	discard	add_strategic_agreement
18201	5.425	the_feel_felt_found+ownership_language	discard	tone_change
18202	5.450	ownership_language+never_say_calm_down	discard	swap_the_feel_felt_found_for_never_say_calm_down
18203	5.075	the_feel_felt_found	discard	remove_ownership_language
18204	5.237	the_feel_felt_found+genuine_admission	discard	swap_ownership_language_for_genuine_admission
18205	5.312	ownership_language	discard	remove_the_feel_felt_found
18206	5.425	the_feel_felt_found+ownership_language	discard	tone_change
18207	5.450	the_feel_felt_found+ownership_language	discard	temp_0.90
18208	5.112	ownership_language+warmth_injection	discard	swap_the_feel_felt_found_for_warmth_injection
18209	5.238	the_feel_felt_found+ownership_language	discard	tone_change
18210	5.200	the_feel_felt_found+ownership_language	discard	crossover
18211	5.550	the_feel_felt_found+ownership_language	discard	crossover
18212	4.800	ownership_language	discard	remove_the_feel_felt_found
18213	4.912	the_feel_felt_found+energy_matching	discard	swap_ownership_language_for_energy_matching
18214	5.225	the_feel_felt_found+ownership_language	discard	temp_0.65
18215	5.013	the_feel_felt_found+ownership_language	discard	crossover
18216	5.750	ownership_language	discard	crossover
18217	5.138	the_feel_felt_found+ownership_language	discard	temp_0.90
18218	5.525	the_feel_felt_found+ownership_language	discard	crossover
18219	5.013	the_feel_felt_found+ownership_language+genuine_admission	discard	add_genuine_admission
18220	5.525	ownership_language+strategic_agreement	discard	swap_the_feel_felt_found_for_strategic_agreement
18221	4.800	the_feel_felt_found+ownership_language+energy_matching	discard	add_energy_matching
18222	5.325	ownership_language	discard	remove_the_feel_felt_found
18223	4.487	the_feel_felt_found+ownership_language	discard	temp_0.90
18224	5.138	ownership_language+concrete_next_steps	discard	swap_the_feel_felt_found_for_concrete_next_steps
18225	5.325	the_feel_felt_found+ownership_language+proactive_extras	discard	add_proactive_extras
18226	5.450	the_feel_felt_found+proactive_extras	discard	swap_ownership_language_for_proactive_extras
18227	5.013	the_feel_felt_found+ownership_language+genuine_admission	discard	add_genuine_admission
18228	5.325	the_feel_felt_found+ownership_language	discard	tone_change
