generation	eq_score	techniques	status	description
18771	5.450	ownership_language+warmth_injection	discard	swap_the_feel_felt_found_for_warmth_injection
18772	5.650	ownership_language	discard	crossover
18773	4.612	ownership_language	discard	remove_the_feel_felt_found
18774	5.325	the_feel_felt_found+ownership_language	discard	crossover
18775	5.113	the_feel_felt_found	discard	remove_ownership_language
18776	5.650	none	discard	crossover
18777	5.450	the_feel_felt_found+ownership_language+energy_matching	discard	add_energy_matching
18778	5.013	the_feel_felt_found+ownership_language	discard	tone_change
18779	5.550	the_feel_felt_found+ownership_language+casual_professionalism	discard	add_casual_professionalism
18780	5.013	the_feel_felt_found+never_say_calm_down	discard	swap_ownership_language_for_never_say_calm_down
18781	5.237	the_feel_felt_found+ownership_language	discard	temp_0.70
18782	5.013	ownership_language	discard	crossover
18783	5.325	the_feel_felt_found+ownership_language+validation_before_solution	discard	add_validation_before_solution
18784	5.325	ownership_language	discard	remove_the_feel_felt_found
18785	5.200	the_feel_felt_found+ownership_language	discard	tone_change
18786	5.125	the_feel_felt_found+ownership_language+concrete_next_steps	discard	add_concrete_next_steps
18787	5.550	the_feel_felt_found+ownership_language	discard	temp_0.70
18788	4.925	the_feel_felt_found+ownership_language+genuine_admission	discard	add_genuine_admission
18789	5.237	the_feel_felt_found	discard	crossover
18790	5.325	the_feel_felt_found+ownership_language	discard	temp_0.65
18791	5.138	the_feel_felt_found+ownership_language	discard	tone_change
18792	5.425	the_feel_felt_found+ownership_language+genuine_admission	discard	add_genuine_admission
18793	4.700	the_feel_felt_found+strategic_agreement	discard	swap_ownership_language_for_strategic_agreement
18794	5.112	the_feel_felt_found+ownership_language+validation_before_solution	discard	add_validation_before_solution
18795	5.138	the_feel_felt_found+ownership_language+proactive_extras	discard	add_proactive_extras
18796	5.138	the_feel_felt_found+validation_before_solution	discard	swap_ownership_language_for_validation_before_solution
18797	5.338	the_feel_felt_found+ownership_language	discard	temp_0.75
18798	5.550	the_feel_felt_found	discard	remove_ownership_language
18799	5.350	the_feel_felt_found	discard	crossover
18800	5.325	the_feel_felt_found+ownership_language+casual_professionalism	discard	add_casual_professionalism
18801	5.425	the_feel_felt_found+ownership_language	discard	tone_change
18802	5.550	ownership_language+proactive_extras	discard	swap_the_feel_felt_found_for_proactive_extras
18803	5.425	the_feel_felt_found+ownership_language	discard	tone_change
18804	5.350	the_feel_felt_found+ownership_language	discard	tone_change
18805	5.025	the_feel_felt_found+ownership_language	discard	crossover
18806	4.925	ownership_language	discard	remove_the_feel_felt_found
18807	5.450	none	discard	crossover
18808	4.800	the_feel_felt_found+ownership_language+emotional_labeling	discard	add_emotional_labeling
18809	5.225	the_feel_felt_found+ownership_language	discard	temp_0.75
18810	4.825	the_feel_felt_found+ownership_language	discard	tone_change
18811	5.112	the_feel_felt_found+ownership_language+energy_matching	discard	add_energy_matching
18812	5.338	the_feel_felt_found+ownership_language	discard	tone_change
18813	5.450	the_feel_felt_found+ownership_language	discard	tone_change
18814	5.450	ownership_language+warmth_injection	discard	swap_the_feel_felt_found_for_warmth_injection
18815	4.825	the_feel_felt_found+ownership_language	discard	tone_change
18816	5.350	ownership_language	discard	remove_the_feel_felt_found
18817	5.325	the_feel_felt_found+ownership_language+personal_touch	discard	add_personal_touch
18818	5.450	the_feel_felt_found+ownership_language	discard	temp_0.90
18819	4.925	the_feel_felt_found+ownership_language	discard	tone_change
18820	5.525	ownership_language+emotional_labeling	discard	swap_the_feel_felt_found_for_emotional_labeling
18821	5.338	the_feel_felt_found+ownership_language	discard	tone_change
18822	5.325	the_feel_felt_found+ownership_language	discard	temp_0.90
18823	5.112	the_feel_felt_found+concrete_next_steps	discard	swap_ownership_language_for_concrete_next_steps
18824	5.112	the_feel_felt_found+ownership_language	discard	crossover
18825	5.013	the_feel_felt_found+ownership_language	discard	tone_change
18826	5.325	the_feel_felt_found+ownership_language	discard	temp_0.65
18827	5.013	the_feel_felt_found+ownership_language	discard	tone_change
18828	5.750	the_feel_felt_found+ownership_language+concrete_next_steps	discard	add_concrete_next_steps
18829	4.725	the_feel_felt_found	discard	crossover
18830	4.987	the_feel_felt_found+ownership_language	discard	crossover
18831	5.450	the_feel_felt_found+ownership_language	discard	tone_change
18832	5.237	ownership_language	discard	remove_the_feel_felt_found
18833	5.200	none	discard	crossover
18834	5.350	the_feel_felt_found+ownership_language+casual_professionalism	discard	add_casual_professionalism
18835	5.450	the_feel_felt_found+ownership_language+strategic_agreement	discard	add_strategic_agreement
18836	5.450	the_feel_felt_found+ownership_language+validation_before_solution	discard	add_validation_before_solution
18837	5.425	the_feel_felt_found+ownership_language+proactive_extras	discard	add_proactive_extras
18838	5.425	the_feel_felt_found+ownership_language+personal_touch	discard	add_personal_touch
18839	5.013	the_feel_felt_found+never_say_calm_down	discard	swap_ownership_language_for_never_say_calm_down
18840	5.450	the_feel_felt_found+ownership_language	discard	tone_change
18841	5.450	ownership_language	discard	remove_the_feel_felt_found
18842	5.450	the_feel_felt_found+ownership_language	discard	crossover
18843	5.237	the_feel_felt_found+ownership_language+warmth_injection	discard	add_warmth_injection
18844	4.925	ownership_language+concrete_next_steps	discard	swap_the_feel_felt_found_for_concrete_next_steps
18845	5.237	the_feel_felt_found+ownership_language+concrete_next_steps	discard	add_concrete_next_steps
18846	5.450	ownership_language+energy_matching	discard	swap_the_feel_felt_found_for_energy_matching
18847	5.650	the_feel_felt_found+ownership_language	discard	tone_change
18848	5.138	the_feel_felt_found+ownership_language	discard	tone_change
18849	5.438	the_feel_felt_found+ownership_language	discard	temp_0.85
18850	5.550	the_feel_felt_found+ownership_language+genuine_admission	discard	add_genuine_admission
18851	5.238	ownership_language+never_say_calm_down	discard	swap_the_feel_felt_found_for_never_say_calm_down
18852	4.925	the_feel_felt_found+never_say_calm_down	discard	swap_ownership_language_for_never_say_calm_down
18853	5.138	the_feel_felt_found+ownership_language	discard	tone_change
18854	5.325	the_feel_felt_found+ownership_language+casual_professionalism	discard	add_casual_professionalism
18855	5.625	the_feel_felt_found+proactive_extras	discard	swap_ownership_language_for_proactive_extras
18856	5.138	the_feel_felt_found+ownership_language	discard	tone_change
18857	5.450	the_feel_felt_found+casual_professionalism	discard	swap_ownership_language_for_casual_professionalism
18858	5.337	the_feel_felt_found+ownership_language+never_say_calm_down	discard	add_never_say_calm_down
18859	4.700	ownership_language	discard	remove_the_feel_felt_found
18860	5.112	the_feel_felt_found+ownership_language	discard	crossover
18861	5.075	the_feel_felt_found+ownership_language	discard	temp_0.85
18862	5.450	the_feel_felt_found+ownership_language	discard	crossover
18863	5.425	the_feel_felt_found+ownership_language	discard	tone_change
18864	5.200	the_feel_felt_found+ownership_language+warmth_injection	discard	add_warmth_injection
18865	5.013	the_feel_felt_found+ownership_language	discard	tone_change
18866	4.825	ownership_language	discard	remove_the_feel_felt_found
18867	5.025	the_feel_felt_found+ownership_language	discard	tone_change
18868	5.450	the_feel_felt_found	discard	remove_ownership_language
18869	4.825	ownership_language+casual_professionalism	discard	swap_the_feel_felt_found_for_casual_professionalism
18870	5.450	the_feel_felt_found+casual_professionalism	discard	swap_ownership_language_for_casual_professionalism
18871	5.237	the_feel_felt_found+ownership_language	discard	crossover
18872	5.350	the_feel_felt_found+ownership_language	discard	tone_change
18873	4.725	the_feel_felt_found+ownership_language	discard	tone_change
18874	5.025	ownership_language+concrete_next_steps	discard	swap_the_feel_felt_found_for_concrete_next_steps
18875	5.138	the_feel_felt_found+ownership_language	discard	tone_change
18876	5.550	the_feel_felt_found+ownership_language	discard	temp_0.95
18877	5.650	ownership_language+casual_professionalism	discard	swap_the_feel_felt_found_for_casual_professionalism
18878	5.325	the_feel_felt_found+ownership_language	discard	tone_change
18879	4.725	the_feel_felt_found+ownership_language	discard	crossover
18880	5.200	the_feel_felt_found+ownership_language	discard	temp_0.95
18881	5.338	the_feel_felt_found+ownership_language	discard	temp_0.85
18882	5.138	the_feel_felt_found	discard	crossover
18883	5.325	the_feel_felt_found+ownership_language+energy_matching	discard	add_energy_matching
18884	5.237	the_feel_felt_found+ownership_language+strategic_agreement	discard	add_strategic_agreement
18885	5.325	the_feel_felt_found	discard	remove_ownership_language
18886	4.888	the_feel_felt_found+concrete_next_steps	discard	swap_ownership_language_for_concrete_next_steps
18887	5.013	none	discard	crossover
18888	5.112	the_feel_felt_found+ownership_language	discard	temp_0.85
18889	5.237	the_feel_felt_found+ownership_language	discard	temp_0.85
18890	5.200	the_feel_felt_found	discard	remove_ownership_language
18891	5.550	the_feel_felt_found+ownership_language+validation_before_solution	discard	add_validation_before_solution
18892	4.700	the_feel_felt_found+ownership_language	discard	temp_0.85
18893	5.300	the_feel_felt_found+ownership_language	discard	crossover
18894	5.550	the_feel_felt_found+ownership_language	discard	tone_change
18895	5.450	the_feel_felt_found+ownership_language	discard	tone_change
18896	5.138	the_feel_felt_found+ownership_language	discard	temp_0.70
18897	5.525	the_feel_felt_found+ownership_language	discard	crossover
18898	4.825	the_feel_felt_found+ownership_language	discard	temp_0.90
18899	4.812	the_feel_felt_found+ownership_language+concrete_next_steps	discard	add_concrete_next_steps
18900	5.650	ownership_language	discard	crossover
18901	5.437	the_feel_felt_found+emotional_labeling	discard	swap_ownership_language_for_emotional_labeling
18902	5.425	the_feel_felt_found+emotional_labeling	discard	swap_ownership_language_for_emotional_labeling
18903	5.325	the_feel_felt_found+ownership_language	discard	temp_0.90
18904	5.338	the_feel_felt_found+ownership_language	discard	temp_0.90
18905	5.425	ownership_language	discard	remove_the_feel_felt_found
18906	5.025	ownership_language	discard	crossover
18907	5.350	the_feel_felt_found+casual_professionalism	discard	swap_ownership_language_for_casual_professionalism
18908	5.137	the_feel_felt_found+ownership_language	discard	tone_change
18909	5.138	none	discard	crossover
18910	5.112	the_feel_felt_found+proactive_extras	discard	swap_ownership_language_for_proactive_extras
18911	5.325	ownership_language	discard	crossover
18912	4.700	the_feel_felt_found	discard	remove_ownership_language
18913	4.825	the_feel_felt_found	discard	remove_ownership_language
18914	5.450	the_feel_felt_found	discard	remove_ownership_language
18915	5.237	the_feel_felt_found+ownership_language+personal_touch	discard	add_personal_touch
18916	4.700	the_feel_felt_found+ownership_language	discard	temp_0.65
18917	5.138	the_feel_felt_found	discard	remove_ownership_language
18918	5.237	the_feel_felt_found+ownership_language	discard	tone_change
18919	5.013	the_feel_felt_found+ownership_language	discard	tone_change
18920	5.025	ownership_language	discard	remove_the_feel_felt_found
18921	5.138	ownership_language+validation_before_solution	discard	swap_the_feel_felt_found_for_validation_before_solution
18922	5.325	the_feel_felt_found+strategic_agreement	discard	swap_ownership_language_for_strategic_agreement
18923	5.550	ownership_language+mirroring	discard	swap_the_feel_felt_found_for_mirroring
18924	5.325	the_feel_felt_found+ownership_language	discard	tone_change
18925	5.425	the_feel_felt_found+ownership_language+genuine_admission	discard	add_genuine_admission
18926	5.650	the_feel_felt_found+ownership_language	discard	tone_change
18927	5.200	the_feel_felt_found+ownership_language+personal_touch	discard	add_personal_touch
18928	5.425	the_feel_felt_found+casual_professionalism	discard	swap_ownership_language_for_casual_professionalism
18929	5.138	the_feel_felt_found+ownership_language	discard	tone_change
18930	5.350	the_feel_felt_found+personal_touch	discard	swap_ownership_language_for_personal_touch
18931	5.325	the_feel_felt_found+ownership_language	discard	tone_change
18932	5.525	ownership_language+strategic_agreement	discard	swap_the_feel_felt_found_for_strategic_agreement
18933	5.112	the_feel_felt_found+ownership_language+strategic_agreement	discard	add_strategic_agreement
18934	4.825	ownership_language+warmth_injection	discard	swap_the_feel_felt_found_for_warmth_injection
18935	5.450	ownership_language+personal_touch	discard	swap_the_feel_felt_found_for_personal_touch
18936	5.350	the_feel_felt_found+ownership_language	discard	temp_0.75
18937	5.450	the_feel_felt_found+ownership_language+personal_touch	discard	add_personal_touch
18938	5.137	the_feel_felt_found+never_say_calm_down	discard	swap_ownership_language_for_never_say_calm_down
18939	5.450	the_feel_felt_found+ownership_language	discard	temp_0.95
18940	5.075	the_feel_felt_found+ownership_language	discard	temp_0.90
18941	5.650	the_feel_felt_found+ownership_language+warmth_injection	discard	add_warmth_injection
18942	5.550	the_feel_felt_found	discard	remove_ownership_language
18943	5.325	the_feel_felt_found+ownership_language+genuine_admission	discard	add_genuine_admission
18944	5.138	the_feel_felt_found+ownership_language+proactive_extras	discard	add_proactive_extras
18945	4.513	the_feel_felt_found+ownership_language+warmth_injection	discard	add_warmth_injection
18946	5.450	the_feel_felt_found+ownership_language	discard	crossover
18947	5.550	the_feel_felt_found+ownership_language	discard	tone_change
18948	5.138	ownership_language+validation_before_solution	discard	swap_the_feel_felt_found_for_validation_before_solution
18949	4.925	the_feel_felt_found+ownership_language	discard	tone_change
18950	5.225	the_feel_felt_found+ownership_language	discard	tone_change
18951	5.425	the_feel_felt_found+ownership_language	discard	temp_0.65
18952	5.225	the_feel_felt_found+ownership_language+strategic_agreement	discard	add_strategic_agreement
18953	5.013	the_feel_felt_found+ownership_language+concrete_next_steps	discard	add_concrete_next_steps
18954	5.138	the_feel_felt_found+ownership_language	discard	tone_change
18955	4.987	ownership_language	discard	remove_the_feel_felt_found
18956	5.138	the_feel_felt_found+ownership_language+concrete_next_steps	discard	add_concrete_next_steps
18957	5.550	the_feel_felt_found+ownership_language+warmth_injection	discard	add_warmth_injection
18958	5.300	the_feel_felt_found	discard	crossover
18959	5.225	the_feel_felt_found+ownership_language	discard	tone_change
18960	5.750	the_feel_felt_found+ownership_language	discard	tone_change
18961	5.325	the_feel_felt_found+ownership_language	discard	tone_change
18962	5.425	the_feel_felt_found+ownership_language	discard	tone_change
18963	5.138	the_feel_felt_found+ownership_language+emotional_labeling	discard	add_emotional_labeling
18964	5.350	the_feel_felt_found+ownership_language	discard	tone_change
18965	5.112	the_feel_felt_found+ownership_language	discard	temp_0.85
18966	5.325	the_feel_felt_found+ownership_language+energy_matching	discard	add_energy_matching
18967	5.550	none	discard	crossover
18968	5.138	the_feel_felt_found+ownership_language	discard	tone_change
18969	5.138	the_feel_felt_found+ownership_language+energy_matching	discard	add_energy_matching
18970	5.325	the_feel_felt_found+ownership_language	discard	crossover
18971	5.237	the_feel_felt_found	discard	remove_ownership_language
18972	5.238	the_feel_felt_found+ownership_language+genuine_admission	discard	add_genuine_admission
18973	5.112	the_feel_felt_found+ownership_language+emotional_labeling	discard	add_emotional_labeling
18974	5.137	the_feel_felt_found+ownership_language+mirroring	discard	add_mirroring
18975	5.525	the_feel_felt_found+ownership_language+mirroring	discard	add_mirroring
18976	5.650	none	discard	crossover
18977	4.925	the_feel_felt_found+ownership_language+concrete_next_steps	discard	add_concrete_next_steps
18978	4.925	the_feel_felt_found+ownership_language	discard	temp_0.95
18979	5.350	the_feel_felt_found+ownership_language+mirroring	discard	add_mirroring
18980	5.450	the_feel_felt_found+energy_matching	discard	swap_ownership_language_for_energy_matching
18981	4.412	ownership_language	discard	remove_the_feel_felt_found
18982	4.900	the_feel_felt_found+warmth_injection	discard	swap_ownership_language_for_warmth_injection
18983	5.300	the_feel_felt_found+mirroring	discard	swap_ownership_language_for_mirroring
18984	5.013	the_feel_felt_found	discard	crossover
18985	4.987	ownership_language	discard	remove_the_feel_felt_found
18986	5.550	the_feel_felt_found+ownership_language	discard	crossover
18987	4.925	ownership_language	discard	crossover
18988	5.225	ownership_language	discard	remove_the_feel_felt_found
18989	5.237	the_feel_felt_found+ownership_language	discard	crossover
18990	5.450	ownership_language+mirroring	discard	swap_the_feel_felt_found_for_mirroring
18991	5.013	the_feel_felt_found+ownership_language	discard	tone_change
18992	5.750	the_feel_felt_found+ownership_language	discard	tone_change
18993	5.138	ownership_language+casual_professionalism	discard	swap_the_feel_felt_found_for_casual_professionalism
18994	5.300	none	discard	crossover
18995	5.425	ownership_language+energy_matching	discard	swap_the_feel_felt_found_for_energy_matching
18996	5.200	ownership_language	discard	crossover
18997	5.300	the_feel_felt_found+ownership_language	discard	tone_change
18998	5.450	the_feel_felt_found+ownership_language+proactive_extras	discard	add_proactive_extras
18999	5.138	the_feel_felt_found+ownership_language	discard	crossover
19000	5.113	the_feel_felt_found+ownership_language	discard	crossover
19001	5.450	the_feel_felt_found+ownership_language	discard	tone_change
19002	5.650	the_feel_felt_found+ownership_language	discard	temp_0.85
19003	5.525	the_feel_felt_found	discard	remove_ownership_language
19004	4.713	ownership_language	discard	crossover
19005	5.138	the_feel_felt_found+ownership_language	discard	tone_change
19006	4.700	the_feel_felt_found+ownership_language	discard	temp_0.75
19007	5.237	the_feel_felt_found+ownership_language	discard	crossover
19008	5.525	the_feel_felt_found+ownership_language	discard	crossover
19009	5.437	ownership_language	discard	crossover
19010	5.450	the_feel_felt_found	discard	remove_ownership_language
19011	5.013	the_feel_felt_found+ownership_language	discard	temp_0.90
19012	5.325	the_feel_felt_found+ownership_language+never_say_calm_down	discard	add_never_say_calm_down
19013	5.112	the_feel_felt_found+ownership_language+mirroring	discard	add_mirroring
19014	5.325	ownership_language+validation_before_solution	discard	swap_the_feel_felt_found_for_validation_before_solution
19015	5.550	the_feel_felt_found+ownership_language+concrete_next_steps	discard	add_concrete_next_steps
19016	4.925	the_feel_felt_found+ownership_language	discard	crossover
19017	5.013	the_feel_felt_found+ownership_language	discard	crossover
19018	5.425	the_feel_felt_found+ownership_language	discard	tone_change
19019	5.450	the_feel_felt_found+ownership_language	discard	tone_change
19020	5.000	the_feel_felt_found+ownership_language+mirroring	discard	add_mirroring
19021	5.325	the_feel_felt_found+ownership_language	discard	tone_change
19022	4.825	the_feel_felt_found+ownership_language+casual_professionalism	discard	add_casual_professionalism
19023	5.138	the_feel_felt_found+ownership_language+genuine_admission	discard	add_genuine_admission
19024	4.925	the_feel_felt_found+ownership_language+strategic_agreement	discard	add_strategic_agreement
19025	5.125	the_feel_felt_found+ownership_language	discard	temp_0.70
19026	5.138	the_feel_felt_found+ownership_language	discard	temp_0.95
19027	4.612	the_feel_felt_found+ownership_language+concrete_next_steps	discard	add_concrete_next_steps
19028	4.825	the_feel_felt_found+ownership_language+energy_matching	discard	add_energy_matching
19029	5.237	the_feel_felt_found+energy_matching	discard	swap_ownership_language_for_energy_matching
19030	4.925	the_feel_felt_found+ownership_language	discard	tone_change
19031	5.550	the_feel_felt_found+ownership_language	discard	tone_change
19032	4.825	the_feel_felt_found+strategic_agreement	discard	swap_ownership_language_for_strategic_agreement
19033	5.325	ownership_language	discard	remove_the_feel_felt_found
19034	5.350	ownership_language+never_say_calm_down	discard	swap_the_feel_felt_found_for_never_say_calm_down
19035	5.037	the_feel_felt_found+ownership_language	discard	temp_0.85
19036	5.338	ownership_language+personal_touch	discard	swap_the_feel_felt_found_for_personal_touch
19037	5.025	the_feel_felt_found+ownership_language	discard	temp_0.90
19038	5.138	the_feel_felt_found+energy_matching	discard	swap_ownership_language_for_energy_matching
19039	5.138	the_feel_felt_found+ownership_language+never_say_calm_down	discard	add_never_say_calm_down
19040	5.013	the_feel_felt_found+ownership_language	discard	crossover
19041	5.138	the_feel_felt_found+ownership_language+genuine_admission	discard	add_genuine_admission
19042	5.325	ownership_language	discard	crossover
19043	5.237	the_feel_felt_found+ownership_language	discard	temp_0.65
