generation	eq_score	techniques	status	description
11091	5.138	the_feel_felt_found+ownership_language+strategic_agreement	discard	add_strategic_agreement
11092	5.325	the_feel_felt_found+ownership_language+warmth_injection	discard	add_warmth_injection
11093	4.925	the_feel_felt_found+ownership_language	discard	tone_change
11094	5.550	the_feel_felt_found+ownership_language	discard	crossover
11095	4.925	the_feel_felt_found+ownership_language	discard	tone_change
11096	5.450	the_feel_felt_found+ownership_language	discard	crossover
11097	4.888	the_feel_felt_found+ownership_language	discard	crossover
11098	4.888	the_feel_felt_found+ownership_language	discard	tone_change
11099	4.825	the_feel_felt_found+ownership_language	discard	crossover
11100	5.325	the_feel_felt_found+never_say_calm_down	discard	swap_ownership_language_for_never_say_calm_down
11101	5.213	ownership_language+casual_professionalism	discard	swap_the_feel_felt_found_for_casual_professionalism
11102	4.825	the_feel_felt_found	discard	remove_ownership_language
11103	5.325	the_feel_felt_found+ownership_language+never_say_calm_down	discard	add_never_say_calm_down
11104	5.237	the_feel_felt_found+ownership_language	discard	temp_0.65
11105	5.350	the_feel_felt_found+ownership_language	discard	crossover
11106	5.025	the_feel_felt_found+ownership_language	discard	tone_change
11107	5.450	ownership_language	discard	remove_the_feel_felt_found
11108	4.825	the_feel_felt_found+ownership_language	discard	crossover
11109	5.238	the_feel_felt_found+ownership_language	discard	tone_change
11110	5.450	the_feel_felt_found+ownership_language	discard	tone_change
11111	5.325	the_feel_felt_found+ownership_language	discard	tone_change
11112	5.350	the_feel_felt_found+warmth_injection	discard	swap_ownership_language_for_warmth_injection
11113	5.450	the_feel_felt_found	discard	crossover
11114	5.237	the_feel_felt_found+ownership_language+concrete_next_steps	discard	add_concrete_next_steps
11115	5.450	the_feel_felt_found+ownership_language	discard	crossover
11116	5.550	the_feel_felt_found+ownership_language+strategic_agreement	discard	add_strategic_agreement
11117	5.350	the_feel_felt_found+ownership_language	discard	temp_0.70
11118	5.013	the_feel_felt_found+ownership_language	discard	tone_change
11119	5.550	the_feel_felt_found+ownership_language	discard	temp_0.90
11120	5.025	the_feel_felt_found+ownership_language	discard	tone_change
11121	5.450	the_feel_felt_found+ownership_language	discard	tone_change
11122	5.550	the_feel_felt_found+ownership_language	discard	temp_0.75
11123	4.825	the_feel_felt_found+ownership_language+concrete_next_steps	discard	add_concrete_next_steps
11124	5.338	the_feel_felt_found+ownership_language	discard	temp_0.85
11125	4.700	the_feel_felt_found+ownership_language+proactive_extras	discard	add_proactive_extras
11126	5.237	the_feel_felt_found+ownership_language	discard	temp_0.95
11127	5.525	the_feel_felt_found+ownership_language	discard	tone_change
11128	5.112	the_feel_felt_found+ownership_language	discard	tone_change
11129	5.013	the_feel_felt_found+personal_touch	discard	swap_ownership_language_for_personal_touch
11130	4.700	the_feel_felt_found	discard	remove_ownership_language
11131	5.113	the_feel_felt_found+ownership_language	discard	tone_change
11132	4.825	the_feel_felt_found+validation_before_solution	discard	swap_ownership_language_for_validation_before_solution
11133	4.825	ownership_language+concrete_next_steps	discard	swap_the_feel_felt_found_for_concrete_next_steps
11134	5.200	the_feel_felt_found+ownership_language	discard	temp_0.85
11135	5.325	the_feel_felt_found+ownership_language	discard	temp_0.90
11136	5.325	the_feel_felt_found+ownership_language	discard	temp_0.85
11137	5.350	the_feel_felt_found+ownership_language	discard	temp_0.70
11138	5.013	ownership_language+strategic_agreement	discard	swap_the_feel_felt_found_for_strategic_agreement
11139	5.425	ownership_language	discard	remove_the_feel_felt_found
11140	5.450	the_feel_felt_found+ownership_language+energy_matching	discard	add_energy_matching
11141	5.013	the_feel_felt_found+ownership_language+mirroring	discard	add_mirroring
11142	5.325	the_feel_felt_found+ownership_language	discard	tone_change
11143	4.912	the_feel_felt_found+ownership_language	discard	tone_change
11144	5.338	the_feel_felt_found+ownership_language+emotional_labeling	discard	add_emotional_labeling
11145	5.450	the_feel_felt_found+ownership_language	discard	temp_0.70
11146	5.325	the_feel_felt_found+ownership_language+energy_matching	discard	add_energy_matching
11147	5.038	the_feel_felt_found+ownership_language+genuine_admission	discard	add_genuine_admission
11148	5.237	ownership_language	discard	crossover
11149	5.338	ownership_language	discard	crossover
11150	5.450	the_feel_felt_found+ownership_language	discard	tone_change
11151	5.450	the_feel_felt_found	discard	crossover
11152	5.112	the_feel_felt_found	discard	remove_ownership_language
11153	5.200	the_feel_felt_found+ownership_language+casual_professionalism	discard	add_casual_professionalism
11154	4.800	the_feel_felt_found+ownership_language	discard	temp_0.70
11155	4.700	the_feel_felt_found+ownership_language	discard	tone_change
11156	5.550	the_feel_felt_found+ownership_language	discard	tone_change
11157	5.325	the_feel_felt_found+ownership_language+strategic_agreement	discard	add_strategic_agreement
11158	5.013	the_feel_felt_found+ownership_language	discard	tone_change
11159	4.925	the_feel_felt_found+ownership_language+never_say_calm_down	discard	add_never_say_calm_down
11160	5.013	the_feel_felt_found+personal_touch	discard	swap_ownership_language_for_personal_touch
11161	5.037	the_feel_felt_found+ownership_language	discard	crossover
11162	5.300	the_feel_felt_found+ownership_language	discard	temp_0.95
11163	5.525	the_feel_felt_found+ownership_language+never_say_calm_down	discard	add_never_say_calm_down
11164	5.325	the_feel_felt_found+ownership_language+emotional_labeling	discard	add_emotional_labeling
11165	5.238	the_feel_felt_found+warmth_injection	discard	swap_ownership_language_for_warmth_injection
11166	5.325	the_feel_felt_found+mirroring	discard	swap_ownership_language_for_mirroring
11167	5.350	ownership_language+energy_matching	discard	swap_the_feel_felt_found_for_energy_matching
11168	5.550	ownership_language+warmth_injection	discard	swap_the_feel_felt_found_for_warmth_injection
11169	4.825	the_feel_felt_found+ownership_language	discard	tone_change
11170	5.525	the_feel_felt_found+ownership_language	discard	temp_0.70
11171	5.025	the_feel_felt_found+emotional_labeling	discard	swap_ownership_language_for_emotional_labeling
11172	5.237	the_feel_felt_found+ownership_language	discard	tone_change
11173	5.650	the_feel_felt_found+ownership_language	discard	tone_change
11174	4.825	the_feel_felt_found+ownership_language+validation_before_solution	discard	add_validation_before_solution
11175	5.350	the_feel_felt_found+ownership_language	discard	tone_change
11176	5.237	the_feel_felt_found+ownership_language	discard	crossover
11177	5.438	the_feel_felt_found+ownership_language	discard	tone_change
11178	5.238	the_feel_felt_found+ownership_language+genuine_admission	discard	add_genuine_admission
11179	4.825	ownership_language+proactive_extras	discard	swap_the_feel_felt_found_for_proactive_extras
11180	5.550	the_feel_felt_found+ownership_language	discard	tone_change
11181	5.112	none	discard	crossover
11182	5.550	the_feel_felt_found+ownership_language	discard	tone_change
11183	5.138	the_feel_felt_found+ownership_language	discard	tone_change
11184	5.350	the_feel_felt_found+ownership_language	discard	temp_0.75
11185	5.338	ownership_language+never_say_calm_down	discard	swap_the_feel_felt_found_for_never_say_calm_down
11186	5.325	ownership_language	discard	crossover
11187	4.763	the_feel_felt_found	discard	remove_ownership_language
11188	5.237	ownership_language+personal_touch	discard	swap_the_feel_felt_found_for_personal_touch
11189	5.237	the_feel_felt_found+validation_before_solution	discard	swap_ownership_language_for_validation_before_solution
11190	5.237	the_feel_felt_found+ownership_language	discard	tone_change
11191	5.425	the_feel_felt_found+emotional_labeling	discard	swap_ownership_language_for_emotional_labeling
11192	5.238	the_feel_felt_found+ownership_language+concrete_next_steps	discard	add_concrete_next_steps
11193	4.825	the_feel_felt_found+ownership_language	discard	tone_change
11194	4.613	the_feel_felt_found+ownership_language	discard	crossover
11195	5.138	the_feel_felt_found+ownership_language+warmth_injection	discard	add_warmth_injection
11196	4.925	the_feel_felt_found+ownership_language+emotional_labeling	discard	add_emotional_labeling
11197	5.425	the_feel_felt_found+ownership_language	discard	crossover
11198	5.450	the_feel_felt_found+ownership_language	discard	tone_change
11199	5.550	the_feel_felt_found+ownership_language	discard	temp_0.85
11200	5.550	ownership_language+validation_before_solution	discard	swap_the_feel_felt_found_for_validation_before_solution
11201	5.200	the_feel_felt_found+ownership_language	discard	crossover
11202	5.425	ownership_language+energy_matching	discard	swap_the_feel_felt_found_for_energy_matching
11203	5.450	the_feel_felt_found+ownership_language	discard	tone_change
11204	4.612	the_feel_felt_found+ownership_language	discard	crossover
11205	5.025	ownership_language	discard	remove_the_feel_felt_found
11206	5.550	ownership_language+concrete_next_steps	discard	swap_the_feel_felt_found_for_concrete_next_steps
11207	5.450	the_feel_felt_found+ownership_language	discard	tone_change
11208	4.700	the_feel_felt_found+ownership_language+concrete_next_steps	discard	add_concrete_next_steps
11209	4.925	the_feel_felt_found+ownership_language	discard	tone_change
11210	5.450	ownership_language+strategic_agreement	discard	swap_the_feel_felt_found_for_strategic_agreement
11211	5.450	the_feel_felt_found	discard	crossover
11212	5.425	ownership_language+concrete_next_steps	discard	swap_the_feel_felt_found_for_concrete_next_steps
11213	5.213	the_feel_felt_found+mirroring	discard	swap_ownership_language_for_mirroring
11214	5.550	the_feel_felt_found+ownership_language	discard	crossover
11215	5.350	ownership_language	discard	crossover
11216	5.138	the_feel_felt_found+mirroring	discard	swap_ownership_language_for_mirroring
11217	5.550	the_feel_felt_found	discard	crossover
11218	4.925	the_feel_felt_found	discard	crossover
11219	5.013	the_feel_felt_found+ownership_language	discard	temp_0.75
11220	5.325	ownership_language	discard	remove_the_feel_felt_found
11221	5.450	the_feel_felt_found+ownership_language	discard	tone_change
11222	4.700	the_feel_felt_found+ownership_language+genuine_admission	discard	add_genuine_admission
11223	4.700	the_feel_felt_found+ownership_language	discard	temp_0.65
11224	5.325	ownership_language+warmth_injection	discard	swap_the_feel_felt_found_for_warmth_injection
11225	5.425	ownership_language	discard	crossover
11226	5.450	the_feel_felt_found	discard	crossover
11227	5.650	the_feel_felt_found+ownership_language+personal_touch	discard	add_personal_touch
11228	4.612	the_feel_felt_found+ownership_language	discard	tone_change
11229	4.612	the_feel_felt_found+never_say_calm_down	discard	swap_ownership_language_for_never_say_calm_down
11230	5.425	the_feel_felt_found+ownership_language	discard	temp_0.75
11231	5.550	the_feel_felt_found+ownership_language	discard	crossover
11232	5.350	the_feel_felt_found+ownership_language	discard	temp_0.65
11233	5.550	the_feel_felt_found+ownership_language	discard	temp_0.65
11234	5.338	ownership_language	discard	remove_the_feel_felt_found
11235	5.013	ownership_language	discard	crossover
11236	5.338	the_feel_felt_found+warmth_injection	discard	swap_ownership_language_for_warmth_injection
11237	5.138	the_feel_felt_found+ownership_language	discard	tone_change
11238	5.450	the_feel_felt_found+ownership_language	discard	tone_change
11239	5.138	the_feel_felt_found+casual_professionalism	discard	swap_ownership_language_for_casual_professionalism
11240	5.350	the_feel_felt_found+ownership_language	discard	crossover
11241	5.450	the_feel_felt_found+ownership_language	discard	tone_change
11242	5.425	the_feel_felt_found+ownership_language+validation_before_solution	discard	add_validation_before_solution
11243	5.200	the_feel_felt_found+ownership_language+mirroring	discard	add_mirroring
11244	5.138	the_feel_felt_found+ownership_language	discard	tone_change
11245	5.237	the_feel_felt_found+ownership_language	discard	tone_change
11246	5.250	the_feel_felt_found+ownership_language	discard	tone_change
11247	5.200	none	discard	crossover
11248	5.525	the_feel_felt_found+ownership_language	discard	crossover
11249	5.237	the_feel_felt_found+ownership_language	discard	crossover
11250	5.138	ownership_language+personal_touch	discard	swap_the_feel_felt_found_for_personal_touch
11251	5.138	the_feel_felt_found+ownership_language	discard	temp_0.70
11252	5.237	the_feel_felt_found+ownership_language+warmth_injection	discard	add_warmth_injection
11253	5.325	ownership_language+emotional_labeling	discard	swap_the_feel_felt_found_for_emotional_labeling
11254	5.325	the_feel_felt_found+ownership_language+concrete_next_steps	discard	add_concrete_next_steps
11255	5.425	ownership_language	discard	crossover
11256	5.325	the_feel_felt_found	discard	remove_ownership_language
11257	5.350	the_feel_felt_found+ownership_language+casual_professionalism	discard	add_casual_professionalism
11258	5.650	the_feel_felt_found	discard	crossover
11259	5.338	the_feel_felt_found+ownership_language	discard	tone_change
11260	5.550	the_feel_felt_found+ownership_language	discard	tone_change
11261	5.200	the_feel_felt_found+ownership_language	discard	crossover
11262	5.037	ownership_language+concrete_next_steps	discard	swap_the_feel_felt_found_for_concrete_next_steps
11263	5.450	the_feel_felt_found+ownership_language	discard	tone_change
11264	5.200	the_feel_felt_found+ownership_language	discard	temp_0.70
11265	5.450	the_feel_felt_found+ownership_language+energy_matching	discard	add_energy_matching
11266	5.550	the_feel_felt_found+ownership_language	discard	crossover
11267	4.938	the_feel_felt_found+ownership_language	discard	tone_change
11268	5.550	the_feel_felt_found+ownership_language+personal_touch	discard	add_personal_touch
11269	5.213	the_feel_felt_found+personal_touch	discard	swap_ownership_language_for_personal_touch
11270	5.138	the_feel_felt_found+ownership_language+emotional_labeling	discard	add_emotional_labeling
11271	5.112	ownership_language+casual_professionalism	discard	swap_the_feel_felt_found_for_casual_professionalism
11272	5.425	the_feel_felt_found+ownership_language	discard	temp_0.95
11273	5.138	the_feel_felt_found+never_say_calm_down	discard	swap_ownership_language_for_never_say_calm_down
11274	5.425	the_feel_felt_found	discard	remove_ownership_language
11275	5.325	the_feel_felt_found+ownership_language+concrete_next_steps	discard	add_concrete_next_steps
11276	5.237	the_feel_felt_found+ownership_language+warmth_injection	discard	add_warmth_injection
11277	5.112	the_feel_felt_found	discard	crossover
11278	5.550	the_feel_felt_found+never_say_calm_down	discard	swap_ownership_language_for_never_say_calm_down
11279	5.138	the_feel_felt_found+ownership_language	discard	temp_0.95
11280	4.812	the_feel_felt_found+ownership_language	discard	tone_change
11281	5.238	ownership_language+never_say_calm_down	discard	swap_the_feel_felt_found_for_never_say_calm_down
11282	5.650	the_feel_felt_found+ownership_language	discard	tone_change
11283	5.112	the_feel_felt_found+ownership_language+proactive_extras	discard	add_proactive_extras
11284	4.487	the_feel_felt_found+ownership_language+warmth_injection	discard	add_warmth_injection
11285	5.550	the_feel_felt_found+ownership_language	discard	crossover
11286	5.650	the_feel_felt_found+ownership_language	discard	temp_0.75
11287	5.200	the_feel_felt_found+ownership_language	discard	tone_change
11288	5.650	the_feel_felt_found+ownership_language+genuine_admission	discard	add_genuine_admission
11289	5.138	ownership_language+emotional_labeling	discard	swap_the_feel_felt_found_for_emotional_labeling
11290	5.325	the_feel_felt_found+ownership_language+genuine_admission	discard	add_genuine_admission
11291	5.237	the_feel_felt_found	discard	remove_ownership_language
11292	5.450	the_feel_felt_found+strategic_agreement	discard	swap_ownership_language_for_strategic_agreement
11293	5.438	the_feel_felt_found+ownership_language	discard	tone_change
11294	5.013	the_feel_felt_found+ownership_language	discard	temp_0.65
11295	4.925	the_feel_felt_found+ownership_language	discard	temp_0.95
11296	5.200	the_feel_felt_found+ownership_language	discard	crossover
11297	5.138	the_feel_felt_found	discard	crossover
11298	5.325	the_feel_felt_found+ownership_language+personal_touch	discard	add_personal_touch
11299	5.237	the_feel_felt_found+concrete_next_steps	discard	swap_ownership_language_for_concrete_next_steps
11300	5.400	ownership_language	discard	remove_the_feel_felt_found
11301	5.138	the_feel_felt_found+ownership_language+strategic_agreement	discard	add_strategic_agreement
11302	4.888	the_feel_felt_found	discard	remove_ownership_language
11303	5.112	the_feel_felt_found+ownership_language+never_say_calm_down	discard	add_never_say_calm_down
11304	5.225	the_feel_felt_found+ownership_language+concrete_next_steps	discard	add_concrete_next_steps
11305	5.425	the_feel_felt_found	discard	crossover
11306	5.338	the_feel_felt_found+ownership_language	discard	temp_0.75
11307	5.138	ownership_language+genuine_admission	discard	swap_the_feel_felt_found_for_genuine_admission
11308	5.325	the_feel_felt_found	discard	crossover
11309	5.138	ownership_language+proactive_extras	discard	swap_the_feel_felt_found_for_proactive_extras
11310	5.112	ownership_language	discard	remove_the_feel_felt_found
11311	4.925	ownership_language	discard	remove_the_feel_felt_found
11312	5.238	the_feel_felt_found+ownership_language	discard	tone_change
11313	5.200	the_feel_felt_found+ownership_language+proactive_extras	discard	add_proactive_extras
11314	5.550	ownership_language	discard	remove_the_feel_felt_found
11315	5.425	ownership_language+casual_professionalism	discard	swap_the_feel_felt_found_for_casual_professionalism
11316	5.013	none	discard	crossover
11317	5.450	the_feel_felt_found+proactive_extras	discard	swap_ownership_language_for_proactive_extras
11318	5.325	ownership_language+strategic_agreement	discard	swap_the_feel_felt_found_for_strategic_agreement
11319	5.450	the_feel_felt_found+ownership_language	discard	temp_0.85
11320	5.237	the_feel_felt_found+ownership_language	discard	crossover
11321	5.025	the_feel_felt_found+proactive_extras	discard	swap_ownership_language_for_proactive_extras
11322	5.238	the_feel_felt_found+ownership_language	discard	crossover
11323	5.200	the_feel_felt_found+ownership_language+genuine_admission	discard	add_genuine_admission
11324	5.450	the_feel_felt_found	discard	remove_ownership_language
11325	5.425	the_feel_felt_found+ownership_language	discard	temp_0.90
11326	5.425	the_feel_felt_found	discard	crossover
11327	5.013	the_feel_felt_found+ownership_language+validation_before_solution	discard	add_validation_before_solution
11328	5.550	the_feel_felt_found+ownership_language+warmth_injection	discard	add_warmth_injection
11329	5.650	the_feel_felt_found+ownership_language	discard	tone_change
11330	5.650	the_feel_felt_found+ownership_language	discard	tone_change
11331	5.325	the_feel_felt_found	discard	crossover
11332	5.237	the_feel_felt_found+ownership_language+warmth_injection	discard	add_warmth_injection
11333	5.225	the_feel_felt_found+ownership_language	discard	tone_change
11334	5.550	the_feel_felt_found+genuine_admission	discard	swap_ownership_language_for_genuine_admission
11335	5.238	ownership_language+strategic_agreement	discard	swap_the_feel_felt_found_for_strategic_agreement
11336	4.612	the_feel_felt_found+ownership_language+mirroring	discard	add_mirroring
11337	4.825	ownership_language	discard	crossover
11338	4.713	the_feel_felt_found+ownership_language+concrete_next_steps	discard	add_concrete_next_steps
11339	5.450	the_feel_felt_found+ownership_language+personal_touch	discard	add_personal_touch
11340	5.550	the_feel_felt_found+ownership_language	discard	crossover
11341	5.550	the_feel_felt_found	discard	remove_ownership_language
11342	5.325	the_feel_felt_found	discard	remove_ownership_language
11343	5.213	ownership_language+emotional_labeling	discard	swap_the_feel_felt_found_for_emotional_labeling
11344	5.112	the_feel_felt_found+ownership_language	discard	tone_change
11345	5.650	the_feel_felt_found+ownership_language	discard	temp_0.75
11346	5.550	the_feel_felt_found+ownership_language+genuine_admission	discard	add_genuine_admission
11347	5.425	ownership_language+casual_professionalism	discard	swap_the_feel_felt_found_for_casual_professionalism
11348	5.325	the_feel_felt_found+ownership_language+energy_matching	discard	add_energy_matching
11349	5.237	the_feel_felt_found+ownership_language+emotional_labeling	discard	add_emotional_labeling
11350	5.425	the_feel_felt_found+ownership_language+warmth_injection	discard	add_warmth_injection
11351	5.237	the_feel_felt_found+ownership_language	discard	tone_change
11352	5.113	ownership_language	discard	remove_the_feel_felt_found
11353	5.325	ownership_language	discard	remove_the_feel_felt_found
11354	4.825	the_feel_felt_found+ownership_language	discard	tone_change
11355	5.325	the_feel_felt_found+ownership_language	discard	temp_0.75
11356	5.550	ownership_language	discard	crossover
11357	5.550	the_feel_felt_found	discard	crossover
11358	4.925	ownership_language+casual_professionalism	discard	swap_the_feel_felt_found_for_casual_professionalism
11359	5.238	the_feel_felt_found	discard	remove_ownership_language
11360	5.550	the_feel_felt_found+ownership_language	discard	tone_change
11361	4.925	the_feel_felt_found+ownership_language	discard	tone_change
11362	5.013	the_feel_felt_found+ownership_language+proactive_extras	discard	add_proactive_extras
11363	5.525	the_feel_felt_found+ownership_language	discard	crossover
