generation	eq_score	techniques	status	description
19044	5.550	the_feel_felt_found+ownership_language	discard	tone_change
19045	5.013	the_feel_felt_found+strategic_agreement	discard	swap_ownership_language_for_strategic_agreement
19046	4.925	the_feel_felt_found+ownership_language	discard	crossover
19047	4.825	the_feel_felt_found+ownership_language+concrete_next_steps	discard	add_concrete_next_steps
19048	5.237	the_feel_felt_found+ownership_language	discard	tone_change
19049	4.825	the_feel_felt_found+ownership_language	discard	crossover
19050	5.138	the_feel_felt_found	discard	crossover
19051	5.550	the_feel_felt_found+ownership_language	discard	temp_0.65
19052	5.325	the_feel_felt_found	discard	remove_ownership_language
19053	5.225	ownership_language+never_say_calm_down	discard	swap_the_feel_felt_found_for_never_say_calm_down
19054	4.700	the_feel_felt_found	discard	remove_ownership_language
19055	5.450	the_feel_felt_found+ownership_language+casual_professionalism	discard	add_casual_professionalism
19056	5.325	the_feel_felt_found+ownership_language+energy_matching	discard	add_energy_matching
19057	5.450	ownership_language	discard	remove_the_feel_felt_found
19058	4.675	ownership_language	discard	crossover
19059	5.550	the_feel_felt_found+ownership_language	discard	tone_change
19060	5.550	the_feel_felt_found+ownership_language	discard	crossover
19061	5.550	the_feel_felt_found+ownership_language	discard	temp_0.75
19062	5.550	the_feel_felt_found	discard	remove_ownership_language
19063	5.550	the_feel_felt_found+ownership_language	discard	temp_0.70
19064	5.450	the_feel_felt_found+ownership_language	discard	crossover
19065	5.200	the_feel_felt_found+ownership_language+mirroring	discard	add_mirroring
19066	5.013	the_feel_felt_found+ownership_language+strategic_agreement	discard	add_strategic_agreement
19067	5.450	the_feel_felt_found+ownership_language+casual_professionalism	discard	add_casual_professionalism
19068	5.200	the_feel_felt_found+ownership_language	discard	tone_change
19069	5.325	none	discard	crossover
19070	5.137	the_feel_felt_found+ownership_language+never_say_calm_down	discard	add_never_say_calm_down
19071	5.325	the_feel_felt_found+strategic_agreement	discard	swap_ownership_language_for_strategic_agreement
19072	5.213	the_feel_felt_found+ownership_language	discard	crossover
19073	5.112	none	discard	crossover
19074	4.825	the_feel_felt_found+ownership_language	discard	tone_change
19075	5.425	the_feel_felt_found+ownership_language	discard	tone_change
19076	4.825	the_feel_felt_found+ownership_language+genuine_admission	discard	add_genuine_admission
19077	5.338	the_feel_felt_found+ownership_language+genuine_admission	discard	add_genuine_admission
19078	4.825	the_feel_felt_found+ownership_language	discard	tone_change
19079	5.425	ownership_language+warmth_injection	discard	swap_the_feel_felt_found_for_warmth_injection
19080	5.350	the_feel_felt_found	discard	crossover
19081	5.438	none	discard	crossover
19082	5.113	the_feel_felt_found+ownership_language	discard	crossover
19083	5.450	the_feel_felt_found+ownership_language+proactive_extras	discard	add_proactive_extras
19084	5.550	the_feel_felt_found+ownership_language	discard	temp_0.85
19085	5.013	the_feel_felt_found+ownership_language	discard	temp_0.90
19086	5.038	the_feel_felt_found+ownership_language+never_say_calm_down	discard	add_never_say_calm_down
19087	5.425	the_feel_felt_found+ownership_language+personal_touch	discard	add_personal_touch
19088	5.013	the_feel_felt_found+ownership_language+casual_professionalism	discard	add_casual_professionalism
19089	5.225	the_feel_felt_found+ownership_language	discard	crossover
19090	5.425	the_feel_felt_found+ownership_language	discard	temp_0.95
19091	5.425	ownership_language	discard	crossover
19092	5.238	the_feel_felt_found	discard	remove_ownership_language
19093	5.225	the_feel_felt_found+ownership_language	discard	tone_change
19094	5.650	the_feel_felt_found+ownership_language+mirroring	discard	add_mirroring
19095	5.525	the_feel_felt_found+ownership_language+emotional_labeling	discard	add_emotional_labeling
19096	5.138	the_feel_felt_found+ownership_language	discard	crossover
19097	5.238	the_feel_felt_found+ownership_language+concrete_next_steps	discard	add_concrete_next_steps
19098	5.138	the_feel_felt_found+ownership_language+strategic_agreement	discard	add_strategic_agreement
19099	5.325	the_feel_felt_found+ownership_language+never_say_calm_down	discard	add_never_say_calm_down
19100	5.550	the_feel_felt_found+ownership_language+mirroring	discard	add_mirroring
19101	5.525	the_feel_felt_found+ownership_language	discard	temp_0.75
19102	5.325	the_feel_felt_found+ownership_language	discard	temp_0.75
19103	5.238	the_feel_felt_found+ownership_language	discard	tone_change
19104	4.800	the_feel_felt_found+ownership_language	discard	tone_change
19105	5.025	ownership_language	discard	remove_the_feel_felt_found
19106	5.325	the_feel_felt_found+ownership_language	discard	tone_change
19107	5.450	the_feel_felt_found+ownership_language	discard	crossover
19108	5.425	the_feel_felt_found+ownership_language	discard	tone_change
19109	5.338	the_feel_felt_found+ownership_language	discard	tone_change
19110	5.237	the_feel_felt_found+ownership_language	discard	temp_0.85
19111	5.550	the_feel_felt_found+ownership_language	discard	tone_change
19112	4.888	the_feel_felt_found+ownership_language	discard	temp_0.90
19113	5.750	the_feel_felt_found+ownership_language	discard	crossover
19114	5.325	the_feel_felt_found+ownership_language+mirroring	discard	add_mirroring
19115	5.237	the_feel_felt_found+ownership_language	discard	temp_0.85
19116	5.425	the_feel_felt_found+ownership_language	discard	tone_change
19117	5.450	the_feel_felt_found	discard	crossover
19118	5.112	ownership_language+proactive_extras	discard	swap_the_feel_felt_found_for_proactive_extras
19119	4.825	the_feel_felt_found+ownership_language	discard	crossover
19120	5.425	the_feel_felt_found+ownership_language+casual_professionalism	discard	add_casual_professionalism
19121	5.450	ownership_language+strategic_agreement	discard	swap_the_feel_felt_found_for_strategic_agreement
19122	4.825	the_feel_felt_found+ownership_language	discard	tone_change
19123	5.138	the_feel_felt_found+ownership_language+warmth_injection	discard	add_warmth_injection
19124	5.138	the_feel_felt_found+ownership_language	discard	crossover
19125	5.138	the_feel_felt_found+ownership_language+validation_before_solution	discard	add_validation_before_solution
19126	5.550	the_feel_felt_found	discard	remove_ownership_language
19127	4.575	the_feel_felt_found+ownership_language+proactive_extras	discard	add_proactive_extras
19128	5.225	ownership_language	discard	crossover
19129	5.450	the_feel_felt_found	discard	remove_ownership_language
19130	5.550	the_feel_felt_found+ownership_language	discard	crossover
19131	5.138	ownership_language+concrete_next_steps	discard	swap_the_feel_felt_found_for_concrete_next_steps
19132	5.238	the_feel_felt_found+ownership_language	discard	tone_change
19133	5.550	the_feel_felt_found+ownership_language+energy_matching	discard	add_energy_matching
19134	5.013	ownership_language	discard	remove_the_feel_felt_found
19135	5.550	the_feel_felt_found+ownership_language	discard	tone_change
19136	5.450	the_feel_felt_found+ownership_language	discard	crossover
19137	5.238	the_feel_felt_found+ownership_language	discard	tone_change
19138	5.425	the_feel_felt_found+ownership_language+personal_touch	discard	add_personal_touch
19139	5.037	ownership_language	discard	crossover
19140	5.037	the_feel_felt_found+ownership_language+concrete_next_steps	discard	add_concrete_next_steps
19141	5.237	the_feel_felt_found+ownership_language+warmth_injection	discard	add_warmth_injection
19142	5.013	the_feel_felt_found+ownership_language+strategic_agreement	discard	add_strategic_agreement
19143	5.113	the_feel_felt_found+ownership_language	discard	tone_change
19144	5.325	ownership_language+emotional_labeling	discard	swap_the_feel_felt_found_for_emotional_labeling
19145	5.225	the_feel_felt_found+ownership_language	discard	tone_change
19146	5.325	ownership_language	discard	crossover
19147	4.800	ownership_language	discard	remove_the_feel_felt_found
19148	5.425	the_feel_felt_found+ownership_language	discard	crossover
19149	5.750	the_feel_felt_found+ownership_language+warmth_injection	discard	add_warmth_injection
19150	5.138	the_feel_felt_found+ownership_language	discard	crossover
19151	5.450	the_feel_felt_found+ownership_language	discard	temp_0.95
19152	5.113	the_feel_felt_found+ownership_language	discard	tone_change
19153	5.200	the_feel_felt_found+ownership_language+warmth_injection	discard	add_warmth_injection
19154	4.925	the_feel_felt_found+ownership_language	discard	temp_0.90
19155	4.925	the_feel_felt_found+ownership_language+genuine_admission	discard	add_genuine_admission
19156	5.037	the_feel_felt_found+ownership_language	discard	tone_change
19157	5.225	the_feel_felt_found	discard	crossover
19158	5.225	the_feel_felt_found+ownership_language+mirroring	discard	add_mirroring
19159	5.425	the_feel_felt_found+ownership_language	discard	temp_0.90
19160	5.113	the_feel_felt_found+ownership_language	discard	crossover
19161	5.138	the_feel_felt_found	discard	remove_ownership_language
19162	5.450	the_feel_felt_found+ownership_language+personal_touch	discard	add_personal_touch
19163	4.925	the_feel_felt_found+ownership_language	discard	tone_change
19164	5.325	the_feel_felt_found+ownership_language	discard	tone_change
19165	5.013	ownership_language+proactive_extras	discard	swap_the_feel_felt_found_for_proactive_extras
19166	5.450	the_feel_felt_found+ownership_language	discard	tone_change
19167	5.138	ownership_language	discard	crossover
19168	5.450	the_feel_felt_found+ownership_language+validation_before_solution	discard	add_validation_before_solution
19169	5.425	the_feel_felt_found+ownership_language+validation_before_solution	discard	add_validation_before_solution
19170	5.138	ownership_language+energy_matching	discard	swap_the_feel_felt_found_for_energy_matching
19171	5.237	the_feel_felt_found+ownership_language+casual_professionalism	discard	add_casual_professionalism
19172	4.700	the_feel_felt_found+ownership_language+energy_matching	discard	add_energy_matching
19173	5.037	the_feel_felt_found+ownership_language	discard	crossover
19174	5.112	the_feel_felt_found+warmth_injection	discard	swap_ownership_language_for_warmth_injection
19175	5.138	the_feel_felt_found	discard	crossover
19176	5.425	the_feel_felt_found+ownership_language	discard	temp_0.95
19177	5.225	the_feel_felt_found+ownership_language	discard	temp_0.90
19178	5.325	the_feel_felt_found+ownership_language+genuine_admission	discard	add_genuine_admission
19179	5.325	the_feel_felt_found	discard	crossover
19180	5.237	the_feel_felt_found+ownership_language	discard	crossover
19181	5.450	the_feel_felt_found+ownership_language+validation_before_solution	discard	add_validation_before_solution
19182	5.013	the_feel_felt_found+ownership_language	discard	tone_change
19183	5.325	the_feel_felt_found+ownership_language+energy_matching	discard	add_energy_matching
19184	4.800	the_feel_felt_found+ownership_language	discard	tone_change
19185	5.138	ownership_language+validation_before_solution	discard	swap_the_feel_felt_found_for_validation_before_solution
19186	5.112	the_feel_felt_found+ownership_language	discard	temp_0.70
19187	5.450	the_feel_felt_found+ownership_language	discard	tone_change
19188	4.900	ownership_language+personal_touch	discard	swap_the_feel_felt_found_for_personal_touch
19189	4.612	the_feel_felt_found+ownership_language	discard	temp_0.70
19190	5.112	the_feel_felt_found+ownership_language+energy_matching	discard	add_energy_matching
19191	4.925	the_feel_felt_found+ownership_language	discard	temp_0.70
19192	4.513	the_feel_felt_found+ownership_language+emotional_labeling	discard	add_emotional_labeling
19193	5.450	ownership_language+validation_before_solution	discard	swap_the_feel_felt_found_for_validation_before_solution
19194	5.225	the_feel_felt_found+ownership_language	discard	tone_change
19195	5.450	ownership_language+mirroring	discard	swap_the_feel_felt_found_for_mirroring
19196	5.137	the_feel_felt_found+ownership_language	discard	crossover
19197	5.138	the_feel_felt_found+ownership_language	discard	crossover
19198	5.138	the_feel_felt_found+ownership_language+never_say_calm_down	discard	add_never_say_calm_down
19199	5.237	the_feel_felt_found+ownership_language	discard	temp_0.95
19200	5.325	the_feel_felt_found	discard	crossover
19201	5.650	the_feel_felt_found+mirroring	discard	swap_ownership_language_for_mirroring
19202	5.425	the_feel_felt_found+casual_professionalism	discard	swap_ownership_language_for_casual_professionalism
19203	5.250	the_feel_felt_found+ownership_language	discard	tone_change
19204	5.238	the_feel_felt_found+ownership_language+concrete_next_steps	discard	add_concrete_next_steps
19205	5.550	the_feel_felt_found+ownership_language	discard	tone_change
19206	4.700	ownership_language+casual_professionalism	discard	swap_the_feel_felt_found_for_casual_professionalism
19207	5.200	the_feel_felt_found+ownership_language	discard	tone_change
19208	5.325	the_feel_felt_found+ownership_language	discard	tone_change
19209	5.425	the_feel_felt_found	discard	crossover
19210	5.550	the_feel_felt_found+ownership_language+strategic_agreement	discard	add_strategic_agreement
19211	5.425	the_feel_felt_found+ownership_language	discard	crossover
19212	5.025	the_feel_felt_found+ownership_language	discard	tone_change
19213	4.888	ownership_language	discard	crossover
19214	5.100	ownership_language	discard	crossover
19215	5.038	the_feel_felt_found+ownership_language	discard	tone_change
19216	5.138	the_feel_felt_found+ownership_language	discard	tone_change
19217	5.550	the_feel_felt_found+ownership_language	discard	crossover
19218	4.975	the_feel_felt_found	discard	crossover
19219	5.450	the_feel_felt_found+ownership_language	discard	tone_change
19220	5.200	the_feel_felt_found+ownership_language	discard	crossover
19221	5.550	the_feel_felt_found+ownership_language	discard	tone_change
19222	5.338	the_feel_felt_found+ownership_language	discard	temp_0.65
19223	4.888	the_feel_felt_found+ownership_language	discard	tone_change
19224	5.013	ownership_language	discard	remove_the_feel_felt_found
19225	5.550	the_feel_felt_found+ownership_language	discard	crossover
19226	5.138	ownership_language	discard	remove_the_feel_felt_found
19227	5.112	the_feel_felt_found+ownership_language	discard	crossover
19228	5.550	the_feel_felt_found+ownership_language+casual_professionalism	discard	add_casual_professionalism
19229	5.550	the_feel_felt_found+ownership_language	discard	crossover
19230	4.825	ownership_language	discard	crossover
19231	5.450	ownership_language	discard	crossover
19232	5.237	the_feel_felt_found+ownership_language	discard	crossover
19233	4.513	the_feel_felt_found+ownership_language	discard	crossover
19234	4.487	the_feel_felt_found+ownership_language	discard	crossover
19235	5.137	the_feel_felt_found+energy_matching	discard	swap_ownership_language_for_energy_matching
19236	4.725	the_feel_felt_found+ownership_language	discard	temp_0.75
19237	5.237	the_feel_felt_found+ownership_language+validation_before_solution	discard	add_validation_before_solution
19238	5.338	the_feel_felt_found+ownership_language	discard	tone_change
19239	5.225	the_feel_felt_found+ownership_language+energy_matching	discard	add_energy_matching
19240	4.925	the_feel_felt_found+ownership_language	discard	tone_change
19241	4.888	the_feel_felt_found+ownership_language+energy_matching	discard	add_energy_matching
19242	5.225	ownership_language+concrete_next_steps	discard	swap_the_feel_felt_found_for_concrete_next_steps
19243	4.800	none	discard	crossover
19244	4.612	the_feel_felt_found+ownership_language+emotional_labeling	discard	add_emotional_labeling
19245	5.325	the_feel_felt_found+casual_professionalism	discard	swap_ownership_language_for_casual_professionalism
19246	5.237	the_feel_felt_found+ownership_language	discard	temp_0.90
19247	5.425	the_feel_felt_found+ownership_language+mirroring	discard	add_mirroring
19248	5.138	the_feel_felt_found+ownership_language	discard	tone_change
19249	5.025	the_feel_felt_found+ownership_language	discard	tone_change
19250	5.325	the_feel_felt_found	discard	crossover
19251	5.450	the_feel_felt_found+ownership_language+strategic_agreement	discard	add_strategic_agreement
19252	5.338	the_feel_felt_found+ownership_language	discard	tone_change
19253	5.013	the_feel_felt_found+ownership_language	discard	crossover
19254	5.237	none	discard	crossover
19255	4.613	the_feel_felt_found+ownership_language	discard	tone_change
19256	5.325	ownership_language+proactive_extras	discard	swap_the_feel_felt_found_for_proactive_extras
19257	4.950	the_feel_felt_found+mirroring	discard	swap_ownership_language_for_mirroring
19258	5.325	the_feel_felt_found+ownership_language	discard	temp_0.90
19259	5.138	the_feel_felt_found+emotional_labeling	discard	swap_ownership_language_for_emotional_labeling
19260	4.987	the_feel_felt_found+ownership_language	discard	tone_change
19261	5.550	ownership_language	discard	crossover
19262	5.550	the_feel_felt_found+energy_matching	discard	swap_ownership_language_for_energy_matching
19263	5.013	the_feel_felt_found+concrete_next_steps	discard	swap_ownership_language_for_concrete_next_steps
19264	4.700	the_feel_felt_found+ownership_language	discard	temp_0.95
19265	5.350	ownership_language+concrete_next_steps	discard	swap_the_feel_felt_found_for_concrete_next_steps
