generation	eq_score	techniques	status	description
7803	5.100	the_feel_felt_found	discard	remove_ownership_language
7804	4.987	the_feel_felt_found+ownership_language	discard	tone_change
7805	5.112	the_feel_felt_found+ownership_language	discard	tone_change
7806	5.450	the_feel_felt_found+ownership_language+concrete_next_steps	discard	add_concrete_next_steps
7807	5.225	the_feel_felt_found+ownership_language	discard	tone_change
7808	5.325	the_feel_felt_found	discard	crossover
7809	5.237	the_feel_felt_found+ownership_language	discard	temp_0.70
7810	5.138	the_feel_felt_found+ownership_language+genuine_admission	discard	add_genuine_admission
7811	5.450	the_feel_felt_found+ownership_language+never_say_calm_down	discard	add_never_say_calm_down
7812	5.237	the_feel_felt_found+ownership_language	discard	temp_0.85
7813	5.138	the_feel_felt_found+casual_professionalism	discard	swap_ownership_language_for_casual_professionalism
7814	5.200	the_feel_felt_found+ownership_language	discard	crossover
7815	4.925	the_feel_felt_found+ownership_language+proactive_extras	discard	add_proactive_extras
7816	5.425	the_feel_felt_found+ownership_language	discard	temp_0.90
7817	5.237	the_feel_felt_found+ownership_language	discard	crossover
7818	5.138	none	discard	crossover
7819	5.550	ownership_language+genuine_admission	discard	swap_the_feel_felt_found_for_genuine_admission
7820	5.113	the_feel_felt_found+ownership_language	discard	crossover
7821	5.237	the_feel_felt_found+ownership_language	discard	tone_change
7822	5.025	the_feel_felt_found+ownership_language	discard	tone_change
7823	5.013	the_feel_felt_found+ownership_language	discard	tone_change
7824	5.137	the_feel_felt_found+ownership_language+personal_touch	discard	add_personal_touch
7825	5.237	the_feel_felt_found+ownership_language	discard	temp_0.75
7826	5.450	the_feel_felt_found+mirroring	discard	swap_ownership_language_for_mirroring
7827	4.487	the_feel_felt_found+ownership_language	discard	tone_change
7828	5.237	the_feel_felt_found+ownership_language	discard	tone_change
7829	5.175	ownership_language+concrete_next_steps	discard	swap_the_feel_felt_found_for_concrete_next_steps
7830	4.787	ownership_language	discard	crossover
7831	4.825	the_feel_felt_found+strategic_agreement	discard	swap_ownership_language_for_strategic_agreement
7832	5.325	the_feel_felt_found+ownership_language+casual_professionalism	discard	add_casual_professionalism
7833	5.237	the_feel_felt_found+ownership_language	discard	temp_0.95
7834	5.425	the_feel_felt_found	discard	remove_ownership_language
7835	5.300	the_feel_felt_found+ownership_language	discard	tone_change
7836	4.612	the_feel_felt_found+ownership_language	discard	crossover
7837	5.550	the_feel_felt_found+ownership_language+warmth_injection	discard	add_warmth_injection
7838	5.137	the_feel_felt_found+ownership_language+concrete_next_steps	discard	add_concrete_next_steps
7839	5.138	the_feel_felt_found+ownership_language	discard	crossover
7840	5.450	the_feel_felt_found+ownership_language+concrete_next_steps	discard	add_concrete_next_steps
7841	5.138	the_feel_felt_found	discard	remove_ownership_language
7842	5.650	the_feel_felt_found+ownership_language+concrete_next_steps	discard	add_concrete_next_steps
7843	5.325	the_feel_felt_found+ownership_language+personal_touch	discard	add_personal_touch
7844	5.550	the_feel_felt_found	discard	crossover
7845	5.550	the_feel_felt_found+ownership_language	discard	tone_change
7846	5.438	the_feel_felt_found+ownership_language	discard	tone_change
7847	5.550	none	discard	crossover
7848	5.325	the_feel_felt_found+casual_professionalism	discard	swap_ownership_language_for_casual_professionalism
7849	5.138	the_feel_felt_found+ownership_language+strategic_agreement	discard	add_strategic_agreement
7850	5.225	the_feel_felt_found+ownership_language+warmth_injection	discard	add_warmth_injection
7851	5.550	the_feel_felt_found+ownership_language	discard	temp_0.65
7852	5.300	ownership_language+proactive_extras	discard	swap_the_feel_felt_found_for_proactive_extras
7853	5.350	the_feel_felt_found+ownership_language	discard	crossover
7854	5.237	the_feel_felt_found+ownership_language	discard	tone_change
7855	5.100	ownership_language	discard	crossover
7856	5.450	the_feel_felt_found+ownership_language+mirroring	discard	add_mirroring
7857	5.550	the_feel_felt_found+ownership_language	discard	tone_change
7858	5.325	the_feel_felt_found	discard	crossover
7859	5.550	the_feel_felt_found+genuine_admission	discard	swap_ownership_language_for_genuine_admission
7860	5.013	the_feel_felt_found+ownership_language	discard	tone_change
7861	5.550	the_feel_felt_found+validation_before_solution	discard	swap_ownership_language_for_validation_before_solution
7862	5.138	the_feel_felt_found+ownership_language	discard	temp_0.90
7863	5.112	the_feel_felt_found	discard	remove_ownership_language
7864	5.325	the_feel_felt_found+ownership_language+genuine_admission	discard	add_genuine_admission
7865	5.650	the_feel_felt_found+ownership_language+proactive_extras	discard	add_proactive_extras
7866	5.450	the_feel_felt_found+ownership_language	discard	crossover
7867	5.238	the_feel_felt_found+proactive_extras	discard	swap_ownership_language_for_proactive_extras
7868	5.037	the_feel_felt_found+ownership_language+never_say_calm_down	discard	add_never_say_calm_down
7869	5.200	the_feel_felt_found	discard	crossover
7870	5.450	the_feel_felt_found+ownership_language+validation_before_solution	discard	add_validation_before_solution
7871	5.237	the_feel_felt_found+ownership_language	discard	temp_0.70
7872	5.113	the_feel_felt_found	discard	crossover
7873	5.450	the_feel_felt_found+ownership_language	discard	tone_change
7874	5.200	the_feel_felt_found	discard	remove_ownership_language
7875	5.437	the_feel_felt_found+ownership_language	discard	tone_change
7876	4.700	the_feel_felt_found+ownership_language+emotional_labeling	discard	add_emotional_labeling
7877	5.112	the_feel_felt_found+ownership_language	discard	tone_change
7878	5.650	the_feel_felt_found	discard	crossover
7879	5.425	the_feel_felt_found+mirroring	discard	swap_ownership_language_for_mirroring
7880	5.550	the_feel_felt_found+ownership_language	discard	tone_change
7881	5.450	the_feel_felt_found+ownership_language	discard	tone_change
7882	5.225	the_feel_felt_found+ownership_language+personal_touch	discard	add_personal_touch
7883	4.888	the_feel_felt_found+ownership_language	discard	temp_0.85
7884	5.425	ownership_language	discard	crossover
7885	5.138	ownership_language	discard	remove_the_feel_felt_found
7886	5.550	the_feel_felt_found+ownership_language	discard	temp_0.90
7887	5.237	the_feel_felt_found+ownership_language	discard	tone_change
7888	5.075	the_feel_felt_found+ownership_language	discard	tone_change
7889	5.450	the_feel_felt_found+ownership_language+genuine_admission	discard	add_genuine_admission
7890	5.138	the_feel_felt_found+ownership_language	discard	crossover
7891	5.425	the_feel_felt_found	discard	remove_ownership_language
7892	5.550	the_feel_felt_found	discard	remove_ownership_language
7893	5.138	ownership_language	discard	remove_the_feel_felt_found
7894	5.325	the_feel_felt_found	discard	crossover
7895	5.338	the_feel_felt_found+ownership_language	discard	temp_0.85
7896	5.013	ownership_language+strategic_agreement	discard	swap_the_feel_felt_found_for_strategic_agreement
7897	5.550	ownership_language	discard	remove_the_feel_felt_found
7898	4.925	none	discard	crossover
7899	5.213	ownership_language	discard	crossover
7900	5.025	the_feel_felt_found+ownership_language	discard	tone_change
7901	5.338	the_feel_felt_found+genuine_admission	discard	swap_ownership_language_for_genuine_admission
7902	5.450	the_feel_felt_found+ownership_language+emotional_labeling	discard	add_emotional_labeling
7903	5.138	the_feel_felt_found+concrete_next_steps	discard	swap_ownership_language_for_concrete_next_steps
7904	5.237	the_feel_felt_found+ownership_language	discard	crossover
7905	5.138	the_feel_felt_found+ownership_language	discard	crossover
7906	5.550	the_feel_felt_found+ownership_language+validation_before_solution	discard	add_validation_before_solution
7907	4.913	the_feel_felt_found+concrete_next_steps	discard	swap_ownership_language_for_concrete_next_steps
7908	5.025	the_feel_felt_found+ownership_language	discard	tone_change
7909	5.450	the_feel_felt_found+concrete_next_steps	discard	swap_ownership_language_for_concrete_next_steps
7910	5.450	the_feel_felt_found+strategic_agreement	discard	swap_ownership_language_for_strategic_agreement
7911	5.013	the_feel_felt_found+ownership_language	discard	tone_change
7912	5.200	the_feel_felt_found+ownership_language+strategic_agreement	discard	add_strategic_agreement
7913	5.450	the_feel_felt_found+ownership_language+warmth_injection	discard	add_warmth_injection
7914	5.138	the_feel_felt_found+ownership_language+genuine_admission	discard	add_genuine_admission
7915	5.225	the_feel_felt_found+ownership_language	discard	temp_0.75
7916	5.112	the_feel_felt_found+ownership_language	discard	tone_change
7917	5.238	the_feel_felt_found+ownership_language	discard	temp_0.70
7918	5.450	ownership_language	discard	crossover
7919	5.200	the_feel_felt_found+ownership_language	discard	tone_change
7920	5.112	the_feel_felt_found+validation_before_solution	discard	swap_ownership_language_for_validation_before_solution
7921	5.325	the_feel_felt_found+ownership_language	discard	crossover
7922	5.325	the_feel_felt_found	discard	remove_ownership_language
7923	5.650	the_feel_felt_found+ownership_language+genuine_admission	discard	add_genuine_admission
7924	5.425	the_feel_felt_found+ownership_language+genuine_admission	discard	add_genuine_admission
7925	5.138	the_feel_felt_found+ownership_language	discard	temp_0.95
7926	5.237	the_feel_felt_found+ownership_language+warmth_injection	discard	add_warmth_injection
7927	5.450	ownership_language+proactive_extras	discard	swap_the_feel_felt_found_for_proactive_extras
7928	5.325	ownership_language	discard	remove_the_feel_felt_found
7929	5.037	the_feel_felt_found+ownership_language	discard	tone_change
7930	5.213	the_feel_felt_found+ownership_language	discard	crossover
7931	5.550	the_feel_felt_found+ownership_language+mirroring	discard	add_mirroring
7932	5.212	ownership_language	discard	remove_the_feel_felt_found
7933	5.550	ownership_language+casual_professionalism	discard	swap_the_feel_felt_found_for_casual_professionalism
7934	5.450	the_feel_felt_found+concrete_next_steps	discard	swap_ownership_language_for_concrete_next_steps
7935	4.925	ownership_language	discard	remove_the_feel_felt_found
7936	5.013	the_feel_felt_found+ownership_language	discard	tone_change
7937	5.550	the_feel_felt_found+ownership_language	discard	tone_change
7938	5.112	the_feel_felt_found+validation_before_solution	discard	swap_ownership_language_for_validation_before_solution
7939	5.013	the_feel_felt_found+ownership_language+energy_matching	discard	add_energy_matching
7940	5.450	the_feel_felt_found+ownership_language	discard	temp_0.95
7941	5.450	the_feel_felt_found+ownership_language+energy_matching	discard	add_energy_matching
7942	5.350	the_feel_felt_found+ownership_language	discard	temp_0.75
7943	5.237	the_feel_felt_found+ownership_language+mirroring	discard	add_mirroring
7944	5.225	ownership_language+concrete_next_steps	discard	swap_the_feel_felt_found_for_concrete_next_steps
7945	4.912	the_feel_felt_found+ownership_language	discard	temp_0.95
7946	4.825	ownership_language	discard	crossover
7947	4.700	the_feel_felt_found+ownership_language	discard	temp_0.85
7948	5.550	ownership_language	discard	remove_the_feel_felt_found
7949	5.238	the_feel_felt_found	discard	crossover
7950	5.450	ownership_language	discard	crossover
7951	5.200	ownership_language+never_say_calm_down	discard	swap_the_feel_felt_found_for_never_say_calm_down
7952	5.550	the_feel_felt_found+ownership_language+casual_professionalism	discard	add_casual_professionalism
7953	5.650	the_feel_felt_found	discard	remove_ownership_language
7954	5.450	the_feel_felt_found+ownership_language	discard	temp_0.75
7955	4.925	the_feel_felt_found+ownership_language	discard	crossover
7956	5.450	the_feel_felt_found+ownership_language+concrete_next_steps	discard	add_concrete_next_steps
7957	5.450	the_feel_felt_found+ownership_language	discard	tone_change
7958	5.013	the_feel_felt_found+ownership_language	discard	tone_change
7959	5.325	the_feel_felt_found+ownership_language+energy_matching	discard	add_energy_matching
7960	5.650	ownership_language+personal_touch	discard	swap_the_feel_felt_found_for_personal_touch
7961	4.925	ownership_language+proactive_extras	discard	swap_the_feel_felt_found_for_proactive_extras
7962	4.987	the_feel_felt_found+ownership_language	discard	temp_0.95
7963	5.037	the_feel_felt_found+ownership_language	discard	temp_0.65
7964	5.237	the_feel_felt_found+ownership_language+concrete_next_steps	discard	add_concrete_next_steps
7965	5.550	ownership_language+validation_before_solution	discard	swap_the_feel_felt_found_for_validation_before_solution
7966	5.550	the_feel_felt_found+ownership_language	discard	temp_0.65
7967	5.450	the_feel_felt_found+ownership_language+proactive_extras	discard	add_proactive_extras
7968	5.138	the_feel_felt_found+ownership_language	discard	tone_change
7969	5.237	the_feel_felt_found+ownership_language+never_say_calm_down	discard	add_never_say_calm_down
7970	5.425	the_feel_felt_found	discard	remove_ownership_language
7971	5.450	the_feel_felt_found+ownership_language	discard	tone_change
7972	5.237	the_feel_felt_found+mirroring	discard	swap_ownership_language_for_mirroring
7973	5.325	the_feel_felt_found	discard	remove_ownership_language
7974	5.237	ownership_language	discard	remove_the_feel_felt_found
7975	5.138	ownership_language+validation_before_solution	discard	swap_the_feel_felt_found_for_validation_before_solution
7976	5.237	the_feel_felt_found+ownership_language	discard	tone_change
7977	5.200	the_feel_felt_found+ownership_language+casual_professionalism	discard	add_casual_professionalism
7978	5.550	ownership_language+proactive_extras	discard	swap_the_feel_felt_found_for_proactive_extras
7979	5.200	ownership_language	discard	remove_the_feel_felt_found
7980	5.237	the_feel_felt_found+ownership_language	discard	temp_0.90
7981	5.325	the_feel_felt_found+ownership_language	discard	temp_0.75
7982	5.750	the_feel_felt_found	discard	crossover
7983	5.225	the_feel_felt_found	discard	remove_ownership_language
7984	4.925	the_feel_felt_found	discard	remove_ownership_language
7985	5.037	none	discard	crossover
7986	5.550	the_feel_felt_found+ownership_language	discard	tone_change
7987	5.237	the_feel_felt_found+ownership_language	discard	tone_change
7988	4.925	the_feel_felt_found+ownership_language	discard	temp_0.75
7989	5.350	the_feel_felt_found+ownership_language	discard	tone_change
7990	4.700	ownership_language	discard	crossover
7991	5.300	ownership_language+energy_matching	discard	swap_the_feel_felt_found_for_energy_matching
7992	5.013	the_feel_felt_found+ownership_language	discard	crossover
7993	4.925	the_feel_felt_found+ownership_language+strategic_agreement	discard	add_strategic_agreement
7994	5.237	the_feel_felt_found+ownership_language	discard	crossover
7995	5.550	the_feel_felt_found+concrete_next_steps	discard	swap_ownership_language_for_concrete_next_steps
7996	5.650	ownership_language+proactive_extras	discard	swap_the_feel_felt_found_for_proactive_extras
7997	5.138	the_feel_felt_found+ownership_language	discard	temp_0.85
7998	4.925	ownership_language+warmth_injection	discard	swap_the_feel_felt_found_for_warmth_injection
7999	5.450	the_feel_felt_found+ownership_language+validation_before_solution	discard	add_validation_before_solution
8000	5.325	the_feel_felt_found+ownership_language	discard	temp_0.85
8001	5.013	the_feel_felt_found+ownership_language+concrete_next_steps	discard	add_concrete_next_steps
8002	4.988	none	discard	crossover
8003	5.237	the_feel_felt_found+ownership_language	discard	tone_change
8004	5.000	ownership_language+warmth_injection	discard	swap_the_feel_felt_found_for_warmth_injection
8005	5.038	ownership_language	discard	remove_the_feel_felt_found
8006	4.825	the_feel_felt_found+ownership_language	discard	crossover
8007	5.338	the_feel_felt_found+ownership_language	discard	temp_0.95
8008	5.450	the_feel_felt_found+ownership_language	discard	crossover
8009	5.237	the_feel_felt_found+ownership_language+validation_before_solution	discard	add_validation_before_solution
8010	5.137	the_feel_felt_found+ownership_language	discard	tone_change
8011	5.650	the_feel_felt_found+ownership_language+never_say_calm_down	discard	add_never_say_calm_down
8012	4.700	ownership_language+casual_professionalism	discard	swap_the_feel_felt_found_for_casual_professionalism
8013	5.550	the_feel_felt_found+ownership_language+validation_before_solution	discard	add_validation_before_solution
8014	5.113	the_feel_felt_found+ownership_language+energy_matching	discard	add_energy_matching
8015	5.138	ownership_language	discard	crossover
8016	5.425	ownership_language+concrete_next_steps	discard	swap_the_feel_felt_found_for_concrete_next_steps
8017	5.450	the_feel_felt_found+ownership_language+concrete_next_steps	discard	add_concrete_next_steps
8018	5.450	the_feel_felt_found+ownership_language+mirroring	discard	add_mirroring
8019	5.237	ownership_language+warmth_injection	discard	swap_the_feel_felt_found_for_warmth_injection
8020	5.325	the_feel_felt_found+ownership_language+strategic_agreement	discard	add_strategic_agreement
8021	4.913	ownership_language+emotional_labeling	discard	swap_the_feel_felt_found_for_emotional_labeling
8022	5.225	the_feel_felt_found+ownership_language	discard	tone_change
8023	5.450	the_feel_felt_found+ownership_language+casual_professionalism	discard	add_casual_professionalism
8024	4.575	the_feel_felt_found+ownership_language	discard	temp_0.65
8025	5.350	the_feel_felt_found+ownership_language+genuine_admission	discard	add_genuine_admission
8026	5.450	the_feel_felt_found+ownership_language+emotional_labeling	discard	add_emotional_labeling
8027	5.225	the_feel_felt_found+ownership_language	discard	crossover
8028	5.237	the_feel_felt_found+ownership_language	discard	tone_change
8029	5.525	ownership_language	discard	remove_the_feel_felt_found
8030	5.425	the_feel_felt_found+ownership_language	discard	tone_change
8031	5.325	the_feel_felt_found+ownership_language	discard	tone_change
8032	5.013	the_feel_felt_found+ownership_language+never_say_calm_down	discard	add_never_say_calm_down
8033	5.013	the_feel_felt_found+ownership_language+genuine_admission	discard	add_genuine_admission
8034	5.450	the_feel_felt_found+ownership_language+warmth_injection	discard	add_warmth_injection
8035	5.550	the_feel_felt_found+ownership_language	discard	temp_0.85
8036	5.237	the_feel_felt_found+ownership_language	discard	tone_change
8037	5.138	the_feel_felt_found+ownership_language	discard	tone_change
8038	5.325	the_feel_felt_found+ownership_language	discard	crossover
8039	4.825	the_feel_felt_found+ownership_language	discard	crossover
8040	5.225	the_feel_felt_found+ownership_language+validation_before_solution	discard	add_validation_before_solution
8041	5.450	ownership_language	discard	crossover
8042	5.338	the_feel_felt_found+ownership_language+warmth_injection	discard	add_warmth_injection
8043	5.112	the_feel_felt_found+ownership_language	discard	tone_change
8044	5.025	the_feel_felt_found	discard	crossover
8045	5.237	the_feel_felt_found+ownership_language	discard	crossover
8046	5.138	the_feel_felt_found+strategic_agreement	discard	swap_ownership_language_for_strategic_agreement
8047	5.237	ownership_language+emotional_labeling	discard	swap_the_feel_felt_found_for_emotional_labeling
8048	5.175	the_feel_felt_found+ownership_language	discard	crossover
8049	5.237	the_feel_felt_found+ownership_language+casual_professionalism	discard	add_casual_professionalism
8050	5.450	ownership_language+energy_matching	discard	swap_the_feel_felt_found_for_energy_matching
8051	5.325	the_feel_felt_found+ownership_language+genuine_admission	discard	add_genuine_admission
8052	5.425	the_feel_felt_found+ownership_language+strategic_agreement	discard	add_strategic_agreement
8053	5.237	ownership_language+never_say_calm_down	discard	swap_the_feel_felt_found_for_never_say_calm_down
8054	5.550	the_feel_felt_found+ownership_language	discard	crossover
8055	5.013	the_feel_felt_found+ownership_language+concrete_next_steps	discard	add_concrete_next_steps
8056	4.912	the_feel_felt_found+ownership_language	discard	temp_0.70
8057	5.450	the_feel_felt_found+ownership_language	discard	temp_0.70
8058	5.138	the_feel_felt_found+ownership_language+emotional_labeling	discard	add_emotional_labeling
8059	4.700	the_feel_felt_found+ownership_language+validation_before_solution	discard	add_validation_before_solution
8060	5.525	the_feel_felt_found+ownership_language	discard	tone_change
8061	5.525	the_feel_felt_found+ownership_language+energy_matching	discard	add_energy_matching
8062	5.450	the_feel_felt_found+ownership_language+casual_professionalism	discard	add_casual_professionalism
8063	5.550	the_feel_felt_found+ownership_language+personal_touch	discard	add_personal_touch
8064	5.338	the_feel_felt_found+ownership_language	discard	temp_0.75
8065	5.138	the_feel_felt_found+ownership_language+personal_touch	discard	add_personal_touch
8066	5.025	the_feel_felt_found+ownership_language	discard	temp_0.95
8067	5.037	the_feel_felt_found	discard	crossover
8068	5.138	the_feel_felt_found+ownership_language	discard	tone_change
8069	5.225	the_feel_felt_found+ownership_language	discard	crossover
8070	5.300	the_feel_felt_found+ownership_language	discard	tone_change
8071	5.450	none	discard	crossover
8072	5.337	ownership_language+mirroring	discard	swap_the_feel_felt_found_for_mirroring
8073	5.112	the_feel_felt_found+ownership_language	discard	tone_change
8074	5.425	the_feel_felt_found+personal_touch	discard	swap_ownership_language_for_personal_touch
8075	5.325	the_feel_felt_found+ownership_language	discard	tone_change
8076	5.113	the_feel_felt_found+ownership_language	discard	tone_change
