generation	eq_score	techniques	status	description
8357	5.025	ownership_language+genuine_admission	discard	swap_the_feel_felt_found_for_genuine_admission
8358	5.225	the_feel_felt_found	discard	crossover
8359	5.225	the_feel_felt_found+ownership_language+emotional_labeling	discard	add_emotional_labeling
8360	5.013	the_feel_felt_found+ownership_language	discard	tone_change
8361	5.138	the_feel_felt_found+ownership_language	discard	crossover
8362	5.013	the_feel_felt_found+ownership_language	discard	tone_change
8363	5.038	the_feel_felt_found+genuine_admission	discard	swap_ownership_language_for_genuine_admission
8364	5.138	the_feel_felt_found+ownership_language+mirroring	discard	add_mirroring
8365	5.450	the_feel_felt_found+ownership_language+strategic_agreement	discard	add_strategic_agreement
8366	5.225	the_feel_felt_found+ownership_language	discard	crossover
8367	5.237	ownership_language	discard	crossover
8368	5.112	the_feel_felt_found+ownership_language	discard	crossover
8369	5.025	the_feel_felt_found+ownership_language	discard	tone_change
8370	5.013	ownership_language+genuine_admission	discard	swap_the_feel_felt_found_for_genuine_admission
8371	5.650	the_feel_felt_found+ownership_language	discard	tone_change
8372	5.300	the_feel_felt_found+ownership_language	discard	temp_0.70
8373	5.013	ownership_language+personal_touch	discard	swap_the_feel_felt_found_for_personal_touch
8374	5.237	ownership_language+personal_touch	discard	swap_the_feel_felt_found_for_personal_touch
8375	5.550	the_feel_felt_found+ownership_language+energy_matching	discard	add_energy_matching
8376	5.238	the_feel_felt_found+ownership_language+warmth_injection	discard	add_warmth_injection
8377	5.525	the_feel_felt_found+ownership_language	discard	tone_change
8378	5.300	the_feel_felt_found+ownership_language	discard	tone_change
8379	5.212	the_feel_felt_found+ownership_language	discard	tone_change
8380	5.650	ownership_language+warmth_injection	discard	swap_the_feel_felt_found_for_warmth_injection
8381	5.625	the_feel_felt_found+ownership_language	discard	tone_change
8382	5.550	the_feel_felt_found+ownership_language+casual_professionalism	discard	add_casual_professionalism
8383	5.325	the_feel_felt_found+ownership_language+concrete_next_steps	discard	add_concrete_next_steps
8384	4.700	the_feel_felt_found+ownership_language	discard	temp_0.90
8385	5.075	the_feel_felt_found+ownership_language+mirroring	discard	add_mirroring
8386	5.138	the_feel_felt_found+ownership_language	discard	tone_change
8387	5.450	ownership_language+energy_matching	discard	swap_the_feel_felt_found_for_energy_matching
8388	5.550	the_feel_felt_found+ownership_language	discard	tone_change
8389	5.350	the_feel_felt_found+ownership_language	discard	crossover
8390	5.425	the_feel_felt_found+ownership_language+validation_before_solution	discard	add_validation_before_solution
8391	5.013	the_feel_felt_found+ownership_language+emotional_labeling	discard	add_emotional_labeling
8392	5.088	ownership_language	discard	crossover
8393	5.200	the_feel_felt_found+ownership_language+concrete_next_steps	discard	add_concrete_next_steps
8394	5.137	the_feel_felt_found+casual_professionalism	discard	swap_ownership_language_for_casual_professionalism
8395	4.825	the_feel_felt_found+energy_matching	discard	swap_ownership_language_for_energy_matching
8396	5.450	the_feel_felt_found+ownership_language	discard	temp_0.90
8397	5.325	the_feel_felt_found+never_say_calm_down	discard	swap_ownership_language_for_never_say_calm_down
8398	5.138	ownership_language	discard	crossover
8399	5.338	the_feel_felt_found	discard	remove_ownership_language
8400	5.225	the_feel_felt_found+ownership_language	discard	tone_change
8401	5.112	ownership_language+energy_matching	discard	swap_the_feel_felt_found_for_energy_matching
8402	5.425	the_feel_felt_found+ownership_language	discard	tone_change
8403	5.237	the_feel_felt_found	discard	remove_ownership_language
8404	4.800	the_feel_felt_found+ownership_language	discard	tone_change
8405	5.337	the_feel_felt_found+ownership_language+warmth_injection	discard	add_warmth_injection
8406	5.237	the_feel_felt_found+ownership_language	discard	tone_change
8407	5.350	the_feel_felt_found+ownership_language	discard	tone_change
8408	4.588	the_feel_felt_found+ownership_language	discard	tone_change
8409	5.225	the_feel_felt_found+ownership_language	discard	tone_change
8410	5.425	the_feel_felt_found+ownership_language	discard	temp_0.90
8411	5.112	ownership_language	discard	crossover
8412	4.925	the_feel_felt_found+ownership_language	discard	tone_change
8413	5.075	the_feel_felt_found+ownership_language	discard	tone_change
8414	5.425	the_feel_felt_found	discard	remove_ownership_language
8415	5.225	the_feel_felt_found+ownership_language	discard	tone_change
8416	5.138	ownership_language	discard	crossover
8417	5.013	the_feel_felt_found+ownership_language	discard	temp_0.65
8418	5.300	the_feel_felt_found+ownership_language	discard	tone_change
8419	5.237	the_feel_felt_found	discard	crossover
8420	5.450	the_feel_felt_found+ownership_language+genuine_admission	discard	add_genuine_admission
8421	5.350	the_feel_felt_found+ownership_language+concrete_next_steps	discard	add_concrete_next_steps
8422	4.925	none	discard	crossover
8423	5.138	the_feel_felt_found+strategic_agreement	discard	swap_ownership_language_for_strategic_agreement
8424	5.550	the_feel_felt_found+ownership_language	discard	tone_change
8425	5.237	ownership_language+genuine_admission	discard	swap_the_feel_felt_found_for_genuine_admission
8426	5.238	ownership_language+emotional_labeling	discard	swap_the_feel_felt_found_for_emotional_labeling
8427	5.112	the_feel_felt_found	discard	crossover
8428	5.450	the_feel_felt_found+ownership_language	discard	tone_change
8429	4.925	the_feel_felt_found+ownership_language	discard	tone_change
8430	5.350	the_feel_felt_found+ownership_language+proactive_extras	discard	add_proactive_extras
8431	4.613	the_feel_felt_found	discard	crossover
8432	5.013	ownership_language+never_say_calm_down	discard	swap_the_feel_felt_found_for_never_say_calm_down
8433	5.037	the_feel_felt_found+ownership_language+energy_matching	discard	add_energy_matching
8434	4.925	the_feel_felt_found+ownership_language	discard	crossover
8435	5.450	ownership_language	discard	remove_the_feel_felt_found
8436	5.237	the_feel_felt_found+ownership_language	discard	temp_0.65
8437	5.138	ownership_language	discard	crossover
8438	4.888	ownership_language+concrete_next_steps	discard	swap_the_feel_felt_found_for_concrete_next_steps
8439	5.325	the_feel_felt_found+ownership_language	discard	temp_0.90
8440	5.550	the_feel_felt_found+ownership_language	discard	tone_change
8441	5.213	the_feel_felt_found+warmth_injection	discard	swap_ownership_language_for_warmth_injection
8442	5.138	the_feel_felt_found+ownership_language	discard	temp_0.90
8443	5.325	the_feel_felt_found+ownership_language+validation_before_solution	discard	add_validation_before_solution
8444	5.213	the_feel_felt_found+ownership_language+energy_matching	discard	add_energy_matching
8445	5.138	the_feel_felt_found+ownership_language	discard	tone_change
8446	5.037	the_feel_felt_found	discard	remove_ownership_language
8447	5.312	the_feel_felt_found+ownership_language	discard	tone_change
8448	5.425	the_feel_felt_found+ownership_language+mirroring	discard	add_mirroring
8449	5.550	the_feel_felt_found+ownership_language	discard	crossover
8450	5.325	the_feel_felt_found+ownership_language+strategic_agreement	discard	add_strategic_agreement
8451	5.100	the_feel_felt_found+ownership_language	discard	crossover
8452	4.987	the_feel_felt_found+ownership_language+concrete_next_steps	discard	add_concrete_next_steps
8453	4.800	the_feel_felt_found+ownership_language+energy_matching	discard	add_energy_matching
8454	5.425	ownership_language+never_say_calm_down	discard	swap_the_feel_felt_found_for_never_say_calm_down
8455	4.825	the_feel_felt_found+ownership_language	discard	tone_change
8456	5.425	the_feel_felt_found+ownership_language	discard	crossover
8457	5.000	ownership_language	discard	crossover
8458	5.450	the_feel_felt_found	discard	crossover
8459	5.550	the_feel_felt_found+ownership_language	discard	tone_change
8460	5.013	ownership_language	discard	crossover
8461	5.237	the_feel_felt_found	discard	remove_ownership_language
8462	5.138	the_feel_felt_found+ownership_language+proactive_extras	discard	add_proactive_extras
8463	5.325	the_feel_felt_found+ownership_language+warmth_injection	discard	add_warmth_injection
8464	5.238	the_feel_felt_found	discard	remove_ownership_language
8465	5.425	the_feel_felt_found+ownership_language+genuine_admission	discard	add_genuine_admission
8466	5.650	the_feel_felt_found+ownership_language	discard	tone_change
8467	5.200	the_feel_felt_found+ownership_language+emotional_labeling	discard	add_emotional_labeling
8468	5.325	ownership_language	discard	crossover
8469	5.212	the_feel_felt_found+ownership_language	discard	tone_change
8470	5.138	the_feel_felt_found+warmth_injection	discard	swap_ownership_language_for_warmth_injection
8471	5.650	ownership_language	discard	crossover
8472	5.237	the_feel_felt_found+concrete_next_steps	discard	swap_ownership_language_for_concrete_next_steps
8473	5.325	the_feel_felt_found+ownership_language	discard	temp_0.75
8474	5.025	the_feel_felt_found+ownership_language+personal_touch	discard	add_personal_touch
8475	4.900	the_feel_felt_found+ownership_language+personal_touch	discard	add_personal_touch
8476	4.825	the_feel_felt_found+ownership_language	discard	tone_change
8477	5.338	the_feel_felt_found+ownership_language+emotional_labeling	discard	add_emotional_labeling
8478	5.450	the_feel_felt_found+ownership_language	discard	temp_0.95
8479	5.138	the_feel_felt_found	discard	remove_ownership_language
8480	4.912	the_feel_felt_found+ownership_language	discard	crossover
8481	5.112	the_feel_felt_found+ownership_language	discard	tone_change
8482	4.700	the_feel_felt_found	discard	remove_ownership_language
8483	4.925	the_feel_felt_found+ownership_language+strategic_agreement	discard	add_strategic_agreement
8484	4.775	the_feel_felt_found+ownership_language	discard	crossover
8485	5.450	the_feel_felt_found	discard	crossover
8486	5.138	the_feel_felt_found+never_say_calm_down	discard	swap_ownership_language_for_never_say_calm_down
8487	5.112	the_feel_felt_found+ownership_language+never_say_calm_down	discard	add_never_say_calm_down
8488	4.912	ownership_language+genuine_admission	discard	swap_the_feel_felt_found_for_genuine_admission
8489	5.037	the_feel_felt_found+ownership_language	discard	tone_change
8490	5.138	the_feel_felt_found+ownership_language	discard	tone_change
8491	5.013	the_feel_felt_found+ownership_language+concrete_next_steps	discard	add_concrete_next_steps
8492	4.925	the_feel_felt_found+strategic_agreement	discard	swap_ownership_language_for_strategic_agreement
8493	4.700	ownership_language+warmth_injection	discard	swap_the_feel_felt_found_for_warmth_injection
8494	5.013	ownership_language+genuine_admission	discard	swap_the_feel_felt_found_for_genuine_admission
8495	5.450	ownership_language	discard	crossover
8496	5.550	the_feel_felt_found+ownership_language	discard	crossover
8497	5.350	the_feel_felt_found+ownership_language	discard	crossover
8498	4.725	the_feel_felt_found+ownership_language+mirroring	discard	add_mirroring
8499	5.213	ownership_language+strategic_agreement	discard	swap_the_feel_felt_found_for_strategic_agreement
8500	5.325	ownership_language+genuine_admission	discard	swap_the_feel_felt_found_for_genuine_admission
8501	5.325	the_feel_felt_found+ownership_language	discard	crossover
8502	5.450	the_feel_felt_found+ownership_language	discard	crossover
8503	5.325	ownership_language+personal_touch	discard	swap_the_feel_felt_found_for_personal_touch
8504	5.200	ownership_language	discard	remove_the_feel_felt_found
8505	5.350	the_feel_felt_found+ownership_language+energy_matching	discard	add_energy_matching
8506	5.450	the_feel_felt_found+ownership_language+emotional_labeling	discard	add_emotional_labeling
8507	4.888	the_feel_felt_found+ownership_language	discard	tone_change
8508	5.013	ownership_language	discard	remove_the_feel_felt_found
8509	5.650	ownership_language	discard	remove_the_feel_felt_found
8510	5.338	the_feel_felt_found+ownership_language	discard	tone_change
8511	5.525	the_feel_felt_found+concrete_next_steps	discard	swap_ownership_language_for_concrete_next_steps
8512	5.138	the_feel_felt_found+ownership_language+mirroring	discard	add_mirroring
8513	5.225	ownership_language	discard	remove_the_feel_felt_found
8514	5.200	ownership_language+warmth_injection	discard	swap_the_feel_felt_found_for_warmth_injection
8515	5.350	the_feel_felt_found	discard	crossover
8516	5.350	the_feel_felt_found+ownership_language+mirroring	discard	add_mirroring
8517	5.550	the_feel_felt_found+ownership_language	discard	tone_change
8518	5.650	the_feel_felt_found+ownership_language	discard	temp_0.75
8519	5.237	the_feel_felt_found+ownership_language+concrete_next_steps	discard	add_concrete_next_steps
8520	5.525	the_feel_felt_found+ownership_language	discard	crossover
8521	5.225	the_feel_felt_found+ownership_language+warmth_injection	discard	add_warmth_injection
8522	5.450	the_feel_felt_found+warmth_injection	discard	swap_ownership_language_for_warmth_injection
8523	5.237	ownership_language+concrete_next_steps	discard	swap_the_feel_felt_found_for_concrete_next_steps
8524	5.325	the_feel_felt_found+ownership_language	discard	crossover
8525	5.550	the_feel_felt_found+ownership_language+casual_professionalism	discard	add_casual_professionalism
8526	5.650	the_feel_felt_found+genuine_admission	discard	swap_ownership_language_for_genuine_admission
8527	4.787	ownership_language+never_say_calm_down	discard	swap_the_feel_felt_found_for_never_say_calm_down
8528	5.550	the_feel_felt_found+concrete_next_steps	discard	swap_ownership_language_for_concrete_next_steps
8529	4.900	ownership_language+warmth_injection	discard	swap_the_feel_felt_found_for_warmth_injection
8530	5.037	the_feel_felt_found	discard	remove_ownership_language
8531	5.025	the_feel_felt_found+ownership_language	discard	tone_change
8532	5.200	ownership_language+casual_professionalism	discard	swap_the_feel_felt_found_for_casual_professionalism
8533	5.237	the_feel_felt_found	discard	crossover
8534	5.300	ownership_language	discard	remove_the_feel_felt_found
8535	5.237	the_feel_felt_found+ownership_language+mirroring	discard	add_mirroring
8536	5.037	the_feel_felt_found	discard	remove_ownership_language
8537	5.550	the_feel_felt_found	discard	crossover
8538	5.550	ownership_language+never_say_calm_down	discard	swap_the_feel_felt_found_for_never_say_calm_down
8539	5.025	the_feel_felt_found+validation_before_solution	discard	swap_ownership_language_for_validation_before_solution
8540	5.200	the_feel_felt_found+ownership_language	discard	temp_0.70
8541	5.325	ownership_language+never_say_calm_down	discard	swap_the_feel_felt_found_for_never_say_calm_down
8542	5.450	the_feel_felt_found	discard	crossover
8543	5.013	the_feel_felt_found+ownership_language	discard	crossover
8544	5.025	ownership_language+emotional_labeling	discard	swap_the_feel_felt_found_for_emotional_labeling
8545	5.450	ownership_language	discard	remove_the_feel_felt_found
8546	5.013	the_feel_felt_found+ownership_language+emotional_labeling	discard	add_emotional_labeling
8547	5.450	the_feel_felt_found+ownership_language+never_say_calm_down	discard	add_never_say_calm_down
8548	5.213	the_feel_felt_found+ownership_language	discard	crossover
8549	5.425	the_feel_felt_found+ownership_language+energy_matching	discard	add_energy_matching
8550	5.225	the_feel_felt_found+ownership_language+mirroring	discard	add_mirroring
8551	5.112	ownership_language	discard	remove_the_feel_felt_found
8552	5.138	ownership_language+emotional_labeling	discard	swap_the_feel_felt_found_for_emotional_labeling
8553	4.700	the_feel_felt_found+ownership_language	discard	temp_0.70
8554	5.138	the_feel_felt_found	discard	crossover
8555	5.450	ownership_language+emotional_labeling	discard	swap_the_feel_felt_found_for_emotional_labeling
8556	5.450	the_feel_felt_found+ownership_language+mirroring	discard	add_mirroring
8557	5.225	the_feel_felt_found+ownership_language	discard	crossover
8558	5.013	ownership_language+mirroring	discard	swap_the_feel_felt_found_for_mirroring
8559	5.200	the_feel_felt_found	discard	crossover
8560	5.138	the_feel_felt_found+ownership_language+proactive_extras	discard	add_proactive_extras
8561	5.425	ownership_language+warmth_injection	discard	swap_the_feel_felt_found_for_warmth_injection
8562	5.650	the_feel_felt_found+ownership_language+genuine_admission	discard	add_genuine_admission
8563	5.450	the_feel_felt_found+ownership_language	discard	tone_change
8564	5.450	ownership_language+energy_matching	discard	swap_the_feel_felt_found_for_energy_matching
8565	5.237	the_feel_felt_found+ownership_language	discard	tone_change
8566	4.987	the_feel_felt_found+ownership_language+warmth_injection	discard	add_warmth_injection
8567	5.325	the_feel_felt_found	discard	crossover
8568	5.175	the_feel_felt_found	discard	remove_ownership_language
8569	5.325	the_feel_felt_found+ownership_language+mirroring	discard	add_mirroring
8570	5.000	the_feel_felt_found+ownership_language	discard	temp_0.90
8571	5.550	the_feel_felt_found+ownership_language	discard	crossover
8572	4.513	the_feel_felt_found+ownership_language	discard	temp_0.85
8573	4.675	the_feel_felt_found+ownership_language+energy_matching	discard	add_energy_matching
8574	5.225	the_feel_felt_found+ownership_language+genuine_admission	discard	add_genuine_admission
8575	5.138	the_feel_felt_found+ownership_language+validation_before_solution	discard	add_validation_before_solution
8576	5.425	the_feel_felt_found+ownership_language	discard	temp_0.75
8577	5.338	the_feel_felt_found+mirroring	discard	swap_ownership_language_for_mirroring
8578	5.237	ownership_language+mirroring	discard	swap_the_feel_felt_found_for_mirroring
8579	5.013	the_feel_felt_found+ownership_language+proactive_extras	discard	add_proactive_extras
8580	5.238	the_feel_felt_found+ownership_language	discard	temp_0.70
8581	5.325	the_feel_felt_found+ownership_language	discard	crossover
8582	5.138	the_feel_felt_found+ownership_language+personal_touch	discard	add_personal_touch
8583	5.013	the_feel_felt_found+ownership_language	discard	tone_change
8584	5.650	the_feel_felt_found+ownership_language+personal_touch	discard	add_personal_touch
8585	4.825	the_feel_felt_found+ownership_language	discard	tone_change
8586	4.925	ownership_language	discard	remove_the_feel_felt_found
8587	5.450	the_feel_felt_found+ownership_language	discard	temp_0.75
8588	4.888	the_feel_felt_found+ownership_language	discard	temp_0.90
8589	5.112	the_feel_felt_found+strategic_agreement	discard	swap_ownership_language_for_strategic_agreement
8590	5.137	the_feel_felt_found+ownership_language	discard	crossover
8591	4.888	the_feel_felt_found+ownership_language+strategic_agreement	discard	add_strategic_agreement
8592	5.450	the_feel_felt_found+mirroring	discard	swap_ownership_language_for_mirroring
8593	5.650	the_feel_felt_found+ownership_language	discard	crossover
8594	5.350	the_feel_felt_found+ownership_language	discard	tone_change
8595	5.138	the_feel_felt_found+ownership_language	discard	crossover
8596	5.138	none	discard	crossover
8597	5.013	the_feel_felt_found	discard	remove_ownership_language
8598	4.925	ownership_language	discard	remove_the_feel_felt_found
8599	4.800	ownership_language	discard	crossover
8600	5.450	the_feel_felt_found+ownership_language	discard	tone_change
8601	5.325	the_feel_felt_found+ownership_language	discard	crossover
8602	4.700	the_feel_felt_found+ownership_language+genuine_admission	discard	add_genuine_admission
8603	5.650	the_feel_felt_found+ownership_language	discard	tone_change
8604	5.013	the_feel_felt_found+ownership_language	discard	temp_0.85
8605	5.650	the_feel_felt_found+ownership_language	discard	tone_change
8606	5.325	the_feel_felt_found+ownership_language+casual_professionalism	discard	add_casual_professionalism
8607	5.425	ownership_language	discard	crossover
8608	5.450	the_feel_felt_found+ownership_language+personal_touch	discard	add_personal_touch
8609	5.550	the_feel_felt_found	discard	crossover
8610	5.550	the_feel_felt_found+ownership_language	discard	crossover
8611	4.800	the_feel_felt_found+ownership_language	discard	tone_change
8612	5.025	the_feel_felt_found+ownership_language	discard	tone_change
8613	5.013	ownership_language	discard	crossover
8614	5.125	the_feel_felt_found+ownership_language	discard	tone_change
8615	5.112	the_feel_felt_found+ownership_language+mirroring	discard	add_mirroring
8616	5.013	the_feel_felt_found+ownership_language	discard	crossover
8617	5.137	the_feel_felt_found+ownership_language	discard	temp_0.70
8618	5.425	the_feel_felt_found+ownership_language	discard	temp_0.70
8619	5.037	ownership_language+genuine_admission	discard	swap_the_feel_felt_found_for_genuine_admission
8620	5.138	the_feel_felt_found	discard	crossover
8621	5.037	the_feel_felt_found+ownership_language	discard	tone_change
8622	4.925	the_feel_felt_found+ownership_language+personal_touch	discard	add_personal_touch
8623	5.450	the_feel_felt_found	discard	remove_ownership_language
8624	5.225	ownership_language	discard	crossover
8625	5.213	the_feel_felt_found+ownership_language	discard	tone_change
8626	5.200	the_feel_felt_found+ownership_language	discard	temp_0.65
8627	4.825	the_feel_felt_found+ownership_language	discard	crossover
8628	4.925	the_feel_felt_found+ownership_language	discard	tone_change
8629	5.550	the_feel_felt_found+ownership_language	discard	temp_0.90
8630	5.138	the_feel_felt_found+ownership_language	discard	tone_change
8631	5.238	the_feel_felt_found+ownership_language	discard	tone_change
8632	5.450	the_feel_felt_found+ownership_language	discard	temp_0.85
8633	4.800	the_feel_felt_found+strategic_agreement	discard	swap_ownership_language_for_strategic_agreement
8634	5.238	the_feel_felt_found+ownership_language	discard	tone_change
