generation	eq_score	techniques	status	description
9736	4.725	the_feel_felt_found+ownership_language+concrete_next_steps	discard	add_concrete_next_steps
9737	5.425	the_feel_felt_found+ownership_language+never_say_calm_down	discard	add_never_say_calm_down
9738	5.325	the_feel_felt_found+personal_touch	discard	swap_ownership_language_for_personal_touch
9739	5.425	ownership_language+strategic_agreement	discard	swap_the_feel_felt_found_for_strategic_agreement
9740	5.350	the_feel_felt_found+ownership_language+energy_matching	discard	add_energy_matching
9741	5.450	the_feel_felt_found+ownership_language+warmth_injection	discard	add_warmth_injection
9742	5.113	the_feel_felt_found+ownership_language	discard	temp_0.75
9743	5.137	the_feel_felt_found+ownership_language	discard	tone_change
9744	5.237	the_feel_felt_found+ownership_language+concrete_next_steps	discard	add_concrete_next_steps
9745	5.338	the_feel_felt_found	discard	crossover
9746	5.237	the_feel_felt_found+ownership_language	discard	temp_0.90
9747	5.550	the_feel_felt_found+ownership_language	discard	tone_change
9748	5.237	the_feel_felt_found+ownership_language+concrete_next_steps	discard	add_concrete_next_steps
9749	5.550	the_feel_felt_found	discard	crossover
9750	5.088	the_feel_felt_found+ownership_language	discard	tone_change
9751	5.238	the_feel_felt_found+ownership_language	discard	tone_change
9752	4.612	ownership_language+energy_matching	discard	swap_the_feel_felt_found_for_energy_matching
9753	4.888	the_feel_felt_found+ownership_language	discard	crossover
9754	5.138	the_feel_felt_found+ownership_language	discard	temp_0.85
9755	4.925	the_feel_felt_found+ownership_language	discard	tone_change
9756	5.138	the_feel_felt_found+ownership_language+validation_before_solution	discard	add_validation_before_solution
9757	4.925	the_feel_felt_found+ownership_language+warmth_injection	discard	add_warmth_injection
9758	5.550	the_feel_felt_found+ownership_language	discard	tone_change
9759	5.550	ownership_language	discard	crossover
9760	5.138	the_feel_felt_found+ownership_language	discard	temp_0.90
9761	5.138	the_feel_felt_found+ownership_language	discard	tone_change
9762	4.888	the_feel_felt_found+ownership_language+casual_professionalism	discard	add_casual_professionalism
9763	5.338	the_feel_felt_found+ownership_language	discard	tone_change
9764	5.650	the_feel_felt_found+ownership_language+strategic_agreement	discard	add_strategic_agreement
9765	5.425	the_feel_felt_found+ownership_language	discard	temp_0.90
9766	5.450	the_feel_felt_found+ownership_language	discard	temp_0.85
9767	5.013	ownership_language+casual_professionalism	discard	swap_the_feel_felt_found_for_casual_professionalism
9768	4.825	the_feel_felt_found+ownership_language	discard	tone_change
9769	5.013	the_feel_felt_found	discard	crossover
9770	5.200	the_feel_felt_found	discard	crossover
9771	4.612	the_feel_felt_found+ownership_language	discard	temp_0.95
9772	5.650	the_feel_felt_found+ownership_language+genuine_admission	discard	add_genuine_admission
9773	5.400	the_feel_felt_found+ownership_language	discard	tone_change
9774	5.075	ownership_language	discard	crossover
9775	5.138	the_feel_felt_found+ownership_language+never_say_calm_down	discard	add_never_say_calm_down
9776	5.450	the_feel_felt_found+ownership_language	discard	tone_change
9777	5.013	the_feel_felt_found+ownership_language	discard	tone_change
9778	5.175	the_feel_felt_found+ownership_language	discard	crossover
9779	5.425	the_feel_felt_found+ownership_language	discard	tone_change
9780	4.825	ownership_language+warmth_injection	discard	swap_the_feel_felt_found_for_warmth_injection
9781	5.138	ownership_language	discard	crossover
9782	5.138	ownership_language+casual_professionalism	discard	swap_the_feel_felt_found_for_casual_professionalism
9783	5.237	the_feel_felt_found+ownership_language+emotional_labeling	discard	add_emotional_labeling
9784	5.238	the_feel_felt_found+ownership_language	discard	tone_change
9785	5.425	the_feel_felt_found+ownership_language+emotional_labeling	discard	add_emotional_labeling
9786	5.450	the_feel_felt_found+ownership_language	discard	tone_change
9787	5.325	the_feel_felt_found+ownership_language	discard	tone_change
9788	5.350	ownership_language	discard	remove_the_feel_felt_found
9789	5.013	the_feel_felt_found+ownership_language	discard	temp_0.85
9790	5.325	the_feel_felt_found+strategic_agreement	discard	swap_ownership_language_for_strategic_agreement
9791	5.650	the_feel_felt_found+ownership_language	discard	temp_0.75
9792	5.450	the_feel_felt_found+ownership_language+warmth_injection	discard	add_warmth_injection
9793	5.325	ownership_language+emotional_labeling	discard	swap_the_feel_felt_found_for_emotional_labeling
9794	5.013	the_feel_felt_found+ownership_language	discard	temp_0.70
9795	4.925	ownership_language	discard	crossover
9796	5.112	the_feel_felt_found+ownership_language+emotional_labeling	discard	add_emotional_labeling
9797	5.325	ownership_language	discard	remove_the_feel_felt_found
9798	5.350	the_feel_felt_found+ownership_language	discard	temp_0.90
9799	4.888	the_feel_felt_found+ownership_language+strategic_agreement	discard	add_strategic_agreement
9800	5.013	the_feel_felt_found+ownership_language	discard	tone_change
9801	5.425	the_feel_felt_found+concrete_next_steps	discard	swap_ownership_language_for_concrete_next_steps
9802	5.425	the_feel_felt_found+ownership_language+personal_touch	discard	add_personal_touch
9803	5.550	ownership_language	discard	crossover
9804	5.237	the_feel_felt_found+ownership_language	discard	temp_0.65
9805	5.325	the_feel_felt_found+ownership_language+genuine_admission	discard	add_genuine_admission
9806	5.325	the_feel_felt_found	discard	remove_ownership_language
9807	5.138	the_feel_felt_found	discard	crossover
9808	5.337	the_feel_felt_found+ownership_language+personal_touch	discard	add_personal_touch
9809	4.513	ownership_language	discard	crossover
9810	5.138	the_feel_felt_found+ownership_language	discard	temp_0.90
9811	5.237	ownership_language+concrete_next_steps	discard	swap_the_feel_felt_found_for_concrete_next_steps
9812	5.325	the_feel_felt_found+never_say_calm_down	discard	swap_ownership_language_for_never_say_calm_down
9813	4.913	ownership_language+strategic_agreement	discard	swap_the_feel_felt_found_for_strategic_agreement
9814	5.325	the_feel_felt_found	discard	crossover
9815	5.037	the_feel_felt_found+ownership_language	discard	crossover
9816	5.550	the_feel_felt_found+ownership_language+mirroring	discard	add_mirroring
9817	5.450	the_feel_felt_found+ownership_language+emotional_labeling	discard	add_emotional_labeling
9818	5.025	the_feel_felt_found	discard	crossover
9819	5.325	the_feel_felt_found+ownership_language	discard	crossover
9820	4.888	ownership_language	discard	crossover
9821	5.112	the_feel_felt_found+ownership_language+proactive_extras	discard	add_proactive_extras
9822	5.325	the_feel_felt_found+ownership_language	discard	crossover
9823	5.350	the_feel_felt_found+ownership_language+energy_matching	discard	add_energy_matching
9824	5.425	the_feel_felt_found+ownership_language	discard	tone_change
9825	4.925	the_feel_felt_found+ownership_language+validation_before_solution	discard	add_validation_before_solution
9826	5.237	the_feel_felt_found+ownership_language	discard	tone_change
9827	5.550	the_feel_felt_found+ownership_language	discard	tone_change
9828	5.550	the_feel_felt_found+ownership_language+never_say_calm_down	discard	add_never_say_calm_down
9829	5.438	the_feel_felt_found+ownership_language	discard	tone_change
9830	5.450	ownership_language	discard	crossover
9831	5.238	the_feel_felt_found+ownership_language	discard	crossover
9832	4.925	the_feel_felt_found+ownership_language	discard	tone_change
9833	5.037	the_feel_felt_found+genuine_admission	discard	swap_ownership_language_for_genuine_admission
9834	5.037	the_feel_felt_found+energy_matching	discard	swap_ownership_language_for_energy_matching
9835	5.200	the_feel_felt_found	discard	crossover
9836	5.113	the_feel_felt_found+ownership_language+warmth_injection	discard	add_warmth_injection
9837	4.925	the_feel_felt_found+ownership_language+concrete_next_steps	discard	add_concrete_next_steps
9838	5.237	the_feel_felt_found+ownership_language+energy_matching	discard	add_energy_matching
9839	5.550	the_feel_felt_found+ownership_language+never_say_calm_down	discard	add_never_say_calm_down
9840	5.525	ownership_language+casual_professionalism	discard	swap_the_feel_felt_found_for_casual_professionalism
9841	5.138	the_feel_felt_found	discard	remove_ownership_language
9842	5.550	the_feel_felt_found+ownership_language	discard	crossover
9843	5.550	the_feel_felt_found+ownership_language+strategic_agreement	discard	add_strategic_agreement
9844	4.800	the_feel_felt_found+ownership_language	discard	tone_change
9845	5.325	the_feel_felt_found+ownership_language	discard	temp_0.95
9846	5.325	ownership_language+emotional_labeling	discard	swap_the_feel_felt_found_for_emotional_labeling
9847	5.238	the_feel_felt_found+ownership_language+emotional_labeling	discard	add_emotional_labeling
9848	5.425	ownership_language+concrete_next_steps	discard	swap_the_feel_felt_found_for_concrete_next_steps
9849	5.450	the_feel_felt_found+ownership_language	discard	tone_change
9850	5.013	the_feel_felt_found+ownership_language	discard	temp_0.85
9851	5.425	the_feel_felt_found+emotional_labeling	discard	swap_ownership_language_for_emotional_labeling
9852	5.200	ownership_language	discard	crossover
9853	5.138	ownership_language+casual_professionalism	discard	swap_the_feel_felt_found_for_casual_professionalism
9854	5.550	the_feel_felt_found+ownership_language	discard	crossover
9855	5.550	the_feel_felt_found+ownership_language	discard	temp_0.65
9856	5.550	the_feel_felt_found+ownership_language	discard	tone_change
9857	5.325	ownership_language+never_say_calm_down	discard	swap_the_feel_felt_found_for_never_say_calm_down
9858	5.237	the_feel_felt_found+ownership_language+energy_matching	discard	add_energy_matching
9859	5.013	the_feel_felt_found+ownership_language+proactive_extras	discard	add_proactive_extras
9860	5.450	the_feel_felt_found+ownership_language+personal_touch	discard	add_personal_touch
9861	5.450	ownership_language+personal_touch	discard	swap_the_feel_felt_found_for_personal_touch
9862	5.138	the_feel_felt_found	discard	crossover
9863	5.100	the_feel_felt_found+ownership_language+validation_before_solution	discard	add_validation_before_solution
9864	5.138	the_feel_felt_found+ownership_language+proactive_extras	discard	add_proactive_extras
9865	5.338	the_feel_felt_found+ownership_language+genuine_admission	discard	add_genuine_admission
9866	4.700	the_feel_felt_found+ownership_language+mirroring	discard	add_mirroring
9867	4.700	ownership_language+mirroring	discard	swap_the_feel_felt_found_for_mirroring
9868	5.350	the_feel_felt_found+ownership_language	discard	tone_change
9869	5.200	the_feel_felt_found+concrete_next_steps	discard	swap_ownership_language_for_concrete_next_steps
9870	5.238	the_feel_felt_found+ownership_language+emotional_labeling	discard	add_emotional_labeling
9871	5.138	the_feel_felt_found+personal_touch	discard	swap_ownership_language_for_personal_touch
9872	5.325	the_feel_felt_found+ownership_language	discard	crossover
9873	5.650	none	discard	crossover
9874	5.325	the_feel_felt_found+ownership_language	discard	crossover
9875	4.825	ownership_language	discard	remove_the_feel_felt_found
9876	4.575	the_feel_felt_found+ownership_language	discard	crossover
9877	4.725	the_feel_felt_found+ownership_language	discard	temp_0.75
9878	5.550	the_feel_felt_found+ownership_language	discard	temp_0.65
9879	5.325	the_feel_felt_found+ownership_language	discard	tone_change
9880	4.913	the_feel_felt_found+ownership_language+proactive_extras	discard	add_proactive_extras
9881	5.650	the_feel_felt_found+ownership_language	discard	temp_0.85
9882	5.425	ownership_language	discard	crossover
9883	4.912	ownership_language+genuine_admission	discard	swap_the_feel_felt_found_for_genuine_admission
9884	5.450	the_feel_felt_found+never_say_calm_down	discard	swap_ownership_language_for_never_say_calm_down
9885	5.237	the_feel_felt_found+ownership_language+strategic_agreement	discard	add_strategic_agreement
9886	5.450	the_feel_felt_found+ownership_language+casual_professionalism	discard	add_casual_professionalism
9887	5.200	the_feel_felt_found+ownership_language	discard	temp_0.75
9888	5.325	the_feel_felt_found+warmth_injection	discard	swap_ownership_language_for_warmth_injection
9889	5.013	the_feel_felt_found+ownership_language	discard	crossover
9890	5.450	the_feel_felt_found+ownership_language+warmth_injection	discard	add_warmth_injection
9891	5.138	the_feel_felt_found+ownership_language	discard	temp_0.85
9892	5.550	the_feel_felt_found+ownership_language	discard	tone_change
9893	5.125	the_feel_felt_found+ownership_language	discard	crossover
9894	5.238	the_feel_felt_found+ownership_language	discard	crossover
9895	5.550	the_feel_felt_found+ownership_language+emotional_labeling	discard	add_emotional_labeling
9896	5.237	the_feel_felt_found+ownership_language	discard	tone_change
9897	5.550	the_feel_felt_found+ownership_language	discard	temp_0.70
9898	5.013	the_feel_felt_found+ownership_language	discard	crossover
9899	5.113	the_feel_felt_found+ownership_language+warmth_injection	discard	add_warmth_injection
9900	5.325	ownership_language+genuine_admission	discard	swap_the_feel_felt_found_for_genuine_admission
9901	5.450	the_feel_felt_found+ownership_language	discard	crossover
9902	4.925	the_feel_felt_found	discard	crossover
9903	5.550	ownership_language	discard	crossover
9904	5.025	ownership_language	discard	remove_the_feel_felt_found
9905	4.825	ownership_language+concrete_next_steps	discard	swap_the_feel_felt_found_for_concrete_next_steps
9906	5.225	the_feel_felt_found+ownership_language	discard	crossover
9907	5.113	the_feel_felt_found	discard	crossover
9908	5.338	ownership_language	discard	remove_the_feel_felt_found
9909	5.138	the_feel_felt_found+ownership_language	discard	temp_0.65
9910	5.237	none	discard	crossover
9911	5.200	the_feel_felt_found+ownership_language+validation_before_solution	discard	add_validation_before_solution
9912	5.300	the_feel_felt_found+ownership_language+proactive_extras	discard	add_proactive_extras
9913	5.450	the_feel_felt_found+ownership_language+energy_matching	discard	add_energy_matching
9914	5.113	ownership_language+proactive_extras	discard	swap_the_feel_felt_found_for_proactive_extras
9915	5.450	the_feel_felt_found+ownership_language	discard	tone_change
9916	5.138	the_feel_felt_found+ownership_language	discard	crossover
9917	5.237	the_feel_felt_found+mirroring	discard	swap_ownership_language_for_mirroring
9918	5.112	the_feel_felt_found+ownership_language	discard	tone_change
9919	5.138	the_feel_felt_found+ownership_language	discard	tone_change
9920	5.138	the_feel_felt_found+ownership_language	discard	crossover
9921	5.237	the_feel_felt_found+ownership_language+never_say_calm_down	discard	add_never_say_calm_down
9922	4.825	the_feel_felt_found+ownership_language+personal_touch	discard	add_personal_touch
9923	5.450	the_feel_felt_found+ownership_language+casual_professionalism	discard	add_casual_professionalism
9924	5.138	the_feel_felt_found+ownership_language	discard	tone_change
9925	5.450	the_feel_felt_found+ownership_language	discard	crossover
9926	5.425	the_feel_felt_found+ownership_language+genuine_admission	discard	add_genuine_admission
9927	5.237	ownership_language	discard	remove_the_feel_felt_found
9928	4.925	the_feel_felt_found	discard	crossover
9929	4.725	the_feel_felt_found+ownership_language+personal_touch	discard	add_personal_touch
9930	5.137	ownership_language+warmth_injection	discard	swap_the_feel_felt_found_for_warmth_injection
9931	5.450	the_feel_felt_found+ownership_language	discard	crossover
9932	5.338	the_feel_felt_found	discard	crossover
9933	5.750	the_feel_felt_found+ownership_language	discard	tone_change
9934	5.450	ownership_language+personal_touch	discard	swap_the_feel_felt_found_for_personal_touch
9935	5.037	the_feel_felt_found+ownership_language	discard	tone_change
9936	5.013	the_feel_felt_found+ownership_language	discard	temp_0.75
9937	5.325	ownership_language+energy_matching	discard	swap_the_feel_felt_found_for_energy_matching
9938	5.450	the_feel_felt_found	discard	crossover
9939	5.238	the_feel_felt_found	discard	remove_ownership_language
9940	5.138	the_feel_felt_found+ownership_language	discard	temp_0.90
9941	5.013	the_feel_felt_found+ownership_language	discard	temp_0.95
9942	4.812	the_feel_felt_found+ownership_language+emotional_labeling	discard	add_emotional_labeling
9943	5.225	the_feel_felt_found+ownership_language+genuine_admission	discard	add_genuine_admission
9944	5.325	the_feel_felt_found+ownership_language	discard	tone_change
9945	5.037	the_feel_felt_found+ownership_language+personal_touch	discard	add_personal_touch
9946	5.338	the_feel_felt_found+ownership_language+never_say_calm_down	discard	add_never_say_calm_down
9947	5.650	the_feel_felt_found+ownership_language+energy_matching	discard	add_energy_matching
9948	5.325	the_feel_felt_found	discard	crossover
9949	5.450	the_feel_felt_found+ownership_language+strategic_agreement	discard	add_strategic_agreement
9950	5.138	the_feel_felt_found+ownership_language	discard	temp_0.95
9951	5.112	the_feel_felt_found+ownership_language+genuine_admission	discard	add_genuine_admission
9952	5.138	the_feel_felt_found+ownership_language	discard	temp_0.70
9953	5.325	the_feel_felt_found+ownership_language	discard	temp_0.90
9954	5.338	the_feel_felt_found+ownership_language+casual_professionalism	discard	add_casual_professionalism
9955	5.450	the_feel_felt_found+ownership_language	discard	crossover
9956	5.038	the_feel_felt_found+ownership_language+energy_matching	discard	add_energy_matching
9957	5.300	the_feel_felt_found+ownership_language	discard	temp_0.65
9958	5.138	the_feel_felt_found+emotional_labeling	discard	swap_ownership_language_for_emotional_labeling
9959	5.425	the_feel_felt_found+ownership_language+concrete_next_steps	discard	add_concrete_next_steps
9960	4.575	the_feel_felt_found+ownership_language	discard	tone_change
9961	5.325	the_feel_felt_found+ownership_language	discard	tone_change
9962	4.925	the_feel_felt_found+ownership_language	discard	crossover
9963	5.650	the_feel_felt_found+ownership_language+energy_matching	discard	add_energy_matching
9964	5.337	the_feel_felt_found+ownership_language+warmth_injection	discard	add_warmth_injection
9965	5.237	ownership_language	discard	crossover
9966	5.025	the_feel_felt_found+ownership_language	discard	crossover
9967	5.400	the_feel_felt_found+ownership_language+mirroring	discard	add_mirroring
9968	5.338	the_feel_felt_found+ownership_language	discard	crossover
9969	5.325	the_feel_felt_found+ownership_language	discard	tone_change
9970	5.525	the_feel_felt_found+ownership_language	discard	tone_change
9971	5.300	the_feel_felt_found+warmth_injection	discard	swap_ownership_language_for_warmth_injection
9972	5.112	the_feel_felt_found	discard	remove_ownership_language
9973	5.137	the_feel_felt_found+ownership_language	discard	temp_0.95
9974	5.450	the_feel_felt_found+ownership_language	discard	tone_change
9975	5.525	the_feel_felt_found+ownership_language+validation_before_solution	discard	add_validation_before_solution
9976	5.013	the_feel_felt_found+ownership_language	discard	tone_change
9977	5.450	the_feel_felt_found+ownership_language+proactive_extras	discard	add_proactive_extras
9978	5.138	the_feel_felt_found+ownership_language	discard	tone_change
9979	4.612	the_feel_felt_found+ownership_language	discard	tone_change
9980	5.138	the_feel_felt_found+ownership_language	discard	crossover
9981	5.112	the_feel_felt_found+ownership_language	discard	temp_0.85
9982	5.138	the_feel_felt_found+ownership_language	discard	temp_0.85
9983	5.550	the_feel_felt_found	discard	remove_ownership_language
9984	5.212	the_feel_felt_found+ownership_language	discard	crossover
9985	5.237	the_feel_felt_found+ownership_language+genuine_admission	discard	add_genuine_admission
9986	5.138	the_feel_felt_found+ownership_language	discard	temp_0.70
9987	5.450	the_feel_felt_found+casual_professionalism	discard	swap_ownership_language_for_casual_professionalism
9988	5.325	the_feel_felt_found+ownership_language+energy_matching	discard	add_energy_matching
9989	5.300	ownership_language+mirroring	discard	swap_the_feel_felt_found_for_mirroring
9990	5.013	the_feel_felt_found+ownership_language+never_say_calm_down	discard	add_never_say_calm_down
9991	4.888	the_feel_felt_found+ownership_language+validation_before_solution	discard	add_validation_before_solution
9992	4.800	the_feel_felt_found+ownership_language+strategic_agreement	discard	add_strategic_agreement
9993	5.325	the_feel_felt_found	discard	remove_ownership_language
9994	5.325	ownership_language+casual_professionalism	discard	swap_the_feel_felt_found_for_casual_professionalism
9995	5.325	the_feel_felt_found+ownership_language	discard	crossover
9996	5.200	the_feel_felt_found+ownership_language+proactive_extras	discard	add_proactive_extras
9997	5.113	the_feel_felt_found+ownership_language	discard	temp_0.70
9998	4.987	ownership_language+personal_touch	discard	swap_the_feel_felt_found_for_personal_touch
9999	5.013	the_feel_felt_found+ownership_language	discard	temp_0.95
10000	5.525	ownership_language+concrete_next_steps	discard	swap_the_feel_felt_found_for_concrete_next_steps
10001	5.550	the_feel_felt_found+ownership_language	discard	temp_0.95
10002	5.425	the_feel_felt_found+ownership_language	discard	crossover
10003	5.325	the_feel_felt_found+ownership_language+casual_professionalism	discard	add_casual_professionalism
10004	5.025	the_feel_felt_found+ownership_language+emotional_labeling	discard	add_emotional_labeling
10005	5.450	the_feel_felt_found+ownership_language	discard	crossover
10006	5.425	the_feel_felt_found+ownership_language	discard	tone_change
10007	5.325	the_feel_felt_found+ownership_language	discard	tone_change
10008	5.425	the_feel_felt_found+ownership_language	discard	temp_0.85
