generation	eq_score	techniques	status	description
5875	5.138	the_feel_felt_found+ownership_language+concrete_next_steps	discard	add_concrete_next_steps
5876	5.338	the_feel_felt_found+ownership_language	discard	temp_0.70
5877	5.013	the_feel_felt_found+ownership_language+strategic_agreement	discard	add_strategic_agreement
5878	5.425	the_feel_felt_found+ownership_language	discard	tone_change
5879	5.138	the_feel_felt_found	discard	crossover
5880	5.550	ownership_language+never_say_calm_down	discard	swap_the_feel_felt_found_for_never_say_calm_down
5881	5.350	ownership_language	discard	remove_the_feel_felt_found
5882	5.238	the_feel_felt_found	discard	crossover
5883	5.550	the_feel_felt_found+ownership_language+personal_touch	discard	add_personal_touch
5884	5.550	the_feel_felt_found+ownership_language	discard	crossover
5885	5.112	the_feel_felt_found+ownership_language+strategic_agreement	discard	add_strategic_agreement
5886	4.925	the_feel_felt_found+ownership_language	discard	tone_change
5887	4.912	the_feel_felt_found	discard	crossover
5888	4.825	the_feel_felt_found+ownership_language	discard	tone_change
5889	5.325	the_feel_felt_found+ownership_language	discard	temp_0.90
5890	5.238	the_feel_felt_found+ownership_language	discard	tone_change
5891	4.888	the_feel_felt_found+ownership_language+casual_professionalism	discard	add_casual_professionalism
5892	5.237	the_feel_felt_found+ownership_language	discard	tone_change
5893	5.550	none	discard	crossover
5894	5.450	the_feel_felt_found+ownership_language	discard	crossover
5895	5.650	the_feel_felt_found+concrete_next_steps	discard	swap_ownership_language_for_concrete_next_steps
5896	4.825	the_feel_felt_found+ownership_language	discard	tone_change
5897	5.325	the_feel_felt_found+ownership_language	discard	tone_change
5898	4.825	the_feel_felt_found+ownership_language+proactive_extras	discard	add_proactive_extras
5899	5.438	the_feel_felt_found+ownership_language+genuine_admission	discard	add_genuine_admission
5900	5.138	the_feel_felt_found+ownership_language	discard	temp_0.90
5901	5.038	the_feel_felt_found	discard	crossover
5902	4.612	the_feel_felt_found	discard	crossover
5903	5.425	the_feel_felt_found+ownership_language	discard	crossover
5904	5.138	the_feel_felt_found+ownership_language+casual_professionalism	discard	add_casual_professionalism
5905	5.450	the_feel_felt_found+ownership_language	discard	temp_0.95
5906	5.325	the_feel_felt_found+ownership_language	discard	crossover
5907	5.425	the_feel_felt_found+ownership_language+genuine_admission	discard	add_genuine_admission
5908	5.650	the_feel_felt_found+ownership_language	discard	crossover
5909	5.025	the_feel_felt_found+casual_professionalism	discard	swap_ownership_language_for_casual_professionalism
5910	5.450	the_feel_felt_found+ownership_language+mirroring	discard	add_mirroring
5911	5.450	the_feel_felt_found+ownership_language	discard	tone_change
5912	4.925	the_feel_felt_found+ownership_language+energy_matching	discard	add_energy_matching
5913	5.650	ownership_language	discard	crossover
5914	5.550	the_feel_felt_found+ownership_language+emotional_labeling	discard	add_emotional_labeling
5915	4.913	the_feel_felt_found+ownership_language	discard	crossover
5916	5.238	the_feel_felt_found+ownership_language+personal_touch	discard	add_personal_touch
5917	5.525	the_feel_felt_found+warmth_injection	discard	swap_ownership_language_for_warmth_injection
5918	4.825	the_feel_felt_found+warmth_injection	discard	swap_ownership_language_for_warmth_injection
5919	5.450	the_feel_felt_found+concrete_next_steps	discard	swap_ownership_language_for_concrete_next_steps
5920	5.075	the_feel_felt_found+ownership_language	discard	tone_change
5921	5.550	the_feel_felt_found+concrete_next_steps	discard	swap_ownership_language_for_concrete_next_steps
5922	5.013	the_feel_felt_found+ownership_language+genuine_admission	discard	add_genuine_admission
5923	5.225	the_feel_felt_found+ownership_language	discard	tone_change
5924	5.138	the_feel_felt_found+ownership_language	discard	temp_0.95
5925	5.450	the_feel_felt_found+ownership_language	discard	temp_0.85
5926	5.325	the_feel_felt_found+ownership_language+never_say_calm_down	discard	add_never_say_calm_down
5927	5.450	ownership_language	discard	remove_the_feel_felt_found
5928	5.037	the_feel_felt_found+ownership_language	discard	tone_change
5929	4.825	the_feel_felt_found+ownership_language	discard	tone_change
5930	5.325	the_feel_felt_found+ownership_language+mirroring	discard	add_mirroring
5931	5.325	the_feel_felt_found+ownership_language	discard	temp_0.65
5932	5.425	ownership_language+strategic_agreement	discard	swap_the_feel_felt_found_for_strategic_agreement
5933	5.037	the_feel_felt_found+ownership_language	discard	crossover
5934	5.550	the_feel_felt_found+ownership_language+warmth_injection	discard	add_warmth_injection
5935	4.713	the_feel_felt_found+ownership_language+emotional_labeling	discard	add_emotional_labeling
5936	5.138	the_feel_felt_found+ownership_language	discard	tone_change
5937	4.888	the_feel_felt_found+ownership_language	discard	temp_0.65
5938	5.013	ownership_language+casual_professionalism	discard	swap_the_feel_felt_found_for_casual_professionalism
5939	5.237	the_feel_felt_found	discard	remove_ownership_language
5940	5.450	ownership_language	discard	remove_the_feel_felt_found
5941	5.138	the_feel_felt_found	discard	crossover
5942	5.425	the_feel_felt_found+ownership_language	discard	tone_change
5943	4.925	the_feel_felt_found	discard	remove_ownership_language
5944	4.800	the_feel_felt_found	discard	crossover
5945	5.138	the_feel_felt_found+ownership_language	discard	temp_0.90
5946	5.425	ownership_language+concrete_next_steps	discard	swap_the_feel_felt_found_for_concrete_next_steps
5947	5.325	the_feel_felt_found+mirroring	discard	swap_ownership_language_for_mirroring
5948	5.550	ownership_language	discard	crossover
5949	5.550	the_feel_felt_found+ownership_language	discard	crossover
5950	5.200	ownership_language+energy_matching	discard	swap_the_feel_felt_found_for_energy_matching
5951	5.075	none	discard	crossover
5952	5.450	the_feel_felt_found+ownership_language	discard	temp_0.70
5953	5.325	the_feel_felt_found	discard	remove_ownership_language
5954	5.550	the_feel_felt_found+ownership_language	discard	crossover
5955	5.350	ownership_language+never_say_calm_down	discard	swap_the_feel_felt_found_for_never_say_calm_down
5956	5.550	the_feel_felt_found+ownership_language	discard	tone_change
5957	5.525	the_feel_felt_found	discard	remove_ownership_language
5958	5.200	the_feel_felt_found+ownership_language	discard	tone_change
5959	5.550	the_feel_felt_found+ownership_language	discard	crossover
5960	5.650	the_feel_felt_found+ownership_language	discard	tone_change
5961	5.238	the_feel_felt_found+ownership_language	discard	tone_change
5962	5.450	the_feel_felt_found+ownership_language+validation_before_solution	discard	add_validation_before_solution
5963	5.325	the_feel_felt_found+ownership_language	discard	crossover
5964	5.450	the_feel_felt_found+ownership_language	discard	tone_change
5965	5.138	the_feel_felt_found	discard	crossover
5966	5.013	the_feel_felt_found+concrete_next_steps	discard	swap_ownership_language_for_concrete_next_steps
5967	4.825	the_feel_felt_found+ownership_language+concrete_next_steps	discard	add_concrete_next_steps
5968	5.350	the_feel_felt_found+ownership_language	discard	crossover
5969	5.238	the_feel_felt_found+ownership_language	discard	temp_0.75
5970	4.700	the_feel_felt_found+ownership_language+validation_before_solution	discard	add_validation_before_solution
5971	5.200	the_feel_felt_found+ownership_language+concrete_next_steps	discard	add_concrete_next_steps
5972	5.237	ownership_language	discard	remove_the_feel_felt_found
5973	5.450	the_feel_felt_found+ownership_language	discard	temp_0.90
5974	5.025	the_feel_felt_found+ownership_language+validation_before_solution	discard	add_validation_before_solution
5975	5.238	the_feel_felt_found+ownership_language	discard	crossover
5976	5.112	ownership_language	discard	remove_the_feel_felt_found
5977	5.425	ownership_language+mirroring	discard	swap_the_feel_felt_found_for_mirroring
5978	5.237	the_feel_felt_found+ownership_language	discard	tone_change
5979	5.450	ownership_language+warmth_injection	discard	swap_the_feel_felt_found_for_warmth_injection
5980	5.550	the_feel_felt_found+ownership_language	discard	crossover
5981	5.450	ownership_language	discard	crossover
5982	5.325	the_feel_felt_found+ownership_language	discard	tone_change
5983	5.325	the_feel_felt_found+ownership_language+validation_before_solution	discard	add_validation_before_solution
5984	5.238	ownership_language+genuine_admission	discard	swap_the_feel_felt_found_for_genuine_admission
5985	5.113	the_feel_felt_found+ownership_language	discard	temp_0.70
5986	5.200	the_feel_felt_found+casual_professionalism	discard	swap_ownership_language_for_casual_professionalism
5987	5.450	ownership_language	discard	remove_the_feel_felt_found
5988	5.325	the_feel_felt_found+ownership_language+strategic_agreement	discard	add_strategic_agreement
5989	5.550	the_feel_felt_found+ownership_language+proactive_extras	discard	add_proactive_extras
5990	5.138	the_feel_felt_found+ownership_language+validation_before_solution	discard	add_validation_before_solution
5991	5.013	the_feel_felt_found+ownership_language+validation_before_solution	discard	add_validation_before_solution
5992	5.200	ownership_language+validation_before_solution	discard	swap_the_feel_felt_found_for_validation_before_solution
5993	5.650	the_feel_felt_found+ownership_language+validation_before_solution	discard	add_validation_before_solution
5994	5.200	the_feel_felt_found+ownership_language+never_say_calm_down	discard	add_never_say_calm_down
5995	4.925	the_feel_felt_found+never_say_calm_down	discard	swap_ownership_language_for_never_say_calm_down
5996	5.450	the_feel_felt_found+ownership_language	discard	temp_0.90
5997	4.925	the_feel_felt_found+ownership_language	discard	temp_0.65
5998	5.138	the_feel_felt_found+ownership_language+personal_touch	discard	add_personal_touch
5999	5.300	the_feel_felt_found	discard	remove_ownership_language
6000	5.138	the_feel_felt_found+ownership_language	discard	crossover
6001	5.550	the_feel_felt_found+ownership_language	discard	temp_0.65
6002	5.450	the_feel_felt_found+ownership_language	discard	tone_change
6003	5.112	the_feel_felt_found+ownership_language	discard	temp_0.70
6004	5.138	the_feel_felt_found+ownership_language	discard	crossover
6005	5.138	the_feel_felt_found+ownership_language	discard	crossover
6006	5.450	the_feel_felt_found+energy_matching	discard	swap_ownership_language_for_energy_matching
6007	5.550	the_feel_felt_found+ownership_language+casual_professionalism	discard	add_casual_professionalism
6008	5.013	ownership_language+validation_before_solution	discard	swap_the_feel_felt_found_for_validation_before_solution
6009	5.137	the_feel_felt_found+ownership_language	discard	crossover
6010	5.338	the_feel_felt_found	discard	crossover
6011	4.825	the_feel_felt_found+ownership_language	discard	tone_change
6012	4.825	ownership_language	discard	crossover
6013	5.138	the_feel_felt_found+ownership_language	discard	tone_change
6014	5.013	ownership_language	discard	remove_the_feel_felt_found
6015	5.338	the_feel_felt_found+ownership_language	discard	tone_change
6016	5.450	the_feel_felt_found+ownership_language	discard	crossover
6017	5.550	the_feel_felt_found+ownership_language+emotional_labeling	discard	add_emotional_labeling
6018	5.138	the_feel_felt_found+ownership_language+casual_professionalism	discard	add_casual_professionalism
6019	5.550	the_feel_felt_found+ownership_language	discard	temp_0.75
6020	5.113	the_feel_felt_found+ownership_language+concrete_next_steps	discard	add_concrete_next_steps
6021	5.425	ownership_language	discard	remove_the_feel_felt_found
6022	5.138	the_feel_felt_found+ownership_language+never_say_calm_down	discard	add_never_say_calm_down
6023	5.237	the_feel_felt_found+ownership_language	discard	temp_0.75
6024	5.550	ownership_language+emotional_labeling	discard	swap_the_feel_felt_found_for_emotional_labeling
6025	5.013	the_feel_felt_found+ownership_language	discard	crossover
6026	5.100	the_feel_felt_found+ownership_language+validation_before_solution	discard	add_validation_before_solution
6027	5.325	the_feel_felt_found+ownership_language	discard	crossover
6028	5.450	the_feel_felt_found+ownership_language	discard	tone_change
6029	5.138	the_feel_felt_found+ownership_language	discard	tone_change
6030	5.200	ownership_language	discard	remove_the_feel_felt_found
6031	5.450	the_feel_felt_found	discard	crossover
6032	5.225	the_feel_felt_found+ownership_language+concrete_next_steps	discard	add_concrete_next_steps
6033	5.237	the_feel_felt_found+ownership_language	discard	tone_change
6034	5.138	the_feel_felt_found+ownership_language+warmth_injection	discard	add_warmth_injection
6035	5.425	the_feel_felt_found+ownership_language	discard	tone_change
6036	5.138	ownership_language+validation_before_solution	discard	swap_the_feel_felt_found_for_validation_before_solution
6037	5.200	ownership_language+never_say_calm_down	discard	swap_the_feel_felt_found_for_never_say_calm_down
6038	5.013	the_feel_felt_found+ownership_language+warmth_injection	discard	add_warmth_injection
6039	5.525	the_feel_felt_found+ownership_language	discard	tone_change
6040	5.325	the_feel_felt_found+ownership_language	discard	tone_change
6041	5.450	the_feel_felt_found+ownership_language	discard	tone_change
6042	5.550	the_feel_felt_found+ownership_language	discard	temp_0.90
6043	4.700	the_feel_felt_found	discard	remove_ownership_language
6044	5.325	the_feel_felt_found+ownership_language+casual_professionalism	discard	add_casual_professionalism
6045	5.013	ownership_language+personal_touch	discard	swap_the_feel_felt_found_for_personal_touch
6046	5.450	the_feel_felt_found+ownership_language+mirroring	discard	add_mirroring
6047	5.138	ownership_language+validation_before_solution	discard	swap_the_feel_felt_found_for_validation_before_solution
6048	5.237	the_feel_felt_found+ownership_language	discard	tone_change
6049	5.450	the_feel_felt_found+ownership_language	discard	tone_change
6050	5.450	none	discard	crossover
6051	5.138	the_feel_felt_found+ownership_language	discard	tone_change
6052	5.550	ownership_language	discard	remove_the_feel_felt_found
6053	5.325	the_feel_felt_found+proactive_extras	discard	swap_ownership_language_for_proactive_extras
6054	5.238	the_feel_felt_found	discard	crossover
6055	5.425	the_feel_felt_found+mirroring	discard	swap_ownership_language_for_mirroring
6056	5.013	the_feel_felt_found+ownership_language	discard	crossover
6057	5.750	the_feel_felt_found	discard	crossover
6058	5.112	the_feel_felt_found+ownership_language	discard	tone_change
6059	4.925	the_feel_felt_found+personal_touch	discard	swap_ownership_language_for_personal_touch
6060	5.237	ownership_language	discard	crossover
6061	5.013	the_feel_felt_found+personal_touch	discard	swap_ownership_language_for_personal_touch
6062	5.138	the_feel_felt_found+ownership_language	discard	tone_change
6063	5.325	ownership_language	discard	crossover
6064	5.338	the_feel_felt_found+ownership_language	discard	temp_0.95
6065	5.138	the_feel_felt_found+ownership_language+mirroring	discard	add_mirroring
6066	5.012	the_feel_felt_found+ownership_language+warmth_injection	discard	add_warmth_injection
6067	5.325	ownership_language	discard	crossover
6068	5.325	the_feel_felt_found	discard	remove_ownership_language
6069	5.338	ownership_language+validation_before_solution	discard	swap_the_feel_felt_found_for_validation_before_solution
6070	5.138	the_feel_felt_found+ownership_language	discard	temp_0.85
6071	5.550	the_feel_felt_found	discard	remove_ownership_language
6072	5.450	the_feel_felt_found+ownership_language	discard	tone_change
6073	5.425	ownership_language	discard	crossover
6074	5.337	the_feel_felt_found+genuine_admission	discard	swap_ownership_language_for_genuine_admission
6075	5.138	the_feel_felt_found+ownership_language+energy_matching	discard	add_energy_matching
6076	5.425	the_feel_felt_found	discard	remove_ownership_language
6077	5.325	the_feel_felt_found	discard	crossover
6078	5.225	the_feel_felt_found+ownership_language+energy_matching	discard	add_energy_matching
6079	5.325	the_feel_felt_found+ownership_language	discard	crossover
6080	5.138	the_feel_felt_found+ownership_language+strategic_agreement	discard	add_strategic_agreement
6081	5.425	the_feel_felt_found+ownership_language	discard	tone_change
6082	5.013	the_feel_felt_found+ownership_language+personal_touch	discard	add_personal_touch
6083	5.325	the_feel_felt_found+ownership_language	discard	crossover
6084	5.088	the_feel_felt_found+ownership_language	discard	tone_change
6085	5.013	the_feel_felt_found+ownership_language	discard	temp_0.75
6086	5.112	the_feel_felt_found+ownership_language+validation_before_solution	discard	add_validation_before_solution
6087	5.075	the_feel_felt_found+ownership_language	discard	tone_change
6088	4.925	ownership_language	discard	remove_the_feel_felt_found
6089	5.225	the_feel_felt_found+ownership_language	discard	crossover
6090	5.137	the_feel_felt_found+strategic_agreement	discard	swap_ownership_language_for_strategic_agreement
6091	5.325	the_feel_felt_found+ownership_language+strategic_agreement	discard	add_strategic_agreement
6092	5.325	the_feel_felt_found+mirroring	discard	swap_ownership_language_for_mirroring
6093	5.325	the_feel_felt_found+ownership_language	discard	crossover
6094	5.450	the_feel_felt_found+ownership_language	discard	crossover
6095	5.300	the_feel_felt_found+ownership_language	discard	temp_0.65
6096	5.025	the_feel_felt_found+ownership_language	discard	temp_0.75
6097	5.550	the_feel_felt_found+emotional_labeling	discard	swap_ownership_language_for_emotional_labeling
6098	5.425	the_feel_felt_found+ownership_language	discard	temp_0.75
6099	5.112	the_feel_felt_found+ownership_language+never_say_calm_down	discard	add_never_say_calm_down
6100	5.325	the_feel_felt_found+ownership_language	discard	tone_change
6101	4.925	ownership_language	discard	remove_the_feel_felt_found
6102	5.237	ownership_language+validation_before_solution	discard	swap_the_feel_felt_found_for_validation_before_solution
6103	5.013	the_feel_felt_found+ownership_language	discard	temp_0.70
6104	5.013	the_feel_felt_found+ownership_language	discard	temp_0.75
6105	5.237	the_feel_felt_found	discard	remove_ownership_language
6106	5.138	the_feel_felt_found+ownership_language	discard	tone_change
6107	5.013	ownership_language+mirroring	discard	swap_the_feel_felt_found_for_mirroring
6108	5.325	the_feel_felt_found+ownership_language	discard	temp_0.90
6109	5.450	the_feel_felt_found+ownership_language	discard	tone_change
6110	5.338	ownership_language	discard	crossover
6111	4.700	the_feel_felt_found+ownership_language+concrete_next_steps	discard	add_concrete_next_steps
6112	5.450	the_feel_felt_found	discard	remove_ownership_language
6113	5.138	none	discard	crossover
6114	5.650	the_feel_felt_found+ownership_language+mirroring	discard	add_mirroring
6115	5.138	the_feel_felt_found+ownership_language+concrete_next_steps	discard	add_concrete_next_steps
6116	5.450	the_feel_felt_found+ownership_language	discard	crossover
6117	5.650	the_feel_felt_found+ownership_language+proactive_extras	discard	add_proactive_extras
6118	5.200	the_feel_felt_found+ownership_language	discard	crossover
6119	5.450	the_feel_felt_found	discard	remove_ownership_language
6120	5.550	the_feel_felt_found+ownership_language+never_say_calm_down	discard	add_never_say_calm_down
6121	4.888	the_feel_felt_found+proactive_extras	discard	swap_ownership_language_for_proactive_extras
6122	4.912	the_feel_felt_found+ownership_language	discard	temp_0.90
6123	5.650	the_feel_felt_found+ownership_language	discard	tone_change
6124	5.450	the_feel_felt_found+ownership_language	discard	temp_0.85
6125	5.325	the_feel_felt_found+ownership_language+personal_touch	discard	add_personal_touch
6126	4.912	ownership_language+warmth_injection	discard	swap_the_feel_felt_found_for_warmth_injection
6127	5.425	the_feel_felt_found	discard	remove_ownership_language
6128	5.112	the_feel_felt_found	discard	remove_ownership_language
6129	5.350	the_feel_felt_found+ownership_language+strategic_agreement	discard	add_strategic_agreement
6130	5.013	the_feel_felt_found+concrete_next_steps	discard	swap_ownership_language_for_concrete_next_steps
6131	5.112	the_feel_felt_found+casual_professionalism	discard	swap_ownership_language_for_casual_professionalism
6132	5.325	the_feel_felt_found+ownership_language	discard	temp_0.95
6133	5.225	the_feel_felt_found+ownership_language+energy_matching	discard	add_energy_matching
6134	5.200	the_feel_felt_found+ownership_language	discard	temp_0.75
6135	5.138	ownership_language	discard	crossover
6136	5.138	the_feel_felt_found+ownership_language	discard	temp_0.75
6137	5.300	the_feel_felt_found+ownership_language+warmth_injection	discard	add_warmth_injection
6138	5.138	ownership_language	discard	crossover
6139	5.750	the_feel_felt_found+ownership_language+never_say_calm_down	discard	add_never_say_calm_down
6140	5.425	ownership_language+concrete_next_steps	discard	swap_the_feel_felt_found_for_concrete_next_steps
6141	5.425	the_feel_felt_found+ownership_language+proactive_extras	discard	add_proactive_extras
6142	4.925	the_feel_felt_found+ownership_language+energy_matching	discard	add_energy_matching
6143	5.450	the_feel_felt_found+strategic_agreement	discard	swap_ownership_language_for_strategic_agreement
6144	5.425	the_feel_felt_found+ownership_language	discard	tone_change
6145	5.425	the_feel_felt_found+ownership_language+emotional_labeling	discard	add_emotional_labeling
6146	5.013	ownership_language+concrete_next_steps	discard	swap_the_feel_felt_found_for_concrete_next_steps
6147	4.800	the_feel_felt_found+ownership_language	discard	temp_0.75
6148	5.550	the_feel_felt_found+ownership_language	discard	tone_change
6149	5.425	ownership_language+mirroring	discard	swap_the_feel_felt_found_for_mirroring
6150	5.213	the_feel_felt_found+ownership_language	discard	crossover
