generation	eq_score	techniques	status	description
16851	5.138	ownership_language	discard	crossover
16852	5.237	ownership_language+personal_touch	discard	swap_the_feel_felt_found_for_personal_touch
16853	5.450	the_feel_felt_found+ownership_language	discard	tone_change
16854	5.450	ownership_language+personal_touch	discard	swap_the_feel_felt_found_for_personal_touch
16855	5.112	the_feel_felt_found	discard	remove_ownership_language
16856	5.450	the_feel_felt_found+ownership_language+personal_touch	discard	add_personal_touch
16857	5.650	the_feel_felt_found+ownership_language+casual_professionalism	discard	add_casual_professionalism
16858	5.325	the_feel_felt_found+ownership_language	discard	temp_0.85
16859	5.338	the_feel_felt_found+ownership_language	discard	temp_0.95
16860	4.825	the_feel_felt_found+genuine_admission	discard	swap_ownership_language_for_genuine_admission
16861	5.338	the_feel_felt_found+ownership_language	discard	tone_change
16862	5.525	the_feel_felt_found+ownership_language	discard	tone_change
16863	5.237	the_feel_felt_found+ownership_language	discard	temp_0.65
16864	5.138	the_feel_felt_found	discard	crossover
16865	4.800	the_feel_felt_found+ownership_language	discard	crossover
16866	5.138	the_feel_felt_found	discard	remove_ownership_language
16867	5.237	ownership_language	discard	crossover
16868	4.700	the_feel_felt_found+ownership_language+genuine_admission	discard	add_genuine_admission
16869	4.800	ownership_language	discard	crossover
16870	5.450	the_feel_felt_found+ownership_language	discard	tone_change
16871	5.225	the_feel_felt_found+ownership_language+never_say_calm_down	discard	add_never_say_calm_down
16872	5.450	the_feel_felt_found+ownership_language	discard	temp_0.95
16873	5.450	ownership_language+energy_matching	discard	swap_the_feel_felt_found_for_energy_matching
16874	5.138	ownership_language	discard	crossover
16875	5.550	ownership_language	discard	crossover
16876	5.450	the_feel_felt_found	discard	crossover
16877	4.800	the_feel_felt_found+ownership_language+personal_touch	discard	add_personal_touch
16878	5.138	ownership_language+proactive_extras	discard	swap_the_feel_felt_found_for_proactive_extras
16879	5.013	ownership_language	discard	remove_the_feel_felt_found
16880	5.138	the_feel_felt_found+ownership_language	discard	crossover
16881	5.237	the_feel_felt_found+ownership_language	discard	temp_0.95
16882	4.800	the_feel_felt_found+ownership_language	discard	tone_change
16883	5.237	the_feel_felt_found	discard	remove_ownership_language
16884	5.550	ownership_language	discard	remove_the_feel_felt_found
16885	5.550	the_feel_felt_found	discard	crossover
16886	4.863	the_feel_felt_found+ownership_language+emotional_labeling	discard	add_emotional_labeling
16887	5.200	the_feel_felt_found+ownership_language	discard	tone_change
16888	4.825	the_feel_felt_found+ownership_language	discard	tone_change
16889	4.925	the_feel_felt_found+mirroring	discard	swap_ownership_language_for_mirroring
16890	5.450	ownership_language+strategic_agreement	discard	swap_the_feel_felt_found_for_strategic_agreement
16891	5.025	ownership_language+personal_touch	discard	swap_the_feel_felt_found_for_personal_touch
16892	5.325	the_feel_felt_found+ownership_language	discard	temp_0.95
16893	5.037	the_feel_felt_found+ownership_language+proactive_extras	discard	add_proactive_extras
16894	5.450	ownership_language+mirroring	discard	swap_the_feel_felt_found_for_mirroring
16895	5.013	the_feel_felt_found+ownership_language	discard	tone_change
16896	5.237	the_feel_felt_found+ownership_language	discard	temp_0.95
16897	5.450	the_feel_felt_found+ownership_language+mirroring	discard	add_mirroring
16898	5.425	the_feel_felt_found+ownership_language	discard	crossover
16899	4.825	the_feel_felt_found	discard	remove_ownership_language
16900	5.200	ownership_language+emotional_labeling	discard	swap_the_feel_felt_found_for_emotional_labeling
16901	5.300	the_feel_felt_found+ownership_language	discard	tone_change
16902	5.550	ownership_language+emotional_labeling	discard	swap_the_feel_felt_found_for_emotional_labeling
16903	5.325	the_feel_felt_found+casual_professionalism	discard	swap_ownership_language_for_casual_professionalism
16904	5.325	the_feel_felt_found+ownership_language	discard	temp_0.70
16905	5.013	the_feel_felt_found+ownership_language	discard	temp_0.65
16906	5.450	the_feel_felt_found+ownership_language+never_say_calm_down	discard	add_never_say_calm_down
16907	5.550	the_feel_felt_found+ownership_language+genuine_admission	discard	add_genuine_admission
16908	5.088	the_feel_felt_found+ownership_language	discard	crossover
16909	5.138	the_feel_felt_found+ownership_language	discard	tone_change
16910	5.338	the_feel_felt_found+ownership_language	discard	tone_change
16911	5.237	ownership_language	discard	crossover
16912	5.550	the_feel_felt_found+ownership_language	discard	temp_0.65
16913	5.550	the_feel_felt_found+ownership_language	discard	tone_change
16914	5.138	the_feel_felt_found+ownership_language	discard	tone_change
16915	5.237	ownership_language+warmth_injection	discard	swap_the_feel_felt_found_for_warmth_injection
16916	5.200	ownership_language	discard	remove_the_feel_felt_found
16917	5.238	the_feel_felt_found+ownership_language	discard	temp_0.90
16918	5.013	ownership_language	discard	crossover
16919	5.237	the_feel_felt_found+ownership_language+warmth_injection	discard	add_warmth_injection
16920	5.138	the_feel_felt_found+ownership_language	discard	tone_change
16921	5.025	the_feel_felt_found+ownership_language	discard	crossover
16922	5.325	the_feel_felt_found+ownership_language+never_say_calm_down	discard	add_never_say_calm_down
16923	5.237	the_feel_felt_found+ownership_language	discard	crossover
16924	5.138	the_feel_felt_found+ownership_language	discard	tone_change
16925	5.013	the_feel_felt_found+ownership_language	discard	tone_change
16926	5.325	the_feel_felt_found+ownership_language	discard	tone_change
16927	5.450	the_feel_felt_found+ownership_language	discard	tone_change
16928	5.025	ownership_language+casual_professionalism	discard	swap_the_feel_felt_found_for_casual_professionalism
16929	5.550	the_feel_felt_found+ownership_language	discard	temp_0.75
16930	5.650	ownership_language	discard	remove_the_feel_felt_found
16931	5.550	ownership_language	discard	crossover
16932	5.325	the_feel_felt_found+ownership_language	discard	tone_change
16933	5.450	ownership_language	discard	remove_the_feel_felt_found
16934	5.237	the_feel_felt_found	discard	crossover
16935	4.700	the_feel_felt_found+ownership_language	discard	temp_0.75
16936	4.925	the_feel_felt_found+personal_touch	discard	swap_ownership_language_for_personal_touch
16937	4.825	the_feel_felt_found+ownership_language	discard	temp_0.65
16938	4.700	the_feel_felt_found	discard	remove_ownership_language
16939	5.450	the_feel_felt_found+ownership_language	discard	tone_change
16940	5.338	ownership_language	discard	remove_the_feel_felt_found
16941	5.137	the_feel_felt_found+ownership_language	discard	temp_0.75
16942	5.138	the_feel_felt_found+ownership_language	discard	tone_change
16943	5.325	the_feel_felt_found+ownership_language	discard	temp_0.65
16944	5.213	the_feel_felt_found+ownership_language	discard	tone_change
16945	5.325	the_feel_felt_found+ownership_language	discard	tone_change
16946	5.450	the_feel_felt_found+proactive_extras	discard	swap_ownership_language_for_proactive_extras
16947	5.450	the_feel_felt_found+ownership_language	discard	crossover
16948	5.025	the_feel_felt_found+ownership_language+validation_before_solution	discard	add_validation_before_solution
16949	5.325	none	discard	crossover
16950	5.650	the_feel_felt_found+ownership_language	discard	temp_0.70
16951	5.450	the_feel_felt_found+ownership_language	discard	tone_change
16952	5.450	the_feel_felt_found+ownership_language	discard	tone_change
16953	5.237	the_feel_felt_found+ownership_language	discard	tone_change
16954	5.013	the_feel_felt_found+ownership_language	discard	temp_0.70
16955	5.450	the_feel_felt_found+ownership_language	discard	temp_0.75
16956	5.550	the_feel_felt_found+ownership_language	discard	temp_0.75
16957	4.725	the_feel_felt_found+ownership_language	discard	crossover
16958	5.425	the_feel_felt_found+ownership_language+genuine_admission	discard	add_genuine_admission
16959	5.450	ownership_language	discard	remove_the_feel_felt_found
16960	4.938	the_feel_felt_found+ownership_language	discard	temp_0.95
16961	5.650	the_feel_felt_found+ownership_language	discard	tone_change
16962	5.175	the_feel_felt_found+ownership_language+genuine_admission	discard	add_genuine_admission
16963	5.138	the_feel_felt_found+ownership_language	discard	temp_0.95
16964	5.300	the_feel_felt_found+ownership_language	discard	temp_0.85
16965	5.450	ownership_language+warmth_injection	discard	swap_the_feel_felt_found_for_warmth_injection
16966	5.338	the_feel_felt_found+ownership_language	discard	tone_change
16967	4.825	the_feel_felt_found+emotional_labeling	discard	swap_ownership_language_for_emotional_labeling
16968	5.138	the_feel_felt_found+ownership_language	discard	temp_0.85
16969	4.513	the_feel_felt_found+ownership_language	discard	tone_change
16970	5.337	the_feel_felt_found+genuine_admission	discard	swap_ownership_language_for_genuine_admission
16971	5.037	the_feel_felt_found+ownership_language	discard	tone_change
16972	5.013	the_feel_felt_found+ownership_language	discard	temp_0.90
16973	5.238	the_feel_felt_found+ownership_language	discard	tone_change
16974	5.450	the_feel_felt_found+ownership_language	discard	tone_change
16975	5.237	the_feel_felt_found+ownership_language	discard	tone_change
16976	5.013	the_feel_felt_found+ownership_language	discard	crossover
16977	4.513	ownership_language+emotional_labeling	discard	swap_the_feel_felt_found_for_emotional_labeling
16978	5.037	the_feel_felt_found+ownership_language	discard	crossover
16979	5.138	the_feel_felt_found+ownership_language+genuine_admission	discard	add_genuine_admission
16980	5.238	the_feel_felt_found+ownership_language	discard	tone_change
16981	5.450	the_feel_felt_found+ownership_language+genuine_admission	discard	add_genuine_admission
16982	5.338	the_feel_felt_found+ownership_language	discard	tone_change
16983	5.425	ownership_language	discard	remove_the_feel_felt_found
16984	5.200	the_feel_felt_found+ownership_language	discard	tone_change
16985	5.450	the_feel_felt_found+ownership_language	discard	temp_0.65
16986	5.450	the_feel_felt_found+validation_before_solution	discard	swap_ownership_language_for_validation_before_solution
16987	5.450	ownership_language+concrete_next_steps	discard	swap_the_feel_felt_found_for_concrete_next_steps
16988	5.013	the_feel_felt_found+ownership_language+concrete_next_steps	discard	add_concrete_next_steps
16989	5.350	ownership_language	discard	remove_the_feel_felt_found
16990	5.138	none	discard	crossover
16991	5.025	the_feel_felt_found+ownership_language	discard	tone_change
16992	5.200	the_feel_felt_found+ownership_language	discard	temp_0.70
16993	5.325	none	discard	crossover
16994	4.825	the_feel_felt_found+ownership_language	discard	tone_change
16995	5.237	the_feel_felt_found+ownership_language	discard	tone_change
16996	4.800	the_feel_felt_found+ownership_language	discard	temp_0.95
16997	5.037	the_feel_felt_found+ownership_language	discard	tone_change
16998	5.450	ownership_language	discard	remove_the_feel_felt_found
16999	5.425	the_feel_felt_found+ownership_language	discard	tone_change
17000	5.525	ownership_language+energy_matching	discard	swap_the_feel_felt_found_for_energy_matching
17001	5.425	the_feel_felt_found	discard	crossover
17002	5.200	the_feel_felt_found+ownership_language+energy_matching	discard	add_energy_matching
17003	5.325	the_feel_felt_found+ownership_language	discard	temp_0.95
17004	4.925	the_feel_felt_found+casual_professionalism	discard	swap_ownership_language_for_casual_professionalism
17005	5.013	the_feel_felt_found+ownership_language+validation_before_solution	discard	add_validation_before_solution
17006	4.513	the_feel_felt_found+ownership_language+proactive_extras	discard	add_proactive_extras
17007	5.550	ownership_language	discard	remove_the_feel_felt_found
17008	5.013	the_feel_felt_found+ownership_language	discard	crossover
17009	4.700	the_feel_felt_found+ownership_language	discard	temp_0.90
17010	5.225	the_feel_felt_found+ownership_language	discard	tone_change
17011	5.425	ownership_language	discard	remove_the_feel_felt_found
17012	5.550	the_feel_felt_found+ownership_language	discard	tone_change
17013	5.138	the_feel_felt_found+ownership_language	discard	temp_0.90
17014	4.925	the_feel_felt_found+warmth_injection	discard	swap_ownership_language_for_warmth_injection
17015	5.037	the_feel_felt_found+ownership_language	discard	crossover
17016	4.613	the_feel_felt_found+ownership_language	discard	tone_change
17017	4.825	none	discard	crossover
17018	5.650	the_feel_felt_found+ownership_language	discard	tone_change
17019	4.825	the_feel_felt_found+ownership_language+concrete_next_steps	discard	add_concrete_next_steps
17020	5.138	the_feel_felt_found+ownership_language	discard	tone_change
17021	5.350	the_feel_felt_found+ownership_language+casual_professionalism	discard	add_casual_professionalism
17022	5.112	the_feel_felt_found+ownership_language	discard	crossover
17023	4.825	the_feel_felt_found	discard	crossover
17024	5.138	the_feel_felt_found	discard	crossover
17025	5.237	ownership_language	discard	crossover
17026	5.238	the_feel_felt_found+ownership_language	discard	tone_change
17027	5.238	ownership_language+personal_touch	discard	swap_the_feel_felt_found_for_personal_touch
17028	5.425	the_feel_felt_found+ownership_language	discard	crossover
17029	5.550	the_feel_felt_found+casual_professionalism	discard	swap_ownership_language_for_casual_professionalism
17030	5.237	the_feel_felt_found+ownership_language	discard	tone_change
17031	4.888	the_feel_felt_found+ownership_language	discard	tone_change
17032	5.550	the_feel_felt_found+ownership_language+genuine_admission	discard	add_genuine_admission
17033	5.325	the_feel_felt_found+ownership_language+emotional_labeling	discard	add_emotional_labeling
17034	5.450	the_feel_felt_found+ownership_language+never_say_calm_down	discard	add_never_say_calm_down
17035	5.550	ownership_language+validation_before_solution	discard	swap_the_feel_felt_found_for_validation_before_solution
17036	4.800	ownership_language+energy_matching	discard	swap_the_feel_felt_found_for_energy_matching
17037	5.425	the_feel_felt_found+ownership_language+genuine_admission	discard	add_genuine_admission
17038	5.138	the_feel_felt_found+casual_professionalism	discard	swap_ownership_language_for_casual_professionalism
17039	5.212	the_feel_felt_found+ownership_language	discard	temp_0.75
17040	5.013	the_feel_felt_found+ownership_language	discard	crossover
17041	4.913	the_feel_felt_found+personal_touch	discard	swap_ownership_language_for_personal_touch
17042	5.237	the_feel_felt_found+ownership_language	discard	crossover
17043	5.325	the_feel_felt_found+ownership_language+validation_before_solution	discard	add_validation_before_solution
17044	5.237	ownership_language	discard	crossover
17045	4.987	the_feel_felt_found+ownership_language	discard	tone_change
17046	5.550	the_feel_felt_found	discard	crossover
17047	5.013	the_feel_felt_found+ownership_language	discard	temp_0.90
17048	5.550	ownership_language	discard	crossover
17049	5.200	ownership_language+concrete_next_steps	discard	swap_the_feel_felt_found_for_concrete_next_steps
17050	5.225	the_feel_felt_found+ownership_language+emotional_labeling	discard	add_emotional_labeling
17051	5.200	ownership_language	discard	crossover
17052	5.238	the_feel_felt_found+mirroring	discard	swap_ownership_language_for_mirroring
17053	5.550	the_feel_felt_found+ownership_language	discard	tone_change
17054	5.025	ownership_language+energy_matching	discard	swap_the_feel_felt_found_for_energy_matching
17055	4.925	ownership_language+mirroring	discard	swap_the_feel_felt_found_for_mirroring
17056	4.888	ownership_language	discard	remove_the_feel_felt_found
17057	5.325	the_feel_felt_found+ownership_language+strategic_agreement	discard	add_strategic_agreement
17058	5.450	the_feel_felt_found	discard	crossover
17059	4.800	ownership_language+genuine_admission	discard	swap_the_feel_felt_found_for_genuine_admission
17060	4.800	the_feel_felt_found+ownership_language	discard	tone_change
17061	5.025	the_feel_felt_found	discard	crossover
17062	5.237	the_feel_felt_found	discard	remove_ownership_language
17063	5.425	the_feel_felt_found	discard	crossover
17064	5.013	the_feel_felt_found+ownership_language	discard	temp_0.90
17065	5.350	the_feel_felt_found+ownership_language+mirroring	discard	add_mirroring
17066	5.450	the_feel_felt_found+ownership_language	discard	tone_change
17067	5.425	the_feel_felt_found+ownership_language+strategic_agreement	discard	add_strategic_agreement
17068	5.550	the_feel_felt_found+ownership_language	discard	tone_change
17069	5.037	the_feel_felt_found	discard	crossover
17070	5.325	the_feel_felt_found+ownership_language	discard	crossover
17071	5.650	the_feel_felt_found+ownership_language	discard	tone_change
17072	5.237	the_feel_felt_found+ownership_language+genuine_admission	discard	add_genuine_admission
17073	4.888	the_feel_felt_found+ownership_language	discard	tone_change
17074	5.550	the_feel_felt_found+ownership_language	discard	tone_change
17075	5.325	the_feel_felt_found	discard	remove_ownership_language
17076	5.550	the_feel_felt_found+ownership_language+mirroring	discard	add_mirroring
17077	5.550	the_feel_felt_found	discard	crossover
17078	5.550	the_feel_felt_found+ownership_language+validation_before_solution	discard	add_validation_before_solution
17079	5.225	the_feel_felt_found	discard	remove_ownership_language
17080	5.325	the_feel_felt_found+ownership_language+concrete_next_steps	discard	add_concrete_next_steps
17081	5.138	the_feel_felt_found+ownership_language+validation_before_solution	discard	add_validation_before_solution
17082	5.425	the_feel_felt_found+ownership_language	discard	temp_0.90
17083	5.213	the_feel_felt_found+ownership_language	discard	crossover
17084	5.450	the_feel_felt_found+energy_matching	discard	swap_ownership_language_for_energy_matching
17085	5.138	the_feel_felt_found+ownership_language	discard	temp_0.65
17086	5.850	the_feel_felt_found	discard	crossover
17087	4.925	ownership_language+concrete_next_steps	discard	swap_the_feel_felt_found_for_concrete_next_steps
17088	5.550	the_feel_felt_found	discard	crossover
17089	5.550	the_feel_felt_found+ownership_language+never_say_calm_down	discard	add_never_say_calm_down
17090	5.450	the_feel_felt_found+ownership_language	discard	tone_change
17091	5.425	the_feel_felt_found+ownership_language+emotional_labeling	discard	add_emotional_labeling
17092	5.350	the_feel_felt_found+ownership_language	discard	tone_change
17093	5.450	the_feel_felt_found+ownership_language	discard	temp_0.65
17094	4.513	the_feel_felt_found+ownership_language	discard	temp_0.85
17095	5.425	the_feel_felt_found+ownership_language+emotional_labeling	discard	add_emotional_labeling
17096	4.713	the_feel_felt_found+ownership_language	discard	temp_0.95
17097	5.325	the_feel_felt_found+ownership_language	discard	tone_change
17098	5.138	the_feel_felt_found+ownership_language+never_say_calm_down	discard	add_never_say_calm_down
17099	5.013	the_feel_felt_found	discard	crossover
17100	5.350	the_feel_felt_found+ownership_language	discard	tone_change
17101	5.138	the_feel_felt_found+ownership_language	discard	crossover
17102	5.138	the_feel_felt_found+ownership_language+warmth_injection	discard	add_warmth_injection
17103	5.450	ownership_language	discard	crossover
17104	5.450	the_feel_felt_found+validation_before_solution	discard	swap_ownership_language_for_validation_before_solution
17105	5.325	the_feel_felt_found+ownership_language+casual_professionalism	discard	add_casual_professionalism
17106	5.138	the_feel_felt_found+ownership_language+mirroring	discard	add_mirroring
17107	4.513	the_feel_felt_found+ownership_language+energy_matching	discard	add_energy_matching
17108	5.100	ownership_language+never_say_calm_down	discard	swap_the_feel_felt_found_for_never_say_calm_down
17109	5.450	the_feel_felt_found+energy_matching	discard	swap_ownership_language_for_energy_matching
17110	4.987	the_feel_felt_found+ownership_language	discard	tone_change
17111	5.550	the_feel_felt_found+ownership_language+concrete_next_steps	discard	add_concrete_next_steps
17112	5.025	the_feel_felt_found+ownership_language	discard	tone_change
17113	5.425	ownership_language+warmth_injection	discard	swap_the_feel_felt_found_for_warmth_injection
17114	5.138	the_feel_felt_found+ownership_language+casual_professionalism	discard	add_casual_professionalism
17115	4.825	the_feel_felt_found+ownership_language+concrete_next_steps	discard	add_concrete_next_steps
17116	5.450	the_feel_felt_found+concrete_next_steps	discard	swap_ownership_language_for_concrete_next_steps
17117	5.450	ownership_language	discard	crossover
17118	5.100	the_feel_felt_found+ownership_language	discard	crossover
17119	5.450	the_feel_felt_found+ownership_language	discard	tone_change
17120	5.450	none	discard	crossover
17121	5.650	ownership_language	discard	crossover
17122	5.650	the_feel_felt_found+ownership_language+proactive_extras	discard	add_proactive_extras
17123	4.925	ownership_language+personal_touch	discard	swap_the_feel_felt_found_for_personal_touch
17124	5.237	the_feel_felt_found+ownership_language	discard	tone_change
17125	5.550	ownership_language	discard	crossover
17126	5.213	the_feel_felt_found+ownership_language+genuine_admission	discard	add_genuine_admission
17127	5.025	the_feel_felt_found+ownership_language	discard	temp_0.90
17128	5.200	the_feel_felt_found+ownership_language+personal_touch	discard	add_personal_touch
17129	5.850	the_feel_felt_found	discard	crossover
17130	4.938	the_feel_felt_found+ownership_language	discard	tone_change
17131	5.450	the_feel_felt_found+ownership_language	discard	temp_0.90
17132	5.237	the_feel_felt_found+ownership_language	discard	temp_0.65
