generation	eq_score	techniques	status	description
2260	5.013	the_feel_felt_found+ownership_language	discard	tone_change
2261	5.138	the_feel_felt_found+ownership_language	discard	temp_0.85
2262	5.425	the_feel_felt_found+concrete_next_steps	discard	swap_ownership_language_for_concrete_next_steps
2263	5.450	the_feel_felt_found+ownership_language	discard	crossover
2264	5.225	the_feel_felt_found+ownership_language	discard	tone_change
2265	5.425	the_feel_felt_found+ownership_language+personal_touch	discard	add_personal_touch
2266	5.325	the_feel_felt_found+ownership_language	discard	tone_change
2267	5.137	none	discard	crossover
2268	5.125	ownership_language	discard	remove_the_feel_felt_found
2269	5.325	the_feel_felt_found	discard	remove_ownership_language
2270	5.750	the_feel_felt_found+ownership_language	discard	tone_change
2271	5.237	the_feel_felt_found+ownership_language	discard	tone_change
2272	5.137	ownership_language	discard	crossover
2273	5.338	ownership_language	discard	crossover
2274	4.888	the_feel_felt_found+ownership_language	discard	tone_change
2275	5.350	the_feel_felt_found	discard	crossover
2276	4.700	ownership_language+warmth_injection	discard	swap_the_feel_felt_found_for_warmth_injection
2277	5.112	the_feel_felt_found+ownership_language	discard	crossover
2278	5.450	the_feel_felt_found+genuine_admission	discard	swap_ownership_language_for_genuine_admission
2279	5.450	the_feel_felt_found+casual_professionalism	discard	swap_ownership_language_for_casual_professionalism
2280	5.200	the_feel_felt_found	discard	remove_ownership_language
2281	5.237	the_feel_felt_found+ownership_language	discard	tone_change
2282	5.237	ownership_language+never_say_calm_down	discard	swap_the_feel_felt_found_for_never_say_calm_down
2283	5.013	the_feel_felt_found+ownership_language	discard	tone_change
2284	5.200	the_feel_felt_found+ownership_language	discard	temp_0.75
2285	5.550	the_feel_felt_found+ownership_language+concrete_next_steps	discard	add_concrete_next_steps
2286	4.800	the_feel_felt_found+casual_professionalism	discard	swap_ownership_language_for_casual_professionalism
2287	5.350	the_feel_felt_found+casual_professionalism	discard	swap_ownership_language_for_casual_professionalism
2288	5.350	the_feel_felt_found+casual_professionalism	discard	swap_ownership_language_for_casual_professionalism
2289	5.550	the_feel_felt_found+ownership_language	discard	tone_change
2290	5.338	the_feel_felt_found+ownership_language	discard	crossover
2291	5.338	ownership_language	discard	crossover
2292	4.825	the_feel_felt_found+ownership_language	discard	crossover
2293	5.237	the_feel_felt_found+ownership_language	discard	tone_change
2294	5.450	the_feel_felt_found	discard	crossover
2295	5.237	ownership_language	discard	remove_the_feel_felt_found
2296	5.425	the_feel_felt_found+ownership_language+proactive_extras	discard	add_proactive_extras
2297	5.138	ownership_language	discard	remove_the_feel_felt_found
2298	5.112	the_feel_felt_found+ownership_language	discard	tone_change
2299	4.912	the_feel_felt_found+ownership_language+concrete_next_steps	discard	add_concrete_next_steps
2300	5.450	the_feel_felt_found+ownership_language	discard	tone_change
2301	5.237	the_feel_felt_found	discard	crossover
2302	5.325	the_feel_felt_found+ownership_language	discard	tone_change
2303	4.613	the_feel_felt_found+ownership_language	discard	tone_change
2304	5.237	the_feel_felt_found+ownership_language	discard	crossover
2305	5.237	the_feel_felt_found+casual_professionalism	discard	swap_ownership_language_for_casual_professionalism
2306	5.238	the_feel_felt_found	discard	remove_ownership_language
2307	5.237	the_feel_felt_found+ownership_language	discard	tone_change
2308	5.350	the_feel_felt_found	discard	remove_ownership_language
2309	5.550	ownership_language	discard	remove_the_feel_felt_found
2310	5.438	the_feel_felt_found+ownership_language+mirroring	discard	add_mirroring
2311	4.800	the_feel_felt_found+ownership_language+proactive_extras	discard	add_proactive_extras
2312	5.450	the_feel_felt_found+ownership_language	discard	temp_0.95
2313	4.700	the_feel_felt_found+ownership_language	discard	temp_0.65
2314	4.912	the_feel_felt_found+ownership_language	discard	crossover
2315	5.438	the_feel_felt_found+warmth_injection	discard	swap_ownership_language_for_warmth_injection
2316	5.325	ownership_language+strategic_agreement	discard	swap_the_feel_felt_found_for_strategic_agreement
2317	5.425	the_feel_felt_found+ownership_language+mirroring	discard	add_mirroring
2318	5.250	the_feel_felt_found+ownership_language+never_say_calm_down	discard	add_never_say_calm_down
2319	4.700	the_feel_felt_found	discard	remove_ownership_language
2320	5.112	the_feel_felt_found+ownership_language	discard	tone_change
2321	5.300	the_feel_felt_found+ownership_language	discard	tone_change
2322	5.325	the_feel_felt_found+warmth_injection	discard	swap_ownership_language_for_warmth_injection
2323	5.138	the_feel_felt_found+ownership_language+concrete_next_steps	discard	add_concrete_next_steps
2324	5.138	ownership_language+personal_touch	discard	swap_the_feel_felt_found_for_personal_touch
2325	4.763	the_feel_felt_found+ownership_language+validation_before_solution	discard	add_validation_before_solution
2326	5.550	the_feel_felt_found+ownership_language	discard	crossover
2327	5.013	the_feel_felt_found+ownership_language	discard	crossover
2328	5.425	the_feel_felt_found+ownership_language	discard	crossover
2329	5.237	the_feel_felt_found+ownership_language+genuine_admission	discard	add_genuine_admission
2330	5.450	ownership_language	discard	crossover
2331	4.825	the_feel_felt_found	discard	remove_ownership_language
2332	5.325	the_feel_felt_found+ownership_language	discard	tone_change
2333	5.425	ownership_language+validation_before_solution	discard	swap_the_feel_felt_found_for_validation_before_solution
2334	4.700	the_feel_felt_found+ownership_language+emotional_labeling	discard	add_emotional_labeling
2335	5.013	the_feel_felt_found+ownership_language+strategic_agreement	discard	add_strategic_agreement
2336	4.888	the_feel_felt_found+ownership_language	discard	tone_change
2337	5.325	ownership_language+never_say_calm_down	discard	swap_the_feel_felt_found_for_never_say_calm_down
2338	4.975	the_feel_felt_found+ownership_language+personal_touch	discard	add_personal_touch
2339	4.800	the_feel_felt_found+ownership_language+casual_professionalism	discard	add_casual_professionalism
2340	4.987	the_feel_felt_found+ownership_language	discard	temp_0.95
2341	5.338	the_feel_felt_found+ownership_language+casual_professionalism	discard	add_casual_professionalism
2342	5.138	the_feel_felt_found+ownership_language	discard	crossover
2343	5.350	ownership_language	discard	crossover
2344	4.612	the_feel_felt_found+ownership_language+energy_matching	discard	add_energy_matching
2345	5.138	the_feel_felt_found+ownership_language+genuine_admission	discard	add_genuine_admission
2346	5.237	the_feel_felt_found+ownership_language	discard	temp_0.85
2347	5.550	the_feel_felt_found+ownership_language+strategic_agreement	discard	add_strategic_agreement
2348	5.112	ownership_language+mirroring	discard	swap_the_feel_felt_found_for_mirroring
2349	5.350	the_feel_felt_found+ownership_language	discard	temp_0.70
2350	5.325	the_feel_felt_found+ownership_language	discard	temp_0.85
2351	5.013	ownership_language+energy_matching	discard	swap_the_feel_felt_found_for_energy_matching
2352	5.250	the_feel_felt_found+ownership_language	discard	temp_0.70
2353	5.450	the_feel_felt_found+ownership_language	discard	tone_change
2354	5.013	ownership_language+mirroring	discard	swap_the_feel_felt_found_for_mirroring
2355	5.325	the_feel_felt_found+ownership_language	discard	tone_change
2356	5.550	the_feel_felt_found+ownership_language	discard	tone_change
2357	5.450	the_feel_felt_found+ownership_language	discard	tone_change
2358	5.138	the_feel_felt_found+ownership_language	discard	tone_change
2359	5.138	the_feel_felt_found+ownership_language+validation_before_solution	discard	add_validation_before_solution
2360	5.137	ownership_language	discard	crossover
2361	5.112	the_feel_felt_found+ownership_language	discard	tone_change
2362	5.237	the_feel_felt_found+ownership_language	discard	tone_change
2363	5.013	the_feel_felt_found+ownership_language	discard	temp_0.65
2364	5.013	the_feel_felt_found+ownership_language	discard	crossover
2365	4.988	the_feel_felt_found	discard	remove_ownership_language
2366	5.425	the_feel_felt_found+ownership_language+concrete_next_steps	discard	add_concrete_next_steps
2367	4.800	the_feel_felt_found+ownership_language+strategic_agreement	discard	add_strategic_agreement
2368	5.237	the_feel_felt_found	discard	remove_ownership_language
2369	5.325	the_feel_felt_found+ownership_language+proactive_extras	discard	add_proactive_extras
2370	5.013	ownership_language	discard	crossover
2371	5.550	ownership_language+validation_before_solution	discard	swap_the_feel_felt_found_for_validation_before_solution
2372	5.237	the_feel_felt_found	discard	remove_ownership_language
2373	5.450	the_feel_felt_found	discard	crossover
2374	5.237	the_feel_felt_found+ownership_language+validation_before_solution	discard	add_validation_before_solution
2375	5.550	the_feel_felt_found+emotional_labeling	discard	swap_ownership_language_for_emotional_labeling
2376	5.325	the_feel_felt_found+ownership_language	discard	tone_change
2377	5.013	ownership_language+proactive_extras	discard	swap_the_feel_felt_found_for_proactive_extras
2378	5.138	the_feel_felt_found+ownership_language	discard	crossover
2379	5.450	ownership_language	discard	remove_the_feel_felt_found
2380	5.550	the_feel_felt_found+ownership_language	discard	tone_change
2381	4.912	the_feel_felt_found+strategic_agreement	discard	swap_ownership_language_for_strategic_agreement
2382	5.425	the_feel_felt_found+ownership_language	discard	tone_change
2383	5.200	the_feel_felt_found+ownership_language	discard	tone_change
2384	5.450	the_feel_felt_found+ownership_language	discard	crossover
2385	5.550	the_feel_felt_found+ownership_language	discard	tone_change
2386	5.237	the_feel_felt_found+ownership_language	discard	tone_change
2387	5.450	the_feel_felt_found+ownership_language	discard	tone_change
2388	5.450	the_feel_felt_found+ownership_language+proactive_extras	discard	add_proactive_extras
2389	5.250	ownership_language	discard	crossover
2390	5.525	the_feel_felt_found+ownership_language+genuine_admission	discard	add_genuine_admission
2391	5.550	the_feel_felt_found+ownership_language+mirroring	discard	add_mirroring
2392	5.138	the_feel_felt_found+ownership_language+emotional_labeling	discard	add_emotional_labeling
2393	5.350	the_feel_felt_found+ownership_language+energy_matching	discard	add_energy_matching
2394	5.450	the_feel_felt_found+ownership_language	discard	temp_0.75
2395	5.138	the_feel_felt_found+never_say_calm_down	discard	swap_ownership_language_for_never_say_calm_down
2396	5.112	ownership_language+emotional_labeling	discard	swap_the_feel_felt_found_for_emotional_labeling
2397	4.613	the_feel_felt_found+ownership_language	discard	crossover
2398	5.650	ownership_language	discard	crossover
2399	5.650	the_feel_felt_found+ownership_language+validation_before_solution	discard	add_validation_before_solution
2400	5.550	the_feel_felt_found+ownership_language	discard	crossover
2401	5.350	the_feel_felt_found	discard	remove_ownership_language
2402	5.013	the_feel_felt_found+ownership_language	discard	crossover
2403	4.825	the_feel_felt_found+ownership_language	discard	temp_0.75
2404	5.100	the_feel_felt_found+ownership_language	discard	temp_0.70
2405	5.225	the_feel_felt_found+ownership_language	discard	tone_change
2406	5.338	the_feel_felt_found+ownership_language	discard	crossover
2407	5.450	the_feel_felt_found+ownership_language	discard	crossover
2408	5.112	ownership_language	discard	crossover
2409	5.013	the_feel_felt_found+ownership_language	discard	crossover
2410	5.013	the_feel_felt_found+ownership_language+concrete_next_steps	discard	add_concrete_next_steps
2411	4.825	the_feel_felt_found+ownership_language	discard	crossover
2412	5.225	the_feel_felt_found+ownership_language	discard	tone_change
2413	5.237	the_feel_felt_found+casual_professionalism	discard	swap_ownership_language_for_casual_professionalism
2414	5.450	the_feel_felt_found+ownership_language	discard	tone_change
2415	5.112	the_feel_felt_found+ownership_language	discard	temp_0.70
2416	5.300	ownership_language+never_say_calm_down	discard	swap_the_feel_felt_found_for_never_say_calm_down
2417	5.237	the_feel_felt_found+never_say_calm_down	discard	swap_ownership_language_for_never_say_calm_down
2418	5.237	the_feel_felt_found+ownership_language	discard	tone_change
2419	4.700	the_feel_felt_found+ownership_language+never_say_calm_down	discard	add_never_say_calm_down
2420	5.238	the_feel_felt_found+strategic_agreement	discard	swap_ownership_language_for_strategic_agreement
2421	5.112	the_feel_felt_found+ownership_language	discard	temp_0.90
2422	5.425	ownership_language	discard	remove_the_feel_felt_found
2423	4.513	the_feel_felt_found+ownership_language+concrete_next_steps	discard	add_concrete_next_steps
2424	5.438	the_feel_felt_found+ownership_language	discard	crossover
2425	4.925	the_feel_felt_found+ownership_language	discard	temp_0.65
2426	4.925	the_feel_felt_found	discard	crossover
2427	5.350	the_feel_felt_found+strategic_agreement	discard	swap_ownership_language_for_strategic_agreement
2428	5.425	the_feel_felt_found+ownership_language	discard	tone_change
2429	5.338	ownership_language	discard	crossover
2430	5.550	the_feel_felt_found+ownership_language	discard	tone_change
2431	5.525	the_feel_felt_found	discard	remove_ownership_language
2432	5.325	the_feel_felt_found+ownership_language	discard	tone_change
2433	5.112	the_feel_felt_found	discard	crossover
2434	5.037	none	discard	crossover
2435	4.925	the_feel_felt_found+ownership_language+casual_professionalism	discard	add_casual_professionalism
2436	4.675	the_feel_felt_found+ownership_language+genuine_admission	discard	add_genuine_admission
2437	5.550	the_feel_felt_found+ownership_language+never_say_calm_down	discard	add_never_say_calm_down
2438	5.650	the_feel_felt_found+ownership_language	discard	tone_change
2439	5.425	ownership_language+never_say_calm_down	discard	swap_the_feel_felt_found_for_never_say_calm_down
2440	5.550	the_feel_felt_found+ownership_language	discard	tone_change
2441	5.300	ownership_language	discard	remove_the_feel_felt_found
2442	5.325	the_feel_felt_found+ownership_language+concrete_next_steps	discard	add_concrete_next_steps
2443	5.237	the_feel_felt_found+ownership_language+personal_touch	discard	add_personal_touch
2444	4.825	the_feel_felt_found+ownership_language	discard	crossover
2445	5.325	the_feel_felt_found+ownership_language+validation_before_solution	discard	add_validation_before_solution
2446	5.450	the_feel_felt_found+ownership_language	discard	tone_change
2447	4.675	the_feel_felt_found+ownership_language	discard	tone_change
2448	4.800	the_feel_felt_found+ownership_language+validation_before_solution	discard	add_validation_before_solution
2449	5.113	ownership_language+emotional_labeling	discard	swap_the_feel_felt_found_for_emotional_labeling
2450	5.550	the_feel_felt_found+ownership_language+strategic_agreement	discard	add_strategic_agreement
2451	5.112	the_feel_felt_found+ownership_language	discard	temp_0.70
2452	5.338	the_feel_felt_found+ownership_language	discard	tone_change
2453	5.138	the_feel_felt_found	discard	remove_ownership_language
2454	4.825	ownership_language+strategic_agreement	discard	swap_the_feel_felt_found_for_strategic_agreement
2455	5.138	the_feel_felt_found+ownership_language	discard	temp_0.70
2456	5.038	the_feel_felt_found+ownership_language	discard	crossover
2457	5.450	the_feel_felt_found+ownership_language+warmth_injection	discard	add_warmth_injection
2458	5.325	the_feel_felt_found	discard	remove_ownership_language
2459	5.350	the_feel_felt_found+ownership_language+proactive_extras	discard	add_proactive_extras
2460	5.112	ownership_language	discard	crossover
2461	5.337	ownership_language+personal_touch	discard	swap_the_feel_felt_found_for_personal_touch
2462	5.138	the_feel_felt_found+ownership_language	discard	tone_change
2463	5.037	the_feel_felt_found+ownership_language	discard	crossover
2464	5.450	the_feel_felt_found+ownership_language	discard	tone_change
2465	5.450	none	discard	crossover
2466	5.550	the_feel_felt_found+ownership_language	discard	tone_change
2467	5.425	the_feel_felt_found+ownership_language+proactive_extras	discard	add_proactive_extras
2468	5.013	the_feel_felt_found	discard	remove_ownership_language
2469	5.237	the_feel_felt_found+ownership_language	discard	temp_0.90
2470	4.825	the_feel_felt_found+ownership_language	discard	tone_change
2471	5.550	the_feel_felt_found	discard	remove_ownership_language
2472	5.350	the_feel_felt_found+ownership_language+mirroring	discard	add_mirroring
2473	5.238	the_feel_felt_found+ownership_language	discard	temp_0.85
2474	5.238	the_feel_felt_found+ownership_language	discard	crossover
2475	5.138	the_feel_felt_found+ownership_language+casual_professionalism	discard	add_casual_professionalism
2476	5.013	the_feel_felt_found+ownership_language	discard	crossover
2477	5.225	ownership_language+mirroring	discard	swap_the_feel_felt_found_for_mirroring
2478	5.437	the_feel_felt_found+ownership_language	discard	tone_change
2479	4.800	the_feel_felt_found	discard	crossover
2480	4.825	the_feel_felt_found+ownership_language	discard	temp_0.95
2481	5.225	none	discard	crossover
2482	4.825	the_feel_felt_found+ownership_language	discard	tone_change
2483	5.650	the_feel_felt_found+ownership_language	discard	crossover
2484	4.825	the_feel_felt_found+ownership_language+mirroring	discard	add_mirroring
2485	5.137	the_feel_felt_found+ownership_language	discard	tone_change
2486	5.025	the_feel_felt_found+ownership_language	discard	temp_0.90
2487	5.550	the_feel_felt_found+ownership_language+validation_before_solution	discard	add_validation_before_solution
2488	5.338	the_feel_felt_found	discard	remove_ownership_language
2489	5.238	the_feel_felt_found+ownership_language+validation_before_solution	discard	add_validation_before_solution
2490	5.237	the_feel_felt_found+ownership_language	discard	crossover
2491	5.200	ownership_language	discard	remove_the_feel_felt_found
2492	5.112	the_feel_felt_found+ownership_language+never_say_calm_down	discard	add_never_say_calm_down
2493	4.800	the_feel_felt_found+ownership_language	discard	tone_change
2494	5.425	the_feel_felt_found+warmth_injection	discard	swap_ownership_language_for_warmth_injection
2495	5.138	the_feel_felt_found+personal_touch	discard	swap_ownership_language_for_personal_touch
2496	5.238	the_feel_felt_found+ownership_language	discard	tone_change
2497	4.912	the_feel_felt_found+ownership_language	discard	crossover
2498	4.925	ownership_language	discard	crossover
2499	5.112	the_feel_felt_found	discard	remove_ownership_language
2500	5.013	the_feel_felt_found+ownership_language+proactive_extras	discard	add_proactive_extras
2501	5.237	ownership_language	discard	crossover
2502	5.200	the_feel_felt_found+ownership_language+emotional_labeling	discard	add_emotional_labeling
2503	5.225	the_feel_felt_found+ownership_language+personal_touch	discard	add_personal_touch
2504	5.325	ownership_language+warmth_injection	discard	swap_the_feel_felt_found_for_warmth_injection
2505	5.438	the_feel_felt_found+ownership_language+energy_matching	discard	add_energy_matching
2506	5.112	ownership_language	discard	remove_the_feel_felt_found
2507	5.550	the_feel_felt_found+ownership_language+never_say_calm_down	discard	add_never_say_calm_down
2508	5.450	the_feel_felt_found+ownership_language	discard	tone_change
2509	5.325	the_feel_felt_found+ownership_language	discard	tone_change
2510	5.250	the_feel_felt_found+ownership_language+personal_touch	discard	add_personal_touch
2511	5.238	the_feel_felt_found+ownership_language+strategic_agreement	discard	add_strategic_agreement
2512	5.550	the_feel_felt_found+ownership_language	discard	tone_change
2513	5.138	the_feel_felt_found+strategic_agreement	discard	swap_ownership_language_for_strategic_agreement
2514	4.925	the_feel_felt_found+energy_matching	discard	swap_ownership_language_for_energy_matching
2515	5.325	the_feel_felt_found+ownership_language	discard	temp_0.70
2516	4.613	the_feel_felt_found+energy_matching	discard	swap_ownership_language_for_energy_matching
2517	5.450	the_feel_felt_found+ownership_language	discard	crossover
2518	5.112	ownership_language+personal_touch	discard	swap_the_feel_felt_found_for_personal_touch
2519	5.237	the_feel_felt_found+personal_touch	discard	swap_ownership_language_for_personal_touch
2520	5.338	ownership_language	discard	remove_the_feel_felt_found
2521	5.337	ownership_language+strategic_agreement	discard	swap_the_feel_felt_found_for_strategic_agreement
2522	5.237	the_feel_felt_found+ownership_language+validation_before_solution	discard	add_validation_before_solution
2523	5.350	the_feel_felt_found+ownership_language	discard	crossover
2524	5.037	the_feel_felt_found+ownership_language	discard	crossover
2525	5.213	the_feel_felt_found+ownership_language	discard	crossover
2526	4.912	the_feel_felt_found+ownership_language	discard	crossover
2527	5.237	the_feel_felt_found+ownership_language+never_say_calm_down	discard	add_never_say_calm_down
2528	4.925	the_feel_felt_found+ownership_language	discard	crossover
2529	4.612	the_feel_felt_found+ownership_language	discard	tone_change
2530	5.325	the_feel_felt_found+ownership_language+emotional_labeling	discard	add_emotional_labeling
2531	4.513	the_feel_felt_found	discard	remove_ownership_language
2532	5.650	ownership_language+mirroring	discard	swap_the_feel_felt_found_for_mirroring
2533	5.425	the_feel_felt_found+ownership_language	discard	tone_change
2534	4.925	the_feel_felt_found	discard	remove_ownership_language
2535	5.325	the_feel_felt_found+ownership_language+strategic_agreement	discard	add_strategic_agreement
2536	5.325	the_feel_felt_found+ownership_language+personal_touch	discard	add_personal_touch
