generation	eq_score	techniques	status	description
8635	5.013	the_feel_felt_found+casual_professionalism	discard	swap_ownership_language_for_casual_professionalism
8636	5.100	the_feel_felt_found+mirroring	discard	swap_ownership_language_for_mirroring
8637	5.237	none	discard	crossover
8638	5.450	ownership_language+never_say_calm_down	discard	swap_the_feel_felt_found_for_never_say_calm_down
8639	5.138	the_feel_felt_found+ownership_language	discard	tone_change
8640	4.888	the_feel_felt_found+ownership_language	discard	tone_change
8641	5.225	the_feel_felt_found+ownership_language	discard	temp_0.90
8642	5.550	the_feel_felt_found+never_say_calm_down	discard	swap_ownership_language_for_never_say_calm_down
8643	5.138	ownership_language+emotional_labeling	discard	swap_the_feel_felt_found_for_emotional_labeling
8644	5.013	the_feel_felt_found+ownership_language	discard	temp_0.90
8645	4.900	the_feel_felt_found+ownership_language+never_say_calm_down	discard	add_never_say_calm_down
8646	5.650	the_feel_felt_found+ownership_language	discard	tone_change
8647	5.138	the_feel_felt_found+ownership_language	discard	crossover
8648	5.450	the_feel_felt_found+ownership_language	discard	temp_0.65
8649	5.425	ownership_language	discard	crossover
8650	5.125	the_feel_felt_found+ownership_language	discard	temp_0.70
8651	4.612	ownership_language	discard	remove_the_feel_felt_found
8652	5.100	the_feel_felt_found+ownership_language	discard	crossover
8653	5.550	the_feel_felt_found+personal_touch	discard	swap_ownership_language_for_personal_touch
8654	5.237	the_feel_felt_found+ownership_language	discard	temp_0.70
8655	5.325	the_feel_felt_found+ownership_language	discard	temp_0.65
8656	5.350	the_feel_felt_found+mirroring	discard	swap_ownership_language_for_mirroring
8657	5.025	the_feel_felt_found+ownership_language+warmth_injection	discard	add_warmth_injection
8658	5.650	the_feel_felt_found+ownership_language	discard	temp_0.95
8659	5.450	the_feel_felt_found+ownership_language	discard	crossover
8660	5.238	the_feel_felt_found+ownership_language	discard	tone_change
8661	5.238	the_feel_felt_found+ownership_language+strategic_agreement	discard	add_strategic_agreement
8662	5.550	the_feel_felt_found+ownership_language	discard	crossover
8663	4.825	the_feel_felt_found	discard	crossover
8664	5.325	the_feel_felt_found+ownership_language	discard	crossover
8665	5.138	the_feel_felt_found+ownership_language	discard	temp_0.85
8666	5.013	the_feel_felt_found+ownership_language	discard	tone_change
8667	5.013	the_feel_felt_found+casual_professionalism	discard	swap_ownership_language_for_casual_professionalism
8668	5.550	the_feel_felt_found+ownership_language+validation_before_solution	discard	add_validation_before_solution
8669	5.450	the_feel_felt_found	discard	crossover
8670	5.238	the_feel_felt_found+ownership_language+validation_before_solution	discard	add_validation_before_solution
8671	5.550	the_feel_felt_found+ownership_language+emotional_labeling	discard	add_emotional_labeling
8672	5.325	the_feel_felt_found+ownership_language	discard	temp_0.95
8673	4.925	the_feel_felt_found+ownership_language	discard	tone_change
8674	5.037	the_feel_felt_found+ownership_language	discard	crossover
8675	5.138	the_feel_felt_found+ownership_language+mirroring	discard	add_mirroring
8676	5.112	ownership_language+casual_professionalism	discard	swap_the_feel_felt_found_for_casual_professionalism
8677	5.138	ownership_language	discard	remove_the_feel_felt_found
8678	5.337	ownership_language+never_say_calm_down	discard	swap_the_feel_felt_found_for_never_say_calm_down
8679	4.925	the_feel_felt_found+validation_before_solution	discard	swap_ownership_language_for_validation_before_solution
8680	5.550	ownership_language	discard	crossover
8681	5.450	the_feel_felt_found+ownership_language+mirroring	discard	add_mirroring
8682	5.325	none	discard	crossover
8683	5.450	the_feel_felt_found+ownership_language	discard	crossover
8684	5.250	ownership_language+casual_professionalism	discard	swap_the_feel_felt_found_for_casual_professionalism
8685	5.312	ownership_language+casual_professionalism	discard	swap_the_feel_felt_found_for_casual_professionalism
8686	5.550	the_feel_felt_found+ownership_language	discard	tone_change
8687	5.550	the_feel_felt_found+ownership_language	discard	temp_0.75
8688	5.550	the_feel_felt_found+ownership_language	discard	crossover
8689	5.300	the_feel_felt_found+ownership_language+validation_before_solution	discard	add_validation_before_solution
8690	4.925	the_feel_felt_found+ownership_language	discard	tone_change
8691	5.450	the_feel_felt_found+ownership_language+validation_before_solution	discard	add_validation_before_solution
8692	5.325	the_feel_felt_found+ownership_language	discard	tone_change
8693	5.013	the_feel_felt_found+ownership_language+warmth_injection	discard	add_warmth_injection
8694	5.037	ownership_language	discard	remove_the_feel_felt_found
8695	5.013	the_feel_felt_found+ownership_language	discard	tone_change
8696	4.913	the_feel_felt_found	discard	remove_ownership_language
8697	5.138	the_feel_felt_found+genuine_admission	discard	swap_ownership_language_for_genuine_admission
8698	5.550	the_feel_felt_found+ownership_language+emotional_labeling	discard	add_emotional_labeling
8699	5.425	the_feel_felt_found+ownership_language	discard	tone_change
8700	5.338	the_feel_felt_found+ownership_language+casual_professionalism	discard	add_casual_professionalism
8701	4.888	the_feel_felt_found+ownership_language+emotional_labeling	discard	add_emotional_labeling
8702	5.425	the_feel_felt_found	discard	crossover
8703	4.888	the_feel_felt_found+ownership_language	discard	tone_change
8704	4.825	the_feel_felt_found+ownership_language+emotional_labeling	discard	add_emotional_labeling
8705	4.513	ownership_language+warmth_injection	discard	swap_the_feel_felt_found_for_warmth_injection
8706	5.025	the_feel_felt_found+ownership_language	discard	tone_change
8707	5.325	the_feel_felt_found	discard	crossover
8708	4.800	the_feel_felt_found	discard	remove_ownership_language
8709	5.450	the_feel_felt_found+concrete_next_steps	discard	swap_ownership_language_for_concrete_next_steps
8710	4.888	the_feel_felt_found+ownership_language+personal_touch	discard	add_personal_touch
8711	5.425	the_feel_felt_found+ownership_language	discard	tone_change
8712	4.800	the_feel_felt_found	discard	remove_ownership_language
8713	5.225	the_feel_felt_found+validation_before_solution	discard	swap_ownership_language_for_validation_before_solution
8714	5.037	the_feel_felt_found+ownership_language	discard	crossover
8715	5.137	the_feel_felt_found+ownership_language	discard	temp_0.85
8716	5.200	the_feel_felt_found+ownership_language	discard	crossover
8717	5.013	the_feel_felt_found+ownership_language	discard	crossover
8718	5.112	the_feel_felt_found+ownership_language	discard	temp_0.65
8719	5.338	the_feel_felt_found	discard	crossover
8720	4.888	the_feel_felt_found+ownership_language	discard	temp_0.70
8721	5.225	the_feel_felt_found+ownership_language+genuine_admission	discard	add_genuine_admission
8722	4.925	the_feel_felt_found+ownership_language	discard	temp_0.65
8723	5.650	the_feel_felt_found+ownership_language+emotional_labeling	discard	add_emotional_labeling
8724	4.925	ownership_language	discard	remove_the_feel_felt_found
8725	5.238	ownership_language	discard	crossover
8726	5.138	the_feel_felt_found+ownership_language	discard	tone_change
8727	5.112	ownership_language+validation_before_solution	discard	swap_the_feel_felt_found_for_validation_before_solution
8728	5.238	the_feel_felt_found+energy_matching	discard	swap_ownership_language_for_energy_matching
8729	5.338	ownership_language	discard	remove_the_feel_felt_found
8730	5.138	the_feel_felt_found+ownership_language+proactive_extras	discard	add_proactive_extras
8731	4.912	the_feel_felt_found+ownership_language+emotional_labeling	discard	add_emotional_labeling
8732	5.350	the_feel_felt_found+ownership_language	discard	crossover
8733	4.700	the_feel_felt_found+ownership_language	discard	tone_change
8734	5.425	the_feel_felt_found+ownership_language	discard	tone_change
8735	5.025	the_feel_felt_found+ownership_language	discard	tone_change
8736	5.450	none	discard	crossover
8737	4.513	ownership_language	discard	crossover
8738	4.825	the_feel_felt_found+ownership_language+genuine_admission	discard	add_genuine_admission
8739	4.825	the_feel_felt_found+ownership_language+concrete_next_steps	discard	add_concrete_next_steps
8740	5.037	the_feel_felt_found+ownership_language+never_say_calm_down	discard	add_never_say_calm_down
8741	5.325	the_feel_felt_found+ownership_language	discard	crossover
8742	5.450	the_feel_felt_found+ownership_language+casual_professionalism	discard	add_casual_professionalism
8743	5.450	the_feel_felt_found+ownership_language	discard	tone_change
8744	5.550	the_feel_felt_found+ownership_language	discard	tone_change
8745	5.450	ownership_language+personal_touch	discard	swap_the_feel_felt_found_for_personal_touch
8746	5.113	the_feel_felt_found+ownership_language+emotional_labeling	discard	add_emotional_labeling
8747	5.237	the_feel_felt_found+ownership_language+strategic_agreement	discard	add_strategic_agreement
8748	5.113	the_feel_felt_found+never_say_calm_down	discard	swap_ownership_language_for_never_say_calm_down
8749	5.550	the_feel_felt_found+ownership_language	discard	temp_0.85
8750	5.325	the_feel_felt_found+validation_before_solution	discard	swap_ownership_language_for_validation_before_solution
8751	5.013	the_feel_felt_found+concrete_next_steps	discard	swap_ownership_language_for_concrete_next_steps
8752	5.550	the_feel_felt_found+ownership_language+strategic_agreement	discard	add_strategic_agreement
8753	5.237	the_feel_felt_found+ownership_language+never_say_calm_down	discard	add_never_say_calm_down
8754	5.550	the_feel_felt_found+ownership_language	discard	tone_change
8755	5.425	the_feel_felt_found+ownership_language	discard	tone_change
8756	5.350	the_feel_felt_found+validation_before_solution	discard	swap_ownership_language_for_validation_before_solution
8757	5.237	ownership_language+never_say_calm_down	discard	swap_the_feel_felt_found_for_never_say_calm_down
8758	5.237	the_feel_felt_found	discard	crossover
8759	5.237	ownership_language	discard	remove_the_feel_felt_found
8760	5.425	the_feel_felt_found+ownership_language+concrete_next_steps	discard	add_concrete_next_steps
8761	5.237	the_feel_felt_found+ownership_language+mirroring	discard	add_mirroring
8762	5.138	the_feel_felt_found+ownership_language+mirroring	discard	add_mirroring
8763	5.338	the_feel_felt_found+ownership_language	discard	crossover
8764	5.425	the_feel_felt_found+ownership_language	discard	crossover
8765	5.113	the_feel_felt_found+ownership_language	discard	temp_0.95
8766	5.112	the_feel_felt_found+ownership_language+strategic_agreement	discard	add_strategic_agreement
8767	5.013	the_feel_felt_found+ownership_language+strategic_agreement	discard	add_strategic_agreement
8768	5.325	the_feel_felt_found+ownership_language+validation_before_solution	discard	add_validation_before_solution
8769	5.550	the_feel_felt_found	discard	remove_ownership_language
8770	5.138	the_feel_felt_found+ownership_language	discard	tone_change
8771	5.550	the_feel_felt_found	discard	remove_ownership_language
8772	4.987	the_feel_felt_found	discard	remove_ownership_language
8773	5.425	the_feel_felt_found+ownership_language	discard	tone_change
8774	5.200	ownership_language+warmth_injection	discard	swap_the_feel_felt_found_for_warmth_injection
8775	4.613	the_feel_felt_found+ownership_language	discard	temp_0.75
8776	5.138	the_feel_felt_found	discard	crossover
8777	5.425	the_feel_felt_found+ownership_language+mirroring	discard	add_mirroring
8778	5.325	ownership_language	discard	crossover
8779	4.925	the_feel_felt_found+ownership_language+casual_professionalism	discard	add_casual_professionalism
8780	5.112	the_feel_felt_found+ownership_language	discard	temp_0.95
8781	5.037	the_feel_felt_found+ownership_language	discard	temp_0.75
8782	5.200	the_feel_felt_found+ownership_language	discard	crossover
8783	5.350	ownership_language+personal_touch	discard	swap_the_feel_felt_found_for_personal_touch
8784	5.350	ownership_language	discard	crossover
8785	5.113	the_feel_felt_found+ownership_language+never_say_calm_down	discard	add_never_say_calm_down
8786	5.450	the_feel_felt_found+ownership_language+warmth_injection	discard	add_warmth_injection
8787	4.612	the_feel_felt_found+ownership_language+casual_professionalism	discard	add_casual_professionalism
8788	5.450	the_feel_felt_found	discard	crossover
8789	5.350	the_feel_felt_found+ownership_language	discard	crossover
8790	5.237	the_feel_felt_found+ownership_language	discard	crossover
8791	4.513	the_feel_felt_found+ownership_language+emotional_labeling	discard	add_emotional_labeling
8792	5.450	the_feel_felt_found+ownership_language	discard	temp_0.90
8793	4.825	the_feel_felt_found+ownership_language	discard	tone_change
8794	4.800	the_feel_felt_found	discard	crossover
8795	5.550	the_feel_felt_found+ownership_language	discard	crossover
8796	5.350	the_feel_felt_found+ownership_language+validation_before_solution	discard	add_validation_before_solution
8797	4.913	the_feel_felt_found	discard	crossover
8798	5.137	the_feel_felt_found+concrete_next_steps	discard	swap_ownership_language_for_concrete_next_steps
8799	5.350	ownership_language+warmth_injection	discard	swap_the_feel_felt_found_for_warmth_injection
8800	5.550	the_feel_felt_found+ownership_language	discard	tone_change
8801	5.550	the_feel_felt_found+never_say_calm_down	discard	swap_ownership_language_for_never_say_calm_down
8802	5.450	the_feel_felt_found+ownership_language	discard	tone_change
8803	5.350	the_feel_felt_found+ownership_language	discard	tone_change
8804	5.325	the_feel_felt_found+ownership_language	discard	temp_0.95
8805	5.013	the_feel_felt_found+validation_before_solution	discard	swap_ownership_language_for_validation_before_solution
8806	5.025	the_feel_felt_found+ownership_language+strategic_agreement	discard	add_strategic_agreement
8807	5.138	the_feel_felt_found+ownership_language	discard	tone_change
8808	4.925	the_feel_felt_found+ownership_language	discard	crossover
8809	5.450	ownership_language+personal_touch	discard	swap_the_feel_felt_found_for_personal_touch
8810	5.225	the_feel_felt_found+ownership_language	discard	crossover
8811	5.112	the_feel_felt_found+ownership_language	discard	tone_change
8812	5.550	the_feel_felt_found+ownership_language	discard	temp_0.75
8813	5.325	the_feel_felt_found+ownership_language+emotional_labeling	discard	add_emotional_labeling
8814	4.513	the_feel_felt_found+ownership_language+validation_before_solution	discard	add_validation_before_solution
8815	5.237	the_feel_felt_found+ownership_language	discard	tone_change
8816	5.138	the_feel_felt_found+ownership_language+strategic_agreement	discard	add_strategic_agreement
8817	5.112	the_feel_felt_found+ownership_language+energy_matching	discard	add_energy_matching
8818	5.237	the_feel_felt_found+ownership_language	discard	crossover
8819	5.138	the_feel_felt_found+concrete_next_steps	discard	swap_ownership_language_for_concrete_next_steps
8820	5.112	the_feel_felt_found+ownership_language+never_say_calm_down	discard	add_never_say_calm_down
8821	5.550	the_feel_felt_found+ownership_language	discard	temp_0.65
8822	5.325	the_feel_felt_found+proactive_extras	discard	swap_ownership_language_for_proactive_extras
8823	5.238	the_feel_felt_found+ownership_language	discard	tone_change
8824	5.550	the_feel_felt_found+ownership_language	discard	crossover
8825	5.550	the_feel_felt_found+ownership_language+never_say_calm_down	discard	add_never_say_calm_down
8826	5.300	the_feel_felt_found+genuine_admission	discard	swap_ownership_language_for_genuine_admission
8827	4.925	ownership_language+casual_professionalism	discard	swap_the_feel_felt_found_for_casual_professionalism
8828	5.325	the_feel_felt_found+ownership_language	discard	tone_change
8829	5.550	ownership_language+warmth_injection	discard	swap_the_feel_felt_found_for_warmth_injection
8830	5.450	the_feel_felt_found+ownership_language	discard	tone_change
8831	5.000	the_feel_felt_found	discard	remove_ownership_language
8832	5.325	ownership_language	discard	crossover
8833	5.013	the_feel_felt_found+ownership_language	discard	crossover
8834	5.013	the_feel_felt_found+ownership_language	discard	crossover
8835	5.350	the_feel_felt_found+ownership_language+concrete_next_steps	discard	add_concrete_next_steps
8836	5.237	the_feel_felt_found	discard	remove_ownership_language
8837	5.550	the_feel_felt_found+ownership_language	discard	tone_change
8838	5.450	the_feel_felt_found+ownership_language+strategic_agreement	discard	add_strategic_agreement
8839	5.550	the_feel_felt_found+ownership_language	discard	crossover
8840	5.450	the_feel_felt_found	discard	crossover
8841	5.550	the_feel_felt_found+validation_before_solution	discard	swap_ownership_language_for_validation_before_solution
8842	4.912	ownership_language	discard	remove_the_feel_felt_found
8843	5.325	the_feel_felt_found+ownership_language	discard	crossover
8844	5.138	the_feel_felt_found+ownership_language+concrete_next_steps	discard	add_concrete_next_steps
8845	5.350	the_feel_felt_found+ownership_language+personal_touch	discard	add_personal_touch
8846	5.113	ownership_language	discard	remove_the_feel_felt_found
8847	4.800	the_feel_felt_found+ownership_language+proactive_extras	discard	add_proactive_extras
8848	5.238	the_feel_felt_found+ownership_language+never_say_calm_down	discard	add_never_say_calm_down
8849	5.450	the_feel_felt_found+personal_touch	discard	swap_ownership_language_for_personal_touch
8850	5.425	the_feel_felt_found+ownership_language	discard	temp_0.90
8851	5.138	the_feel_felt_found+ownership_language	discard	crossover
8852	5.550	the_feel_felt_found+ownership_language	discard	tone_change
8853	5.425	ownership_language	discard	remove_the_feel_felt_found
8854	5.550	the_feel_felt_found+ownership_language	discard	tone_change
8855	5.200	the_feel_felt_found+ownership_language	discard	crossover
8856	4.825	the_feel_felt_found+ownership_language	discard	tone_change
8857	5.450	the_feel_felt_found	discard	crossover
8858	5.138	the_feel_felt_found+ownership_language	discard	temp_0.95
8859	4.725	none	discard	crossover
8860	4.912	the_feel_felt_found+ownership_language	discard	crossover
8861	5.450	the_feel_felt_found+ownership_language	discard	tone_change
8862	4.700	the_feel_felt_found+ownership_language+personal_touch	discard	add_personal_touch
8863	5.237	ownership_language+casual_professionalism	discard	swap_the_feel_felt_found_for_casual_professionalism
8864	5.550	the_feel_felt_found	discard	crossover
8865	5.425	none	discard	crossover
8866	5.138	the_feel_felt_found+ownership_language	discard	tone_change
8867	5.025	the_feel_felt_found+ownership_language+genuine_admission	discard	add_genuine_admission
8868	5.325	the_feel_felt_found+ownership_language+strategic_agreement	discard	add_strategic_agreement
8869	5.237	ownership_language+casual_professionalism	discard	swap_the_feel_felt_found_for_casual_professionalism
8870	5.350	the_feel_felt_found+ownership_language	discard	tone_change
8871	5.225	the_feel_felt_found+ownership_language+genuine_admission	discard	add_genuine_admission
8872	5.200	ownership_language+casual_professionalism	discard	swap_the_feel_felt_found_for_casual_professionalism
8873	5.325	the_feel_felt_found+ownership_language	discard	tone_change
8874	4.700	the_feel_felt_found+ownership_language+warmth_injection	discard	add_warmth_injection
8875	5.138	the_feel_felt_found+ownership_language	discard	temp_0.95
8876	4.800	the_feel_felt_found+ownership_language	discard	tone_change
8877	5.300	the_feel_felt_found+never_say_calm_down	discard	swap_ownership_language_for_never_say_calm_down
8878	4.912	the_feel_felt_found+ownership_language+warmth_injection	discard	add_warmth_injection
8879	5.237	the_feel_felt_found+ownership_language	discard	tone_change
8880	4.938	the_feel_felt_found+ownership_language+proactive_extras	discard	add_proactive_extras
8881	5.550	the_feel_felt_found+ownership_language+warmth_injection	discard	add_warmth_injection
8882	5.300	the_feel_felt_found+ownership_language	discard	tone_change
8883	5.450	the_feel_felt_found+ownership_language+concrete_next_steps	discard	add_concrete_next_steps
8884	5.425	the_feel_felt_found+ownership_language	discard	temp_0.95
8885	5.425	the_feel_felt_found+ownership_language	discard	tone_change
8886	5.138	ownership_language+proactive_extras	discard	swap_the_feel_felt_found_for_proactive_extras
8887	5.550	the_feel_felt_found+ownership_language	discard	tone_change
8888	5.425	the_feel_felt_found+ownership_language+proactive_extras	discard	add_proactive_extras
8889	5.450	the_feel_felt_found+ownership_language	discard	tone_change
8890	5.425	the_feel_felt_found+emotional_labeling	discard	swap_ownership_language_for_emotional_labeling
8891	5.213	the_feel_felt_found+ownership_language	discard	tone_change
8892	5.337	the_feel_felt_found	discard	crossover
8893	5.450	the_feel_felt_found+ownership_language	discard	tone_change
8894	5.350	the_feel_felt_found	discard	remove_ownership_language
8895	5.550	the_feel_felt_found+ownership_language	discard	crossover
8896	5.450	the_feel_felt_found+ownership_language+personal_touch	discard	add_personal_touch
8897	5.112	ownership_language+strategic_agreement	discard	swap_the_feel_felt_found_for_strategic_agreement
8898	4.888	the_feel_felt_found+ownership_language	discard	temp_0.95
8899	5.137	the_feel_felt_found+ownership_language+concrete_next_steps	discard	add_concrete_next_steps
8900	4.925	the_feel_felt_found+ownership_language	discard	tone_change
8901	4.925	the_feel_felt_found+ownership_language+concrete_next_steps	discard	add_concrete_next_steps
8902	5.425	the_feel_felt_found+ownership_language	discard	temp_0.70
8903	5.237	the_feel_felt_found+ownership_language	discard	tone_change
8904	5.650	the_feel_felt_found+ownership_language+genuine_admission	discard	add_genuine_admission
8905	5.238	the_feel_felt_found	discard	crossover
8906	5.750	the_feel_felt_found+ownership_language	discard	tone_change
