generation	eq_score	techniques	status	description
3935	5.325	the_feel_felt_found+ownership_language+emotional_labeling	discard	add_emotional_labeling
3936	5.550	the_feel_felt_found	discard	remove_ownership_language
3937	5.550	the_feel_felt_found	discard	crossover
3938	5.338	the_feel_felt_found+ownership_language	discard	tone_change
3939	5.338	the_feel_felt_found+ownership_language	discard	temp_0.90
3940	4.912	the_feel_felt_found+personal_touch	discard	swap_ownership_language_for_personal_touch
3941	5.525	ownership_language	discard	remove_the_feel_felt_found
3942	5.200	the_feel_felt_found+ownership_language+emotional_labeling	discard	add_emotional_labeling
3943	4.987	the_feel_felt_found+ownership_language	discard	tone_change
3944	5.450	the_feel_felt_found+ownership_language+energy_matching	discard	add_energy_matching
3945	5.337	the_feel_felt_found+proactive_extras	discard	swap_ownership_language_for_proactive_extras
3946	5.238	the_feel_felt_found+ownership_language	discard	tone_change
3947	5.525	the_feel_felt_found+validation_before_solution	discard	swap_ownership_language_for_validation_before_solution
3948	5.350	the_feel_felt_found+ownership_language	discard	crossover
3949	4.800	the_feel_felt_found+ownership_language+mirroring	discard	add_mirroring
3950	4.888	the_feel_felt_found+ownership_language+genuine_admission	discard	add_genuine_admission
3951	5.325	the_feel_felt_found+ownership_language	discard	temp_0.85
3952	5.425	the_feel_felt_found+ownership_language+never_say_calm_down	discard	add_never_say_calm_down
3953	4.612	the_feel_felt_found+ownership_language	discard	crossover
3954	5.325	the_feel_felt_found	discard	crossover
3955	5.237	the_feel_felt_found+ownership_language	discard	crossover
3956	5.425	the_feel_felt_found+ownership_language	discard	crossover
3957	5.337	ownership_language	discard	crossover
3958	5.350	the_feel_felt_found+ownership_language	discard	temp_0.75
3959	5.138	the_feel_felt_found+ownership_language	discard	crossover
3960	5.238	ownership_language	discard	crossover
3961	5.325	the_feel_felt_found+ownership_language+personal_touch	discard	add_personal_touch
3962	4.800	the_feel_felt_found+ownership_language+mirroring	discard	add_mirroring
3963	5.325	the_feel_felt_found+ownership_language+personal_touch	discard	add_personal_touch
3964	5.338	the_feel_felt_found+proactive_extras	discard	swap_ownership_language_for_proactive_extras
3965	5.450	ownership_language+genuine_admission	discard	swap_the_feel_felt_found_for_genuine_admission
3966	5.625	ownership_language	discard	crossover
3967	5.525	the_feel_felt_found+ownership_language	discard	tone_change
3968	5.025	the_feel_felt_found+ownership_language	discard	tone_change
3969	5.200	the_feel_felt_found+ownership_language+warmth_injection	discard	add_warmth_injection
3970	5.550	ownership_language	discard	crossover
3971	5.325	ownership_language	discard	remove_the_feel_felt_found
3972	4.825	the_feel_felt_found+mirroring	discard	swap_ownership_language_for_mirroring
3973	5.350	ownership_language+personal_touch	discard	swap_the_feel_felt_found_for_personal_touch
3974	5.237	the_feel_felt_found+ownership_language+casual_professionalism	discard	add_casual_professionalism
3975	5.650	the_feel_felt_found+ownership_language+casual_professionalism	discard	add_casual_professionalism
3976	5.550	the_feel_felt_found+ownership_language	discard	temp_0.90
3977	5.750	ownership_language	discard	remove_the_feel_felt_found
3978	5.237	the_feel_felt_found+ownership_language	discard	tone_change
3979	5.550	the_feel_felt_found+ownership_language+warmth_injection	discard	add_warmth_injection
3980	5.550	the_feel_felt_found+ownership_language	discard	tone_change
3981	5.013	the_feel_felt_found+ownership_language	discard	tone_change
3982	5.550	ownership_language+validation_before_solution	discard	swap_the_feel_felt_found_for_validation_before_solution
3983	4.700	ownership_language+strategic_agreement	discard	swap_the_feel_felt_found_for_strategic_agreement
3984	5.550	the_feel_felt_found	discard	remove_ownership_language
3985	5.550	the_feel_felt_found+ownership_language	discard	temp_0.65
3986	5.200	the_feel_felt_found+ownership_language+never_say_calm_down	discard	add_never_say_calm_down
3987	4.800	the_feel_felt_found+ownership_language	discard	tone_change
3988	5.138	the_feel_felt_found+ownership_language	discard	tone_change
3989	5.113	the_feel_felt_found+ownership_language+energy_matching	discard	add_energy_matching
3990	5.450	the_feel_felt_found+ownership_language	discard	temp_0.95
3991	5.300	the_feel_felt_found+ownership_language	discard	tone_change
3992	5.425	ownership_language	discard	crossover
3993	5.013	the_feel_felt_found+ownership_language+personal_touch	discard	add_personal_touch
3994	5.450	ownership_language+mirroring	discard	swap_the_feel_felt_found_for_mirroring
3995	5.450	the_feel_felt_found+ownership_language	discard	crossover
3996	4.612	the_feel_felt_found+ownership_language+warmth_injection	discard	add_warmth_injection
3997	5.013	the_feel_felt_found+ownership_language	discard	temp_0.70
3998	4.975	the_feel_felt_found	discard	crossover
3999	5.237	the_feel_felt_found+ownership_language	discard	tone_change
4000	5.237	ownership_language	discard	crossover
4001	5.325	the_feel_felt_found+ownership_language+casual_professionalism	discard	add_casual_professionalism
4002	5.350	the_feel_felt_found	discard	remove_ownership_language
4003	5.212	ownership_language	discard	crossover
4004	5.425	the_feel_felt_found+concrete_next_steps	discard	swap_ownership_language_for_concrete_next_steps
4005	5.550	the_feel_felt_found+energy_matching	discard	swap_ownership_language_for_energy_matching
4006	4.825	the_feel_felt_found+ownership_language	discard	tone_change
4007	5.650	the_feel_felt_found+ownership_language+energy_matching	discard	add_energy_matching
4008	5.213	the_feel_felt_found+ownership_language+warmth_injection	discard	add_warmth_injection
4009	5.525	the_feel_felt_found+ownership_language	discard	temp_0.95
4010	5.200	ownership_language	discard	remove_the_feel_felt_found
4011	5.425	the_feel_felt_found+ownership_language	discard	crossover
4012	5.013	the_feel_felt_found+ownership_language+validation_before_solution	discard	add_validation_before_solution
4013	4.575	ownership_language	discard	remove_the_feel_felt_found
4014	5.325	the_feel_felt_found+ownership_language	discard	tone_change
4015	5.237	the_feel_felt_found	discard	remove_ownership_language
4016	5.337	the_feel_felt_found+energy_matching	discard	swap_ownership_language_for_energy_matching
4017	5.450	the_feel_felt_found+ownership_language	discard	tone_change
4018	4.513	the_feel_felt_found+ownership_language+emotional_labeling	discard	add_emotional_labeling
4019	5.200	the_feel_felt_found+ownership_language+validation_before_solution	discard	add_validation_before_solution
4020	5.550	the_feel_felt_found+ownership_language+validation_before_solution	discard	add_validation_before_solution
4021	5.325	ownership_language	discard	remove_the_feel_felt_found
4022	4.800	the_feel_felt_found+ownership_language	discard	temp_0.75
4023	5.550	the_feel_felt_found+ownership_language+never_say_calm_down	discard	add_never_say_calm_down
4024	5.450	the_feel_felt_found+ownership_language	discard	temp_0.95
4025	5.013	the_feel_felt_found+ownership_language+validation_before_solution	discard	add_validation_before_solution
4026	5.450	the_feel_felt_found	discard	remove_ownership_language
4027	5.450	ownership_language+warmth_injection	discard	swap_the_feel_felt_found_for_warmth_injection
4028	5.300	the_feel_felt_found+ownership_language	discard	temp_0.95
4029	5.325	the_feel_felt_found+ownership_language+validation_before_solution	discard	add_validation_before_solution
4030	5.325	ownership_language+concrete_next_steps	discard	swap_the_feel_felt_found_for_concrete_next_steps
4031	5.325	the_feel_felt_found+ownership_language+emotional_labeling	discard	add_emotional_labeling
4032	5.200	the_feel_felt_found+ownership_language+validation_before_solution	discard	add_validation_before_solution
4033	5.450	the_feel_felt_found+ownership_language	discard	tone_change
4034	5.450	the_feel_felt_found+ownership_language	discard	temp_0.70
4035	5.425	the_feel_felt_found+ownership_language+warmth_injection	discard	add_warmth_injection
4036	5.525	the_feel_felt_found+ownership_language+genuine_admission	discard	add_genuine_admission
4037	4.912	the_feel_felt_found+ownership_language+strategic_agreement	discard	add_strategic_agreement
4038	4.825	the_feel_felt_found+ownership_language	discard	tone_change
4039	5.025	the_feel_felt_found+ownership_language+validation_before_solution	discard	add_validation_before_solution
4040	5.550	the_feel_felt_found+ownership_language	discard	tone_change
4041	5.237	the_feel_felt_found+ownership_language	discard	temp_0.70
4042	5.200	the_feel_felt_found+ownership_language	discard	temp_0.75
4043	5.237	ownership_language+genuine_admission	discard	swap_the_feel_felt_found_for_genuine_admission
4044	5.237	the_feel_felt_found+ownership_language	discard	temp_0.85
4045	5.013	none	discard	crossover
4046	5.425	the_feel_felt_found+ownership_language	discard	temp_0.90
4047	5.112	the_feel_felt_found+ownership_language	discard	tone_change
4048	5.450	the_feel_felt_found+ownership_language+warmth_injection	discard	add_warmth_injection
4049	5.325	the_feel_felt_found+ownership_language+genuine_admission	discard	add_genuine_admission
4050	5.550	ownership_language+mirroring	discard	swap_the_feel_felt_found_for_mirroring
4051	5.200	the_feel_felt_found	discard	remove_ownership_language
4052	5.138	the_feel_felt_found+ownership_language	discard	tone_change
4053	5.550	ownership_language+emotional_labeling	discard	swap_the_feel_felt_found_for_emotional_labeling
4054	5.300	the_feel_felt_found+ownership_language	discard	crossover
4055	5.112	the_feel_felt_found	discard	remove_ownership_language
4056	4.888	the_feel_felt_found+energy_matching	discard	swap_ownership_language_for_energy_matching
4057	4.588	the_feel_felt_found+ownership_language	discard	temp_0.90
4058	4.925	the_feel_felt_found+ownership_language+casual_professionalism	discard	add_casual_professionalism
4059	5.450	the_feel_felt_found+ownership_language	discard	crossover
4060	5.138	the_feel_felt_found+ownership_language	discard	crossover
4061	5.325	the_feel_felt_found	discard	crossover
4062	5.238	the_feel_felt_found+ownership_language	discard	tone_change
4063	5.325	the_feel_felt_found	discard	remove_ownership_language
4064	5.450	the_feel_felt_found+ownership_language+validation_before_solution	discard	add_validation_before_solution
4065	5.013	ownership_language+proactive_extras	discard	swap_the_feel_felt_found_for_proactive_extras
4066	4.925	the_feel_felt_found+ownership_language	discard	tone_change
4067	5.325	the_feel_felt_found+ownership_language	discard	temp_0.85
4068	5.325	the_feel_felt_found	discard	remove_ownership_language
4069	5.337	ownership_language+validation_before_solution	discard	swap_the_feel_felt_found_for_validation_before_solution
4070	5.112	ownership_language	discard	remove_the_feel_felt_found
4071	4.925	the_feel_felt_found+ownership_language+mirroring	discard	add_mirroring
4072	5.137	the_feel_felt_found+ownership_language	discard	temp_0.90
4073	5.013	ownership_language+warmth_injection	discard	swap_the_feel_felt_found_for_warmth_injection
4074	5.138	the_feel_felt_found+ownership_language+strategic_agreement	discard	add_strategic_agreement
4075	5.138	the_feel_felt_found+ownership_language	discard	crossover
4076	4.825	the_feel_felt_found+ownership_language	discard	tone_change
4077	5.138	the_feel_felt_found+ownership_language	discard	tone_change
4078	4.888	ownership_language	discard	remove_the_feel_felt_found
4079	5.112	the_feel_felt_found+ownership_language+personal_touch	discard	add_personal_touch
4080	5.213	the_feel_felt_found+ownership_language	discard	crossover
4081	4.925	the_feel_felt_found+ownership_language	discard	crossover
4082	4.925	the_feel_felt_found	discard	crossover
4083	5.550	the_feel_felt_found+ownership_language	discard	tone_change
4084	5.013	the_feel_felt_found+ownership_language+personal_touch	discard	add_personal_touch
4085	5.025	the_feel_felt_found+ownership_language	discard	tone_change
4086	5.450	the_feel_felt_found+ownership_language	discard	tone_change
4087	5.112	the_feel_felt_found+ownership_language+mirroring	discard	add_mirroring
4088	4.488	the_feel_felt_found+ownership_language+mirroring	discard	add_mirroring
4089	5.037	the_feel_felt_found+ownership_language	discard	crossover
4090	5.650	the_feel_felt_found	discard	remove_ownership_language
4091	5.237	the_feel_felt_found+ownership_language+never_say_calm_down	discard	add_never_say_calm_down
4092	5.025	the_feel_felt_found+ownership_language+genuine_admission	discard	add_genuine_admission
4093	4.513	the_feel_felt_found+ownership_language+strategic_agreement	discard	add_strategic_agreement
4094	5.650	the_feel_felt_found+ownership_language	discard	temp_0.70
4095	5.650	ownership_language+genuine_admission	discard	swap_the_feel_felt_found_for_genuine_admission
4096	5.425	the_feel_felt_found+ownership_language	discard	tone_change
4097	5.138	the_feel_felt_found+ownership_language	discard	temp_0.70
4098	5.138	the_feel_felt_found+ownership_language+personal_touch	discard	add_personal_touch
4099	5.138	ownership_language	discard	remove_the_feel_felt_found
4100	5.113	the_feel_felt_found	discard	crossover
4101	4.925	the_feel_felt_found+ownership_language	discard	temp_0.65
4102	5.013	the_feel_felt_found	discard	crossover
4103	5.338	ownership_language	discard	crossover
4104	5.550	ownership_language+energy_matching	discard	swap_the_feel_felt_found_for_energy_matching
4105	5.225	the_feel_felt_found+ownership_language	discard	crossover
4106	4.700	the_feel_felt_found+ownership_language	discard	crossover
4107	5.138	the_feel_felt_found+ownership_language+genuine_admission	discard	add_genuine_admission
4108	5.650	the_feel_felt_found+ownership_language+casual_professionalism	discard	add_casual_professionalism
4109	4.825	the_feel_felt_found+ownership_language+genuine_admission	discard	add_genuine_admission
4110	5.137	the_feel_felt_found+ownership_language	discard	tone_change
4111	5.425	the_feel_felt_found+ownership_language	discard	tone_change
4112	5.237	the_feel_felt_found+ownership_language	discard	temp_0.65
4113	5.450	the_feel_felt_found+ownership_language	discard	temp_0.70
4114	5.137	the_feel_felt_found+ownership_language	discard	crossover
4115	5.213	the_feel_felt_found+ownership_language	discard	crossover
4116	5.038	the_feel_felt_found+ownership_language	discard	temp_0.85
4117	5.112	the_feel_felt_found+ownership_language+casual_professionalism	discard	add_casual_professionalism
4118	4.900	the_feel_felt_found+ownership_language	discard	temp_0.70
4119	5.550	the_feel_felt_found+ownership_language+personal_touch	discard	add_personal_touch
4120	4.825	the_feel_felt_found+ownership_language+proactive_extras	discard	add_proactive_extras
4121	4.713	the_feel_felt_found+ownership_language+proactive_extras	discard	add_proactive_extras
4122	5.112	ownership_language+genuine_admission	discard	swap_the_feel_felt_found_for_genuine_admission
4123	5.550	the_feel_felt_found+ownership_language	discard	crossover
4124	5.325	the_feel_felt_found+ownership_language	discard	temp_0.65
4125	5.450	the_feel_felt_found	discard	crossover
4126	4.888	the_feel_felt_found+ownership_language	discard	temp_0.85
4127	5.250	ownership_language	discard	crossover
4128	5.013	the_feel_felt_found+ownership_language	discard	temp_0.95
4129	5.013	the_feel_felt_found	discard	remove_ownership_language
4130	5.325	ownership_language	discard	remove_the_feel_felt_found
4131	5.200	the_feel_felt_found+ownership_language	discard	tone_change
4132	5.650	the_feel_felt_found+ownership_language	discard	temp_0.90
4133	5.212	ownership_language+genuine_admission	discard	swap_the_feel_felt_found_for_genuine_admission
4134	5.338	the_feel_felt_found+strategic_agreement	discard	swap_ownership_language_for_strategic_agreement
4135	5.113	the_feel_felt_found+ownership_language	discard	tone_change
4136	5.425	the_feel_felt_found	discard	remove_ownership_language
4137	5.325	the_feel_felt_found+ownership_language+genuine_admission	discard	add_genuine_admission
4138	4.888	the_feel_felt_found+ownership_language	discard	temp_0.90
4139	5.013	the_feel_felt_found+validation_before_solution	discard	swap_ownership_language_for_validation_before_solution
4140	5.450	the_feel_felt_found	discard	remove_ownership_language
4141	5.112	the_feel_felt_found+ownership_language	discard	temp_0.75
4142	5.450	the_feel_felt_found+ownership_language	discard	tone_change
4143	5.225	the_feel_felt_found+ownership_language+casual_professionalism	discard	add_casual_professionalism
4144	5.425	the_feel_felt_found+ownership_language	discard	crossover
4145	5.075	the_feel_felt_found+ownership_language+emotional_labeling	discard	add_emotional_labeling
4146	5.013	ownership_language	discard	crossover
4147	5.025	the_feel_felt_found+ownership_language+energy_matching	discard	add_energy_matching
4148	5.350	the_feel_felt_found+ownership_language+concrete_next_steps	discard	add_concrete_next_steps
4149	5.237	the_feel_felt_found+ownership_language	discard	tone_change
4150	5.013	the_feel_felt_found+personal_touch	discard	swap_ownership_language_for_personal_touch
4151	5.138	the_feel_felt_found+emotional_labeling	discard	swap_ownership_language_for_emotional_labeling
4152	4.925	none	discard	crossover
4153	5.550	the_feel_felt_found	discard	crossover
4154	5.238	the_feel_felt_found+ownership_language	discard	crossover
4155	5.037	ownership_language+personal_touch	discard	swap_the_feel_felt_found_for_personal_touch
4156	5.325	the_feel_felt_found	discard	remove_ownership_language
4157	4.888	the_feel_felt_found	discard	crossover
4158	5.138	the_feel_felt_found+ownership_language	discard	tone_change
4159	5.237	the_feel_felt_found+ownership_language	discard	temp_0.65
4160	5.450	none	discard	crossover
4161	5.325	the_feel_felt_found+mirroring	discard	swap_ownership_language_for_mirroring
4162	5.200	ownership_language	discard	crossover
4163	5.138	the_feel_felt_found+validation_before_solution	discard	swap_ownership_language_for_validation_before_solution
4164	5.113	the_feel_felt_found	discard	crossover
4165	5.425	the_feel_felt_found+ownership_language	discard	tone_change
4166	5.200	the_feel_felt_found+emotional_labeling	discard	swap_ownership_language_for_emotional_labeling
4167	5.450	the_feel_felt_found+ownership_language	discard	tone_change
4168	5.138	ownership_language	discard	crossover
4169	4.763	the_feel_felt_found	discard	remove_ownership_language
4170	4.800	the_feel_felt_found+ownership_language	discard	crossover
4171	4.825	the_feel_felt_found+ownership_language	discard	tone_change
4172	5.037	the_feel_felt_found+warmth_injection	discard	swap_ownership_language_for_warmth_injection
4173	5.237	the_feel_felt_found+ownership_language+proactive_extras	discard	add_proactive_extras
4174	5.125	the_feel_felt_found+ownership_language	discard	tone_change
4175	5.550	the_feel_felt_found	discard	remove_ownership_language
4176	5.650	ownership_language+warmth_injection	discard	swap_the_feel_felt_found_for_warmth_injection
4177	5.138	the_feel_felt_found+ownership_language	discard	temp_0.75
4178	4.888	the_feel_felt_found+never_say_calm_down	discard	swap_ownership_language_for_never_say_calm_down
4179	5.013	the_feel_felt_found+strategic_agreement	discard	swap_ownership_language_for_strategic_agreement
4180	5.238	the_feel_felt_found+ownership_language+warmth_injection	discard	add_warmth_injection
4181	4.713	the_feel_felt_found+ownership_language+validation_before_solution	discard	add_validation_before_solution
4182	5.450	the_feel_felt_found+ownership_language+energy_matching	discard	add_energy_matching
4183	5.112	the_feel_felt_found+ownership_language	discard	tone_change
4184	5.237	the_feel_felt_found+ownership_language	discard	tone_change
4185	5.450	the_feel_felt_found+never_say_calm_down	discard	swap_ownership_language_for_never_say_calm_down
4186	5.425	the_feel_felt_found+ownership_language	discard	tone_change
4187	5.137	the_feel_felt_found+ownership_language	discard	tone_change
4188	5.237	the_feel_felt_found+ownership_language+concrete_next_steps	discard	add_concrete_next_steps
4189	4.825	the_feel_felt_found+ownership_language	discard	temp_0.75
4190	5.550	the_feel_felt_found+ownership_language+emotional_labeling	discard	add_emotional_labeling
4191	5.325	ownership_language+energy_matching	discard	swap_the_feel_felt_found_for_energy_matching
4192	5.425	the_feel_felt_found+ownership_language	discard	tone_change
4193	5.450	the_feel_felt_found+ownership_language	discard	tone_change
4194	4.987	the_feel_felt_found+never_say_calm_down	discard	swap_ownership_language_for_never_say_calm_down
4195	5.425	ownership_language	discard	crossover
4196	4.513	the_feel_felt_found+validation_before_solution	discard	swap_ownership_language_for_validation_before_solution
4197	4.925	the_feel_felt_found+ownership_language	discard	temp_0.95
4198	4.888	the_feel_felt_found+ownership_language	discard	tone_change
4199	5.238	the_feel_felt_found+ownership_language	discard	crossover
4200	5.450	the_feel_felt_found+ownership_language	discard	temp_0.90
4201	5.138	the_feel_felt_found+strategic_agreement	discard	swap_ownership_language_for_strategic_agreement
4202	4.900	ownership_language+proactive_extras	discard	swap_the_feel_felt_found_for_proactive_extras
4203	5.650	the_feel_felt_found+ownership_language	discard	tone_change
4204	5.325	ownership_language+concrete_next_steps	discard	swap_the_feel_felt_found_for_concrete_next_steps
4205	5.450	the_feel_felt_found+ownership_language	discard	temp_0.90
4206	5.325	the_feel_felt_found+concrete_next_steps	discard	swap_ownership_language_for_concrete_next_steps
4207	5.138	the_feel_felt_found	discard	remove_ownership_language
4208	5.213	the_feel_felt_found+ownership_language+never_say_calm_down	discard	add_never_say_calm_down
4209	5.550	the_feel_felt_found+ownership_language+strategic_agreement	discard	add_strategic_agreement
