generation	eq_score	techniques	status	description
3098	5.325	the_feel_felt_found+ownership_language	discard	tone_change
3099	5.138	ownership_language+warmth_injection	discard	swap_the_feel_felt_found_for_warmth_injection
3100	5.238	the_feel_felt_found+ownership_language+proactive_extras	discard	add_proactive_extras
3101	5.338	the_feel_felt_found	discard	crossover
3102	5.013	ownership_language	discard	remove_the_feel_felt_found
3103	4.825	the_feel_felt_found+ownership_language	discard	tone_change
3104	5.550	the_feel_felt_found+ownership_language	discard	tone_change
3105	5.450	the_feel_felt_found+ownership_language	discard	crossover
3106	5.138	the_feel_felt_found+ownership_language	discard	temp_0.90
3107	5.325	ownership_language+personal_touch	discard	swap_the_feel_felt_found_for_personal_touch
3108	5.237	the_feel_felt_found+ownership_language	discard	temp_0.70
3109	5.138	the_feel_felt_found	discard	remove_ownership_language
3110	4.575	ownership_language	discard	remove_the_feel_felt_found
3111	4.900	the_feel_felt_found+ownership_language	discard	tone_change
3112	5.237	the_feel_felt_found+ownership_language+validation_before_solution	discard	add_validation_before_solution
3113	5.350	the_feel_felt_found+ownership_language	discard	tone_change
3114	5.450	none	discard	crossover
3115	5.225	the_feel_felt_found+ownership_language	discard	crossover
3116	5.450	the_feel_felt_found+ownership_language	discard	tone_change
3117	4.575	the_feel_felt_found	discard	crossover
3118	5.113	the_feel_felt_found+ownership_language	discard	tone_change
3119	4.913	ownership_language+never_say_calm_down	discard	swap_the_feel_felt_found_for_never_say_calm_down
3120	4.700	the_feel_felt_found+ownership_language	discard	temp_0.85
3121	5.450	the_feel_felt_found+never_say_calm_down	discard	swap_ownership_language_for_never_say_calm_down
3122	5.138	the_feel_felt_found+ownership_language+energy_matching	discard	add_energy_matching
3123	5.325	the_feel_felt_found	discard	remove_ownership_language
3124	5.525	the_feel_felt_found+ownership_language	discard	crossover
3125	4.825	the_feel_felt_found+ownership_language	discard	temp_0.70
3126	5.325	the_feel_felt_found+ownership_language	discard	temp_0.90
3127	5.013	the_feel_felt_found+ownership_language	discard	temp_0.95
3128	5.112	the_feel_felt_found+ownership_language+energy_matching	discard	add_energy_matching
3129	5.450	the_feel_felt_found	discard	crossover
3130	5.325	the_feel_felt_found+personal_touch	discard	swap_ownership_language_for_personal_touch
3131	5.238	the_feel_felt_found+casual_professionalism	discard	swap_ownership_language_for_casual_professionalism
3132	5.088	ownership_language+casual_professionalism	discard	swap_the_feel_felt_found_for_casual_professionalism
3133	5.525	the_feel_felt_found+warmth_injection	discard	swap_ownership_language_for_warmth_injection
3134	5.237	the_feel_felt_found+ownership_language+mirroring	discard	add_mirroring
3135	5.338	the_feel_felt_found+ownership_language+personal_touch	discard	add_personal_touch
3136	5.138	ownership_language+casual_professionalism	discard	swap_the_feel_felt_found_for_casual_professionalism
3137	5.550	the_feel_felt_found+ownership_language	discard	tone_change
3138	5.425	the_feel_felt_found+ownership_language+concrete_next_steps	discard	add_concrete_next_steps
3139	5.450	the_feel_felt_found+ownership_language	discard	tone_change
3140	5.450	the_feel_felt_found+ownership_language	discard	tone_change
3141	5.450	the_feel_felt_found+ownership_language	discard	tone_change
3142	5.450	the_feel_felt_found+ownership_language+energy_matching	discard	add_energy_matching
3143	5.550	the_feel_felt_found+ownership_language+energy_matching	discard	add_energy_matching
3144	5.325	the_feel_felt_found+ownership_language+personal_touch	discard	add_personal_touch
3145	5.237	the_feel_felt_found+ownership_language	discard	tone_change
3146	5.550	the_feel_felt_found	discard	remove_ownership_language
3147	5.237	the_feel_felt_found+ownership_language+strategic_agreement	discard	add_strategic_agreement
3148	5.100	the_feel_felt_found+ownership_language	discard	temp_0.75
3149	5.013	the_feel_felt_found+ownership_language	discard	tone_change
3150	5.025	the_feel_felt_found+ownership_language	discard	temp_0.75
3151	5.550	the_feel_felt_found+ownership_language	discard	temp_0.70
3152	5.425	the_feel_felt_found	discard	remove_ownership_language
3153	5.338	the_feel_felt_found+ownership_language+emotional_labeling	discard	add_emotional_labeling
3154	5.200	the_feel_felt_found+ownership_language+warmth_injection	discard	add_warmth_injection
3155	5.013	the_feel_felt_found+proactive_extras	discard	swap_ownership_language_for_proactive_extras
3156	5.325	the_feel_felt_found+ownership_language	discard	tone_change
3157	5.025	the_feel_felt_found+ownership_language	discard	tone_change
3158	5.138	the_feel_felt_found+ownership_language	discard	tone_change
3159	5.325	the_feel_felt_found+ownership_language	discard	temp_0.85
3160	5.338	ownership_language+proactive_extras	discard	swap_the_feel_felt_found_for_proactive_extras
3161	4.925	the_feel_felt_found+ownership_language	discard	crossover
3162	5.112	the_feel_felt_found+ownership_language+casual_professionalism	discard	add_casual_professionalism
3163	4.825	the_feel_felt_found+ownership_language+emotional_labeling	discard	add_emotional_labeling
3164	5.450	the_feel_felt_found+ownership_language	discard	crossover
3165	5.237	ownership_language	discard	remove_the_feel_felt_found
3166	5.437	the_feel_felt_found+ownership_language+emotional_labeling	discard	add_emotional_labeling
3167	5.650	the_feel_felt_found+ownership_language+concrete_next_steps	discard	add_concrete_next_steps
3168	5.450	the_feel_felt_found+strategic_agreement	discard	swap_ownership_language_for_strategic_agreement
3169	5.325	the_feel_felt_found+ownership_language	discard	tone_change
3170	5.650	the_feel_felt_found	discard	remove_ownership_language
3171	4.912	the_feel_felt_found+ownership_language	discard	tone_change
3172	5.237	the_feel_felt_found+ownership_language+personal_touch	discard	add_personal_touch
3173	5.325	the_feel_felt_found+ownership_language	discard	tone_change
3174	5.425	the_feel_felt_found+ownership_language	discard	tone_change
3175	5.013	ownership_language	discard	remove_the_feel_felt_found
3176	4.812	ownership_language+strategic_agreement	discard	swap_the_feel_felt_found_for_strategic_agreement
3177	5.338	ownership_language	discard	remove_the_feel_felt_found
3178	4.925	the_feel_felt_found	discard	remove_ownership_language
3179	5.025	none	discard	crossover
3180	5.013	ownership_language+personal_touch	discard	swap_the_feel_felt_found_for_personal_touch
3181	5.425	the_feel_felt_found+ownership_language	discard	temp_0.70
3182	5.112	the_feel_felt_found+ownership_language+never_say_calm_down	discard	add_never_say_calm_down
3183	5.337	the_feel_felt_found+ownership_language	discard	tone_change
3184	5.238	the_feel_felt_found+ownership_language	discard	temp_0.70
3185	4.888	the_feel_felt_found+ownership_language+concrete_next_steps	discard	add_concrete_next_steps
3186	5.200	the_feel_felt_found+ownership_language	discard	tone_change
3187	5.450	the_feel_felt_found+ownership_language	discard	crossover
3188	5.338	the_feel_felt_found+ownership_language+mirroring	discard	add_mirroring
3189	5.112	the_feel_felt_found+ownership_language	discard	temp_0.85
3190	5.200	the_feel_felt_found+ownership_language	discard	temp_0.90
3191	5.650	the_feel_felt_found+ownership_language	discard	tone_change
3192	5.550	the_feel_felt_found+ownership_language+validation_before_solution	discard	add_validation_before_solution
3193	5.450	the_feel_felt_found+ownership_language+casual_professionalism	discard	add_casual_professionalism
3194	5.013	the_feel_felt_found+energy_matching	discard	swap_ownership_language_for_energy_matching
3195	5.650	ownership_language	discard	remove_the_feel_felt_found
3196	5.013	the_feel_felt_found	discard	crossover
3197	5.550	the_feel_felt_found+validation_before_solution	discard	swap_ownership_language_for_validation_before_solution
3198	5.338	the_feel_felt_found+ownership_language	discard	crossover
3199	4.700	the_feel_felt_found+ownership_language+strategic_agreement	discard	add_strategic_agreement
3200	5.013	the_feel_felt_found+ownership_language	discard	tone_change
3201	5.200	the_feel_felt_found+ownership_language	discard	tone_change
3202	4.713	the_feel_felt_found+ownership_language	discard	crossover
3203	5.325	ownership_language+personal_touch	discard	swap_the_feel_felt_found_for_personal_touch
3204	4.925	the_feel_felt_found+ownership_language	discard	temp_0.85
3205	5.025	the_feel_felt_found+ownership_language	discard	tone_change
3206	5.550	the_feel_felt_found+ownership_language	discard	tone_change
3207	5.338	the_feel_felt_found	discard	remove_ownership_language
3208	5.138	the_feel_felt_found	discard	crossover
3209	5.238	the_feel_felt_found+ownership_language+energy_matching	discard	add_energy_matching
3210	5.112	the_feel_felt_found+ownership_language	discard	crossover
3211	5.425	the_feel_felt_found+ownership_language	discard	crossover
3212	4.925	the_feel_felt_found+ownership_language	discard	temp_0.75
3213	5.238	the_feel_felt_found+ownership_language	discard	temp_0.75
3214	5.013	the_feel_felt_found+ownership_language	discard	crossover
3215	5.225	the_feel_felt_found+ownership_language	discard	temp_0.75
3216	5.238	the_feel_felt_found+ownership_language	discard	tone_change
3217	4.925	the_feel_felt_found+ownership_language	discard	temp_0.95
3218	5.013	ownership_language	discard	remove_the_feel_felt_found
3219	5.138	the_feel_felt_found+ownership_language+casual_professionalism	discard	add_casual_professionalism
3220	5.550	the_feel_felt_found+ownership_language	discard	tone_change
3221	5.200	the_feel_felt_found	discard	remove_ownership_language
3222	5.025	the_feel_felt_found+ownership_language	discard	tone_change
3223	5.212	the_feel_felt_found+ownership_language	discard	temp_0.95
3224	5.012	the_feel_felt_found+ownership_language	discard	tone_change
3225	5.138	the_feel_felt_found+ownership_language	discard	tone_change
3226	4.700	the_feel_felt_found+ownership_language	discard	tone_change
3227	5.213	ownership_language+genuine_admission	discard	swap_the_feel_felt_found_for_genuine_admission
3228	5.013	the_feel_felt_found+ownership_language+never_say_calm_down	discard	add_never_say_calm_down
3229	5.325	the_feel_felt_found+ownership_language+proactive_extras	discard	add_proactive_extras
3230	5.138	the_feel_felt_found+ownership_language	discard	crossover
3231	5.013	the_feel_felt_found+ownership_language+warmth_injection	discard	add_warmth_injection
3232	5.213	the_feel_felt_found+ownership_language	discard	tone_change
3233	5.425	the_feel_felt_found+ownership_language+validation_before_solution	discard	add_validation_before_solution
3234	5.138	the_feel_felt_found	discard	remove_ownership_language
3235	5.338	the_feel_felt_found+genuine_admission	discard	swap_ownership_language_for_genuine_admission
3236	4.800	the_feel_felt_found+ownership_language	discard	temp_0.85
3237	5.237	ownership_language	discard	crossover
3238	5.325	the_feel_felt_found+ownership_language+genuine_admission	discard	add_genuine_admission
3239	5.200	ownership_language	discard	crossover
3240	5.113	the_feel_felt_found+casual_professionalism	discard	swap_ownership_language_for_casual_professionalism
3241	5.450	none	discard	crossover
3242	5.237	the_feel_felt_found+ownership_language	discard	tone_change
3243	5.425	the_feel_felt_found+ownership_language	discard	crossover
3244	5.013	the_feel_felt_found+ownership_language	discard	crossover
3245	5.013	the_feel_felt_found+ownership_language	discard	tone_change
3246	5.138	the_feel_felt_found+ownership_language	discard	temp_0.65
3247	5.325	the_feel_felt_found+ownership_language+proactive_extras	discard	add_proactive_extras
3248	4.925	the_feel_felt_found+ownership_language+validation_before_solution	discard	add_validation_before_solution
3249	5.325	the_feel_felt_found+ownership_language	discard	temp_0.95
3250	5.238	ownership_language+strategic_agreement	discard	swap_the_feel_felt_found_for_strategic_agreement
3251	5.325	the_feel_felt_found+ownership_language+mirroring	discard	add_mirroring
3252	4.825	the_feel_felt_found+ownership_language	discard	tone_change
3253	4.700	the_feel_felt_found+ownership_language+warmth_injection	discard	add_warmth_injection
3254	5.550	the_feel_felt_found+strategic_agreement	discard	swap_ownership_language_for_strategic_agreement
3255	5.550	ownership_language	discard	crossover
3256	5.650	the_feel_felt_found+ownership_language	discard	tone_change
3257	5.138	the_feel_felt_found+ownership_language+concrete_next_steps	discard	add_concrete_next_steps
3258	5.237	the_feel_felt_found+ownership_language	discard	temp_0.75
3259	5.550	the_feel_felt_found+ownership_language	discard	tone_change
3260	5.350	the_feel_felt_found+ownership_language+strategic_agreement	discard	add_strategic_agreement
3261	5.237	the_feel_felt_found+ownership_language+energy_matching	discard	add_energy_matching
3262	4.825	the_feel_felt_found+genuine_admission	discard	swap_ownership_language_for_genuine_admission
3263	5.325	ownership_language	discard	remove_the_feel_felt_found
3264	5.213	the_feel_felt_found+ownership_language	discard	tone_change
3265	5.325	the_feel_felt_found+ownership_language+strategic_agreement	discard	add_strategic_agreement
3266	5.112	the_feel_felt_found+ownership_language	discard	tone_change
3267	4.888	the_feel_felt_found+ownership_language+validation_before_solution	discard	add_validation_before_solution
3268	5.550	the_feel_felt_found+energy_matching	discard	swap_ownership_language_for_energy_matching
3269	5.550	the_feel_felt_found+ownership_language	discard	tone_change
3270	5.238	the_feel_felt_found+casual_professionalism	discard	swap_ownership_language_for_casual_professionalism
3271	5.112	the_feel_felt_found+ownership_language	discard	temp_0.70
3272	5.237	the_feel_felt_found+ownership_language	discard	crossover
3273	4.300	the_feel_felt_found+ownership_language+emotional_labeling	discard	add_emotional_labeling
3274	5.450	the_feel_felt_found+ownership_language	discard	crossover
3275	5.100	the_feel_felt_found+ownership_language	discard	crossover
3276	4.825	the_feel_felt_found+ownership_language	discard	crossover
3277	5.550	the_feel_felt_found+ownership_language	discard	temp_0.85
3278	5.450	the_feel_felt_found	discard	remove_ownership_language
3279	4.800	the_feel_felt_found+ownership_language+genuine_admission	discard	add_genuine_admission
3280	5.550	the_feel_felt_found+ownership_language	discard	tone_change
3281	5.425	the_feel_felt_found+ownership_language	discard	temp_0.85
3282	4.925	ownership_language+energy_matching	discard	swap_the_feel_felt_found_for_energy_matching
3283	5.138	the_feel_felt_found+ownership_language+emotional_labeling	discard	add_emotional_labeling
3284	5.450	the_feel_felt_found+ownership_language	discard	tone_change
3285	5.300	the_feel_felt_found+ownership_language+mirroring	discard	add_mirroring
3286	5.138	the_feel_felt_found	discard	crossover
3287	5.237	the_feel_felt_found+ownership_language	discard	temp_0.65
3288	5.213	the_feel_felt_found+ownership_language+emotional_labeling	discard	add_emotional_labeling
3289	5.037	the_feel_felt_found+ownership_language	discard	temp_0.85
3290	5.650	the_feel_felt_found+ownership_language+concrete_next_steps	discard	add_concrete_next_steps
3291	5.112	none	discard	crossover
3292	5.550	the_feel_felt_found+ownership_language+emotional_labeling	discard	add_emotional_labeling
3293	5.237	the_feel_felt_found+ownership_language+concrete_next_steps	discard	add_concrete_next_steps
3294	5.075	the_feel_felt_found+ownership_language+warmth_injection	discard	add_warmth_injection
3295	5.138	the_feel_felt_found+ownership_language+validation_before_solution	discard	add_validation_before_solution
3296	5.237	the_feel_felt_found+ownership_language	discard	tone_change
3297	5.525	the_feel_felt_found+ownership_language+genuine_admission	discard	add_genuine_admission
3298	5.350	ownership_language+emotional_labeling	discard	swap_the_feel_felt_found_for_emotional_labeling
3299	5.425	ownership_language	discard	crossover
3300	5.450	ownership_language+never_say_calm_down	discard	swap_the_feel_felt_found_for_never_say_calm_down
3301	4.912	the_feel_felt_found+ownership_language+never_say_calm_down	discard	add_never_say_calm_down
3302	5.550	the_feel_felt_found+ownership_language	discard	temp_0.85
3303	4.825	the_feel_felt_found+ownership_language	discard	temp_0.75
3304	5.213	the_feel_felt_found+ownership_language	discard	crossover
3305	4.925	the_feel_felt_found+ownership_language	discard	temp_0.65
3306	5.450	the_feel_felt_found+ownership_language	discard	temp_0.95
3307	5.237	the_feel_felt_found+ownership_language	discard	temp_0.85
3308	5.650	the_feel_felt_found+ownership_language	discard	temp_0.85
3309	4.700	the_feel_felt_found+ownership_language	discard	tone_change
3310	5.013	ownership_language	discard	remove_the_feel_felt_found
3311	5.550	the_feel_felt_found+ownership_language	discard	tone_change
3312	5.325	the_feel_felt_found	discard	crossover
3313	5.450	the_feel_felt_found	discard	remove_ownership_language
3314	5.075	ownership_language	discard	crossover
3315	5.650	the_feel_felt_found+ownership_language	discard	temp_0.85
3316	4.763	ownership_language+genuine_admission	discard	swap_the_feel_felt_found_for_genuine_admission
3317	5.425	ownership_language	discard	crossover
3318	5.338	the_feel_felt_found+ownership_language	discard	tone_change
3319	5.325	the_feel_felt_found+ownership_language+casual_professionalism	discard	add_casual_professionalism
3320	5.038	the_feel_felt_found+ownership_language+never_say_calm_down	discard	add_never_say_calm_down
3321	5.237	ownership_language+warmth_injection	discard	swap_the_feel_felt_found_for_warmth_injection
3322	5.138	the_feel_felt_found	discard	remove_ownership_language
3323	5.350	the_feel_felt_found	discard	crossover
3324	5.138	the_feel_felt_found+ownership_language	discard	crossover
3325	5.138	the_feel_felt_found+ownership_language	discard	crossover
3326	5.138	the_feel_felt_found+ownership_language	discard	crossover
3327	5.213	the_feel_felt_found+ownership_language	discard	tone_change
3328	5.425	the_feel_felt_found+ownership_language+emotional_labeling	discard	add_emotional_labeling
3329	5.138	the_feel_felt_found+ownership_language	discard	tone_change
3330	5.238	the_feel_felt_found	discard	crossover
3331	4.925	the_feel_felt_found+ownership_language+strategic_agreement	discard	add_strategic_agreement
3332	5.138	the_feel_felt_found+ownership_language	discard	temp_0.90
3333	5.550	the_feel_felt_found+ownership_language	discard	tone_change
3334	4.925	the_feel_felt_found+ownership_language	discard	temp_0.75
3335	5.450	ownership_language	discard	remove_the_feel_felt_found
3336	5.237	the_feel_felt_found	discard	crossover
3337	5.325	the_feel_felt_found+ownership_language+proactive_extras	discard	add_proactive_extras
3338	5.013	the_feel_felt_found+ownership_language+genuine_admission	discard	add_genuine_admission
3339	5.350	the_feel_felt_found+casual_professionalism	discard	swap_ownership_language_for_casual_professionalism
3340	5.450	the_feel_felt_found+ownership_language	discard	crossover
3341	5.325	the_feel_felt_found+ownership_language	discard	temp_0.70
3342	5.425	the_feel_felt_found	discard	crossover
3343	5.525	the_feel_felt_found+ownership_language+genuine_admission	discard	add_genuine_admission
3344	5.338	the_feel_felt_found+ownership_language	discard	crossover
3345	5.425	the_feel_felt_found+ownership_language	discard	tone_change
3346	4.888	the_feel_felt_found+mirroring	discard	swap_ownership_language_for_mirroring
3347	5.550	the_feel_felt_found+ownership_language+warmth_injection	discard	add_warmth_injection
3348	5.550	the_feel_felt_found+ownership_language	discard	tone_change
3349	5.350	ownership_language+emotional_labeling	discard	swap_the_feel_felt_found_for_emotional_labeling
3350	5.425	the_feel_felt_found+ownership_language	discard	tone_change
3351	5.013	the_feel_felt_found+ownership_language+never_say_calm_down	discard	add_never_say_calm_down
3352	5.138	the_feel_felt_found+energy_matching	discard	swap_ownership_language_for_energy_matching
3353	4.987	the_feel_felt_found+ownership_language	discard	crossover
3354	5.013	the_feel_felt_found+ownership_language	discard	tone_change
3355	5.425	ownership_language	discard	crossover
3356	5.112	the_feel_felt_found+ownership_language	discard	tone_change
3357	5.325	the_feel_felt_found+ownership_language	discard	tone_change
3358	5.650	ownership_language+warmth_injection	discard	swap_the_feel_felt_found_for_warmth_injection
3359	5.338	the_feel_felt_found+ownership_language	discard	tone_change
3360	5.037	the_feel_felt_found	discard	remove_ownership_language
3361	5.138	the_feel_felt_found+personal_touch	discard	swap_ownership_language_for_personal_touch
3362	5.525	the_feel_felt_found+ownership_language	discard	tone_change
3363	5.425	ownership_language+mirroring	discard	swap_the_feel_felt_found_for_mirroring
3364	5.425	the_feel_felt_found+ownership_language	discard	temp_0.65
3365	4.925	the_feel_felt_found+warmth_injection	discard	swap_ownership_language_for_warmth_injection
3366	5.037	the_feel_felt_found+ownership_language+never_say_calm_down	discard	add_never_say_calm_down
3367	4.513	the_feel_felt_found	discard	remove_ownership_language
3368	5.237	ownership_language	discard	crossover
3369	4.825	the_feel_felt_found+ownership_language+energy_matching	discard	add_energy_matching
3370	5.237	the_feel_felt_found	discard	crossover
3371	5.750	the_feel_felt_found+energy_matching	discard	swap_ownership_language_for_energy_matching
3372	5.450	ownership_language+emotional_labeling	discard	swap_the_feel_felt_found_for_emotional_labeling
3373	4.888	the_feel_felt_found+mirroring	discard	swap_ownership_language_for_mirroring
3374	5.550	the_feel_felt_found+ownership_language	discard	temp_0.65
3375	5.450	ownership_language+proactive_extras	discard	swap_the_feel_felt_found_for_proactive_extras
