generation	eq_score	techniques	status	description
14650	4.700	the_feel_felt_found+ownership_language	discard	tone_change
14651	5.350	the_feel_felt_found+ownership_language	discard	tone_change
14652	5.138	the_feel_felt_found+ownership_language	discard	crossover
14653	5.013	the_feel_felt_found+ownership_language+personal_touch	discard	add_personal_touch
14654	5.225	ownership_language+warmth_injection	discard	swap_the_feel_felt_found_for_warmth_injection
14655	5.325	ownership_language	discard	remove_the_feel_felt_found
14656	5.250	the_feel_felt_found+ownership_language	discard	tone_change
14657	5.300	ownership_language	discard	remove_the_feel_felt_found
14658	4.700	the_feel_felt_found+ownership_language	discard	temp_0.70
14659	5.425	the_feel_felt_found+ownership_language+mirroring	discard	add_mirroring
14660	5.225	the_feel_felt_found+ownership_language	discard	temp_0.90
14661	5.450	the_feel_felt_found+ownership_language	discard	crossover
14662	5.450	ownership_language	discard	remove_the_feel_felt_found
14663	5.013	the_feel_felt_found+ownership_language+never_say_calm_down	discard	add_never_say_calm_down
14664	5.213	the_feel_felt_found	discard	remove_ownership_language
14665	4.825	the_feel_felt_found+ownership_language+concrete_next_steps	discard	add_concrete_next_steps
14666	5.325	ownership_language+energy_matching	discard	swap_the_feel_felt_found_for_energy_matching
14667	4.888	the_feel_felt_found	discard	crossover
14668	5.550	the_feel_felt_found+ownership_language+proactive_extras	discard	add_proactive_extras
14669	5.237	the_feel_felt_found+ownership_language	discard	crossover
14670	5.338	the_feel_felt_found+ownership_language+proactive_extras	discard	add_proactive_extras
14671	5.550	the_feel_felt_found+ownership_language+concrete_next_steps	discard	add_concrete_next_steps
14672	5.138	the_feel_felt_found+ownership_language	discard	crossover
14673	5.200	the_feel_felt_found+ownership_language+genuine_admission	discard	add_genuine_admission
14674	5.138	the_feel_felt_found+ownership_language	discard	tone_change
14675	4.900	the_feel_felt_found+ownership_language+personal_touch	discard	add_personal_touch
14676	5.013	the_feel_felt_found+ownership_language+never_say_calm_down	discard	add_never_say_calm_down
14677	4.700	the_feel_felt_found+ownership_language	discard	crossover
14678	5.425	the_feel_felt_found+ownership_language	discard	tone_change
14679	5.325	the_feel_felt_found+ownership_language	discard	temp_0.90
14680	5.238	the_feel_felt_found+ownership_language	discard	crossover
14681	5.300	the_feel_felt_found+ownership_language+proactive_extras	discard	add_proactive_extras
14682	5.450	the_feel_felt_found	discard	crossover
14683	5.325	the_feel_felt_found+ownership_language	discard	tone_change
14684	4.812	the_feel_felt_found	discard	crossover
14685	5.525	ownership_language+concrete_next_steps	discard	swap_the_feel_felt_found_for_concrete_next_steps
14686	5.237	the_feel_felt_found+ownership_language	discard	temp_0.95
14687	5.338	the_feel_felt_found+ownership_language+casual_professionalism	discard	add_casual_professionalism
14688	5.138	the_feel_felt_found+ownership_language	discard	tone_change
14689	5.450	the_feel_felt_found+ownership_language+mirroring	discard	add_mirroring
14690	5.112	ownership_language+energy_matching	discard	swap_the_feel_felt_found_for_energy_matching
14691	5.013	the_feel_felt_found+ownership_language+concrete_next_steps	discard	add_concrete_next_steps
14692	5.200	the_feel_felt_found+ownership_language+validation_before_solution	discard	add_validation_before_solution
14693	5.450	the_feel_felt_found+ownership_language+genuine_admission	discard	add_genuine_admission
14694	5.650	the_feel_felt_found+ownership_language	discard	temp_0.90
14695	5.112	ownership_language	discard	crossover
14696	5.325	ownership_language+personal_touch	discard	swap_the_feel_felt_found_for_personal_touch
14697	4.912	the_feel_felt_found+concrete_next_steps	discard	swap_ownership_language_for_concrete_next_steps
14698	4.925	the_feel_felt_found+ownership_language+personal_touch	discard	add_personal_touch
14699	5.113	the_feel_felt_found+ownership_language	discard	tone_change
14700	5.112	the_feel_felt_found+ownership_language	discard	tone_change
14701	5.425	the_feel_felt_found+emotional_labeling	discard	swap_ownership_language_for_emotional_labeling
14702	5.325	the_feel_felt_found+ownership_language	discard	crossover
14703	5.350	the_feel_felt_found+ownership_language+personal_touch	discard	add_personal_touch
14704	5.425	the_feel_felt_found+ownership_language	discard	tone_change
14705	5.237	the_feel_felt_found+strategic_agreement	discard	swap_ownership_language_for_strategic_agreement
14706	4.825	the_feel_felt_found+ownership_language+never_say_calm_down	discard	add_never_say_calm_down
14707	5.550	ownership_language	discard	crossover
14708	5.425	the_feel_felt_found+ownership_language	discard	crossover
14709	5.450	the_feel_felt_found+ownership_language	discard	crossover
14710	5.112	the_feel_felt_found+ownership_language+casual_professionalism	discard	add_casual_professionalism
14711	4.925	the_feel_felt_found+ownership_language	discard	tone_change
14712	4.800	the_feel_felt_found+ownership_language	discard	crossover
14713	5.138	ownership_language	discard	remove_the_feel_felt_found
14714	5.238	the_feel_felt_found+ownership_language	discard	tone_change
14715	5.325	the_feel_felt_found+ownership_language+validation_before_solution	discard	add_validation_before_solution
14716	5.450	the_feel_felt_found+ownership_language+casual_professionalism	discard	add_casual_professionalism
14717	5.550	the_feel_felt_found+ownership_language	discard	tone_change
14718	5.450	the_feel_felt_found+strategic_agreement	discard	swap_ownership_language_for_strategic_agreement
14719	5.200	the_feel_felt_found+ownership_language	discard	crossover
14720	4.612	the_feel_felt_found+ownership_language	discard	tone_change
14721	5.113	ownership_language	discard	crossover
14722	5.550	ownership_language+validation_before_solution	discard	swap_the_feel_felt_found_for_validation_before_solution
14723	5.013	ownership_language	discard	crossover
14724	5.338	ownership_language+strategic_agreement	discard	swap_the_feel_felt_found_for_strategic_agreement
14725	4.825	the_feel_felt_found+ownership_language	discard	temp_0.95
14726	4.800	the_feel_felt_found+ownership_language	discard	temp_0.70
14727	5.338	the_feel_felt_found	discard	crossover
14728	5.013	the_feel_felt_found+ownership_language+proactive_extras	discard	add_proactive_extras
14729	5.112	ownership_language+proactive_extras	discard	swap_the_feel_felt_found_for_proactive_extras
14730	5.425	the_feel_felt_found+ownership_language	discard	tone_change
14731	4.900	the_feel_felt_found	discard	remove_ownership_language
14732	5.450	the_feel_felt_found+ownership_language+casual_professionalism	discard	add_casual_professionalism
14733	5.350	the_feel_felt_found+ownership_language+mirroring	discard	add_mirroring
14734	5.550	none	discard	crossover
14735	5.425	the_feel_felt_found+ownership_language	discard	crossover
14736	5.450	the_feel_felt_found+ownership_language	discard	tone_change
14737	5.550	the_feel_felt_found	discard	crossover
14738	4.900	the_feel_felt_found+ownership_language	discard	tone_change
14739	5.325	the_feel_felt_found+ownership_language	discard	tone_change
14740	5.425	ownership_language	discard	crossover
14741	5.138	the_feel_felt_found+energy_matching	discard	swap_ownership_language_for_energy_matching
14742	5.325	the_feel_felt_found+ownership_language	discard	tone_change
14743	4.825	the_feel_felt_found+mirroring	discard	swap_ownership_language_for_mirroring
14744	5.037	ownership_language+validation_before_solution	discard	swap_the_feel_felt_found_for_validation_before_solution
14745	5.525	the_feel_felt_found+ownership_language+personal_touch	discard	add_personal_touch
14746	5.425	ownership_language+casual_professionalism	discard	swap_the_feel_felt_found_for_casual_professionalism
14747	5.750	the_feel_felt_found+ownership_language+mirroring	discard	add_mirroring
14748	5.025	the_feel_felt_found+ownership_language	discard	tone_change
14749	5.138	the_feel_felt_found+ownership_language	discard	temp_0.85
14750	5.325	the_feel_felt_found+ownership_language	discard	temp_0.90
14751	4.925	the_feel_felt_found	discard	remove_ownership_language
14752	4.612	the_feel_felt_found	discard	crossover
14753	5.237	the_feel_felt_found+ownership_language	discard	tone_change
14754	5.138	the_feel_felt_found+ownership_language+casual_professionalism	discard	add_casual_professionalism
14755	5.338	the_feel_felt_found+ownership_language	discard	tone_change
14756	4.825	the_feel_felt_found+ownership_language+concrete_next_steps	discard	add_concrete_next_steps
14757	5.550	ownership_language+strategic_agreement	discard	swap_the_feel_felt_found_for_strategic_agreement
14758	5.325	the_feel_felt_found	discard	crossover
14759	4.825	the_feel_felt_found+ownership_language	discard	tone_change
14760	5.113	the_feel_felt_found+ownership_language	discard	crossover
14761	4.700	the_feel_felt_found+ownership_language	discard	temp_0.65
14762	4.713	the_feel_felt_found+ownership_language	discard	temp_0.75
14763	5.450	the_feel_felt_found+ownership_language+personal_touch	discard	add_personal_touch
14764	4.825	the_feel_felt_found+ownership_language	discard	crossover
14765	5.550	the_feel_felt_found+ownership_language	discard	crossover
14766	4.925	the_feel_felt_found+ownership_language+emotional_labeling	discard	add_emotional_labeling
14767	4.987	the_feel_felt_found+ownership_language	discard	crossover
14768	4.925	the_feel_felt_found+mirroring	discard	swap_ownership_language_for_mirroring
14769	5.450	ownership_language+mirroring	discard	swap_the_feel_felt_found_for_mirroring
14770	4.925	the_feel_felt_found+ownership_language	discard	temp_0.95
14771	5.138	the_feel_felt_found+ownership_language+personal_touch	discard	add_personal_touch
14772	4.825	the_feel_felt_found+ownership_language	discard	crossover
14773	5.237	the_feel_felt_found	discard	crossover
14774	4.912	the_feel_felt_found+ownership_language	discard	tone_change
14775	5.138	the_feel_felt_found+ownership_language+never_say_calm_down	discard	add_never_say_calm_down
14776	5.138	the_feel_felt_found+ownership_language+genuine_admission	discard	add_genuine_admission
14777	5.450	the_feel_felt_found+ownership_language+warmth_injection	discard	add_warmth_injection
14778	5.325	the_feel_felt_found+ownership_language	discard	tone_change
14779	5.113	the_feel_felt_found+validation_before_solution	discard	swap_ownership_language_for_validation_before_solution
14780	5.237	the_feel_felt_found+ownership_language	discard	tone_change
14781	5.425	the_feel_felt_found+ownership_language	discard	tone_change
14782	5.237	the_feel_felt_found+ownership_language	discard	tone_change
14783	5.237	the_feel_felt_found+ownership_language	discard	tone_change
14784	5.088	the_feel_felt_found+ownership_language	discard	temp_0.95
14785	5.025	ownership_language	discard	crossover
14786	5.325	the_feel_felt_found+ownership_language	discard	temp_0.95
14787	5.338	ownership_language	discard	crossover
14788	5.450	none	discard	crossover
14789	5.138	the_feel_felt_found	discard	crossover
14790	5.300	the_feel_felt_found+ownership_language	discard	crossover
14791	5.238	ownership_language	discard	crossover
14792	5.138	the_feel_felt_found+never_say_calm_down	discard	swap_ownership_language_for_never_say_calm_down
14793	5.013	the_feel_felt_found+ownership_language	discard	tone_change
14794	5.200	the_feel_felt_found+ownership_language+mirroring	discard	add_mirroring
14795	5.212	the_feel_felt_found+ownership_language	discard	crossover
14796	5.338	the_feel_felt_found+ownership_language+concrete_next_steps	discard	add_concrete_next_steps
14797	5.138	the_feel_felt_found+ownership_language+warmth_injection	discard	add_warmth_injection
14798	4.925	the_feel_felt_found+mirroring	discard	swap_ownership_language_for_mirroring
14799	5.138	none	discard	crossover
14800	4.925	the_feel_felt_found	discard	crossover
14801	5.112	ownership_language+emotional_labeling	discard	swap_the_feel_felt_found_for_emotional_labeling
14802	4.825	the_feel_felt_found+ownership_language	discard	temp_0.75
14803	5.237	the_feel_felt_found+never_say_calm_down	discard	swap_ownership_language_for_never_say_calm_down
14804	5.138	ownership_language+casual_professionalism	discard	swap_the_feel_felt_found_for_casual_professionalism
14805	4.825	the_feel_felt_found+ownership_language+personal_touch	discard	add_personal_touch
14806	5.450	the_feel_felt_found+ownership_language+never_say_calm_down	discard	add_never_say_calm_down
14807	4.825	the_feel_felt_found+ownership_language+mirroring	discard	add_mirroring
14808	5.237	the_feel_felt_found+ownership_language	discard	temp_0.75
14809	5.125	the_feel_felt_found+ownership_language+emotional_labeling	discard	add_emotional_labeling
14810	5.450	ownership_language	discard	remove_the_feel_felt_found
14811	5.350	the_feel_felt_found+ownership_language	discard	tone_change
14812	5.013	the_feel_felt_found+ownership_language	discard	temp_0.95
14813	5.213	the_feel_felt_found+ownership_language+warmth_injection	discard	add_warmth_injection
14814	5.013	the_feel_felt_found+ownership_language	discard	tone_change
14815	5.337	the_feel_felt_found+ownership_language	discard	tone_change
14816	5.112	the_feel_felt_found+ownership_language	discard	crossover
14817	5.300	the_feel_felt_found+ownership_language	discard	crossover
14818	5.425	the_feel_felt_found+concrete_next_steps	discard	swap_ownership_language_for_concrete_next_steps
14819	5.237	the_feel_felt_found	discard	crossover
14820	5.450	the_feel_felt_found+casual_professionalism	discard	swap_ownership_language_for_casual_professionalism
14821	5.113	the_feel_felt_found+ownership_language	discard	tone_change
14822	5.450	the_feel_felt_found+ownership_language	discard	tone_change
14823	5.250	the_feel_felt_found+ownership_language+emotional_labeling	discard	add_emotional_labeling
14824	5.013	the_feel_felt_found	discard	crossover
14825	5.138	the_feel_felt_found+ownership_language+never_say_calm_down	discard	add_never_say_calm_down
14826	5.138	the_feel_felt_found+ownership_language+proactive_extras	discard	add_proactive_extras
14827	5.013	ownership_language+energy_matching	discard	swap_the_feel_felt_found_for_energy_matching
14828	5.112	the_feel_felt_found+ownership_language	discard	temp_0.65
14829	5.337	the_feel_felt_found+ownership_language+emotional_labeling	discard	add_emotional_labeling
14830	5.138	the_feel_felt_found+ownership_language+energy_matching	discard	add_energy_matching
14831	5.112	the_feel_felt_found+ownership_language	discard	tone_change
14832	5.213	the_feel_felt_found+ownership_language+genuine_admission	discard	add_genuine_admission
14833	4.825	the_feel_felt_found+ownership_language	discard	tone_change
14834	5.112	the_feel_felt_found+warmth_injection	discard	swap_ownership_language_for_warmth_injection
14835	5.138	the_feel_felt_found+ownership_language	discard	tone_change
14836	5.237	ownership_language	discard	crossover
14837	5.450	the_feel_felt_found+ownership_language	discard	temp_0.70
14838	5.138	the_feel_felt_found+ownership_language+warmth_injection	discard	add_warmth_injection
14839	5.525	the_feel_felt_found+ownership_language	discard	tone_change
14840	5.200	the_feel_felt_found+ownership_language+mirroring	discard	add_mirroring
14841	4.925	the_feel_felt_found+ownership_language+concrete_next_steps	discard	add_concrete_next_steps
14842	5.237	ownership_language	discard	crossover
14843	5.138	the_feel_felt_found+ownership_language+strategic_agreement	discard	add_strategic_agreement
14844	5.112	the_feel_felt_found+ownership_language	discard	tone_change
14845	5.112	the_feel_felt_found+ownership_language+concrete_next_steps	discard	add_concrete_next_steps
14846	5.138	the_feel_felt_found	discard	crossover
14847	4.987	the_feel_felt_found+ownership_language	discard	crossover
14848	5.225	the_feel_felt_found+concrete_next_steps	discard	swap_ownership_language_for_concrete_next_steps
14849	5.112	the_feel_felt_found+ownership_language+casual_professionalism	discard	add_casual_professionalism
14850	5.237	the_feel_felt_found+ownership_language	discard	tone_change
14851	5.137	the_feel_felt_found+ownership_language	discard	crossover
14852	5.338	ownership_language+never_say_calm_down	discard	swap_the_feel_felt_found_for_never_say_calm_down
14853	5.450	the_feel_felt_found+ownership_language	discard	temp_0.65
14854	5.450	the_feel_felt_found	discard	crossover
14855	4.700	the_feel_felt_found+ownership_language+personal_touch	discard	add_personal_touch
14856	5.550	the_feel_felt_found+ownership_language	discard	temp_0.95
14857	5.300	the_feel_felt_found+personal_touch	discard	swap_ownership_language_for_personal_touch
14858	5.450	the_feel_felt_found+ownership_language+genuine_admission	discard	add_genuine_admission
14859	5.113	ownership_language+energy_matching	discard	swap_the_feel_felt_found_for_energy_matching
14860	5.113	the_feel_felt_found+emotional_labeling	discard	swap_ownership_language_for_emotional_labeling
14861	5.312	ownership_language+mirroring	discard	swap_the_feel_felt_found_for_mirroring
14862	5.213	the_feel_felt_found+ownership_language	discard	temp_0.65
14863	5.037	the_feel_felt_found+ownership_language	discard	tone_change
14864	5.400	the_feel_felt_found+never_say_calm_down	discard	swap_ownership_language_for_never_say_calm_down
14865	5.138	the_feel_felt_found	discard	remove_ownership_language
14866	5.200	the_feel_felt_found+ownership_language	discard	tone_change
14867	5.425	the_feel_felt_found+ownership_language+warmth_injection	discard	add_warmth_injection
14868	5.325	the_feel_felt_found+ownership_language	discard	temp_0.75
14869	5.450	the_feel_felt_found	discard	crossover
14870	5.325	the_feel_felt_found+ownership_language	discard	tone_change
14871	5.450	the_feel_felt_found+ownership_language	discard	temp_0.75
14872	5.237	the_feel_felt_found+ownership_language	discard	tone_change
14873	5.325	the_feel_felt_found+ownership_language+genuine_admission	discard	add_genuine_admission
14874	5.350	the_feel_felt_found+ownership_language+warmth_injection	discard	add_warmth_injection
14875	5.450	the_feel_felt_found+ownership_language	discard	crossover
14876	5.525	the_feel_felt_found+ownership_language	discard	tone_change
14877	5.013	the_feel_felt_found+ownership_language	discard	crossover
14878	5.550	the_feel_felt_found	discard	remove_ownership_language
14879	5.338	the_feel_felt_found+ownership_language	discard	temp_0.90
14880	5.138	the_feel_felt_found+ownership_language	discard	tone_change
14881	5.112	the_feel_felt_found+ownership_language	discard	temp_0.85
14882	5.250	the_feel_felt_found+ownership_language	discard	tone_change
14883	5.325	the_feel_felt_found+ownership_language	discard	crossover
14884	5.213	ownership_language+concrete_next_steps	discard	swap_the_feel_felt_found_for_concrete_next_steps
14885	5.325	the_feel_felt_found+warmth_injection	discard	swap_ownership_language_for_warmth_injection
14886	4.925	the_feel_felt_found+ownership_language+mirroring	discard	add_mirroring
14887	5.200	the_feel_felt_found+ownership_language	discard	crossover
14888	5.138	the_feel_felt_found+ownership_language+mirroring	discard	add_mirroring
14889	5.013	the_feel_felt_found+ownership_language	discard	temp_0.90
14890	5.325	the_feel_felt_found+ownership_language	discard	temp_0.90
14891	5.350	the_feel_felt_found+ownership_language+emotional_labeling	discard	add_emotional_labeling
14892	5.138	ownership_language	discard	crossover
14893	4.600	the_feel_felt_found+personal_touch	discard	swap_ownership_language_for_personal_touch
14894	5.325	ownership_language+validation_before_solution	discard	swap_the_feel_felt_found_for_validation_before_solution
14895	5.100	the_feel_felt_found	discard	remove_ownership_language
14896	5.325	the_feel_felt_found+ownership_language+genuine_admission	discard	add_genuine_admission
14897	5.337	the_feel_felt_found+casual_professionalism	discard	swap_ownership_language_for_casual_professionalism
14898	5.425	the_feel_felt_found+ownership_language	discard	crossover
14899	5.550	the_feel_felt_found+ownership_language+concrete_next_steps	discard	add_concrete_next_steps
14900	5.338	the_feel_felt_found+ownership_language	discard	crossover
14901	4.825	ownership_language	discard	remove_the_feel_felt_found
14902	5.325	the_feel_felt_found+ownership_language	discard	tone_change
14903	5.325	the_feel_felt_found+ownership_language	discard	tone_change
14904	5.550	the_feel_felt_found+never_say_calm_down	discard	swap_ownership_language_for_never_say_calm_down
14905	5.200	the_feel_felt_found+ownership_language	discard	tone_change
14906	4.925	the_feel_felt_found+ownership_language	discard	tone_change
14907	5.237	the_feel_felt_found+ownership_language+validation_before_solution	discard	add_validation_before_solution
14908	4.925	the_feel_felt_found+ownership_language	discard	temp_0.85
14909	5.138	the_feel_felt_found+ownership_language	discard	crossover
14910	5.338	the_feel_felt_found+ownership_language	discard	crossover
14911	5.138	the_feel_felt_found+ownership_language	discard	crossover
14912	5.325	the_feel_felt_found+ownership_language	discard	tone_change
14913	4.925	the_feel_felt_found+ownership_language	discard	temp_0.75
14914	4.888	the_feel_felt_found+ownership_language+warmth_injection	discard	add_warmth_injection
14915	5.325	the_feel_felt_found+ownership_language+emotional_labeling	discard	add_emotional_labeling
14916	5.138	the_feel_felt_found+ownership_language	discard	tone_change
14917	5.138	the_feel_felt_found	discard	crossover
14918	4.925	the_feel_felt_found+ownership_language	discard	temp_0.90
14919	4.825	ownership_language+genuine_admission	discard	swap_the_feel_felt_found_for_genuine_admission
14920	5.425	the_feel_felt_found+ownership_language	discard	temp_0.90
14921	5.038	the_feel_felt_found	discard	crossover
14922	5.337	the_feel_felt_found+validation_before_solution	discard	swap_ownership_language_for_validation_before_solution
