generation	eq_score	techniques	status	description
7533	4.700	ownership_language+validation_before_solution	discard	swap_the_feel_felt_found_for_validation_before_solution
7534	5.400	the_feel_felt_found+ownership_language+emotional_labeling	discard	add_emotional_labeling
7535	5.450	the_feel_felt_found+ownership_language+warmth_injection	discard	add_warmth_injection
7536	5.325	the_feel_felt_found+ownership_language	discard	tone_change
7537	5.650	the_feel_felt_found+genuine_admission	discard	swap_ownership_language_for_genuine_admission
7538	5.138	ownership_language	discard	remove_the_feel_felt_found
7539	5.237	the_feel_felt_found+ownership_language	discard	tone_change
7540	4.888	the_feel_felt_found+ownership_language+warmth_injection	discard	add_warmth_injection
7541	5.237	ownership_language+warmth_injection	discard	swap_the_feel_felt_found_for_warmth_injection
7542	5.425	the_feel_felt_found+ownership_language	discard	tone_change
7543	5.013	the_feel_felt_found+ownership_language	discard	temp_0.70
7544	4.888	the_feel_felt_found+ownership_language+casual_professionalism	discard	add_casual_professionalism
7545	4.925	the_feel_felt_found+ownership_language	discard	temp_0.95
7546	5.338	the_feel_felt_found+ownership_language	discard	crossover
7547	5.550	the_feel_felt_found+ownership_language+concrete_next_steps	discard	add_concrete_next_steps
7548	5.338	the_feel_felt_found	discard	remove_ownership_language
7549	5.550	the_feel_felt_found+validation_before_solution	discard	swap_ownership_language_for_validation_before_solution
7550	5.325	ownership_language	discard	crossover
7551	5.750	ownership_language+validation_before_solution	discard	swap_the_feel_felt_found_for_validation_before_solution
7552	5.250	the_feel_felt_found+ownership_language	discard	tone_change
7553	5.450	ownership_language+genuine_admission	discard	swap_the_feel_felt_found_for_genuine_admission
7554	5.325	the_feel_felt_found+ownership_language	discard	tone_change
7555	4.800	ownership_language+personal_touch	discard	swap_the_feel_felt_found_for_personal_touch
7556	5.550	the_feel_felt_found+ownership_language	discard	tone_change
7557	5.200	the_feel_felt_found+validation_before_solution	discard	swap_ownership_language_for_validation_before_solution
7558	5.238	the_feel_felt_found+ownership_language	discard	tone_change
7559	5.100	the_feel_felt_found+ownership_language	discard	crossover
7560	5.425	the_feel_felt_found+ownership_language	discard	temp_0.75
7561	5.525	the_feel_felt_found+ownership_language	discard	temp_0.75
7562	5.450	the_feel_felt_found+ownership_language	discard	tone_change
7563	5.325	the_feel_felt_found+ownership_language	discard	crossover
7564	5.138	the_feel_felt_found+ownership_language+proactive_extras	discard	add_proactive_extras
7565	5.450	the_feel_felt_found+ownership_language	discard	tone_change
7566	5.550	the_feel_felt_found+ownership_language	discard	temp_0.70
7567	5.350	ownership_language+personal_touch	discard	swap_the_feel_felt_found_for_personal_touch
7568	5.138	the_feel_felt_found	discard	crossover
7569	4.825	the_feel_felt_found+warmth_injection	discard	swap_ownership_language_for_warmth_injection
7570	5.550	the_feel_felt_found+ownership_language	discard	temp_0.75
7571	5.325	the_feel_felt_found+ownership_language+warmth_injection	discard	add_warmth_injection
7572	5.138	the_feel_felt_found	discard	remove_ownership_language
7573	5.325	the_feel_felt_found+ownership_language	discard	temp_0.70
7574	4.700	the_feel_felt_found+ownership_language	discard	tone_change
7575	4.913	the_feel_felt_found+ownership_language+strategic_agreement	discard	add_strategic_agreement
7576	5.237	the_feel_felt_found+strategic_agreement	discard	swap_ownership_language_for_strategic_agreement
7577	5.325	ownership_language+validation_before_solution	discard	swap_the_feel_felt_found_for_validation_before_solution
7578	4.825	the_feel_felt_found	discard	remove_ownership_language
7579	5.013	the_feel_felt_found+ownership_language	discard	crossover
7580	5.138	ownership_language	discard	remove_the_feel_felt_found
7581	5.112	the_feel_felt_found	discard	crossover
7582	5.450	the_feel_felt_found+casual_professionalism	discard	swap_ownership_language_for_casual_professionalism
7583	5.425	the_feel_felt_found+ownership_language	discard	temp_0.75
7584	5.138	the_feel_felt_found+ownership_language+casual_professionalism	discard	add_casual_professionalism
7585	5.550	the_feel_felt_found+ownership_language+warmth_injection	discard	add_warmth_injection
7586	5.237	the_feel_felt_found+ownership_language+personal_touch	discard	add_personal_touch
7587	5.138	the_feel_felt_found+energy_matching	discard	swap_ownership_language_for_energy_matching
7588	5.550	the_feel_felt_found+ownership_language	discard	temp_0.70
7589	5.225	the_feel_felt_found+strategic_agreement	discard	swap_ownership_language_for_strategic_agreement
7590	5.013	ownership_language	discard	crossover
7591	5.138	the_feel_felt_found+ownership_language	discard	temp_0.90
7592	5.225	the_feel_felt_found+ownership_language	discard	temp_0.75
7593	5.013	ownership_language	discard	crossover
7594	4.925	ownership_language+personal_touch	discard	swap_the_feel_felt_found_for_personal_touch
7595	5.450	the_feel_felt_found+ownership_language+genuine_admission	discard	add_genuine_admission
7596	5.325	ownership_language	discard	crossover
7597	5.325	ownership_language+personal_touch	discard	swap_the_feel_felt_found_for_personal_touch
7598	5.087	the_feel_felt_found+ownership_language	discard	temp_0.90
7599	5.237	the_feel_felt_found+ownership_language	discard	tone_change
7600	5.112	the_feel_felt_found+ownership_language	discard	crossover
7601	5.325	the_feel_felt_found+ownership_language	discard	crossover
7602	5.012	the_feel_felt_found+ownership_language+never_say_calm_down	discard	add_never_say_calm_down
7603	5.013	the_feel_felt_found+ownership_language	discard	temp_0.65
7604	5.325	the_feel_felt_found+ownership_language+emotional_labeling	discard	add_emotional_labeling
7605	5.450	the_feel_felt_found+ownership_language	discard	temp_0.75
7606	5.325	the_feel_felt_found+ownership_language+energy_matching	discard	add_energy_matching
7607	5.325	the_feel_felt_found+ownership_language+strategic_agreement	discard	add_strategic_agreement
7608	5.550	the_feel_felt_found	discard	crossover
7609	5.325	the_feel_felt_found+ownership_language+never_say_calm_down	discard	add_never_say_calm_down
7610	5.138	the_feel_felt_found+ownership_language+emotional_labeling	discard	add_emotional_labeling
7611	5.450	the_feel_felt_found+ownership_language+mirroring	discard	add_mirroring
7612	5.400	the_feel_felt_found+ownership_language	discard	temp_0.70
7613	5.350	ownership_language	discard	crossover
7614	5.138	the_feel_felt_found+ownership_language+validation_before_solution	discard	add_validation_before_solution
7615	5.550	the_feel_felt_found+strategic_agreement	discard	swap_ownership_language_for_strategic_agreement
7616	4.825	the_feel_felt_found+ownership_language+energy_matching	discard	add_energy_matching
7617	5.237	ownership_language+energy_matching	discard	swap_the_feel_felt_found_for_energy_matching
7618	5.237	the_feel_felt_found+ownership_language+strategic_agreement	discard	add_strategic_agreement
7619	5.213	the_feel_felt_found+ownership_language+energy_matching	discard	add_energy_matching
7620	5.338	the_feel_felt_found+ownership_language	discard	tone_change
7621	5.650	the_feel_felt_found	discard	remove_ownership_language
7622	5.025	none	discard	crossover
7623	5.325	ownership_language	discard	crossover
7624	5.425	the_feel_felt_found+ownership_language	discard	tone_change
7625	5.425	ownership_language+energy_matching	discard	swap_the_feel_felt_found_for_energy_matching
7626	5.225	ownership_language	discard	remove_the_feel_felt_found
7627	5.325	the_feel_felt_found+ownership_language	discard	tone_change
7628	5.237	the_feel_felt_found+ownership_language+never_say_calm_down	discard	add_never_say_calm_down
7629	5.650	the_feel_felt_found+genuine_admission	discard	swap_ownership_language_for_genuine_admission
7630	5.237	the_feel_felt_found	discard	remove_ownership_language
7631	5.113	the_feel_felt_found+ownership_language+emotional_labeling	discard	add_emotional_labeling
7632	5.013	the_feel_felt_found+warmth_injection	discard	swap_ownership_language_for_warmth_injection
7633	5.650	the_feel_felt_found+ownership_language	discard	tone_change
7634	4.300	the_feel_felt_found+ownership_language+emotional_labeling	discard	add_emotional_labeling
7635	5.325	the_feel_felt_found+ownership_language	discard	temp_0.85
7636	5.075	the_feel_felt_found+ownership_language+genuine_admission	discard	add_genuine_admission
7637	5.325	the_feel_felt_found+ownership_language	discard	temp_0.70
7638	5.450	the_feel_felt_found+ownership_language	discard	tone_change
7639	5.137	the_feel_felt_found+ownership_language+personal_touch	discard	add_personal_touch
7640	4.912	the_feel_felt_found+ownership_language	discard	tone_change
7641	5.225	the_feel_felt_found+ownership_language+warmth_injection	discard	add_warmth_injection
7642	4.925	none	discard	crossover
7643	5.650	the_feel_felt_found+ownership_language+proactive_extras	discard	add_proactive_extras
7644	5.088	the_feel_felt_found+ownership_language+genuine_admission	discard	add_genuine_admission
7645	5.650	the_feel_felt_found+ownership_language	discard	tone_change
7646	5.238	the_feel_felt_found+ownership_language+mirroring	discard	add_mirroring
7647	5.425	ownership_language	discard	crossover
7648	5.225	ownership_language+warmth_injection	discard	swap_the_feel_felt_found_for_warmth_injection
7649	5.138	ownership_language	discard	remove_the_feel_felt_found
7650	5.112	the_feel_felt_found+ownership_language	discard	crossover
7651	4.575	the_feel_felt_found+ownership_language+never_say_calm_down	discard	add_never_say_calm_down
7652	5.525	the_feel_felt_found+ownership_language+emotional_labeling	discard	add_emotional_labeling
7653	5.450	the_feel_felt_found+genuine_admission	discard	swap_ownership_language_for_genuine_admission
7654	4.925	the_feel_felt_found+ownership_language+warmth_injection	discard	add_warmth_injection
7655	5.450	the_feel_felt_found+ownership_language	discard	tone_change
7656	5.038	the_feel_felt_found+ownership_language+mirroring	discard	add_mirroring
7657	5.325	the_feel_felt_found	discard	remove_ownership_language
7658	4.712	ownership_language+emotional_labeling	discard	swap_the_feel_felt_found_for_emotional_labeling
7659	5.025	the_feel_felt_found+ownership_language+mirroring	discard	add_mirroring
7660	4.612	ownership_language+emotional_labeling	discard	swap_the_feel_felt_found_for_emotional_labeling
7661	5.138	the_feel_felt_found+ownership_language+concrete_next_steps	discard	add_concrete_next_steps
7662	5.550	the_feel_felt_found+ownership_language	discard	crossover
7663	5.013	ownership_language+mirroring	discard	swap_the_feel_felt_found_for_mirroring
7664	5.550	the_feel_felt_found+ownership_language+genuine_admission	discard	add_genuine_admission
7665	5.450	the_feel_felt_found+ownership_language	discard	tone_change
7666	5.200	the_feel_felt_found+ownership_language	discard	crossover
7667	4.925	the_feel_felt_found+ownership_language+warmth_injection	discard	add_warmth_injection
7668	5.100	ownership_language	discard	remove_the_feel_felt_found
7669	5.237	the_feel_felt_found+ownership_language+concrete_next_steps	discard	add_concrete_next_steps
7670	5.550	the_feel_felt_found+ownership_language	discard	temp_0.75
7671	5.350	the_feel_felt_found+ownership_language+casual_professionalism	discard	add_casual_professionalism
7672	4.888	the_feel_felt_found+genuine_admission	discard	swap_ownership_language_for_genuine_admission
7673	4.825	ownership_language	discard	remove_the_feel_felt_found
7674	5.200	the_feel_felt_found+ownership_language+energy_matching	discard	add_energy_matching
7675	4.612	the_feel_felt_found+ownership_language	discard	tone_change
7676	5.325	the_feel_felt_found	discard	remove_ownership_language
7677	5.425	the_feel_felt_found+ownership_language+personal_touch	discard	add_personal_touch
7678	5.450	the_feel_felt_found	discard	remove_ownership_language
7679	5.138	ownership_language	discard	crossover
7680	4.900	the_feel_felt_found+ownership_language	discard	crossover
7681	5.450	the_feel_felt_found+ownership_language	discard	temp_0.75
7682	5.013	the_feel_felt_found+ownership_language	discard	tone_change
7683	5.325	ownership_language+validation_before_solution	discard	swap_the_feel_felt_found_for_validation_before_solution
7684	5.125	the_feel_felt_found+ownership_language	discard	crossover
7685	5.013	the_feel_felt_found+ownership_language+energy_matching	discard	add_energy_matching
7686	5.137	the_feel_felt_found+ownership_language	discard	tone_change
7687	5.237	the_feel_felt_found+ownership_language+energy_matching	discard	add_energy_matching
7688	5.425	the_feel_felt_found+ownership_language+concrete_next_steps	discard	add_concrete_next_steps
7689	5.325	ownership_language+never_say_calm_down	discard	swap_the_feel_felt_found_for_never_say_calm_down
7690	4.888	the_feel_felt_found+ownership_language+casual_professionalism	discard	add_casual_professionalism
7691	5.138	the_feel_felt_found+ownership_language+warmth_injection	discard	add_warmth_injection
7692	4.825	ownership_language+genuine_admission	discard	swap_the_feel_felt_found_for_genuine_admission
7693	5.200	the_feel_felt_found+ownership_language	discard	crossover
7694	5.350	the_feel_felt_found+ownership_language	discard	temp_0.65
7695	5.550	the_feel_felt_found+ownership_language+proactive_extras	discard	add_proactive_extras
7696	5.138	the_feel_felt_found+casual_professionalism	discard	swap_ownership_language_for_casual_professionalism
7697	5.425	the_feel_felt_found+ownership_language+personal_touch	discard	add_personal_touch
7698	5.138	the_feel_felt_found	discard	remove_ownership_language
7699	5.237	the_feel_felt_found+ownership_language+mirroring	discard	add_mirroring
7700	5.550	ownership_language	discard	remove_the_feel_felt_found
7701	5.450	ownership_language	discard	remove_the_feel_felt_found
7702	5.550	the_feel_felt_found+ownership_language+energy_matching	discard	add_energy_matching
7703	5.138	the_feel_felt_found+ownership_language	discard	crossover
7704	4.600	the_feel_felt_found+ownership_language+genuine_admission	discard	add_genuine_admission
7705	5.238	the_feel_felt_found+ownership_language	discard	temp_0.75
7706	5.325	the_feel_felt_found+ownership_language	discard	tone_change
7707	5.250	the_feel_felt_found+strategic_agreement	discard	swap_ownership_language_for_strategic_agreement
7708	4.925	the_feel_felt_found+ownership_language+casual_professionalism	discard	add_casual_professionalism
7709	4.912	none	discard	crossover
7710	5.450	the_feel_felt_found+ownership_language+concrete_next_steps	discard	add_concrete_next_steps
7711	5.013	the_feel_felt_found+ownership_language+emotional_labeling	discard	add_emotional_labeling
7712	5.112	the_feel_felt_found+ownership_language	discard	crossover
7713	5.212	the_feel_felt_found+ownership_language	discard	tone_change
7714	5.650	ownership_language+genuine_admission	discard	swap_the_feel_felt_found_for_genuine_admission
7715	5.550	the_feel_felt_found+ownership_language	discard	temp_0.75
7716	5.550	the_feel_felt_found+ownership_language	discard	temp_0.75
7717	5.112	the_feel_felt_found+ownership_language	discard	temp_0.75
7718	5.425	the_feel_felt_found+ownership_language+personal_touch	discard	add_personal_touch
7719	4.700	the_feel_felt_found+ownership_language	discard	temp_0.75
7720	5.325	the_feel_felt_found+ownership_language	discard	temp_0.75
7721	5.138	the_feel_felt_found	discard	crossover
7722	4.800	the_feel_felt_found+ownership_language	discard	temp_0.95
7723	5.237	the_feel_felt_found+concrete_next_steps	discard	swap_ownership_language_for_concrete_next_steps
7724	5.013	the_feel_felt_found+mirroring	discard	swap_ownership_language_for_mirroring
7725	4.825	the_feel_felt_found+ownership_language	discard	crossover
7726	4.862	the_feel_felt_found+warmth_injection	discard	swap_ownership_language_for_warmth_injection
7727	5.300	ownership_language	discard	remove_the_feel_felt_found
7728	4.925	the_feel_felt_found+ownership_language	discard	tone_change
7729	5.325	the_feel_felt_found+ownership_language	discard	tone_change
7730	5.112	ownership_language	discard	crossover
7731	5.113	the_feel_felt_found+ownership_language	discard	crossover
7732	5.750	the_feel_felt_found+ownership_language	discard	crossover
7733	5.550	the_feel_felt_found+ownership_language	discard	tone_change
7734	5.237	the_feel_felt_found+ownership_language+energy_matching	discard	add_energy_matching
7735	5.325	the_feel_felt_found+ownership_language	discard	tone_change
7736	5.237	the_feel_felt_found+ownership_language+concrete_next_steps	discard	add_concrete_next_steps
7737	4.912	ownership_language	discard	remove_the_feel_felt_found
7738	5.112	the_feel_felt_found	discard	remove_ownership_language
7739	5.550	the_feel_felt_found+ownership_language	discard	tone_change
7740	5.450	the_feel_felt_found	discard	crossover
7741	5.325	ownership_language+personal_touch	discard	swap_the_feel_felt_found_for_personal_touch
7742	5.350	ownership_language+warmth_injection	discard	swap_the_feel_felt_found_for_warmth_injection
7743	5.013	the_feel_felt_found+ownership_language	discard	tone_change
7744	5.425	ownership_language+emotional_labeling	discard	swap_the_feel_felt_found_for_emotional_labeling
7745	4.612	the_feel_felt_found+ownership_language	discard	temp_0.90
7746	4.825	the_feel_felt_found+ownership_language	discard	tone_change
7747	5.038	the_feel_felt_found+ownership_language+energy_matching	discard	add_energy_matching
7748	5.013	the_feel_felt_found+ownership_language+never_say_calm_down	discard	add_never_say_calm_down
7749	5.650	the_feel_felt_found+ownership_language+concrete_next_steps	discard	add_concrete_next_steps
7750	5.237	the_feel_felt_found+ownership_language	discard	tone_change
7751	5.138	the_feel_felt_found+ownership_language+emotional_labeling	discard	add_emotional_labeling
7752	4.675	the_feel_felt_found	discard	remove_ownership_language
7753	5.112	the_feel_felt_found+ownership_language+emotional_labeling	discard	add_emotional_labeling
7754	5.237	the_feel_felt_found+ownership_language	discard	tone_change
7755	5.213	the_feel_felt_found+ownership_language	discard	tone_change
7756	5.213	the_feel_felt_found+ownership_language	discard	temp_0.70
7757	5.350	the_feel_felt_found+ownership_language	discard	tone_change
7758	5.300	the_feel_felt_found+ownership_language+warmth_injection	discard	add_warmth_injection
7759	5.450	the_feel_felt_found	discard	crossover
7760	5.138	the_feel_felt_found+ownership_language+casual_professionalism	discard	add_casual_professionalism
7761	5.425	the_feel_felt_found+ownership_language	discard	tone_change
7762	5.025	the_feel_felt_found+ownership_language	discard	tone_change
7763	5.013	the_feel_felt_found+ownership_language+mirroring	discard	add_mirroring
7764	5.325	the_feel_felt_found+ownership_language	discard	temp_0.85
7765	5.338	the_feel_felt_found+ownership_language+validation_before_solution	discard	add_validation_before_solution
7766	5.425	the_feel_felt_found+ownership_language+casual_professionalism	discard	add_casual_professionalism
7767	4.800	the_feel_felt_found+ownership_language+genuine_admission	discard	add_genuine_admission
7768	5.037	ownership_language	discard	remove_the_feel_felt_found
7769	5.325	ownership_language+never_say_calm_down	discard	swap_the_feel_felt_found_for_never_say_calm_down
7770	5.138	the_feel_felt_found	discard	crossover
7771	5.325	the_feel_felt_found+ownership_language+validation_before_solution	discard	add_validation_before_solution
7772	5.112	the_feel_felt_found+ownership_language+casual_professionalism	discard	add_casual_professionalism
7773	4.925	the_feel_felt_found+emotional_labeling	discard	swap_ownership_language_for_emotional_labeling
7774	5.325	the_feel_felt_found	discard	remove_ownership_language
7775	5.450	ownership_language+personal_touch	discard	swap_the_feel_felt_found_for_personal_touch
7776	5.113	the_feel_felt_found+ownership_language+genuine_admission	discard	add_genuine_admission
7777	5.113	the_feel_felt_found+ownership_language+validation_before_solution	discard	add_validation_before_solution
7778	5.138	the_feel_felt_found+mirroring	discard	swap_ownership_language_for_mirroring
7779	4.700	the_feel_felt_found+ownership_language+never_say_calm_down	discard	add_never_say_calm_down
7780	5.112	the_feel_felt_found+ownership_language	discard	tone_change
7781	5.112	the_feel_felt_found+ownership_language	discard	tone_change
7782	5.325	the_feel_felt_found+ownership_language+mirroring	discard	add_mirroring
7783	5.450	the_feel_felt_found	discard	crossover
7784	4.862	the_feel_felt_found+ownership_language	discard	tone_change
7785	5.013	the_feel_felt_found+ownership_language	discard	crossover
7786	5.037	ownership_language+warmth_injection	discard	swap_the_feel_felt_found_for_warmth_injection
7787	5.112	the_feel_felt_found+ownership_language	discard	crossover
7788	5.038	the_feel_felt_found+ownership_language	discard	tone_change
7789	5.425	the_feel_felt_found	discard	remove_ownership_language
7790	5.325	the_feel_felt_found+ownership_language	discard	crossover
7791	4.888	the_feel_felt_found+never_say_calm_down	discard	swap_ownership_language_for_never_say_calm_down
7792	5.337	ownership_language	discard	crossover
7793	5.138	the_feel_felt_found+ownership_language	discard	crossover
7794	4.925	the_feel_felt_found+ownership_language	discard	crossover
7795	5.425	the_feel_felt_found+ownership_language	discard	tone_change
7796	5.112	ownership_language	discard	remove_the_feel_felt_found
7797	5.550	the_feel_felt_found+ownership_language+strategic_agreement	discard	add_strategic_agreement
7798	5.138	the_feel_felt_found+ownership_language	discard	crossover
7799	5.213	the_feel_felt_found+ownership_language	discard	tone_change
7800	5.237	the_feel_felt_found+ownership_language	discard	temp_0.90
7801	5.200	ownership_language	discard	crossover
7802	5.237	the_feel_felt_found+ownership_language	discard	temp_0.90
