generation	eq_score	techniques	status	description
10279	5.037	the_feel_felt_found+ownership_language+energy_matching	discard	add_energy_matching
10280	4.800	the_feel_felt_found+ownership_language	discard	tone_change
10281	5.338	the_feel_felt_found+ownership_language	discard	tone_change
10282	5.450	the_feel_felt_found+ownership_language	discard	tone_change
10283	5.550	the_feel_felt_found+ownership_language	discard	crossover
10284	5.225	ownership_language+genuine_admission	discard	swap_the_feel_felt_found_for_genuine_admission
10285	4.925	the_feel_felt_found+ownership_language+personal_touch	discard	add_personal_touch
10286	5.325	ownership_language+mirroring	discard	swap_the_feel_felt_found_for_mirroring
10287	4.612	the_feel_felt_found+proactive_extras	discard	swap_ownership_language_for_proactive_extras
10288	5.112	the_feel_felt_found+ownership_language+never_say_calm_down	discard	add_never_say_calm_down
10289	5.138	the_feel_felt_found+ownership_language	discard	temp_0.65
10290	5.138	the_feel_felt_found+ownership_language	discard	tone_change
10291	5.550	ownership_language+energy_matching	discard	swap_the_feel_felt_found_for_energy_matching
10292	5.137	the_feel_felt_found+ownership_language	discard	crossover
10293	5.450	the_feel_felt_found+ownership_language	discard	tone_change
10294	5.425	the_feel_felt_found	discard	remove_ownership_language
10295	5.013	the_feel_felt_found+ownership_language+personal_touch	discard	add_personal_touch
10296	4.800	the_feel_felt_found+ownership_language+energy_matching	discard	add_energy_matching
10297	5.550	the_feel_felt_found+ownership_language	discard	temp_0.75
10298	5.425	the_feel_felt_found+ownership_language	discard	temp_0.85
10299	5.425	the_feel_felt_found+ownership_language	discard	temp_0.70
10300	5.138	the_feel_felt_found+ownership_language+mirroring	discard	add_mirroring
10301	5.225	the_feel_felt_found+ownership_language+concrete_next_steps	discard	add_concrete_next_steps
10302	5.425	the_feel_felt_found+never_say_calm_down	discard	swap_ownership_language_for_never_say_calm_down
10303	5.138	the_feel_felt_found+ownership_language	discard	tone_change
10304	5.650	the_feel_felt_found+ownership_language	discard	tone_change
10305	5.425	ownership_language+never_say_calm_down	discard	swap_the_feel_felt_found_for_never_say_calm_down
10306	5.550	the_feel_felt_found+ownership_language	discard	temp_0.95
10307	5.550	the_feel_felt_found+ownership_language+never_say_calm_down	discard	add_never_say_calm_down
10308	5.437	the_feel_felt_found+ownership_language+casual_professionalism	discard	add_casual_professionalism
10309	5.238	the_feel_felt_found+mirroring	discard	swap_ownership_language_for_mirroring
10310	5.550	the_feel_felt_found+ownership_language	discard	temp_0.90
10311	5.525	the_feel_felt_found	discard	remove_ownership_language
10312	5.200	the_feel_felt_found+ownership_language+energy_matching	discard	add_energy_matching
10313	5.237	the_feel_felt_found	discard	remove_ownership_language
10314	4.487	the_feel_felt_found+ownership_language	discard	temp_0.95
10315	5.550	the_feel_felt_found+ownership_language	discard	temp_0.95
10316	5.550	the_feel_felt_found+ownership_language	discard	tone_change
10317	5.300	the_feel_felt_found+ownership_language	discard	temp_0.90
10318	4.388	the_feel_felt_found+ownership_language	discard	tone_change
10319	5.350	the_feel_felt_found+ownership_language+personal_touch	discard	add_personal_touch
10320	4.613	the_feel_felt_found+genuine_admission	discard	swap_ownership_language_for_genuine_admission
10321	5.013	the_feel_felt_found+ownership_language	discard	tone_change
10322	5.338	the_feel_felt_found+ownership_language	discard	crossover
10323	5.138	the_feel_felt_found+ownership_language	discard	crossover
10324	5.650	the_feel_felt_found+ownership_language+mirroring	discard	add_mirroring
10325	5.137	the_feel_felt_found+ownership_language	discard	temp_0.75
10326	5.237	the_feel_felt_found+ownership_language	discard	tone_change
10327	5.550	the_feel_felt_found+ownership_language	discard	crossover
10328	5.650	ownership_language	discard	crossover
10329	5.325	the_feel_felt_found+ownership_language+personal_touch	discard	add_personal_touch
10330	5.200	the_feel_felt_found+ownership_language+warmth_injection	discard	add_warmth_injection
10331	4.925	the_feel_felt_found	discard	remove_ownership_language
10332	4.825	the_feel_felt_found+ownership_language	discard	temp_0.85
10333	5.450	ownership_language	discard	remove_the_feel_felt_found
10334	5.238	the_feel_felt_found+ownership_language	discard	tone_change
10335	4.925	the_feel_felt_found+ownership_language	discard	temp_0.90
10336	5.075	ownership_language	discard	crossover
10337	5.425	the_feel_felt_found+ownership_language	discard	tone_change
10338	5.425	the_feel_felt_found	discard	crossover
10339	5.325	ownership_language	discard	crossover
10340	5.112	the_feel_felt_found+ownership_language	discard	tone_change
10341	5.450	ownership_language	discard	crossover
10342	5.425	the_feel_felt_found+ownership_language	discard	tone_change
10343	5.525	the_feel_felt_found+ownership_language+mirroring	discard	add_mirroring
10344	5.138	the_feel_felt_found	discard	crossover
10345	5.138	the_feel_felt_found+ownership_language+energy_matching	discard	add_energy_matching
10346	5.075	the_feel_felt_found+ownership_language	discard	tone_change
10347	5.037	none	discard	crossover
10348	5.650	the_feel_felt_found+ownership_language	discard	tone_change
10349	5.138	the_feel_felt_found+ownership_language	discard	tone_change
10350	4.925	the_feel_felt_found+ownership_language	discard	temp_0.75
10351	4.700	ownership_language	discard	crossover
10352	5.450	the_feel_felt_found+ownership_language+energy_matching	discard	add_energy_matching
10353	5.450	the_feel_felt_found+ownership_language	discard	tone_change
10354	5.425	the_feel_felt_found+ownership_language	discard	tone_change
10355	5.450	the_feel_felt_found+ownership_language	discard	crossover
10356	5.138	the_feel_felt_found+ownership_language	discard	tone_change
10357	5.125	the_feel_felt_found+ownership_language+strategic_agreement	discard	add_strategic_agreement
10358	5.425	ownership_language	discard	crossover
10359	5.225	the_feel_felt_found+ownership_language	discard	tone_change
10360	5.013	the_feel_felt_found+emotional_labeling	discard	swap_ownership_language_for_emotional_labeling
10361	4.888	the_feel_felt_found+ownership_language	discard	tone_change
10362	5.325	the_feel_felt_found+ownership_language	discard	temp_0.95
10363	5.450	the_feel_felt_found+strategic_agreement	discard	swap_ownership_language_for_strategic_agreement
10364	5.237	the_feel_felt_found+never_say_calm_down	discard	swap_ownership_language_for_never_say_calm_down
10365	5.213	the_feel_felt_found+ownership_language+personal_touch	discard	add_personal_touch
10366	5.200	the_feel_felt_found+ownership_language	discard	temp_0.65
10367	4.800	ownership_language	discard	crossover
10368	5.200	the_feel_felt_found	discard	remove_ownership_language
10369	5.450	the_feel_felt_found+ownership_language	discard	temp_0.75
10370	5.550	the_feel_felt_found+ownership_language+personal_touch	discard	add_personal_touch
10371	5.013	the_feel_felt_found	discard	remove_ownership_language
10372	5.225	the_feel_felt_found+ownership_language	discard	crossover
10373	5.138	the_feel_felt_found+ownership_language+personal_touch	discard	add_personal_touch
10374	5.450	none	discard	crossover
10375	5.325	the_feel_felt_found+ownership_language	discard	tone_change
10376	5.450	the_feel_felt_found+ownership_language	discard	crossover
10377	5.138	the_feel_felt_found+ownership_language	discard	tone_change
10378	5.237	ownership_language	discard	remove_the_feel_felt_found
10379	4.925	the_feel_felt_found+ownership_language	discard	tone_change
10380	5.650	the_feel_felt_found+ownership_language+warmth_injection	discard	add_warmth_injection
10381	5.138	ownership_language	discard	remove_the_feel_felt_found
10382	4.912	the_feel_felt_found+ownership_language+mirroring	discard	add_mirroring
10383	5.650	the_feel_felt_found+ownership_language	discard	crossover
10384	5.450	the_feel_felt_found+ownership_language+mirroring	discard	add_mirroring
10385	5.238	the_feel_felt_found+ownership_language+warmth_injection	discard	add_warmth_injection
10386	5.325	the_feel_felt_found+ownership_language	discard	tone_change
10387	5.325	ownership_language	discard	remove_the_feel_felt_found
10388	5.013	the_feel_felt_found+personal_touch	discard	swap_ownership_language_for_personal_touch
10389	5.650	the_feel_felt_found+ownership_language+strategic_agreement	discard	add_strategic_agreement
10390	5.025	the_feel_felt_found	discard	remove_ownership_language
10391	4.987	the_feel_felt_found+ownership_language	discard	tone_change
10392	5.450	ownership_language+casual_professionalism	discard	swap_the_feel_felt_found_for_casual_professionalism
10393	5.237	the_feel_felt_found+ownership_language	discard	tone_change
10394	4.912	the_feel_felt_found+ownership_language	discard	crossover
10395	5.238	the_feel_felt_found+validation_before_solution	discard	swap_ownership_language_for_validation_before_solution
10396	5.237	the_feel_felt_found+mirroring	discard	swap_ownership_language_for_mirroring
10397	5.237	the_feel_felt_found+ownership_language+personal_touch	discard	add_personal_touch
10398	5.300	the_feel_felt_found+ownership_language	discard	tone_change
10399	5.013	the_feel_felt_found+ownership_language+personal_touch	discard	add_personal_touch
10400	5.350	the_feel_felt_found+ownership_language	discard	crossover
10401	5.013	the_feel_felt_found+ownership_language	discard	crossover
10402	5.550	the_feel_felt_found+ownership_language+personal_touch	discard	add_personal_touch
10403	5.550	the_feel_felt_found+ownership_language+energy_matching	discard	add_energy_matching
10404	4.825	ownership_language	discard	remove_the_feel_felt_found
10405	5.325	ownership_language	discard	remove_the_feel_felt_found
10406	4.800	the_feel_felt_found+ownership_language	discard	tone_change
10407	5.038	the_feel_felt_found+ownership_language	discard	temp_0.65
10408	5.338	the_feel_felt_found+ownership_language	discard	temp_0.90
10409	4.825	the_feel_felt_found+ownership_language	discard	tone_change
10410	4.825	the_feel_felt_found+ownership_language+proactive_extras	discard	add_proactive_extras
10411	5.325	the_feel_felt_found	discard	crossover
10412	5.425	ownership_language	discard	remove_the_feel_felt_found
10413	5.325	the_feel_felt_found+ownership_language	discard	temp_0.75
10414	4.888	the_feel_felt_found+ownership_language	discard	tone_change
10415	5.138	none	discard	crossover
10416	5.112	the_feel_felt_found+ownership_language	discard	crossover
10417	5.200	the_feel_felt_found+ownership_language+validation_before_solution	discard	add_validation_before_solution
10418	5.425	ownership_language+proactive_extras	discard	swap_the_feel_felt_found_for_proactive_extras
10419	4.825	the_feel_felt_found+ownership_language	discard	temp_0.75
10420	5.325	the_feel_felt_found+ownership_language	discard	temp_0.65
10421	5.338	the_feel_felt_found+ownership_language	discard	tone_change
10422	5.237	the_feel_felt_found+ownership_language+casual_professionalism	discard	add_casual_professionalism
10423	4.800	ownership_language+validation_before_solution	discard	swap_the_feel_felt_found_for_validation_before_solution
10424	5.325	the_feel_felt_found+ownership_language	discard	tone_change
10425	4.825	ownership_language+never_say_calm_down	discard	swap_the_feel_felt_found_for_never_say_calm_down
10426	5.138	the_feel_felt_found+ownership_language+energy_matching	discard	add_energy_matching
10427	5.037	the_feel_felt_found+ownership_language	discard	tone_change
10428	5.450	none	discard	crossover
10429	5.300	the_feel_felt_found+casual_professionalism	discard	swap_ownership_language_for_casual_professionalism
10430	5.325	the_feel_felt_found+ownership_language	discard	temp_0.95
10431	5.112	the_feel_felt_found+personal_touch	discard	swap_ownership_language_for_personal_touch
10432	4.987	the_feel_felt_found+ownership_language+strategic_agreement	discard	add_strategic_agreement
10433	4.700	the_feel_felt_found+ownership_language	discard	tone_change
10434	5.138	the_feel_felt_found+ownership_language+validation_before_solution	discard	add_validation_before_solution
10435	5.650	the_feel_felt_found+ownership_language	discard	temp_0.90
10436	5.225	the_feel_felt_found+ownership_language	discard	crossover
10437	5.237	the_feel_felt_found+casual_professionalism	discard	swap_ownership_language_for_casual_professionalism
10438	5.325	ownership_language	discard	crossover
10439	5.450	the_feel_felt_found+ownership_language	discard	tone_change
10440	5.650	the_feel_felt_found+ownership_language+never_say_calm_down	discard	add_never_say_calm_down
10441	5.450	the_feel_felt_found+ownership_language	discard	tone_change
10442	4.912	the_feel_felt_found+ownership_language	discard	crossover
10443	4.888	the_feel_felt_found+ownership_language+genuine_admission	discard	add_genuine_admission
10444	5.238	the_feel_felt_found+ownership_language	discard	crossover
10445	5.550	the_feel_felt_found+ownership_language	discard	crossover
10446	5.350	the_feel_felt_found+ownership_language	discard	tone_change
10447	4.800	ownership_language	discard	crossover
10448	5.013	the_feel_felt_found+ownership_language+concrete_next_steps	discard	add_concrete_next_steps
10449	4.900	the_feel_felt_found+ownership_language+validation_before_solution	discard	add_validation_before_solution
10450	5.213	the_feel_felt_found+ownership_language+never_say_calm_down	discard	add_never_say_calm_down
10451	4.825	the_feel_felt_found+ownership_language	discard	tone_change
10452	5.338	ownership_language	discard	remove_the_feel_felt_found
10453	4.800	ownership_language+mirroring	discard	swap_the_feel_felt_found_for_mirroring
10454	4.612	the_feel_felt_found+ownership_language	discard	tone_change
10455	5.425	the_feel_felt_found+ownership_language+personal_touch	discard	add_personal_touch
10456	5.325	the_feel_felt_found+ownership_language+warmth_injection	discard	add_warmth_injection
10457	5.137	the_feel_felt_found+ownership_language	discard	temp_0.90
10458	5.038	the_feel_felt_found	discard	remove_ownership_language
10459	5.325	the_feel_felt_found	discard	remove_ownership_language
10460	5.450	the_feel_felt_found+ownership_language+emotional_labeling	discard	add_emotional_labeling
10461	5.138	the_feel_felt_found+ownership_language	discard	temp_0.70
10462	5.325	the_feel_felt_found+ownership_language	discard	crossover
10463	5.237	ownership_language	discard	crossover
10464	5.138	the_feel_felt_found+ownership_language+emotional_labeling	discard	add_emotional_labeling
10465	5.237	ownership_language	discard	remove_the_feel_felt_found
10466	5.212	the_feel_felt_found+ownership_language+genuine_admission	discard	add_genuine_admission
10467	4.700	none	discard	crossover
10468	5.037	the_feel_felt_found+ownership_language+mirroring	discard	add_mirroring
10469	5.425	the_feel_felt_found+ownership_language	discard	temp_0.70
10470	5.325	the_feel_felt_found+ownership_language	discard	tone_change
10471	4.800	ownership_language+strategic_agreement	discard	swap_the_feel_felt_found_for_strategic_agreement
10472	5.225	the_feel_felt_found+ownership_language+validation_before_solution	discard	add_validation_before_solution
10473	5.237	ownership_language	discard	crossover
10474	4.800	ownership_language+mirroring	discard	swap_the_feel_felt_found_for_mirroring
10475	5.237	the_feel_felt_found+ownership_language+energy_matching	discard	add_energy_matching
10476	4.912	the_feel_felt_found+ownership_language	discard	tone_change
10477	5.238	the_feel_felt_found+ownership_language+strategic_agreement	discard	add_strategic_agreement
10478	4.925	the_feel_felt_found+ownership_language	discard	tone_change
10479	4.888	the_feel_felt_found+ownership_language	discard	crossover
10480	5.113	the_feel_felt_found+ownership_language+genuine_admission	discard	add_genuine_admission
10481	5.425	the_feel_felt_found+ownership_language+concrete_next_steps	discard	add_concrete_next_steps
10482	5.550	the_feel_felt_found+ownership_language+never_say_calm_down	discard	add_never_say_calm_down
10483	5.138	the_feel_felt_found+ownership_language	discard	tone_change
10484	5.138	the_feel_felt_found+genuine_admission	discard	swap_ownership_language_for_genuine_admission
10485	5.450	the_feel_felt_found+ownership_language	discard	tone_change
10486	5.138	the_feel_felt_found+emotional_labeling	discard	swap_ownership_language_for_emotional_labeling
10487	5.013	the_feel_felt_found+ownership_language+strategic_agreement	discard	add_strategic_agreement
10488	5.525	the_feel_felt_found+ownership_language	discard	tone_change
10489	5.025	the_feel_felt_found+ownership_language	discard	crossover
10490	5.200	the_feel_felt_found+ownership_language+strategic_agreement	discard	add_strategic_agreement
10491	5.550	the_feel_felt_found+proactive_extras	discard	swap_ownership_language_for_proactive_extras
10492	5.450	the_feel_felt_found+ownership_language	discard	temp_0.95
10493	5.550	the_feel_felt_found+ownership_language+mirroring	discard	add_mirroring
10494	5.325	the_feel_felt_found+ownership_language	discard	tone_change
10495	5.037	the_feel_felt_found+ownership_language+energy_matching	discard	add_energy_matching
10496	5.138	the_feel_felt_found+ownership_language+concrete_next_steps	discard	add_concrete_next_steps
10497	5.425	the_feel_felt_found+ownership_language	discard	temp_0.85
10498	5.325	the_feel_felt_found	discard	remove_ownership_language
10499	5.350	the_feel_felt_found+ownership_language	discard	crossover
10500	5.550	the_feel_felt_found+ownership_language+energy_matching	discard	add_energy_matching
10501	5.450	the_feel_felt_found+ownership_language	discard	temp_0.70
10502	5.450	the_feel_felt_found+ownership_language+genuine_admission	discard	add_genuine_admission
10503	5.138	the_feel_felt_found+ownership_language	discard	tone_change
10504	5.325	ownership_language+validation_before_solution	discard	swap_the_feel_felt_found_for_validation_before_solution
10505	5.550	none	discard	crossover
10506	4.513	ownership_language+emotional_labeling	discard	swap_the_feel_felt_found_for_emotional_labeling
10507	5.325	ownership_language	discard	remove_the_feel_felt_found
10508	4.825	ownership_language+strategic_agreement	discard	swap_the_feel_felt_found_for_strategic_agreement
10509	5.138	ownership_language+proactive_extras	discard	swap_the_feel_felt_found_for_proactive_extras
10510	5.238	the_feel_felt_found+ownership_language+warmth_injection	discard	add_warmth_injection
10511	5.338	the_feel_felt_found+validation_before_solution	discard	swap_ownership_language_for_validation_before_solution
10512	5.550	the_feel_felt_found+ownership_language	discard	tone_change
10513	5.237	the_feel_felt_found+ownership_language	discard	temp_0.75
10514	5.338	the_feel_felt_found+ownership_language	discard	tone_change
10515	5.112	ownership_language+never_say_calm_down	discard	swap_the_feel_felt_found_for_never_say_calm_down
10516	5.425	the_feel_felt_found+ownership_language	discard	tone_change
10517	5.238	ownership_language	discard	remove_the_feel_felt_found
10518	5.237	the_feel_felt_found+ownership_language	discard	tone_change
10519	5.013	the_feel_felt_found+ownership_language+personal_touch	discard	add_personal_touch
10520	5.325	the_feel_felt_found+ownership_language+mirroring	discard	add_mirroring
10521	4.700	the_feel_felt_found+ownership_language	discard	crossover
10522	5.237	the_feel_felt_found+ownership_language	discard	crossover
10523	5.450	the_feel_felt_found+ownership_language	discard	temp_0.95
10524	5.200	the_feel_felt_found+ownership_language+personal_touch	discard	add_personal_touch
10525	4.925	the_feel_felt_found+ownership_language+proactive_extras	discard	add_proactive_extras
10526	5.237	ownership_language	discard	remove_the_feel_felt_found
10527	4.575	the_feel_felt_found+ownership_language+casual_professionalism	discard	add_casual_professionalism
10528	5.450	the_feel_felt_found+ownership_language	discard	temp_0.65
10529	5.237	the_feel_felt_found+ownership_language+emotional_labeling	discard	add_emotional_labeling
10530	5.425	the_feel_felt_found+genuine_admission	discard	swap_ownership_language_for_genuine_admission
10531	4.925	the_feel_felt_found+ownership_language+proactive_extras	discard	add_proactive_extras
10532	5.650	the_feel_felt_found+ownership_language	discard	tone_change
10533	5.200	the_feel_felt_found	discard	remove_ownership_language
10534	5.213	the_feel_felt_found+strategic_agreement	discard	swap_ownership_language_for_strategic_agreement
10535	5.200	the_feel_felt_found+validation_before_solution	discard	swap_ownership_language_for_validation_before_solution
10536	4.988	ownership_language	discard	remove_the_feel_felt_found
10537	5.225	ownership_language	discard	remove_the_feel_felt_found
10538	5.425	the_feel_felt_found+ownership_language	discard	temp_0.95
10539	4.900	the_feel_felt_found+ownership_language	discard	temp_0.95
10540	5.425	the_feel_felt_found+ownership_language+warmth_injection	discard	add_warmth_injection
10541	5.237	the_feel_felt_found+ownership_language	discard	temp_0.70
10542	5.425	the_feel_felt_found	discard	crossover
10543	5.200	the_feel_felt_found+ownership_language+personal_touch	discard	add_personal_touch
10544	5.138	the_feel_felt_found+ownership_language	discard	temp_0.75
10545	5.300	the_feel_felt_found+ownership_language+concrete_next_steps	discard	add_concrete_next_steps
10546	5.112	ownership_language+never_say_calm_down	discard	swap_the_feel_felt_found_for_never_say_calm_down
10547	5.550	the_feel_felt_found+ownership_language	discard	temp_0.85
10548	5.450	ownership_language+strategic_agreement	discard	swap_the_feel_felt_found_for_strategic_agreement
10549	5.650	the_feel_felt_found+ownership_language	discard	crossover
10550	4.825	the_feel_felt_found+ownership_language	discard	tone_change
10551	4.925	ownership_language	discard	crossover
10552	5.325	the_feel_felt_found+ownership_language+warmth_injection	discard	add_warmth_injection
10553	5.237	the_feel_felt_found+ownership_language	discard	crossover
