generation	eq_score	techniques	status	description
13566	5.238	the_feel_felt_found+ownership_language	discard	crossover
13567	4.913	the_feel_felt_found+ownership_language	discard	temp_0.95
13568	5.325	the_feel_felt_found+ownership_language	discard	tone_change
13569	5.350	the_feel_felt_found	discard	crossover
13570	4.800	the_feel_felt_found+ownership_language+proactive_extras	discard	add_proactive_extras
13571	5.550	the_feel_felt_found	discard	crossover
13572	5.200	ownership_language	discard	crossover
13573	5.550	the_feel_felt_found+ownership_language	discard	tone_change
13574	5.550	the_feel_felt_found+ownership_language+proactive_extras	discard	add_proactive_extras
13575	5.237	the_feel_felt_found+ownership_language	discard	tone_change
13576	4.825	the_feel_felt_found+ownership_language	discard	temp_0.70
13577	5.450	the_feel_felt_found+mirroring	discard	swap_ownership_language_for_mirroring
13578	5.350	the_feel_felt_found+ownership_language+proactive_extras	discard	add_proactive_extras
13579	5.338	the_feel_felt_found+ownership_language	discard	tone_change
13580	5.112	the_feel_felt_found+ownership_language	discard	tone_change
13581	5.138	the_feel_felt_found+ownership_language	discard	crossover
13582	5.350	the_feel_felt_found+ownership_language	discard	tone_change
13583	5.337	the_feel_felt_found+ownership_language+strategic_agreement	discard	add_strategic_agreement
13584	5.113	the_feel_felt_found+validation_before_solution	discard	swap_ownership_language_for_validation_before_solution
13585	4.925	none	discard	crossover
13586	5.225	the_feel_felt_found+ownership_language	discard	crossover
13587	5.650	the_feel_felt_found+ownership_language	discard	tone_change
13588	5.350	the_feel_felt_found	discard	crossover
13589	5.425	the_feel_felt_found	discard	crossover
13590	5.175	the_feel_felt_found+ownership_language	discard	temp_0.75
13591	5.225	the_feel_felt_found+ownership_language+proactive_extras	discard	add_proactive_extras
13592	4.825	the_feel_felt_found+ownership_language	discard	temp_0.75
13593	5.550	the_feel_felt_found	discard	remove_ownership_language
13594	5.138	the_feel_felt_found+ownership_language+proactive_extras	discard	add_proactive_extras
13595	5.450	ownership_language+mirroring	discard	swap_the_feel_felt_found_for_mirroring
13596	5.200	the_feel_felt_found+ownership_language	discard	crossover
13597	4.925	the_feel_felt_found+ownership_language+proactive_extras	discard	add_proactive_extras
13598	5.550	the_feel_felt_found+ownership_language	discard	tone_change
13599	5.038	the_feel_felt_found	discard	remove_ownership_language
13600	5.425	the_feel_felt_found+ownership_language	discard	tone_change
13601	5.450	the_feel_felt_found+ownership_language+genuine_admission	discard	add_genuine_admission
13602	5.425	the_feel_felt_found+concrete_next_steps	discard	swap_ownership_language_for_concrete_next_steps
13603	5.013	the_feel_felt_found+ownership_language	discard	tone_change
13604	5.325	ownership_language	discard	remove_the_feel_felt_found
13605	4.938	the_feel_felt_found+ownership_language+never_say_calm_down	discard	add_never_say_calm_down
13606	5.425	the_feel_felt_found+ownership_language	discard	crossover
13607	5.200	the_feel_felt_found+ownership_language+proactive_extras	discard	add_proactive_extras
13608	5.238	ownership_language+mirroring	discard	swap_the_feel_felt_found_for_mirroring
13609	5.450	the_feel_felt_found	discard	crossover
13610	5.550	the_feel_felt_found	discard	remove_ownership_language
13611	5.550	the_feel_felt_found+ownership_language	discard	crossover
13612	4.912	the_feel_felt_found+validation_before_solution	discard	swap_ownership_language_for_validation_before_solution
13613	5.013	ownership_language+never_say_calm_down	discard	swap_the_feel_felt_found_for_never_say_calm_down
13614	5.113	the_feel_felt_found+ownership_language	discard	temp_0.70
13615	5.112	the_feel_felt_found+ownership_language	discard	tone_change
13616	5.325	ownership_language+casual_professionalism	discard	swap_the_feel_felt_found_for_casual_professionalism
13617	5.650	the_feel_felt_found+ownership_language+genuine_admission	discard	add_genuine_admission
13618	5.013	ownership_language	discard	crossover
13619	5.450	the_feel_felt_found+ownership_language+genuine_admission	discard	add_genuine_admission
13620	5.237	the_feel_felt_found+ownership_language	discard	tone_change
13621	5.237	the_feel_felt_found+ownership_language	discard	tone_change
13622	5.337	the_feel_felt_found+ownership_language	discard	tone_change
13623	5.425	the_feel_felt_found+ownership_language	discard	tone_change
13624	5.650	ownership_language+casual_professionalism	discard	swap_the_feel_felt_found_for_casual_professionalism
13625	5.138	the_feel_felt_found+ownership_language	discard	crossover
13626	5.138	the_feel_felt_found+ownership_language	discard	temp_0.85
13627	5.237	the_feel_felt_found+ownership_language	discard	crossover
13628	5.013	the_feel_felt_found+ownership_language	discard	tone_change
13629	5.650	the_feel_felt_found+ownership_language+concrete_next_steps	discard	add_concrete_next_steps
13630	5.425	the_feel_felt_found+ownership_language	discard	tone_change
13631	5.650	the_feel_felt_found+ownership_language	discard	crossover
13632	5.350	ownership_language	discard	remove_the_feel_felt_found
13633	5.300	the_feel_felt_found+energy_matching	discard	swap_ownership_language_for_energy_matching
13634	4.925	the_feel_felt_found+emotional_labeling	discard	swap_ownership_language_for_emotional_labeling
13635	5.337	the_feel_felt_found	discard	remove_ownership_language
13636	5.138	ownership_language	discard	remove_the_feel_felt_found
13637	5.200	the_feel_felt_found+ownership_language+never_say_calm_down	discard	add_never_say_calm_down
13638	5.550	the_feel_felt_found+ownership_language	discard	tone_change
13639	5.438	the_feel_felt_found+ownership_language+warmth_injection	discard	add_warmth_injection
13640	5.037	the_feel_felt_found+ownership_language	discard	tone_change
13641	5.325	the_feel_felt_found+ownership_language+warmth_injection	discard	add_warmth_injection
13642	5.013	the_feel_felt_found	discard	crossover
13643	5.013	the_feel_felt_found+ownership_language+validation_before_solution	discard	add_validation_before_solution
13644	5.450	ownership_language	discard	crossover
13645	5.325	the_feel_felt_found+ownership_language	discard	tone_change
13646	5.137	the_feel_felt_found+ownership_language	discard	tone_change
13647	5.325	the_feel_felt_found+ownership_language	discard	tone_change
13648	5.237	the_feel_felt_found+ownership_language	discard	temp_0.95
13649	5.550	the_feel_felt_found	discard	crossover
13650	5.450	the_feel_felt_found+ownership_language+proactive_extras	discard	add_proactive_extras
13651	5.450	the_feel_felt_found+ownership_language+never_say_calm_down	discard	add_never_say_calm_down
13652	5.238	the_feel_felt_found+ownership_language+concrete_next_steps	discard	add_concrete_next_steps
13653	5.450	the_feel_felt_found+ownership_language	discard	tone_change
13654	4.988	the_feel_felt_found+ownership_language	discard	temp_0.95
13655	5.425	the_feel_felt_found+ownership_language	discard	tone_change
13656	5.138	the_feel_felt_found+ownership_language+validation_before_solution	discard	add_validation_before_solution
13657	5.350	the_feel_felt_found+ownership_language+emotional_labeling	discard	add_emotional_labeling
13658	5.350	the_feel_felt_found+ownership_language	discard	temp_0.70
13659	5.650	the_feel_felt_found+ownership_language	discard	temp_0.70
13660	5.013	none	discard	crossover
13661	4.487	the_feel_felt_found+proactive_extras	discard	swap_ownership_language_for_proactive_extras
13662	5.013	the_feel_felt_found+ownership_language	discard	tone_change
13663	5.138	none	discard	crossover
13664	4.825	the_feel_felt_found+ownership_language	discard	temp_0.65
13665	5.138	ownership_language+strategic_agreement	discard	swap_the_feel_felt_found_for_strategic_agreement
13666	4.987	the_feel_felt_found+ownership_language	discard	temp_0.65
13667	5.450	the_feel_felt_found+ownership_language	discard	tone_change
13668	5.013	the_feel_felt_found+ownership_language+personal_touch	discard	add_personal_touch
13669	5.550	the_feel_felt_found+ownership_language	discard	temp_0.70
13670	5.237	ownership_language+concrete_next_steps	discard	swap_the_feel_felt_found_for_concrete_next_steps
13671	5.013	the_feel_felt_found+ownership_language	discard	temp_0.75
13672	5.325	the_feel_felt_found+ownership_language	discard	crossover
13673	5.425	the_feel_felt_found+ownership_language	discard	temp_0.90
13674	5.038	the_feel_felt_found+ownership_language	discard	tone_change
13675	5.237	the_feel_felt_found+casual_professionalism	discard	swap_ownership_language_for_casual_professionalism
13676	4.912	the_feel_felt_found+ownership_language	discard	crossover
13677	5.325	the_feel_felt_found+ownership_language	discard	temp_0.95
13678	5.550	the_feel_felt_found+ownership_language	discard	crossover
13679	5.550	the_feel_felt_found+ownership_language+validation_before_solution	discard	add_validation_before_solution
13680	5.138	the_feel_felt_found+ownership_language	discard	crossover
13681	4.987	the_feel_felt_found+ownership_language+warmth_injection	discard	add_warmth_injection
13682	5.138	the_feel_felt_found+ownership_language	discard	temp_0.85
13683	4.925	the_feel_felt_found+ownership_language	discard	temp_0.65
13684	4.825	the_feel_felt_found	discard	remove_ownership_language
13685	5.338	the_feel_felt_found+ownership_language	discard	tone_change
13686	5.650	the_feel_felt_found+ownership_language	discard	temp_0.85
13687	5.550	the_feel_felt_found+ownership_language+genuine_admission	discard	add_genuine_admission
13688	5.138	the_feel_felt_found+ownership_language+mirroring	discard	add_mirroring
13689	4.988	the_feel_felt_found+ownership_language	discard	temp_0.85
13690	5.550	none	discard	crossover
13691	5.237	the_feel_felt_found+ownership_language+mirroring	discard	add_mirroring
13692	4.888	the_feel_felt_found+ownership_language+never_say_calm_down	discard	add_never_say_calm_down
13693	5.450	the_feel_felt_found+emotional_labeling	discard	swap_ownership_language_for_emotional_labeling
13694	5.325	ownership_language+proactive_extras	discard	swap_the_feel_felt_found_for_proactive_extras
13695	5.237	ownership_language	discard	remove_the_feel_felt_found
13696	5.438	the_feel_felt_found+ownership_language+casual_professionalism	discard	add_casual_professionalism
13697	5.300	the_feel_felt_found+ownership_language+genuine_admission	discard	add_genuine_admission
13698	5.112	the_feel_felt_found+proactive_extras	discard	swap_ownership_language_for_proactive_extras
13699	5.013	ownership_language+concrete_next_steps	discard	swap_the_feel_felt_found_for_concrete_next_steps
13700	5.325	ownership_language	discard	crossover
13701	5.550	the_feel_felt_found+ownership_language	discard	tone_change
13702	5.438	ownership_language	discard	remove_the_feel_felt_found
13703	5.225	the_feel_felt_found+ownership_language	discard	tone_change
13704	5.012	the_feel_felt_found+ownership_language	discard	tone_change
13705	5.350	the_feel_felt_found+ownership_language	discard	tone_change
13706	5.650	the_feel_felt_found+ownership_language+never_say_calm_down	discard	add_never_say_calm_down
13707	4.800	the_feel_felt_found+ownership_language	discard	temp_0.85
13708	4.925	the_feel_felt_found+genuine_admission	discard	swap_ownership_language_for_genuine_admission
13709	5.238	ownership_language	discard	crossover
13710	5.325	the_feel_felt_found	discard	remove_ownership_language
13711	5.138	the_feel_felt_found+ownership_language	discard	temp_0.65
13712	5.450	the_feel_felt_found+ownership_language	discard	tone_change
13713	5.012	the_feel_felt_found+ownership_language+energy_matching	discard	add_energy_matching
13714	5.450	the_feel_felt_found+ownership_language	discard	temp_0.90
13715	4.825	the_feel_felt_found+ownership_language	discard	temp_0.70
13716	5.100	the_feel_felt_found+ownership_language+casual_professionalism	discard	add_casual_professionalism
13717	5.350	the_feel_felt_found+ownership_language	discard	tone_change
13718	5.450	the_feel_felt_found+ownership_language	discard	temp_0.95
13719	4.912	the_feel_felt_found+ownership_language	discard	temp_0.75
13720	5.138	the_feel_felt_found+ownership_language+proactive_extras	discard	add_proactive_extras
13721	5.650	the_feel_felt_found+ownership_language	discard	tone_change
13722	5.450	the_feel_felt_found+ownership_language	discard	temp_0.70
13723	5.237	ownership_language+warmth_injection	discard	swap_the_feel_felt_found_for_warmth_injection
13724	5.350	the_feel_felt_found+ownership_language	discard	temp_0.75
13725	5.550	ownership_language+proactive_extras	discard	swap_the_feel_felt_found_for_proactive_extras
13726	4.925	none	discard	crossover
13727	5.138	the_feel_felt_found	discard	crossover
13728	4.763	ownership_language	discard	remove_the_feel_felt_found
13729	5.013	ownership_language	discard	crossover
13730	5.550	the_feel_felt_found+ownership_language+casual_professionalism	discard	add_casual_professionalism
13731	5.425	the_feel_felt_found+ownership_language	discard	tone_change
13732	5.650	the_feel_felt_found+ownership_language	discard	temp_0.90
13733	5.750	the_feel_felt_found+ownership_language+strategic_agreement	discard	add_strategic_agreement
13734	5.013	the_feel_felt_found+ownership_language	discard	tone_change
13735	5.237	ownership_language+validation_before_solution	discard	swap_the_feel_felt_found_for_validation_before_solution
13736	5.650	the_feel_felt_found+ownership_language+warmth_injection	discard	add_warmth_injection
13737	5.200	the_feel_felt_found+ownership_language	discard	tone_change
13738	4.925	the_feel_felt_found+ownership_language	discard	temp_0.85
13739	5.325	the_feel_felt_found+ownership_language+energy_matching	discard	add_energy_matching
13740	4.888	the_feel_felt_found+ownership_language	discard	temp_0.85
13741	4.900	the_feel_felt_found+ownership_language	discard	temp_0.65
13742	5.450	the_feel_felt_found+ownership_language	discard	crossover
13743	5.525	the_feel_felt_found+ownership_language+proactive_extras	discard	add_proactive_extras
13744	5.237	the_feel_felt_found+ownership_language	discard	crossover
13745	5.237	none	discard	crossover
13746	5.650	the_feel_felt_found+ownership_language	discard	temp_0.95
13747	4.912	the_feel_felt_found+ownership_language+emotional_labeling	discard	add_emotional_labeling
13748	5.525	the_feel_felt_found+ownership_language	discard	tone_change
13749	5.450	ownership_language	discard	crossover
13750	5.550	the_feel_felt_found+ownership_language+emotional_labeling	discard	add_emotional_labeling
13751	5.338	the_feel_felt_found+ownership_language+genuine_admission	discard	add_genuine_admission
13752	5.338	the_feel_felt_found+ownership_language+mirroring	discard	add_mirroring
13753	5.450	ownership_language+personal_touch	discard	swap_the_feel_felt_found_for_personal_touch
13754	4.575	the_feel_felt_found+ownership_language+warmth_injection	discard	add_warmth_injection
13755	5.325	the_feel_felt_found+ownership_language	discard	tone_change
13756	5.350	none	discard	crossover
13757	5.138	the_feel_felt_found+ownership_language+proactive_extras	discard	add_proactive_extras
13758	5.138	the_feel_felt_found+ownership_language	discard	crossover
13759	5.238	the_feel_felt_found+ownership_language	discard	tone_change
13760	5.138	ownership_language+validation_before_solution	discard	swap_the_feel_felt_found_for_validation_before_solution
13761	5.225	the_feel_felt_found	discard	remove_ownership_language
13762	5.225	the_feel_felt_found+ownership_language+energy_matching	discard	add_energy_matching
13763	4.825	the_feel_felt_found+ownership_language+strategic_agreement	discard	add_strategic_agreement
13764	5.350	the_feel_felt_found+ownership_language	discard	tone_change
13765	5.238	the_feel_felt_found+emotional_labeling	discard	swap_ownership_language_for_emotional_labeling
13766	5.213	ownership_language	discard	crossover
13767	5.138	ownership_language	discard	remove_the_feel_felt_found
13768	4.825	the_feel_felt_found+ownership_language	discard	tone_change
13769	4.700	the_feel_felt_found+ownership_language	discard	tone_change
13770	5.450	the_feel_felt_found+ownership_language	discard	tone_change
13771	5.550	the_feel_felt_found+ownership_language	discard	tone_change
13772	5.425	the_feel_felt_found+ownership_language	discard	crossover
13773	5.112	the_feel_felt_found+ownership_language	discard	temp_0.95
13774	5.238	the_feel_felt_found+ownership_language	discard	crossover
13775	5.012	ownership_language+validation_before_solution	discard	swap_the_feel_felt_found_for_validation_before_solution
13776	5.238	the_feel_felt_found+ownership_language	discard	tone_change
13777	4.825	the_feel_felt_found+proactive_extras	discard	swap_ownership_language_for_proactive_extras
13778	5.200	the_feel_felt_found	discard	crossover
13779	5.650	the_feel_felt_found+ownership_language	discard	tone_change
13780	5.450	the_feel_felt_found+ownership_language+casual_professionalism	discard	add_casual_professionalism
13781	5.350	the_feel_felt_found+ownership_language+genuine_admission	discard	add_genuine_admission
13782	5.450	the_feel_felt_found+ownership_language+genuine_admission	discard	add_genuine_admission
13783	5.450	the_feel_felt_found+ownership_language+genuine_admission	discard	add_genuine_admission
13784	5.238	the_feel_felt_found+ownership_language	discard	temp_0.65
13785	5.550	the_feel_felt_found+ownership_language	discard	tone_change
13786	5.550	the_feel_felt_found+ownership_language	discard	temp_0.70
13787	5.425	the_feel_felt_found+ownership_language+warmth_injection	discard	add_warmth_injection
13788	5.325	the_feel_felt_found+ownership_language+energy_matching	discard	add_energy_matching
13789	5.550	ownership_language+emotional_labeling	discard	swap_the_feel_felt_found_for_emotional_labeling
13790	4.888	the_feel_felt_found	discard	crossover
13791	5.025	the_feel_felt_found+ownership_language+validation_before_solution	discard	add_validation_before_solution
13792	5.038	the_feel_felt_found+concrete_next_steps	discard	swap_ownership_language_for_concrete_next_steps
13793	4.888	the_feel_felt_found+ownership_language+concrete_next_steps	discard	add_concrete_next_steps
13794	4.913	ownership_language+warmth_injection	discard	swap_the_feel_felt_found_for_warmth_injection
13795	5.325	the_feel_felt_found+ownership_language	discard	temp_0.70
13796	5.237	ownership_language	discard	remove_the_feel_felt_found
13797	5.138	the_feel_felt_found+ownership_language	discard	tone_change
13798	5.550	the_feel_felt_found+ownership_language	discard	tone_change
13799	5.325	the_feel_felt_found+ownership_language	discard	tone_change
13800	5.112	the_feel_felt_found+ownership_language+validation_before_solution	discard	add_validation_before_solution
13801	5.225	ownership_language	discard	crossover
13802	4.888	the_feel_felt_found+ownership_language	discard	crossover
13803	5.350	the_feel_felt_found+ownership_language	discard	tone_change
13804	5.325	ownership_language+concrete_next_steps	discard	swap_the_feel_felt_found_for_concrete_next_steps
13805	5.325	the_feel_felt_found+ownership_language+concrete_next_steps	discard	add_concrete_next_steps
13806	5.337	none	discard	crossover
13807	5.550	ownership_language+strategic_agreement	discard	swap_the_feel_felt_found_for_strategic_agreement
13808	5.125	the_feel_felt_found+ownership_language	discard	crossover
13809	5.237	ownership_language	discard	crossover
13810	5.037	the_feel_felt_found+ownership_language	discard	tone_change
13811	4.725	ownership_language	discard	crossover
13812	5.037	the_feel_felt_found+ownership_language	discard	crossover
13813	5.138	the_feel_felt_found+ownership_language+emotional_labeling	discard	add_emotional_labeling
13814	5.450	the_feel_felt_found+ownership_language	discard	tone_change
13815	5.425	the_feel_felt_found+ownership_language+personal_touch	discard	add_personal_touch
13816	5.550	the_feel_felt_found+ownership_language+warmth_injection	discard	add_warmth_injection
13817	4.513	ownership_language+warmth_injection	discard	swap_the_feel_felt_found_for_warmth_injection
13818	5.138	ownership_language	discard	crossover
13819	5.550	the_feel_felt_found+ownership_language+personal_touch	discard	add_personal_touch
13820	5.325	the_feel_felt_found+ownership_language	discard	tone_change
13821	5.425	the_feel_felt_found+ownership_language+energy_matching	discard	add_energy_matching
13822	5.112	ownership_language	discard	remove_the_feel_felt_found
13823	5.325	the_feel_felt_found+genuine_admission	discard	swap_ownership_language_for_genuine_admission
13824	4.987	the_feel_felt_found+ownership_language	discard	crossover
13825	5.237	the_feel_felt_found+ownership_language	discard	temp_0.85
13826	5.138	the_feel_felt_found+ownership_language	discard	temp_0.75
13827	5.525	the_feel_felt_found+ownership_language	discard	tone_change
13828	5.325	ownership_language	discard	crossover
13829	5.013	the_feel_felt_found+ownership_language	discard	tone_change
13830	5.237	the_feel_felt_found+ownership_language	discard	tone_change
13831	5.200	the_feel_felt_found+ownership_language	discard	temp_0.70
13832	5.550	the_feel_felt_found+ownership_language	discard	temp_0.95
13833	5.112	the_feel_felt_found+ownership_language	discard	tone_change
13834	4.825	the_feel_felt_found+ownership_language	discard	tone_change
13835	5.175	the_feel_felt_found+ownership_language	discard	crossover
13836	5.450	the_feel_felt_found+ownership_language	discard	temp_0.85
13837	5.450	the_feel_felt_found+ownership_language	discard	tone_change
13838	4.812	the_feel_felt_found+ownership_language	discard	crossover
13839	5.325	the_feel_felt_found+ownership_language+emotional_labeling	discard	add_emotional_labeling
13840	5.237	the_feel_felt_found	discard	crossover
13841	5.137	the_feel_felt_found+ownership_language	discard	tone_change
13842	5.138	the_feel_felt_found+ownership_language	discard	temp_0.95
13843	5.300	the_feel_felt_found+ownership_language+strategic_agreement	discard	add_strategic_agreement
13844	5.138	the_feel_felt_found+ownership_language	discard	temp_0.85
